id	type	ListingDate	PriceLabel	SoldDate	SoldPrice	Beds	Baths	Cars	EER	PlotSize	Agency.Name	Slug
42400	Unit	2021-08-16	$319,500	2021-09-29	$319,500	1	1	1			LJ Hooker Queanbeyan – Jerrabomberra – Googong	1-88-henderson-road-crestwood-nsw-2620
43737	House	2021-07-01	Auction	2021-09-03	$876,500	3	2	3	4.0	666.0	Michael Potter Real Estate	9-simonetti-street-dunlop-act-2615
43740	Apartment	2021-07-01	$300,000 - $330,000	2021-10-22	Undisclosed	2	1	1	6.0		LJ Hooker Manuka	8-41-leahy-close-narrabundah-act-2604
43788	Land	2021-07-01	$1,000,000	2021-09-23	$1,000,000	0	0	0		581.0	Ray White Batemans Bay	4-train-street-broulee-nsw-2537
43812	Apartment	2021-07-02	By Negotiation	2021-10-19	$282,500	1	1	1			Ray White Queanbeyan | Jerrabomberra	27a-17-uriarra-road-queanbeyan-nsw-2620
43852	Land	2021-07-02	By Negotiation	2022-02-01	Undisclosed	0	0	0		7.91	LJ Hooker Sussex Inlet	14-old-berrara-road-sussex-inlet-nsw-2540
43899	House	2021-07-05	Offers over $1,189,000	2021-11-18	$1,375,000	4	2	2	6.0	0.0	Confidence Real Estate	13-niland-street-whitlam-act-2615
43905	House	2021-07-05	$380,000	2021-11-30	$370,000	3	1	1			Fisk & Nagle Property	9-wonga-street-cooma-nsw-2630
43910	House	2021-07-06	$520 000	2021-09-10	Undisclosed	6	2	6		4040.0	Raine & Horne Young	2344-henry-lawson-way-bulla-creek-nsw-2594
43912	Unit	2021-07-06	470000	2021-12-01	$470,000	2	1	1	6.0		Independent Gungahlin	154-1-mouat-street-lyneham-act-2602
43994	House	2021-07-06	$1,100,000+	2022-11-11	Undisclosed	6	4	5	2.5	1012.0	Ray White Queanbeyan | Jerrabomberra	27a-27b-william-street-oaks-estate-act-2620
44015	Land	2021-07-06	Price Guide $695,000	2021-10-15	$680,000	0	0	0		15.54	Raine & Horne Southern Highlands	lot-2503-towrang-road-brayton-nsw-2579
44019	DuplexSemi-detached	2021-07-06	Guide $539,000	2021-09-22	$540,000	3	2	1		260.0	Ray White Goulburn	10-176-taralga-road-goulburn-nsw-2580
44039	Terrace	2021-08-16	$415,000	2021-11-19	$415,000	1	1	1			LJ Hooker Queanbeyan – Jerrabomberra – Googong	10-51-mary-street-googong-nsw-2620
44042	Terrace	2021-08-16	Contact Agent	2022-03-31	$425,000	1	1	1			LJ Hooker Queanbeyan – Jerrabomberra – Googong	9-51-mary-street-googong-nsw-2620
44083	Livestock	2021-07-08	For Sale by EOI	2021-09-02	Undisclosed	4	2	0		119.0	LAWD	226-cloughs-road-wagga-wagga-nsw-2650
44086	House	2021-07-08	$699,000	2021-10-12	$685,000	4	2	1		966.0	LJ Hooker Moruya	19-luck-street-moruya-nsw-2537
44107	House	2021-07-08	$635,000+	2021-09-03	$642,000	3	1	1	4.5		LJ Hooker Weston/Woden	36-loureiro-street-conder-act-2906
44146	Townhouse	2021-07-08	$678,000	2021-11-18	$678,000	3	3	1	5.0	4688.0	New Door Properties	20-1-rouseabout-street-lawson-act-2617
44152	BlockOfUnits	2021-08-16	$1,650,000	2021-09-13	$1,650,000	8	7	7		1043.0	LJ Hooker Queanbeyan – Jerrabomberra – Googong	3-carinya-street-queanbeyan-nsw-2620
44161	Apartment	2021-07-09	$555,000+	2021-10-14	$556,500	1	1	1	6.0	0.0	Wright Dunn Real Estate	215-19-marcus-clarke-street-city-act-2601
44176	Apartment	2021-07-09	$419,000	2021-10-01	Undisclosed	1	1	1	5.5		Luton Weston Creek & Molonglo Valley	7-17-majura-avenue-dickson-act-2602
44186	Apartment	2021-07-09	508,000	2021-09-07	$508,000	2	1	1	6.0		Maria Selleck Properties	1411-15-bowes-street-phillip-act-2606
44187	House	2021-07-09	$949,000	2021-09-21	$920,000	3	2	2		879.0	LJ Hooker Narooma	7b-guboo-place-bermagui-nsw-2546
44251	House	2021-07-12	By Negotiation	2021-10-27	$950,000	4	2	6	1.0	914.0	Impact Properties	60-mileham-street-macgregor-act-2615
44279	AcreageSemi-rural	2021-07-13	$820,000	2021-09-28	$820,000	5	2	2		60.0	Henley Property - Cooma	154-scotts-road-cooma-nsw-2630
44314	Townhouse	2021-07-13	$480,000 - $510,000	2021-09-15	$530,000	2	2	1			McIntyre Property	11-83-85-tharwa-road-queanbeyan-nsw-2620
44315	Apartment	2021-07-13	$380,000+	2021-09-15	$396,000	1	1	1	6.0		LJ Hooker Tuggeranong	151-56-forbes-street-turner-act-2612
44325	Land	2021-07-14	$89,000	2021-10-11	$89,000	0	0	0		771.0	Belle Property Braidwood	4-araluen-street-majors-creek-nsw-2622
44336	House	2021-07-14	By Negotiation	2021-09-03	$775,000	3	2	2	5.5	0.0	LJ Hooker Gungahlin	30-haystack-crescent-palmerston-act-2913
44369	Apartment	2021-07-14	Sold for $411,000	2021-09-02	$411,000	1	1	1	6.0		McGrath Canberra	50-116-easty-street-phillip-act-2606
44375	Villa	2021-07-14	Under Offer	2022-01-25	$247,000	2	1	1			Bella Coastal Property	52-396-princes-highway-ulladulla-nsw-2539
44522	Other	2021-07-14	$1,799,000	2021-11-18	$1,799,000	4	2	3		20650.0	Hallmark Real Estate Advisors	1241-congo-road-meringo-nsw-2537
44899	House	2021-07-14	$880,000	2021-09-27	$890,000	3	1	1	1.0	664.0	Luton Tuggeranong	33-mirrool-street-duffy-act-2611
44901	Land	2021-07-14	$98,000	2021-09-23	$92,000	0	0	0		2023.0	Henley Property - Cooma	lot-3-19-otway-street-nimmitabel-nsw-2631
44906	AcreageSemi-rural	2021-07-14	$1,400,000-$1,450,000	2021-11-05	$1,250,000	5	3	2		8.55	Ray White Queanbeyan | Jerrabomberra	60-blewitt-lane-burra-nsw-2620
44910	Apartment	2021-07-14	$489,000+	2021-09-02	Undisclosed	1	1	2	6.0		One Agency Gamarra & Co	24-5-burbury-close-barton-act-2600
44913	Unit	2021-07-15	$330,000	2021-09-06	$330,000	1	1	1	6.0		home.by holly	1514-120-eastern-valley-way-belconnen-act-2617
44924	Townhouse	2021-07-15	$699,000+	2021-09-16	$710,000	3	2	2	4.5	419.0	Ray White Canberra	8-20-splayd-close-dunlop-act-2615
44950	Unit	2021-07-15	$525,000	2021-10-15	Undisclosed	2	2	1	3.0		Ray White Canberra	136-15-john-cleland-crescent-florey-act-2615
44957	House	2021-07-15	Contact Agent	2021-10-15	Undisclosed	6	3	2		582.0	Bella Coastal Property	75-burrill-street-south-ulladulla-nsw-2539
44961	House	2021-07-15	By Negotiation	2021-09-16	$820,000	3	1	2	0.5	758.0	LJ Hooker Tuggeranong	94-enid-lorimer-circuit-chisholm-act-2905
44971	House	2021-07-15	$665,000	2021-09-10	$665,000	3	2	1		918.0	My Agent Christine Ewin	15b-peter-crescent-batehaven-nsw-2536
44974	House	2021-07-15	$891,000	2021-10-19	$891,000	4	2	0	0.5	825.0	home.by holly	97-ohalloran-circuit-kambah-act-2902
44985	Apartment	2021-07-15	$365,000+	2021-09-30	$377,000	2	2	2	6.0		LJ Hooker Kippax	107-68-hardwick-crescent-holt-act-2615
44992	Land	2021-07-15	$329,000	2021-11-12	$329,000	0	0	0		683.0	Ray White Batemans Bay	6-jardine-road-sunshine-bay-nsw-2536
45002	House	2021-07-15	Contact Agent	2021-09-02	Undisclosed	3	1	1	1.5	1049.0	New Door Properties	1-maraar-place-giralang-act-2617
45009	House	2021-08-13	Contact Agent	2021-09-03	$885,000	4	2	2		437.0	LJ Hooker Queanbeyan – Jerrabomberra – Googong	16-rosa-street-googong-nsw-2620
45011	House	2021-07-15	By Negotiation	2021-09-29	Undisclosed	4	2	2	4.0	1133.0	LJ Hooker Weston/Woden	shackleton-circuit-mawson-act-2607
45012	BlockOfUnits	2021-07-15	BY NEGOTIATION	2021-10-18	$1,645,000	7	7	6		765.0	Elders Real Estate Batemans Bay	364-beach-road-batehaven-nsw-2536
45032	Unit	2021-07-16	$495,000	2021-11-04	$480,000	6	5	1			Fisk & Nagle Property	28-31-24-mittagang-road-cooma-nsw-2630
45051	House	2021-07-16	$1,200,000 - $1,300,000	2021-09-08	Undisclosed	4	3	5		8000.0	Ray White Queanbeyan | Jerrabomberra	39-mcdonnell-drive-bungendore-nsw-2621
45059	House	2021-07-16	Price On Request	2021-09-23	Undisclosed	3	2	2	2.0	975.0	Bastion Property Group	2-duterrau-crescent-lyneham-act-2602
45074	Townhouse	2021-07-16	$660,000+	2021-09-07	$680,000	3	2	1	6.0		LJ Hooker Gungahlin	1-21-clark-close-spence-act-2615
45081	Townhouse	2021-07-17	By Negotiation - Vicinity of $890,000	2021-09-20	Undisclosed	3	2	2			Marshall and Tacheci Real Estate	moorhen-cove-4-15-wallaga-lake-road-bermagui-nsw-2546
45091	Apartment	2021-07-19	By Negotiation	2021-09-03	Undisclosed	2	2	2	6.0		LJ Hooker Canberra City	116-26-antill-street-dickson-act-2602
45109	Apartment	2021-07-19	$650,895	2022-01-27	$630,000	3	2	2	5.0	0.0	GEOCON	1203-90-swain-street-gungahlin-act-2912
45111	Apartment	2021-07-19	$325,395	2022-02-23	$325,395	1	1	0	5.0	0.0	GEOCON	111-90-swain-street-gungahlin-act-2912
45155	Apartment	2021-07-20	$429,000+	2021-09-29	Undisclosed	2	1	1	6.0		Luton Dickson	22-23-tay-street-watson-act-2602
45167	Apartment	2021-07-20	By Negotiation	2021-11-12	$522,000	2	2	2	6.0		Impact Properties	119-57-benjamin-way-belconnen-act-2617
45179	Apartment	2021-07-20	$1,270,000	2021-10-13	$1,270,000	3	2	2	7.4	0.0	JWLand	g01-4-anzac-park-campbell-act-2612
45183	Unit	2021-07-21	$349,000+	2021-09-03	$350,500	1	1	1	6.0		Luton Gungahlin	4-77-gozzard-street-gungahlin-act-2912
45205	Apartment	2021-07-21	$335,000	2021-10-01	$336,000	1	1	1	6.0	0.0	LJ Hooker Belconnen	73-29-braybrooke-street-bruce-act-2617
45214	Unit	2021-07-21	$340,000 +	2021-08-31	$355,000	1	1	1	6.0		LJ Hooker Belconnen	m05-4-grazier-lane-belconnen-act-2617
45238	Apartment	2021-07-22	$460,000+	2021-09-23	Undisclosed	2	1	1	6.0		Luton Weston Creek & Molonglo Valley	142-39-benjamin-way-belconnen-act-2617
45266	House	2021-07-22	Contact Agent	2021-10-15	$2,025,000	3	1	0	0.5	0.0	Berkely Residential	27-lawley-street-deakin-act-2600
45267	Apartment	2021-07-22	$949,000	2021-10-05	$940,000	3	2	2	5.0	0.0	Berkely Residential	167-53-eyre-street-kingston-act-2604
45279	Land	2021-07-22	$560,000	2021-10-13	$470,000	0	0	0		500.0	Bella Coastal Property	7-4-thrush-street-bawley-point-nsw-2539
45293	House	2021-07-22	By Negotiation	2021-10-08	$1,075,000	4	3	2	0.0	0.0	Confidence Real Estate	12-bailey-crescent-googong-nsw-2620
45302	Apartment	2021-07-22	By Negotiation	2021-09-23	$445,000	2	2	2			Ian McNamee & Partners - Queanbeyan	5-39-43-crawford-street-queanbeyan-nsw-2620
45329	Apartment	2021-07-23	$454,900	2022-02-07	$454,900	1	1	0	5.0	0.0	GEOCON	115-83-cooyong-street-reid-act-2612
45331	Apartment	2021-07-23	$389,900	2022-02-13	$389,900	1	1	0	5.0	0.0	GEOCON	408-81-cooyong-street-reid-act-2612
45332	Unit	2021-07-23	$299,000+	2021-09-10	$295,000	1	1	1	6.0		LJ Hooker Kippax	306-38-gozzard-street-gungahlin-act-2912
45335	House	2021-07-23	Auction 25/09/2021	2021-09-25	$1,450,000	4	2	2	0.0	736.0	LJ Hooker Dickson	56-blacket-street-downer-act-2602
45342	Apartment	2021-07-23	$510,900	2021-10-05	$510,900	2	2	2	5.0	0.0	GEOCON	936-26-cynthea-teague-crescent-greenway-act-2900
45343	Apartment	2021-07-23	$319,900	2021-09-17	Undisclosed	1	1	0	5.0	0.0	GEOCON	1001-15-bowes-street-phillip-act-2606
45362	Land	2021-07-23	$510,000	2022-06-17	$460,000	0	0	0		700.0	LJ Hooker Tuross Head	95-coogee-street-tuross-head-nsw-2537
45370	House	2021-07-24	480,000 - 520,000	2021-09-10	$531,000	2	2	1		720.8	LJ Hooker Malua Bay	52-bavarde-ave-batemans-bay-nsw-2536
45371	House	2021-07-24	$590,000 - $620,000	2021-10-06	$620,000	3	2	2		451.8	LJ Hooker Malua Bay	6-9-eric-fenning-drive-surf-beach-nsw-2536
45392	Apartment	2021-07-26	269000	2021-09-07	$269,000	1	1	1	0.0	0.0	LJ Hooker Kippax	33-58-bennelong-crescent-macquarie-act-2614
45394	House	2021-07-26	Contact Agent	2021-09-02	$920,000	5	2	2		2000.0	Ray White Goulburn	13-jockey-court-goulburn-nsw-2580
45397	House	2021-07-26	$660,000	2021-09-13	Undisclosed	3	2	2		2.14	Raine & Horne Young	38-byrne-close-young-nsw-2594
45409	Other	2021-07-26		2021-10-26	Undisclosed	7	5	0		1606.0	Tathra Beach Real Estate	78-merimbula-drive-merimbula-nsw-2548
45428	House	2021-07-27	VIRTUAL AUCTION	2021-09-27	$790,000	3	1	1	1.0	931.0	McIntyre Property	108-ohalloran-circuit-kambah-act-2902
45431	House	2021-07-27	$775,000	2021-10-20	$690,000	3	2	2		569.0	LJ Hooker Narooma	38-keating-drive-bermagui-nsw-2546
45434	House	2021-07-27	VIRTUAL AUCTION	2021-09-24	$980,000	4	2	2	4.5	848.92	McIntyre Property	18-handasyde-street-conder-act-2906
45435	Unit	2021-07-27	$249,000	2021-09-22	$249,000	2	1	1			LJ Hooker Batemans Bay	unit-207-202-208-beach-road-batehaven-nsw-2536
45436	Apartment	2021-07-27	$765,000	2021-10-22	$765,000	1	1	1	6.0	0.0	Berkely Residential	11-17-eastlake-parade-kingston-act-2604
45446	House	2021-07-27	$979,000	2022-07-01	Undisclosed	4	2	2		718.0	LJ Hooker Narooma	8-dulip-close-dalmeny-nsw-2546
45448	Studio	2021-07-27	$85,000	2021-09-22	$85,000	1	1	1			LJ Hooker Batemans Bay	unit-207a-202-208-beach-road-batehaven-nsw-2536
45460	Townhouse	2021-07-27	Forthcoming Auction	2021-09-01	Undisclosed	3	2	2	4.5	0.0	Ray White Canberra	1-16-monaghan-place-nicholls-act-2913
45466	Townhouse	2021-07-28	By Negotiation	2021-09-24	$750,000	3	2	2	2.5		Impact Properties	23-27-temperley-street-nicholls-act-2913
45467	Other	2021-07-28	Auction Sunday 19th September at 10am	2021-09-19	$310,000	0	0	0		42.0	McCann Properties	lot-1-dp574573-gundaroo-road-gunning-nsw-2581
45473	Apartment	2021-07-28	$660,000	2021-10-06	$660,000	2	2	1	6.0	0.0	Berkely Residential	14-10-trevillian-quay-kingston-act-2604
45481	Apartment	2021-07-28	$425,000+	2021-10-08	$425,000	1	1	1	6.0	0.0	LJ Hooker Gungahlin	138-10-ipima-street-braddon-act-2612
45492	House	2021-07-28	$1,485,000	2021-10-09	$1,485,000	5	3	6		40030.0	LJ Hooker Malua Bay	143-clyde-road-north-batemans-bay-nsw-2536
45493	Land	2021-07-28	Auction	2021-09-01	$1,228,000	0	0	0	0.0	1636.0	LJ Hooker Kaleen	49-bainton-crescent-melba-act-2615
45498	Apartment	2021-07-28	$369,000	2021-12-16	Undisclosed	2	1	1	6.0		One Agency Sandy Morris	193-325-anketell-street-greenway-act-2900
45502	Farmlet	2021-07-28	Under Offer	2021-10-13	Undisclosed	2	1	6		3.8	Ray White Braidwood	10869-nerriga-road-braidwood-nsw-2622
45504	Apartment	2021-07-28	$434,888+	2021-09-14	Undisclosed	1	1	1	6.0	0.0	Ivan Tasic - Edge Real Estate	27-41-hampton-circuit-yarralumla-act-2600
45509	House	2021-07-29	$859,000 - $899,000	2021-09-01	Undisclosed	4	2	2	4.0		LJ Hooker Manuka	19-withnell-circuit-kambah-act-2902
45510	House	2021-07-29	Auction 25/09/2021	2021-09-25	$915,000	4	2	2	3.0	0.0	PURNELL	38-carslake-loop-gordon-act-2906
45512	House	2021-07-29	$1,375,000	2021-09-09	Undisclosed	5	2	2	5.0	604.0	VERV Property	40-cazneaux-crescent-weston-act-2611
45515	Apartment	2021-07-29	$649,000 - $699,000	2021-12-22	$653,500	2	2	2	6.0		LJ Hooker Manuka	25-1-gordon-street-city-act-2601
45520	House	2021-07-29	$850,000+	2021-09-21	Undisclosed	4	2	1	3.0		One Agency Sandy Morris	9-werriwa-crescent-isabella-plains-act-2905
45526	Apartment	2021-07-29	$445,000	2021-09-01	$445,000	1	1	1	6.0		home.by holly	508-45-furzer-street-phillip-act-2606
45528	House	2021-07-29	Price On Request	2021-11-21	Undisclosed	4	3	1	4.0	640.0	Bastion Property Group	44-piddington-street-watson-act-2602
45533	House	2021-07-29	Contact Agent	2021-10-29	$1,060,000	4	2	2	6.0	405.0	Agent Residential	9-james-mcauley-crescent-wright-act-2611
45535	Unit	2021-07-29	$275,000+	2021-08-31	$315,000	1	1	1	6.0		LJ Hooker Dickson	17-39-brigalow-street-oconnor-act-2602
45544	House	2021-07-29	Auction	2021-09-23	Undisclosed	3	2	4	4.0		One Agency Sandy Morris	41-girdlestone-circuit-calwell-act-2905
45545	Apartment	2021-07-29	440,000+	2021-10-07	$450,000	2	1	1	6.0		LJ Hooker Tuggeranong	94-5-burnie-street-lyons-act-2606
45552	House	2021-07-29	2,425,000+	2021-10-26	$2,350,000	9	4	0	1.5	2568.0	LJ Hooker Kaleen	1-3-5-graham-street-macgregor-act-2615
45556	House	2021-07-29	Expressions of Interest	2021-09-21	$1,600,000	3	1	1	0.0	784.0	Wright Dunn Real Estate	74-macarthur-avenue-oconnor-act-2602
45560	House	2021-07-29	AUCTION	2021-09-16	$1,670,000	5	4	2	5.5	791.0	Maria Selleck Properties	55-diamond-street-amaroo-act-2914
45563	Unit	2021-07-29	570,000+	2021-09-10	Undisclosed	2	2	2	6.0		LJ Hooker Canberra City	3-115-canberra-avenue-griffith-act-2603
45567	Townhouse	2021-07-29	Auction	2021-09-23	$723,000	2	1	1	3.0		Badenoch Real Estate	40-32-bunbury-street-stirling-act-2611
45587	House	2021-07-30	Price Guide $1,450,000	2021-11-29	$1,425,000	5	3	2		1460.0	Raine & Horne Southern Highlands	17-oaklands-street-mittagong-nsw-2575
45593	House	2021-07-30	$875,000	2021-10-19	$867,000	3	2	2		604.0	Elders Real Estate Batemans Bay	37b-ridge-street-catalina-nsw-2536
45594	House	2021-07-30	Auction 01/10/21	2021-10-01	$902,000	4	2	2	2.5	1503.0	Ray White Canberra	3-crofts-crescent-spence-act-2615
45601	Apartment	2021-07-30	$629,000	2021-09-03	$645,000	2	2	2	6.0		Luton Manuka	30-7-empire-circuit-forrest-act-2603
45608	House	2021-07-30	$690,000 off plan, $720,000 once completed	2021-09-22	$690,000	3	2	2		450.0	LJ Hooker Moruya	11-12-13-14-shorthorn-close-moruya-nsw-2537
45612	Apartment	2021-07-30	Enquire today	2022-05-04	$440,000	1	1	1	6.0		Crowthers	914-25-edinburgh-avenue-city-act-2601
45615	House	2021-07-31	Auction postone 	2021-09-02	Undisclosed	4	2	2	5.0	465.0	Leader Capital Real Estate	22-mary-gillespie-avenue-gungahlin-act-2912
45616	House	2021-07-31	$800,000-$850,000	2021-10-01	$800,000	3	3	2		736.0	LJ Hooker Gungahlin	9b-hanley-place-yass-nsw-2582
45626	House	2021-08-02	$900,000 - $950,000	2021-09-03	$945,000	4	3	2		773.0	Sails Real Estate	60b-the-dress-circle-tura-beach-nsw-2548
45629	ServicedApartment	2021-08-02	$349,000 - $379,000	2021-11-02	$342,500	2	2	2			Sails Real Estate	9-1-3-ocean-drive-merimbula-nsw-2548
45631	ServicedApartment	2021-08-02	$299,000 - $319,000	2021-10-29	$310,000	2	2	1			Sails Real Estate	2-67-main-street-merimbula-nsw-2548
45633	House	2021-08-02	$980,000	2021-09-27	$940,000	6	3	3			Sails Real Estate	10-view-street-merimbula-nsw-2548
45634	House	2021-08-02	$900,000 - $925,000	2021-09-02	$925,000	3	2	3		792.0	Sails Real Estate	19-seaview-avenue-merimbula-nsw-2548
45636	Unit	2021-08-02	$679,000	2021-10-11	$679,000	3	2	1			Sails Real Estate	1-14-casey-jayne-court-tura-beach-nsw-2548
45637	Townhouse	2021-08-02	$429,000	2021-10-12	$420,000	3	2	2			Sails Real Estate	2-8-reid-street-merimbula-nsw-2548
45638	House	2021-08-02	$1,100,000 - $1,150,000	2021-10-13	$1,050,000	4	2	2		950.0	Sails Real Estate	3-whistler-close-merimbula-nsw-2548
45639	Unit	2021-08-02	Price Guide $400,000 - $440,000	2021-09-17	$440,000	2	1	2			Sails Real Estate	2-22-merimbola-street-pambula-nsw-2549
45640	Land	2021-08-02	$6,000,000	2021-09-28	$6,050,000	0	0	0		13.67	Sails Real Estate	lot-229-mirador-drive-merimbula-nsw-2548
45644	House	2021-08-02	Price Guide $800,000 - $850,000	2021-09-08	$825,000	4	3	2		1719.0	Sails Real Estate	26c-elizabeth-parade-tura-beach-nsw-2548
45645	House	2021-08-02	$1,290,000	2022-02-16	$1,200,000	4	2	4		1.02	Sails Real Estate	454-sapphire-coast-drive-tura-beach-nsw-2548
45646	House	2021-08-02	$1,150,000 to $1,200,000	2021-09-02	$1,175,000	4	2	4		1064.0	Sails Real Estate	49-the-crest-merimbula-nsw-2548
45649	House	2021-08-02	By Negotiation	2021-10-29	Undisclosed	3	2	8	1.0	790.0	McIntyre Property	36-baskerville-street-chisholm-act-2905
45654	House	2021-08-13	$640,000	2021-09-06	$640,000	3	2	2		974.0	LJ Hooker Queanbeyan – Jerrabomberra – Googong	5-ingleside-road-karabar-nsw-2620
45661	Townhouse	2021-08-02	By negotiation	2021-09-10	$550,000	3	1	1	3.0		Ray White Canberra	16-5-harry-hopman-circuit-gordon-act-2906
45677	House	2021-08-02	$615,000	2021-09-02	$605,000	4	2	3			Ray White Goulburn	15-samuel-place-goulburn-nsw-2580
45679	House	2021-08-03	Sold At Auction $1,320,000	2021-09-04	$1,320,000	4	2	2	4.0	449.0	Canberry Properties	16-pogson-street-moncrieff-act-2914
45682	House	2021-08-03	$1,416,000	2021-09-04	$1,416,000	7	3	2		816.0	My Agent Christine Ewin	9-grant-street-broulee-nsw-2537
45688	AcreageSemi-rural	2021-08-03	$1,100,000	2021-11-18	Undisclosed	4	2	10		5.76	Professionals Batemans Bay	20-pear-tree-place-moruya-nsw-2537
45689	House	2021-08-03	ONLINE AUCTION	2021-09-06	$755,000	3	1	1	2.5	465.0	McIntyre Property	13-bastow-circuit-banks-act-2906
45693	Townhouse	2021-08-03	$599,000+	2021-09-29	$610,000	2	1	1	6.0	162.0	Luton Gungahlin	55-turbayne-crescent-forde-act-2914
45694	AcreageSemi-rural	2021-08-03	$1,200,000	2022-08-22	$1,000,000	4	2	1		16.9	LJ Hooker Batemans Bay	20-western-distributor-road-currowan-nsw-2536
45695	House	2021-08-03	$750,000	2021-09-03	$750,000	3	2	2			LJ Hooker Batemans Bay	102-carramar-drive-malua-bay-nsw-2536
45698	House	2021-08-03	SOLD - $950,000	2021-09-12	$950,000	3	2	2	3.5	537.0	Stone Gungahlin	36-auburn-street-amaroo-act-2914
45706	House	2021-08-03	$300,000	2021-11-12	$280,000	3	1	1			Fisk & Nagle Property	43-burton-street-bombala-nsw-2632
45708	Apartment	2021-08-03	$359,000	2022-03-04	$370,000	1	1	1			Ray White Queanbeyan | Jerrabomberra	27-4-ross-road-queanbeyan-nsw-2620
45718	Apartment	2021-08-03	Forthcoming Auction	2021-09-30	$300,000	2	1	1	6.0		LJ Hooker Dickson	23-179-melrose-drive-lyons-act-2606
45723	Land	2021-08-03	AUCTION	2021-09-02	$706,000	0	0	0		3733.0	Henley Property - Jindabyne	11-acacia-place-east-jindabyne-nsw-2627
45729	Apartment	2021-08-04	By Negotiation	2021-09-06	$365,000	1	1	1	6.0	0.0	Nim Osborne Real Estate	85-39-benjamin-way-belconnen-act-2617
45733	House	2021-08-04	Auction	2021-09-11	$1,225,000	3	2	2	3.0	0.0	Luton Manuka	25a-macgregor-street-deakin-act-2600
45735	Apartment	2021-08-04	Auction 22/10/2021	2021-10-22	$480,000	1	1	1	6.0	0.0	Ray White Canberra	32-39-eastlake-parade-kingston-act-2604
45736	House	2021-08-04	AUCTION  02/10/2021	2021-10-02	Undisclosed	4	2	3	1.5	0.0	The Westend CBR	2-harry-hopman-circuit-gordon-act-2906
45737	House	2021-08-04	Expressions of Interest	2021-09-03	$450,000	3	1	3		1037.0	Belle Property Braidwood	7-wallace-street-tarago-nsw-2580
45738	House	2021-08-04	Auction	2021-09-25	$1,610,000	3	1	2	2.0	743.0	Irwin Property	4-hoddle-gardens-ainslie-act-2602
45739	Townhouse	2021-08-04	Auction, Sat 4th Sep at 10:00am	2021-09-04	$685,000	3	2	2	5.0	0.0	LJ Hooker Gungahlin	1-74-henry-kendall-street-franklin-act-2913
45740	House	2021-08-04	Contact Agent	2021-10-26	$2,410,000	5	3	4	2.0	0.0	Berkely Residential	5-kanangra-place-omalley-act-2606
45742	House	2021-08-04	Contact Agent	2021-08-31	$820,000	3	2	2		677.0	Ian McNamee & Partners - Queanbeyan	20-thornton-road-karabar-nsw-2620
45748	House	2021-08-04	$630,000	2021-08-31	$630,000	3	1	1	6.0	235.0	New Door Properties	12-briger-street-taylor-act-2913
45749	Apartment	2021-08-04	Sold $315,000	2021-10-06	$315,000	1	1	1	5.5		McGrath Canberra	310-38-gozzard-street-gungahlin-act-2912
45755	Apartment	2021-08-04	$409,000 - $449,000	2021-10-07	$425,000	2	2	2	6.0		McGrath Canberra	37-77-gozzard-street-gungahlin-act-2912
45756	Townhouse	2021-08-04	Forthcoming Auction	2021-09-14	Undisclosed	1	1	0	6.0		LJ Hooker Dickson	2-13-coppin-place-weetangera-act-2614
45760	House	2021-08-04	$1,070,000	2021-09-06	Undisclosed	4	2	2		796.0	VERV Property	16-parkview-crescent-jerrabomberra-nsw-2619
45774	House	2021-08-04	Auction Saturday 11 September 12pm	2021-09-11	$1,430,000	4	3	5	0.0	7032.0	McGrath Canberra	14-granville-close-greenleigh-nsw-2620
45777	House	2021-08-04	$826,000	2021-09-04	$826,000	4	2	2		556.0	My Agent Christine Ewin	79-ainslie-parade-tomakin-nsw-2537
45780	House	2021-08-04		2021-09-22	Undisclosed	4	2	2		659.0	Tathra Beach Real Estate	9-wildlife-drive-tathra-nsw-2550
45784	House	2021-08-04	Expressions of Interest	2021-08-31	$765,000	3	1	1		550.0	Bella Coastal Property	53-wallaroy-drive-burrill-lake-nsw-2539
45788	House	2021-08-04	Forthcoming Auction	2021-09-03	Undisclosed	4	2	0			Luton Gungahlin	38-clare-valley-place-wamboin-nsw-2620
45798	House	2021-08-05	Forthcoming Auction	2021-09-08	Undisclosed	4	2	2	3.5	797.0	Luton Weston Creek & Molonglo Valley	6-lamble-place-oxley-act-2903
45799	Apartment	2021-08-05	$350,000+	2021-10-06	Undisclosed	2	1	2	0.0		Luton Weston Creek & Molonglo Valley	69-17-medley-street-chifley-act-2606
45803	House	2021-08-05	AUCTION	2021-09-13	$875,000	4	2	2	0.0		Michael Potter Real Estate	27-christmas-street-theodore-act-2905
45807	House	2021-08-05	$1,220,000	2021-09-08	$1,220,000	4	2	3	3.0	774.0	home.by holly	19-damala-street-waramanga-act-2611
45814	Apartment	2021-08-05	Offers over $220,000	2021-09-23	$220,000	1	1	1	2.5		McIntyre Property	8c-6-irvine-street-watson-act-2602
45817	House	2021-08-05	Auction	2021-09-26	Undisclosed	4	2	2	3.0	1280.0	One Agency Sandy Morris	21-hawken-street-monash-act-2904
45820	House	2021-08-05	Auction 04/09/21	2021-09-04	$1,115,000	5	3	2	1.5	1115.0	LJ Hooker Tuggeranong	63-bugden-avenue-gowrie-act-2904
45823	House	2021-08-05	Contact Agent	2021-09-16	Undisclosed	4	2	2		891.0	home.by holly	40-crest-road-crestwood-nsw-2620
45826	House	2021-08-05	Forthcoming Auction	2021-10-24	$1,955,000	5	4	2	2.0	0.0	Confidence Real Estate	4-oodgeroo-avenue-franklin-act-2913
45828	House	2021-08-05	$650,000 +	2021-09-13	$795,000	4	2	3	2.5	861.0	Maloney's Property	42-clive-steele-avenue-monash-act-2904
45832	House	2021-08-05	$1,300,000 +	2021-11-23	$1,300,000	5	4	2	0.5	737.0	Timothy Road	40-sheehy-street-evatt-act-2617
45838	House	2021-08-05	Auction	2021-09-20	Undisclosed	4	2	3	3.5	841.0	Timothy Road	16-alberga-street-kaleen-act-2617
45839	DuplexSemi-detached	2021-08-05	$875,000 +	2021-09-06	$885,000	3	2	2	4.5	880.0	LJ Hooker Tuggeranong	1-144-theodore-street-lyons-act-2606
45842	House	2021-08-05	Auction	2021-10-06	$1,435,000	3	1	0	1.0	667.0	LJ Hooker Canberra City	13-boobialla-street-oconnor-act-2602
45845	House	2021-08-05	Auction	2021-09-06	Undisclosed	4	2	2	0.5	886.0	Ray White Canberra	20-couvreur-street-garran-act-2605
45846	House	2021-08-05	Auction 23/09/21	2021-09-23	Undisclosed	4	1	2	1.0	886.0	Ray White Canberra	8-aaron-place-macgregor-act-2615
45849	House	2021-08-05	Auction	2021-10-09	$1,080,000	6	3	0	1.0	738.0	LJ Hooker Weston/Woden	37-arndell-street-macquarie-act-2614
45850	House	2021-08-05	Auction	2021-09-25	Undisclosed	5	2	0	2.0	700.0	LJ Hooker Weston/Woden	66-hilder-street-weston-act-2611
45851	DuplexSemi-detached	2021-08-05	Forthcoming Auction	2021-09-06	$880,000	4	2	2	4.0	1410.0	LJ Hooker Weston/Woden	6a-cethana-place-duffy-act-2611
45852	House	2021-08-05	$1,250,000-$1,350,000	2021-11-19	$1,350,000	6	4	4		569.0	My Agent Christine Ewin	13-sandy-place-long-beach-nsw-2536
45855	House	2021-08-05	$420,000	2021-09-27	$422,250	3	1	1		691.0	Henley Property - Cooma	16-woolalla-street-cooma-nsw-2630
45857	House	2021-08-05	$1,000,000 - $1,100,000	2021-10-18	Undisclosed	5	2	7		28.35	Ray White Canberra	42-wells-place-bellmount-forest-nsw-2581
45859	Apartment	2021-08-05	Contact Agent	2021-09-30	Undisclosed	2	2	2	6.0		home.by holly	66-43-constitution-avenue-reid-act-2612
45860	House	2021-08-05	Forthcoming Auction	2021-09-16	Undisclosed	5	4	2	4.0	758.0	Ray White Canberra	119-miller-street-oconnor-act-2602
45862	House	2021-08-05	Auction	2021-09-27	$810,000	4	2	2		753.0	Henley Property - Cooma	27-monaro-avenue-cooma-nsw-2630
45864	House	2021-08-05	$1.65M	2021-10-11	$1,600,000	3	2	1		594.0	Bella Coastal Property	4-northaven-avenue-bawley-point-nsw-2539
45884	Land	2021-08-05	$499,000	2021-09-07	$485,000	0	0	0		723.0	Sails Real Estate	1-elizabeth-parade-tura-beach-nsw-2548
45886	House	2021-08-05	Auction	2021-10-14	Undisclosed	5	3	5	4.5	2041.0	Blackshaw Manuka	8-akame-circuit-omalley-act-2606
45887	Apartment	2021-08-06	$470,000+	2021-11-02	Undisclosed	2	1	1	6.0		Luton Weston Creek & Molonglo Valley	15-60-callam-street-phillip-act-2606
45890	DuplexSemi-detached	2021-08-06	$899,000+	2022-04-12	Undisclosed	3	2	2	5.0	431.0	Bastion Property Group	6a-arndell-street-macquarie-act-2614
45891	Townhouse	2021-08-06	Price On Request	2021-09-29	Undisclosed	4	4	2	3.0	1160.0	Bastion Property Group	5-15-dalman-crescent-omalley-act-2606
45892	House	2021-08-06	Price On Request	2021-09-20	Undisclosed	4	1	2	0.5	807.0	Bastion Property Group	18-knaggs-crescent-page-act-2614
45898	House	2021-08-06	$879,000+	2021-09-29	$976,000	3	1	2	1.0	784.0	LJ Hooker Gungahlin	107-onkaparinga-crescent-kaleen-act-2617
45901	House	2021-08-06	Auction	2021-09-01	Undisclosed	3	2	2	5.5	242.0	LJ Hooker Canberra City	38-keppel-street-harrison-act-2914
45902	Apartment	2021-08-06	Auction Sat, 4th Sep at 9:00am	2021-09-04	$506,000	3	2	2	6.0	0.0	LJ Hooker Gungahlin	2-15-bill-ferguson-circuit-bonner-act-2914
45905	House	2021-08-06	ONLINE AUCTION	2021-09-04	$697,500	3	3	2		550.0	My Agent Christine Ewin	6-barton-parade-tomakin-nsw-2537
45907	House	2021-08-06	$761,000	2021-08-31	$761,000	3	2	2		612.0	My Agent Christine Ewin	8-28-30-michener-court-long-beach-nsw-2536
45917	Townhouse	2021-08-06	Price On Request	2021-10-01	Undisclosed	3	1	1	3.5	0.0	Bastion Property Group	1-36-fink-crescent-calwell-act-2905
45920	Townhouse	2021-08-06	$395,000	2021-10-01	Undisclosed	1	1	1	3.5		Ray White Canberra	13-19-moorhouse-street-oconnor-act-2602
45926	Apartment	2021-08-06	830,000	2021-09-10	$830,000	3	2	2	4.0		Maria Selleck Properties	1202-2-marcus-clarke-street-city-act-2601
45931	Other	2021-08-06	$925,000	2021-09-20	$905,000	4	1	6		100.0	Belle Property Braidwood	359-foxs-elbow-road-braidwood-nsw-2622
45953	Apartment	2021-08-09	Auction	2021-09-08	Undisclosed	2	1	1		1219.0	Henley Property - Jindabyne	3-12-cobbon-crescent-jindabyne-nsw-2627
45957	House	2021-08-09	Auction Sunday 5th September at 10am	2021-09-05	Undisclosed	3	2	4		7833.0	McCann Properties	36-collector-road-gunning-nsw-2581
45963	Apartment	2021-08-09	Auction	2021-10-09	$360,000	1	1	1	4.0	0.0	LJ Hooker Tuggeranong	312-1-mouat-street-lyneham-act-2602
45964	House	2021-08-09	Auction 2 October at 12pm	2021-09-24	Undisclosed	4	2	2	4.0	558.0	LJ Hooker Tuggeranong	12-polwarth-circuit-dunlop-act-2615
45966	House	2021-08-09	Forthcoming auction	2021-09-03	$750,000	3	1	1	4.0	477.0	LJ Hooker Gungahlin	14-naas-close-amaroo-act-2914
45970	House	2021-08-09	Auction	2021-10-06	$1,393,500	3	1	0	3.5	870.0	LJ Hooker Canberra City	6-edkins-street-downer-act-2602
45971	House	2021-08-09	Auction - 2nd of October @ 12:00pm	2021-10-02	$1,635,000	3	1	1	3.0	902.0	Cream Residential	11-sabine-close-garran-act-2605
45973	House	2021-08-09	ONLINE AUCTION	2021-09-10	$1,350,000	3	3	4		10.4	Elders Real Estate Batemans Bay	144-meadows-road-mogendoura-nsw-2537
45977	House	2021-08-09	By Negotiation	2021-09-22	$1,270,000	5	4	3	6.0	0.0	Confidence Real Estate	2-rachel-makinson-street-strathnairn-act-2615
45985	House	2021-08-09	AUCTION Online Sat 11 Sept 3.30pm	2021-09-13	$738,000	3	1	1	6.0	0.0	Upside	7-maclurcan-street-franklin-act-2913
45987	Townhouse	2021-08-09	Offers over $599,000	2021-10-07	$660,000	3	1	2	1.0		Luton Manuka	24-8-jondol-place-isabella-plains-act-2905
45993	House	2021-08-09	$720,000	2021-11-04	$670,000	3	1	2		4277.0	LJ Hooker Tuross Head	26-princes-highway-bodalla-nsw-2545
45997	Unit	2021-08-09	$825,000	2021-11-05	$818,000	3	2	2			Henley Property - Jindabyne	12-36-clyde-street-jindabyne-nsw-2627
45998	House	2021-08-09	Price Guide $800,000 - $840,000	2021-09-22	$835,000	4	2	2		601.0	Sails Real Estate	54-pambula-beach-road-pambula-beach-nsw-2549
46001	Dairy	2021-08-10	$8,300,000	2022-03-01	Undisclosed	4	2	0		427.0	LAWD	409-moroka-road-maffra-vic-3860
46002	Dairy	2021-08-10	$7,800,000	2022-06-15	Undisclosed	2	2	0		289.0	LAWD	271-bushy-park-valencia-creek-road-maffra-vic-3860
46003	Dairy	2021-08-10	$8,400,000	2022-06-15	Undisclosed	4	2	0		314.0	LAWD	180-mclachlan-road-heyfield-vic-3858
46009	House	2021-08-10	Sold at auction $1,180,000.00	2021-09-04	$1,180,000	3	2	6	3.5	0.0	McGrath Canberra	7-eaton-place-monash-act-2904
46017	House	2021-08-10	Auction	2021-10-06	$900,000	3	1	2	0.5	717.8	LJ Hooker Canberra City	24-eungella-street-duffy-act-2611
46018	House	2021-08-10	$1,500,000	2021-09-03	$1,500,000	4	3	5		5504.0	LJ Hooker Batemans Bay	11-barlings-drive-tomakin-nsw-2537
46019	House	2021-08-10	Auction	2021-09-11	$710,000	3	1	0	3.0	433.0	Ray White Canberra	8-thurgood-court-gordon-act-2906
46022	House	2021-08-10	Forthcoming Auction	2021-09-17	Undisclosed	2	2	2		802.0	Ray White Batemans Bay	233-annetts-parade-mossy-point-nsw-2537
46038	House	2021-08-10	$300 000	2021-10-27	Undisclosed	4	2	1		468.0	Raine & Horne Young	9a-smith-street-harden-nsw-2587
46042	House	2021-08-10	$770,000	2021-10-21	$770,000	3	2	1	5.5	266.0	New Door Properties	21-dalkin-crescent-casey-act-2913
46043	Townhouse	2021-08-10	$499,000 +	2021-12-05	$524,000	2	2	2	6.0	0.0	Town Residential	28-18-shugg-street-taylor-act-2913
46044	House	2021-08-10	By Negotiation	2021-09-24	$865,000	4	2	2	0.0	0.0	Confidence Real Estate	53-thomas-royal-gardens-queanbeyan-east-nsw-2620
46051	AcreageSemi-rural	2021-08-10	Auction	2021-09-08	$3,080,000	5	3	8		5.0	Henley Property - Jindabyne	17-high-country-drive-jindabyne-nsw-2627
46054	House	2021-08-10	$512,500	2021-09-07	$512,500	3	1	1		556.0	My Agent Christine Ewin	28-clare-crescent-batehaven-nsw-2536
46055	House	2021-08-10	$665,000	2021-09-10	$665,000	3	1	1		459.0	LJ Hooker Malua Bay	9a-broomfield-crescent-long-beach-nsw-2536
46060	House	2021-08-11	Online Auction 29/09/2021 5.30pm	2021-09-29	$820,000	3	1	1	1.0	604.0	Morrissey Property	4-proby-place-kambah-act-2902
46061	Townhouse	2021-08-11	Auction	2021-09-11	Undisclosed	4	2	2	3.0	0.0	Luton Manuka	7-10-taronga-place-omalley-act-2606
46063	Apartment	2021-08-11	$469,000+	2021-10-08	$482,000	2	2	2	6.0		McGrath Canberra	23-37-braybrooke-street-bruce-act-2617
46067	House	2021-09-08	SOLD $980,000	2021-09-04	Undisclosed	3	2	2	2.0	884.0	Blackshaw Belconnen	26-lightfoot-crescent-florey-act-2615
46068	House	2021-08-11	Online Auction Saturday September 25th,  at 12pm	2021-09-25	Undisclosed	4	2	3	6.0		LJ Hooker Manuka	25-newman-street-yarralumla-act-2600
46070	Unit	2021-08-11	$599,000+	2021-09-21	$596,000	3	2	2	6.0		Canberry Properties	1505-120-eastern-valley-way-belconnen-act-2617
46071	House	2021-08-11	Auction	2021-09-20	Undisclosed	4	2	2	6.0	450.0	LJ Hooker Canberra City	7-philip-hodgins-street-wright-act-2611
46074	House	2021-08-11	Auction	2021-09-25	$712,000	3	1	1	6.0	247.0	Luton Gungahlin	20-yerradhang-street-ngunnawal-act-2913
46077	House	2021-08-11	VIRTUAL AUCTION	2021-09-27	$980,000	4	2	3	2.5	788.0	McIntyre Property	28-fred-lane-crescent-gordon-act-2906
46079	AcreageSemi-rural	2021-08-11	Auction Sunday 12th September at 10am	2021-09-12	$1,135,000	5	2	6		12.5	McCann Properties	104-collector-road-gunning-nsw-2581
46081	House	2021-08-11	Contact Agent	2021-10-16	$1,195,000	4	3	2	3.0	0.0	Illustrated Properties	4-villaret-street-harrison-act-2914
46083	House	2021-08-11	VIRTUAL AUCTION	2021-09-27	$810,000	3	2	2	4.5	0.0	McIntyre Property	2-30-jemalong-street-duffy-act-2611
46085	House	2021-08-11	Auction 29/09/2021	2021-09-29	$1,003,000	4	2	3	4.0	0.0	Ray White Canberra	11-ashburner-street-higgins-act-2615
46088	Townhouse	2021-08-11	Auction	2021-09-04	$798,000	3	2	2	4.5	368.0	LJ Hooker Belconnen	111-sugarloaf-circle-palmerston-act-2913
46089	Unit	2021-08-11	Online Auction	2021-09-03	$310,000	1	1	1	6.0		LJ Hooker Belconnen	24-2-ranken-place-belconnen-act-2617
46090	House	2021-08-11	Online Auction	2021-09-25	$878,000	3	2	2	1.5	834.0	LJ Hooker Belconnen	8-groveland-crescent-isabella-plains-act-2905
46091	Unit	2021-08-11	Online Auction	2021-09-25	$575,000	2	2	2	6.0	0.0	LJ Hooker Belconnen	714-86-88-northbourne-avenue-braddon-act-2612
46092	House	2021-08-11	$619,000	2021-09-09	$615,000	3	2	0		3542.0	Belle Property Braidwood	23-george-street-majors-creek-nsw-2622
46094	House	2021-08-11	Online Auction	2021-09-16	$1,214,000	3	1	0	2.5	613.0	LJ Hooker Belconnen	4-cassinia-street-oconnor-act-2602
46095	House	2021-08-11	Auction Online	2021-09-16	Undisclosed	3	1	2	4.0	837.0	Sadil Quinlan	4-yuille-place-charnwood-act-2615
46096	House	2021-08-11	Auction	2021-09-14	Undisclosed	4	4	3	4.5	0.0	Luton Manuka	58-dawes-street-kingston-act-2604
46097	House	2021-08-11	Auction	2021-09-30	Undisclosed	4	3	2	6.0		Luton Gungahlin	50-gallagher-street-kambah-act-2902
46099	House	2021-08-11	Price Guide $1,725,000	2021-09-24	$1,660,000	3	2	1		2018.0	Ray White Bowral	16-jellore-street-berrima-nsw-2577
46100	House	2021-08-11	Expressions of Interest	2021-09-20	$1,750,000	3	1	1	2.5	814.0	Wright Dunn Real Estate	17-moten-campbell-act-2612
46104	Townhouse	2021-08-11	Auction 23/09/2021	2021-09-22	Undisclosed	3	2	2	4.0	0.0	Ray White Canberra	9-60-boldrewood-street-turner-act-2612
46106	House	2021-08-11	SOLD PRIOR AUCTION : $746,000	2021-09-13	Undisclosed	3	1	1	6.0	290.0	New Door Properties	60-margaret-tucker-street-bonner-act-2914
46108	Apartment	2021-08-11	$409,000	2021-10-26	Undisclosed	1	1	1	6.0		McIntyre Property	117-39-benjamin-way-belconnen-act-2617
46111	House	2021-08-11	Auction 30/09/21	2021-09-30	$802,000	3	1	0	1.0	724.0	Civium Property Group - Residential	9-franks-place-kambah-act-2902
46112	Unit	2021-08-11	Auction Online Sat 9 Oct 4.30pm	2021-10-09	$521,000	2	2	2	6.0	0.0	Upside	22-54-ernest-cavanagh-street-gungahlin-act-2912
46115	House	2021-08-11	$470,000	2021-11-18	$455,000	3	1	3			One Agency Craig Schofield	1-murray-lane-cooma-nsw-2630
46122	Townhouse	2021-08-12	Auction	2021-09-28	Undisclosed	4	2	2	4.0	515.0	Luton Weston Creek & Molonglo Valley	2b-hansen-circuit-isaacs-act-2607
46125	House	2021-08-12	Auction	2021-10-01	Undisclosed	4	2	2	5.0	897.0	Luton Weston Creek & Molonglo Valley	44-cargelligo-street-duffy-act-2611
46127	DuplexSemi-detached	2021-08-12	$715,000	2021-09-18	$715,000	2	2	2	6.0	0.0	home.by holly	2-30-aurora-close-mawson-act-2607
46130	House	2021-08-12	Auction	2021-09-20	Undisclosed	4	2	2	5.0	450.0	Luton Dickson	10-leveque-street-harrison-act-2914
46131	Townhouse	2021-08-12	Forthcoming Auction	2021-09-24	$680,000	3	2	2	6.0	0.0	Luton Gungahlin	5-554a-cotter-road-coombs-act-2611
46132	House	2021-08-12	Auction online Sat 4th Sept	2021-09-04	$735,000	3	2	1	3.5	478.0	LJ Hooker Gungahlin	5-paul-coe-crescent-ngunnawal-act-2913
46135	House	2021-08-12	$776,000	2021-10-10	$776,000	2	1	1	1.0	0.0	home.by holly	69-dugdale-street-cook-act-2614
46136	Unit	2021-08-12	$455,000	2021-09-02	$455,000	2	2	2	6.0		LJ Hooker Belconnen	114-2-newchurch-street-coombs-act-2611
46138	House	2021-08-12	Auction	2021-10-09	$1,378,000	3	1	1	2.0	769.0	LJ Hooker Weston/Woden	26-neilson-street-garran-act-2605
46141	Apartment	2021-08-12	$330,000+	2021-08-31	$350,000	1	1	1	6.0		McIntyre Property	17-311-anketell-street-greenway-act-2900
46142	House	2021-08-12	$1,380,000	2021-09-18	$1,380,000	3	1	1	4.5	705.0	home.by holly	8-bates-street-dickson-act-2602
46145	Townhouse	2021-08-12	$611,000	2021-09-03	Undisclosed	3	1	2	5.5	254.0	Ray White Canberra	8-16-minnta-place-ngunnawal-act-2913
46146	House	2021-08-12	Auction 16/09/2021	2021-09-16	Undisclosed	3	1	2	2.5	867.0	Ray White Canberra	6-giffen-close-holt-act-2615
46149	House	2021-08-12	$1,000,000+	2021-09-23	$990,000	4	2	2	2.5	910.0	McIntyre Property	26-garanya-street-waramanga-act-2611
46150	House	2021-08-12	UNDER OFFER	2021-09-20	$760,000	3	2	2		679.0	Elders Real Estate Batemans Bay	7-shorthorn-close-moruya-nsw-2537
46151	House	2021-08-12	$1,295,000	2021-11-12	Undisclosed	4	2	2		12700.0	Elders Real Estate Batemans Bay	68-kettle-road-long-beach-nsw-2536
46152	House	2021-08-12	$695,000	2021-09-08	$705,000	3	2	0			LJ Hooker Tuross Head	3-kitchener-road-tuross-head-nsw-2537
46154	House	2021-08-12	Auction 25 Sep 2021	2021-09-14	$1,215,000	5	3	2	5.0	469.0	Town Residential	31-hibberd-crescent-forde-act-2914
46155	House	2021-09-16	SOLD - price undisclosed	2021-09-30	Undisclosed	6	3	2	1.5	1168.0	Blackshaw Belconnen	16-rogers-street-fraser-act-2615
46156	House	2021-08-12	$1,803,000 - SUBURB RECORD PRICE	2021-09-25	$1,803,000	5	2	2	1.5	953.0	home.by holly	12-lukin-place-watson-act-2602
46157	House	2021-08-12	Auction	2021-09-29	$935,000	3	1	2	1.5	0.0	LJ Hooker Dickson	115-william-webb-drive-mckellar-act-2617
46161	Apartment	2021-08-12	$475,000	2021-09-23	$465,000	3	1	1			LJ Hooker Malua Bay	19-2-6-matthew-parade-batehaven-nsw-2536
46164	Land	2021-08-12	Guide: $280,000 - $300,000	2021-11-25	$390,000	0	0	0		669.0	Henley Property - Cooma	188-sharp-street-cooma-nsw-2630
46165	Unit	2021-08-12	$575,000	2021-10-12	Undisclosed	3	1	2			Whale Coast Realty	12-9-mort-avenue-dalmeny-nsw-2546
46166	House	2021-08-12	AUCTION	2021-08-31	$822,000	4	2	2		886.0	Elders Real Estate Batemans Bay	96-litchfield-crescent-long-beach-nsw-2536
46169	House	2021-08-13	$1,495,000	2021-10-21	Undisclosed	5	3	4		1192.0	Whale Coast Realty	43-dawn-parade-kianga-nsw-2546
46170	House	2021-08-13	$1,795,000	2021-09-29	Undisclosed	4	2	1		615.0	Whale Coast Realty	109-dalmeny-drive-kianga-nsw-2546
46171	Land	2021-08-13	$725,000	2021-09-16	Undisclosed	0	0	0		3350.0	Whale Coast Realty	52-58-williamson-drive-north-narooma-nsw-2546
46172	Apartment	2021-08-13	$490,000+	2021-11-22	$470,000	1	1	1	6.0		Maloney's Property	61-22-eyre-street-kingston-act-2604
46173	House	2021-08-13	$1,149,000	2021-10-08	Undisclosed	4	3	3		752.0	Whale Coast Realty	11-warbler-crescent-north-narooma-nsw-2546
46177	Townhouse	2021-08-13	$516,000	2021-09-03	$516,000	2	1	2	3.0		Hugo. Canberra	1-3-redcliffe-street-palmerston-act-2913
46179	DuplexSemi-detached	2021-08-13	$1,050,000+	2021-09-14	Undisclosed	3	1	1	2.5	428.0	LJ Hooker Dickson	19-lowrie-street-dickson-act-2602
46182	House	2021-08-13	$655,000	2021-09-08	$655,000	2	1	1	6.0		home.by holly	2-phillipa-weeks-street-watson-act-2602
46183	Land	2021-08-13	$350,000.00	2021-09-13	$340,000	0	0	0		770.0	LJ Hooker Batemans Bay	114-hume-road-sunshine-bay-nsw-2536
46184	Land	2021-08-13	$150,000	2021-09-09	Undisclosed	0	0	0		1.06	Raine & Horne Young	29-dowling-drive-murringo-nsw-2586
46185	House	2021-08-13	Price Guide $1,495,000 - $1,595,000	2021-09-10	$1,650,000	3	1	2		38.0	Raine & Horne Southern Highlands	278-inverary-road-sutton-forest-nsw-2577
46186	House	2021-08-13	Price Guide: $1,400,000	2021-10-30	$1,750,000	5	2	1		1037.0	LJ Hooker Batemans Bay	69-tallawang-avenue-malua-bay-nsw-2536
46188	Apartment	2021-08-13	$560,000+	2021-10-01	$572,000	2	2	1	5.5		Maloney's Property	103-66-allara-street-city-act-2601
46189	House	2021-08-13	Auction	2021-09-08	Undisclosed	3	2	3	2.0	969.0	Ray White Canberra	2-corey-place-gowrie-act-2904
46191	House	2021-08-14	$792,500	2021-09-07	$792,500	3	2	2	4.5	254.0	Hugo. Canberra	54-mary-gillespie-avenue-gungahlin-act-2912
46192	House	2021-08-14	Price Guide $659,000 - $669,000	2021-09-23	$650,000	3	2	1			Ray White Batemans Bay	2-10-peninsula-drive-north-batemans-bay-nsw-2536
46194	Townhouse	2021-08-14	$630,000	2021-09-01	$649,800	3	2	2	0.0	0.0	BRADYS Real Estate	10-50-52-ellendon-street-bungendore-nsw-2621
46198	House	2021-08-14	On-Line Auction	2021-09-08	$475,000	2	1	0		677.0	Ray White Rural Canberra | Yass	47-lead-st-yass-nsw-2582
46201	House	2021-08-15	Price Guide $690,000 - $720,000	2021-12-22	$710,000	2	1	3		680.0	Ray White Batemans Bay	8a-ridge-street-catalina-nsw-2536
46202	House	2021-08-15	ONLINE AUCTION	2021-09-17	$867,000	3	1	2	1.5		Maria Selleck Properties	11a-cahalan-place-evatt-act-2617
46203	Townhouse	2021-08-15	AUCTION	2021-09-16	$1,132,000	3	3	2			Henley Property - Jindabyne	2-123-gippsland-street-jindabyne-nsw-2627
46204	Townhouse	2021-08-16	Auction	2021-09-04	Undisclosed	2	2	1	6.0	0.0	Luton Weston Creek & Molonglo Valley	11-3-felstead-vista-denman-prospect-act-2611
46205	Townhouse	2021-08-16	Auction	2021-10-09	Undisclosed	3	2	2	6.0	0.0	Luton Weston Creek & Molonglo Valley	19-18-sellbach-street-weston-act-2611
46206	House	2021-08-16	Auction	2021-09-17	$795,000	3	2	1		62.5	Ray White Goulburn	355-covan-creek-road-goulburn-nsw-2580
46208	House	2021-08-16	$1,399,000	2021-12-22	$1,399,000	4	3	3		996.0	Hallmark Real Estate Advisors	217-hector-mcwilliam-drive-tuross-head-nsw-2537
46211	AcreageSemi-rural	2021-08-16	1,350,000	2021-10-30	$1,300,000	3	2	2		25.0	Fraser-Gray Real Estate	588-larrys-mountain-road-moruya-nsw-2537
46212	House	2021-08-16	$630,000	2021-09-20	$630,000	5	3	6		961.0	Fraser-Gray Real Estate	5-gundary-street-moruya-nsw-2537
46213	House	2021-08-16	Contact Agent	2022-01-18	$870,000	4	2	4		590.0	Fraser-Gray Real Estate	86-heath-street-broulee-nsw-2537
46216	House	2021-08-16	$765,000	2021-09-27	$785,000	3	1	2		909.0	Fraser-Gray Real Estate	4-broulee-road-broulee-nsw-2537
46217	House	2021-08-16	$665,000	2022-01-14	$655,000	2	1	2		601.0	Fraser-Gray Real Estate	6-manly-street-tuross-head-nsw-2537
46218	House	2021-08-16	$1,300,000	2021-11-26	$1,200,000	4	2	6		3244.0	Fraser-Gray Real Estate	283-north-head-drive-moruya-nsw-2537
46219	House	2021-08-16	$826,000	2021-09-18	$826,000	5	2	4		604.0	My Agent Christine Ewin	14-peter-crescent-batehaven-nsw-2536
46220	House	2021-08-16	$699,000	2021-09-30	$675,000	4	2	1		847.0	LJ Hooker Batemans Bay	8-sunset-street-surfside-nsw-2536
46221	Apartment	2021-08-16	Offers over $399,000	2021-11-11	$425,000	1	1	1	6.0		Luton Manuka	409-1-elouera-street-braddon-act-2612
46223	House	2021-08-16	AUCTION	2021-09-09	$645,000	3	1	3		405.0	Ray White Goulburn	139-goldsmith-street-goulburn-nsw-2580
46224	Unit	2021-08-13	$280,000	2021-09-07	$280,000	2	1	1			LJ Hooker Queanbeyan – Jerrabomberra – Googong	2-67-derrima-road-queanbeyan-nsw-2620
46227	Townhouse	2021-08-12	$475,000	2021-09-06	$475,000	2	1	1			LJ Hooker Queanbeyan – Jerrabomberra – Googong	4-10-nimmitabel-street-queanbeyan-nsw-2620
46248	House	2021-08-16	$2,750,000	2021-11-18	$2,750,000	4	3	4		1.8	LJ Hooker Tuross Head	13-bass-ridge-tuross-head-nsw-2537
46253	House	2021-08-16	AUCTION	2021-09-09	$685,000	3	1	1		937.8	Ray White Goulburn	215-cowper-street-goulburn-nsw-2580
46257	House	2021-08-17	$975,000	2021-09-15	Undisclosed	4	1	5		3067.0	Tarago Real Estate	1-nicole-place-goulburn-nsw-2580
46265	Apartment	2021-08-17	$435,000+	2022-01-27	Undisclosed	1	1	1	0.0	702.0	Clover Canberra	28-de-burgh-street-lyneham-act-2602
46266	House	2021-08-17	Auction 08/10/2021	2021-10-08	$852,000	3	2	2	4.0	450.0	Ray White Canberra	11-polwarth-circuit-dunlop-act-2615
46269	Apartment	2021-08-17	$385,000	2021-10-01	Undisclosed	2	1	2	6.0		Ray White Canberra	45-16-david-miller-crescent-casey-act-2913
46273	Apartment	2021-08-17	Forthcoming Auction	2021-10-18	$440,000	2	2	2	6.0		Luton Gungahlin	39-77-gozzard-street-gungahlin-act-2912
46274	House	2021-08-17	$1,295,000	2021-09-28	$1,295,000	4	2	6		1.4	LJ Hooker Batemans Bay	8-barrakee-drive-long-beach-nsw-2536
46279	Townhouse	2021-08-18	Auction	2021-09-13	$870,000	3	2	2	0.5		Luton Manuka	34-1-wilkins-street-mawson-act-2607
46282	Unit	2021-08-18	$1,050,000	2021-10-29	Undisclosed	3	3	2	5.5	0.0	Luton Manuka	15-10-macpherson-street-oconnor-act-2602
46283	Townhouse	2021-08-18	Auction	2021-09-09	Undisclosed	2	1	1	3.5	0.0	Luton Manuka	8-14-marr-street-pearce-act-2607
46284	Townhouse	2021-08-18	Auction 14/10/2021	2021-10-14	$795,000	4	2	2	5.0		Ray White Canberra	5-4-lind-close-fraser-act-2615
46285	House	2021-08-18	Expressions of Interest	2021-09-21	Undisclosed	4	2	3		14164.0	Belle Property Braidwood	13-naughtons-close-braidwood-nsw-2622
46288	House	2021-08-18	Auction 30/09/21	2021-09-30	$1,505,000	5	3	2	2.5	992.0	Ray White Canberra	14-orourke-street-weetangera-act-2614
46289	Townhouse	2021-08-18	Auction 16/09/2021	2021-09-16	Undisclosed	3	2	1	1.5	0.0	Ray White Canberra	5-31-barlow-street-scullin-act-2614
46290	Townhouse	2021-08-18	Forthcoming Auction	2021-09-14	$806,000	3	3	2	6.0		Carter and Co Agents	8-paisley-street-nicholls-act-2913
46299	House	2021-08-18	Price Range $660,000-$680,000	2021-10-11	$700,500	3	2	6		1679.0	LJ Hooker Batemans Bay	7a-palana-street-surfside-nsw-2536
46306	House	2021-08-19	$1,100,000	2021-09-02	$1,100,000	4	2	2	3.0	560.0	McGrath Canberra	13-auburn-street-amaroo-act-2914
46309	House	2021-08-19	Auction Sat, 4th Sep at 11:00am	2021-09-04	$1,035,000	4	2	2	4.0	454.0	LJ Hooker Gungahlin	28-marie-dalley-street-gungahlin-act-2912
46310	Apartment	2021-08-19	$800,000 +	2021-11-08	Undisclosed	4	2	2	4.5		LJ Hooker Tuggeranong	greenway-2900-act
46312	Apartment	2021-08-19	$270,000	2021-09-15	$276,000	2	1	1	3.5		McIntyre Property	3-32-springvale-drive-hawker-act-2614
46313	House	2021-08-19	Forthcoming Auction	2021-09-08	Undisclosed	4	2	2	4.0	814.0	Ray White Canberra	73-templestowe-avenue-conder-act-2906
46316	House	2021-08-19	AUCTION	2021-09-16	$530,000	4	1	3		1008.0	Ray White Goulburn	59-eleanor-street-goulburn-nsw-2580
46317	Unit	2021-08-19	$449,000	2021-09-14	$449,000	1	1	1	6.0		Luton Manuka	55-2-edinburgh-avenue-city-act-2601
46327	Land	2021-08-19	Auction	2021-09-15	$781,500	0	0	0		801.0	Henley Property - Jindabyne	18-alpensee-weg-east-jindabyne-nsw-2627
46328	Alpine	2021-08-19	Auction price guide $550,000 to $595,000	2021-09-16	$580,000	2	1	2			Henley Property - Jindabyne	14-28-park-road-jindabyne-nsw-2627
46331	House	2021-08-20	Expressions of Interest	2021-11-23	$900,000	4	1	2			Sadil Quinlan	3-guy-street-batemans-bay-nsw-2536
46334	House	2021-08-20	Forthcoming Auction	2021-09-02	$945,000	4	2	2	6.0	475.0	LJ Hooker Gungahlin	12-don-bell-street-bonner-act-2914
46336	Unit	2021-08-20	$475,000	2021-09-02	$515,000	2	1	1			Ray White Batemans Bay	5-58-smith-street-broulee-nsw-2537
46338	House	2021-08-20	Auction	2021-10-04	Undisclosed	5	2	2	2.0	1144.0	Luton Tuggeranong	56-oconnor-circuit-calwell-act-2905
46339	Lifestyle	2021-08-20	$1,250,000	2021-12-08	$1,200,000	3	1	3		104.0	Belle Property Braidwood	60-grey-gums-road-majors-creek-nsw-2622
46343	Townhouse	2021-08-20	$685,000	2021-09-06	$685,000	3	2	2	6.0	225.0	Ray White Canberra	7-abdullah-street-bonner-act-2914
46349	House	2021-08-20	Please Call	2021-09-30	Undisclosed	4	3	2		12.6	Bella Coastal Property	9-casuarina-close-burrill-lake-nsw-2539
46351	AcreageSemi-rural	2021-08-21	Contact Agent	2022-01-19	Undisclosed	4	3	6	0.0	9.96	All Real Estate NSW	134-bingley-way-wamboin-nsw-2620
46352	House	2021-08-21	Forthcoming Auction	2021-09-01	Undisclosed	4	2	2	4.0	754.0	Ray White Canberra	18-blackbutt-street-oconnor-act-2602
46353	House	2021-08-22	$949,000	2021-09-10	$949,000	4	2	2		1300.0	Sails Real Estate	116-pacific-way-tura-beach-nsw-2548
46356	House	2021-08-23	Forthcoming Auction	2021-09-28	$850,000	3	2	2	3.0	466.0	LJ Hooker Gungahlin	59-ferguson-circuit-ngunnawal-act-2913
46357	House	2021-08-23	$825,000+	2021-09-02	$850,000	3	2	2	6.0	420.0	LJ Hooker Gungahlin	11-lumsdaine-street-moncrieff-act-2914
46361	Unit	2021-08-23	$209,000	2021-09-03	$209,000	1	1	1			LJ Hooker Queanbeyan – Jerrabomberra – Googong	18-104-henderson-road-crestwood-nsw-2620
46367	House	2021-08-23	Auction 9th October 2021 at 11am Online	2021-09-01	$870,000	3	2	1		415.0	LJ Hooker Moruya	16-constable-street-moruya-heads-nsw-2537
46368	House	2021-08-23	Auction	2021-09-04	$705,000	3	1	1	5.5	240.0	Luton Dickson	9-maclurcan-street-franklin-act-2913
46370	Alpine	2021-08-23	Auction	2021-09-23	Undisclosed	3	3	0			Henley Property - Jindabyne	11-mountain-drive-thredbo-nsw-2625
46371	House	2021-08-23	Auction	2021-09-07	$600,000	4	1	3			Ray White Goulburn	11-marsden-street-goulburn-nsw-2580
46372	Land	2021-08-23	$399,000	2021-11-05	$380,000	0	0	0		1339.0	LJ Hooker Batemans Bay	7b-palana-street-surfside-nsw-2536
46374	House	2021-08-23	$510,000	2021-11-09	$500,000	4	2	2			One Agency Craig Schofield	49-maclean-street-numeralla-nsw-2630
46376	Unit	2021-08-23	Forthcoming Auction	2021-09-22	$250,000	1	1	0	3.51	0.0	Wright Dunn Real Estate	3-127-madigan-street-hackett-act-2602
46379	House	2021-08-23		2021-10-05	Undisclosed	4	2	2		1734.0	Tathra Beach Real Estate	30-thompson-drive-tathra-nsw-2550
46380	Apartment	2021-08-23	AUCTION	2021-09-22	$472,500	1	1	1			Henley Property - Jindabyne	7-3-kurrajong-street-jindabyne-nsw-2627
46384	House	2021-08-24	$699,000	2021-09-21	$695,000	3	1	1		556.0	LJ Hooker Tuross Head	20-bondi-street-tuross-head-nsw-2537
46386	House	2021-08-24	Offers Invited	2022-01-27	$1,025,000	4	2	1		1591.0	Ray White Goulburn	45-eldon-street-goulburn-nsw-2580
46399	Land	2021-08-24	$380,000	2021-09-03	$420,000	0	0	0		1000.0	LJ Hooker Narooma	7-johnston-way-mystery-bay-nsw-2546
46406	Cropping	2021-08-24	EOI	2021-12-13	Undisclosed	0	0	0		12343.0	LAWD	walgett-2832-nsw
46409	House	2021-08-25	Auction 29/09/2021	2021-09-29	$668,000	3	1	1	4.5	492.0	Ray White Canberra	7-herring-place-macgregor-act-2615
46413	House	2021-08-25	Online Auction	2021-09-09	$802,000	3	1	2		604.0	Ray White Queanbeyan | Jerrabomberra	14-carwoola-place-queanbeyan-nsw-2620
46418	Townhouse	2021-08-25	$1,000,000 plus	2021-10-22	$1,005,000	3	2	2	5.0		Maloney's Property	14-64-wattle-street-lyneham-act-2602
46420	House	2021-08-25	$489,000	2021-09-16	$485,000	3	1	1		632.0	Ray White Goulburn	39-mary-street-goulburn-nsw-2580
46421	House	2021-08-25	Auction 07/10/2021	2021-10-07	$1,200,000	5	2	2	1.5	762.0	Ray White Canberra	7-linger-place-melba-act-2615
46422	House	2021-08-25	Online Auction - Inspections by appointment	2021-09-23	$703,000	3	1	2	0.0	612.0	LJ Hooker Belconnen	5-weaver-place-charnwood-act-2615
46423	House	2021-08-25	Contact Agent	2021-09-10	Undisclosed	4	2	2	4.0	0.0	home.by holly	45-campbell-street-ainslie-act-2602
46427	House	2021-08-25	Auction Sat, 4th Sep at 12:00pm	2021-09-04	$831,000	3	2	1	4.5	342.0	LJ Hooker Gungahlin	7-leita-court-ngunnawal-act-2913
46428	Apartment	2021-08-25	By Negotiation	2021-11-02	Undisclosed	3	2	2	6.0		Ray White Canberra	101-85-eyre-street-kingston-act-2604
46429	House	2021-08-25	Auction 15/10/2021	2021-10-15	$865,000	4	2	0	3.5	725.0	Ray White Canberra	30-nicholas-street-higgins-act-2615
46434	Unit	2021-08-25	$385,000	2021-10-21	Undisclosed	2	1	2	6.0		Ray White Canberra	35-16-david-miller-crescent-casey-act-2913
46435	House	2021-08-25	$750,000 - $800,000	2021-09-16	$805,000	3	1	3	0.0	0.0	McGrath Canberra	1a-hazelwood-street-queanbeyan-nsw-2620
46439	Unit	2021-08-25	$729,000	2021-09-15	$729,000	3	2	2			Elders Real Estate Batemans Bay	7-2a-graydon-avenue-denhams-beach-nsw-2536
46442	House	2021-08-26	Auction 06/10/2021	2021-10-06	$1,730,000	5	3	3	2.5	1562.0	Ray White Canberra	27-liverpool-street-macquarie-act-2614
46445	Lifestyle	2021-08-26	$499,000	2021-12-09	$490,000	0	0	0			Ray White Goulburn	498-strathaird-lane-taralga-nsw-2580
46448	House	2021-08-26	Auction 21/09/2021	2021-09-21	Undisclosed	3	1	2	0.5	963.0	Ray White Canberra	8-shannon-circuit-kaleen-act-2617
46450	House	2021-08-26	$1,200,000+	2021-08-31	Undisclosed	5	2	8	1.0	1071.0	LJ Hooker Kaleen	45-belconnen-way-weetangera-act-2614
46457	Unit	2021-08-26	$420,000+	2021-09-21	$470,000	2	1	1	6.0		LJ Hooker Tuggeranong	49-120-thynne-street-bruce-act-2617
46460	House	2021-08-26	EOI	2022-01-13	$550,000	3	1	0		1056.0	Sadil Quinlan	44-high-street-batemans-bay-nsw-2536
46461	House	2021-08-26	EOI	2021-12-24	$550,000	3	1	0		936.0	Sadil Quinlan	46-high-street-batemans-bay-nsw-2536
46463	House	2021-08-26	Auction 01/10/2021	2021-09-30	Undisclosed	4	2	3	1.0	879.0	Ray White Canberra	12-callabonna-street-kaleen-act-2617
46467	House	2021-08-26	Forthcoming Auction	2021-09-03	Undisclosed	3	1	2	1.5	697.0	Ray White Canberra	15-bucknel-circuit-isabella-plains-act-2905
46468	Townhouse	2021-08-26	Offers above $679,000	2021-11-11	$690,000	3	2	2	6.0	3353.0	New Door Properties	10-101-okeefe-avenue-moncrieff-act-2914
46469	Apartment	2021-08-26	$300,000	2021-10-20	$300,000	1	1	1	6.0		New Door Properties	54-1-gungahlin-place-gungahlin-act-2912
46479	Apartment	2021-08-27	$385,000	2021-09-14	$385,000	1	1	1	6.0		home.by holly	132-14-boolee-street-reid-act-2612
46482	House	2021-08-27	Auction	2021-09-27	$840,000	4	3	2			Ray White Batemans Bay	10a-dell-parade-moruya-heads-nsw-2537
46488	House	2021-08-27	680000- 720000	2021-09-10	$700,000	2	1	2		1011.0	Ray White Bungendore	26-osborne-street-bungendore-nsw-2621
46489	House	2021-08-27	Forthcoming Auction	2021-10-26	$1,220,000	4	3	2	4.0	390.0	Confidence Real Estate	24b-castlereagh-crescent-macquarie-act-2614
46492	House	2021-08-27	$790,000	2021-09-24	$790,000	4	2	0		790.0	My Agent Christine Ewin	101-palana-street-surfside-nsw-2536
46494	House	2021-08-27	Auction	2021-10-31	$830,000	4	1	4		2934.0	Ray White Batemans Bay	15-francis-street-moruya-nsw-2537
46502	Lifestyle	2021-08-29	$2,250,000	2021-09-20	Undisclosed	4	2	6		40.0	Guy Higgins Property Sales	131-hunters-road-wapengo-nsw-2550
46503	House	2021-08-29	Offers over $615,000	2021-09-20	Undisclosed	4	2	4		1024.0	Guy Higgins Property Sales	1-glen-mia-drive-bega-nsw-2550
46504	Lifestyle	2021-08-29	Under Offer	2021-11-29	Undisclosed	3	2	2		44.1	Ray White Braidwood	21-rose-valley-road-wog-wog-nsw-2622
46508	House	2021-08-30	Auction	2021-09-18	Undisclosed	4	2	2	0.0	880.0	Luton Dickson	25-cunningham-street-karabar-nsw-2620
46513	House	2021-08-30	Expressions of Interest	2021-09-15	$2,100,000	4	2	1		563.0	LJ Hooker Batemans Bay	52-iluka-avenue-malua-bay-nsw-2536
46514	Cropping	2021-08-30	EOI	2022-01-24	Undisclosed	0	0	0		22386.0	LAWD	corinella-group-portfolio-victoria-south-australia-lake-bolac-vic-3351
46515	House	2021-08-30	$789,000	2021-09-07	$825,000	4	1	3		835.0	LJ Hooker Malua Bay	5-connells-close-mossy-point-nsw-2537
46516	House	2021-08-30	$795,000 - $810,000	2021-09-29	$810,000	4	1	4		1022.0	Ray White Bungendore	3-hopkins-street-bungendore-nsw-2621
46517	House	2021-08-30	Online Auction	2021-09-14	$845,000	3	1	1		588.0	Ray White Queanbeyan | Jerrabomberra	18-morton-street-queanbeyan-nsw-2620
46523	House	2021-08-30	On-Line Auction	2021-09-23	$947,500	4	2	4		810.0	Ray White Rural Canberra | Yass	45-middle-st-murrumbateman-nsw-2582
46531	House	2021-08-30	940000 - 970000	2021-09-21	$985,000	4	2	2		959.0	Ray White Bungendore	12-mckay-drive-bungendore-nsw-2621
46532	Apartment	2021-08-30	$414,900	2021-11-08	$414,900	1	1	1	6.0	0.0	Independent Projects	504-480-northbourne-avenue-dickson-act-2602
46533	Apartment	2021-08-30	$664,900	2022-01-20	$664,900	2	2	1	6.0	0.0	Independent Projects	703-480-northbourne-avenue-dickson-act-2602
46537	House	2021-08-31	By Negotiation	2021-09-20	$760,000	3	2	2	4.5	448.0	LJ Hooker Kippax	7-higham-place-dunlop-act-2615
46539	House	2021-08-31	By Negotiation	2021-09-24	Undisclosed	4	2	1	1.0	916.0	McIntyre Property	5-peppin-place-charnwood-act-2615
46541	House	2021-08-31	Online Auction	2021-09-16	$520,000	3	1	4		689.0	Ray White Goulburn	10-duke-street-goulburn-nsw-2580
46542	Townhouse	2021-08-31	$639,000 - $679,000	2021-09-27	$660,000	3	2	2			Ian McNamee & Partners - Queanbeyan	3-110-henderson-road-crestwood-nsw-2620
46550	Apartment	2021-08-31	$375,000	2021-10-13	$375,000	1	1	1	0.0	0.0	Ian McNamee & Partners - Queanbeyan	wellsvale-drive-googong-nsw-2620
46553	House	2021-08-31	$720,000 to $750,000	2022-01-14	$730,000	3	2	2		660.0	LJ Hooker Batemans Bay	16-gould-street-tuross-head-nsw-2537
46561	DuplexSemi-detached	2021-08-31	Auction - 2nd October 10am	2021-10-02	$1,110,000	3	1	1	4.0	0.0	Cream Residential	52-carroll-street-hughes-act-2605
46563	House	2021-08-31	$429,000	2021-09-22	$420,000	3	2	1		701.9	Ray White Batemans Bay	4-park-street-mogo-nsw-2536
46569	Apartment	2021-08-31	Auction 10/09/2021	2021-09-10	$565,000	2	2	1	5.5		Bertram Ellis	18-11-fawkner-street-braddon-act-2612
46570	House	2021-08-31		2021-11-03	Undisclosed	5	2	2		682.0	Tathra Beach Real Estate	36-stafford-crescent-tathra-nsw-2550
46571	Townhouse	2021-09-01	Forthcoming auction	2021-09-18	$760,000	3	2	2	5.0		LJ Hooker Gungahlin	29-tom-nicholas-crescent-forde-act-2914
46575	House	2021-09-01	Sold at Auction: $1,077,500	2021-09-18	$1,077,500	3	2	2	6.0	437.0	McGrath Canberra	52-booroolong-street-throsby-act-2914
46581	House	2021-09-01	Auction, Tue 21st Sep at 6:00pm	2021-09-21	$1,000,000	4	2	2	6.0	537.0	LJ Hooker Gungahlin	132-ida-west-street-bonner-act-2914
46582	Townhouse	2021-09-01	Online Auction - Inspections by appointment	2021-09-25	$780,000	3	2	2	5.5	0.0	LJ Hooker Belconnen	1-95-lampard-circuit-bruce-act-2617
46586	Apartment	2021-09-01	$718,000	2022-02-23	$718,000	2	2	2	6.0	0.0	JWLand	59-currong-street-north-braddon-act-2612
46587	House	2021-09-01	Sold Prior to Auction	2021-09-23	Undisclosed	3	2	2	4.5	439.0	Bastion Property Group	31a-raymond-street-ainslie-act-2602
46588	Apartment	2021-09-01	$849,500	2021-11-16	Undisclosed	2	2	1	5.0	0.0	Luton Manuka	e6-2-currie-crescent-griffith-act-2603
46594	House	2021-09-01	$1,000,000 - $1,100,000	2021-09-10	$1,050,000	4	2	2		1800.0	My Agent Christine Ewin	28-the-ridge-road-malua-bay-nsw-2536
46596	Unit	2021-09-01	Auction	2021-10-14	$350,000	1	1	1	6.0	0.0	Ray White Canberra	65-100-henry-kendall-street-franklin-act-2913
46599	Apartment	2021-09-01	Auction, Sun 19th Sep at 11:00am	2021-09-19	$508,000	2	2	2	6.0	0.0	LJ Hooker Gungahlin	91-11-wimmera-street-harrison-act-2914
46600	House	2021-09-01	$630,000	2021-09-22	$630,000	3	1	2		601.0	My Agent Christine Ewin	94-ridge-street-catalina-nsw-2536
46603	House	2021-09-01	Forthcoming Auction	2021-09-07	Undisclosed	3	1	2	4.5	766.0	Luton Weston Creek & Molonglo Valley	12-buvelot-street-weston-act-2611
46606	BlockOfUnits	2021-09-01	VIRTUAL AUCTION	2021-09-08	$630,000	3	2	2	6.0		McIntyre Property	49-4-pearlman-street-coombs-act-2611
46607	Unit	2021-09-01	$465,000	2022-02-25	$465,900	2	2	2	6.5	0.0	Canberry Properties	285-aspen-door-925-greenway-act-2900
46613	Townhouse	2021-09-01	Auction	2021-09-25	$665,000	3	1	1	1.5	246.0	LJ Hooker Kippax	15-summerville-crescent-florey-act-2615
46615	Dairy	2021-09-01	$4,950,000	2021-09-30	Undisclosed	4	1	0		241.27	LAWD	fulham-3851-vic
46617	DuplexSemi-detached	2021-09-01	$1,195,000	2022-04-12	Undisclosed	3	2	1		430.0	Whale Coast Realty	2-30-long-point-street-potato-point-nsw-2545
46624	Unit	2021-09-01	$292,000	2021-10-20	$292,000	2	1	1			LJ Hooker Queanbeyan – Jerrabomberra – Googong	9-102-henderson-road-crestwood-nsw-2620
46627	Land	2021-09-01	$695,000	2021-10-29	$695,000	0	0	0	0.0	708.0	New Door Properties	40-mcglashan-street-taylor-act-2913
46628	Apartment	2021-09-01	$399,900	2021-09-27	$389,900	1	1	1	5.0	0.0	Independent Projects	480-northbourne-avenue-dickson-act-2602
46629	House	2021-09-01	Auction	2021-09-24	$725,000	4	2	2		858.0	Ray White Goulburn	18-edward-street-goulburn-nsw-2580
46632	DuplexSemi-detached	2021-09-01	Auction	2021-09-29	$1,120,000	3	1	2	5.5	644.1	LJ Hooker Dickson	23-mouat-street-lyneham-act-2602
46634	Horticulture	2021-09-01	EOI	2023-02-09	Undisclosed	0	0	0		3793.0	LAWD	5449-gregory-highway-emerald-qld-4720
46636	House	2021-09-02	Auction	2021-09-10	$742,000	3	2	3	2.0	444.0	Luton Tuggeranong	24-lort-place-chisholm-act-2905
46637	Apartment	2021-09-02	UNDER OFFER	2021-09-17	$400,000	2	1	1	2.0	0.0	Agent Team Belconnen	12-48-dalley-crescent-latham-act-2615
46638	Apartment	2021-09-02	$285,000+	2021-10-12	$300,000	1	1	1	3.5		Luton Gungahlin	29-58-bennelong-crescent-macquarie-act-2614
46639	Townhouse	2021-09-02	Auction	2021-10-02	$800,000	3	2	2	6.0		Luton Gungahlin	7-35-laird-crescent-forde-act-2914
46640	House	2021-09-02	Auction	2021-09-30	Undisclosed	4	3	2	3.0	840.0	Luton Weston Creek & Molonglo Valley	54-julia-flynn-avenue-isaacs-act-2607
46641	Townhouse	2021-09-02	Auction	2021-09-24	Undisclosed	4	2	2	0.5	0.0	Luton Weston Creek & Molonglo Valley	7-32-clamp-place-greenway-act-2900
46642	House	2021-09-02	Online Auction	2021-09-17	$1,420,000	4	2	2		809.0	Ian McNamee & Partners - Queanbeyan	43-woodhill-link-jerrabomberra-nsw-2619
46643	House	2021-09-02	Auction	2021-09-25	$631,000	3	2	1		886.0	Henley Property - Cooma	51-oliver-street-berridale-nsw-2628
46645	House	2021-09-02	Auction	2021-10-09	$1,383,500	5	2	2	3.0	886.0	Timothy Road	15-barber-crescent-flynn-act-2615
46647	House	2021-09-02	$900,000 - $950,000	2021-09-10	$955,000	4	2	2		992.0	My Agent Christine Ewin	9-bunderra-circuit-malua-bay-nsw-2536
46648	House	2021-09-02	Auction	2021-09-25	Undisclosed	3	1	1	4.0		Luton Dickson	27-piddington-street-watson-act-2602
46654	House	2021-09-02	$2,440,000	2021-09-25	$2,440,000	4	2	2	6.0	0.0	home.by holly	24-raymond-street-ainslie-act-2602
46661	House	2021-09-02	AUCTION	2021-09-21	$805,000	5	3	3		661.0	Elders Real Estate Batemans Bay	42-cook-avenue-surf-beach-nsw-2536
46664	Apartment	2021-09-02	$509,000+	2021-11-24	Undisclosed	2	2	1	6.0		Civium Property Group - Residential	2003-120-eastern-valley-way-belconnen-act-2617
46668	House	2021-09-02	SOLD FOR $731,000	2021-09-25	$731,000	3	1	1	4.0		McGrath Canberra	14-anna-morgan-circuit-bonner-act-2914
46669	Apartment	2021-09-02	Offers over $380,000	2021-09-08	$410,000	1	1	1	6.0		Independent Gungahlin	86-121-easty-street-phillip-act-2606
46670	Apartment	2021-09-02	$530,000	2021-09-24	$530,000	2	2	1	6.0		home.by holly	20-47-abena-avenue-crace-act-2911
46673	House	2021-09-02	Auction	2021-09-20	$855,000	4	2	2		1406.0	Ray White Goulburn	26-faithfull-street-goulburn-nsw-2580
46674	House	2021-09-02	Auction	2021-09-18	$791,000	3	2	2	4.0	575.0	Luton Kippax	46-shrivell-circuit-dunlop-act-2615
46675	House	2021-09-02	Auction	2021-09-11	$770,000	3	1	2	2.5	978.0	Luton Kippax	2-bloxham-street-charnwood-act-2615
46677	House	2021-09-02	FORTHCOMING AUCTION	2021-09-07	$1,107,000	4	2	2	2.5	1144.0	Solely Properties	14-garrick-street-fadden-act-2904
46682	House	2021-09-03	$770,000 - $820,000	2021-09-25	$815,000	3	1	4			McGrath Canberra	13-monk-place-queanbeyan-nsw-2620
46685	House	2021-09-03	Auction	2021-09-24	Undisclosed	4	1	2	1.0		Timothy Road	26-kootingal-street-giralang-act-2617
46686	House	2021-09-03	Forthcoming Auction	2021-09-15	Undisclosed	5	3	3	3.5	963.0	LJ Hooker Tuggeranong	10-fisk-street-monash-act-2904
46690	House	2021-09-03	Online Auction	2021-09-18	$850,000	4	2	2	4.0	538.0	LJ Hooker Belconnen	58-branson-street-dunlop-act-2615
46692	House	2021-09-03		2021-09-10	Undisclosed	3	2	1		726.0	Hallmark Real Estate Advisors	16-anderson-avenue-tuross-head-nsw-2537
46700	Townhouse	2021-09-03	$700,000 - $750,000	2021-09-15	Undisclosed	3	2	2			McGrath Canberra	1-7-9-blackall-avenue-queanbeyan-nsw-2620
46701	House	2021-09-03	$1,136,000	2021-09-18	$1,136,000	4	3	2	5.0	540.0	Bastion Property Group	43-mummery-terrace-moncrieff-act-2914
46705	House	2021-09-03	Auction 01/10/2021	2021-10-01	$1,090,000	4	2	1	2.5	708.0	Ray White Canberra	8-pasmore-close-kaleen-act-2617
46706	House	2021-09-03	Sold Prior Auction $905,000	2021-11-01	$905,000	3	3	4	3.0	761.0	New Door Properties	18-wedgwood-close-chisholm-act-2905
46708	Land	2021-09-03		2021-10-01	Undisclosed	0	0	0		558.0	Tathra Beach Real Estate	21-bayview-drive-tathra-nsw-2550
46711	House	2021-09-03	SOLD $1,007,000	2021-09-23	$1,007,000	4	2	2	4.5	443.0	Blackshaw Gungahlin	37-cultivation-street-harrison-act-2914
46715	House	2021-09-03	$2,001,000	2021-10-02	$2,001,000	4	2	2	2.0	0.0	home.by holly	28-bragg-street-hackett-act-2602
46723	House	2021-09-03	Auction 24/09/2021	2021-09-24	Undisclosed	3	1	1	4.0	428.0	Ray White Canberra	13a-badgery-street-macquarie-act-2614
46724	Unit	2021-09-03	Auction	2021-10-31	$365,000	2	1	1			Ray White Batemans Bay	1-384-388-beach-road-batehaven-nsw-2536
46725	House	2021-09-03	Price Guide $1,130,000 to $1,195,000	2021-11-11	$1,120,000	4	3	3		830.0	Ray White Batemans Bay	1-batman-place-sunshine-bay-nsw-2536
46726	Townhouse	2021-09-03	Auction	2021-09-22	$753,000	2	1	1	1.0	282.0	Michael Potter Real Estate	29-mcnamara-street-pearce-act-2607
46727	Land	2021-09-04	$265,000	2021-10-26	$265,000	0	0	0		1480.0	McCann Properties	lot-219-green-avenue-gunning-nsw-2581
46728	Townhouse	2021-09-04	$1,190,000	2021-12-23	$1,190,000	3	2	2		312.0	Sails Real Estate	29-1-elizabeth-street-merimbula-nsw-2548
46729	Land	2021-09-04	$279,000	2021-10-26	$279,000	0	0	0		1036.0	McCann Properties	lot-225-green-avenue-gunning-nsw-2581
46730	Land	2021-09-04	$245,000	2021-10-27	$245,000	0	0	0		1008.0	McCann Properties	lot-216-green-avenue-gunning-nsw-2581
46731	House	2021-09-04	Auction	2021-09-10	$1,100,000	4	2	2	4.5	455.0	Luton Gungahlin	23-brumby-street-harrison-act-2914
46732	Land	2021-09-04	Price Guide $500,000	2021-10-06	$490,000	0	0	0		5000.0	Sails Real Estate	65b-oaklands-road-pambula-nsw-2549
46734	Townhouse	2021-09-04	$1,160,000	2021-10-05	Undisclosed	3	3	2	6.0	8207.0	Independent Projects	2-2-torrens-street-braddon-act-2612
46735	House	2021-09-04	Auction	2021-09-22	Undisclosed	3	1	3	2.5	412.0	Timothy Road	8-samuels-crescent-ngunnawal-act-2913
46736	House	2021-09-04	AUCTION	2021-09-29	$1,475,000	6	3	5		1002.0	Henley Property - Jindabyne	89-gippsland-street-jindabyne-nsw-2627
46737	Townhouse	2021-09-04	Auction	2021-09-29	$1,220,000	3	2	2			Henley Property - Jindabyne	2-2-cobbodah-street-jindabyne-nsw-2627
46739	AcreageSemi-rural	2021-09-04	AUCTION	2021-10-06	$2,015,000	3	2	3		2.0	Henley Property - Jindabyne	19-ponderosa-lane-jindabyne-nsw-2627
46743	Townhouse	2021-09-06	Online Auction	2021-09-18	$600,000	3	1	1	4.5	0.0	LJ Hooker Belconnen	15-17-31-margaret-tucker-street-bonner-act-2914
46744	House	2021-09-06	By Negotiation	2021-09-13	Undisclosed	4	4	2		626.0	Bella Coastal Property	22-harrington-crescent-bawley-point-nsw-2539
46745	House	2021-09-06	Online Auction	2021-09-28	$1,150,000	3	1	0	2.5	725.0	LJ Hooker Belconnen	22-cadell-street-downer-act-2602
46753	House	2021-09-06	$729,000	2021-10-20	Undisclosed	3	1	1	3.0	467.0	McIntyre Property	27-abercrombie-circuit-banks-act-2906
46758	House	2021-09-06	AUCTION	2021-10-09	$1,515,500	5	2	2		696.0	LJ Hooker Malua Bay	19-king-street-malua-bay-nsw-2536
46759	Townhouse	2021-09-06	Price On Request	2021-09-23	Undisclosed	1	1	1	6.0		Bastion Property Group	6-3-hay-street-oconnor-act-2602
46760	Land	2021-09-06	Price On Request	2021-09-25	Undisclosed	0	0	0		732.0	Bastion Property Group	2-neville-gare-street-wright-act-2611
46763	House	2021-09-06	$915,000	2021-10-14	$915,000	3	2	1		974.0	Hallmark Real Estate Advisors	50-jutland-avenue-tuross-head-nsw-2537
46771	House	2021-09-06	AUCTION DATE MOVED FORWARD TO 30/9	2021-09-30	$703,000	3	2	3		556.0	LJ Hooker Malua Bay	15-yarralumla-crescent-tomakin-nsw-2537
46775	House	2021-09-06	625,000+	2021-10-01	Undisclosed	3	1	2	5.5	0.0	Ivan Tasic - Edge Real Estate	15-dolan-close-gordon-act-2906
46776	House	2021-09-06	$899,000	2021-11-22	Undisclosed	4	2	2		477.0	Luton Dickson	jerrabomberra-2619-nsw
46777	House	2021-09-06	$933,500	2021-09-13	$933,500	3	2	2		920.0	LJ Hooker Queanbeyan – Jerrabomberra – Googong	31-kinlyside-avenue-jerrabomberra-nsw-2619
46779	Apartment	2021-09-06	$330,000+	2021-11-11	$337,500	1	1	0	6.0		Ray White Canberra	613-15-bowes-street-phillip-act-2606
46782	House	2021-09-06	$595,000 - 635,000	2021-11-01	$620,000	3	2	1		538.0	Ray White Goulburn	26-lagoon-street-goulburn-nsw-2580
46784	Unit	2021-09-06	$586,000	2022-01-21	$586,000	2	2	2	6.0		McGrath Canberra	901-6-gribble-street-gungahlin-act-2912
46791	House	2021-09-07	Auction	2021-10-02	$1,472,000	4	2	2	4.0	603.0	Independent Gungahlin	16-hogg-street-casey-act-2913
46792	House	2021-09-07	Auction 01/10/2021	2021-10-01	$925,000	3	2	2	3.0	1053.0	Ray White Canberra	7-connor-place-kambah-act-2902
46793	Townhouse	2021-09-07	VIRTUAL AUCTION	2021-09-27	$590,000	3	1	1	1.5	336.0	McIntyre Property	12-7-sommers-street-conder-act-2906
46795	Apartment	2021-09-07	$300,000+	2021-11-17	$295,000	2	1	1	5.5		McIntyre Property	4-8-corinna-street-lyons-act-2606
46797	Apartment	2021-09-07	359,000+	2021-10-08	Undisclosed	1	1	1	6.0		LJ Hooker Canberra City	41-162-flemington-road-harrison-act-2914
46801	House	2021-09-07	Contact Agent	2021-09-23	Undisclosed	4	2	2	1.5	891.0	home.by holly	154-namatjira-drive-chapman-act-2611
46803	House	2021-09-07	$880,000 - $940,000	2021-10-01	$950,000	3	1	3			LJ Hooker Gungahlin	yass-2582-nsw
46805	Townhouse	2021-09-07	Auction	2021-09-22	$730,500	2	1	1	2.0		Badenoch Real Estate	22-16-sexton-street-cook-act-2614
46806	House	2021-09-07	$790,000 to $820,000	2021-10-14	$800,000	3	2	2			Sails Real Estate	7a-banksia-court-tura-beach-nsw-2548
46807	House	2021-09-07	$439,000	2021-10-27	$450,000	3	1	1		2264.0	One Agency Craig Schofield	45-culey-avenue-cooma-nsw-2630
46809	House	2021-09-07	Price Guide $1,395,000 - $1,495,000	2021-09-22	$1,476,000	4	3	2		2803.0	Raine & Horne Southern Highlands	30-argyle-street-moss-vale-nsw-2577
46810	Townhouse	2021-09-07	$575,000+	2021-10-07	$565,000	3	1	2	3.5	217.0	The Real Estate Guy	14-146-ellerston-avenue-isabella-plains-act-2905
46811	House	2021-09-07	Price Guide $1,395,000 - $1,495,000	2021-09-21	Undisclosed	3	1	1		2359.0	Raine & Horne Southern Highlands	21-valetta-street-moss-vale-nsw-2577
46813	Apartment	2021-09-07	$400,000 +	2021-10-25	$424,000	2	2	1	6.0		Maloney's Property	109-38-gozzard-street-gungahlin-act-2912
46816	Townhouse	2021-09-07	Auction 30/09/2021	2021-09-30	$608,500	3	1	1	2.0	0.0	Ray White Canberra	2-93-chewings-street-scullin-act-2614
46825	House	2021-09-07	$875,000 to $925,000	2022-01-17	$925,000	3	2	2			Sails Real Estate	1-7-jacaranda-place-merimbula-nsw-2548
46826	House	2021-09-07	$875,000 to $925,000	2022-04-01	$920,000	3	2	2			Sails Real Estate	2-7-jacaranda-place-merimbula-nsw-2548
46827	Apartment	2021-09-07	Auction 29/09/2021	2021-09-29	$355,000	2	1	1	1.0	0.0	Ray White Canberra	69-4-wilkins-street-mawson-act-2607
46828	Apartment	2021-09-07	Offers Above $330,000	2021-10-22	$345,000	1	1	1	6.0		Canberry Properties	43-77-gozzard-street-gungahlin-act-2912
46829	Apartment	2021-09-07	$490,000	2021-10-15	Undisclosed	2	1	1	6.0		Ray White Canberra	181-1-mouat-street-lyneham-act-2602
46834	House	2021-09-07	$619,000 - $639,000	2021-10-01	$653,000	3	2	0		451.0	Ray White Batemans Bay	3-queen-street-moruya-nsw-2537
46836	Livestock	2021-09-08	EOI	2021-09-24	Undisclosed	6	4	0		491.0	LAWD	1859-sylvia-road-binda-nsw-2583
46838	House	2021-09-08	$2,495,000	2021-11-10	Undisclosed	5	2	2	4.5	725.0	Luton Manuka	10-nathan-street-deakin-act-2600
46839	House	2021-09-08	AUCTION	2021-09-24	$610,000	3	1	1		648.0	Ray White Goulburn	127-goldsmith-street-goulburn-nsw-2580
46840	Townhouse	2021-09-08	$860,000+	2021-10-13	$875,000	4	2	2	5.0	0.0	Luton Gungahlin	3-16-ray-ellis-crescent-forde-act-2914
46842	Livestock	2021-09-08	EOI	2021-10-06	Undisclosed	3	1	0		597.1	LAWD	146-springfield-lane-tarcutta-nsw-2652
46845	House	2021-09-08	FORTHCOMING AUCTION	2021-09-23	$805,000	4	2	2		556.0	Elders Real Estate Batemans Bay	41-deakin-parade-tomakin-nsw-2537
46847	Apartment	2021-09-08	$890,000-$920,000	2021-09-24	$880,000	3	2	2			Sails Real Estate	90-1-elizabeth-street-merimbula-nsw-2548
46849	House	2021-09-08	AUCTION	2021-11-29	$1,375,000	3	2	1		847.0	Elders Real Estate Batemans Bay	93-northcove-road-long-beach-nsw-2536
46850	Apartment	2021-09-08	$370,000	2021-11-11	$380,000	2	1	1	6.0	0.0	LJ Hooker Belconnen	61-311-flemington-road-franklin-act-2913
46852	House	2021-09-08	Auction	2021-09-22	$681,000	2	2	2	6.0		Carter and Co Agents	30a-narrambla-terrace-lawson-act-2617
46853	House	2021-09-08	Online Auction	2021-10-02	$890,000	3	1	1	1.0	929.0	LJ Hooker Belconnen	4-seccombe-place-macgregor-act-2615
46854	House	2021-09-08	Online Auction	2021-09-25	$830,500	3	2	2	6.0	500.0	LJ Hooker Belconnen	109-marchant-circuit-dunlop-act-2615
46855	House	2021-09-08	Sold at auction $1,190,000.00	2021-10-02	$1,190,000	4	2	2	4.5		McGrath Canberra	176-mabo-boulevard-bonner-act-2914
46856	House	2021-09-08	Auction	2021-10-14	$860,000	4	2	2		701.0	Ian McNamee & Partners - Queanbeyan	5-binaburra-place-karabar-nsw-2620
46857	Apartment	2021-09-08	Online Auction	2021-10-01	Undisclosed	3	2	2	6.0	0.0	Luton Weston Creek & Molonglo Valley	31-12-national-circuit-barton-act-2600
46860	Apartment	2021-09-08	$410,000+	2021-10-28	Undisclosed	1	1	1	6.0		LJ Hooker Canberra City	65-15-coranderrk-street-city-act-2601
46861	House	2021-09-08	Sold prior to auction $960,000	2021-09-17	$960,000	4	2	2	4.5		McGrath Canberra	27-keith-waller-rise-casey-act-2913
46862	House	2021-09-08	Auction	2021-10-01	$1,273,000	3	1	3	1.0	811.0	LJ Hooker Kaleen	14-warrego-circuit-kaleen-act-2617
46867	Land	2021-09-08	$395,000	2021-10-14	$387,500	0	0	0		575.0	LJ Hooker Narooma	7-wallaga-lake-road-wallaga-lake-heights-nsw-2546
46868	Land	2021-09-08	$519,000	2022-01-31	$519,000	0	0	0		594.0	LJ Hooker Narooma	37-mummaga-way-dalmeny-nsw-2546
46873	House	2021-09-08	$350,000	2021-11-22	$350,000	2	2	1			Bella Coastal Property	50-381-murramarang-road-bawley-point-nsw-2539
46874	House	2021-09-08	By Negotiation	2021-09-08	Undisclosed	4	3	2			Bella Coastal Property	39-voyager-cresent-bawley-point-nsw-2539
46876	Apartment	2021-09-08	$640,000	2021-10-15	$640,000	2	2	2	6.0		home.by holly	11-16-berrigan-crescent-oconnor-act-2602
46878	House	2021-09-08	Guide: $360,000 - $380,000	2021-10-07	$380,000	2	1	1		719.0	Henley Property - Cooma	27-nambucca-street-cooma-nsw-2630
46880	House	2021-09-09	Auction, Sat 18th Sep at 10:00am	2021-09-18	$785,000	3	2	1	5.0	505.0	LJ Hooker Gungahlin	9-bungaree-crescent-ngunnawal-act-2913
46881	House	2021-09-09	Online Auction Saturday 25th September at 1pm	2021-09-25	$876,000	4	1	2	5.0	955.0	McCann Properties	8-billson-place-wanniassa-act-2903
46882	House	2021-09-09	Online Auction Saturday 25th September at 11:30am	2021-09-25	$870,000	3	1	2	3.0	850.0	McCann Properties	28-michie-street-wanniassa-act-2903
46883	Unit	2021-09-09	$490,000 - $510,000	2021-10-08	$500,000	2	2	2			Ray White Queanbeyan | Jerrabomberra	19-13-15-morisset-street-queanbeyan-nsw-2620
46885	House	2021-09-09	Auction	2021-09-30	$904,000	3	2	2	4.5		Luton Gungahlin	47-narden-street-crace-act-2911
46886	House	2021-09-09	Expressions of Interest	2021-10-14	Undisclosed	3	1	4		7700.0	Bella Coastal Property	11-weemala-crescent-bawley-point-nsw-2539
46887	House	2021-09-09	Forthcoming Auction	2021-09-17	Undisclosed	4	2	2	6.0	371.0	Ray White Canberra	7-fullston-way-holt-act-2615
46889	House	2021-09-09	Price Guide $695,000 - $745,000	2021-09-17	$755,000	3	1	1		593.0	Raine & Horne Southern Highlands	26b-simon-place-moss-vale-nsw-2577
46890	House	2021-09-09	Forthcoming Auction	2021-09-17	Undisclosed	3	1	3	0.5	643.0	Ray White Canberra	81-pennefather-street-higgins-act-2615
46893	House	2021-09-09	Auction	2021-09-28	$845,000	4	2	2		966.0	Ian McNamee & Partners - Queanbeyan	9-nimbus-place-karabar-nsw-2620
46894	House	2021-09-09	$639,000 - $669,000	2021-10-01	$640,000	3	1	1		700.0	LJ Hooker Moruya	19-shore-street-moruya-nsw-2537
46897	House	2021-09-09	$900,000 - $950,000	2021-09-16	$960,000	4	2	2		1110.0	My Agent Christine Ewin	12-bunderra-circuit-malua-bay-nsw-2536
46905	Apartment	2021-09-09	SOLD - $485,000	2021-09-22	$485,000	2	1	1	6.0		Stone Gungahlin	3-27-ian-nicol-street-watson-act-2602
46906	Apartment	2021-09-09	$620,000+	2021-09-24	$630,000	2	2	2	6.0		Maloney's Property	14-24-ijong-street-braddon-act-2612
46908	House	2021-09-09	Auction	2021-09-27	$740,000	3	1	1	6.0		Luton Gungahlin	5-gulwan-street-ngunnawal-act-2913
46909	House	2021-09-09	$950,000	2021-09-29	$950,000	4	2	2	4.0	0.0	home.by holly	16-clarendon-street-amaroo-act-2914
46911	House	2021-09-09	$3,500,000	2021-10-12	$3,500,000	3	2	2	0.0	19.63	LJ Hooker Kippax	3071-barton-highway-murrumbateman-nsw-2582
46914	House	2021-09-09	Auction 01/10/2021	2021-10-01	Undisclosed	4	2	1	4.5	702.0	Ray White Canberra	6-muscio-place-chisholm-act-2905
46924	Apartment	2021-09-09	$405,000+	2021-09-23	$425,000	1	1	1	6.0		LJ Hooker Dickson	618-86-88-northbourne-avenue-braddon-act-2612
46925	House	2021-09-10	Auction	2021-09-22	Undisclosed	3	1	1	1.5	776.0	Timothy Road	31-levine-street-evatt-act-2617
46926	House	2021-09-10	Auction	2021-09-16	Undisclosed	3	1	1	5.0		Luton Manuka	23-wyselaskie-circuit-kambah-act-2902
46927	House	2021-09-10	Auction 29/09/2021	2021-09-29	Undisclosed	4	2	2	1.0	864.0	Ray White Canberra	161-osburn-drive-macgregor-act-2615
46929	House	2021-09-10	Auction 24/09/2021	2021-09-24	Undisclosed	3	1	1	4.0	479.0	Ray White Canberra	27-bargang-crescent-ngunnawal-act-2913
46930	House	2021-09-10	Auction	2021-09-29	$935,000	3	1	2	1.5	695.5	LJ Hooker Kaleen	29-mcmaster-street-scullin-act-2614
46931	Townhouse	2021-09-10	Auction	2021-09-29	$583,000	3	1	1	0.0	285.0	LJ Hooker Kaleen	5-25-earle-place-page-act-2614
46932	Unit	2021-09-10	Auction	2021-10-26	Undisclosed	3	2	3	6.0	0.0	Luton Manuka	5-57-67-eyre-street-kingston-act-2604
46933	House	2021-09-10	Contact Agent	2021-09-29	Undisclosed	4	2	2	6.0	0.0	home.by holly	240-duffy-street-ainslie-act-2602
46934	House	2021-09-10	Auction 08/10/2021	2021-10-08	$1,130,000	4	3	3	2.5	846.0	Ray White Canberra	14-stewart-crescent-melba-act-2615
46935	House	2021-09-10	Auction	2021-09-29	$768,000	3	1	3	1.0	701.0	LJ Hooker Dickson	7-downard-street-calwell-act-2905
46938	Land	2021-09-10	$500,000 - $550,000	2021-11-16	$500,000	0	0	0		582.0	Bella Coastal Property	57-lake-conjola-ent-road-conjola-park-nsw-2539
46939	House	2021-09-10	Expressions Of Interest	2021-10-26	$840,000	3	2	2		692.0	Bella Coastal Property	153-lake-conjola-entrance-road-lake-conjola-nsw-2539
46940	House	2021-09-10	$829,000	2021-10-12	$829,000	3	2	2			Sails Real Estate	89-merimbula-drive-merimbula-nsw-2548
46941	Apartment	2021-09-10	$1,300,000	2021-09-29	$1,300,000	3	2	2	5.0	0.0	home.by holly	810-83-cooyong-street-reid-act-2612
46942	House	2021-09-10	$830,000+	2021-10-14	$870,000	3	1	2	5.5	650.0	LJ Hooker Gungahlin	12-acraman-place-amaroo-act-2914
46943	House	2021-09-10	SOLD BY STEVE!	2021-09-10	$645,000	4	2	2			Ray White Batemans Bay	4-joseph-street-batehaven-nsw-2536
46944	House	2021-09-10	$899,000	2021-12-15	$880,000	3	2	2		920.0	LJ Hooker Tuross Head	36-hawkins-road-tuross-head-nsw-2537
46949	House	2021-09-10	Auction Guide $700,000	2021-09-30	$999,000	3	1	1		1221.0	Ray White Bowral	600-argyle-street-moss-vale-nsw-2577
46950	Apartment	2021-09-10	By Negotiation	2021-09-22	$750,000	2	2	2	6.0		LJ Hooker Dickson	15-27-berrigan-crescent-oconnor-act-2602
46951	House	2021-09-10	Auction 24/09/2021	2021-09-24	Undisclosed	4	2	2	0.5	819.0	Ray White Canberra	47-erldunda-circuit-hawker-act-2614
46952	House	2021-09-10	Contact Agent	2021-10-19	$1,210,000	8	4	3		13000.0	Raine & Horne Southern Highlands	263-mulwaree-drive-tallong-nsw-2579
46954	House	2021-09-10	Online Auction	2021-10-01	$975,000	4	2	4	1.0		Luton Gungahlin	216-southern-cross-drive-latham-act-2615
46961	Land	2021-09-10	By Negotiation	2021-09-30	$1,200,000	0	0	0		1342.0	Impact Properties	7-9-carinya-street-queanbeyan-nsw-2620
46972	House	2021-09-10	Auction 23/09/2021	2021-09-23	Undisclosed	4	1	3	3.5	737.0	Ray White Canberra	83-somerset-street-duffy-act-2611
46974	Retirement	2021-09-10	$450,000	2021-11-26	$446,000	2	1	1			Bella Coastal Property	58-1-norman-street-lake-conjola-nsw-2539
46975	House	2021-09-10	Auction 01/10/2021	2021-10-01	$812,500	3	1	1	2.0	718.0	Ray White Canberra	41-freda-gibson-circuit-theodore-act-2905
46980	House	2021-09-11	ONLINE AUCTION	2021-10-03	$1,111,000	4	2	2	5.5	860.0	Maria Selleck Properties	6-oreilly-street-macgregor-act-2615
46982	AcreageSemi-rural	2021-09-12	Contact Agent	2021-11-14	$1,250,000	3	2	4	0.0	6.94	All Real Estate NSW	68-bohmers-lane-bywong-nsw-2621
46983	House	2021-09-12		2021-10-06	Undisclosed	3	1	4		13000.0	Tathra Beach Real Estate	51-mountview-close-bega-nsw-2550
46984	Land	2021-09-12	$320,000	2021-09-15	$400,000	0	0	0		2024.0	Henley Property - Jindabyne	lot-5-no-13-rutherford-street-dalgety-nsw-2628
46985	House	2021-09-13	Sold	2021-10-09	Undisclosed	4	3	6			McGrath Canberra	6-morris-close-greenleigh-nsw-2620
46986	Apartment	2021-09-13	Contact Agent	2021-12-21	$1,035,000	3	1	2			Sails Real Estate	4-1-short-street-merimbula-nsw-2548
46988	House	2021-09-13	Auction	2021-09-28	Undisclosed	4	2	2	0.5	780.0	Timothy Road	7-emerton-street-evatt-act-2617
46991	Apartment	2021-09-13	Online Auction Wednesday September 29th,  12.15pm	2021-09-29	Undisclosed	2	1	1	1.0		LJ Hooker Manuka	20-33-dawes-street-kingston-act-2604
46992	House	2021-09-13	$610,000	2021-10-26	$595,000	3	1	0		1100.0	Ray White Goulburn	44-may-street-goulburn-nsw-2580
46993	Unit	2021-09-13	$529,000	2021-10-06	$535,000	2	1	1			Elders Real Estate Batemans Bay	3-58-smith-street-broulee-nsw-2537
46995	House	2021-09-13	Auction, Sat 25th Sep at 10:00am	2021-09-17	$690,000	3	1	3	5.0	525.0	LJ Hooker Gungahlin	3-platt-place-charnwood-act-2615
46996	House	2021-09-13	Online Auction	2021-09-30	Undisclosed	5	2	2	2.0	813.0	Luton Weston Creek & Molonglo Valley	118-namatjira-drive-stirling-act-2611
46998	Townhouse	2021-09-13	VIRTUAL AUCTION	2021-10-02	$498,000	2	1	1	6.0	6707.0	McIntyre Property	15-36-john-holt-street-macgregor-act-2615
46999	Townhouse	2021-09-13	VIRTUAL AUCTION	2021-09-22	$570,000	3	1	1	2.0	0.0	McIntyre Property	5-2-warrumbul-street-ngunnawal-act-2913
47000	House	2021-09-13	AUCTION	2021-09-30	$880,000	3	1	2		1015.0	Ray White Goulburn	118-verner-street-goulburn-nsw-2580
47008	House	2021-09-13	$695,000	2021-10-01	$700,000	4	2	2		828.0	Ray White Goulburn	5-lamarra-place-goulburn-nsw-2580
47011	House	2021-09-13	Auction 07/10/2021	2021-09-24	Undisclosed	4	3	3	4.0	1022.0	Ray White Canberra	2-hadow-place-gilmore-act-2905
47012	House	2021-09-13	Auction 01/10/2021	2021-10-01	$1,255,000	4	2	2	3.5	920.0	Ray White Canberra	12-ivo-whitton-circuit-kambah-act-2902
47013	Townhouse	2021-09-13	Sold prior to Auction $980,000	2021-09-20	$980,000	4	3	2	6.0		Bastion Property Group	287-bettong-avenue-throsby-act-2914
47015	House	2021-09-13	Auction 30/09/2021	2021-09-30	Undisclosed	4	2	2	0.0	470.0	Ray White Canberra	3-insley-street-googong-nsw-2620
47023	House	2021-09-13	$990,000	2021-11-05	$963,000	4	2	2		2000.0	Ray White Goulburn	5-clyde-street-goulburn-nsw-2580
47024	House	2021-09-13	$899,000	2021-09-10	$899,000	3	2	2		4071.0	Sails Real Estate	2-nolan-drive-tura-beach-nsw-2548
47027	House	2021-09-14	Auction, Thu 30th Sep at 5:00pm	2021-09-30	$835,500	3	1	2	2.5	411.0	LJ Hooker Gungahlin	14-cradle-close-palmerston-act-2913
47031	Land	2021-09-14	$165,000	2021-10-29	Undisclosed	0	0	0		2000.0	LAWD	26-dickinson-street-binalong-nsw-2584
47032	House	2021-09-14	Auction 24/09/21	2021-09-24	Undisclosed	3	1	0	1.0	1134.0	LJ Hooker Dickson	45-cowper-street-ainslie-act-2602
47038	Apartment	2021-09-14	$420,000	2021-10-27	$410,000	2	1	1	6.0		Canberry Properties	69-68-college-st-belconnen-belconnen-act-2617
47039	Unit	2021-09-14	$525,000+	2022-02-22	$540,000	1	1	1	6.0		LJ Hooker Canberra City	32-11-kerridge-street-kingston-act-2604
47040	House	2021-09-14	$530,000	2021-09-14	Undisclosed	3	2	3		948.0	Raine & Horne Young	3-chantilly-place-young-nsw-2594
47043	House	2021-09-14	SOLD	2021-10-09	$951,000	3	1	2	1.5	771.0	Cream Residential	14-cassia-place-rivett-act-2611
47044	House	2021-09-14	Open Home Cancelled	2022-02-25	Undisclosed	3	1	6		1593.0	Raine & Horne Southern Highlands	1345-nowra-road-fitzroy-falls-nsw-2577
47045	Apartment	2021-09-14	$395,000+	2021-11-18	$405,000	1	1	1	6.0	62.0	Ray White Canberra	308-7-irving-street-phillip-act-2606
47048	Apartment	2021-09-14	Auction 9 October at 10am	2021-09-27	$425,000	2	1	1	2.5		LJ Hooker Tuggeranong	1-24-frencham-street-downer-act-2602
47050	House	2021-09-14	Auction	2021-10-02	$1,375,000	4	2	2	4.5	456.0	Independent Gungahlin	35-flos-greig-street-watson-act-2602
47052	Land	2021-09-14	Auction 09/10/21	2021-10-08	Undisclosed	0	0	0		1400.0	McGrath Canberra	18-lochiel-street-karabar-nsw-2620
47055	House	2021-09-14	Online Auction	2021-10-10	$1,120,000	4	2	6		1019.0	Ray White Rural Canberra | Yass	9-joan-st-murrumbateman-nsw-2582
47057	House	2021-09-14	AUCTION	2021-10-08	$640,000	3	1	1		1011.0	Ray White Goulburn	40-may-street-goulburn-nsw-2580
47060	House	2021-09-14	$775,000	2021-09-24	$775,000	4	2	2		597.2	Ray White Goulburn	36-ivy-lea-place-goulburn-nsw-2580
47063	Land	2021-09-14	$290,000-$320,000	2021-10-11	$310,000	0	0	0		601.0	LJ Hooker Batemans Bay	19-riverview-crescent-catalina-nsw-2536
47064	Apartment	2021-09-14	$445,000	2021-11-12	$464,000	2	1	1	6.0		The Real Estate Shop	88-116-easty-street-phillip-act-2606
47067	House	2021-09-14	SOLD - $1,524,000	2021-09-26	$1,524,000	5	2	2	6.0	693.0	Stone Gungahlin	44-aida-ball-circuit-forde-act-2914
47068	House	2021-09-14	Price Guide $735,000	2021-09-29	Undisclosed	3	2	1		639.0	Whale Coast Realty	24-old-highway-narooma-nsw-2546
47069	House	2021-09-14	SOLD - $1,260,000	2021-09-26	$1,260,000	4	2	2	5.5	504.0	Stone Gungahlin	26-heatherdale-street-amaroo-act-2914
47071	Apartment	2021-09-14	$485,000 to $515000	2021-10-08	$510,000	2	2	2	6.0		Impact Properties	63-275-flemington-road-franklin-act-2913
47072	House	2021-09-14	Auction 30/9/21	2021-09-30	$835,000	3	1	1	4.0	703.0	Ray White Canberra	4-bick-place-banks-act-2906
47073	Townhouse	2021-09-15	Auction	2021-10-02	Undisclosed	4	3	2	6.0	0.0	Luton Weston Creek & Molonglo Valley	8-11-castan-street-coombs-act-2611
47074	Apartment	2021-09-15	By Negation	2021-11-19	$610,000	2	2	1	6.0		LJ Hooker Gungahlin	316-240-bunda-street-city-act-2601
47075	House	2021-09-15	Auction	2021-10-09	Undisclosed	3	2	1	1.5	742.0	Luton Manuka	7-bage-place-mawson-act-2607
47076	Apartment	2021-09-15	Auction	2021-10-07	Undisclosed	4	3	3	5.5		Luton Manuka	501-45-honeysett-view-kingston-act-2604
47077	House	2021-09-15	Sold prior to auction $955,000	2021-09-23	$955,000	4	2	2	6.0	420.0	McGrath Canberra	7-dyindan-street-ngunnawal-act-2913
47078	Townhouse	2021-09-15	Contact Agent	2021-10-11	Undisclosed	2	2	1	6.0		VERV Property	17-7-loveday-crescent-casey-act-2913
47080	Townhouse	2021-09-15	Auction	2021-09-30	$660,000	2	2	2	5.5		Badenoch Real Estate	23-paget-street-bruce-act-2617
47084	House	2021-09-15	Auction	2021-10-08	Undisclosed	5	4	2	4.5	1369.0	Luton Manuka	42-endeavour-street-red-hill-act-2603
47090	House	2021-09-15	VIRTUAL AUCTION	2021-09-21	$920,000	4	2	2	1.5	759.0	McIntyre Property	44-handasyde-street-conder-act-2906
47096	House	2021-09-15	$1,450,000 - $1,500,000	2021-11-15	$1,465,000	4	2	3		8327.0	LJ Hooker Malua Bay	8-silverdell-place-surf-beach-nsw-2536
47097	Unit	2021-09-15	$315,000	2021-10-08	$315,000	2	1	1			LJ Hooker Queanbeyan – Jerrabomberra – Googong	25-18-booth-street-queanbeyan-east-nsw-2620
47098	House	2021-09-15	Auction	2021-10-09	Undisclosed	6	3	4	0.5	1061.0	Luton Manuka	7-anstey-street-pearce-act-2607
47099	House	2021-09-15	Expressions of Interest	2021-10-13	Undisclosed	1	1	1		706.0	Bella Coastal Property	7-northwood-drive-kioloa-nsw-2539
47102	House	2021-09-15	By Negotiation	2021-10-11	$755,000	3	1	2	0.5	479.0	Impact Properties	88-livingston-avenue-kambah-act-2902
47104	Apartment	2021-09-15	Auction 07/10/2021	2021-09-30	$450,000	2	1	1	6.0	0.0	Ray White Canberra	26-126-thynne-street-bruce-act-2617
47105	House	2021-09-15	Auction 07/10/2021	2021-10-07	Undisclosed	3	1	2	0.5	729.0	Ray White Canberra	25-pennefather-street-higgins-act-2615
47106	House	2021-09-15	Auction 08/10/2021	2021-09-30	$1,310,000	4	1	3	2.0	694.0	Ray White Canberra	18-gundara-street-aranda-act-2614
47107	Townhouse	2021-09-15	Auction 29/09/2021	2021-09-29	$801,000	3	3	2	4.0	0.0	Ray White Canberra	3-128-easty-street-phillip-act-2606
47108	House	2021-09-15	Online Auction	2021-10-09	$978,500	4	2	2	1.0	910.0	LJ Hooker Belconnen	9-poole-place-latham-act-2615
47109	Unit	2021-09-15	Auction 30/09/2021	2021-09-30	$478,000	2	1	1	5.5	0.0	Ray White Canberra	15-38-bootle-place-phillip-act-2606
47110	House	2021-09-15	$780,000	2021-10-19	$780,000	3	1	1		652.0	Bella Coastal Property	17-hapgood-close-kioloa-nsw-2539
47111	House	2021-09-15	$1,570,000.00	2021-10-09	Undisclosed	4	2	2	4.5		McGrath Canberra	22-love-street-flynn-act-2615
47114	House	2021-09-15	Auction	2021-10-06	$955,000	4	2	2	1.0	981.0	LJ Hooker Dickson	10-nott-street-fraser-act-2615
47115	Other	2021-09-15	$650,000	2021-09-28	$650,000	0	0	0		34.0	LJ Hooker Queanbeyan – Jerrabomberra – Googong	82-naylor-road-urila-nsw-2620
47116	Livestock	2021-09-15	EOI	2021-10-23	Undisclosed	4	1	0		795.0	LAWD	54-lawrence-lane-yass-nsw-2582
47118	House	2021-09-15	Price Guide $570,000 - $615,000	2021-12-09	$580,000	3	1	2		1041.0	Ray White Goulburn	92-coromandel-street-goulburn-nsw-2580
47119	House	2021-09-15	Auction Guide: $450,000	2021-10-13	$501,500	2	1	1		797.0	Henley Property - Cooma	2-sir-william-hudson-street-cooma-nsw-2630
47120	Unit	2021-09-15	$230,000 per unit	2021-11-29	Undisclosed	2	1	1			Raine & Horne Young	unit-1-13-cloete-street-young-nsw-2594
47124	House	2021-09-15	Auction	2021-10-07	$955,000	4	2	2	0.5	851.0	Luton Gungahlin	2-hibbins-place-latham-act-2615
47125	Apartment	2021-09-15	$445,000	2021-10-18	$445,000	1	1	1	6.0	0.0	Independent Projects	11-irving-street-phillip-act-2606
47127	Apartment	2021-09-15	$405,000+	2021-11-03	$405,000	1	1	1	6.0	0.0	Independent Projects	11-irving-street-phillip-act-2606
47132	Other	2021-09-16	Auction online 9th October 2.15 pm	2021-10-09	Undisclosed	4	2	2		5.81	McGrath Canberra	4-trig-lane-carwoola-nsw-2620
47133	Apartment	2021-09-16	$790,000	2021-11-12	$790,000	3	2	2	6.0	0.0	home.by holly	11-10-helemon-street-braddon-act-2612
47136	House	2021-09-16	Auction 06/10/2021	2021-10-06	$757,000	4	2	2	5.5	352.0	Ray White Canberra	2-35-brockway-circuit-banks-act-2906
47140	House	2021-09-16	SOLD PRIOR to AUCTION-$686,000	2021-09-28	$686,000	3	2	2	6.0		McGrath Canberra	41-mcgovern-street-casey-act-2913
47141	House	2021-09-16	Auction 08/10/2021	2021-10-08	Undisclosed	4	2	2	2.5	822.0	Ray White Canberra	25-morton-street-weetangera-act-2614
47142	House	2021-09-16	Online Auction Wednesday October 6th,  12:30pm	2021-10-06	$1,380,000	7	3	2	2.0		LJ Hooker Manuka	105-oconnor-circuit-calwell-act-2905
47143	Apartment	2021-09-16	Auction 30/09/2021	2021-09-30	$430,000	3	2	1	3.5	0.0	Ray White Canberra	4h-3-avoca-place-fisher-act-2611
47145	Townhouse	2021-09-16	Auction	2021-10-02	$575,000	3	1	1	2.0	0.0	Luton Tuggeranong	12-8-jondol-place-isabella-plains-act-2905
47150	House	2021-09-16	Auction 01/10/2021	2021-10-01	$955,000	4	2	2	4.0	372.0	Ray White Canberra	64-swain-street-gungahlin-act-2912
47151	House	2021-09-16	Auction 29/09/2021	2021-09-29	$1,160,000	4	1	2	1.5	788.0	Ray White Canberra	44-roseworthy-crescent-farrer-act-2607
47154	House	2021-09-16	VIRTUAL AUCTION	2021-10-11	$800,000	3	1	4	4.0	704.0	McIntyre Property	6-forsythe-street-banks-act-2906
47156	House	2021-09-16	Auction	2021-10-09	Undisclosed	4	2	4	0.0	705.0	LJ Hooker Weston/Woden	68-fitchett-street-garran-act-2605
47157	Apartment	2021-09-16	Auction	2021-10-06	Undisclosed	2	2	1	3.5		Luton Manuka	5-28-gosse-street-kingston-act-2604
47158	Apartment	2021-09-16	$330,000+	2021-10-11	$332,000	1	1	1	4.0		Maloney's Property	24-13-15-sturt-avenue-griffith-act-2603
47159	Apartment	2021-09-16	$409,000 - $439,000	2021-09-24	$435,000	2	2	1		113.0	Ian McNamee & Partners - Queanbeyan	59-39-43-crawford-street-queanbeyan-nsw-2620
47160	House	2021-09-16	Auction 16/10/21	2021-10-16	Undisclosed	4	2	4	1.0	0.0	One Agency Sandy Morris	65-ragless-circuit-kambah-act-2902
47161	Land	2021-09-16	By Negotiation	2021-10-12	$1,200,000	0	0	0		814.0	New Door Properties	6-cullen-street-watson-act-2602
47162	House	2021-09-16	Auction 2/10/21	2021-09-23	Undisclosed	3	1	2	2.5	618.0	One Agency Sandy Morris	4-battersby-circuit-kambah-act-2902
47163	House	2021-09-16	Online Auction	2021-10-02	$750,000	3	1	1	5.0	357.0	LJ Hooker Belconnen	7-audrey-cahn-street-macgregor-act-2615
47164	House	2021-09-16	Online Auction	2021-10-02	$1,370,000	4	3	2	4.5	522.0	LJ Hooker Belconnen	13-zorzi-street-forde-act-2914
47166	Apartment	2021-09-16	$435,000	2021-10-12	$439,000	2	1	1	6.0		Canberry Properties	105-72-college-street-belconnen-act-2617
47167	House	2021-09-16	Forthcoming Auction	2021-10-14	$985,000	4	2	1	4.0	330.0	Confidence Real Estate	10-fairydale-street-harrison-act-2914
47168	Apartment	2021-09-16	Offers over $290,000	2022-04-04	$290,000	1	1	1	1.0		Crowthers	24-47-mcmillan-crescent-griffith-act-2603
47170	House	2021-09-16	Online Auction	2021-10-02	$934,500	4	3	2	1.5	754.0	LJ Hooker Belconnen	22-handcock-crescent-macgregor-act-2615
47171	House	2021-09-16	Contact Agent	2021-10-11	Undisclosed	5	2	2	4.5	570.0	VERV Property	61-ian-potter-crescent-gungahlin-act-2912
47172	House	2021-09-16	$430,000	2022-02-28	$422,000	2	1	0		1259.0	Henley Property - Cooma	11-polo-flat-road-cooma-nsw-2630
47173	House	2021-09-16	Auction	2021-09-21	Undisclosed	3	1	0	5.0		Badenoch Real Estate	32-yarrawonga-street-ngunnawal-act-2913
47174	Townhouse	2021-09-16	BY NEGOTIATION	2021-11-11	$677,000	3	2	2	3.0		Maria Selleck Properties	4-132-totterdell-street-belconnen-act-2617
47175	House	2021-09-16	Online Auction	2021-10-02	$711,700	3	1	1	6.0	226.0	LJ Hooker Belconnen	56-refshauge-crescent-macgregor-act-2615
47178	House	2021-09-16	Sold prior to auction $1,242,000	2021-09-29	$1,242,000	4	3	2	5.0	677.0	McGrath Canberra	7-carina-street-ngunnawal-act-2913
47181	Unit	2021-09-16	Contact Agent	2021-10-06	Undisclosed	1	1	1	4.5		One Agency Gamarra & Co	37-1-gungahlin-place-gungahlin-act-2912
47182	House	2021-09-16	$1,450,000	2021-10-01	$1,450,000	3	1	1	1.0	0.0	home.by holly	143-mackenzie-street-hackett-act-2602
47183	Townhouse	2021-09-16	$875,000	2021-10-09	$875,000	3	2	2	4.5	0.0	home.by holly	90-aspinall-street-watson-act-2602
47184	House	2021-09-16	Auction 30/09/2021	2021-09-30	$950,000	4	1	2	1.5	773.0	Ray White Canberra	11-nulsen-circuit-flynn-act-2615
47189	House	2021-09-16	By Negotiation	2021-09-29	Undisclosed	3	1	1	0.0	0.0	Zango Private Listers	15-richardson-street-garran-act-2605
47191	House	2021-09-16	AUCTION - Online 9th October @ 12pm	2021-10-09	$1,780,000	4	2	1	2.0	0.0	Cream Residential	49-gilmore-crescent-garran-act-2605
47192	House	2021-09-16	$1,175,000 to $1,225,000	2021-10-14	$1,261,000	5	3	2		827.5	Sails Real Estate	8-jabiru-place-merimbula-nsw-2548
47193	House	2021-09-16	$749,000	2021-09-30	Undisclosed	3	1	2		601.0	Whale Coast Realty	17-hyland-avenue-narooma-nsw-2546
47194	Alpine	2021-09-16	Auction	2021-10-13	$2,320,000	5	4	2			Henley Property - Jindabyne	32-jerrara-drive-east-jindabyne-nsw-2627
47195	Townhouse	2021-09-16	Auction 01/10/2021	2021-10-01	$802,000	2	1	2	0.5	290.0	Ray White Canberra	13-hyndes-crescent-holder-act-2611
47199	House	2021-09-17	$1,200,000	2021-10-11	$1,200,000	4	2	2	4.0	785.0	Hugo. Canberra	1-gorman-crescent-nicholls-act-2913
47202	House	2021-09-17	$1,295,000+	2021-10-05	$1,415,000	4	3	2	6.0	318.0	Dovers & Co Property Services	63-negus-crescent-watson-act-2602
47208	Land	2021-09-17	$250,000-$270,000	2021-09-24	$270,000	0	0	0		701.0	My Agent Christine Ewin	39-litchfield-crescent-long-beach-nsw-2536
47210	House	2021-09-17	Auction, On-Site, 20/11/2021 at 11:00am	2021-10-20	$960,000	3	2	2	1.5	957.0	Impact Properties	3-eggers-place-bonython-act-2905
47211	House	2021-09-17	Auction	2021-10-08	$680,000	3	1	0	2.5	403.0	LJ Hooker Gungahlin	48-gurrang-avenue-ngunnawal-act-2913
47212	House	2021-09-17	$870,000 - $920,000	2021-10-15	$900,000	3	2	2		7507.0	My Agent Christine Ewin	5-carrie-crescent-moruya-nsw-2537
47218	House	2021-09-17	Offers invited!	2021-10-15	Undisclosed	4	2	4		930.0	Raine & Horne Young	1-settlers-place-young-nsw-2594
47221	House	2021-09-17	Forthcoming Auction	2021-10-06	$881,000	3	1	2	1.5	708.0	Confidence Real Estate	16-woollum-crescent-rivett-act-2611
47225	DuplexSemi-detached	2021-09-17	Auction	2021-10-13	Undisclosed	3	2	2	5.5	0.0	LJ Hooker Kaleen	94b-diamantina-crescent-kaleen-act-2617
47230	Unit	2021-09-17	$190,000+	2022-01-14	Undisclosed	1	1	0	0.0	0.0	Clover Canberra	11-10-arthur-street-crestwood-nsw-2620
47231	House	2021-09-17	Auction	2021-10-13	Undisclosed	3	1	1	1.5	968.0	LJ Hooker Kaleen	3-wattle-street-oconnor-act-2602
47236	AcreageSemi-rural	2021-09-19	AUCTION	2021-10-16	$1,830,000	4	3	3		2.05	Henley Property - Jindabyne	31-snowgum-court-jindabyne-nsw-2627
47239	House	2021-09-20	Auction 14/10/2021	2021-10-14	$1,541,000	4	2	2	6.0	779.0	Ray White Canberra	6-bowler-place-kambah-act-2902
47240	House	2021-09-20	$799,000	2021-10-28	$799,000	3	2	2			Sails Real Estate	2-44-golf-circuit-tura-beach-nsw-2548
47244	House	2021-09-20	By Negotiation	2021-10-21	$1,400,000	5	2	2		845.0	Bella Coastal Property	9-silky-oak-avenue-ulladulla-nsw-2539
47247	House	2021-09-20	$799,000	2021-10-08	$799,000	3	2	4		856.0	LJ Hooker Batemans Bay	9-johnson-place-surf-beach-nsw-2536
47250	Townhouse	2021-09-20	$600,000 - $650,000	2021-10-06	$650,000	3	2	2			McGrath Canberra	9-7-11-cassidy-street-queanbeyan-nsw-2620
47251	House	2021-09-20	$995,000	2022-01-20	$980,000	3	2	4		5.0	LJ Hooker Moruya	59-pear-tree-place-moruya-nsw-2537
47258	House	2021-09-20	Auction	2021-10-01	$985,000	3	1	1	1.5		Bertram Ellis	14-tantangara-street-duffy-act-2611
47261	House	2021-09-20	Online Auction	2021-10-07	$1,882,000	3	1	2	0.0	681.0	Ray White Queanbeyan | Jerrabomberra	23-frome-street-griffith-act-2603
47262	House	2021-09-20	Auction 14/10/2021	2021-10-14	$835,000	3	2	2	2.0	703.0	Ray White Canberra	84-boddington-crescent-kambah-act-2902
47264	Townhouse	2021-09-20	Auction 09/10/21	2021-10-09	$1,218,000	3	2	2	6.0	0.0	LJ Hooker Dickson	13-18-parbery-street-kingston-act-2604
47265	Apartment	2021-09-20	$329,950+	2021-10-29	$350,000	1	1	1	5.0		Luton Gungahlin	219-1-anthony-rolfe-avenue-gungahlin-act-2912
47266	House	2021-09-20	Offers over $900,000	2021-11-06	$915,000	4	2	2	3.5	435.0	Agent Residential	135-rob-riley-circuit-bonner-act-2914
47268	House	2021-09-21	SOLD $500,500	2021-09-30	$500,500	2	1	1	6.0		Blackshaw Gungahlin	4-1-wanliss-street-latham-act-2615
47270	House	2021-09-21	$699,000	2021-09-29	$699,000	3	2	2			LJ Hooker Malua Bay	24b-sylvan-street-malua-bay-nsw-2536
47271	Apartment	2021-09-21	$830,000+	2021-11-23	Undisclosed	3	2	3	6.0	0.0	Ray White Canberra	237-1-anthony-rolfe-avenue-gungahlin-act-2912
47274	Townhouse	2021-09-21	$430,000	2021-10-12	$420,000	2	1	1			Ray White Queanbeyan | Jerrabomberra	9-47-booth-street-queanbeyan-nsw-2620
47278	Lifestyle	2021-09-21	Auction	2021-10-05	$912,000	3	1	5		20.22	Raine & Horne Goulburn	311-forest-siding-road-middle-arm-nsw-2580
47279	Land	2021-09-21	Auction	2021-11-02	$80,000	0	0	0		4047.0	Raine & Horne Goulburn	1-3-lachlan-street-bigga-via-crookwell-nsw-2583
47281	House	2021-09-21	AUCTION	2021-10-01	$1,500,000	4	3	6	0.5		Michael Potter Real Estate	10-steinwedel-street-farrer-act-2607
47282	Townhouse	2021-09-21	AUCTION	2021-10-09	Undisclosed	3	1	2	6.0		Michael Potter Real Estate	6-9-tasman-place-lyons-act-2606
47284	House	2021-09-21	Auction	2021-09-28	$950,000	3	2	1	1.0	1001.0	Michael Potter Real Estate	5-annear-place-fadden-act-2904
47288	House	2021-09-21	Online Auction	2021-10-07	$825,000	4	2	2		429.0	Ray White Queanbeyan | Jerrabomberra	21-lindbeck-corner-googong-nsw-2620
47289	Unit	2021-09-21	$299,000+	2021-10-26	$325,000	2	1	1	2.0		Ray White Canberra	9-9-keith-place-scullin-act-2614
47290	House	2021-09-21	Contact Agent	2021-10-10	$1,151,000	3	1	3	2.0	680.0	Maria Selleck Properties	8-coghlan-street-chifley-act-2606
47291	Townhouse	2021-09-21	$580,000	2021-10-06	$580,000	2	1	1			LJ Hooker Queanbeyan – Jerrabomberra – Googong	3-3-parr-place-karabar-nsw-2620
47293	House	2021-09-21	AUCTION	2021-11-09	Undisclosed	3	2	1		676.0	Ray White Bowral	13-gordon-road-bowral-nsw-2576
47294	House	2021-09-22	Auction	2021-10-16	Undisclosed	6	3	2	4.5	0.0	Luton Manuka	14-eildon-place-duffy-act-2611
47295	Apartment	2021-09-22	$389,000+	2021-11-04	$398,000	2	1	1	6.0	0.0	LJ Hooker Gungahlin	34-60-john-gorton-drive-coombs-act-2611
47296	Land	2021-09-22	$325,000	2021-10-01	$325,000	0	0	0		556.0	My Agent Christine Ewin	8-mulgowrie-street-malua-bay-nsw-2536
47297	House	2021-09-22	Auction 23/10/21	2021-10-23	$1,721,000	4	2	2	3.0	661.0	LJ Hooker Dickson	103-dooring-street-dickson-act-2602
47298	House	2021-09-22	Online Auction	2021-10-07	$1,136,000	4	2	2	5.5	552.0	Ray White Queanbeyan | Jerrabomberra	harrison-2914-act
47300	House	2021-09-22	$811,000	2021-10-14	$811,000	3	2	2	4.5	232.0	McGrath Canberra	83-mary-gillespie-avenue-gungahlin-act-2912
47301	House	2021-09-22	Auction online: 16th October 10.30am	2021-10-16	$1,101,000	4	2	2	4.0	329.0	McGrath Canberra	38-casilda-street-harrison-act-2914
47302	House	2021-09-22	VIRTUAL AUCTION	2021-10-01	$1,470,000	4	3	2	5.0	881.0	McIntyre Property	23-wittunga-crescent-banks-act-2906
47307	House	2021-09-22	VIRTUAL AUCTION	2021-10-05	$885,000	3	2	2	1.0	855.0	McIntyre Property	4-arden-place-gilmore-act-2905
47309	Villa	2021-09-22	Auction on-line 23rd October 2021 @ 11am	2021-10-08	$1,850,000	4	2	2	3.5	860.0	Maloney's Property	13-40-culgoa-circuit-omalley-act-2606
47312	House	2021-09-22	Auction 21/10/2021	2021-10-21	$2,145,000	1	1	0	0.0	0.0	Ray White Canberra	13-mccarthy-rd-wallaroo-nsw-2618
47313	House	2021-09-22	Online Auction	2021-10-06	$900,000	4	2	2	5.0	860.0	LJ Hooker Belconnen	11-hedger-street-dunlop-act-2615
47314	Townhouse	2021-09-22	Online Auction	2021-10-16	Undisclosed	4	2	2	5.0	0.0	LJ Hooker Belconnen	1-15-gibbes-place-weetangera-act-2614
47315	House	2021-09-22	Online Auction	2021-10-09	$891,500	3	2	2	4.5	348.0	LJ Hooker Belconnen	26-siroset-close-dunlop-act-2615
47319	Land	2021-09-22	Expressions of Interest	2021-12-01	$950,000	0	0	0		26.0	LJ Hooker Moruya	lot-2-151-potato-point-road-bodalla-nsw-2545
47320	House	2021-09-22	Auction 15/10/2021	2021-10-15	$820,000	3	1	2	1.5	816.0	Ray White Canberra	12-darlot-place-kambah-act-2902
47321	House	2021-09-22	Online Auction	2021-10-09	$852,500	3	2	2	6.0	344.0	LJ Hooker Belconnen	58-hilda-kincaid-crescent-macgregor-act-2615
47322	Apartment	2021-09-22	$440,000+	2021-10-22	Undisclosed	1	1	1	5.5		Ray White Canberra	703-92-northbourne-avenue-braddon-act-2612
47323	House	2021-09-22	$640,000 - $680,000	2021-10-01	$680,000	3	2	2		721.9	My Agent Christine Ewin	1-litchfield-crescent-long-beach-nsw-2536
47324	House	2021-09-22	Auction	2021-10-01	$1,570,000	5	4	4	2.5	791.0	Luton Gungahlin	44-rollston-street-amaroo-act-2914
47325	Villa	2021-09-22	Auction Guide $575,000	2021-10-26	$683,000	2	2	1			Raine & Horne Southern Highlands	5-15-mack-street-moss-vale-nsw-2577
47327	House	2021-09-22	AUCTION	2021-10-05	$400,000	3	1	1		632.0	Raine & Horne Goulburn	3-bennett-street-goulburn-nsw-2580
47328	House	2021-09-22	$650,000	2021-11-16	$630,000	4	2	2		551.0	Raine & Horne Goulburn	181-faithfull-street-goulburn-nsw-2580
47333	Unit	2021-09-22	$475,000	2021-10-07	$475,000	2	1	1	3.5		Luton Manuka	4-7-9-troughton-street-banks-act-2906
47338	House	2021-09-22	$832,500	2021-10-08	$832,500	4	2	2		771.0	My Agent Christine Ewin	12-escape-place-malua-bay-nsw-2536
47339	Apartment	2021-09-22	$435,000+	2021-10-29	$437,500	2	2	2	6.0	65.0	LJ Hooker Kaleen	50-241-flemington-road-franklin-act-2913
47340	House	2021-09-22	$800,000+	2021-10-16	Undisclosed	3	2	2	5.5	433.0	McGrath Canberra	27-anakie-court-ngunnawal-act-2913
47343	House	2021-09-22	By Negotiation	2021-10-25	$1,480,000	5	2	4		8000.0	Ray White Bungendore	80-mcdonnell-drive-bungendore-nsw-2621
47344	Apartment	2021-09-23	Auction	2021-10-13	Undisclosed	2	1	1	3.5	0.0	Luton Weston Creek & Molonglo Valley	21-10-wilkins-street-mawson-act-2607
47345	House	2021-09-23	By Negotiation	2021-10-12	Undisclosed	3	1	2		604.0	Bella Coastal Property	136-malibu-drive-bawley-point-nsw-2539
47346	House	2021-09-23	$1,665,000	2021-10-08	$1,665,000	6	3	2		4330.0	Bella Coastal Property	10-voyager-crescent-bawley-point-nsw-2539
47349	Apartment	2021-09-23	$550,000+	2022-03-04	$565,000	2	1	1	4.0		McGrath Canberra	1006-2-marcus-clarke-street-city-act-2601
47350	House	2021-09-23	Auction 2/10/21	2021-09-28	Undisclosed	3	2	2	3.5	908.0	One Agency Sandy Morris	48-prichard-circuit-richardson-act-2905
47351	Townhouse	2021-09-23	$745,000	2021-10-18	$745,000	3	2	2	6.0	0.0	home.by holly	94-john-gorton-drive-coombs-act-2611
47352	House	2021-09-23	Auction	2021-09-29	Undisclosed	3	1	2	4.5	632.0	One Agency Sandy Morris	12-tumbleton-place-isabella-plains-act-2905
47353	House	2021-09-23	Auction 15/10/2021	2021-10-07	$965,000	5	2	3	3.5	982.0	Ray White Canberra	62-templestowe-avenue-conder-act-2906
47354	House	2021-09-23	Sold Prior to Auction	2021-11-19	$660,000	4	2	2	0.0	1011.0	McCann Properties	7-cullavin-street-gunning-nsw-2581
47355	House	2021-09-23	$619,000	2021-12-15	$619,000	4	2	2	0.0	1011.0	McCann Properties	5-cullavin-street-gunning-nsw-2581
47356	House	2021-09-23	Auction 08/10/2021	2021-10-08	$1,550,000	5	2	2	1.5	747.0	Ray White Canberra	23-atkinson-street-cook-act-2614
47357	House	2021-09-23	Auction	2021-10-16	$1,436,500	4	2	3	2.0	0.0	Luton Dickson	64-brunswick-circuit-kaleen-act-2617
47359	House	2021-09-23	$679,000	2021-10-07	$679,000	3	1	1		601.0	LJ Hooker Malua Bay	49-riverview-crescent-catalina-nsw-2536
47360	House	2021-09-23	Auction	2021-10-08	$780,000	3	2	1	5.5	375.0	LJ Hooker Gungahlin	88-refshauge-crescent-macgregor-act-2615
47363	House	2021-09-23	VIRTUAL AUCTION	2021-10-15	$1,000,000	4	2	2	4.0	493.0	McIntyre Property	8-mcgilvray-close-gordon-act-2906
47364	Townhouse	2021-09-23	Auction, Sat 9th Oct at 1:00pm	2021-10-09	$815,000	3	2	2	5.0	254.0	LJ Hooker Gungahlin	39-anthony-rolfe-avenue-gungahlin-act-2912
47365	House	2021-09-23	Auction	2021-10-12	$695,000	3	1	2	1.0		LJ Hooker Weston/Woden	21-reader-court-banks-act-2906
47367	House	2021-09-23	Auction	2021-10-09	Undisclosed	3	1	2	1.0	694.0	Luton Weston Creek & Molonglo Valley	44-woralul-street-waramanga-act-2611
47368	House	2021-09-23	Auction	2021-10-15	$888,000	3	2	1	1.0	807.0	Luton Tuggeranong	2-keeling-place-kambah-act-2902
47369	Townhouse	2021-09-23	Auction	2021-10-16	Undisclosed	3	1	1	2.0	0.0	Luton Weston Creek & Molonglo Valley	25-146-ellerston-avenue-isabella-plains-act-2905
47370	MixedFarming	2021-09-23	$10,250,000	2022-05-16	Undisclosed	3	1	0		658.49	LAWD	greenethorpe-2809-nsw
47371	House	2021-09-23	Auction	2021-09-27	$860,000	3	2	2	2.0	885.0	Luton Tuggeranong	84-lewis-luxton-avenue-gordon-act-2906
47375	House	2021-09-23	Auction 06/10/2021	2021-10-06	$1,455,000	4	2	2	1.5	1426.0	Ray White Canberra	12-howarth-place-chapman-act-2611
47377	House	2021-09-23	Auction	2021-10-16	Undisclosed	4	2	2	0.0	865.0	Luton Weston Creek & Molonglo Valley	1-haynes-place-stirling-act-2611
47378	House	2021-09-23	Auction 14/10/21	2021-10-14	$1,320,000	4	2	2	5.5	591.0	Ray White Canberra	9-arcadia-street-crace-act-2911
47380	House	2021-09-23	Auction 07/10/2021	2021-10-07	$1,145,000	4	2	3	4.0	922.0	Ray White Canberra	4-haly-place-macarthur-act-2904
47381	House	2021-09-23	$1,390,000	2021-10-09	$1,390,000	5	2	2	4.5	0.0	home.by holly	4-clouston-street-wright-act-2611
47382	Lifestyle	2021-09-23	$500,000	2021-10-22	Undisclosed	0	0	0		118.0	Ray White Braidwood	158-haughtons-road-tomboye-nsw-2622
47383	Unit	2021-09-23	$329,950+	2021-11-01	Undisclosed	2	1	1	5.0		McIntyre Property	2a-4-beetaloo-street-hawker-act-2614
47384	Lifestyle	2021-09-23	$500,000	2021-11-12	$480,000	0	0	0		100.0	Ray White Braidwood	158a-haughtons-road-tomboye-nsw-2622
47386	House	2021-09-23	Auction 16th October @11am on-line	2021-09-30	$1,750,000	6	3	2	1.5	833.0	Maloney's Property	20-brereton-street-garran-act-2605
47388	Land	2021-09-23	$149 000	2022-03-29	Undisclosed	0	0	0		1069.0	Raine & Horne Young	105-william-street-young-nsw-2594
47390	House	2021-09-23	Auction	2021-10-07	$1,375,000	5	3	2	1.0	928.0	Luton Tuggeranong	7-courtice-close-fadden-act-2904
47394	Townhouse	2021-09-23	Auction 16 October at 12pm	2021-10-16	$745,000	3	1	2	1.0	0.0	LJ Hooker Tuggeranong	13-37-barr-smith-avenue-bonython-act-2905
47395	Land	2021-09-23	$275,000	2021-10-19	$275,000	0	0	0		1131.0	McCann Properties	lot-220-green-avenue-gunning-nsw-2581
47398	Other	2021-09-23	Expressions of Interest	2021-09-13	Undisclosed	0	0	0		393300.0	Belle Property Braidwood	660-majors-creek-road-braidwood-nsw-2622
47399	Apartment	2021-09-23	$330,000+	2021-10-19	$335,000	2	1	1	4.0		LJ Hooker Dickson	4-271-antill-street-watson-act-2602
47400	House	2021-09-23	$999,000 to $1,099,000	2021-10-29	$1,200,000	4	2	5	0.0	1436.0	Heading Home Properties	8-faunce-place-bungendore-nsw-2621
47404	Land	2021-09-23	$560,000	2021-12-17	$535,000	0	0	0		5.0	LJ Hooker Narooma	lot-2-lot-2-wonga-road-narooma-nsw-2546
47406	Apartment	2021-09-23	$450,000+	2021-11-17	$460,000	2	1	1	5.5		LJ Hooker Dickson	46-1-mouat-street-lyneham-act-2602
47408	House	2021-09-23	Auction	2021-10-16	$900,000	3	1	1	2.0		LJ Hooker Dickson	59-bosworth-circuit-kambah-act-2902
47410	House	2021-09-23	Auction 16 October at 11am	2021-09-25	$780,000	3	1	1	4.5	833.0	LJ Hooker Tuggeranong	108-lawrence-wackett-crescent-theodore-act-2905
47411	House	2021-09-23	$590,000+	2021-10-16	$667,000	2	1	1	5.0	214.0	LJ Hooker Kippax	26-strong-place-belconnen-act-2617
47412	House	2021-09-23	Auction 14/10/2021	2021-10-14	$1,386,000	3	2	2	1.5	848.0	Ray White Canberra	68-mackellar-crescent-cook-act-2614
47413	House	2021-09-23	$770,000 - $820,000	2021-10-06	$800,000	3	2	2		832.0	My Agent Christine Ewin	66-blairs-road-long-beach-nsw-2536
47414	House	2021-09-23	$1,020,000	2021-10-16	$1,020,000	3	1	1	1.0		home.by holly	9-cooper-place-watson-act-2602
47415	House	2021-09-23	$1,370,000	2021-10-16	$1,370,000	5	2	2	2.5	0.0	home.by holly	11-mortlock-circuit-kaleen-act-2617
47416	Apartment	2021-09-23	$553,150	2021-10-21	$553,150	2	2	2	5.5		home.by holly	69-21-aspinall-street-watson-act-2602
47418	Unit	2021-09-23	$270,000 - $300,000	2021-11-05	Undisclosed	2	1	1			McGrath Canberra	15-102-henderson-road-queanbeyan-nsw-2620
47419	Alpine	2021-09-23	$785,000	2022-03-11	$740,000	3	1	2			Henley Property - Jindabyne	2-38-gippsland-street-jindabyne-nsw-2627
47421	House	2021-09-24	Auction	2021-10-16	$980,000	5	2	0	5.0	446.0	Luton Gungahlin	21-inglewood-street-gungahlin-act-2912
47422	Unit	2021-09-24	$185,000 - $195,000	2021-10-07	$213,000	1	1	1			Ian McNamee & Partners - Queanbeyan	12-122-henderson-road-queanbeyan-nsw-2620
47426	House	2021-09-24	$1,510,000	2021-10-08	$1,510,000	3	1	1	2.0		home.by holly	110-rivett-street-hackett-act-2602
47430	Townhouse	2021-09-24	Online Auction Wed 13th October at 12:30pm	2021-10-13	Undisclosed	3	2	2	2.5		LJ Hooker Manuka	3-23-pigdon-place-belconnen-act-2617
47431	Apartment	2021-09-24	$417,000	2021-10-27	$417,000	1	1	1	6.0		home.by holly	111-17-dooring-street-braddon-act-2612
47435	House	2021-09-24	Guide $2,000,000 - $2,200,000	2022-02-28	Undisclosed	6	2	2		2.51	Ray White Bowral	23-missingham-parade-robertson-nsw-2577
47436	House	2021-09-24	By Negotiation -  Vicinity of $1,340,000	2022-07-01	$1,300,000	3	2	7			Marshall and Tacheci Real Estate	144b-murrah-street-bermagui-nsw-2546
47438	House	2021-09-24	Auction 08/10/2021	2021-10-08	$1,060,000	3	1	1	0.5	666.0	Ray White Canberra	5-chevalier-street-weston-act-2611
47440	AcreageSemi-rural	2021-09-24	Auction	2021-10-21	$2,925,000	4	2	3		3.1	Henley Property - Jindabyne	4-river-run-jindabyne-nsw-2627
47441	House	2021-09-24	Auction on-line 16th October 2021 @ 1pm	2021-10-06	$1,850,000	5	3	3	1.5	1226.0	Maloney's Property	6-molineaux-place-farrer-act-2607
47442	House	2021-09-24	Auction 08/10/2021	2021-10-08	$973,000	3	2	2	5.5	283.0	Ray White Canberra	14-barnet-close-phillip-act-2606
47443	House	2021-09-24	Expressions of Interest Closes 19/10/2021 @ 3:00pm	2021-11-08	$1,041,000	4	2	2	1.48	0.0	Wright Dunn Real Estate	8-ardlethan-street-fisher-act-2611
47444	Unit	2021-09-24	$275,000+	2021-10-11	Undisclosed	2	1	1	4.0		Ray White Canberra	19-30-springvale-drive-hawker-act-2614
47446	House	2021-09-24	Auction 14/10/2021	2021-10-14	$850,000	3	2	2	1.0	702.0	Ray White Canberra	10-gurr-street-calwell-act-2905
47447	House	2021-09-24	$1.2million	2021-10-25	$1,200,000	3	3	2		859.0	LJ Hooker Batemans Bay	24-mary-place-long-beach-nsw-2536
47448	Townhouse	2021-09-24	Forthcoming Auction	2021-09-28	$751,500	3	2	2	6.0		Canberry Properties	9-15-dickins-street-forde-act-2914
47454	House	2021-09-24	Auction 08/10/2021	2021-10-08	$1,722,000	5	3	3	4.0	796.0	Ray White Canberra	1-ponsford-place-nicholls-act-2913
47458	House	2021-09-24	Price On Request	2021-10-14	Undisclosed	3	2	2	5.0	400.0	Bastion Property Group	10-lanaba-street-crace-act-2911
47462	Apartment	2021-09-24	$365,000	2021-11-20	$365,000	2	1	1			Sails Real Estate	30-3197-princes-highway-millingandi-nsw-2549
47464	House	2021-09-24	$635,000	2021-10-08	$660,000	3	2	2		601.0	LJ Hooker Malua Bay	35-vista-avenue-catalina-nsw-2536
47466	House	2021-09-24	Auction	2021-10-08	Undisclosed	3	2	2		935.0	Ray White Bowral	44-burrawang-street-robertson-nsw-2577
47467	House	2021-09-24	Auction	2021-10-12	Undisclosed	4	2	2		1066.0	Ray White Bowral	42-burrawang-street-robertson-nsw-2577
47471	House	2021-09-25	Price Guide $850,000	2021-10-27	$850,000	4	3	2		666.0	Sails Real Estate	50-berrambool-drive-merimbula-nsw-2548
47476	Townhouse	2021-09-27	Auction 14/10/2021	2021-10-14	$630,000	3	1	2	5.0	0.0	Ray White Canberra	33-46-paul-coe-crescent-ngunnawal-act-2913
47477	Townhouse	2021-09-27	Auction 28/10/2021	2021-10-28	$865,000	3	2	2	8.0	406.0	Ray White Canberra	7-35-fullagar-crescent-higgins-act-2615
47478	House	2021-09-27	Auction 28/10/2021	2021-10-28	$820,000	3	2	2	8.5	346.0	Ray White Canberra	5-39-fullagar-crescent-higgins-act-2615
47479	Townhouse	2021-09-27	Auction 28/10/2021	2021-10-28	$840,500	3	2	2	8.0	300.0	Ray White Canberra	6-37-fullagar-crescent-higgins-act-2615
47481	Unit	2021-09-27	$289,000	2021-11-06	$289,000	2	1	1			LJ Hooker Queanbeyan – Jerrabomberra – Googong	17-7-young-street-crestwood-nsw-2620
47485	House	2021-09-27	Auction Bidding Guide $600,000-$650,000	2021-10-30	$703,000	3	1	3	0.0	550.0	My Agent Christine Ewin	61-timbara-crescent-surfside-nsw-2536
47487	Apartment	2021-09-27	$469,000	2021-12-10	$460,000	2	1	2			Ray White Batemans Bay	6-14-corrigan-crescent-batehaven-nsw-2536
47488	Apartment	2021-09-27	Offers Over $420,000	2021-12-14	$551,000	2	1	1	5.5		Sadil Quinlan	8-8-edmondson-street-campbell-act-2612
47490	Apartment	2021-09-27	Auction	2021-10-30	$335,000	1	1	1	6.0	0.0	LJ Hooker Woden/Weston	19-39-chandler-street-belconnen-act-2617
47491	House	2021-09-27	Auction	2021-10-07	$830,000	3	2	2	5.5	233.0	Luton Gungahlin	7-katoomba-street-harrison-act-2914
47492	Townhouse	2021-09-27	Auction, Mon 11th Oct at 6:00pm	2021-10-11	$905,000	3	2	2	6.0	308.0	LJ Hooker Gungahlin	2-77-zakharov-avenue-forde-act-2914
47495	House	2021-09-27	Auction	2021-10-23	$1,000,000	4	2	2	3.5	743.0	Luton Tuggeranong	40-barr-smith-avenue-bonython-act-2905
47496	House	2021-09-27	Auction	2021-10-06	$757,000	2	1	5	4.0	991.0	Luton Gungahlin	10-chauncy-crescent-richardson-act-2905
47497	House	2021-09-27	$790,000 - $820,000	2021-10-22	$800,000	3	2	2		578.0	Ray White Batemans Bay	19-freycinet-drive-sunshine-bay-nsw-2536
47501	Apartment	2021-09-27	Auction	2021-10-08	$407,000	1	1	1	6.0		Luton Gungahlin	103-14-boolee-street-reid-act-2612
47503	House	2021-09-27		2021-10-18	Undisclosed	3	1	1		1170.0	Hallmark Real Estate Advisors	7-monash-avenue-tuross-head-nsw-2537
47506	House	2021-09-27	$973,000	2021-11-10	$973,000	4	2	2		405.0	LJ Hooker Queanbeyan – Jerrabomberra – Googong	34-underhill-street-googong-nsw-2620
47509	Townhouse	2021-09-27	Auction	2021-10-26	Undisclosed	2	1	2			Ian McNamee & Partners - Queanbeyan	39-southbar-road-karabar-nsw-2620
47512	Land	2021-09-27	$510,000	2022-03-21	Undisclosed	0	0	0		1307.0	Whale Coast Realty	6-martin-grove-mystery-bay-nsw-2546
47513	Alpine	2021-09-27	Auction	2021-10-28	$1,600,000	4	2	3		555.0	Henley Property - Jindabyne	9-girvin-place-east-jindabyne-nsw-2627
47514	Land	2021-09-27	Auction	2021-10-20	$1,150,000	0	0	0		2427.0	Ray White Bowral	24-guthawah-way-renwick-nsw-2575
47517	Land	2021-09-28	Auction	2021-10-20	$405,000	0	0	0		861.0	Henley Property - Jindabyne	3-lantana-drive-kalkite-nsw-2627
47518	Land	2021-09-28	Auction	2021-10-20	$1,415,000	0	0	0		1638.0	Henley Property - Jindabyne	25-echidna-place-east-jindabyne-nsw-2627
47519	House	2021-09-28	Sold prior to auction	2021-10-09	$975,000	4	2	2	3.5	555.0	Morrissey Property	90-burdekin-avenue-amaroo-act-2914
47521	Townhouse	2021-09-28	$615,000	2021-11-09	$630,000	2	1	1	0.0		The Real Estate Shop	20-5-tristania-street-rivett-act-2611
47522	House	2021-09-28	Auction	2021-11-03	$1,215,000	3	1	1		1015.0	Henley Property - Jindabyne	4-power-place-jindabyne-nsw-2627
47523	Unit	2021-09-28	$399,000	2021-11-24	Undisclosed	1	1	1	6.0		Luton Manuka	5-77-macarthur-avenue-oconnor-act-2602
47525	Apartment	2021-09-28	Contact Agent	2021-11-29	Undisclosed	2	2	1	5.0		home.by holly	18-5-kerridge-street-kingston-act-2604
47526	House	2021-09-28	VIRTUAL AUCTION	2021-10-18	$880,000	3	2	3	3.0	0.0	McIntyre Property	53-carslake-loop-gordon-act-2906
47527	Townhouse	2021-09-28	VIRTUAL AUCTION	2021-10-18	$685,000	3	1	1	3.0	0.0	McIntyre Property	7-17-maddock-place-gordon-act-2906
47530	Townhouse	2021-09-28	Auction 23rd October at 3.30pm	2021-10-23	$703,000	3	1	2	5.0	362.0	LJ Hooker Tuggeranong	50-30-ebenezer-street-bonython-act-2905
47532	House	2021-09-28	$550,000	2021-11-22	$530,000	4	1	4		1081.0	Belle Property Braidwood	8-wallace-street-tarago-nsw-2580
47533	House	2021-09-28	$239,000	2021-12-09	Undisclosed	2	1	1		308.0	Raine & Horne Young	13-boothby-street-young-nsw-2594
47534	House	2021-09-28	$1,350,000 - $1,450,000	2021-10-27	$1,380,000	5	2	2		556.0	My Agent Christine Ewin	33-mulgowrie-street-malua-bay-nsw-2536
47535	House	2021-09-28	$1,050,000+	2021-10-22	$1,077,500	4	2	2	5.5		LJ Hooker Gungahlin	7-olary-street-amaroo-act-2914
47537	House	2021-09-28	Auction	2021-10-23	$1,385,000	4	2	2	5.0	800.0	Carter and Co Agents	34-temperley-street-nicholls-act-2913
47541	Townhouse	2021-09-28	SOLD $500,000	2021-10-07	$500,000	2	1	1	5.0		Blackshaw Gungahlin	21-47-freda-bennett-circuit-nicholls-act-2913
47542	Townhouse	2021-09-28	SOLD $812,500.00	2021-10-07	$812,500	3	2	2	6.0	231.0	Blackshaw Gungahlin	69-mary-gillespie-avenue-gungahlin-act-2912
47543	Townhouse	2021-09-28	Auction 21/10/2021	2021-10-21	$975,000	4	2	2	5.0	0.0	Ray White Canberra	1-137-lampard-circuit-bruce-act-2617
47544	House	2021-09-28	Online Auction	2021-10-12	$650,000	3	1	4		1069.0	Ray White Rural Canberra | Yass	53-victoria-street-yass-nsw-2582
47546	Unit	2021-09-28	$475,000+	2021-11-16	$493,000	2	1	1	6.0		LJ Hooker Dickson	63-29-dawes-street-kingston-act-2604
47553	House	2021-09-28	Auction 16 October at 1pm	2021-10-16	$830,000	3	1	2	3.0	856.0	LJ Hooker Tuggeranong	9-mcvilly-close-gordon-act-2906
47554	Apartment	2021-09-28	Online Auction	2021-10-14	$525,000	2	1	1	5.0		Luton Kippax	14-42-lhotsky-street-charnwood-act-2615
47555	House	2021-09-28	VIRTUAL AUCTION	2021-10-08	Undisclosed	4	2	2	0.0	921.0	McIntyre Property	2-hybon-avenue-queanbeyan-east-nsw-2620
47558	House	2021-09-28	By Negotiation	2021-11-12	$720,000	5	2	2	0.0	696.0	Heading Home Properties	48-agnes-avenue-queanbeyan-nsw-2620
47563	Townhouse	2021-09-29	Auction	2021-10-06	$860,000	3	2	2	4.0		Independent Gungahlin	3-12-lomax-street-forde-act-2914
47564	Other	2021-09-29	Forthcoming Auction	2021-11-01	Undisclosed	4	2	4		4.26	Luton Manuka	63-yuranga-drive-wamboin-nsw-2620
47565	House	2021-09-29	Auction 16/10/2021	2021-10-16	$900,000	4	2	2	6.0		McGrath Canberra	78-peter-cullen-way-wright-act-2611
47566	Apartment	2021-09-29	$439,000+	2021-11-19	$445,100	2	1	1	6.0		McGrath Canberra	401-17-dooring-street-braddon-act-2612
47569	House	2021-09-29	Auction	2021-10-09	Undisclosed	3	1	2	2.0	565.0	Blackshaw Belconnen	6-leycester-place-charnwood-act-2615
47570	Townhouse	2021-09-29	Auction 16/10/2021	2021-10-11	$711,000	3	2	2	4.5		McGrath Canberra	15-345-mirrabei-drive-moncrieff-act-2914
47571	House	2021-09-29	$1,144,000	2021-10-11	$1,144,000	4	2	2	3.5	440.0	McGrath Canberra	11-denoon-street-forde-act-2914
47572	Apartment	2021-09-29	Online Auction Wednesday 20th October, at 12.30pm	2021-10-20	$525,000	1	1	1	6.0		LJ Hooker Manuka	42-45-blackall-street-barton-act-2600
47574	House	2021-09-29	VIRTUAL AUCTION	2021-10-14	Undisclosed	3	1	2	2.0	645.0	McIntyre Property	5-foley-place-holt-act-2615
47575	House	2021-09-29	$1.4mil	2021-09-29	$1,400,000	4	2	4		2000.0	Raine & Horne Goulburn	44-platypus-circuit-goulburn-nsw-2580
47576	Townhouse	2021-09-29	Auction	2021-10-23	$685,000	2	2	1	6.0	0.0	Luton Manuka	2-15-braine-street-page-act-2614
47577	House	2021-09-29	VIRTUAL AUCTION	2021-10-05	$1,300,000	5	2	2	4.0	885.0	McIntyre Property	7-roughsey-place-conder-act-2906
47578	Townhouse	2021-09-29	$440,000	2021-11-02	$440,000	2	1	1			LJ Hooker Queanbeyan – Jerrabomberra – Googong	2-69-donald-road-karabar-nsw-2620
47580	House	2021-09-29	Auction 23rd October at 10.30am	2021-10-23	$1,000,000	4	2	2	1.5	822.0	LJ Hooker Tuggeranong	63-callaway-crescent-gordon-act-2906
47581	House	2021-09-29	$905,000	2021-10-14	$905,000	3	1	0	2.0	959.0	Blackshaw Gungahlin	6-kevin-street-evatt-act-2617
47582	House	2021-09-29	Auction	2021-10-18	$1,200,000	5	2	2		945.0	Ian McNamee & Partners - Queanbeyan	3-waterfall-drive-jerrabomberra-nsw-2619
47583	Unit	2021-09-29	Sold $465,000	2021-10-21	$465,000	2	2	1	6.0		Blackshaw Gungahlin	95-311-flemington-road-franklin-act-2913
47585	House	2021-09-29	Auction 21/10/2021	2021-10-21	Undisclosed	4	1	3	4.0	521.0	Ray White Canberra	20-bayley-street-narrabundah-act-2604
47586	House	2021-09-29	$839,000	2021-10-26	$830,000	3	2	0		635.0	LJ Hooker Tuross Head	4-evans-road-tuross-head-nsw-2537
47588	House	2021-09-29	Auction	2021-10-02	$1,260,000	5	3	3	5.5	406.0	Luton Gungahlin	360-anthony-rolfe-avenue-harrison-act-2914
47590	House	2021-09-29	Auction	2021-11-01	$2,170,000	4	1	2	1.5	1099.0	Ian McNamee & Partners - Queanbeyan	26-angas-street-ainslie-act-2602
47592	House	2021-09-29	AUCTION	2021-10-22	$531,000	2	1	1		1062.0	Ray White Goulburn	57-prince-street-goulburn-nsw-2580
47595	House	2021-09-29	Guide: $600,000 - $650,000	2021-11-22	$700,000	3	2	3		872.0	Henley Property - Cooma	31-myack-street-berridale-nsw-2628
47596	House	2021-09-29	Auction 21/10/2021	2021-10-21	$705,000	4	1	2	1.5	735.0	Ray White Canberra	20-geeves-court-charnwood-act-2615
47600	House	2021-09-29	Contact Agent	2021-10-29	Undisclosed	3	3	2		582.0	Raine & Horne Southern Highlands	65a-bendooley-street-bowral-nsw-2576
47601	House	2021-09-29	$849,000	2021-11-12	$835,000	4	2	2		821.4	Ray White Goulburn	57-quiberon-way-goulburn-nsw-2580
47602	House	2021-09-29	Under Contract - Inspections Cancelled	2021-10-12	$1,550,000	3	2	0		1515.0	Raine & Horne Southern Highlands	102-moss-vale-road-kangaroo-valley-nsw-2577
47604	House	2021-09-23	$819,000	2021-10-13	$795,000	4	2	2			Ray White Goulburn	34-mcguire-drive-goulburn-nsw-2580
47605	House	2021-09-29	SOLD - $1,252,000	2021-10-08	$1,252,000	4	2	2	4.5	392.0	Stone Gungahlin	31-neil-harris-crescent-forde-act-2914
47609	House	2021-09-29	Auction 23 October at 12pm	2021-10-23	$1,635,000	5	2	2	1.5	772.0	LJ Hooker Tuggeranong	74-appel-crescent-fadden-act-2904
47610	Land	2021-09-29	$339,000	2021-11-04	$339,000	0	0	0		710.0	LJ Hooker Moruya	9-swan-ridge-place-moruya-nsw-2537
47615	House	2021-09-29	Auction	2021-10-21	$580,000	3	1	1		765.0	Ray White Goulburn	24-eldon-street-goulburn-nsw-2580
47616	Apartment	2021-09-29	$620,900	2021-10-12	$610,900	1	1	1	6.0	0.0	Independent Projects	48-1-light-street-griffith-act-2603
47618	MixedFarming	2021-09-29	EOI	2021-11-08	Undisclosed	3	0	0		992.0	LAWD	young-2594-nsw
47619	House	2021-09-29	Auction	2021-10-16	$1,192,000	4	3	2	4.0		Independent Gungahlin	15-myra-law-crescent-moncrieff-act-2914
47620	Land	2021-09-29	$400,000-$440,000	2021-10-08	$460,000	0	0	0		1923.0	My Agent Christine Ewin	18-spotted-gum-place-north-batemans-bay-nsw-2536
47622	House	2021-09-29	Offers over $670,000	2021-10-21	$707,500	3	2	2	6.0	0.0	Crowthers	47-zakharov-avenue-forde-act-2914
47623	House	2021-09-29	Bidding Guide $750,000 - $780,000	2021-10-30	$960,000	4	2	2		608.0	My Agent Christine Ewin	50-fauna-avenue-long-beach-nsw-2536
47625	House	2021-09-30	Auction	2021-10-21	Undisclosed	5	3	3	3.0	1013.0	Luton Weston Creek & Molonglo Valley	40-mckail-crescent-stirling-act-2611
47626	House	2021-09-30	$880,000	2021-10-16	$880,000	3	1	2	6.0	715.0	home.by holly	20-kissane-crescent-evatt-act-2617
47627	House	2021-09-30	VIRTUAL AUCTION	2021-10-11	$809,000	3	2	2	3.5	724.0	McIntyre Property	3-mcgrowdie-place-gordon-act-2906
47628	Townhouse	2021-09-30	Auction 21/10/2021	2021-10-21	$881,000	3	2	1	2.0	325.7	Ray White Canberra	24-70-bourne-street-cook-act-2614
47630	House	2021-09-30	$959,000	2021-10-26	Undisclosed	4	2	2	2.5	823.0	Luton Manuka	12-sowden-street-mckellar-act-2617
47633	House	2021-09-30	Price On Request	2021-10-23	Undisclosed	4	3	2	4.5	565.0	Bastion Property Group	4-boobialla-street-oconnor-act-2602
47634	Apartment	2021-09-30	Online Auction Saturday 16th October, at 10am	2021-10-06	$650,000	2	1	1	2.0		LJ Hooker Manuka	1-33-dawes-street-kingston-act-2604
47636	House	2021-09-30	Online Auction - 20/10/21 10 am	2021-10-19	$730,000	3	1	1	4.0	498.0	Hodgkinson Real Estate	58-dixson-circuit-conder-act-2906
47637	House	2021-09-30	Auction 16/10/21	2021-10-16	$1,405,000	3	1	1	0.5	998.0	LJ Hooker Dickson	11-tyson-street-ainslie-act-2602
47641	Apartment	2021-09-30	$323,000+	2021-09-28	$323,000	1	1	0	6.0		Impact Properties	171-259-northbourne-avenue-lyneham-act-2602
47642	House	2021-09-30	$975,000 - $990,000	2021-09-29	$965,000	4	1	2			Ray White Bungendore	35-osborne-street-bungendore-nsw-2621
47643	House	2021-09-30	Auction 15/10/2021	2021-10-15	$910,000	4	2	2	4.5	941.0	Ray White Canberra	42-harry-hopman-circuit-gordon-act-2906
47644	House	2021-09-30	Auction	2021-10-21	Undisclosed	3	1	2	0.0	377.0	One Agency Sandy Morris	55-marconi-crescent-kambah-act-2902
47645	House	2021-09-30	$900,000+	2021-10-29	Undisclosed	4	2	3	2.5		One Agency Sandy Morris	3-eagle-circuit-kambah-act-2902
47646	House	2021-09-30	$650,000	2021-11-12	$650,000	3	1	2	0.0	394.0	home.by holly	1-96-uriarra-road-crestwood-nsw-2620
47647	House	2021-09-30	Auction	2021-10-11	$900,000	3	2	2	4.5	387.0	Timothy Road	14-patrick-shaw-street-casey-act-2913
47648	Townhouse	2021-09-30	Auction	2021-10-20	$740,000	2	1	1	2.5	208.0	Timothy Road	29-maclachlan-street-holder-act-2611
47650	House	2021-09-30	FORTHCOMING AUCTION	2021-10-14	$650,000	3	1	1		854.0	Elders Real Estate Batemans Bay	10-northcove-road-long-beach-nsw-2536
47651	House	2021-09-30	$829,000	2021-10-26	$810,000	4	3	2		949.0	Raine & Horne Goulburn	19-angela-place-goulburn-nsw-2580
47653	House	2021-09-30	FORTHCOMING AUCTION	2021-10-15	$675,000	3	2	1		702.0	Elders Real Estate Batemans Bay	3-cook-avenue-surf-beach-nsw-2536
47654	House	2021-09-30	Contact Agent	2021-10-23	Undisclosed	4	2	2	1.0	768.0	VERV Property	12-laidley-place-florey-act-2615
47655	Townhouse	2021-09-30	Auction	2021-10-21	Undisclosed	3	2	2	3.0	258.0	Timothy Road	10-mackenzie-street-hackett-act-2602
47656	Apartment	2021-09-30	$950,000	2021-12-08	Undisclosed	2	2	2	6.0		Luton Dickson	g13-20-26-anzac-park-campbell-act-2612
47665	Unit	2021-09-30	Online Auction	2021-10-16	$382,500	2	1	1	6.0	0.0	LJ Hooker Belconnen	42-2-ranken-place-belconnen-act-2617
47668	House	2021-09-30	Auction 21/10/2021	2021-10-21	Undisclosed	4	2	2	2.5	938.0	Ray White Canberra	19-glasgow-place-hughes-act-2605
47671	House	2021-09-30	Auction 23 October at 2pm	2021-10-23	Undisclosed	3	1	2	1.5	764.0	LJ Hooker Tuggeranong	31-beasley-street-torrens-act-2607
47675	Apartment	2021-09-30	$622,500	2021-10-15	$622,500	2	1	2	3.5		home.by holly	11-21-ijong-street-braddon-act-2612
47676	House	2021-09-30	By Negotiation - Vicinity of $700,000	2022-01-31	$710,000	3	2	2		559.0	Marshall and Tacheci Real Estate	5-beauty-point-road-wallaga-lake-nsw-2546
47677	House	2021-09-30		2021-11-01	Undisclosed	3	2	1		600.0	Tathra Beach Real Estate	18-sanctuary-place-tathra-nsw-2550
47678	Apartment	2021-09-30	$689,000+	2022-02-22	$700,000	2	2	2	6.0		LJ Hooker Woden/Weston	226-1-kalma-way-campbell-act-2612
47682	AcreageSemi-rural	2021-09-30	Open For Inspection This Sat 12.30pm to 1.30pm	2021-10-29	$1,800,000	3	1	6		34.79	Raine & Horne Southern Highlands	118-selbys-road-budgong-nsw-2577
47689	Apartment	2021-09-30	$412,000	2021-11-03	$412,000	1	1	1	6.0	0.0	home.by holly	13-25-fawkner-street-braddon-act-2612
47690	AcreageSemi-rural	2021-09-30	AUCTION	2021-10-20	$1,560,000	4	3	2		1.39	Henley Property - Jindabyne	36-snowgum-court-jindabyne-nsw-2627
53953	House	2021-07-30	$795,000	2022-05-16	$795,000	3	2	2		450.0	LJ Hooker Moruya	14-shorthorn-close-moruya-nsw-2537
54526	Unit	2021-09-01	$465,000	2022-02-25	$465,900	2	2	2	6.5		Canberry Properties	285-aspen-door-925-greenway-act-2900
85782	House	2021-09-14	Contact Agent	2023-09-21	Undisclosed	5	3	8		5863.0	Belle Property Braidwood	2-llewellyn-drive-braidwood-nsw-2622
92702	House	2021-07-22	$675,000 - $725,000	2024-02-02	Undisclosed	3	2	1		698.9	LJ Hooker Sussex Inlet	3-coral-court-sussex-inlet-nsw-2540
