id	type	ListingDate	PriceLabel	SoldDate	SoldPrice	Beds	Baths	Cars	EER	PlotSize	Agency.Name	Slug
51610	Apartment	2022-01-19	Offers over $399,000	2022-04-15	$410,000	1	1	0	6.0	47.0	Burgess Rawson Residential	615-19-challis-street-dickson-act-2602
52036	House	2022-01-02	Under Contract	2022-03-20	$790,000	3	2	3		904.0	Guy Higgins Property Sales	312-bermagui-road-akolele-nsw-2546
52039	House	2022-01-03	$1,000,000 to $1,090,000	2022-03-24	$1,090,000	4	2	2		649.0	LJ Hooker Batemans Bay	29-michener-court-long-beach-nsw-2536
52061	House	2022-01-04	$579,000	2022-04-06	$559,000	3	1	1		740.0	Raine & Horne Goulburn	17-wheatley-avenue-goulburn-nsw-2580
52067	House	2022-01-04	Auction	2022-01-17	Undisclosed	4	2	2	4.5	465.0	Luton Gungahlin	48-hanley-street-casey-act-2913
52074	Townhouse	2022-01-04	Auction - $699,000+	2022-01-15	$720,000	3	2	2	6.0		Luton Gungahlin	33-363-mirrabei-drive-moncrieff-act-2914
52077	House	2022-01-04	Auction 25th Jan 2022	2022-01-25	$795,000	3	1	0	0.5	804.0	Sadil Quinlan	266-wheeler-crescent-wanniassa-act-2903
52078	House	2022-01-04	$320,000+	2022-03-03	Undisclosed	1	1	1	6.0		Ray White Canberra	116-41-chandler-street-belconnen-act-2617
52080	Townhouse	2022-01-04	Forthcoming Auction - $369,000+	2022-02-09	$383,000	1	1	1	3.5	323.6	Luton Gungahlin	39-de-bortoli-street-gungahlin-act-2912
52083	House	2022-01-04	Price Guide of $1,200,000 - $1,300,000	2022-03-09	Undisclosed	4	2	2		556.0	Whale Coast Realty	35-myuna-street-dalmeny-nsw-2546
52088	House	2022-01-04	AUCTION	2022-02-02	$2,270,000	3	2	2		2567.0	Henley Property - Jindabyne	17-lakeview-terrace-east-jindabyne-nsw-2627
52090	Alpine	2022-01-04	Guide $1.4 to 1.45 M	2022-02-16	Undisclosed	5	2	5			Henley Property - Jindabyne	7-ted-winter-close-jindabyne-nsw-2627
52091	House	2022-01-05	$759 000 - $799 000	2022-02-28	Undisclosed	3	1	1		619.0	Ian McNamee & Partners - Queanbeyan	132-uriarra-road-queanbeyan-nsw-2620
52096	House	2022-01-05	Auction	2022-02-05	$1,335,000	4	2	2	1.5	810.0	Luton Gungahlin	50-pokana-circuit-kaleen-act-2617
52099	House	2022-01-05	Auction 29/01/2022	2022-01-29	$1,151,000	4	2	2	4.0	651.0	Ray White Canberra	4-crespin-place-banks-act-2906
52102	Townhouse	2022-01-05	Auction 05/02/2022	2022-02-05	$690,000	3	2	2	6.0		Ray White Canberra	14-20-helpmann-street-bonython-act-2905
52103	Townhouse	2022-01-05	Auction 28/01/2022	2022-01-28	Undisclosed	3	2	2			Ray White Canberra	12-6-doeberl-place-karabar-nsw-2620
52104	House	2022-01-05	$899,000	2022-03-22	$887,000	3	1	2		628.0	Clearwater Real Estate Narooma	7-fishermans-cres-north-narooma-nsw-2546
52107	Townhouse	2022-01-05	Auction 29/01/2022	2022-01-29	Undisclosed	3	2	1	6.0		Ray White Canberra	10-93-chewings-street-scullin-act-2614
52108	Apartment	2022-01-05	Auction 27/01/2022	2022-01-20	Undisclosed	1	1	1	3.0	1868.4	Ray White Canberra	2-9-keith-street-scullin-act-2614
52116	Apartment	2022-01-05	420000+	2022-01-25	$420,000	2	1	1	6.0		Luton Dickson	602-2-akuna-street-city-act-2601
52117	Apartment	2022-01-05	Auction 5th Feb at 10.00am	2022-02-05	$520,000	2	2	2	6.0		LJ Hooker Tuggeranong	94-104-henry-kendall-street-franklin-act-2913
52118	House	2022-01-05	$741,000	2022-02-25	$741,000	3	1	1		725.0	Clearwater Real Estate Narooma	8-grenville-ave-tuross-head-nsw-2537
52120	House	2022-01-05	Auction	2022-01-29	Undisclosed	5	2	2	4.5	729.0	Luton Kippax	2-mag-place-dunlop-act-2615
52122	House	2022-01-05	Auction	2022-01-27	$935,500	3	1	1	0.5	778.0	LJ Hooker Belconnen	8-carron-street-page-act-2614
52124	House	2022-01-05	$669,000	2022-02-16	$615,000	3	1	1		556.0	LJ Hooker Tuross Head	15-brighton-street-tuross-head-nsw-2537
52129	House	2022-01-05	Auction	2022-01-29	Undisclosed	4	2	2	6.0	487.0	Luton Gungahlin	7-alan-watt-crescent-casey-act-2913
52131	House	2022-01-05	By Negotiation	2022-03-16	$850,000	3	1	1			Luton Tuggeranong	248-calabash-road-tinderry-nsw-2620
52132	Townhouse	2022-01-05	$799,000+	2022-01-20	$825,000	3	2	2	6.0	0.0	LJ Hooker Gungahlin	43-jumbuck-crescent-lawson-act-2617
52135	House	2022-01-05	By Negotiation	2022-02-21	$915,000	3	1	0	2.0	0.0	Confidence Real Estate	8-icely-place-kambah-act-2902
52141	House	2022-01-05	$1,150,000 - $1,250,000	2022-01-17	$1,230,000	6	2	4		556.0	My Agent Christine Ewin	121-ainslie-parade-tomakin-nsw-2537
52148	Apartment	2022-01-05	$475,000+	2022-02-04	Undisclosed	1	1	1	6.0		Impact Properties	39-2-edinburgh-avenue-city-act-2601
52154	Apartment	2022-01-06	$399,000+	2022-01-25	$400,000	1	1	1	6.0	0.0	Canberry Properties	37-21-christina-stead-street-franklin-act-2913
52159	House	2022-01-06	Auction 03/02/2022	2022-02-03	Undisclosed	3	2	1	1.5	703.0	Ray White Canberra	48-mortlock-circuit-kaleen-act-2617
52164	Townhouse	2022-01-06	Auction 28/01/2022	2022-01-28	Undisclosed	3	1	1	5.0	0.0	Ray White Canberra	31-70-bourne-street-cook-act-2614
52169	House	2022-01-06	Auction 29/01/2022	2022-01-29	Undisclosed	4	2	1	0.5	974.0	Ray White Canberra	6-crane-place-farrer-act-2607
52170	Apartment	2022-01-06	$549,000+	2022-02-16	Undisclosed	2	2	1	5.5		Ray White Canberra	406-16-moore-street-city-act-2601
52171	Apartment	2022-01-06	By Negotiation	2022-04-08	Undisclosed	1	1	1	6.0		Ray White Canberra	1323-240-bunda-street-city-act-2601
52173	House	2022-01-06	$ 799,999 +	2022-02-07	$866,000	3	2	2	6.0	0.0	Confidence Real Estate	20-mccredie-street-taylor-act-2913
52176	Apartment	2022-01-06	Auction, Sat 29th Jan at 11.30am	2022-01-29	$557,500	2	2	2	6.0	0.0	LJ Hooker Gungahlin	1-50-hillcrest-street-crace-act-2911
52177	House	2022-01-06	Auction - On Site	2022-02-12	Undisclosed	3	1	1	3.5	801.0	Ray White Canberra	6-biraban-place-macquarie-act-2614
52178	House	2022-01-06	Auction 28/01/2022	2022-01-28	Undisclosed	4	2	3	1.5	1264.0	Ray White Canberra	20-nepean-place-macquarie-act-2614
52179	House	2022-01-06	Auction 29/01/2022	2022-01-29	Undisclosed	2	1	1	3.0	448.0	Ray White Canberra	10-dugdale-street-cook-act-2614
52180	Townhouse	2022-01-06	Auction	2022-01-29	$588,500	2	1	1	2.0		Solely Properties	14-19-ashby-circuit-kambah-act-2902
52186	DuplexSemi-detached	2022-01-06	Auction 03/02/2022	2022-02-03	Undisclosed	3	1	0	1.5	552.25	Ray White Canberra	6-madigan-street-hackett-act-2602
52187	House	2022-01-06	Auction	2022-02-12	$775,000	2	1	2		657.6	LJ Hooker Malua Bay	6-bavarde-avenue-batemans-bay-nsw-2536
52188	House	2022-01-06	$880,000 - $930,000	2022-04-19	$902,000	4	2	1	0.0	607.0	My Agent Christine Ewin	81-ridge-street-catalina-nsw-2536
52199	House	2022-01-06	Auction 03/02/2022	2022-02-03	Undisclosed	5	4	2		974.8	Ray White Canberra	230-bicentennial-drive-jerrabomberra-nsw-2619
52200	Townhouse	2022-01-06	By Negotiation	2022-03-16	$985,000	3	2	2	4.5		Luton Tuggeranong	3-21-bernacchi-street-mawson-act-2607
52203	DuplexSemi-detached	2022-01-06	Auction on 5/2 @ Noon	2022-02-05	$1,175,000	3	1	0	1.5	428.0	Maloney's Property	75-lowanna-street-braddon-act-2612
52204	DuplexSemi-detached	2022-01-06	Auction	2022-02-05	$755,000	2	1	1	5.5		Maloney's Property	5-salomons-place-ainslie-act-2602
52206	House	2022-01-06	Offers above $979,000	2022-02-15	$1,000,000	5	3	2	1.5	1155.0	Town Residential	8-nicholls-place-higgins-act-2615
52233	House	2022-01-08	$729,000	2022-01-25	$715,000	3	2	1		632.3	LJ Hooker Malua Bay	16-flinders-way-surf-beach-nsw-2536
52234	Apartment	2022-01-10	$725,000 - $775,000	2022-05-27	$730,000	2	2	2			Sails Real Estate	62-1-elizabeth-street-merimbula-nsw-2548
52235	House	2022-01-10	$895,000	2022-02-09	Undisclosed	3	2	4	5.0	1103.0	The Real Estate Shop	6-doughty-place-gilmore-act-2905
52237	House	2022-01-10	$975,000+	2022-02-21	$990,000	4	2	1	1.0	938.0	Ray White Canberra	15-degraves-crescent-wanniassa-act-2903
52238	House	2022-01-10	Auction 05/02/2022	2022-02-05	$1,090,000	5	2	2	2.5	776.0	Ray White Canberra	35-willoughby-crescent-gilmore-act-2905
52240	DuplexSemi-detached	2022-01-10	Auction 05/02/2022	2022-02-05	$1,265,000	3	2	2	0.0	780.0	Ray White Canberra	24a-hovea-street-oconnor-act-2602
52242	Land	2022-01-10	$700,000 - $750,000	2022-03-08	$710,000	0	0	0		5.0	My Agent Christine Ewin	18-blackbutt-lane-malua-bay-nsw-2536
52245	House	2022-01-10	AUCTION	2022-02-09	$660,000	3	1	1		955.0	Raine & Horne Goulburn	5-kadwell-street-goulburn-nsw-2580
52246	House	2022-01-10	Auction- Onsite	2022-01-22	$1,251,000	4	2	2		930.0	Ray White Queanbeyan | Jerrabomberra	17-forest-drive-jerrabomberra-nsw-2619
52250	Land	2022-01-10	$570,000	2022-02-04	$570,000	0	0	0		538.0	LJ Hooker Queanbeyan – Jerrabomberra – Googong	lot-860-lanham-street-googong-nsw-2620
52253	House	2022-01-10	$ 805,000 +	2022-02-28	$870,000	3	2	2	6.0	0.0	Confidence Real Estate	18-mccredie-street-taylor-act-2913
52258	House	2022-01-10	$1,795,000	2022-04-01	$1,650,000	3	3	11		2.56	LJ Hooker Batemans Bay	3-sanctuary-forest-place-long-beach-nsw-2536
52263	House	2022-01-10	Open Home Cancelled	2022-02-16	$1,250,000	5	2	1		1467.0	Raine & Horne Southern Highlands	1270-nowra-road-fitzroy-falls-nsw-2577
52268	House	2022-01-10	SOLD	2022-02-07	$995,000	3	2	3		780.0	Smile Elite	6-corks-lane-milton-nsw-2538
52299	Townhouse	2022-01-11	Auction 05/02/2022	2022-02-05	$660,000	3	2	2	3.5	0.0	Ray White Canberra	83-25-pinkerton-circuit-kambah-act-2902
52304	Apartment	2022-01-11	$685,000	2022-07-15	$670,000	2	2	2	6.0		Luton Tuggeranong	310-2-batman-street-braddon-act-2612
52305	House	2022-01-11	$810,000	2022-03-18	$820,000	4	2	2		1898.0	Henley Property - Berridale	16-morrice-street-berridale-nsw-2628
52306	DuplexSemi-detached	2022-01-11	AUCTION	2022-02-05	Undisclosed	3	1	1	3.5		McIntyre Property	39-karrugang-circuit-ngunnawal-act-2913
52307	House	2022-01-11	Sold via Auction	2022-01-31	Undisclosed	4	2	2	4.5	450.0	Stone Gungahlin	38-ben-blakeney-street-bonner-act-2914
52312	House	2022-01-11	Auction	2022-01-27	Undisclosed	3	2	2	2.0	846.0	Luton Tuggeranong	106-bugden-avenue-gowrie-act-2904
52314	DuplexSemi-detached	2022-01-11	Auction 05/02/2022	2022-02-05	$790,000	2	1	2	1.0	780.0	Ray White Canberra	24b-hovea-street-oconnor-act-2602
52315	Lifestyle	2022-01-11	$489,000	2022-01-27	$490,000	0	0	0		18.0	Ray White Braidwood	12-bluebell-road-northangera-nsw-2622
52327	Apartment	2022-01-12	By Negotiation	2022-02-09	$575,000	3	2	1	2.5	0.0	LJ Hooker Gungahlin	56-112-baldwin-drive-kaleen-act-2617
52329	House	2022-01-12	Offers $450,000 + 	2022-03-23	$450,000	4	1	1		4000.0	One Agency Craig Schofield	43-maclean-street-numeralla-nsw-2630
52330	House	2022-01-12	$320,000	2022-03-16	$310,000	3	1	1		620.0	One Agency Craig Schofield	6-orana-avenue-cooma-nsw-2630
52337	House	2022-01-12	$ 1050000- $ 1070000	2022-03-31	$1,070,000	4	2	2	6.0	0.0	Confidence Real Estate	27-bonarba-link-googong-nsw-2620
52338	House	2022-01-12	By Negotiation	2022-02-04	$993,500	4	2	2	4.0	925.0	Luton Tuggeranong	1-firbank-close-isabella-plains-act-2905
52342	House	2022-01-12	Sold at Auction - $780,000	2022-02-05	$780,000	4	1	2	4.5	783.0	McGrath Canberra	35-scantlebury-crescent-theodore-act-2905
52343	House	2022-01-12	Auction	2022-02-03	$730,000	3	1	0	1.5	795.0	LJ Hooker Belconnen	17-osburn-drive-macgregor-act-2615
52344	Townhouse	2022-01-12	Auction	2022-01-29	$545,000	2	1	1	1.0		LJ Hooker Belconnen	19-goddard-crescent-holt-act-2615
52346	House	2022-01-12	SOLD via Auction - $896,000	2022-01-31	$896,000	3	2	2	3.0	450.0	McGrath Canberra	18-tarrant-crescent-dunlop-act-2615
52349	House	2022-01-12	Auction 03/02/2022	2022-02-03	Undisclosed	3	1	1	2.0		Ray White Canberra	33-krichauff-street-page-act-2614
52352	Apartment	2022-01-12	Offers over $349,000	2022-02-10	$360,000	1	1	1	6.0		Luton Manuka	255-325-anketell-street-greenway-act-2900
52355	House	2022-01-12	Auction	2022-02-05	$1,155,000	4	2	1	4.0	780.0	Luton Dickson	84-dixon-drive-holder-act-2611
52360	House	2022-01-12	$1,249,000	2022-03-30	Undisclosed	5	3	2		1302.0	Whale Coast Realty	15-lamont-young-drive-mystery-bay-nsw-2546
52361	Townhouse	2022-01-12	$950,000	2022-02-17	$970,000	3	2	2			Henley Property - Jindabyne	1-3-cobbodah-street-jindabyne-nsw-2627
52362	Townhouse	2022-01-13	Auction	2022-02-02	Undisclosed	3	3	2	6.0		Luton Weston Creek & Molonglo Valley	32-58-max-jacobs-avenue-wright-act-2611
52363	Townhouse	2022-01-13	Auction	2022-01-21	Undisclosed	3	2	2	1.0		Luton Weston Creek & Molonglo Valley	2-burara-crescent-waramanga-act-2611
52364	House	2022-01-13	Auction	2022-02-05	Undisclosed	4	2	2	1.0	905.0	Luton Weston Creek & Molonglo Valley	75-nangor-street-waramanga-act-2611
52365	Apartment	2022-01-13	$649,000+	2022-02-10	$660,000	2	2	2	6.0		PURNELL	96-29-dawes-street-kingston-act-2604
52366	Townhouse	2022-01-13	Auction	2022-01-22	Undisclosed	2	1	1	6.0		Luton Weston Creek & Molonglo Valley	2-131-port-jackson-circuit-phillip-act-2606
52367	Townhouse	2022-01-13	Auction Wednesday 2nd February at 6pm	2022-02-02	$750,000	3	2	1	4.5	0.0	McCann Properties	3-72-tenison-woods-circuit-bonython-act-2905
52369	House	2022-01-13	Auction	2022-02-05	Undisclosed	4	3	2	1.5	1009.0	Luton Weston Creek & Molonglo Valley	42-hawker-street-torrens-act-2607
52370	Land	2022-01-13	$180,000	2022-02-08	$180,000	0	0	0		915.0	Belle Property Braidwood	29-wallace-street-braidwood-nsw-2622
52371	House	2022-01-13	AUCTION	2022-01-25	Undisclosed	3	1	2	1.0	755.0	McIntyre Property	27-bullock-circuit-kambah-act-2902
52372	House	2022-01-13	Auction 04/02/2022	2022-02-04	$867,000	3	1	2	1.5	740.0	Ray White Canberra	3-goessling-place-flynn-act-2615
52375	Other	2022-01-13	Expressions of Interest	2022-02-11	$906,000	0	0	0		57.8	Belle Property Braidwood	915-mount-fairy-road-mount-fairy-nsw-2580
52376	House	2022-01-13	Sold via auction	2022-02-05	Undisclosed	4	2	2	4.0		McGrath Canberra	43-hurrell-street-forde-act-2914
52377	House	2022-01-13	Auction - Saturday February 5th, on site at 10am	2022-02-05	Undisclosed	4	2	2			LJ Hooker Manuka	19-thorpe-avenue-queanbeyan-nsw-2620
52380	House	2022-01-13	$1,150,000 plus	2022-02-10	Undisclosed	4	2	3	0.0	719.0	Ray White Canberra	31-bambridge-street-weetangera-act-2614
52383	House	2022-01-13	Auction Saturday February 5th, on site at 11:30am	2022-02-05	Undisclosed	3	1	3	1.0	668.0	LJ Hooker Manuka	4-strzelecki-crescent-narrabundah-act-2604
52385	House	2022-01-13	Auction 05/02/2022	2022-02-05	$1,550,000	4	2	2	0.5	1411.0	Ray White Canberra	5-mckeahnie-street-weetangera-act-2614
52386	Apartment	2022-01-13	$425,000	2022-02-11	$425,000	1	1	1	6.0	0.0	Independent Projects	159-11-irving-street-phillip-act-2606
52387	Apartment	2022-01-13	$430,000	2022-02-08	$430,000	1	1	1	6.0	0.0	Independent Projects	169-11-irving-street-phillip-act-2606
52388	House	2022-01-13	SOLD AT AUCTION $1,180,000	2022-02-05	$1,180,000	4	2	1	2.5		McGrath Canberra	14-murchison-street-kaleen-act-2617
52390	Townhouse	2022-01-13	Auction 04/02/2022	2022-02-04	Undisclosed	2	1	1	3.0		Ray White Canberra	17-46-catchpole-street-macquarie-act-2614
52392	House	2022-01-13	$799,000+ (Auction 05/02/2022)	2022-02-05	Undisclosed	3	1	2	4.5		Ray White Canberra	3-macvitie-place-macquarie-act-2614
52393	Apartment	2022-01-13	$415,000	2022-02-01	$415,000	1	1	1	6.0	0.0	Independent Projects	137-11-irving-street-phillip-act-2606
52394	Apartment	2022-01-13	$405,000	2022-02-09	$405,000	1	1	1	6.0	0.0	Independent Projects	115-11-irving-street-phillip-act-2606
52396	House	2022-01-13	Auction 05/02/2022	2022-02-05	Undisclosed	4	2	2	6.0	255.2	Ray White Canberra	45-mapleton-avenue-harrison-act-2914
52401	House	2022-01-13	Auction Saturday February 12th, on site at 9:30am	2022-02-12	$1,310,000	4	2	2	1.5		LJ Hooker Manuka	38-fitzhardinge-crescent-evatt-act-2617
52402	Apartment	2022-01-13	Auction 03/02/2022	2022-02-03	Undisclosed	2	1	1	3.5		Ray White Canberra	39-7-medley-street-chifley-act-2606
52403	House	2022-01-13	Auction 04/02/2022	2022-02-04	Undisclosed	3	1	2	1.0	781.0	Ray White Canberra	3-birdwood-street-hughes-act-2605
52404	House	2022-01-13	Sold at Auction - $808,000	2022-02-05	$808,000	3	1	1	3.5	376.0	McGrath Canberra	40-honyong-crescent-ngunnawal-act-2913
52405	House	2022-01-13	$2,300,000 - $2,530,000	2022-03-30	$2,400,000	5	3	10		9.62	Luton Tuggeranong	1616-old-cooma-road-royalla-nsw-2620
52406	House	2022-01-13	Auction 05/02/2022	2022-02-05	$930,000	3	1	3	3.5	790.0	Ray White Canberra	26-max-henry-crescent-macarthur-act-2904
52407	House	2022-01-13	Auction 05/02/2022	2022-02-05	$1,145,000	4	2	2	4.5	902.0	Ray White Canberra	23-galbraith-close-banks-act-2906
52408	House	2022-01-13	Auction 28/01/2022	2022-01-24	$1,500,000	4	2	2	0.5	741.0	Ray White Canberra	62-fitchett-street-garran-act-2605
52409	Townhouse	2022-01-13	Auction 03/02/2022	2022-01-28	Undisclosed	3	2	1	3.5		Ray White Canberra	2-74-britten-jones-drive-holt-act-2615
52410	Townhouse	2022-01-13	Auction 03/02/2022	2022-02-03	Undisclosed	2	1	1	2.0		Ray White Canberra	1-3-sexton-street-cook-act-2614
52411	House	2022-01-13	$789,000	2022-02-18	$789,000	3	2	2		737.0	LJ Hooker Tuross Head	7-andrew-avenue-tuross-head-nsw-2537
52414	House	2022-01-13	Auction 04/02/2022	2022-02-04	$1,061,000	3	2	0	1.5	947.0	Ray White Canberra	16-newbery-crescent-page-act-2614
52416	House	2022-01-13	Auction 03/02/2022	2022-02-03	Undisclosed	4	2	3	1.5	0.0	Ray White Canberra	38-mortlock-circuit-kaleen-act-2617
52417	Unit	2022-01-13	$515,200	2022-02-01	$515,200	2	1	1	6.0		home.by holly	48-35-tay-street-watson-act-2602
52421	House	2022-01-13	AUCTION On-Site on 29/01/2022	2022-01-29	$1,450,000	4	2	2	3.0	0.0	Confidence Real Estate	16-bakewell-street-coombs-act-2611
52422	Land	2022-01-13	BIDDING GUIDE $550,000	2022-02-19	$650,000	0	0	0		556.0	My Agent Christine Ewin	21-dampier-street-congo-nsw-2537
52423	Unit	2022-01-13	$299,000+	2022-02-17	Undisclosed	2	1	1	4.5		Ray White Canberra	7a-30-glenorchy-street-lyons-act-2606
52426	Unit	2022-01-13	Auction	2022-01-29	$380,000	2	1	1	4.5		LJ Hooker Belconnen	8-3-bonrook-street-hawker-act-2614
52431	House	2022-01-13	Auction	2022-02-02	$1,495,000	4	2	6	0.5	966.0	LJ Hooker Kaleen	105-bandjalong-crescent-aranda-act-2614
52433	Townhouse	2022-01-13	Auction 04/02/2022	2022-02-04	Undisclosed	3	1	2	1.5	418.0	Ray White Canberra	2-wardill-close-holt-act-2615
52434	House	2022-01-13	SOLD	2022-02-11	$1,410,000	4	2	2		778.0	Smile Elite	7-national-avenue-shell-cove-nsw-2529
52435	Unit	2022-01-13	Contact Agent	2022-03-04	$255,500	1	1	1			LJ Hooker Queanbeyan – Jerrabomberra – Googong	6-38-isabella-street-queanbeyan-nsw-2620
52436	Unit	2022-01-13	$415,000	2022-02-28	$415,000	1	1	1			LJ Hooker Queanbeyan – Jerrabomberra – Googong	7-15-morisset-street-queanbeyan-nsw-2620
52437	House	2022-01-13	$1,690,000	2022-02-03	$1,690,000	5	3	2			Smile Elite	36-the-promontory-drive-shell-cove-nsw-2529
52438	House	2022-01-13	Price Guide $900,000	2022-01-13	$900,000	3	2	2			Sails Real Estate	143-headland-drive-tura-beach-nsw-2548
52442	Land	2022-01-13	SOLD	2022-06-17	$650,000	0	0	0		271.6	Smile Elite	lot-6406-nabthorpe-parade-schofields-nsw-2762
52443	House	2022-01-13	By Openn Negotiation	2022-02-11	$1,630,000	4	1	4		702.0	Whale Coast Realty	35-riverside-drive-narooma-nsw-2546
52444	House	2022-01-14	$665,000	2022-01-14	$665,000	3	1	2		581.7	Ray White Batemans Bay	4-wattle-crescent-batehaven-nsw-2536
52445	House	2022-01-14	Auction	2022-02-05	Undisclosed	4	2	2	3.0	631.0	Luton Weston Creek & Molonglo Valley	17-meerup-street-amaroo-act-2914
52447	House	2022-01-14	Auction	2022-02-03	Undisclosed	3	1	2	4.5	661.0	Luton Weston Creek & Molonglo Valley	3-alawa-street-waramanga-act-2611
52451	House	2022-01-14	Auction	2022-01-18	$980,000	4	2	3	2.0		Luton Tuggeranong	20-currey-street-gowrie-act-2904
52452	House	2022-01-14	Auction 03/02/2021	2022-02-03	Undisclosed	5	2	3	0.5	861.0	Ray White Canberra	14-deacon-close-chisholm-act-2905
52453	Terrace	2022-01-14	AUCTION	2022-02-01	$922,500	4	2	2	6.0	241.0	Ally Smith - Edge Real Estate	10-birdseye-lane-gungahlin-act-2912
52455	Apartment	2022-01-14	Under offer 	2022-02-03	$710,000	2	1	1			PURNELL	27-4-tench-street-kingston-act-2604
52456	House	2022-01-14	$495,000	2022-03-02	$495,000	3	1	1		902.0	Belle Property Braidwood	30-coronation-avenue-braidwood-nsw-2622
52458	Apartment	2022-01-14	Price Guide $600,000 - $650,000	2022-04-08	$605,000	2	1	1			Sails Real Estate	2-8-sapphire-coast-drive-merimbula-nsw-2548
52461	Apartment	2022-01-14	$435,000	2022-03-15	$435,000	1	1	1	6.0		Maloney's Property	42-35-torrens-street-braddon-act-2612
52462	House	2022-01-14	Auction	2022-02-02	Undisclosed	4	2	2	4.0		Independent Gungahlin	54-bingley-crescent-fraser-act-2615
52467	Townhouse	2022-01-14	Auction	2022-02-10	$830,000	3	2	3	2.0		Luton Tuggeranong	1-19-may-maxwell-crescent-gilmore-act-2905
52475	Apartment	2022-01-14	$370,000 +	2022-01-28	$375,000	1	1	1	6.0		Timothy Road	141-64-college-street-belconnen-act-2617
52476	House	2022-01-14	Bidding Guide $680,000	2022-02-19	Undisclosed	1	1	0		611.0	My Agent Christine Ewin	3-banksia-street-broulee-nsw-2537
52482	House	2022-01-14	Auction 04/02/2022	2022-02-04	Undisclosed	3	1	1	1.0	643.0	Ray White Canberra	9-mollison-street-scullin-act-2614
52487	Unit	2022-01-14	$1,550,000+	2022-02-23	Undisclosed	3	2	2	4.5		Ray White Canberra	15-9-jardine-street-kingston-act-2604
52490	House	2022-01-14	$1,485,000	2022-03-25	$1,485,000	5	3	8		5497.0	LJ Hooker Malua Bay	8-nicholas-grove-rosedale-nsw-2536
52494	House	2022-01-14	$825,000	2022-01-14	$825,000	2	1	1		582.0	My Agent Christine Ewin	16-grantham-road-batehaven-nsw-2536
52502	House	2022-01-14	$990,000	2022-02-09	$1,070,000	4	2	2		556.0	Ray White Batemans Bay	41-kingston-place-tomakin-nsw-2537
52508	House	2022-01-15	$975,000	2022-01-25	Undisclosed	4	3	1		967.0	Whale Coast Realty	10-whiffens-lane-central-tilba-nsw-2546
52510	House	2022-01-17	Under Contract	2022-03-22	$895,000	4	2	1		923.0	Elders Real Estate Batemans Bay	4-elouera-close-lilli-pilli-nsw-2536
52511	House	2022-01-17	$349,000	2022-03-11	$341,000	3	1	1		632.0	Ray White Goulburn	45-hoskins-street-goulburn-nsw-2580
52512	Townhouse	2022-01-17	Auction Thursday 3rd February at 6pm	2022-02-03	$675,000	3	2	2	2.0	0.0	McCann Properties	3-18-horbury-street-phillip-act-2606
52513	House	2022-01-17	AUCTION if not sold prior	2022-02-24	$635,000	3	1	1			Ray White Goulburn	87-clinton-street-goulburn-nsw-2580
52519	Unit	2022-01-17	Contact Agent	2022-02-11	Undisclosed	2	1	1		238.0	Raine & Horne Young	1-4-old-barracks-lane-young-nsw-2594
52521	House	2022-01-17	BIDDING GUIDE: $1.3 Million	2022-02-19	$1,915,000	4	3	3		816.0	My Agent Christine Ewin	71-banyandah-street-south-durras-nsw-2536
52523	House	2022-01-17	Bidding Guide $850,000	2022-02-19	$1,070,000	3	2	3		563.0	My Agent Christine Ewin	11-reid-street-tomakin-nsw-2537
52524	Apartment	2022-01-17	$448,000+	2022-03-18	Undisclosed	1	1	1	6.0	0.0	Ray White Canberra	516-1-elouera-street-braddon-act-2612
52525	House	2022-01-17	Auction Bidding Guide $600,000	2022-02-19	$694,000	4	2	1		556.0	My Agent Christine Ewin	10-bernadette-blvde-batehaven-nsw-2536
52527	House	2022-01-17	AUCTION	2022-02-02	$680,000	3	1	2	2.0	537.0	McIntyre Property	3-tom-place-charnwood-act-2615
52530	House	2022-01-17	Auction Bidding Guide $750,000	2022-02-19	$916,000	3	1	2		727.0	My Agent Christine Ewin	76-sunpatch-parade-tomakin-nsw-2537
52531	House	2022-01-17	Auction	2022-02-16	$820,000	4	3	5		1505.0	Henley Property - Cooma	2-moloola-avenue-cooma-nsw-2630
52537	House	2022-01-17	$779,000	2022-02-11	$779,000	3	1	1		556.0	LJ Hooker Batemans Bay	21-sunset-street-surfside-nsw-2536
52542	House	2022-01-17	Auction	2022-02-12	$808,500	3	1	1		557.0	LJ Hooker Batemans Bay	4-burrawang-crescent-sunshine-bay-nsw-2536
52545	House	2022-01-17	AUCTION	2022-02-14	$1,000,000	3	2	2	2.5	1400.0	McIntyre Property	25-jackie-howe-crescent-macarthur-act-2904
52551	House	2022-01-17	$800,000 - $850,000	2022-02-10	$840,000	3	2	2		473.0	My Agent Christine Ewin	22-fairway-view-catalina-nsw-2536
52555	Apartment	2022-01-17	$420,000+	2022-02-10	$441,000	2	1	1	2.5		Luton Dickson	20-30-chinner-crescent-melba-act-2615
52556	House	2022-01-17	Auction	2022-02-04	Undisclosed	3	1	2	1.0	1105.0	LJ Hooker Dickson	93-shakespeare-crescent-fraser-act-2615
52558	House	2022-01-17	By Negotiation	2022-02-08	$875,000	3	2	5	1.0	749.0	Impact Properties	30-beattie-crescent-richardson-act-2905
52559	Land	2022-01-18	Price Range $880,00 -$925,000	2022-05-16	$900,000	0	0	0		942.0	LJ Hooker Batemans Bay	16-bent-street-batemans-bay-nsw-2536
52560	House	2022-01-18	FORTHCOMING AUCTION	2022-02-23	$1,275,000	4	2	2		816.0	LJ Hooker Batemans Bay	29-mary-place-long-beach-nsw-2536
52562	Apartment	2022-01-18	By Negotiation	2022-04-20	Undisclosed	4	1	1	3.0	0.0	Hodgkinson Real Estate	10-5-hyndes-crescent-holder-act-2611
52563	House	2022-01-18	Auction Sat, 12th of Feb at 10:00am	2022-02-12	$1,226,000	4	2	2	5.0	519.0	LJ Hooker Gungahlin	9-phantom-street-harrison-act-2914
52565	Apartment	2022-01-18	$525,900	2022-02-15	$525,900	2	2	2	5.0	0.0	GEOCON	316-335-anketell-street-greenway-act-2900
52566	House	2022-01-18	$1,525,000	2022-03-16	Undisclosed	4	2	2	3.0		Ray White Canberra	26-davis-street-weetangera-act-2614
52567	House	2022-01-18	$849,000	2022-03-01	$849,000	3	1	1	4.0	764.0	Luton Manuka	51-louisa-lawson-crescent-gilmore-act-2905
52568	House	2022-01-18	Auction	2022-02-14	Undisclosed	3	2	2	4.0		Luton Manuka	11-haystack-crescent-palmerston-act-2913
52574	Townhouse	2022-01-18	Auction Sat, 5th Feb at 11:30am	2022-02-05	$966,000	4	2	2	4.5	0.0	LJ Hooker Gungahlin	10-4-tauss-place-bruce-act-2617
52575	Land	2022-01-18	$370,000 - $390,000	2022-02-25	$365,000	0	0	0		941.9	Ray White Goulburn	30-mcgrath-place-goulburn-nsw-2580
52576	Apartment	2022-01-18	$370,000+	2022-02-11	$452,000	1	1	1	6.0	9727.0	McIntyre Property	136-8-limburg-way-greenway-act-2900
52581	House	2022-01-18	SOLD	2022-03-11	$1,385,000	4	3	2		369.0	Smile Elite	47-messenger-street-north-kellyville-nsw-2155
52584	House	2022-01-18	SOLD	2022-02-10	$1,500,000	4	2	5		2009.0	Smile Elite	44-wuru-drive-burrill-lake-nsw-2539
52585	House	2022-01-18	SOLD	2022-04-01	$745,000	3	1	1		650.0	Smile Elite	ulladulla-2539-nsw
52586	House	2022-01-18	$1,350,000	2022-03-03	$1,350,000	4	3	1		822.0	Smile Elite	44-kurrajong-crescent-conjola-park-nsw-2539
52587	House	2022-01-18	SOLD	2022-01-28	Undisclosed	4	3	2		1003.0	Smile Elite	34-mison-circuit-mollymook-beach-nsw-2539
52588	House	2022-01-18	SOLD	2022-03-03	$1,480,000	5	3	5		856.0	Smile Elite	105-camden-street-ulladulla-nsw-2539
52589	House	2022-01-18	SOLD	2022-05-23	$690,000	3	1	0		696.0	Smile Elite	75-anglers-parade-fishermans-paradise-nsw-2539
52591	House	2022-01-18	SOLD - $1,860,000	2022-03-17	$1,860,000	5	3	2		374.0	Smile Elite	21-gasnier-avenue-north-kellyville-nsw-2155
52593	House	2022-01-18	SOLD	2022-02-15	$1,450,000	4	2	2		374.0	Smile Elite	31-gasnier-avenue-north-kellyville-nsw-2155
52595	House	2022-01-18	SOLD $1185000	2022-03-14	$1,185,000	4	2	5		1124.0	Smile Elite	25-kanuka-drive-ulladulla-nsw-2539
52596	House	2022-01-18	SOLD - $955,000	2022-02-16	$955,000	4	2	2		684.0	Smile Elite	30-gemini-way-narrawallee-nsw-2539
52597	House	2022-01-18	640000	2023-04-06	$640,000	4	2	0		845.0	Smile Elite	166-princes-highway-milton-nsw-2538
52598	AcreageSemi-rural	2022-01-18	SOLD	2022-05-31	$3,200,000	10	5	2		5501.0	Smile Elite	34-regent-street-maitland-nsw-2320
52601	House	2022-01-18	$1,499,000 +	2022-02-18	$1,600,000	5	2	2	1.5	729.0	Carter and Co Agents	12-quandong-street-oconnor-act-2602
52604	Townhouse	2022-01-18	Auction	2022-02-10	Undisclosed	2	1	1		180.0	Ray White Queanbeyan | Jerrabomberra	5-25-thurralilly-street-queanbeyan-east-nsw-2620
52605	House	2022-01-18	$660,000	2022-01-18	$650,000	4	2	2		753.0	One Agency Craig Schofield	14-warra-street-cooma-nsw-2630
52608	House	2022-01-18	Auction	2022-02-13	$525,000	3	1	4		3.0	Ray White Rural Canberra | Yass	6-dale-st-bookham-nsw-2582
52609	House	2022-01-18	By Negotiation	2022-02-14	$1,510,000	2	1	0		6299.0	Bella Coastal Property	10-weemala-crescent-bawley-point-nsw-2539
52610	House	2022-01-18	Auction	2022-02-12	$902,000	3	2	1	5.5	352.79	Ray White Rural Canberra | Yass	3-myulung-street-ngunnawal-act-2913
52611	Townhouse	2022-01-18	Auction	2022-02-12	$690,000	3	2	2	6.0	182.0	Ray White Rural Canberra | Yass	6-4-lawrenson-circuit-jacka-act-2914
52615	House	2022-01-18	Price Guide $1,650,000	2022-02-01	Undisclosed	4	2	3		5.0	Raine & Horne Southern Highlands	17-25-grevillea-place-colo-vale-nsw-2575
52616	House	2022-01-18	SOLD - $1,257,500	2022-02-07	$1,257,500	5	2	3	4.5	850.0	Stone Gungahlin	3-whittell-crescent-florey-act-2615
52618	House	2022-01-18	Auction 12/02/2022	2022-02-12	$1,250,000	3	1	1	0.5	864.0	Ray White Canberra	95-beasley-street-torrens-act-2607
52623	House	2022-01-18	Auction 12/02/2022	2022-02-04	$1,400,000	3	2	2	1.0	735.0	Ray White Canberra	183-antill-street-downer-act-2602
52626	Townhouse	2022-01-18	Contact Agent	2022-02-05	$825,000	3	2	2	6.0		One Agency Gamarra & Co	26-56-christina-stead-street-franklin-act-2913
52627	House	2022-01-18	$995,000	2022-02-10	Undisclosed	3	2	1		601.0	Whale Coast Realty	11-hyland-avenue-narooma-nsw-2546
52634	Townhouse	2022-01-19	$695,000	2022-04-13	$695,000	3	3	2	6.0	2173.0	New Door Properties	23d-narrambla-terrace-lawson-act-2617
52635	House	2022-01-19	Sold prior $1,000,000	2022-02-04	$1,000,000	3	2	2	4.0	433.0	Blackshaw Gungahlin	9-rosella-street-nicholls-act-2913
52637	House	2022-01-19	Auction	2022-02-10	$1,230,000	3	2	2	6.0	475.7	Ray White Rural Canberra | Yass	2-biddlecombe-st-pearce-act-2607
52638	House	2022-01-19	Auction 10/02/2022	2022-02-10	$1,000,000	3	1	0	2.0	680.0	Civium Property Group - Residential	3-goulburn-street-macquarie-act-2614
52639	House	2022-01-19	Auction Saturday 5th February at 10am	2022-02-05	$875,000	3	1	2	0.0	885.0	McCann Properties	4-gair-place-wanniassa-act-2903
52640	House	2022-01-19	Auction Wednesday 9th February at 6pm	2022-02-09	Undisclosed	4	2	2	2.0	991.0	McCann Properties	11-holden-crescent-wanniassa-act-2903
52643	House	2022-01-19	$330,000 - $350,000	2022-01-18	$350,000	3	1	2		613.0	One Agency Craig Schofield	29-yareen-road-cooma-nsw-2630
52646	House	2022-01-19	SOLD AT AUCTION $1,337,000	2022-02-12	$1,337,000	4	2	2	3.0		McGrath Canberra	64-tiptree-crescent-palmerston-act-2913
52647	House	2022-01-19	Auction Saturday 12 February 12:30pm On Site	2022-02-12	$1,036,000	3	2	4	2.0	943.0	Cream Residential	31-kallara-close-duffy-act-2611
52648	Townhouse	2022-01-19	SOLD at Auction	2022-02-12	$680,000	2	1	1	4.5		Cream Residential	11-86-mawson-drive-mawson-act-2607
52650	House	2022-01-19	AUCTION	2022-02-14	$780,000	3	2	1	2.5	750.0	McIntyre Property	63-hadleigh-circuit-isabella-plains-act-2905
52652	Townhouse	2022-01-19	$1,300,000	2022-03-29	Undisclosed	4	2	2	4.5		Luton Gungahlin	12-45-dobbin-circuit-nicholls-act-2913
52653	House	2022-01-19	EXPRESSIONS OF INTEREST BY 9 FEBRUARY AT 5PM	2022-02-10	$1,350,000	3	2	2	4.0	416.0	Maria Selleck Properties	20-fernyhough-crescent-lyneham-act-2602
52657	House	2022-01-19	$1,225,000	2022-02-18	$1,225,000	4	2	4	2.0		McGrath Canberra	40-henry-melville-crescent-gilmore-act-2905
52660	House	2022-01-19	Forthcoming auction	2022-02-22	$985,000	4	2	2	4.0	487.0	LJ Hooker Gungahlin	9-star-close-amaroo-act-2914
52661	Land	2022-01-19	Auction Guide $890,000 - $950,000	2022-02-22	$1,200,000	0	0	0		64.0	Raine & Horne Southern Highlands	524-hanging-rock-road-sutton-forest-nsw-2577
52666	House	2022-01-19	$675,000	2022-02-03	Undisclosed	4	2	3		700.0	Elders Real Estate Batemans Bay	23-valley-road-denhams-beach-nsw-2536
52668	House	2022-01-19	SOLD - $1,263,000	2022-02-07	$1,263,000	4	2	2	5.5	646.0	Stone Gungahlin	4-bev-lawson-street-casey-act-2913
52670	House	2022-01-19	Auction	2022-02-24	Undisclosed	4	2	2	2.0	341.0	Luton Tuggeranong	67-mortimer-lewis-drive-greenway-act-2900
52672	House	2022-01-19	Auction	2022-02-12	$1,400,000	4	2	2	6.0		Luton Gungahlin	5-amphlett-street-moncrieff-act-2914
52673	Apartment	2022-01-19	$245,000+	2022-02-24	$260,000	1	1	1	4.5	78.4	LJ Hooker Dickson	2a-111-knox-street-watson-act-2602
52675	Apartment	2022-01-19	$395,000+	2022-02-10	$400,000	2	1	1	6.0		Ray White Canberra	6-26-chaseling-street-phillip-act-2606
52676	House	2022-01-19	Bidding Guide $530,000	2022-02-19	$570,000	2	1	0		626.0	My Agent Christine Ewin	15-pleasurelea-drive-sunshine-bay-nsw-2536
52677	Other	2022-01-19	$335,000	2022-03-02	$335,000	0	0	0		34.0	Belle Property Braidwood	lot-4-tudor-valley-road-braidwood-nsw-2622
52679	House	2022-01-19	$279,000	2022-01-19	$274,000	3	1	2		2115.0	One Agency Craig Schofield	4-6-stanton-street-nimmitabel-nsw-2631
52717	House	2022-01-19	AUCTION	2022-02-07	$930,000	4	2	2	3.5	685.0	McIntyre Property	22-glencross-street-chisholm-act-2905
52722	House	2022-01-19	$1,350,000+	2022-02-22	$1,350,000	4	2	2	5.5	745.0	LJ Hooker Gungahlin	71-mcclelland-avenue-nicholls-act-2913
52723	House	2022-01-19	Auction 12/02/2022	2022-02-08	$2,200,000	4	2	2	3.5	1407.69	Ray White Canberra	6-hack-street-oconnor-act-2602
52724	House	2022-01-19	Auction 24/02/2022	2022-02-24	Undisclosed	5	3	3		40.0	Ray White Canberra	48-coulton-road-wallaroo-nsw-2618
52725	House	2022-01-19	Auction	2022-01-28	$875,000	3	1	2	2.5	1192.0	Luton Tuggeranong	38-falkiner-place-macarthur-act-2904
52728	Unit	2022-01-19	$495,000	2022-03-01	$470,000	2	1	1	6.0		LJ Hooker Belconnen	5-39-benjamin-way-belconnen-act-2617
52730	House	2022-01-19	Auction  05/02/2022	2022-02-01	$1,050,000	4	2	2	3.0	0.0	Confidence Real Estate	11-john-james-loop-macgregor-act-2615
52731	House	2022-01-19	Auction on 10/2 @ 12.30pm	2022-02-10	$722,000	3	1	1	3.5		Maloney's Property	21-attiwell-circuit-kambah-act-2902
52732	House	2022-01-19	Auction 17/02/2022	2022-02-17	$2,615,000	6	2	2		10.0	Ray White Canberra	28-gooroomon-ponds-road-wallaroo-nsw-2618
52734	Unit	2022-01-19	$230,000	2022-03-17	$237,000	1	1	1			Ray White Queanbeyan | Jerrabomberra	1-10-arthur-street-crestwood-nsw-2620
52740	House	2022-01-19	$1,050,000 to $1,120,000	2022-02-28	$1,090,000	4	2	2		980.0	Ray White Bungendore	12-birch-drive-bungendore-nsw-2621
52741	House	2022-01-19	AUCTION	2022-02-14	$1,479,000	3	1	2	0.0	879.0	McIntyre Property	3-mccrae-street-garran-act-2605
52743	House	2022-01-19	SOLD - $2,150,000	2022-02-07	$2,150,000	5	4	2	6.0	730.0	Stone Gungahlin	1-drummer-street-harrison-act-2914
52744	House	2022-01-19	$1,160,000	2022-02-05	$1,160,000	4	2	1	2.5	853.0	home.by holly	46-ballarat-street-fisher-act-2611
52746	House	2022-01-19	$1,275,000 - $1,400,000	2022-02-16	Undisclosed	4	2	2		664.0	LJ Hooker Sussex Inlet	10-alamein-road-sussex-inlet-nsw-2540
52748	Villa	2022-01-19	SOLD - $817,000	2022-02-07	$817,000	3	2	2	5.0		Stone Gungahlin	7-39-mornington-street-amaroo-act-2914
52749	House	2022-01-19	$1,750,000	2022-02-15	$1,750,000	4	1	2	1.0	825.0	Maloney's Property	17-gellibrand-street-campbell-act-2612
52751	House	2022-01-19	$750,000	2022-03-04	$750,000	3	1	1		860.0	Clearwater Real Estate Narooma	49-shore-st-moruya-nsw-2537
52752	House	2022-01-19	Auction	2022-02-16	$1,050,000	3	1	1	4.0		Luton Dickson	70-burn-street-downer-act-2602
52757	Townhouse	2022-01-20	Offers over $609,000	2022-01-24	Undisclosed	3	1	2	4.5	279.0	One Agency Sandy Morris	22-18-cromwell-circuit-isabella-plains-act-2905
52758	House	2022-01-20	Auction	2022-02-06	Undisclosed	3	2	2	5.0	1332.0	One Agency Sandy Morris	14-purbrick-street-chisholm-act-2905
52759	House	2022-01-20	$1,475,000+	2022-02-19	Undisclosed	4	2	2	5.5		One Agency Sandy Morris	30-mt-vernon-drive-kambah-act-2902
52760	Apartment	2022-01-20	$300,000	2022-04-04	$300,000	1	1	0	6.0		home.by holly	101-2-akuna-street-city-act-2601
52761	House	2022-01-20	Under Offer	2022-02-07	Undisclosed	3	1	1	0.5	1003.0	One Agency Sandy Morris	4-hopwood-place-kambah-act-2902
52763	Apartment	2022-01-20	$395,000+	2022-02-22	Undisclosed	2	1	1	4.0		One Agency Sandy Morris	142-8-limburg-way-greenway-act-2900
52764	House	2022-01-20	Auction - Saturday February 12th, On site at 3:30p	2022-02-12	$850,000	3	1	1	3.5		LJ Hooker Manuka	8-watkins-street-wanniassa-act-2903
52769	Apartment	2022-01-20	Auction - Saturday February 12th, On site at 11:00	2022-02-12	$682,500	2	2	2	3.5		LJ Hooker Manuka	730-1-elouera-street-braddon-act-2612
52771	Land	2022-01-20	$750,000	2022-05-16	$735,000	0	0	0	0.0	587.0	McGrath Canberra	1-mendoza-street-moncrieff-act-2914
52773	Townhouse	2022-01-20	Auction 12/2/22	2022-02-14	$667,000	3	2	2			Ian McNamee & Partners - Queanbeyan	2-10-karabar-street-queanbeyan-nsw-2620
52774	House	2022-01-20	Auction 12/02/2022	2022-02-12	Undisclosed	4	2	2	4.5		Ray White Canberra	14-herman-close-florey-act-2615
52775	Apartment	2022-01-20	$409,000+	2022-02-17	$437,500	1	1	1	6.0		Ray White Canberra	104-15-irving-street-phillip-act-2606
52776	House	2022-01-20	Auction	2022-02-12	$870,000	3	1	1	2.5	825.0	Luton Kippax	8-creed-place-macgregor-act-2615
52778	Other	2022-01-20	$250,000	2022-07-01	$220,000	0	0	0		26.71	One Agency Craig Schofield	peak-view-road-peak-view-nsw-2630
52781	House	2022-01-20	Auction	2022-02-12	$1,100,000	3	1	2	1.5	797.0	Luton Kippax	16-aurora-close-mawson-act-2607
52782	House	2022-01-20	$1,370,000	2022-02-12	$1,370,000	4	2	2	0.5	783.0	home.by holly	15-onkaparinga-crescent-kaleen-act-2617
52783	House	2022-01-20	Contact Agent	2022-02-10	$1,310,000	4	3	2	4.5	540.0	VERV Property	9-bilin-bilin-street-bonner-act-2914
52833	House	2022-01-20	$775,000	2022-03-16	$770,000	4	2	3		1033.0	Ray White Goulburn	5-maclura-drive-marulan-nsw-2579
52834	Apartment	2022-01-20	$ 399,000 +	2022-02-22	$425,000	1	1	1	5.5	0.0	Confidence Real Estate	128-121-easty-street-phillip-act-2606
52835	House	2022-01-20	$750,000-$800,000	2022-02-17	$851,000	3	1	1		999.0	Sails Real Estate	12-bellbird-crescent-merimbula-nsw-2548
52878	House	2022-01-20	$849,000.00	2022-02-16	$820,000	3	1	1		658.0	LJ Hooker Tuross Head	12-anderson-avenue-tuross-head-nsw-2537
52916	Townhouse	2022-01-20	$750,000+	2022-02-12	$770,000	4	2	2	5.0	237.0	LJ Hooker Gungahlin	27-domain-street-palmerston-act-2913
52917	House	2022-01-20	Auction on site 05/02/2022	2022-02-05	Undisclosed	3	2	2	6.0	210.0	Ray White Canberra	63-9-braybrooke-street-bruce-act-2617
52918	House	2022-01-20	Price Range: $690,000-$720,000	2022-02-07	$690,000	3	2	1		711.0	LJ Hooker Batemans Bay	70-melaleuca-crescent-catalina-nsw-2536
52920	House	2022-01-20	$1,350,000	2022-02-09	$1,350,000	3	1	2	1.5	698.0	home.by holly	20-hedley-street-hackett-act-2602
52922	House	2022-01-20	Auction	2022-02-12	Undisclosed	5	2	2	1.0		Luton Dickson	6-florina-place-hawker-act-2614
52923	House	2022-01-20	Price Guide of $1,485,000	2022-01-20	$1,600,000	4	3	4		1.73	InHouse Real Estate	112-toallo-st-pambula-nsw-2549
52925	Unit	2022-01-20	$579,000	2022-03-11	$581,000	3	1	1			Sails Real Estate	3-4-calendo-court-merimbula-nsw-2548
52928	House	2022-01-20	SOLD	2022-05-04	$690,000	4	1	2		979.0	Smile Elite	283-keppel-street-west-bathurst-nsw-2795
52930	House	2022-01-20	SOLD	2022-01-31	$385,000	3	1	0		901.0	Smile Elite	31-perrier-place-kelso-nsw-2795
52931	House	2022-01-20	SOLD	2022-02-16	Undisclosed	4	3	2		651.0	Smile Elite	55-mcbrien-drive-kiama-downs-nsw-2533
52932	Land	2022-01-20	SOLD	2022-02-23	$85,000	0	0	0		1518.0	Smile Elite	26-church-street-trunkey-creek-nsw-2795
52933	House	2022-01-20	SOLD	2022-03-24	$1,200,000	4	2	4		1098.0	Smile Elite	10-gell-place-abercrombie-nsw-2795
52935	House	2022-01-20	SOLD - $745,000	2022-01-31	$745,000	3	2	2		622.0	Smile Elite	161-dawson-street-girards-hill-nsw-2480
52936	House	2022-01-20	SOLD	2022-02-07	$705,000	4	2	3		920.0	Smile Elite	43-rose-street-south-bathurst-nsw-2795
52938	House	2022-01-20	SOLD	2022-01-24	Undisclosed	4	1	3		810.0	Smile Elite	20-parraweena-place-eglinton-nsw-2795
52940	Villa	2022-01-20	SOLD - $547,500	2022-02-17	$547,500	2	1	1			Smile Elite	currans-hill-2567-nsw
52942	House	2022-01-20	Auction	2022-02-26	$1,235,000	3	2	1		822.0	Ray White Batemans Bay	72-sunpatch-parade-tomakin-nsw-2537
52944	House	2022-01-20	Auction 	2022-02-09	Undisclosed	4	2	2	4.0		Badenoch Real Estate	10-hensman-street-latham-act-2615
52945	Apartment	2022-01-20	$529,000+	2022-02-21	$562,000	2	2	1	6.0		LJ Hooker Gungahlin	105-6-8-cape-street-dickson-act-2602
52946	Apartment	2022-01-20	$299,000+	2022-03-11	$323,000	1	1	1	6.0	0.0	LJ Hooker Gungahlin	309-100-gungahlin-place-gungahlin-act-2912
52947	Land	2022-01-20	$349,000	2022-01-31	$354,000	0	0	0		703.0	LJ Hooker Malua Bay	18-bellbird-drive-malua-bay-nsw-2536
52948	House	2022-01-20	Auction	2022-02-16	$725,000	3	1	1	3.5	368.0	LJ Hooker Kaleen	36-charlton-crescent-gordon-act-2906
52950	Apartment	2022-01-20	Auction 03/02/2022	2022-02-03	Undisclosed	2	2	2	5.5		Ray White Canberra	231-15-irving-street-phillip-act-2606
52963	House	2022-01-20	Contact Agent	2022-03-07	$1,125,000	5	2	4	0.0	845.0	Rapport Property	52-rusten-street-karabar-nsw-2620
52965	Townhouse	2022-01-20	Auction 03/02/2022	2022-02-03	Undisclosed	2	1	1			Ray White Canberra	5-6-yarrow-street-queanbeyan-east-nsw-2620
52966	Apartment	2022-01-20	$370,000+	2022-02-17	Undisclosed	2	1	1	6.0		Civium Property Group - Residential	80-21-battye-street-bruce-act-2617
52967	House	2022-01-20	Auction	2022-02-05	$835,000	3	1	0	2.0	743.0	LJ Hooker Belconnen	41-luehmann-street-page-act-2614
52970	AcreageSemi-rural	2022-01-20	$1,200,000 - $1,300,000	2022-02-24	Undisclosed	4	2	0		107.92	Ray White Canberra	585-dairy-creek-road-gundaroo-nsw-2620
52971	House	2022-01-20	$879,000	2022-03-21	$870,000	5	3	2		709.0	Raine & Horne Goulburn	5-5a-aston-martin-drive-goulburn-nsw-2580
52972	House	2022-01-21	Auction	2022-02-13	Undisclosed	5	4	6	4.5	1797.0	Luton Weston Creek & Molonglo Valley	52-monkman-street-chapman-act-2611
52973	House	2022-01-21	$772,000	2022-02-05	$772,000	3	1	0	3.0	500.0	Hugo. Canberra	52-mainwaring-rich-circuit-palmerston-act-2913
52974	House	2022-01-21	Auction 10/02/2022	2022-02-04	Undisclosed	4	2	1	1.0	746.0	Ray White Canberra	21-hemmant-street-oconnor-act-2602
52975	House	2022-01-21	Bidding Guide $520,000	2022-02-19	$643,000	3	1	1		556.0	My Agent Christine Ewin	10-mulgowrie-street-malua-bay-nsw-2536
52976	Land	2022-01-21	Auction	2022-02-26	$1,200,000	0	0	0		607.0	Ray White Batemans Bay	38-grant-street-broulee-nsw-2537
52983	Apartment	2022-01-21	$485,000+	2022-03-08	$485,000	1	1	1	6.0		LJ Hooker Canberra City	406-27-lonsdale-street-braddon-act-2612
52984	House	2022-01-21	$870,000 - $920,000	2022-02-07	$880,000	4	2	3		719.0	My Agent Christine Ewin	4-angophora-place-catalina-nsw-2536
52985	Apartment	2022-01-21	EXPRESSIONS OF INTEREST BY 9 FEBRUARY AT 5PM	2022-02-10	$660,000	2	2	2	6.0		Maria Selleck Properties	305-2-gribble-street-gungahlin-act-2912
52987	Apartment	2022-01-21	Auction, Wed 23rd Feb at 5:00pm	2022-02-23	$642,500	2	2	1	6.0	0.0	LJ Hooker Gungahlin	609-222-city-walk-canberra-act-2601
52989	Townhouse	2022-01-21	$825,000	2022-02-02	$825,000	3	2	1	2.5		home.by holly	25-124-de-burgh-street-lyneham-act-2602
52996	House	2022-01-21	SOLD	2022-05-07	$1,925,000	4	3	6		675.0	Smile Elite	15-richwood-ridge-port-macquarie-nsw-2444
53002	House	2022-01-21	Sold via auction	2022-02-12	Undisclosed	4	2	1	1.0	813.0	McGrath Canberra	144-blamey-crescent-campbell-act-2612
53010	Land	2022-01-21	Guide $695,000	2022-08-05	$675,000	0	0	0		2095.0	Ray White Bowral	lot-6-meehan-place-moss-vale-nsw-2577
53013	House	2022-01-21	PRICE GUIDE $750,000	2022-03-02	$785,000	4	1	0			Tathra Beach Real Estate	50-jellat-way-kalaru-nsw-2550
53015	House	2022-01-21	$ 850,000	2022-03-04	$850,000	3	2	2	3.5	0.0	Confidence Real Estate	17-mary-hall-circuit-dunlop-act-2615
53018	House	2022-01-21	AUCTION	2022-02-05	Undisclosed	4	2	2	1.5	749.0	McIntyre Property	64-must-circuit-calwell-act-2905
53020	House	2022-01-21	Auction	2022-02-12	$890,500	3	2	2	2.5	0.0	Confidence Real Estate	12-oxenham-circuit-gordon-act-2906
53021	House	2022-01-21	SOLD	2022-03-28	$889,000	4	2	2		625.0	Smile Elite	11-astwood-street-colyton-nsw-2760
53026	House	2022-01-21	Auction	2022-02-23	$780,000	2	2	2	0.0		LJ Hooker Canberra City	17-5-gould-street-turner-act-2612
53028	House	2022-01-21	SOLD	2022-03-10	$470,000	3	1	3		978.0	Smile Elite	19-stapleton-avenue-casino-nsw-2470
53038	House	2022-01-23	$1,275,000	2022-02-08	$1,265,000	3	1	1	0.0	791.0	Michael Potter Real Estate	16-mcnamara-street-pearce-act-2607
53042	House	2022-01-24	Auction 12/02/22 10am On Site	2022-02-12	$900,000	4	2	2	3.5	620.0	Morrissey Property	11-odern-place-ngunnawal-act-2913
53046	House	2022-01-24	$1,850,000	2022-05-03	$1,850,000	5	3	1		582.0	LJ Hooker Malua Bay	12-view-street-batehaven-nsw-2536
53048	House	2022-01-24	Sold prior to auction	2022-02-18	$1,061,500	4	2	3		777.0	McGrath Canberra	40-yeo-crescent-yass-nsw-2582
53049	House	2022-01-24	$840,000 - $870,000	2022-02-15	$868,500	5	2	2		923.0	LJ Hooker Malua Bay	11-flinders-way-surf-beach-nsw-2536
53050	House	2022-01-24	$800,000 - $850,000	2022-02-09	$840,000	4	2	2		989.0	LJ Hooker Malua Bay	43-edward-road-batehaven-nsw-2536
53055	Townhouse	2022-01-24	Offers over $625,000	2022-01-29	Undisclosed	3	1	2	4.0	288.0	One Agency Sandy Morris	8-8-wilson-crescent-banks-act-2906
53058	Townhouse	2022-01-24	Sold $740,000	2022-02-03	$740,000	3	2	2	4.5	159.0	Luton Tuggeranong	20-10-helpmann-street-bonython-act-2905
53059	House	2022-01-24	$339,000	2022-03-01	Undisclosed	4	2	2		955.0	Raine & Horne Young	227-albury-street-harden-nsw-2587
53062	Lifestyle	2022-01-24	Auction	2022-02-25	$550,000	0	0	0		12.3	Ray White Goulburn	40-povey-place-breadalbane-nsw-2581
53066	AcreageSemi-rural	2022-01-24	$2,600,000	2022-09-09	Undisclosed	10	5	14		3.78	Fraser-Gray Real Estate	72-donnellys-road-moruya-nsw-2537
53068	House	2022-01-24	AUCTION - 25th February 2022	2022-02-22	Undisclosed	4	2	6		6452.0	Ray White Goulburn	12-racecourse-drive-goulburn-nsw-2580
53071	Apartment	2022-01-24	Auction	2022-02-16	$407,500	1	1	1	5.0		LJ Hooker Canberra City	49-11-fawkner-street-braddon-act-2612
53075	House	2022-01-24	SOLD AT AUCTION $905,000	2022-02-12	$905,000	3	2	2	4.5		McGrath Canberra	42-wanderer-court-amaroo-act-2914
53077	House	2022-01-24	Auction 19/02/2022	2022-02-19	$1,680,000	5	2	2	4.0	1029.0	LJ Hooker Dickson	98-temperley-street-nicholls-act-2913
53078	Land	2022-01-24	$399,000	2022-02-10	$430,000	0	0	0		921.0	LJ Hooker Malua Bay	4-vince-place-malua-bay-nsw-2536
53084	House	2022-01-24	Sold via auction	2022-02-19	$900,000	3	2	2	1.5	914.0	McGrath Canberra	76-summerland-circuit-kambah-act-2902
53085	House	2022-01-24	Auction	2022-02-18	Undisclosed	4	2	2		766.0	Smile Elite	6-creole-street-berowra-nsw-2081
53087	House	2022-01-24	Contact Agent	2022-09-13	$1,250,000	4	2	4		2122.0	Smile Elite	314-stewart-street-bathurst-nsw-2795
53091	House	2022-01-25	Sold via auction	2022-02-19	Undisclosed	4	2	2	2.5		McGrath Canberra	8-westbury-circuit-nicholls-act-2913
53095	House	2022-01-25	Auction Sunday 20th February at 12pm	2022-02-20	$590,000	2	1	3			McCann Properties	26-collector-road-gunning-nsw-2581
53096	House	2022-01-25	Auction	2022-02-19	$762,000	3	1	2	4.0		Luton Tuggeranong	18-dixson-circuit-conder-act-2906
53097	Land	2022-01-25	AUCTION	2022-02-23	$711,000	0	0	0		745.0	Henley Property - Jindabyne	lot-1-10a-nettin-circuit-jindabyne-nsw-2627
53099	Townhouse	2022-01-25	$1,250,000	2022-03-23	Undisclosed	3	2	2			Fraser-Gray Real Estate	4-24-hedley-way-broulee-nsw-2537
53100	Townhouse	2022-01-25	Contact Agent	2022-03-23	Undisclosed	3	2	2			Fraser-Gray Real Estate	2-24-hedley-way-broulee-nsw-2537
53102	Townhouse	2022-01-25	Contact Agent	2022-03-23	Undisclosed	3	2	2			Fraser-Gray Real Estate	1-24-hedley-way-broulee-nsw-2537
53105	House	2022-01-25	$729,000	2022-03-17	$729,000	4	3	0			Ray White Batemans Bay	2-queen-street-moruya-nsw-2537
53107	House	2022-01-25	$859,000	2022-03-17	$850,000	4	2	3		708.0	Hallmark Real Estate Advisors	19-meakin-street-tuross-head-nsw-2537
53111	House	2022-01-25	SOLD	2022-02-23	$1,310,000	4	3	1		305.0	Smile Elite	12-hannaford-avenue-box-hill-nsw-2765
53112	House	2022-01-25	NEW SUBURB RECORD BY SCHOFIELDS NO.1 SELLING AGENT	2022-01-29	$1,265,500	5	3	2		255.0	Smile Elite	84-siding-terrace-schofields-nsw-2762
53113	House	2022-01-25	SOLD	2022-02-14	$1,180,000	5	2	1		329.0	Smile Elite	35-nazarene-crescent-schofields-nsw-2762
53114	Townhouse	2022-01-25	SOLD - $830,000	2022-01-29	$830,000	3	2	1			Smile Elite	2-banyan-glade-schofields-nsw-2762
53115	House	2022-01-25	SOLD	2022-01-30	$1,356,000	4	2	2		450.0	Smile Elite	41-ruth-street-schofields-nsw-2762
53128	House	2022-01-25	$1995000	2022-05-17	Undisclosed	4	3	5		56650.0	Elders Real Estate Tathra	76-lake-cohen-drive-kalaru-nsw-2550
53131	House	2022-01-25	AUCTION	2022-02-06	$1,100,000	4	2	2	2.0	739.0	McIntyre Property	10-barringer-street-conder-act-2906
53132	House	2022-01-25	Auction	2022-02-17	$1,800,000	5	2	2		3.76	Ray White Rural Canberra | Yass	8-woods-close-murrumbateman-nsw-2582
53136	House	2022-01-25	Auction	2022-02-01	$1,000,000	3	2	2	5.0	465.0	Luton Gungahlin	13-kowalski-street-casey-act-2913
53137	House	2022-01-25	Contact Agent	2022-02-19	$1,310,000	3	1	1	0.5	0.0	Wright Dunn Real Estate	21-bancroft-street-dickson-act-2602
53138	House	2022-01-25	Auction	2022-02-09	Undisclosed	3	2	2	3.5	1394.0	Luton Tuggeranong	15-jackie-howe-crescent-macarthur-act-2904
53140	Other	2022-01-25	$715,000	2022-03-14	$715,000	4	1	0		80.0	Henley Property - Cooma	525-greenlands-road-greenlands-nsw-2631
53141	Townhouse	2022-01-25	Auction	2022-02-12	$1,250,250	3	2	2	5.0	0.0	LJ Hooker Dickson	24a-dooring-street-braddon-act-2612
53143	Apartment	2022-01-25	$359,000 - $379,000	2022-03-02	$370,000	2	1	1			Ray White Queanbeyan | Jerrabomberra	3-14-king-street-queanbeyan-nsw-2620
53147	House	2022-01-25	AUCTION - 25th February 2022	2022-02-25	$755,000	5	3	2		809.4	Ray White Goulburn	3-new-street-goulburn-nsw-2580
53148	House	2022-01-25	AUCTION	2022-02-20	Undisclosed	3	1	1	0.0		McIntyre Property	5-schomburgk-street-yarralumla-act-2600
53149	Apartment	2022-01-26	$395,000 +	2022-03-21	$395,000	1	1	1	6.0		McGrath Canberra	612-4-grazier-lane-belconnen-act-2617
53152	House	2022-01-26	SOLD - $1,050,000	2022-02-18	$1,050,000	5	2	2	4.0	346.0	Stone Gungahlin	17-nellie-hamilton-avenue-gungahlin-act-2912
53154	Unit	2022-01-26	$536,000	2022-02-22	$536,000	2	2	2	6.0	4355.0	New Door Properties	21-283-flemington-road-franklin-act-2913
53157	Townhouse	2022-01-27	Auction	2022-02-19	Undisclosed	3	2	3	6.0		Luton Weston Creek & Molonglo Valley	1-1-gifford-street-coombs-act-2611
53158	House	2022-01-27	Auction	2022-02-16	Undisclosed	3	2	1	1.5	441.0	Luton Weston Creek & Molonglo Valley	113-de-little-circuit-greenway-act-2900
53160	House	2022-01-27	Auction	2022-02-19	Undisclosed	3	2	1	5.0	941.0	Luton Weston Creek & Molonglo Valley	3-eungella-street-duffy-act-2611
53161	House	2022-01-27	Auction	2022-02-19	Undisclosed	2	1	1	0.5	375.0	Luton Weston Creek & Molonglo Valley	14-giltinan-place-holt-act-2615
53162	House	2022-01-27	Auction	2022-02-19	Undisclosed	4	2	2	6.0	1224.0	Luton Weston Creek & Molonglo Valley	83-jim-bradley-crescent-uriarra-village-act-2611
53163	House	2022-01-27	Auction	2022-02-19	Undisclosed	5	2	3	2.0	1279.0	Solely Properties	13-sheehan-street-pearce-act-2607
53165	Townhouse	2022-01-27	729,000+	2022-02-07	$786,100	2	2	1	4.0	221.0	Michael Potter Real Estate	8-20-power-street-mawson-act-2607
53167	House	2022-01-27	$1,149,000+	2022-03-11	Undisclosed	4	2	2	5.0	615.0	Luton Manuka	franklin-2913-act
53168	Apartment	2022-01-27	$550,000+	2022-03-07	$555,000	2	2	2	6.0		Impact Properties	271-1-anthony-rolfe-avenue-gungahlin-act-2912
53169	House	2022-01-27	AUCTION	2022-02-21	Undisclosed	3	2	2	5.5	920.0	One Agency Sandy Morris	31-ferrett-circuit-kambah-act-2902
53170	Apartment	2022-01-27	Auction 19/02/2022	2022-02-09	$535,000	1	1	1	6.0		PURNELL	22-5-sydney-avenue-barton-act-2600
53171	Townhouse	2022-01-27	$885,000+	2022-03-30	$885,000	3	2	2	2.0		McGrath Canberra	25-21-temperley-street-nicholls-act-2913
53172	Apartment	2022-01-27	Auction: Saturday February 12th, on site at 2:00pm	2022-02-12	$767,000	2	1	1	6.0		LJ Hooker Manuka	17-8-giles-street-griffith-act-2603
53173	Apartment	2022-01-27	$495,000+	2022-02-03	$520,000	1	1	1	6.0		PURNELL	98-32-blackall-street-barton-act-2600
53174	House	2022-01-27	Auction	2022-02-21	Undisclosed	4	2	2	1.5	745.0	One Agency Sandy Morris	59-lee-steere-crescent-kambah-act-2902
53177	Unit	2022-01-27	Auction	2022-02-19	Undisclosed	2	1	2	6.0		Blackshaw Belconnen	1-33-mcgovern-street-casey-act-2913
53180	House	2022-01-27	$1,360,000	2022-02-18	$1,360,000	3	2	2	2.0	694.0	Luton Dickson	61-banfield-street-downer-act-2602
53181	House	2022-01-27	Guide $1,400,000	2022-03-01	$1,400,000	4	3	3		740.0	Sails Real Estate	56-monaro-street-merimbula-nsw-2548
53184	House	2022-01-27	Auction	2022-02-12	$806,000	3	1	1	2.0	0.0	LJ Hooker Tuggeranong	1-72-noarlunga-crescent-bonython-act-2905
53185	House	2022-01-27	$1,100,000 - $1,200,000	2022-02-08	$1,200,000	4	2	3		658.0	My Agent Christine Ewin	89-courtenay-crescent-long-beach-nsw-2536
53190	House	2022-01-27	Offers Over $815,000	2022-02-25	Undisclosed	4	2	4	1.5	811.0	Zango Private Listers	43-benson-crescent-calwell-act-2905
53191	Townhouse	2022-01-27	SOLD PRIOR TO AUCTION $890,000	2022-02-03	$890,000	3	2	2	1.5		McGrath Canberra	1-5-fitchett-street-garran-act-2605
53193	House	2022-01-27	Auction 17/02/2022	2022-02-17	$750,000	2	1	1	2.0	0.0	Ray White Canberra	80-dexter-street-cook-act-2614
53197	House	2022-01-27	Sold at Auction $1,260,000	2022-02-12	$1,260,000	4	2	2	3.5	761.0	McGrath Canberra	26-namadgi-circuit-palmerston-act-2913
53199	Townhouse	2022-01-27	SOLD for $615,000	2022-02-18	$615,000	2	1	1	6.0	117.0	McGrath Canberra	79-greg-urwin-circuit-casey-act-2913
53200	House	2022-01-27	SOLD PRICE ON REQUEST	2022-02-24	Undisclosed	5	3	2	4.5	0.0	Belle Property Canberra	25-huelin-circuit-flynn-act-2615
53201	House	2022-01-27	Auction	2022-02-11	$1,150,000	4	2	4	2.0	988.0	LJ Hooker Tuggeranong	26-longman-street-richardson-act-2905
53203	House	2022-01-27	Auction	2022-02-01	$1,056,000	3	2	2	1.5	0.0	Confidence Real Estate	1-whitfeld-street-monash-act-2904
53204	House	2022-01-27	SOLD	2022-03-22	$1,400,000	4	2	2		743.0	Smile Elite	5-creole-street-berowra-nsw-2081
53207	House	2022-01-27	Auction 19/02/2022	2022-02-19	Undisclosed	3	2	2	4.5	660.0	Ray White Canberra	33-strayleaf-crescent-gungahlin-act-2912
53208	Lifestyle	2022-01-27	Expressions of Interest	2022-03-25	$1,150,000	3	2	2		23.69	Belle Property Braidwood	2-bell-lane-braidwood-nsw-2622
53210	House	2022-01-27	Auction	2022-02-19	$963,000	3	2	2	2.0	715.2	LJ Hooker Woden/Weston	4-ligar-place-holder-act-2611
53211	House	2022-01-27	Contact agent	2022-03-18	Undisclosed	4	2	2	4.0	906.0	home.by holly	89-rivett-street-hackett-act-2602
53212	House	2022-01-27	Auction	2022-02-12	$910,000	4	2	2	5.5	249.0	Luton Gungahlin	27-gungahlin-place-gungahlin-act-2912
53213	House	2022-01-27	$1,505,000	2022-02-19	$1,505,000	4	1	1	2.0	727.0	home.by holly	17-mackenzie-street-hackett-act-2602
53216	Unit	2022-01-27	Auction	2022-02-17	$381,000	1	1	1	6.0		LJ Hooker Belconnen	112-41-chandler-street-belconnen-act-2617
53217	House	2022-01-27	Contact Agent	2022-02-23	$1,210,000	5	2	2	4.0	1086.0	LJ Hooker Belconnen	173-kingsford-smith-drive-melba-act-2615
53220	Apartment	2022-01-27	$450,000 +	2022-04-04	$455,000	2	1	1	6.0		LJ Hooker Belconnen	290-80-chandler-street-belconnen-act-2617
53221	House	2022-01-27	Auction	2022-02-12	$608,000	3	1	1	3.0	222.0	LJ Hooker Belconnen	11-dhage-court-melba-act-2615
53222	Townhouse	2022-01-27	$751,000	2022-02-04	$751,000	3	2	2	4.0		home.by holly	5-153-kosciuszko-avenue-palmerston-act-2913
53223	House	2022-01-27	Auction	2022-02-12	$982,000	3	1	1	1.0	905.0	LJ Hooker Belconnen	20-mcginness-street-scullin-act-2614
53224	House	2022-01-27	Auction	2022-02-12	$901,000	3	2	2	3.0	489.0	LJ Hooker Belconnen	6-lidgett-place-florey-act-2615
53225	House	2022-01-27	$399,000+	2022-04-12	Undisclosed	2	1	1	6.0		Ray White Canberra	10-60-john-gorton-drive-coombs-act-2611
53229	House	2022-01-27	Auction	2022-02-19	$1,100,000	5	2	2	0.5	924.0	Luton Belconnen	69-blackman-crescent-macquarie-act-2614
53230	Townhouse	2022-01-27	Auction 12/02/2022	2022-02-12	Undisclosed	1	1	1	6.0	162.3	Ray White Canberra	4-3-coppin-place-weetangera-act-2614
53234	Land	2022-01-27	Auction Sunday 20th February at 10am	2022-02-20	$1,405,000	0	0	0	0.0	0.0	McCann Properties	27-dalton-road-gunning-nsw-2581
53235	House	2022-01-27	Contact Agent	2022-02-19	$1,635,000	5	3	2	4.5	540.0	VERV Property	13-nancy-cato-street-franklin-act-2913
53237	House	2022-01-27	$1,000,000	2022-02-19	$1,000,000	3	2	1	2.0		home.by holly	2-20-allport-street-downer-act-2602
53238	Unit	2022-01-27	Auction 16/02/2022	2022-02-16	$791,500	2	2	2	6.0	0.0	LJ Hooker Dickson	3-2-cunningham-street-griffith-act-2603
53239	House	2022-01-27	Auction 17/02/2022	2022-02-17	Undisclosed	3	1	2	3.0	758.0	Ray White Canberra	74-macrossan-crescent-latham-act-2615
53241	House	2022-01-27	$1,151,000	2022-02-19	$1,151,000	3	2	2	1.5	820.0	Luton Dickson	3-darby-street-kaleen-act-2617
53243	Apartment	2022-01-27	Auction	2022-02-18	$350,000	2	1	1	1.0		LJ Hooker Woden/Weston	2-6-heard-street-mawson-act-2607
53246	Townhouse	2022-01-27	By Negotiation	2022-04-20	Undisclosed	2	2	2	6.0		Impact Properties	11-12-dulcie-holland-crescent-moncrieff-act-2914
53247	Land	2022-01-27	SOLD	2022-04-04	$410,000	0	0	0		720.0	Smile Elite	13-sunbright-road-kelso-nsw-2795
53248	Unit	2022-01-27	Price Guide $800,000	2022-03-31	$780,000	2	2	2			Sails Real Estate	67-1-elizabeth-street-merimbula-nsw-2548
53250	House	2022-01-28	Auction	2022-02-12	Undisclosed	4	2	2	2.0	733.0	Luton Weston Creek & Molonglo Valley	5-blowering-street-duffy-act-2611
53251	House	2022-01-28	Auction	2022-02-18	Undisclosed	4	2	2	4.5	815.0	Luton Weston Creek & Molonglo Valley	4-hannam-place-mawson-act-2607
53252	House	2022-01-28	$1,025,000	2022-03-09	$1,030,000	4	2	4	1.5	1076.0	McCann Properties	2-reeves-street-wanniassa-act-2903
53258	House	2022-01-28	Price On Request	2022-02-19	Undisclosed	4	2	2	5.5	449.0	Bastion Property Group	16-cocoparra-crescent-crace-act-2911
53273	Townhouse	2022-01-28	$945,000	2022-02-23	$950,000	3	2	2	6.0		Michael Potter Real Estate	1-3-tantangara-street-duffy-act-2611
53275	Apartment	2022-01-28	Auction	2022-02-03	$735,000	2	2	2	6.0		Luton Tuggeranong	42-24-hartley-street-turner-act-2612
53276	AcreageSemi-rural	2022-01-28	$1,150,000	2022-03-24	$1,100,000	4	2	2		1.27	LJ Hooker Malua Bay	27-yarimup-place-moruya-nsw-2537
53282	House	2022-01-28	Under offer	2022-03-02	Undisclosed	3	1	2		592.0	New Wave Property	10-treetops-crescent-mollymook-beach-nsw-2539
53284	House	2022-01-28	$699,000	2022-03-09	$685,000	4	2	1		715.0	Sails Real Estate	65-monaro-street-merimbula-nsw-2548
53288	Land	2022-01-28	$105,000	2022-06-08	$105,000	0	0	0		759.0	Belle Property Braidwood	30-george-street-majors-creek-nsw-2622
53290	Apartment	2022-01-28	$350,000+	2022-03-07	$357,000	1	1	1	6.0		LJ Hooker Gungahlin	22-120-thynne-street-bruce-act-2617
53292	Townhouse	2022-01-28	SOLD	2022-02-15	$615,000	3	1	1			Smile Elite	3-5-7-ackroyd-street-port-macquarie-nsw-2444
53295	Apartment	2022-01-28	$357,000+	2022-03-10	Undisclosed	1	1	1	6.0		Badenoch Real Estate	8-188-hawker-place-hawker-act-2614
53297	Townhouse	2022-01-28	SOLD	2022-02-10	$540,000	2	1	1			Smile Elite	8-50-52-home-street-port-macquarie-nsw-2444
53302	House	2022-01-28	Auction	2022-02-01	$1,000,000	3	2	1		562.8	LJ Hooker Malua Bay	23-pyang-avenue-malua-bay-nsw-2536
53305	House	2022-01-28	$799,000	2022-03-18	$830,000	3	1	1	3.5		Luton Tuggeranong	6-chevalley-loop-gordon-act-2906
53306	House	2022-01-28	$985,000	2022-05-27	Undisclosed	8	4	0		986.0	Elders Real Estate Batemans Bay	33-hilltop-crescent-surf-beach-nsw-2536
53307	House	2022-01-28	$869,000	2022-06-09	$860,000	3	2	1		602.0	Clearwater Real Estate Narooma	27-fishermans-cres-north-narooma-nsw-2546
53309	House	2022-01-28	$460,000	2022-02-14	Undisclosed	4	2	5		2.1	Raine & Horne Young	76-dowling-drive-murringo-nsw-2586
53310	Land	2022-01-28	$460,000	2022-04-21	$460,000	0	0	0		653.0	Clearwater Real Estate Narooma	25-fishermans-cres-north-narooma-nsw-2546
53311	House	2022-01-28	Contact Agent	2022-07-25	$940,000	4	2	2		1320.0	Smile Elite	20-lomandra-avenue-caniaba-nsw-2480
53314	House	2022-01-28	$595,000	2022-03-30	$580,000	3	1	2		793.0	Elders Real Estate Batemans Bay	62-bergalia-street-moruya-nsw-2537
53320	House	2022-01-27	Auction	2022-02-03	$751,000	3	2	2	6.0	0.0	Canberry Properties	11-15-dickins-street-forde-act-2914
53323	House	2022-02-02	$745,000+	2022-03-31	$750,000	3	1	1	1.5	423.0	The Real Estate Guy	1-47-clift-crescent-richardson-act-2905
53324	House	2022-01-31	Auction Thursday 17th February at 6pm	2022-02-10	$900,000	4	1	6	4.0	796.0	McCann Properties	50-chauncy-crescent-richardson-act-2905
53326	Apartment	2022-01-31	SOLD - $557,000	2022-02-23	$557,000	3	2	2	6.0		Blackshaw Gungahlin	32-75-elizabeth-jolley-crescent-franklin-act-2913
53330	House	2022-01-31	By Negotiation	2022-02-18	$800,000	4	1	2		1018.0	LJ Hooker Sussex Inlet	41-lyons-road-sussex-inlet-nsw-2540
53333	House	2022-01-31	Auction 19/02/22	2022-02-19	$850,000	3	2	2	4.5	350.0	Luton Gungahlin	7-kanbi-place-ngunnawal-act-2913
53339	House	2022-01-31	$749,000	2022-03-23	$740,000	4	2	4		799.0	Raine & Horne Goulburn	69-green-valley-road-goulburn-nsw-2580
53340	House	2022-01-31	Sold $988,000	2022-02-19	$988,000	3	2	1	4.0	325.0	Blackshaw Gungahlin	78-gwen-meredith-loop-franklin-act-2913
53346	Unit	2022-01-31	$562,500	2022-02-28	$562,500	2	2	2	6.0	15.0	McGrath Canberra	5-20-de-burgh-street-lyneham-act-2602
53347	Land	2022-01-31	$650,000	2022-02-17	$600,000	0	0	0		746.0	Henley Property - Jindabyne	4-grosvenor-place-east-jindabyne-nsw-2627
53352	Livestock	2022-01-31	$13,500,000	2022-08-03	Undisclosed	0	0	0		1695.0	LAWD	bundarra-2359-nsw
53354	House	2022-01-31	$920,000	2022-02-21	$920,000	5	3	4		781.0	Raine & Horne Goulburn	22-22a-carmella-drive-goulburn-nsw-2580
53355	House	2022-01-31	Sold via auction	2022-02-24	$1,400,000	3	1	2	0.0	0.0	McGrath Canberra	320-goyder-street-narrabundah-act-2604
53356	House	2022-01-31	$660,000	2022-05-19	$660,000	4	2	1		468.0	Ray White Goulburn	2-victoria-parade-goulburn-nsw-2580
53358	Land	2022-01-31	$300,000	2022-05-25	Undisclosed	0	0	0		1.24	Raine & Horne Young	164-smiths-road-wirrimah-nsw-2803
53360	House	2022-01-31	Auction (Unless Sold Prior)	2022-02-25	$490,000	3	1	2		533.0	Ray White Goulburn	37-mundy-street-goulburn-nsw-2580
53365	Land	2022-01-31	Price Range: $390,000 - $420,000	2022-02-24	$420,000	0	0	0		762.0	LJ Hooker Batemans Bay	7-burunga-way-malua-bay-nsw-2536
53366	House	2022-01-31	Guide $3,500,000	2022-04-08	Undisclosed	4	2	3		2.56	Ray White Bowral	the-gums-66a-osborne-road-burradoo-nsw-2576
53368	House	2022-01-31	Price on Application	2022-03-01	$1,410,000	4	2	10		2436.0	Ray White Bungendore	31-hyland-drive-bungendore-nsw-2621
53373	House	2022-01-27	$1,060,000	2022-02-19	$1,060,000	3	2	3	1.0		Luton Dickson	6-beaurepaire-crescent-holt-act-2615
53374	Apartment	2022-02-01	$360,000	2022-02-20	$360,000	1	1	1	6.0		Hugo. Canberra	49-301-flemington-road-franklin-act-2913
53375	House	2022-02-01	$900,000 to $950,000	2022-03-25	Undisclosed	3	2	2		994.6	Sails Real Estate	33-pacific-way-tura-beach-nsw-2548
53378	Land	2022-02-01	Price Guide $585,000	2022-06-08	$565,000	0	0	0		701.0	Raine & Horne Southern Highlands	lot-19-21-ferguson-crescent-mittagong-nsw-2575
53379	Apartment	2022-02-01	$390,000+	2022-03-25	Undisclosed	1	1	1	6.0		Ray White Canberra	167-60-college-street-belconnen-act-2617
53382	Land	2022-02-01	Auction	2022-02-24	$713,000	0	0	0		1048.0	Henley Property - Jindabyne	5-abbott-street-jindabyne-nsw-2627
53383	House	2022-02-01	SOLD	2022-02-16	$615,000	3	1	2		787.0	Smile Elite	30-scotford-place-windradyne-nsw-2795
53384	House	2022-02-01	SOLD	2022-02-28	$680,000	4	2	2		1191.0	Smile Elite	18-sapphire-crescent-kelso-nsw-2795
53385	House	2022-02-01	SOLD - $1,110,000	2022-02-10	$1,110,000	4	2	2	4.5	449.0	Stone Gungahlin	29-dulverton-street-amaroo-act-2914
53386	Townhouse	2022-02-01	SOLD - $1,146,000	2022-02-17	$1,146,000	3	2	3	5.5		Stone Gungahlin	5-70-henty-street-braddon-act-2612
53387	Townhouse	2022-02-01	$712,500	2022-02-18	$712,500	3	2	2	6.0		McGrath Canberra	27-21-bakewell-street-coombs-act-2611
53389	House	2022-02-01	Contact Agent	2022-04-07	Undisclosed	3	1	2		519.0	Smile Elite	217-bentinck-street-bathurst-nsw-2795
53392	House	2022-02-01	$580,000	2022-02-28	$580,000	2	1	2		1012.0	Henley Property - Cooma	68-myack-street-berridale-nsw-2628
53395	House	2022-02-01	By Negotiation	2022-03-16	$911,000	4	2	2	2.0	0.0	Confidence Real Estate	2-garratt-street-wanniassa-act-2903
53396	House	2022-02-01	Offers Above - $1,300,000	2022-03-17	$1,327,000	3	2	1	3.0	675.0	Cream Residential	27-poynton-street-hughes-act-2605
53397	House	2022-02-01	799,000 +	2022-04-08	$800,000	3	2	2	6.0	0.0	Confidence Real Estate	13-woodward-loop-taylor-act-2913
53400	Apartment	2022-02-01	$669,000	2022-03-03	$669,000	2	2	2	6.0		home.by holly	405-45-furzer-street-phillip-act-2606
53401	Lifestyle	2022-02-01	Auction 29th April	2022-04-14	Undisclosed	0	0	0		133.0	Ray White Goulburn	413-brayton-road-marulan-nsw-2579
53405	Apartment	2022-02-01	By Negotiation	2022-03-03	$470,000	2	2	1	6.0		Impact Properties	41-68-hardwick-crescent-holt-act-2615
53406	House	2022-02-01	By Negotiation	2022-03-15	$1,200,000	2	2	2			Ray White Batemans Bay	8-10-edgewood-place-denhams-beach-nsw-2536
53413	House	2022-02-01	SOLD - $1,200,000	2022-02-11	$1,200,000	4	2	2	4.5	599.0	Stone Gungahlin	53-katherine-avenue-amaroo-act-2914
53422	House	2022-02-01	Auction 26/02/2022	2022-02-26	Undisclosed	4	2	2		4.13	Ray White Canberra	200-valley-drive-royalla-nsw-2620
53424	House	2022-02-01	Contact Agent	2022-02-26	Undisclosed	3	1	2	1.0	781.0	Dwyer Dunn Property Consultants	14-capella-crescent-giralang-act-2617
53426	Other	2022-02-01	Expressions of Interest	2022-03-23	$1,612,500	0	0	0		173.0	Belle Property Braidwood	braidwood-2622-nsw
53427	House	2022-02-01	Contact Agent	2022-05-31	Undisclosed	5	3	10	0.0	7.1	All Real Estate NSW	33-lumley-road-wamboin-nsw-2620
53432	House	2022-02-02	$1,549,000	2022-03-03	$1,600,000	4	2	0	1.5	999.0	Luton Manuka	1-banvard-place-chapman-act-2611
53433	Apartment	2022-02-02	$608,000+	2022-03-28	$610,000	2	2	2	6.0		McGrath Canberra	13-10-macpherson-street-oconnor-act-2602
53434	House	2022-02-02	Auction 24/02/2022	2022-02-24	Undisclosed	3	2	1		335.0	Ray White Canberra	38-violet-terrace-jerrabomberra-nsw-2619
53435	House	2022-02-02	$930,000	2022-02-23	$930,000	4	2	2		378.0	Ian McNamee & Partners - Queanbeyan	2-peppercorn-way-jerrabomberra-nsw-2619
53437	Apartment	2022-02-02	$425,000+	2022-03-03	$440,000	2	1	1	6.0		LJ Hooker Gungahlin	60-41-clare-burton-crescent-franklin-act-2913
53438	House	2022-02-02	SOLD - $910,000	2022-02-20	$910,000	3	2	2	5.5	438.0	Stone Gungahlin	9-boelke-place-macgregor-act-2615
53439	Townhouse	2022-02-02	$729,000+	2022-04-11	$711,000	3	2	2	5.5		Ray White Queanbeyan | Jerrabomberra	32-15-john-cleland-crescent-florey-act-2615
53440	Apartment	2022-02-02	$369,000	2022-03-30	$410,000	1	1	1	6.0	0.0	Ray White Canberra	7-8-baudinette-circuit-bruce-act-2617
53442	House	2022-02-02	Contact Agent	2022-02-26	Undisclosed	4	3	2	6.0	658.0	VERV Property	82-wyndham-avenue-denman-prospect-act-2611
53444	Townhouse	2022-02-02	$785,000	2022-04-01	$775,000	3	2	2	6.0		Luton Tuggeranong	83-1-rowland-rees-crescent-greenway-act-2900
53445	Apartment	2022-02-02	$450,000+	2022-03-23	$505,000	2	2	1	6.0		VERV Property	148-61-john-gorton-drive-wright-act-2611
53448	House	2022-02-02	Auction	2022-02-19	$830,000	3	1	2	1.0	788.0	LJ Hooker Tuggeranong	15-nunan-crescent-oxley-act-2903
53449	Apartment	2022-02-02	Enquire Today	2022-03-21	$402,000	1	1	1	6.0		Crowthers	313-25-edinburgh-ave-city-act-2601
53450	Townhouse	2022-02-02	Auction	2022-02-18	$896,000	4	2	2	6.0		Luton Kippax	3-14-jevons-place-page-act-2614
53452	House	2022-02-02	$1,475,000 - $1,575,000	2022-04-04	$1,450,000	5	2	2		1256.0	Ian McNamee & Partners - Queanbeyan	11-coachwood-avenue-jerrabomberra-nsw-2619
53454	House	2022-02-02	Contact Agent	2022-02-28	$905,000	3	2	1		1038.0	Ian McNamee & Partners - Queanbeyan	12-leakey-place-richardson-act-2905
53458	Townhouse	2022-02-02	$675,000+	2022-02-24	$694,000	3	2	2	5.0		LJ Hooker Tuggeranong	28-50-wilkins-street-mawson-act-2607
53459	House	2022-02-02	$1,075,000+	2022-03-28	$1,075,000	5	3	1	3.0	923.0	LJ Hooker Kippax	12-archdall-street-macgregor-act-2615
53461	Townhouse	2022-02-02	Auction	2022-02-14	Undisclosed	3	2	2	1.0	403.0	LJ Hooker Tuggeranong	3-61-derrington-crescent-bonython-act-2905
53464	Unit	2022-02-02	$480,000	2022-04-01	$487,500	2	1	1	4.5		The Real Estate Shop	40-23-tay-street-watson-act-2602
53467	House	2022-02-02	SOLD	2022-03-17	$560,000	3	1	1		398.2	Smile Elite	195-havannah-street-bathurst-nsw-2795
53468	House	2022-02-02	Auction	2022-02-19	$925,000	4	2	2	4.5	500.0	LJ Hooker Belconnen	5-tarrant-crescent-dunlop-act-2615
53469	DuplexSemi-detached	2022-02-02	Auction	2022-02-26	$1,325,000	4	2	2	1.5	804.0	LJ Hooker Belconnen	64-templeton-street-cook-act-2614
53470	House	2022-02-02	Auction 19/02/2022	2022-02-19	Undisclosed	3	2	2	3.0	450.0	Ray White Canberra	18-bushby-place-holt-act-2615
53472	House	2022-02-02	Auction 24/02/2022	2022-02-24	Undisclosed	2	2	1	6.0	0.0	Ray White Canberra	22-2-bulletin-street-lawson-act-2617
53475	House	2022-02-02	Auction	2022-02-19	$1,475,000	3	2	2	0.5	1290.0	LJ Hooker Belconnen	6-ambalindum-street-hawker-act-2614
53476	DuplexSemi-detached	2022-02-02	Auction	2022-02-16	$749,000	3	1	2	6.0	378.0	LJ Hooker Belconnen	12-riley-close-ngunnawal-act-2913
53478	Unit	2022-02-02	$265,000	2022-02-11	$266,000	1	1	1	3.0		LJ Hooker Belconnen	7-9-keith-street-scullin-act-2614
53480	Unit	2022-02-02	Auction	2022-02-19	$500,000	2	1	2	4.5		LJ Hooker Belconnen	50-13-chandler-street-belconnen-act-2617
53481	DuplexSemi-detached	2022-02-02	Contact Agent	2022-02-28	Undisclosed	3	2	2		353.0	Ian McNamee & Partners - Queanbeyan	6-palm-court-jerrabomberra-nsw-2619
53483	Townhouse	2022-02-02	$459,000	2022-02-09	$503,000	2	1	1			Elders Real Estate Batemans Bay	3-19-high-view-avenue-surf-beach-nsw-2536
53484	House	2022-02-02	$770,000-$820,000	2022-03-04	$780,000	4	2	2		761.0	LJ Hooker Moruya	87-the-anchorage-moruya-heads-nsw-2537
53485	House	2022-02-02	AUCTION	2022-02-21	$765,000	3	1	2	2.0	470.0	McIntyre Property	7-darcy-close-gordon-act-2906
53486	House	2022-02-02	Price Guide: $740,000 - $750,000	2022-02-21	$776,000	3	1	1		668.0	LJ Hooker Batemans Bay	54-maloneys-drive-maloneys-beach-nsw-2536
53492	House	2022-02-02	Sold - $1,090,000	2022-02-20	$1,090,000	3	2	2	6.0	377.0	Stone Gungahlin	101-pro-hart-avenue-strathnairn-act-2615
53494	Apartment	2022-02-02	$450,000+	2022-03-04	Undisclosed	1	1	1	6.0		Bertram Ellis	54-18-captain-cook-crescent-griffith-act-2603
53496	House	2022-02-02	Price Range $660,000- $680,000	2022-03-11	$680,000	2	1	0		822.0	LJ Hooker Batemans Bay	17-tomakin-place-tomakin-nsw-2537
53498	House	2022-02-02	$1,090,000 +	2022-03-22	$1,115,000	4	2	2	3.5	831.0	Luton Tuggeranong	29-crozier-circuit-kambah-act-2902
53500	House	2022-02-02	SOLD - $1,295,000	2022-02-20	$1,295,000	4	2	2	4.5	481.0	Stone Gungahlin	31-zakharov-avenue-forde-act-2914
53502	House	2022-02-02	Price Guide $890,000	2022-04-19	Undisclosed	3	2	2		621.0	InHouse Real Estate	5-madeline-ct-tura-beach-nsw-2548
53503	House	2022-02-03	$1,375,000	2022-03-08	Undisclosed	5	3	4	1.5	831.0	Luton Weston Creek & Molonglo Valley	7-ossa-place-lyons-act-2606
53504	Apartment	2022-02-03	Auction	2022-02-26	Undisclosed	3	2	2	6.0		Luton Weston Creek & Molonglo Valley	8-93-burrinjuck-crescent-duffy-act-2611
53505	Land	2022-02-03	Contact Agent	2022-02-16	$755,000	0	0	0	0.0	665.0	Ian McNamee & Partners - Jerrabomberra	lot-1118-jumping-creek-queanbeyan-nsw-2620
53510	Apartment	2022-02-03	Auction 26/2/2022 3pm On Site	2022-02-08	Undisclosed	1	1	1	6.0		Morrissey Property	20-29-state-circle-deakin-act-2600
53511	House	2022-02-03	Auction	2022-02-26	Undisclosed	4	2	2	1.0	1044.0	Luton Weston Creek & Molonglo Valley	5-simon-place-kambah-act-2902
53513	House	2022-02-03	Auction Thursday 24th February at 6pm	2022-02-24	$789,500	3	1	2	0.0	555.0	McCann Properties	24-langdon-avenue-wanniassa-act-2903
53514	House	2022-02-03	Auction	2022-02-19	$870,000	3	1	1	1.5	695.0	Michael Potter Real Estate	6-woollum-crescent-rivett-act-2611
53515	House	2022-02-03	Auction	2022-02-14	Undisclosed	4	2	2	3.0	780.0	One Agency Sandy Morris	70-harry-hopman-circuit-gordon-act-2906
53517	House	2022-02-03	Auction	2022-02-26	Undisclosed	3	2	2	4.0	803.0	One Agency Sandy Morris	36-rushbrook-circuit-isabella-plains-act-2905
53519	House	2022-02-03	Sold via auction	2022-02-26	Undisclosed	5	3	3			McGrath Canberra	33-lonergan-drive-greenleigh-nsw-2620
53520	Townhouse	2022-02-03	Auction	2022-02-23	$900,000	3	2	2	2.0		Luton Gungahlin	2-35-lochbuy-street-macquarie-act-2614
53522	House	2022-02-03	Price Guide $775,000	2022-04-01	$780,000	4	2	0		1.76	InHouse Real Estate	11-back-creek-rd-nethercote-nsw-2549
53523	House	2022-02-03	Price On Request	2022-02-19	Undisclosed	5	2	2	4.0	882.0	Bastion Property Group	25-darebin-place-conder-act-2906
53524	House	2022-02-03	By Negotiation	2022-02-23	Undisclosed	3	2	1	5.5	331.0	McGrath Canberra	3-daramoolen-street-ngunnawal-act-2913
53525	House	2022-02-03	Auction 26/02/22	2022-02-26	Undisclosed	4	2	1	1.0	920.7	Ray White Canberra	1-edkins-street-downer-act-2602
53526	House	2022-02-03	Auction 26/02/2022	2022-02-21	$1,050,000	3	1	4	2.0		PURNELL	118-darwinia-terrace-chapman-act-2611
53529	House	2022-02-03	$995,000.00	2022-03-18	$950,000	3	2	1		556.0	LJ Hooker Tuross Head	56-allenby-road-tuross-head-nsw-2537
53531	Townhouse	2022-02-03	$789,000+	2022-03-03	$821,000	3	3	2	6.0		McGrath Canberra	13-15-jumbuck-crescent-lawson-act-2617
53540	House	2022-02-03	$1,445,000	2022-02-24	$1,445,000	3	1	2	1.0	689.0	home.by holly	41-archer-street-dickson-act-2602
53541	House	2022-02-03	$805,000	2022-02-11	$805,000	3	2	1	6.0		home.by holly	16-beulah-close-moncrieff-act-2914
53542	House	2022-02-03	Auction, Sat 26th Feb at 1:00pm Onsite	2022-02-26	$1,380,000	4	2	2	6.5	492.0	LJ Hooker Gungahlin	19-snapper-crescent-throsby-act-2914
53543	Townhouse	2022-02-03	$900,000	2022-02-26	$900,000	3	2	2	5.0	381.0	home.by holly	8-26-eungella-street-duffy-act-2611
53545	House	2022-02-03	Price Guide $730,000 - $760,000	2022-02-18	$755,000	4	2	2			Ray White Batemans Bay	6-161-163-beach-road-sunshine-bay-nsw-2536
53546	House	2022-02-03	Auction 24/02/22	2022-02-24	Undisclosed	4	2	2	4.5	731.0	Ray White Canberra	125-william-webb-drive-mckellar-act-2617
53548	House	2022-02-03	Offers over $1,130,000	2022-03-01	Undisclosed	4	2	2	3.5	1071.0	One Agency Sandy Morris	20-girdlestone-circuit-calwell-act-2905
53549	Townhouse	2022-02-03	$650,000+	2022-03-09	$655,000	3	2	1	4.0		LJ Hooker Tuggeranong	43-50-wilkins-street-mawson-act-2607
53550	Townhouse	2022-02-03	Auction	2022-02-23	Undisclosed	2	1	1	4.0		Badenoch Real Estate	107-mainwaring-rich-circuit-palmerston-act-2913
53551	House	2022-02-03	Auction 19th Feb at 10.00am	2022-02-19	Undisclosed	5	2	2	1.5	1351.0	LJ Hooker Tuggeranong	9-loder-place-kambah-act-2902
53552	Apartment	2022-02-03	Auction Friday February 25th, on site at 12:30pm	2022-02-25	Undisclosed	1	1	1	6.0		LJ Hooker Manuka	172-41-chandler-street-belconnen-act-2617
53557	Townhouse	2022-02-03	Auction 24/02/2022	2022-02-15	Undisclosed	3	2	1	4.5	0.0	Ray White Canberra	6-8-fidler-court-bruce-act-2617
53558	House	2022-02-03	$1,260,000	2022-02-19	$1,260,000	5	3	1	1.0	779.0	home.by holly	3-martens-crescent-weston-act-2611
53559	House	2022-02-03	$1,480,000	2022-04-14	$1,480,000	3	1	4	4.5	579.0	home.by holly	9-piper-street-ainslie-act-2602
53560	House	2022-02-03	Auction	2022-03-24	$1,100,000	4	2	2	4.0	0.0	Confidence Real Estate	39-margaret-tucker-street-bonner-act-2914
53561	DuplexSemi-detached	2022-02-03	Auction 25/02/2022	2022-02-25	Undisclosed	3	2	2	5.0		Ray White Canberra	1-8-dyring-place-chisholm-act-2905
53562	House	2022-02-03	$935,000	2022-02-19	$935,000	4	1	3	2.5		home.by holly	79-baddeley-crescent-spence-act-2615
53564	MixedFarming	2022-02-03	Contact Agent	2022-02-11	Undisclosed	7	6	7		56.32	Ray White Bowral	231-iona-park-road-moss-vale-nsw-2577
53565	House	2022-02-03	Auction	2022-02-28	Undisclosed	3	1	1	1.0	1069.0	One Agency Sandy Morris	18-seymour-place-kambah-act-2902
53566	House	2022-02-03	Auction	2022-02-26	$1,100,000	4	2	2	3.0	650.0	LJ Hooker Dickson	2-bunduluk-crescent-ngunnawal-act-2913
53567	Apartment	2022-02-03	$475,000+	2022-03-01	$490,000	1	1	1	5.5		Bertram Ellis	25-26-macquarie-street-barton-act-2600
53568	House	2022-02-03	Price Withheld	2022-03-02	Undisclosed	6	4	5	6.0	1082.0	Bastion Property Group	51-jansz-crescent-griffith-act-2603
53575	House	2022-02-03	$900,000 - $930,000	2022-03-15	$920,000	4	3	2			My Agent Christine Ewin	14-oakwood-way-catalina-nsw-2536
53576	House	2022-02-03	Auction 19/02/2022	2022-02-19	Undisclosed	2	2	1	6.0	185.0	Ray White Canberra	8-2-goldman-street-bruce-act-2617
53578	House	2022-02-03	$1,840,000	2022-02-26	$1,840,000	4	2	2	2.5		home.by holly	7-hull-place-hackett-act-2602
53579	Apartment	2022-02-03	$492,500	2022-02-25	$492,500	2	1	1	5.5		home.by holly	14c-6-irvine-street-watson-act-2602
53582	House	2022-02-03	$440,000	2022-09-08	Undisclosed	2	1	1		620.0	One Agency Craig Schofield	11-monaro-highway-cooma-nsw-2630
53583	Lifestyle	2022-02-03	Price Bracket $630,000 - $650,000	2022-04-23	Undisclosed	3	1	0		40.47	One Agency Craig Schofield	bobeyan-road-bolaro-nsw-2629
53584	House	2022-02-03	Auction	2022-02-19	$915,000	3	1	4	1.5	949.0	VERV Property	11-cowdery-place-monash-act-2904
53587	House	2022-02-03	Auction Sunday 27th February 10am	2022-02-27	$600,000	4	2	0		5200.0	McCann Properties	2-biala-street-gunning-nsw-2581
53589	House	2022-02-03	2295000	2022-03-08	Undisclosed	6	3	2		4369.0	Rapport Property	25-taylor-place-greenleigh-nsw-2620
53591	Apartment	2022-02-03	Sold Prior - $440,000	2022-02-18	$440,000	2	2	1			Ian McNamee & Partners - Queanbeyan	4-12-waniassa-street-queanbeyan-nsw-2620
53596	Studio	2022-02-03	$329,000	2022-03-08	$330,000	0	1	1	6.0		LJ Hooker Canberra City	18-135-blamey-crescent-campbell-act-2612
53597	House	2022-02-03	$830,000+	2022-02-23	$860,000	3	2	2	1.5	835.0	LJ Hooker Tuggeranong	250-heagney-crescent-gilmore-act-2905
53598	House	2022-02-03	Contact Agent	2022-03-04	$3,260,000	4	2	2		4001.0	Ray White Bowral	14-boronia-street-bowral-nsw-2576
53599	Townhouse	2022-02-03	Auction	2022-02-24	Undisclosed	3	2	2	5.5		Badenoch Real Estate	21-11-joy-cummings-place-belconnen-act-2617
53600	Apartment	2022-02-03	By Negotiation	2022-02-23	$530,000	2	2	1	6.0		Impact Properties	46-275-flemington-road-franklin-act-2913
53601	House	2022-02-03	Auction 02/03/2022	2022-03-02	$1,530,000	3	1	1	0.0	919.5	LJ Hooker Dickson	21-melba-street-downer-act-2602
53602	House	2022-02-03	Auction	2022-03-02	$1,265,000	4	2	2	4.5	796.0	LJ Hooker Kaleen	28-dash-crescent-fadden-act-2904
53603	Apartment	2022-02-03	$450,000+	2022-02-26	$500,000	2	1	2	6.0	0.0	LJ Hooker Gungahlin	8-90-gozzard-street-gungahlin-act-2912
53604	Land	2022-02-03	$365,000	2022-02-25	$370,000	0	0	0		859.0	Henley Property - Cooma	28-myack-street-berridale-nsw-2628
53606	Apartment	2022-02-03	Offers Over $350,000+	2022-04-05	Undisclosed	1	1	1	6.0		Civium Property Group - Residential	56-31-thynne-street-bruce-act-2617
53607	House	2022-02-03	AUCTION IF NOT SOLD PRIOR	2022-02-11	Undisclosed	4	3	3		466.0	New Wave Property	33-lake-view-drive-burrill-lake-nsw-2539
53608	House	2022-02-03	Auction	2022-02-26	$1,300,000	3	2	1	2.0	747.0	LJ Hooker Dickson	28-higinbotham-street-watson-act-2602
53609	House	2022-02-03	Auction	2022-02-26	$2,000,000	7	4	3	2.5	1310.0	Luton Tuggeranong	49-buntine-crescent-isaacs-act-2607
53611	House	2022-02-03	$749,000+	2022-04-05	Undisclosed	3	2	1	1.0	433.0	McIntyre Property	30-harrington-circuit-kambah-act-2902
53612	Apartment	2022-02-03	Auction	2022-02-14	Undisclosed	3	3	2	6.0		Luton Gungahlin	5-15-jumbuck-crescent-lawson-act-2617
53615	Apartment	2022-02-03	$679,000+	2022-08-01	$650,000	2	1	1	6.0		LJ Hooker Woden/Weston	152-15-tench-street-kingston-act-2604
53617	House	2022-02-03	$899,000	2022-03-07	$890,000	2	1	1		303.0	Sails Real Estate	11b-booroo-street-pambula-beach-nsw-2549
53618	Townhouse	2022-02-03	Auction 26/02/2022	2022-02-26	Undisclosed	3	2	2	1.5		Ray White Canberra	36-teague-street-cook-act-2614
53619	House	2022-02-03	SOLD	2022-02-28	$1,391,000	5	3	1		300.0	Smile Elite	83-mariner-avenue-schofields-nsw-2762
53620	House	2022-02-03	SOLD	2022-02-14	Undisclosed	5	2	3		1736.0	Smile Elite	12-caroline-avenue-bowral-nsw-2576
53621	House	2022-02-04	$1,600,000	2023-08-30	Undisclosed	4	2	2	6.0		MRKT Property	15a-mcgowan-street-dickson-act-2602
53623	Apartment	2022-02-04	$510,000+	2022-02-25	$546,000	2	2	2	6.0		Luton Gungahlin	134-230-flemington-road-harrison-act-2914
53624	Lifestyle	2022-02-04	AUCTION - 25th March 2022	2022-03-25	$1,650,000	5	2	12		30.0	Ray White Goulburn	2727-collector-road-collector-nsw-2581
53626	Apartment	2022-02-04	$720,000+	2022-03-30	$700,000	2	2	2	6.0		PURNELL	104-65-giles-street-kingston-act-2604
53627	Townhouse	2022-02-04	AUCTION	2022-03-07	$600,000	3	1	1	1.5		McIntyre Property	16-8-jondol-place-isabella-plains-act-2905
53629	Unit	2022-02-04	$400,000 - $440,000	2022-02-21	$441,000	2	1	2			LJ Hooker Batemans Bay	2-724-726-beach-road-surf-beach-nsw-2536
53630	House	2022-02-04	Auction 24/02/2022	2022-02-24	Undisclosed	3	1	1	1.0	743.0	Ray White Canberra	2-waratah-street-oconnor-act-2602
53633	House	2022-02-04	$825,000 - $875,000	2022-03-22	$815,000	4	1	2			PURNELL	3-linaria-place-queanbeyan-nsw-2620
53636	House	2022-02-04	Price Guide $875,000	2022-02-11	$920,000	2	1	0		556.0	Bella Coastal Property	11-merry-street-kioloa-nsw-2539
53637	House	2022-02-04	Price Range: $1.2million-$1.3million	2022-04-19	$1,200,000	4	2	2		975.0	LJ Hooker Batemans Bay	6-michener-court-long-beach-nsw-2536
53638	House	2022-02-04	Auction	2022-02-19	Undisclosed	4	2	2	5.5	461.0	LJ Hooker Belconnen	155-lampard-circuit-bruce-act-2617
53642	DuplexSemi-detached	2022-02-04	Price Guide $750,000 - $800,000	2022-03-04	$775,000	4	2	2			Sails Real Estate	2-8-krista-lee-court-tura-beach-nsw-2548
53644	House	2022-02-04	Contact Agent	2022-03-10	Undisclosed	4	2	3	2.5		home.by holly	52-cadell-street-downer-act-2602
53645	House	2022-02-04	Auction	2022-02-07	Undisclosed	5	4	2	2.0	998.0	Luton Tuggeranong	2-wheatley-street-gowrie-act-2904
53647	House	2022-02-04	$799,000 - $810,000	2022-03-01	$800,000	2	2	2		1.25	Ray White Batemans Bay	288-pollwombra-road-moruya-nsw-2537
53654	House	2022-02-04	Auction	2022-02-19	$1,220,000	3	2	3	1.5	798.0	LJ Hooker Belconnen	63-campaspe-circuit-kaleen-act-2617
53658	Land	2022-02-04	$565,000	2022-03-23	Undisclosed	0	0	0		5.0	LJ Hooker Narooma	342-old-highway-narooma-nsw-2546
53659	House	2022-02-04	Auction on site 26/02/2022	2022-02-26	Undisclosed	5	5	3	1.5	2548.0	Ray White Canberra	12-marrakai-street-hawker-act-2614
53662	House	2022-02-04	Auction 24/02/2022	2022-02-24	Undisclosed	6	2	2	5.0	844.0	Ray White Canberra	52-percy-begg-circuit-dunlop-act-2615
53663	House	2022-02-04	$907,500	2022-02-26	$907,500	4	3	2	1.5	1233.0	Rapport Property	85-goldstein-crescent-chisholm-act-2905
53668	Apartment	2022-02-04	Offers Over $400,000	2022-03-18	Undisclosed	1	1	1	4.0		Sadil Quinlan	31-43-ijong-street-braddon-act-2612
53671	House	2022-02-04	$2,000,000	2022-02-24	$2,000,000	4	2	1	5.0	1008.0	home.by holly	2-hawdon-street-ainslie-act-2602
53672	House	2022-02-04	AUCTION	2022-02-19	Undisclosed	3	1	2	1.0	495.6	McIntyre Property	6-saggers-close-gordon-act-2906
53674	Land	2022-02-04	$600,000 - $650,000	2022-03-07	$605,000	0	0	0		4.07	Sails Real Estate	lot-15-mccausland-road-lochiel-nsw-2549
53678	Apartment	2022-02-04	By Negotiation	2022-02-04	Undisclosed	2	1	1	6.0		Impact Properties	610-2-gribble-street-gungahlin-act-2912
53680	House	2022-02-04	Contact Agent	2022-07-25	$1,150,000	4	2	3		736.0	Smile Elite	31-newlands-crescent-kelso-nsw-2795
53687	Apartment	2022-02-07	$535,000+	2022-02-17	$535,000	2	1	1	6.0		PURNELL	1609-15-bowes-street-phillip-act-2606
53690	House	2022-02-07	$520,000	2022-04-21	$510,000	2	1	0		658.0	LJ Hooker Batemans Bay	21-clare-crescent-batehaven-nsw-2536
53691	House	2022-02-07	Auction 19/02/22	2022-02-19	$990,000	3	2	1	5.0	330.0	Bastion Property Group	23-bungle-bungle-crescent-harrison-act-2914
53694	House	2022-02-07	Auction Bidding Guide $800,000	2022-03-05	$890,000	3	2	2		601.0	My Agent Christine Ewin	34-fauna-avenue-long-beach-nsw-2536
53696	House	2022-02-07	$600,000 - $650,000	2022-03-04	$727,000	3	2	1			My Agent Christine Ewin	2-6-burkes-way-denhams-beach-nsw-2536
53697	Apartment	2022-02-07	$565,000+	2022-07-03	$548,000	1	1	1	4.5	0.0	Berkely Residential	10-16-new-south-wales-crescent-forrest-act-2603
53701	House	2022-02-07	Contact Agent	2022-04-05	$1,075,000	5	2	2		794.0	LJ Hooker Queanbeyan – Jerrabomberra – Googong	63-crest-park-parade-queanbeyan-west-nsw-2620
53704	Unit	2022-02-07	Auction 5/3/22	2022-03-04	$300,000	2	1	1			Ian McNamee & Partners - Queanbeyan	8-19-charles-street-queanbeyan-nsw-2620
53705	AcreageSemi-rural	2022-02-07	$3,200,000	2022-03-22	Undisclosed	4	2	3		13.0	Henley Property - Jindabyne	lot-3-mowamba-way-jindabyne-nsw-2627
53713	Land	2022-02-07	Auction 19/02/2022	2022-02-11	Undisclosed	0	0	0		1000.0	LJ Hooker Queanbeyan – Jerrabomberra – Googong	24-chimney-rise-googong-nsw-2620
53715	Land	2022-02-07	$1,100,000	2022-05-27	$1,100,000	0	0	0			LJ Hooker Batemans Bay	lot-197-dp-1236190-malua-bay-nsw-2536
53718	Townhouse	2022-02-07	Auction onsite Saturday 5 March 12pm	2022-03-05	$930,000	3	2	2	1.0		McGrath Canberra	33-50-wilkins-street-mawson-act-2607
53720	Land	2022-02-07	$329,000 - $359,000	2022-02-21	$405,000	0	0	0		557.0	Ray White Batemans Bay	7-dell-parade-moruya-heads-nsw-2537
53721	Apartment	2022-02-07	By Negotiation	2022-02-25	$362,000	1	1	1	5.0		Impact Properties	23-75-elizabeth-jolley-crescent-franklin-act-2913
53724	House	2022-02-07	$1,450,000+	2022-03-24	Undisclosed	5	3	2	5.0	405.0	Blackshaw Gungahlin	9-henry-kendall-street-franklin-act-2913
53725	AcreageSemi-rural	2022-02-07	By Negotiation	2022-03-04	$1,490,000	4	2	2		9.2	Ray White Bungendore	281-macs-reef-road-bywong-nsw-2621
53726	Unit	2022-02-07	SOLD	2022-03-03	$325,000	2	1	1			Smile Elite	2-73-suttor-street-windradyne-nsw-2795
53727	House	2022-02-08	Sold, price undisclosed	2022-03-05	Undisclosed	3	1	2	1.5	874.0	Blackshaw Gungahlin	7-brain-street-monash-act-2904
53729	House	2022-02-08	Auction Tuesday 22nd February at 6pm	2022-02-22	$892,000	3	1	3	4.0	766.0	McCann Properties	3-brooke-place-wanniassa-act-2903
53730	House	2022-02-08	Sold via auction	2022-02-26	Undisclosed	3	2	2	3.0		McGrath Canberra	42-goble-street-hughes-act-2605
53731	House	2022-02-08	Auction	2022-02-11	Undisclosed	4	2	1	2.5	665.0	Luton Tuggeranong	16-lansell-circuit-wanniassa-act-2903
53732	House	2022-02-08	Auction	2022-02-22	$760,000	3	1	1	5.0		Luton Gungahlin	130-jabanungga-avenue-ngunnawal-act-2913
53737	House	2022-02-08	By Negotiation	2022-03-10	$1,400,000	4	2	2		759.0	Bella Coastal Property	3-shearwater-crescent-bawley-point-nsw-2539
53739	Apartment	2022-02-08	$499,000	2022-03-21	$500,000	1	1	1	6.0		The Real Estate Shop	510-6-cape-street-dickson-act-2602
53740	Townhouse	2022-02-08	Auction 2/3/22	2022-03-04	$550,000	2	1	1			Ian McNamee & Partners - Queanbeyan	2-9-thurralilly-street-queanbeyan-nsw-2620
53741	House	2022-02-08	$1,100,000+	2022-03-24	$1,100,000	4	2	2	1.5	845.0	LJ Hooker Tuggeranong	6-corser-close-fadden-act-2904
53742	House	2022-02-08	$900,000+	2022-03-28	$930,000	6	2	1	2.5	728.0	McIntyre Property	19-norriss-street-chisholm-act-2905
53743	Land	2022-02-08	$325,000	2022-02-08	$325,000	0	0	0		666.0	LJ Hooker Batemans Bay	56-litchfield-crescent-long-beach-nsw-2536
53744	House	2022-02-08	SOLD - $1,025,000	2022-03-07	$1,025,000	3	2	2	5.0	337.0	Stone Gungahlin	9-ridding-street-forde-act-2914
53760	Apartment	2022-02-08	Offers over $800,000	2022-05-23	$820,000	2	2	2	5.0		Sadil Quinlan	g10-20-anzac-park-campbell-act-2612
53765	House	2022-02-08	Auction 26-2-2022	2022-02-15	Undisclosed	4	2	2	3.0		Independent Gungahlin	10-dame-zara-street-gungahlin-act-2912
53767	House	2022-02-08	$750,000 - $770,000	2022-04-05	$772,000	3	1	2		721.0	Ray White Queanbeyan | Jerrabomberra	49-gilmore-place-queanbeyan-west-nsw-2620
53768	House	2022-02-08	SOLD	2022-02-23	Undisclosed	5	2	2	4.5	678.0	Stone Gungahlin	2-clarendon-street-amaroo-act-2914
53770	House	2022-02-08	AUCTION	2022-02-26	$1,240,000	4	2	2	2.0	1278.0	McIntyre Property	9-hardie-close-macarthur-act-2904
53772	House	2022-02-08	Be Negotiation	2022-04-14	Undisclosed	5	2	2	4.5	816.0	Luton Gungahlin	34-sue-geh-circuit-nicholls-act-2913
53775	House	2022-02-08	Auction	2022-03-02	$1,345,000	4	2	2	3.5	1301.0	LJ Hooker Canberra City	14-meredith-circuit-kambah-act-2902
53776	Apartment	2022-02-08	$330,000+	2022-03-29	$351,000	1	1	1	6.0		LJ Hooker Dickson	22-329-flemington-road-franklin-act-2913
53778	Unit	2022-02-08	$359,000	2022-03-17	$350,000	2	1	1			Ray White Goulburn	6-9-allison-street-goulburn-nsw-2580
53779	House	2022-02-09	Auction onsite 25/02/2022	2022-02-25	$1,450,000	4	2	2	4.0	569.0	McGrath Canberra	14-beveridge-crescent-forde-act-2914
53780	House	2022-02-09	Auction	2022-03-05	Undisclosed	3	1	2	2.0	763.0	Luton Weston Creek & Molonglo Valley	13-mccrae-street-garran-act-2605
53781	House	2022-02-09	Auction 27/02/22 11.00am On Site	2022-02-27	$862,000	3	2	3	5.0	652.0	Morrissey Property	7-gurrang-avenue-ngunnawal-act-2913
53782	House	2022-02-09	Auction	2022-03-05	Undisclosed	3	1	1	2.0	746.0	Timothy Road	7-kissane-crescent-evatt-act-2617
53783	Land	2022-02-09	Auction: Saturday 26th February  10.30am	2022-02-26	$1,755,000	0	0	0		988.0	McGrath Canberra	17-quinane-avenue-forde-act-2914
53784	Townhouse	2022-02-09	Offers Over $650,000	2022-03-24	$670,000	3	1	2	2.0		Luton Manuka	18-jondol-place-isabella-plains-act-2905
53785	House	2022-02-09	Auction 05/03/2022	2022-03-05	$1,275,000	3	1	1	0.5	744.1	LJ Hooker Dickson	1-lynd-place-downer-act-2602
53786	Townhouse	2022-02-09	AUCTION	2022-03-04	Undisclosed	2	2	1	5.5		McIntyre Property	41-88-narrambla-terrace-lawson-act-2617
53787	House	2022-02-09	SOLD-$1,865,000	2022-02-09	$1,865,000	4	2	3	4.5		McGrath Canberra	11-gadali-crescent-ngunnawal-act-2913
53788	House	2022-02-09	Guide $1,550,000	2022-03-10	$1,600,000	4	2	7		3.5	Ray White Goulburn	76-greendale-crescent-goulburn-nsw-2580
53792	House	2022-02-09	AUCTION	2022-03-03	Undisclosed	4	2	2	3.5	733.0	McIntyre Property	25-kingscote-crescent-bonython-act-2905
53794	House	2022-02-09	$980,000+	2022-04-05	$1,009,000	5	2	2	3.0	997.0	Luton Tuggeranong	42-byrne-street-wanniassa-act-2903
53795	House	2022-02-09	$1.45M	2022-05-19	$1,425,000	4	2	2		2.75	Bella Coastal Property	104-old-princes-highway-termeil-nsw-2539
53796	Apartment	2022-02-09	$375,000+	2022-04-04	$387,000	2	1	1	3.5		LJ Hooker Woden/Weston	36-2-ranken-place-belconnen-act-2617
53798	House	2022-02-09	Auction, Sat 5th Mar at 2:30pm	2022-03-05	$1,133,000	2	1	3	0.0	1.63	LJ Hooker Gungahlin	16-kinsman-drive-murrumbateman-nsw-2582
53799	House	2022-02-09	Auction 05/03/2022	2022-03-05	Undisclosed	4	2	2	3.0	1027.0	Ray White Canberra	3-lodder-place-chisholm-act-2905
53800	Unit	2022-02-09	Auction	2022-02-26	$835,000	3	2	2	6.0		LJ Hooker Belconnen	93-121-thynne-street-bruce-act-2617
53802	House	2022-02-09	$1,400,000	2022-03-11	$1,313,000	6	3	5	3.0	1103.0	LJ Hooker Belconnen	142-tillyard-drive-flynn-act-2615
53803	House	2022-02-09	Auction	2022-02-26	$838,000	3	2	1	4.0	361.0	LJ Hooker Belconnen	94-refshauge-crescent-macgregor-act-2615
53804	House	2022-02-09	Auction	2022-02-26	$860,000	3	1	2	0.0	975.0	LJ Hooker Belconnen	5-diggles-street-page-act-2614
53805	Unit	2022-02-09	Auction	2022-02-26	$528,000	2	1	2	5.5		LJ Hooker Belconnen	5-37-ainsworth-street-mawson-act-2607
53806	Townhouse	2022-02-09	Auction	2022-02-26	$641,000	2	1	1	0.0		LJ Hooker Belconnen	5-21-jinka-street-hawker-act-2614
53807	House	2022-02-09	$1,325,000	2022-03-05	$1,325,000	4	2	2		6790.0	Luton Dickson	3-angus-place-murrumbateman-nsw-2582
53808	House	2022-02-09	Auction	2022-02-23	$890,000	3	2	2	2.5	762.0	Luton Dickson	12-meeson-street-chisholm-act-2905
53809	House	2022-02-09	Auction, Sat 26th Feb at 3:15pm	2022-02-26	$632,500	2	2	1	5.0	0.0	LJ Hooker Gungahlin	128-wanganeen-avenue-ngunnawal-act-2913
53810	Townhouse	2022-02-09	Sold for $710,000	2022-02-17	Undisclosed	3	2	2	4.0		McGrath Canberra	6-2-hoffmann-street-moncrieff-act-2914
53816	Townhouse	2022-02-09	Auction	2022-03-01	$810,000	3	2	2	3.0		Impact Properties	71-kingsland-parade-casey-act-2913
53818	House	2022-02-09	Auction	2022-03-05	$1,300,000	3	2	2	1.0	0.0	Confidence Real Estate	127-julia-flynn-avenue-isaacs-act-2607
53819	Townhouse	2022-02-09	$770,000	2022-03-09	$770,000	3	2	2	6.0	10274.0	New Door Properties	36-1-bon-scott-crescent-moncrieff-act-2914
53820	Unit	2022-02-09	$410,000+	2022-02-15	$425,000	3	2	2	0.0	0.0	Ally Smith - Edge Real Estate	97-10-thynne-street-bruce-act-2617
53822	Apartment	2022-02-09	SOLD	2022-02-21	Undisclosed	3	2	2			Smile Elite	6-30-golf-links-drive-batemans-bay-nsw-2536
53826	House	2022-02-09	Auction	2022-02-23	$981,000	4	2	2	6.0	393.0	Luton Gungahlin	6-colgan-street-moncrieff-act-2914
53828	Townhouse	2022-02-09	Auction	2022-02-26	$600,000	2	1	1	5.5	333.0	LJ Hooker Belconnen	7-2-manity-court-ngunnawal-act-2913
53829	House	2022-02-09	$950,000+	2022-03-04	$975,000	4	2	2	2.5	1034.0	McIntyre Property	7-wagstaff-place-isabella-plains-act-2905
53830	House	2022-02-09	$580,000 - $620,000	2022-02-22	$615,000	2	1	2		640.0	LJ Hooker Batemans Bay	42-albatross-road-catalina-nsw-2536
53833	House	2022-02-09	$829,000+	2022-03-11	$845,000	3	2	2	4.0		Ray White Canberra	21a-langdon-avenue-wanniassa-act-2903
53835	House	2022-02-09	Auction - Bidders Guide $675,000+	2022-03-05	$655,000	3	1	2	4.0	633.0	Luton Tuggeranong	8-vidal-street-richardson-act-2905
53838	Townhouse	2022-02-09	Auction, Wed 2nd Mar at 6:00pm	2022-03-02	$598,500	2	2	2	6.0	0.0	LJ Hooker Gungahlin	29-41-lawrenson-circuit-jacka-act-2914
53841	House	2022-02-09	$850,000+	2022-02-28	$908,000	3	2	2	4.0		LJ Hooker Gungahlin	77-bill-ferguson-circuit-bonner-act-2914
53842	House	2022-02-09	SOLD	2022-03-02	$700,000	3	1	5		1039.0	Smile Elite	4-ryley-close-moruya-nsw-2537
53843	House	2022-02-09	Auction	2022-03-05	$1,003,000	3	2	1	2.5	771.9	LJ Hooker Woden/Weston	8-blackwood-terrace-holder-act-2611
53851	House	2022-02-10	Auction	2022-03-05	Undisclosed	3	2	2	2.0	803.0	Luton Weston Creek & Molonglo Valley	25-rene-street-chapman-act-2611
53852	House	2022-02-10	Auction	2022-03-05	Undisclosed	4	3	3	2.0	1005.0	Luton Weston Creek & Molonglo Valley	56-doyle-terrace-chapman-act-2611
53853	Townhouse	2022-02-10	$699,000	2022-03-18	$721,000	3	2	1	4.0		Luton Weston Creek & Molonglo Valley	131a-namatjira-drive-fisher-act-2611
53854	House	2022-02-10	Auction	2022-03-03	Undisclosed	4	2	1	2.0	835.0	Luton Weston Creek & Molonglo Valley	4-astelia-place-rivett-act-2611
53855	Townhouse	2022-02-10	Auction	2022-02-24	Undisclosed	4	3	2	6.0		Luton Weston Creek & Molonglo Valley	46-10-gifford-street-coombs-act-2611
53856	House	2022-02-10	Auction	2022-02-16	$1,565,000	3	2	2	3.5	1033.0	Michael Potter Real Estate	2-mauldon-street-chifley-act-2606
53857	Lifestyle	2022-02-10	Price Range -  $295,000 to $325,000	2022-05-02	$325,000	0	0	0		8310.0	Marshall and Tacheci Real Estate	1172-wandella-road-wandella-nsw-2550
53858	Townhouse	2022-02-10	Auction	2022-02-17	Undisclosed	3	2	2	6.0	206.0	LJ Hooker Dickson	1-4-berrigan-crescent-oconnor-act-2602
53859	House	2022-02-10	SOLD $980,000	2022-03-05	$980,000	4	3	5	3.5	1116.0	Blackshaw Belconnen	7-clifford-crescent-melba-act-2615
53860	Townhouse	2022-02-10	Contact Agent	2022-04-01	$650,000	2	2	1	6.0	0.0	McGrath Canberra	33-88-narrambla-terrace-lawson-act-2617
53861	House	2022-02-10	Contact Agent	2022-03-05	$1,000,000	3	2	2	3.5	575.0	McGrath Canberra	47-burraly-court-ngunnawal-act-2913
53862	House	2022-02-10	Price On Request	2022-02-26	Undisclosed	3	1	3	5.0	475.0	Bastion Property Group	30-abercrombie-circuit-banks-act-2906
53864	House	2022-02-10	Contact Agent	2022-03-05	$1,004,000	3	2	2	4.0	343.0	McGrath Canberra	36-loma-rudduck-street-forde-act-2914
53865	House	2022-02-10	Auction	2022-03-05	$1,905,000	4	2	2	3.0	1127.0	LJ Hooker Woden/Weston	6-sabine-close-garran-act-2605
53866	House	2022-02-10	Auction	2022-02-27	Undisclosed	3	1	1	1.5	676.0	One Agency Sandy Morris	11-pirani-place-evatt-act-2617
53870	Apartment	2022-02-10	$544,900	2022-03-01	$544,900	2	2	2	5.0	0.0	GEOCON	202-335-anketell-street-greenway-act-2900
53871	Unit	2022-02-10	$419,000 - $459,000	2022-04-12	Undisclosed	2	2	1			Beaches & Bush Properties	moruya-heads-2537-nsw
53872	House	2022-02-10	$1,400,000	2022-03-05	$1,400,000	3	1	1	3.0	670.0	home.by holly	8-quandong-street-oconnor-act-2602
53875	Apartment	2022-02-10	$540,000	2022-03-08	$540,000	1	1	1	6.0		home.by holly	16-35-berrigan-crescent-oconnor-act-2602
53876	Unit	2022-02-10	Auction : Saturday March 5th, on site at 10:00am	2022-03-05	Undisclosed	3	2	2	4.5		LJ Hooker Manuka	5-24-telopea-park-kingston-act-2604
53878	House	2022-02-10	$1,675,000	2022-02-25	$1,675,000	5	3	2	2.5	1100.0	home.by holly	29-chevalier-street-weston-act-2611
53883	Unit	2022-02-10	$329,000 - $349,000	2022-03-08	Undisclosed	2	1	1	4.5		LJ Hooker Manuka	14-6-maclaurin-crescent-chifley-act-2606
53885	Land	2022-02-10	$420,000	2022-03-04	$450,000	0	0	0		1179.0	LJ Hooker Moruya	4-caswell-street-moruya-nsw-2537
53891	Townhouse	2022-02-10	Auction	2022-03-04	$580,000	2	1	1	6.0	154.0	Luton Tuggeranong	24-25-pinkerton-circuit-kambah-act-2902
53892	Apartment	2022-02-10	$509,000+	2022-02-25	Undisclosed	2	2	2	6.0		Badenoch Real Estate	27-1-clare-burton-crescent-franklin-act-2913
53893	Apartment	2022-02-10	$440,000	2022-04-06	Undisclosed	1	1	1	6.0		Badenoch Real Estate	141-77-northbourne-avenue-turner-act-2612
53894	Townhouse	2022-02-10	$879,000 - $929,000	2022-02-16	Undisclosed	3	2	2	4.0		LJ Hooker Manuka	41-sarre-street-gungahlin-act-2912
53898	House	2022-02-10	Auction 23/02/2022	2022-02-23	Undisclosed	3	2	2	1.5	732.0	Ray White Canberra	8-castieau-street-higgins-act-2615
53899	Townhouse	2022-02-10	SOLD for $776,000	2022-03-07	$776,000	3	2	2	5.5		McGrath Canberra	84-wanderlight-avenue-lawson-act-2617
53900	House	2022-02-10	$850,000	2022-04-05	$840,000	4	2	2		1306.0	Henley Property - Jindabyne	6-kardinia-court-cooma-nsw-2630
53901	House	2022-02-10	$999,000	2022-03-10	Undisclosed	3	1	1	5.0	748.0	Luton Weston Creek & Molonglo Valley	7-kallara-close-duffy-act-2611
53904	House	2022-02-10	$1,050,000 - $1,125,000	2022-06-10	$1,100,000	5	3	3		5.5	My Agent Team	26-clyde-view-drive-long-beach-nsw-2536
53907	Townhouse	2022-02-10	Auction	2022-03-05	Undisclosed	1	1	1	1.5		Timothy Road	55-canopus-crescent-giralang-act-2617
53909	DuplexSemi-detached	2022-02-10	$1,220,000	2022-03-05	$1,220,000	3	1	1	5.0		home.by holly	264-antill-street-hackett-act-2602
53910	House	2022-02-10	$350,000	2022-02-10	$345,000	2	1	1			Ray White Goulburn	9-8-cowper-street-goulburn-nsw-2580
53911	Unit	2022-02-10	$520,000 - $550,000	2022-03-17	$550,000	3	1	1			Ray White Batemans Bay	9-28-anderson-street-moruya-nsw-2537
53912	Apartment	2022-02-10	$750,000	2022-03-15	$750,000	2	2	2	6.0		home.by holly	18-30-david-street-turner-act-2612
53913	House	2022-02-10	Auction 05/03/2022	2022-03-05	$1,000,000	5	3	3	1.0	940.0	LJ Hooker Dickson	1-affleck-place-scullin-act-2614
53915	House	2022-02-10	$920,000	2022-04-04	$920,000	3	2	2	6.0	388.0	New Door Properties	12-edna-thompson-crescent-casey-act-2913
53916	House	2022-02-10	Auction 04/03/2022	2022-03-04	$1,610,000	5	2	2	0.5	807.0	LJ Hooker Dickson	15-hannan-crescent-ainslie-act-2602
53919	Unit	2022-02-10	Contact Agent	2022-03-10	$219,500	1	1	1			LJ Hooker Queanbeyan – Jerrabomberra – Googong	5-7-arthur-street-crestwood-nsw-2620
53920	House	2022-02-10	Expressions of Interest	2022-05-05	$1,215,000	3	2	1		3542.0	Belle Property Braidwood	76-monkittee-street-braidwood-nsw-2622
53921	House	2022-02-10	Contact Agent	2022-03-04	Undisclosed	4	3	2	1.0	816.0	home.by holly	6-shortland-crescent-ainslie-act-2602
53924	House	2022-02-10	$1,450,000	2022-02-26	$1,450,000	3	2	2	4.5	318.0	home.by holly	79-negus-crescent-watson-act-2602
53925	House	2022-02-10	AUCTION	2022-03-07	Undisclosed	4	2	2	0.5		McIntyre Property	19-tauchert-street-chapman-act-2611
