id	type	ListingDate	PriceLabel	SoldDate	SoldPrice	Beds	Baths	Cars	EER	PlotSize	Agency.Name	Slug
67003	AcreageSemi-rural	2022-10-01	$900,000	2022-11-23	$900,000	3	2	5		5.6	Burchell Higgins Property Sales	122-tantawangalo-lane-candelo-nsw-2550
67007	House	2022-10-01	$865,000 - $900,000	2022-10-28	Undisclosed	4	2	2		942.0	PRD Wagga Wagga	1-beaurepaire-street-boorooma-nsw-2650
67008	House	2022-10-02	$1,560,000	2022-10-18	$1,560,000	5	3	3		840.0	Henley Property - Jindabyne	17-rainbow-drive-east-jindabyne-nsw-2627
67463	House	2022-10-04	$600,000 - $640,000	2022-09-29	$626,000	3	2	2		698.0	One Agency Wagga Wagga	6-ross-parkway-gobbagombalin-nsw-2650
67532	House	2022-10-04	Sold Prior to Auction	2022-10-14	Undisclosed	4	2	2	5.0	536.0	Luton Gungahlin	3-timbs-street-casey-act-2913
67546	House	2022-10-04	$350,000	2022-10-20	Undisclosed	2	1	1		708.2	Raine & Horne Young	26-brock-street-young-nsw-2594
67550	House	2022-10-04	$1,110,000	2022-10-14	$1,110,000	4	2	2	1.0	871.0	home.by holly	68-doyle-terrace-chapman-act-2611
67552	AcreageSemi-rural	2022-10-04	$830,000	2022-09-30	$810,000	4	2	3		1.8	Raine & Horne Young	29-belmore-road-young-nsw-2594
67553	Townhouse	2022-10-04	Auction 26/10/2022	2022-10-27	Undisclosed	2	1	1	1.5	256.0	Bastion Property Group	11-92-dexter-street-cook-act-2614
67559	House	2022-10-04	$695,000	2022-11-08	$680,000	4	2	2		765.0	Henley Property - Cooma	39-bligh-street-cooma-nsw-2630
67566	House	2022-10-05	$549,000	2022-11-09	$560,000	3	1	3		1062.0	One Agency Wagga Wagga	21-plumpton-road-kooringal-nsw-2650
67568	House	2022-10-05	$965,000 - $995,000	2022-11-14	$980,000	5	2	2		928.0	One Agency Wagga Wagga	17-atherton-crescent-tatton-nsw-2650
67569	House	2022-10-05	$420,000	2022-11-03	$420,000	3	1	2		1024.0	One Agency Wagga Wagga	9-bungown-place-mount-austin-nsw-2650
67570	House	2022-10-05	$975,000 - $1,025,000	2022-10-31	$995,000	4	2	2		1036.0	One Agency Wagga Wagga	5-kyalla-place-bourkelands-nsw-2650
67572	House	2022-10-05	Auction Saturday 29th October at 9am	2022-10-29	$820,000	3	1	3	5.0	663.0	McCann Properties	41-cuthbert-circuit-wanniassa-act-2903
67573	Townhouse	2022-10-05	Auction 29/10/2022	2022-10-26	Undisclosed	4	2	2	6.0		Independent Gungahlin	50-11-gustin-street-coombs-act-2611
67577	House	2022-10-05	Auction	2022-10-22	Undisclosed	4	2	2	1.0	802.0	LJ Hooker Belconnen	30-alexandria-street-hawker-act-2614
67581	Townhouse	2022-10-05	$550,000	2022-11-17	$545,000	3	1	2	2.5	266.67	McIntyre Property	5-7-nernst-place-banks-act-2906
67582	Apartment	2022-10-05	$370,000 - $390,000	2023-02-02	$375,000	1	1	1			Ray White Queanbeyan | Jerrabomberra	23-6-high-street-queanbeyan-nsw-2620
67586	House	2022-10-05	$1,075,000	2023-01-27	$1,040,000	4	3	2		1201.0	LJ Hooker Batemans Bay	82-northcove-road-long-beach-nsw-2536
67591	House	2022-10-05	$1,395,000 +	2022-11-18	$1,400,000	4	2	2	3.5	732.0	Timothy Road	29-crawford-crescent-flynn-act-2615
67593	House	2022-10-05	$750,000 - $775,000	2023-02-10	Undisclosed	5	3	2		1123.0	PRD Wagga Wagga	4-julie-place-tolland-nsw-2650
67599	Townhouse	2022-10-05	29th October Ray White Belconnen Auction Rooms 3pm	2022-11-03	Undisclosed	2	1	1	6.0		Ray White Canberra	87-eccles-circuit-macgregor-act-2615
67602	House	2022-10-05	$670,000 - $720,000	2022-11-11	$670,000	3	1	1		838.0	My Agent Team	27-evans-street-moruya-nsw-2537
67604	House	2022-10-05	Auction 29/10/2022	2022-10-29	Undisclosed	2	2	1	6.0	115.0	Ray White Canberra	35-spratt-court-casey-act-2913
67605	House	2022-10-05	$779,000+	2022-11-16	$782,000	3	2	2	4.5	250.0	Ray White Canberra	42-lionel-rose-street-holt-act-2615
67606	House	2022-10-05	Auction 29/10/2022	2022-10-29	$1,050,000	4	2	2	5.0	715.0	Ray White Canberra	16-grampians-street-palmerston-act-2913
67611	House	2022-10-05	Auction	2022-10-29	Undisclosed	3	1	1	2.5		Luton Gungahlin	10-karrugang-circuit-ngunnawal-act-2913
67612	Townhouse	2022-10-05	$525,000 +	2022-10-26	Undisclosed	2	1	1	6.0	203.0	LJ Hooker Kippax	18-141-macfarlane-burnet-avenue-macgregor-act-2615
67613	House	2022-10-05	Auction 29/10/2022	2022-10-29	$890,000	3	2	2	2.0	987.9	Ray White Canberra	5-narryer-close-palmerston-act-2913
67615	House	2022-10-05	$985,000	2022-10-20	$982,500	4	2	2		647.0	LJ Hooker Malua Bay	4-mimosa-place-malua-bay-nsw-2536
67616	House	2022-10-05	Auction	2022-10-22	Undisclosed	3	2	2	1.5	956.0	LJ Hooker Belconnen	6-moy-place-macquarie-act-2614
67617	House	2022-10-05	$1,149,000+	2022-12-09	Undisclosed	4	2	2	1.0		Badenoch Real Estate	30-kulgera-street-hawker-act-2614
67618	House	2022-10-05	Price Guide $1,500,000	2023-03-11	Undisclosed	4	3	2		830.0	Sails Real Estate	193-mirador-drive-merimbula-nsw-2548
67619	House	2022-10-05	$1,750,000 - $1,850,000	2022-10-17	$1,860,000	4	3	4		1173.0	Ian McNamee & Partners - Queanbeyan	4-camphorwood-close-jerrabomberra-nsw-2619
67621	Unit	2022-10-05	$290,000 - $310,000	2022-11-03	Undisclosed	2	1	1		2119.06	Ray White Wagga Wagga	2-241-243-edward-street-wagga-wagga-nsw-2650
67624	House	2022-10-05	$1,200,000+	2022-11-10	Undisclosed	5	3	1	3.5	813.0	Ray White Canberra	6-nullagine-street-fisher-act-2611
67625	House	2022-10-05	$749,000+	2023-03-10	$745,000	3	1	4	1.5	882.0	Impact Properties	59-armstrong-crescent-holt-act-2615
67631	House	2022-10-05	Guide $1,350,000	2023-03-31	$1,350,000	5	2	2		2018.0	Ray White Goulburn	34-platypus-circuit-goulburn-nsw-2580
67636	House	2022-10-05	$1,275,000	2022-10-29	$1,275,000	4	2	2	0.0	695.0	home.by holly	52-marsden-street-dickson-act-2602
67638	House	2022-10-05	$260,000 - $280,000	2022-10-20	Undisclosed	3	1	1		581.7	LJ Hooker Wagga Wagga	47-chifley-crescent-kooringal-nsw-2650
67639	House	2022-10-05	$1,470,000	2023-02-23	$1,400,000	3	2	1		1093.9	LJ Hooker Malua Bay	37-pyang-avenue-malua-bay-nsw-2536
67642	Lifestyle	2022-10-05	$1,750,000	2022-10-26	Undisclosed	2	1	2			Henley Property - Jindabyne	160-mcguffickes-road-jindabyne-nsw-2627
67644	Townhouse	2022-10-06	Auction	2022-10-29	$731,000	2	2	2	6.0		Luton Weston Creek & Molonglo Valley	1-2-bellette-street-weston-act-2611
67645	Apartment	2022-10-06	$599,000+	2022-10-26	Undisclosed	2	2	2	6.0		Luton Weston Creek & Molonglo Valley	19-5-skuta-place-denman-prospect-act-2611
67646	Apartment	2022-10-06	$365,000	2022-11-01	$365,000	2	1	1	5.0		home.by holly	2-156-knox-street-watson-act-2602
67647	Townhouse	2022-10-06	Auction	2022-10-29	$908,000	3	2	2	5.5		Luton Weston Creek & Molonglo Valley	15-50-peter-cullen-way-wright-act-2611
67648	House	2022-10-06	Auction Saturday 29th October at 11:15am	2022-10-29	$1,050,000	4	2	2	1.5	897.0	McCann Properties	40-halfrey-circuit-wanniassa-act-2903
67652	House	2022-10-06	SOLD	2022-11-15	Undisclosed	4	2	1	0.5	724.0	Cream Residential	49-kitchener-street-hughes-act-2605
67653	House	2022-10-06	Auction - 29/10/22	2022-10-31	Undisclosed	4	2	3		875.0	Ian McNamee & Partners - Queanbeyan	55-halloran-drive-jerrabomberra-nsw-2619
67654	Townhouse	2022-10-06	$695,000+	2022-11-01	$720,000	3	1	2	1.5		My Morris	6-15-wyselaskie-circuit-kambah-act-2902
67656	House	2022-10-06	$805,000	2022-10-22	$805,000	3	2	2	1.5	558.0	home.by holly	16-mcgowen-close-spence-act-2615
67657	House	2022-10-06	$1,030,000	2022-11-25	$1,030,000	4	3	3	2.5	717.0	home.by holly	19-embley-street-holder-act-2611
67659	House	2022-10-06	Auction	2023-01-11	Undisclosed	5	2	5	2.0	920.0	Luton Tuggeranong	40-ivo-whitton-circuit-kambah-act-2902
67663	House	2022-10-06	$1,572,500	2022-10-29	Undisclosed	4	2	2	5.0		Bastion Property Group	2-jutland-street-crace-act-2911
67670	House	2022-10-06	Auction: Saturday 22nd October On Site at  9:00am	2022-10-22	Undisclosed	4	2	3	4.0	808.0	LJ Hooker Manuka	15-campaspe-circuit-kaleen-act-2617
67671	Land	2022-10-06	$500,000 - $550,000 Price Guide	2022-11-04	$530,000	0	0	0			Sails Real Estate	52-mccausland-road-lochiel-nsw-2549
67672	Townhouse	2022-10-06	Auction 23/03/2023	2023-03-23	$792,000	3	2	2	1.5		Ray White Canberra	138-dexter-street-cook-act-2614
67675	House	2022-10-06	$869,000	2022-11-16	$850,000	4	2	2	1.5	1169.0	Ray White Canberra	50-kerrigan-street-fraser-act-2615
67677	Unit	2022-10-06	$525,000+	2023-01-09	$525,000	2	1	2	6.0		Luton Gungahlin	40-815-horse-park-drive-amaroo-act-2914
67679	House	2022-10-06	Auction Saturday 29 October 2022, 12pm On Site	2022-10-29	$1,347,500	5	3	2	0.0	904.0	Morrissey Property	4-howarth-place-chapman-act-2611
67682	Lifestyle	2022-10-06	$1,150,000	2023-04-03	$1,125,000	3	2	5		40.0	Ray White Goulburn	3262-middle-arm-road-goulburn-nsw-2580
67683	Land	2022-10-06	$90,000	2023-02-06	Undisclosed	0	0	0		2023.0	Kitson Property	26-argent-street-tarcutta-nsw-2652
67685	Unit	2022-10-06	$365,000+	2022-10-13	Undisclosed	2	1	1	0.0		Ray White Canberra	22-153-murranji-street-hawker-act-2614
67686	House	2022-10-06	Auction	2022-10-22	$960,000	5	2	3	1.5	779.0	LJ Hooker Belconnen	8-bavay-place-page-act-2614
67693	House	2022-10-06	Auction 29/10/22	2022-10-29	$1,275,000	3	1	2	4.0	706.0	LJ Hooker Dickson	12-bonython-street-downer-act-2602
67694	House	2022-10-06	Price Guide $899,000	2022-11-14	$850,000	4	3	4		1767.0	Dwyer Properties Sapphire Coast	4-bellbird-court-wolumla-nsw-2550
67699	Apartment	2022-10-06	offers above $850,000	2022-10-24	$885,000	3	2	2	4.0		Maloney's Property	18-34-leahy-close-narrabundah-act-2604
67702	Townhouse	2022-10-06	$510,000+	2022-10-25	$537,000	2	1	1	1.0		LJ Hooker Kippax	5-23-chave-street-holt-act-2615
67703	House	2022-10-06	$950,000 - $1,000,000	2023-02-09	$950,000	3	1	1		556.0	My Agent Team	12-pacific-street-broulee-nsw-2537
67704	House	2022-10-06	Auction 29/10/2022	2022-10-18	Undisclosed	3	1	2	1.5	749.0	Ray White Canberra	139-wattle-street-oconnor-act-2602
67705	House	2022-10-06	Auction 29/10/2022	2022-10-29	Undisclosed	3	1	1	1.0	709.0	Ray White Canberra	9-oakover-circuit-kaleen-act-2617
67706	Townhouse	2022-10-06	$652,500	2022-10-18	$652,500	3	1	2	2.5		Bastion Property Group	7-18-zamia-place-palmerston-act-2913
67711	House	2022-10-06	Guide $1,600,000 - $1,685,000	2023-03-24	$1,600,000	4	2	2		3566.0	Ray White Bowral	54c-beaconsfield-road-moss-vale-nsw-2577
67714	House	2022-10-06	Auction 29/10/2022	2022-10-29	$712,000	3	1	1	1.0	381.0	Ray White Canberra	4-simons-close-mckellar-act-2617
67716	House	2022-10-06	$750,000	2022-10-31	$750,000	3	1	0		1170.0	Hallmark Real Estate Advisors	17-jellicoe-road-tuross-head-nsw-2537
67719	House	2022-10-06	Auction 05/11/2022	2022-11-05	Undisclosed	5	3	4	0.0	40.77	Ray White Canberra	765-nanima-road-springrange-nsw-2618
67721	House	2022-10-06	Auction: Wednesday 23 November, On site at 12:30pm	2022-11-23	Undisclosed	7	3	4	0.0	985.0	LJ Hooker Manuka	18-gatton-street-farrer-act-2607
67722	House	2022-10-06	Auction	2022-10-29	$1,175,000	3	2	1	1.5	752.0	Luton Dickson	51-abeckett-street-watson-act-2602
67723	House	2022-10-06	Auction	2022-10-29	$1,385,000	5	2	2	2.0	769.0	LJ Hooker Woden/Weston	16-collingridge-street-weston-act-2611
67725	House	2022-10-06	$695,000+	2022-11-11	Undisclosed	3	2	1	6.0	161.0	LJ Hooker Dickson	70-tredwell-street-strathnairn-act-2615
67731	House	2022-10-06	Auction	2022-10-29	$862,617	4	2	2	3.0	898.0	LJ Hooker Dickson	7-rochford-street-fraser-act-2615
67733	House	2022-10-06	Auction - Price Guide $600,000	2022-10-21	$600,000	4	2	2		797.0	Ray White Goulburn	58-allison-street-goulburn-nsw-2580
67736	House	2022-10-06	Auction	2022-10-14	$815,000	3	2	1	5.5		Luton Gungahlin	1-annie-douglas-street-casey-act-2913
67739	House	2022-10-06	Auction 29/10/2022	2022-10-29	Undisclosed	4	2	2	4.0	1090.0	Ray White Canberra	8-mudge-place-mckellar-act-2617
67740	House	2022-10-06	$1,295,000	2022-11-02	$1,274,000	6	3	1	2.0	882.0	The Real Estate Shop	2-jenks-place-evatt-act-2617
67741	Apartment	2022-10-06	$365,000+	2023-01-11	Undisclosed	1	1	1	6.0		Ray White Canberra	45-120-thynne-street-bruce-act-2617
67744	House	2022-10-06	$929,000+	2022-10-26	$980,000	4	3	3	3.5	1129.0	LJ Hooker Kippax	23-longworth-place-holt-act-2615
67745	House	2022-10-06	$1,250,000	2022-11-02	$1,250,000	4	2	2		300.0	Smile Elite	46-ballymore-avenue-north-kellyville-nsw-2155
67750	Apartment	2022-10-07	$635,000	2022-11-03	$635,000	2	1	1	3.5		home.by holly	1a-52-forbes-street-turner-act-2612
67751	Apartment	2022-10-07	$420,000+	2022-11-08	$420,000	2	1	2	6.0		Luton Weston Creek & Molonglo Valley	50-60-john-gorton-drive-coombs-act-2611
67752	House	2022-10-07	contact agent	2022-11-23	Undisclosed	4	3	1	1.0	730.0	home.by holly	3-newton-street-hackett-act-2602
67753	Townhouse	2022-10-07	$720,000	2022-10-29	$720,000	2	1	1	3.0		home.by holly	4-1-batchelor-street-torrens-act-2607
67756	House	2022-10-07	Auction 29/10/2022	2022-10-21	$720,000	3	2	2	6.0		Ray White Canberra	16-2-newchurch-street-coombs-act-2611
67757	House	2022-10-07	$1,810,000	2022-10-29	$1,810,000	4	2	1	6.0	807.0	home.by holly	1-lang-street-ainslie-act-2602
67758	Apartment	2022-10-07	$750,000	2022-10-22	$750,000	2	2	2	6.0		home.by holly	35-40-mort-street-braddon-act-2612
67761	Unit	2022-10-07	Price Guide $630,000	2022-10-06	$635,000	3	2	0			Dwyer Properties Sapphire Coast	2-3-brodribb-court-merimbula-nsw-2548
67768	House	2022-10-07	Auction 29/10/2022	2022-10-12	Undisclosed	4	3	2	2.0	764.8	Ray White Canberra	26-stapylton-street-holder-act-2611
67770	Land	2022-10-07	By Negotiation	2023-02-27	$385,000	0	0	0			McIntyre Property	31-hamilton-rise-yass-nsw-2582
67775	House	2022-10-07	By Negotiation	2022-11-08	$1,150,000	4	2	4	6.0	629.0	Timothy Road	1-binney-close-dunlop-act-2615
67777	Unit	2022-10-07	Offers Over $399,000	2022-10-19	Undisclosed	1	1	1	6.0		Luton Tuggeranong	6-116-easty-street-phillip-act-2606
67778	House	2022-10-07	Auction	2022-10-29	$1,200,000	3	1	1	0.0	769.0	Luton Dickson	24-gardiner-street-downer-act-2602
67779	House	2022-10-07	$1,800,000	2022-10-29	$1,800,000	3	2	2	2.0	944.0	home.by holly	43-holmes-crescent-campbell-act-2612
67782	House	2022-10-07	Guide $640,000	2023-02-06	$660,000	3	2	0		380.0	Ray White Goulburn	lot-3-37-elizabeth-street-goulburn-nsw-2580
67785	House	2022-10-07	$735,000	2022-11-15	$725,000	4	2	5		903.0	Raine & Horne Goulburn	39-bunnaby-street-taralga-nsw-2580
67790	Townhouse	2022-10-07	Auction 29/10/2022	2022-10-29	Undisclosed	2	1	2	5.0		Ray White Canberra	6-51-ainsworth-street-mawson-act-2607
67794	House	2022-10-07	$750,000 - $790,000	2022-10-31	$750,000	3	2	2		670.0	My Agent Team	16-timbara-crescent-surfside-nsw-2536
67802	House	2022-10-07	Contact Agent	2022-10-21	$1,180,000	4	2	2		511.0	Smile Elite	6-woolgunyah-parkway-flinders-nsw-2529
67806	Land	2022-10-07	$735,000	2022-11-26	$735,000	0	0	0		387.0	Smile Elite	41-arncliff-avenue-marsden-park-nsw-2765
67807	AcreageSemi-rural	2022-10-07	$4,400,000	2022-11-24	$4,400,000	3	2	3		98.8	Smile Elite	2-boundary-creek-road-wardell-nsw-2477
67811	Apartment	2022-10-07	$480,000	2022-11-24	$480,000	2	2	2	6.0		home.by holly	72-20-federal-highway-watson-act-2602
67813	House	2022-10-07	$820,000	2022-11-28	Undisclosed	3	1	1		505.9	Macarthur Real Estate Agency	51-murray-street-wagga-wagga-nsw-2650
67814	House	2022-10-08	$495,000	2022-10-27	Undisclosed	4	2	1		664.0	Flemings Property Services	14-william-street-young-nsw-2594
67815	House	2022-10-08	$750,000 - $800,000	2023-03-24	Undisclosed	3	3	2		600.0	Dwyer Properties Sapphire Coast	38-bournda-circuit-tura-beach-nsw-2548
67816	House	2022-10-08	Price Guide $3.85m - Call Frank - 0456 555 422	2023-02-27	Undisclosed	5	3	10			Raine & Horne Southern Highlands	200-green-valley-road-kangaroo-valley-nsw-2577
67817	House	2022-10-08	SOLD	2023-10-31	Undisclosed	4	2	2		607.0	Flemings Property Services	2-boyd-street-cootamundra-nsw-2590
67821	House	2022-10-10	$870,000	2022-10-28	$870,000	4	2	3		814.0	Smile Elite	14-limerick-close-ashtonfield-nsw-2323
67826	House	2022-10-10	$1,095,000	2023-08-17	$1,035,000	4	2	4		3.39	My Agent Team	14-sanctuary-forest-place-long-beach-nsw-2536
67829	Land	2022-10-10	$699,000	2023-08-17	$685,000	0	0	0		738.0	My Agent Team	13-mimosa-place-malua-bay-nsw-2536
67833	Apartment	2022-10-10	$240,000 - $260,000	2022-11-25	$245,000	1	1	1			Ray White Queanbeyan | Jerrabomberra	18-10-arthur-street-queanbeyan-nsw-2620
67836	Land	2022-10-10	$550,000	2022-11-08	$500,000	0	0	0		902.0	My Agent Team	81-courtenay-crescent-long-beach-nsw-2536
67841	House	2022-10-10	$595,000	2022-11-10	Undisclosed	4	2	2		780.6	PRD Wagga Wagga	96-yentoo-drive-glenfield-park-nsw-2650
67845	House	2022-10-10	$1,250,000 - $1,350,000	2023-03-01	Undisclosed	4	3	3		25750.0	My Agent Team	74-cors-parade-north-batemans-bay-nsw-2536
67849	Land	2022-10-10	Expressions Of Interest	2023-02-10	Undisclosed	0	0	0		1200.0	Ray White Goulburn	lot-1-theatre-drive-lansdowne-street-goulburn-nsw-2580
67858	House	2022-10-10	AUCTION 11th November 2022	2022-11-11	$900,000	4	2	2		1012.0	Ray White Goulburn	87-bradley-street-goulburn-nsw-2580
67859	House	2022-10-10	$1,200,000+	2022-11-11	$1,190,000	6	2	3	2.5	753.0	McIntyre Property	3-dartnell-street-gowrie-act-2904
67863	House	2022-10-10	Auction	2022-10-26	$615,000	2	1	1	1.0	365.0	LJ Hooker Kippax	21-macfarlan-place-latham-act-2615
67865	House	2022-10-10	990000	2023-01-09	$990,000	4	3	1			Smile Elite	20a-globe-street-riverstone-nsw-2765
67866	Apartment	2022-10-10	Offers over $399,000	2022-11-04	$410,000	1	1	1	6.0		Luton Manuka	24-1-cowlishaw-street-greenway-act-2900
67870	Apartment	2022-10-10	$349,999+	2023-01-31	$352,000	1	1	1	6.0		One Agency Gungahlin	215-38-gozzard-street-gungahlin-act-2912
67874	House	2022-10-11	$649,000	2022-12-09	$630,000	3	1	4		856.0	Raine & Horne Goulburn	5-valley-walk-goulburn-nsw-2580
67875	House	2022-10-11	$619,000	2022-11-10	$580,000	3	1	1		672.0	Raine & Horne Goulburn	42-murray-street-goulburn-nsw-2580
67876	House	2022-10-11	$925,000	2023-09-27	$890,000	4	2	1		759.0	Ray White Batemans Bay	37-long-beach-road-long-beach-nsw-2536
67878	Lifestyle	2022-10-11	$1,475,000	2023-04-05	$1,400,000	3	1	5		102.74	Belle Property Braidwood	3785-cooma-road-braidwood-nsw-2622
67879	House	2022-10-11	BY NEGOTIATION	2022-11-09	$750,000	3	1	1		765.1	Ward Estate Agents	18-waterloo-st-queanbeyan-nsw-2620
67882	House	2022-10-11	Auction 29/10/2022	2022-10-29	$730,000	3	1	2	2.5	875.0	Ray White Canberra	18-mcmahon-court-kambah-act-2902
67883	Lifestyle	2022-10-11	By Negotiation	2023-06-05	$1,200,000	3	1	2		42.4	Ray White Braidwood	558-northangera-road-mongarlowe-nsw-2622
67884	House	2022-10-11	Auction 05/11/2022	2022-11-05	$935,000	4	2	2	4.0	1040.0	Ray White Canberra	8-towers-place-gordon-act-2906
67885	House	2022-10-11	$569,000	2022-12-09	$530,000	4	1	1		645.0	Raine & Horne Goulburn	46-hume-street-goulburn-nsw-2580
67886	House	2022-10-11	Auction 29/10/2022	2022-10-29	$1,235,000	5	2	2	6.0	590.99	Ray White Canberra	24-ballantyne-crescent-franklin-act-2913
67889	Apartment	2022-10-11	$650,000+	2022-11-28	$662,500	3	2	2	5.5		LJ Hooker Tuggeranong	37-1-cowlishaw-street-greenway-act-2900
67894	House	2022-10-11	$900,000+	2023-06-29	$950,000	4	2	2	3.0	802.84	McIntyre Property	11-muntz-street-chisholm-act-2905
67896	House	2022-10-11	$619,000	2023-08-15	$585,000	3	2	2		556.0	Bella Coastal Property	4-spinks-avenue-lake-conjola-nsw-2539
67904	House	2022-10-11	$1,020,000	2023-04-07	$1,000,000	4	2	2		1001.0	Ray White Bungendore	6-bluskie-close-bungendore-nsw-2621
67911	Land	2022-10-11	$365,000	2023-08-09	$357,000	0	0	0		641.0	LJ Hooker Malua Bay	lot-18-elements-83-saltwood-drive-rosedale-nsw-2536
67916	House	2022-10-11	Auction - Buyers Guide = $500,000	2022-11-05	$551,000	3	1	2		669.0	Ray White Rural Canberra | Yass	2-short-street-yass-nsw-2582
67918	House	2022-10-11	$719,950	2022-11-16	Undisclosed	3	1	2	2.0	420.0	McIntyre Property	32-tregear-close-theodore-act-2905
67931	House	2022-10-11	Bidding Guide $880,000	2022-11-12	$907,000	2	1	1		632.0	My Agent Team	81-banyandah-street-south-durras-nsw-2536
67934	AcreageSemi-rural	2022-10-11	$1,395,000	2023-05-08	$1,395,000	6	3	3		3.92	Kitson Property	6-laurel-road-lake-albert-nsw-2650
68024	House	2022-10-12	Online Auction - Current Bid $610,000	2022-11-02	Undisclosed	3	1	1		651.0	PRD Wagga Wagga	80-railway-street-turvey-park-nsw-2650
68025	House	2022-10-12	By Negotiation	2022-11-10	Undisclosed	4	2	2	1.0	807.0	MARQ Property	170-kingsford-smith-drive-spence-act-2615
68027	Unit	2022-10-12	$1.15m-$1.2m Guide	2022-11-14	$1,150,000	2	2	2			Sails Real Estate	79-1-elizabeth-street-merimbula-nsw-2548
68029	Apartment	2022-10-12	$575,000	2022-11-04	$586,000	1	1	1	6.0		The Real Estate Shop	434-24-lonsdale-street-braddon-act-2612
68031	Cropping	2022-10-12	EOI	2023-02-06	Undisclosed	0	0	0		14916.0	LAWD	gundaline-sturt-highway-carrathool-nsw-2711
68032	House	2022-10-12	Auction 30/10/2022	2022-10-29	Undisclosed	4	2	2	1.5	1163.0	Ray White Canberra	4-goodparla-street-hawker-act-2614
68034	House	2022-10-12	$875,000+	2022-11-24	Undisclosed	4	2	2	2.5	725.0	Ray White Canberra	12-huelin-circuit-flynn-act-2615
68035	House	2022-10-12	$739,000+	2022-12-07	Undisclosed	3	1	2	1.0	686.0	Luton Tuggeranong	73-livingston-avenue-kambah-act-2902
68036	House	2022-10-12	$780,000	2022-10-28	$780,000	3	2	2	4.0	488.0	home.by holly	2-stenhouse-close-evatt-act-2617
68037	House	2022-10-12	$980,000	2022-10-27	Undisclosed	4	1	2		695.0	Bella Coastal Property	13-capricorn-avenue-narrawallee-nsw-2539
68038	Apartment	2022-10-12	$385,000	2022-11-02	$385,000	2	1	1	3.5		home.by holly	9b-109-knox-street-watson-act-2602
68040	House	2022-10-12	Auction 05/11/2022	2022-11-05	$1,355,000	5	2	2	3.0	903.5	Ray White Canberra	34-burdekin-street-duffy-act-2611
68060	Apartment	2022-10-12	Property Sold Prior	2022-11-07	$750,000	2	2	2	6.0		LJ Hooker Canberra City	706-2-batman-street-braddon-act-2612
68068	House	2022-10-12	$739,000	2023-08-08	$710,000	3	1	1		550.0	LJ Hooker Tuross Head	5-snapper-place-tuross-head-nsw-2537
68078	House	2022-10-12	$640,000	2022-12-06	$640,000	2	1	2		864.0	Smile Elite	19-pioneer-road-moruya-nsw-2537
68100	House	2022-10-12	Auction 29/10/2022	2022-10-29	Undisclosed	4	3	2	2.0	1048.0	Ray White Canberra	73-outtrim-avenue-calwell-act-2905
68102	House	2022-10-12	$819,000 - $849,000	2023-02-27	Undisclosed	3	2	2		529.0	Ian McNamee & Partners - Queanbeyan	5-tennyson-drive-queanbeyan-east-nsw-2620
68107	House	2022-10-12	Auction	2022-11-09	$585,000	2	1	1	6.0	200.0	LJ Hooker Dickson	14-phillipa-weeks-street-watson-act-2602
68109	House	2022-10-12	$1,585,000 - Nicholas Lyell	2023-03-31	Undisclosed	3	2	1		1852.0	McGoldrick Estate Agents	9-kentia-crescent-berry-nsw-2535
68110	House	2022-10-12	Auction 29/10/2022	2022-10-17	Undisclosed	2	1	1	2.0		Ray White Canberra	13-28-springvale-drive-hawker-act-2614
68135	House	2022-10-12	$649,500 - $669,500	2022-11-02	$695,000	4	2	3		2023.0	PRD Wagga Wagga	12-taber-street-uranquinty-nsw-2652
68153	House	2022-10-12	Auction - 2/11/22	2022-11-03	$2,860,000	6	4	4	5.5		Independent Gungahlin	45-castlereagh-crescent-macquarie-act-2614
68202	House	2022-10-12	Auction	2022-11-05	Undisclosed	3	2	2	5.5	496.0	Luton Kippax	4-clendinnen-street-dunlop-act-2615
68204	Apartment	2022-10-12	$530,000+	2022-11-15	$565,000	2	2	1	5.0		McIntyre Property	3-58-eileen-good-street-greenway-act-2900
68225	House	2022-10-12	Auction	2022-11-04	Undisclosed	3	2	2	4.5	600.0	Luton Kippax	58-macfarlane-burnet-avenue-macgregor-act-2615
68228	House	2022-10-12	Auction	2022-11-05	$711,000	3	1	0	1.5	540.8	LJ Hooker Canberra City	4-tuart-place-rivett-act-2611
68240	Alpine	2022-10-12	$395,000	2022-11-08	$400,000	1	1	1	0.0		Henley Property - Jindabyne	13-2-clyde-street-jindabyne-nsw-2627
68244	Townhouse	2022-10-13	Auction	2022-11-05	$730,000	3	2	2	2.5	458.0	Luton Weston Creek & Molonglo Valley	1-61-ashby-circuit-kambah-act-2902
68250	House	2022-10-13	Auction	2022-11-05	$865,000	4	2	2	4.0		Luton Belconnen	13a-blackman-crescent-macquarie-act-2614
68252	House	2022-10-13	Auction	2022-11-02	Undisclosed	3	2	2	5.0		Luton Gungahlin	27-patrick-shaw-street-casey-act-2913
68260	House	2022-10-13	$1,650,000	2022-11-08	$1,650,000	4	3	1	2.5		home.by holly	82-dryandra-street-oconnor-act-2602
68262	House	2022-10-13	$1,550,000 - $1,675,000	2023-03-03	$1,465,000	3	2	1		834.7	Ray White Batemans Bay	5-sunrise-road-mossy-point-nsw-2537
68266	House	2022-10-13	$900,000	2022-12-05	Undisclosed	2	1	0	5.0	461.75	Ray White Canberra	45-tallara-parkway-narrabundah-act-2604
68269	Land	2022-10-13	BY NEGOTIATION	2023-01-25	$1,200,000	0	0	0		929.1	Ward Estate Agents	19-gilmore-place-queanbeyan-nsw-2620
68271	House	2022-10-13	$2,250,000	2023-02-16	$2,250,000	4	3	2	1.0	846.0	home.by holly	69-elimatta-street-braddon-act-2612
68275	House	2022-10-13	Auction 03/11/2022	2022-11-03	Undisclosed	4	2	2	2.0	847.0	Ray White Canberra	10-farrelly-close-oxley-act-2903
68277	Apartment	2022-10-13	$695,000	2023-01-27	$680,000	2	2	1	6.0		Maloney's Property	28-10-ovens-street-griffith-act-2603
68279	House	2022-10-13	Auction 05/11/2022	2022-11-05	$890,000	4	2	6	3.0	1025.0	Ray White Canberra	2-hurry-place-chisholm-act-2905
68281	Townhouse	2022-10-13	$849,000+	2022-11-14	$835,000	4	2	2	5.0	210.0	Michael Potter Real Estate	79-plimsoll-drive-casey-act-2913
68283	House	2022-10-13	$920,000+	2022-11-25	Undisclosed	4	2	4	3.0	1166.0	Ray White Canberra	4-crofts-place-spence-act-2615
68286	House	2022-10-13	$699,000	2023-08-21	$680,000	4	2	1		556.0	Hallmark Real Estate Advisors	31-coogee-street-tuross-head-nsw-2537
68288	House	2022-10-13	Offers above $949,000	2022-11-29	Undisclosed	4	2	2	6.0	388.0	New Door Properties	67-turbayne-crescent-forde-act-2914
68289	House	2022-10-12	SOLD $2,005,500.00	2022-12-08	$2,005,500	6	4	2	4.5	653.0	New Door Properties	10-verreaux-crescent-throsby-act-2914
68290	Terrace	2022-10-13	Contact Agent	2022-11-05	$620,000	3	2	2	4.0	255.0	Crowthers	9-5-blakey-close-monash-act-2904
68293	House	2022-10-13	Auction	2022-11-05	$833,000	3	2	2	4.0	554.0	LJ Hooker Woden/Weston	24-wyselaskie-circuit-kambah-act-2902
68296	House	2022-10-13	$1,650,000+	2023-03-29	$1,675,000	4	2	1	2.5	838.8	LJ Hooker Dickson	70-paterson-street-ainslie-act-2602
68298	Apartment	2022-10-13	$649,000	2022-11-11	$660,000	2	2	1	6.0		The Real Estate Shop	21-50-moore-street-turner-act-2612
68299	House	2022-10-13	$855,000	2022-12-07	$855,000	4	1	1	5.0	426.0	home.by holly	73-ashkanasy-crescent-evatt-act-2617
68301	House	2022-10-13	$839,000+	2022-11-17	Undisclosed	3	2	2	2.0	776.0	Ray White Canberra	148-heagney-crescent-chisholm-act-2905
68302	Unit	2022-10-13	$539,000	2023-01-17	$525,000	2	1	1			LJ Hooker Malua Bay	1-440-442-beach-road-sunshine-bay-nsw-2536
68311	House	2022-10-13	$770,000+	2022-11-17	Undisclosed	3	2	2	6.0	231.0	Ray White Canberra	218-anthony-rolfe-avenue-gungahlin-act-2912
68316	House	2022-10-13	Auction 05/11/2022	2022-11-05	$1,331,000	5	3	2	0.0		Ray White Canberra	32-moroak-street-hawker-act-2614
68318	House	2022-10-13	AUCTION	2022-11-09	$935,500	4	2	2	4.0	862.0	McIntyre Property	3-annear-place-fadden-act-2904
68322	House	2022-10-13	$299,500	2022-11-02	Undisclosed	2	1	1			PRD Wagga Wagga	3-18-20-vestey-street-wagga-wagga-nsw-2650
68324	House	2022-10-13	$550,000	2022-11-24	Undisclosed	3	1	2		1012.0	Raine & Horne Young	207-neill-street-harden-nsw-2587
68326	Townhouse	2022-10-13	$689,000 +	2023-02-16	Undisclosed	2	1	1	1.5		LJ Hooker Woden/Weston	29-14-marr-street-pearce-act-2607
68332	Land	2022-10-12	$1.25mil	2022-10-14	$1,408,000	0	0	0		2.26	Raine & Horne Goulburn	237-wheeo-rd-goulburn-nsw-2580
68336	House	2022-10-13	$699 000	2022-11-10	$695,000	4	2	2		695.0	LJ Hooker Malua Bay	11-kobada-avenue-lilli-pilli-nsw-2536
68343	House	2022-10-13	AUCTION GUIDE $700,000	2022-11-11	$715,000	3	2	3		834.7	Ray White Goulburn	12-eldon-street-goulburn-nsw-2580
68350	House	2022-10-14	Auction 05/11/2022	2022-11-05	$1,755,000	4	2	1	1.5	1168.0	LJ Hooker Dickson	14-angas-street-ainslie-act-2602
68355	Unit	2022-10-14	Auction Sat, 5th Nov at 10:00am	2022-11-05	$534,000	2	2	2	6.0	0.0	LJ Hooker Gungahlin	78-100-henry-kendall-street-franklin-act-2913
68356	Apartment	2022-10-14	$699,000	2022-11-11	Undisclosed	3	2	1			Sails Real Estate	7-115-tura-beach-drive-tura-beach-nsw-2548
68357	House	2022-10-14	$1,500,000	2022-11-09	$1,500,000	6	4	4		569.0	LJ Hooker Batemans Bay	13-sandy-place-long-beach-nsw-2536
68361	House	2022-10-14	Auction 05/11/2022	2022-11-05	$1,128,000	3	1	2	1.5	664.0	Ray White Canberra	36-wattle-street-lyneham-act-2602
68363	House	2022-10-14	$1,865,000	2022-11-05	$1,865,000	4	2	1	4.0	739.0	home.by holly	12-eady-street-dickson-act-2602
68370	House	2022-10-13	$820,000	2023-03-08	$805,000	4	2	2	1.0	699.0	LJ Hooker Belconnen	23-hayward-street-macgregor-act-2615
68371	Unit	2022-10-12	Auction	2022-11-10	$520,000	3	1	1	6.0		LJ Hooker Belconnen	114-15-john-cleland-crescent-florey-act-2615
68374	House	2022-10-14	SOLD BY NORMA DOMINGUEZ & CIELO POWDITCH	2022-11-24	Undisclosed	4	3	5		579.0	Smile Elite	31-attunga-road-yowie-bay-nsw-2228
68376	House	2022-10-13	Auction	2022-10-29	$932,000	4	2	2	6.0	446.0	LJ Hooker Belconnen	2-358-southern-cross-drive-macgregor-act-2615
68377	Townhouse	2022-10-12	Auction	2022-10-29	$745,000	2	1	1	1.5	372.0	LJ Hooker Belconnen	3-gorrie-close-hawker-act-2614
68378	Apartment	2022-10-12	Auction	2022-10-29	$296,000	1	1	1	6.0		LJ Hooker Belconnen	41-2-ranken-place-belconnen-act-2617
68380	House	2022-10-14	AUCTION	2022-11-05	$925,000	3	1	1	1.0		Michael Potter Real Estate	24-batchelor-street-torrens-act-2607
68381	House	2022-10-14	Contact agent	2022-11-05	Undisclosed	1	1	1	0.5		home.by holly	26-wybalena-grove-cook-act-2614
68388	Land	2022-10-14	$194,000	2023-10-17	$194,000	0	0	0		1012.0	Marshall and Tacheci Real Estate	14-bermaguee-street-quaama-nsw-2550
68399	House	2022-10-14	$795,000	2022-12-05	$775,000	3	2	2		871.0	Elders Real Estate Batemans Bay	46-long-beach-road-long-beach-nsw-2536
68400	House	2022-10-14	Contact Agent	2022-12-05	Undisclosed	3	2	2			Macarthur Real Estate Agency	35-flack-crescent-boorooma-nsw-2650
68402	House	2022-10-14	Auction 30/10/2022	2022-10-30	Undisclosed	3	3	1	1.0	1037.0	Ray White Canberra	12-orourke-street-weetangera-act-2614
68403	House	2022-10-14	$630,000 - $650,000	2022-11-08	Undisclosed	3	2	2		409.0	Ray White Wagga Wagga	39-galing-place-wagga-wagga-nsw-2650
68409	AcreageSemi-rural	2022-10-14	$1,200,000	2023-05-02	$1,030,000	3	2	4		25.0	Fraser-Gray Real Estate	31-brierley-avenue-moruya-nsw-2537
68411	House	2022-10-14	Contact Agent	2022-11-12	$1,675,000	5	3	2		650.0	Smile Elite	40-cormorant-avenue-sussex-inlet-nsw-2540
68414	Townhouse	2022-10-14	Contact Agent	2022-10-28	$915,000	4	2	2			Smile Elite	18-bessie-glade-schofields-nsw-2762
68416	House	2022-10-14	Contact Agent	2023-01-27	Undisclosed	4	2	3		731.0	Smile Elite	34-yarrawonga-drive-mollymook-beach-nsw-2539
68417	House	2022-10-14	$1,000,000	2022-11-26	$1,000,000	3	2	1		318.0	Smile Elite	52-austin-street-schofields-nsw-2762
68418	Land	2022-10-14	860000	2023-04-14	$860,000	0	0	0		388.2	Smile Elite	lot-4203-mariner-avenue-schofields-nsw-2762
68419	House	2022-10-14	$590,000	2022-11-02	$590,000	4	2	3		919.0	Smile Elite	18-fitzgerald-avenue-muswellbrook-nsw-2333
68423	House	2022-10-14	730000	2023-02-03	$730,000	4	2	2		487.8	Smile Elite	6-sunbright-road-kelso-nsw-2795
68427	House	2022-10-14	$1,370,000	2022-11-18	$1,370,000	4	3	2		486.2	Smile Elite	25-hollindale-street-box-hill-nsw-2765
68428	Lifestyle	2022-10-14	Contact Agent	2023-03-13	Undisclosed	3	2	0		37.0	LAWD	394-oura-road-wagga-wagga-nsw-2650
68430	House	2022-10-15	Auction 30/10/2022	2022-10-30	Undisclosed	6	3	2	2.0	2469.0	Ray White Canberra	117-springvale-drive-weetangera-act-2614
68432	Land	2022-10-15	$349,000	2023-01-25	Undisclosed	0	0	0		624.0	Ben Bate Real Estate	5-tatiara-street-dalmeny-nsw-2546
68437	House	2022-10-17	AUCTION	2022-11-07	$930,000	3	2	5	4.5	888.23	McIntyre Property	89-deamer-crescent-richardson-act-2905
68438	House	2022-10-17	$890,000+	2022-11-07	Undisclosed	4	2	4	4.0	0.0	Edge Dewi Radyanto	46-8-ken-tribe-coombs-act-2611
68439	House	2022-10-17	$1,450,000 - $1,550,000	2023-03-31	Undisclosed	4	2	2		804.0	Sails Real Estate	13-curragudde-close-pambula-beach-nsw-2549
68441	House	2022-10-17	$496,000	2023-02-24	$500,000	3	1	1		1287.0	Henley Property - Cooma	7-nadoo-place-cooma-nsw-2630
68443	House	2022-10-17	$900,000 -$970,000	2023-04-12	$920,000	4	2	1		556.0	My Agent Team	21-ocean-avenue-surf-beach-nsw-2536
68444	House	2022-10-17	AUCTION	2022-11-15	$550,000	2	1	1		569.0	Elders Real Estate Batemans Bay	30-bavarde-avenue-batemans-bay-nsw-2536
68447	House	2022-10-12	Preview	2022-11-04	Undisclosed	3	1	1		1296.0	Ray White Wagga Wagga	49-phillip-avenue-mount-austin-nsw-2650
68449	House	2022-10-17	$849,000 - $869,000	2023-02-15	$869,000	4	2	2		1006.0	Sails Real Estate	100-golf-circuit-tura-beach-nsw-2548
68456	House	2022-10-17	AUCTION	2023-04-15	$992,000	4	2	2	5.5	418.0	Bastion Property Group	4-drooka-crescent-crace-act-2911
68458	Farmlet	2022-10-17	$975,000	2023-01-24	$950,000	4	2	2		6.05	Belle Property Braidwood	10315-nerriga-road-braidwood-nsw-2622
68459	Unit	2022-10-17	$309,000	2022-11-08	$305,000	2	1	1			Ray White Goulburn	1-9-allison-street-goulburn-nsw-2580
68472	House	2022-10-17	Bidding Guide: $1,200,000	2022-11-02	$1,365,000	3	2	2		1227.0	My Agent Team	16-millers-crescent-moruya-heads-nsw-2537
68481	Land	2022-10-17	$179 000	2023-02-14	Undisclosed	0	0	0		6046.0	Raine & Horne Young	11-cherry-tree-close-bendick-murrell-nsw-2803
68482	Townhouse	2022-10-17	By Negotiation	2023-01-25	Undisclosed	3	2	2	6.0	190.0	Impact Properties	32-141-mapleton-avenue-harrison-act-2914
68490	Land	2022-10-17	$1,195,000	2023-03-14	Undisclosed	0	0	0		1388.0	Whale Coast Realty	3-jocelyn-street-dalmeny-nsw-2546
68491	House	2022-10-17	$965,000	2023-01-31	$850,000	4	2	4		2935.0	Henley Property - Cooma	42-massie-street-cooma-nsw-2630
68498	House	2022-10-17	$824,900+	2022-11-10	$855,000	3	2	2	6.0	380.0	LJ Hooker Gungahlin	16-jule-knight-street-casey-act-2913
68506	House	2022-10-18	Sold $950,000	2022-11-12	$950,000	4	2	2	4.0	690.0	MARQ Property	26-james-smith-circuit-conder-act-2906
68511	House	2022-10-18	Auction 05/11/2022	2022-10-28	$940,000	4	2	2	6.0	255.2	Ray White Canberra	45-mapleton-avenue-harrison-act-2914
68520	House	2022-10-13	Auction (Unless sold prior)	2022-11-03	Undisclosed	3	1	1			Ray White Wagga Wagga	37-mitchelmore-street-turvey-park-nsw-2650
68527	AcreageSemi-rural	2022-10-18	$900,000	2022-11-23	$930,000	6	3	3		69.0	Henley Property - Cooma	327-warrens-corner-road-numeralla-nsw-2630
68531	Unit	2022-10-18	$385,000	2022-11-17	Undisclosed	2	1	1			Whale Coast Realty	4-32-cresswick-parade-dalmeny-nsw-2546
68541	House	2022-10-12	$550,000	2023-06-03	$510,000	3	1	2		683.0	Raine & Horne Goulburn	151-kinghorne-street-goulburn-nsw-2580
68543	House	2022-10-18	$380,000	2022-10-27	Undisclosed	3	1	4		1018.0	Flemings Property Services	109-swift-street-harden-nsw-2587
68547	House	2022-10-18	Auction	2022-11-06	$1,320,000	3	2	2	4.5	649.0	Luton Gungahlin	42-aida-ball-circuit-forde-act-2914
68553	Townhouse	2022-10-18	900000	2023-02-16	$900,000	4	2	1			Smile Elite	46-godfrey-glade-schofields-nsw-2762
68555	House	2022-10-18	Contact Agent	2023-02-02	Undisclosed	4	2	2	1.0	771.0	Ray White Canberra	386-bugden-avenue-fadden-act-2904
68558	Apartment	2022-10-18	$390,000 Plus	2022-11-04	$430,000	1	1	1	6.0		Maloney's Property	213-17-dooring-street-braddon-act-2612
68560	Townhouse	2022-10-18	Auction	2022-11-06	$801,000	3	3	2	6.0	3792.0	LJ Hooker Belconnen	10-15-calaby-street-coombs-act-2611
68563	House	2022-10-19	$1,199,000	2023-01-19	Undisclosed	3	1	2	3.0		Luton Manuka	11-mackenzie-street-hackett-act-2602
68564	House	2022-10-19	Preview	2022-11-17	Undisclosed	4	2	2		760.0	Ray White Wagga Wagga	19-warambee-street-glenfield-park-nsw-2650
68569	Townhouse	2022-10-19	$720,000	2023-03-21	$711,000	3	1	2	3.0		Maloney's Property	27-23-jondol-place-isabella-plains-act-2905
68573	Townhouse	2022-10-19	Auction	2022-11-05	$650,000	3	2	2	6.0		LJ Hooker Belconnen	8-29-jimmy-little-street-moncrieff-act-2914
68578	House	2022-10-19	$245,000	2023-02-13	Undisclosed	3	1	1		588.1	LJ Hooker Wagga Wagga	9-sepik-road-ashmont-nsw-2650
68580	House	2022-10-19	$689,000+	2022-11-12	$735,000	3	1	6	3.0	756.0	LJ Hooker Kippax	8-fullerton-crescent-richardson-act-2905
68582	House	2022-10-19	$1,211,000	2022-11-02	$1,211,000	4	2	2	5.0	523.0	MARQ Property	8-anchorage-street-harrison-act-2914
68583	House	2022-10-19	$915,000+	2022-12-05	$915,000	3	2	2	4.0	350.0	MARQ Property	57-hesba-brinsmead-street-franklin-act-2913
68584	House	2022-10-19	Auction: Saturday 5 November 9:45am	2022-11-05	$1,296,000	4	2	2	3.5	680.0	MARQ Property	25-strayleaf-crescent-gungahlin-act-2912
68588	House	2022-10-19	$1,100,000	2022-11-25	$990,000	4	2	2	5.0	701.0	Luton Gungahlin	2-ahmatt-street-ngunnawal-act-2913
68589	House	2022-10-19	Auction	2022-11-12	$1,280,000	4	2	3	3.5	1008.0	Luton Gungahlin	74-lyttleton-crescent-cook-act-2614
68590	Townhouse	2022-10-19	$1,050,000	2022-12-07	$1,000,000	3	2	1			Sails Real Estate	2a-jinjera-parade-pambula-beach-nsw-2549
68592	Land	2022-10-19	$340,000 - $355,000	2023-09-07	$335,000	0	0	0		898.5	Macarthur Real Estate Agency	29-durack-circuit-boorooma-nsw-2650
68593	Apartment	2022-10-19	$830,000	2022-11-11	$830,000	3	2	2	5.0	0.0	home.by holly	34-19-25-fawkner-street-braddon-act-2612
68604	House	2022-10-19	$525,000	2022-11-07	$525,000	3	1	1		712.0	Smile Elite	18-miller-street-windradyne-nsw-2795
68608	Unit	2022-10-19	Price Guide $499,000	2022-10-14	Undisclosed	2	1	1			Dwyer Properties Sapphire Coast	3-16-20-merimbola-street-pambula-nsw-2549
68611	House	2022-10-19	Auction Sat, 12th Nov at 11:30am	2022-11-12	$918,500	3	2	2	6.0	420.0	LJ Hooker Gungahlin	175-jabanungga-avenue-ngunnawal-act-2913
68612	Apartment	2022-10-19	Auction	2022-11-02	$382,000	2	1	1	3.5		LJ Hooker Dickson	8-2-walsh-place-curtin-act-2605
68616	House	2022-10-19	$665,000+	2022-11-10	$670,000	3	1	1	5.0		Stone Gungahlin	23-yuranigh-court-ngunnawal-act-2913
68622	Apartment	2022-10-19	$520,000+	2022-12-05	Undisclosed	1	1	1	6.0		Luton Gungahlin	50-81-constitution-avenue-campbell-act-2612
68623	Unit	2022-10-19	Contact Agent	2022-12-07	Undisclosed	2	1	1		140.0	Macarthur Real Estate Agency	6-38-kenneally-street-kooringal-nsw-2650
68625	Land	2022-10-12	Online Live Auction	2022-11-29	$285,000	0	0	0		2900.0	Ray White Rural Tumbarumba	25-langland-street-tumbarumba-nsw-2653
68626	House	2022-10-19	Auction	2022-11-01	Undisclosed	3	1	3	4.0	750.0	Luton Gungahlin	12-sheehy-street-evatt-act-2617
68627	Apartment	2022-10-19	$682,000	2022-11-04	$682,000	2	2	1	5.5	124.0	home.by holly	109-12-david-street-turner-act-2612
68629	House	2022-10-19	Online Auction - Current bid $825,000	2022-11-09	Undisclosed	4	2	1		670.0	PRD Wagga Wagga	36-best-street-wagga-wagga-nsw-2650
68631	House	2022-10-19	$650,000	2022-11-10	$655,000	3	1	0		759.0	Henley Property - Berridale	8-pryce-street-berridale-nsw-2628
68633	House	2022-10-19	$469,000	2023-01-25	$485,000	3	1	1		1006.0	Kitson Property	130-east-street-cartwrights-hill-nsw-2650
68637	Livestock	2022-10-19	$3,150,000	2023-01-09	Undisclosed	3	0	0		343.0	LAWD	1597-black-range-road-bowning-nsw-2582
68641	House	2022-10-19	Auction	2022-11-05	$810,000	3	1	2	2.5	799.0	LJ Hooker Belconnen	3-bennett-place-flynn-act-2615
68642	Townhouse	2022-10-19	$1,110,000	2022-11-05	$1,110,000	3	2	2	5.5		home.by holly	3-74-torrens-street-braddon-act-2612
68644	AcreageSemi-rural	2022-10-19	$1,375,000	2023-09-25	Undisclosed	4	2	2		4.9	Whale Coast Realty	241-ridge-road-central-tilba-nsw-2546
68646	AcreageSemi-rural	2022-10-19	Guide $1,850,000 to $1,950,000	2022-11-16	$1,950,000	5	2	5		2.0	Henley Property - Jindabyne	241-bushy-park-road-east-jindabyne-nsw-2627
68649	House	2022-10-20	Auction	2022-11-12	Undisclosed	4	2	3	3.5	1255.0	Luton Weston Creek & Molonglo Valley	107-ivo-whitton-circuit-kambah-act-2902
68650	House	2022-10-20	Auction	2022-11-12	Undisclosed	4	2	2	2.5	1079.0	Luton Weston Creek & Molonglo Valley	37-mt-vernon-drive-kambah-act-2902
68651	House	2022-10-20	Auction	2022-10-28	Undisclosed	3	2	2	4.0	1032.0	Luton Weston Creek & Molonglo Valley	10-salvado-place-stirling-act-2611
68652	Townhouse	2022-10-20	$649,000	2022-11-25	$638,000	3	1	1	1.5	305.0	Luton Weston Creek & Molonglo Valley	5-147-keverstone-circuit-isabella-plains-act-2905
68654	House	2022-10-20	By Negotiation	2022-11-04	$700,000	3	1	0	3.0	824.0	The Real Estate Shop	5-kootingal-street-giralang-act-2617
68655	Townhouse	2022-10-20	$715,000	2022-11-12	$715,000	2	1	1	2.5	280.0	home.by holly	1-crick-place-belconnen-act-2617
68657	Unit	2022-10-20	Contact Agent	2022-11-14	$670,000	2	2	1	6.0		Independent Gungahlin	105-55-dooring-street-dickson-act-2602
68659	Unit	2022-10-20	Price Range $690,000-$720,000	2023-07-18	$720,000	5	3	2			LJ Hooker Batemans Bay	12-12-heradale-parade-batemans-bay-nsw-2536
68660	Lifestyle	2022-10-20	Price Guide - $2,500,000 to $2,700,000	2023-02-03	Undisclosed	4	3	2		43.05	McGoldrick Estate Agents	545-browns-mountain-road-browns-mountain-nsw-2540
68662	House	2022-10-20	$1,170,000	2023-01-25	$1,170,000	5	3	2	5.5	468.0	home.by holly	16-laird-crescent-forde-act-2914
68663	House	2022-10-20	Auction	2022-11-01	$1,000,000	4	2	2	4.5	451.0	Luton Gungahlin	4-enfield-street-casey-act-2913
68665	House	2022-10-20	For Sale	2023-02-06	Undisclosed	4	2	2	2.0	823.0	Ray White Canberra	37-birdwood-street-hughes-act-2605
68666	House	2022-10-20	Auction 12/11/2022	2022-11-12	Undisclosed	3	1	2	2.0		Ray White Canberra	17-warby-place-charnwood-act-2615
68667	House	2022-10-20	Auction	2022-10-31	$1,310,000	4	2	2	4.0	522.0	Luton Gungahlin	27-winchester-street-casey-act-2913
68668	House	2022-10-20	Auction 12/11/2022	2022-11-11	Undisclosed	4	2	2	5.5	461.0	Bastion Property Group	21-slim-dusty-circuit-moncrieff-act-2914
68669	Townhouse	2022-10-20	Auction Price Guide: $965,000+	2022-11-12	Undisclosed	3	2	2	6.0		Bastion Property Group	19-7-shewcroft-street-watson-act-2602
68670	House	2022-10-20	Auction Saturday 5th November, On Site at 12:00pm	2022-11-05	Undisclosed	5	2	2	0.0		LJ Hooker Manuka	4-woodger-place-fraser-act-2615
68671	House	2022-10-20	$1,070,000	2023-02-14	$1,070,000	4	2	2	6.0	404.0	New Door Properties	115-limb-circuit-moncrieff-act-2914
68673	House	2022-10-20	$1,100,000+	2023-03-01	Undisclosed	4	2	2	2.0	805.0	VERV Property	64-namatjira-drive-stirling-act-2611
68675	Farmlet	2022-10-20	$800,000	2022-12-08	$740,000	4	2	4		9.1	Tarago Real Estate	480-dewsburys-lane-lake-bathurst-nsw-2580
68680	House	2022-10-20	$1,095,000	2023-01-16	Undisclosed	4	2	2		556.0	Whale Coast Realty	47-tatiara-street-dalmeny-nsw-2546
68684	Townhouse	2022-10-20	$675,000	2022-11-05	$675,000	2	2	2	6.0		MARQ Property	7-7-shewcroft-street-watson-act-2602
68686	House	2022-10-20	RESERVE $300,000	2022-11-18	$325,000	3	1	0		385.7	Ray White Goulburn	125-faithfull-street-goulburn-nsw-2580
68687	Apartment	2022-10-20	Auction	2022-11-01	$560,000	2	2	1	6.0		LJ Hooker Belconnen	27c-21-beissel-street-belconnen-act-2617
68688	House	2022-10-20	Auction	2022-11-07	$720,000	3	1	2	4.5	355.0	Luton Kippax	106-hugh-mckay-crescent-dunlop-act-2615
68690	House	2022-10-20	Auction 5/11/2022	2022-11-05	Undisclosed	4	2	2	6.0	377.0	Bastion Property Group	29-pilliga-street-throsby-act-2914
68695	House	2022-10-20	Auction 12/11/2022	2022-11-12	Undisclosed	4	3	2	2.0	985.0	Ray White Canberra	27-sullivan-crescent-wanniassa-act-2903
68696	Townhouse	2022-10-20	$749,000 - $769,000	2023-01-30	Undisclosed	3	2	2			Merimbula Realty	2-96-tura-beach-drive-tura-beach-nsw-2548
68699	House	2022-10-20	$565,000	2022-11-28	Undisclosed	3	2	2		489.0	Macarthur Real Estate Agency	59-durack-circuit-boorooma-nsw-2650
68700	Townhouse	2022-10-20	$590,000+	2022-11-10	Undisclosed	2	1	2	2.0		My Morris	7-59-pinkerton-circuit-kambah-act-2902
68701	House	2022-10-20	Auction	2022-11-12	$995,000	3	2	2	2.0		Luton Gungahlin	241-bugden-avenue-fadden-act-2904
68702	House	2022-10-20	$1,270,000	2022-11-10	$1,270,000	4	2	2	1.0	758.0	home.by holly	9-mccay-place-pearce-act-2607
68709	House	2022-10-20	$755,000	2023-05-16	Undisclosed	5	3	2		840.0	Ben Bate Real Estate	9-marine-drive-narooma-nsw-2546
68713	House	2022-10-20	$975,000+	2022-12-05	Undisclosed	3	2	2	7.5		VERV Property	5a-brough-place-chapman-act-2611
68718	House	2022-10-20	$699,000+	2023-05-11	Undisclosed	3	1	1	0.5	706.0	Ray White Canberra	339-southern-cross-drive-holt-act-2615
68719	House	2022-10-20	AUCTION GUIDE $320,000	2022-11-18	$340,000	1	1	1		235.2	Ray White Goulburn	32-montague-street-goulburn-nsw-2580
68721	House	2022-10-20	Contact Agent	2022-11-15	Undisclosed	4	2	2		645.0	Smile Elite	64a-bright-street-east-lismore-nsw-2480
68722	House	2022-10-20	Price On Request	2023-05-24	Undisclosed	4	2	2		727.0	Smile Elite	76-burraneer-bay-road-burraneer-nsw-2230
68723	House	2022-10-20	Contact  Agent	2022-11-18	$1,160,000	3	1	3		695.0	Smile Elite	45-easton-road-berowra-heights-nsw-2082
68726	House	2022-10-20	$930,000+	2022-10-28	$935,000	5	2	4	3.0	829.0	LJ Hooker Tuggeranong	22-helen-mayo-crescent-bonython-act-2905
68727	House	2022-10-20	Offers Over $689,000	2022-12-07	Undisclosed	3	1	1	3.0	480.0	Luton Tuggeranong	97-pockett-avenue-banks-act-2906
68730	House	2022-10-20	Auction	2022-11-01	Undisclosed	3	1	2	2.0	473.0	Luton Tuggeranong	3-lahey-place-chisholm-act-2905
68731	House	2022-10-20	Sold	2023-04-05	$750,000	3	1	2		651.0	Ian McNamee & Partners - Queanbeyan	20-southwell-place-karabar-nsw-2620
68733	House	2022-10-20	$980,000+	2022-11-16	$980,000	4	2	2	2.5	1117.0	LJ Hooker Tuggeranong	2-michell-street-monash-act-2904
68734	Apartment	2022-10-20	$420,000 +	2023-02-02	$420,000	3	1	1	4.5	3405.0	LJ Hooker Woden/Weston	23-31-disney-court-belconnen-act-2617
68736	House	2022-10-20	$2,950,000+	2023-04-24	Undisclosed	5	4	2	5.0	877.0	LJ Hooker Manuka	54-investigator-street-red-hill-act-2603
68739	House	2022-10-20	$1,899,000+	2023-03-22	$1,800,000	5	4	5	3.0	812.0	LJ Hooker Woden/Weston	12-birdwood-street-hughes-act-2605
68741	House	2022-10-20	Contact Agent	2022-11-15	$220,000	3	1	1		842.0	Smile Elite	10-crown-street-south-lismore-nsw-2480
68746	House	2022-10-20	SOLD PRIOR AUCTION CONTACT AGENT	2022-10-28	Undisclosed	4	2	2	5.5	563.0	New Door Properties	16-mary-gillespie-avenue-gungahlin-act-2912
68758	House	2022-10-21	Auction 10/11/2022	2022-11-10	Undisclosed	2	1	1	2.0	0.0	Ray White Canberra	15-16-gabriel-place-florey-act-2615
68759	Land	2022-10-21	Guide $460,000 to $490,000	2022-10-17	$475,000	0	0	0		1057.0	Henley Property - Jindabyne	39-lotus-avenue-kalkite-nsw-2627
68762	House	2022-10-21	$745,000	2022-11-25	Undisclosed	3	1	2	2.5	838.0	Luton Tuggeranong	1-yelland-place-gilmore-act-2905
68772	Apartment	2022-10-21	Auction	2022-11-03	$780,000	2	2	2	6.0		LJ Hooker Canberra City	302-102-swain-street-gungahlin-act-2912
68775	House	2022-10-21	$700,000-$730,000	2023-03-24	$705,000	4	2	1		700.0	LJ Hooker Gungahlin	12-rossi-street-yass-nsw-2582
68776	House	2022-10-21	$699,000	2023-01-19	Undisclosed	5	2	3		972.7	Macarthur Real Estate Agency	3-atkins-place-estella-nsw-2650
68780	House	2022-10-21	$995,000	2023-02-28	Undisclosed	4	2	2		1302.0	Ben Bate Real Estate	13-lamont-young-drive-mystery-bay-nsw-2546
68791	Lifestyle	2022-10-21	$1,740,000	2022-11-11	$1,740,000	5	2	1		205.0	Belle Property Braidwood	269-foxs-elbow-road-braidwood-nsw-2622
68798	House	2022-10-21	Contact Agent	2022-11-10	Undisclosed	3	1	4		1.32	Smile Elite	18-the-ridgeway-napoleon-reef-nsw-2795
68806	Apartment	2022-10-21	Auction	2022-11-12	Undisclosed	1	1	1	6.0		LJ Hooker Woden/Weston	28-566-cotter-road-wright-act-2611
68811	DuplexSemi-detached	2022-10-21	$680,000 - $710,000	2022-11-15	Undisclosed	3	2	1		432.43	Raine & Horne Goulburn	21-kavanagh-street-goulburn-nsw-2580
68813	DuplexSemi-detached	2022-10-21	$720,000	2022-12-08	$720,000	4	2	2		494.44	Raine & Horne Goulburn	1-konak-street-goulburn-nsw-2580
68814	House	2022-10-21	Auction	2022-11-16	Undisclosed	5	3	1		792.0	Henley Property - Jindabyne	8-caldwell-close-jindabyne-nsw-2627
68822	DuplexSemi-detached	2022-10-21	Under Contract	2023-05-24	Undisclosed	4	3	3		651.0	Ben Bate Real Estate	8-montague-street-narooma-nsw-2546
68826	House	2022-10-22	$830,000 - $869,000	2023-02-03	$820,000	5	2	2		787.0	One Agency Wagga Wagga	19-turramia-crescent-gobbagombalin-nsw-2650
68828	DuplexSemi-detached	2022-10-22	$899,000+	2023-06-08	$890,000	3	2	6	3.5	570.0	Impact Properties	379-gundaroo-drive-gungahlin-act-2912
68829	AcreageSemi-rural	2022-10-22	$3,099,000	2023-03-24	Undisclosed	4	2	0		9.57	Ray White Canberra	105-wattle-flat-road-sutton-nsw-2620
68835	House	2022-10-24	Guide: $630,000 - $660,000	2023-02-15	$637,000	4	2	1		923.0	Henley Property - Cooma	11-giwang-street-cooma-nsw-2630
68842	Townhouse	2022-10-24	$650,000+	2023-04-14	$635,000	3	2	1	5.0		McIntyre Property	5-29-muriel-stewart-circuit-bonner-act-2914
68844	House	2022-10-24	Auction Onsite Thursday 24th November 2022 at 1pm.	2022-11-24	Undisclosed	4	3	2		35.73	PRD Wagga Wagga	631-wokolena-road-alfredtown-nsw-2650
68857	House	2022-10-24	$1,400,000+	2023-03-29	Undisclosed	4	2	2	0.5	0.0	Wright Dunn Real Estate	21-shortland-crescent-ainslie-act-2602
68871	Land	2022-10-24	$84,000	2023-06-06	$75,000	0	0	0		3770.0	Flemings Property Services	lot-6-9-nubba-road-nubba-nsw-2587
68874	House	2022-10-24	$465,000	2023-02-10	Undisclosed	4	2	4			Macarthur Real Estate Agency	37-alfred-street-oura-nsw-2650
68883	House	2022-10-25	$950,000 - $1,045,000	2022-12-08	$985,000	3	2	2		917.0	Sails Real Estate	31-camilla-court-merimbula-nsw-2548
68894	Apartment	2022-10-25	$770000	2022-10-24	$770,000	3	1	2			Henley Property - Jindabyne	1-125-gippsland-street-jindabyne-nsw-2627
68895	House	2022-10-25	Price Guide $895,000- $940,000	2023-09-07	$895,000	4	2	2		700.0	Raine & Horne Southern Highlands	13-roche-close-moss-vale-nsw-2577
68902	House	2022-10-25	$739,000	2022-11-14	$745,000	3	1	4		809.0	Ray White Batemans Bay	115-albert-street-moruya-nsw-2537
68903	House	2022-10-12	$550,000	2022-11-14	Undisclosed	4	2	2			Raine & Horne Young	unit-1-2-13-cloete-street-young-nsw-2594
68904	House	2022-10-25	Offers Above $995,000	2023-02-09	Undisclosed	3	2	2	3.5	501.0	McIntyre Property	weston-2611-act
68910	Apartment	2022-10-25	$525,000+	2022-11-25	$532,500	1	1	1	6.0		LJ Hooker Canberra City	305-15-provan-street-campbell-act-2612
68913	House	2022-10-25	$549,000+	2022-11-23	$557,000	2	1	2	6.0		Stone Gungahlin	31-mcgovern-street-casey-act-2913
68915	House	2022-10-25	Online Auction - Current bid $1,450,000	2022-11-16	Undisclosed	4	2	6		2.14	PRD Wagga Wagga	3-laurel-road-lake-albert-nsw-2650
68916	House	2022-10-25	$900,000 - $990,000	2022-11-14	$1,130,000	3	2	1		506.0	My Agent Team	38b-heath-street-broulee-nsw-2537
68918	House	2022-10-13	AUCTION!!	2023-02-16	Undisclosed	4	2	4		1821.0	Raine & Horne Young	10-jasprizza-avenue-young-nsw-2594
68921	House	2022-10-25	Contact Agent	2023-01-23	Undisclosed	4	3	2		1062.0	Smile Elite	108-loralyn-avenue-st-georges-basin-nsw-2540
68922	House	2022-10-25	Auction guide $775,000	2022-11-23	$850,000	3	2	2		674.0	Ray White Bowral	18-winifred-crescent-mittagong-nsw-2575
68923	Land	2022-10-25	$480,000 - $500,000	2023-07-10	Undisclosed	0	0	0		546.0	New Door Properties	lot-1229-glenrock-drive-googong-nsw-2620
68925	House	2022-10-25	$1,100,000	2022-11-23	$1,100,000	4	2	1		577.0	Smile Elite	11-forest-way-mollymook-beach-nsw-2539
68930	House	2022-10-25	Contact Agent	2022-11-11	Undisclosed	6	3	4		4941.0	Smile Elite	14-magnolia-place-ewingsdale-nsw-2481
68938	House	2022-10-25	$920,000+	2022-10-21	$920,000	4	2	2	6.0		Stone Gungahlin	22-bandicoot-street-throsby-act-2914
68940	House	2022-10-25	$1,269,000+	2023-02-21	$1,275,000	5	4	7	0.5	1099.0	Impact Properties	10-thompson-place-monash-act-2904
68943	House	2022-10-26	$980,000+	2023-03-02	Undisclosed	3	2	2	0.0	1122.0	Ray White Canberra	1-arnot-place-monash-act-2904
68945	House	2022-10-26	Contact Agent	2022-11-17	Undisclosed	4	2	3	3.5	1095.0	Bastion Property Group	14-hirst-place-giralang-act-2617
68947	House	2022-10-26	Auction	2022-11-14	Undisclosed	4	2	2	4.0	679.0	Luton Gungahlin	5-oldershaw-court-nicholls-act-2913
68948	Townhouse	2022-10-26	By Negotiation	2023-01-20	Undisclosed	2	1	2	6.0		Luton Gungahlin	11-37-ainsworth-street-mawson-act-2607
68951	DuplexSemi-detached	2022-10-26	$625,000	2023-03-30	$575,000	3	2	2		544.0	McGrath Batemans Bay & Moruya	2-51-cook-avenue-surf-beach-nsw-2536
68954	House	2022-10-26	$579,000	2022-12-05	Undisclosed	3	2	2		445.5	PRD Wagga Wagga	11-watson-boulevard-lloyd-nsw-2650
68957	House	2022-10-26	$770,000	2023-03-02	Undisclosed	3	1	1	2.0	823.0	LJ Hooker Belconnen	7-bolliger-place-florey-act-2615
68962	Townhouse	2022-10-26	Auction	2022-11-12	$632,000	3	1	1	5.5	217.0	LJ Hooker Belconnen	220-kerrigan-street-dunlop-act-2615
68972	House	2022-10-26	$785,000 to $805,000	2023-01-26	Undisclosed	4	1	1		667.0	New Door Properties	8-doyle-place-karabar-nsw-2620
68977	Townhouse	2022-10-26	$799,000+	2023-02-24	Undisclosed	3	2	2	5.5		Luton Gungahlin	2-16-neil-harris-crescent-forde-act-2914
68981	Apartment	2022-10-26	Auction 10/11/2022	2022-11-10	$600,000	2	2	2	6.0		Ray White Canberra	37-28-beechworth-street-watson-act-2602
68984	Apartment	2022-10-26	$430,000+	2022-11-23	$440,000	1	1	1	6.0		LJ Hooker Canberra City	39-60-tishler-street-wright-act-2611
68989	House	2022-10-26	Auction 19/11/2022	2022-11-18	$1,450,000	4	3	2	6.0	500.0	MARQ Property	106-zanci-street-crace-act-2911
68990	House	2022-10-26	$799,000	2023-03-01	$790,000	3	2	3		1745.0	Dwyer Properties Sapphire Coast	17-bellbird-court-wolumla-nsw-2550
68992	Townhouse	2022-10-26	$715,000+	2023-02-22	Undisclosed	3	2	2	4.0		Luton Tuggeranong	18-38-ebenezer-street-bonython-act-2905
68996	House	2022-10-26	$399,000	2023-01-19	Undisclosed	3	1	1		588.9	Macarthur Real Estate Agency	14-crisp-drive-ashmont-nsw-2650
68998	Unit	2022-10-26	$510,000+	2022-11-09	Undisclosed	2	1	1	6.0	198.0	Luton Kippax	18-36-john-holt-street-macgregor-act-2615
69000	House	2022-10-26	$849,000	2023-06-02	Undisclosed	4	2	1		556.0	Whale Coast Realty	52-sunset-boulevard-kianga-nsw-2546
69015	Villa	2022-10-26	$635,000	2023-06-30	$625,000	2	1	2			Whale Coast Realty	2-8-tilba-street-narooma-nsw-2546
69016	Townhouse	2022-10-26	AUCTION	2022-11-09	$835,000	3	2	2	3.0	346.0	McIntyre Property	7-58-de-little-circuit-greenway-act-2900
69019	Alpine	2022-10-26	Auction	2022-11-15	$810,000	4	1	1		806.0	Henley Property - Jindabyne	22-lotus-avenue-kalkite-nsw-2627
69024	House	2022-10-26	AUCTION GUIDE $220,000	2022-11-01	Undisclosed	4	1	2		1034.0	Raine & Horne Goulburn	10-braidwood-rd-goulburn-nsw-2580
69025	House	2022-10-27	Auction: Saturday 12 November 11:15am	2022-11-12	$1,162,500	4	2	2	1.5	839.0	MARQ Property	30-hensman-street-latham-act-2615
69027	House	2022-10-27	Auction 16/11/22	2022-11-05	$830,000	3	2	2		595.0	Ian McNamee & Partners - Queanbeyan	55-rosewood-glen-jerrabomberra-nsw-2619
69029	Unit	2022-10-27	$339,000+	2022-11-09	$385,000	2	1	1	6.0		Michael Potter Real Estate	87-179-melrose-drive-woden-gardens-lyons-act-2606
69033	Townhouse	2022-10-27	$615,000	2022-12-07	Undisclosed	3	1	1	0.0	498.0	Luton Tuggeranong	21-18-burdett-crescent-theodore-act-2905
69035	House	2022-10-27	$959,000	2023-05-15	$959,000	3	2	2	1.5	820.0	Luton Dickson	3-darby-street-kaleen-act-2617
69036	House	2022-10-27	Auction	2022-11-08	Undisclosed	3	2	2	4.5		Luton Gungahlin	16-fidler-court-bruce-act-2617
69037	Apartment	2022-10-27	$599,000+	2022-11-28	Undisclosed	2	2	2	6.0		Badenoch Real Estate	72-15-bowman-street-macquarie-act-2614
69040	House	2022-10-27	Price Guide $2,900,000	2023-05-03	Undisclosed	4	2	7		18.42	Raine & Horne Southern Highlands	66-72-grevillea-place-colo-vale-nsw-2575
69042	Unit	2022-10-27	Price Guide $450,000	2022-11-16	$450,000	2	1	1			Dwyer Properties Sapphire Coast	9-59-main-street-merimbula-nsw-2548
69043	Land	2022-10-27	$435,000	2023-10-17	$435,000	0	0	0			Berkely Residential	94-oxalis-crescent-tralee-nsw-2620
69045	Livestock	2022-10-27	$2,075,000	2023-06-19	Undisclosed	5	4	4		105.0	Whale Coast Realty	244-stockridge-road-brogo-nsw-2550
69048	House	2022-10-27	$435,000	2023-03-20	$410,000	2	2	2		846.0	Ray White Goulburn	7-roslyn-street-crookwell-nsw-2583
69049	House	2022-10-27	$1,649,000	2023-06-27	Undisclosed	4	2	2	5.0		Luton Manuka	103-blamey-crescent-campbell-act-2612
69056	House	2022-10-27	$769,000	2023-01-20	Undisclosed	4	2	3		957.0	Macarthur Real Estate Agency	107-balmoral-crescent-lake-albert-nsw-2650
69060	Townhouse	2022-10-27	Auction 10/11/2022	2022-11-10	$550,000	2	1	2	5.0	67.0	Ray White Canberra	25-mcgovern-street-casey-act-2913
69064	House	2022-10-27	$710,000	2023-01-18	Undisclosed	3	1	1	0.0	0.0	Berkely Residential	1-cassidy-street-queanbeyan-nsw-2620
69066	House	2022-10-27	$1,100,000+	2023-02-13	$1,085,000	3	1	1	1.5	828.0	LJ Hooker Dickson	2-dutton-street-dickson-act-2602
69068	Townhouse	2022-10-27	$750,000	2023-02-06	Undisclosed	3	2	1			LJ Hooker Narooma	1-28-marine-drive-narooma-nsw-2546
69070	House	2022-10-27	$240,000	2023-03-29	Undisclosed	1	1	1		427.0	Raine & Horne Young	139-swift-street-harden-nsw-2587
69072	Townhouse	2022-10-27	Saturday 12th November, On  Site at 9:00am	2022-11-09	Undisclosed	3	2	2	2.0		LJ Hooker Manuka	19-3-hansen-circuit-isaacs-act-2607
69075	House	2022-10-27	$1,100,000+	2023-04-12	Undisclosed	4	2	4	5.0	468.0	Impact Properties	16-patrick-shaw-street-casey-act-2913
69077	House	2022-10-27	Auction	2023-03-11	Undisclosed	4	2	2	1.5	1124.0	Luton Tuggeranong	23-axon-street-monash-act-2904
69078	Apartment	2022-10-27	Auction 23/11/2022	2022-11-23	$626,000	2	2	1	6.0		LJ Hooker Dickson	71-8-dominion-circuit-forrest-act-2603
69082	House	2022-10-27	$949,000+	2023-06-09	$947,000	4	3	0	3.0	1047.0	Solely Properties	4-churchill-way-gordon-act-2906
69085	Apartment	2022-10-27	$485,000	2022-11-23	Undisclosed	2	1	1	5.0		Badenoch Real Estate	3-81-lachlan-street-macquarie-act-2614
69087	House	2022-10-27	$915,000	2022-12-07	Undisclosed	4	2	2	4.0	490.0	Luton Tuggeranong	41-gouldsmith-street-dunlop-act-2615
69089	House	2022-10-27	Auction 17/11/2022	2022-11-17	Undisclosed	3	2	1	0.5	1229.0	Ray White Canberra	41-osullivan-street-higgins-act-2615
69093	House	2022-10-27	$1,250,000+	2023-02-16	$1,200,000	4	2	0	1.5	0.0	Wright Dunn Real Estate	97-cowper-street-dickson-act-2602
69095	House	2022-10-27	$899,000+	2023-01-13	$900,000	4	2	3	0.5	755.0	LJ Hooker Kaleen	17-challinor-crescent-florey-act-2615
69105	House	2022-10-27	Auction 17/11/2022	2022-11-17	Undisclosed	3	2	2	5.0	578.0	Ray White Canberra	18-wunderly-circuit-macgregor-act-2615
69110	Apartment	2022-10-27	$579,000+	2022-12-07	Undisclosed	2	1	1	6.0		LJ Hooker Manuka	6-12-howitt-street-kingston-act-2604
69111	Lifestyle	2022-10-27	$1,075,000	2023-01-10	$1,050,000	4	2	12		16.88	Ray White Goulburn	3519-grabben-gullen-road-crookwell-nsw-2583
69112	House	2022-10-27	$1,450,000	2023-02-15	$1,450,000	3	1	1	2.0	641.0	home.by holly	40-raymond-street-ainslie-act-2602
69113	House	2022-10-27	Auction	2022-11-23	$840,000	3	1	3	4.0	672.9	LJ Hooker Woden/Weston	23-marlock-street-rivett-act-2611
69116	House	2022-10-27	By Negotiation	2023-01-18	$970,000	4	3	4	3.0	632.0	Impact Properties	18-galbraith-close-banks-act-2906
69118	House	2022-10-27	Auction 19/11/2022	2022-11-15	Undisclosed	5	2	2	4.0	746.0	Ray White Canberra	23-william-webb-drive-mckellar-act-2617
69127	Apartment	2022-10-27	Auction	2022-11-12	$440,000	2	1	1	2.0		LJ Hooker Belconnen	5-114-blamey-crescent-campbell-act-2612
69128	AcreageSemi-rural	2022-10-27	$1,325,000	2023-08-04	Undisclosed	4	2	2		2.14	Ben Bate Real Estate	217-old-highway-narooma-nsw-2546
69129	Apartment	2022-10-27	$350,000+	2023-03-23	$340,000	1	1	1	6.0		LJ Hooker Dickson	11-81-northbourne-avenue-turner-act-2612
69130	House	2022-10-27	$1,550,000+	2023-01-23	$1,540,000	4	2	0	0.0	816.9	LJ Hooker Dickson	186-duffy-street-ainslie-act-2602
69133	Apartment	2022-10-27	$649,000+	2022-12-05	Undisclosed	2	2	1	6.0		LJ Hooker Manuka	7-67-giles-street-kingston-act-2604
69134	Apartment	2022-10-27	$572,000	2022-12-08	$565,000	2	2	2	6.0		LJ Hooker Belconnen	2006-2-grazier-lane-belconnen-act-2617
69145	House	2022-10-28	$695,000	2022-10-28	$687,500	3	1	1		838.0	Ray White Goulburn	10-dewhirst-street-goulburn-nsw-2580
69148	House	2022-10-28	$1,290,000+	2023-03-03	Undisclosed	3	1	2	0.5	940.0	Ray White Canberra	2-bursaria-street-oconnor-act-2602
69151	House	2022-10-28	Expressions of interest	2022-11-07	Undisclosed	5	4	2	1.0	4031.0	Bastion Property Group	4-torres-street-red-hill-act-2603
69152	Apartment	2022-10-28	$399,000 - $429,000	2022-11-08	$415,000	2	1	1	4.5		McIntyre Property	28-68-hardwick-crescent-holt-act-2615
69157	Apartment	2022-10-28	By Negotation	2023-02-07	$2,500,000	3	2	2			Bella Coastal Property	1-1-golf-avenue-mollymook-nsw-2539
69158	House	2022-10-28	$895,000	2023-02-25	$885,000	4	2	2		719.0	LJ Hooker Sussex Inlet	21-iverison-road-sussex-inlet-nsw-2540
69160	Townhouse	2022-10-28	$580,000 - $600,000	2022-11-24	Undisclosed	2	1	1	2.0	236.0	McIntyre Property	4-23-bollard-street-palmerston-act-2913
69161	House	2022-10-28	$2,185,000	2022-11-28	Undisclosed	9	3	4	4.5	961.0	Luton Dickson	51-boldrewood-street-turner-act-2612
69163	Townhouse	2022-10-28	$729,000 - $750,000	2022-12-05	$735,000	3	2	2	6.0		McIntyre Property	2-24-bindaga-place-aranda-act-2614
69168	House	2022-10-28	Contact Agent	2022-11-10	Undisclosed	3	1	4		638.0	Smile Elite	6-de-chair-road-narraweena-nsw-2099
69169	Apartment	2022-10-28	Contact Agent	2023-01-05	Undisclosed	3	2	1			Smile Elite	18-8-10-fraser-street-westmead-nsw-2145
69172	Unit	2022-10-28	AUCTION - 18th November 2022	2022-11-18	$390,000	2	1	1		291.5	Ray White Goulburn	22-picker-street-crookwell-nsw-2583
69175	House	2022-10-28	1000000	2023-05-08	$1,000,000	5	3	4		925.0	Smile Elite	4-lorimer-street-llanarth-nsw-2795
69181	Apartment	2022-10-28	$750,000 - $780,000	2023-02-03	$749,000	2	2	2	6.0		McIntyre Property	710-2-batman-street-braddon-act-2612
69184	House	2022-10-28	Expressions of Interest	2022-11-14	$1,150,000	2	1	1		734.0	Bella Coastal Property	5-murramarang-road-bawley-point-nsw-2539
69187	House	2022-10-28	Under Offer	2022-11-23	$1,480,000	5	3	2	0.0	1249.0	LJ Hooker Dickson	46-rutledge-street-bungendore-nsw-2621
69194	House	2022-10-28	$1,640,000	2022-10-28	$1,630,000	5	3	2		7409.0	Raine & Horne Goulburn	25-ruse-street-goulburn-nsw-2580
69198	Land	2022-10-28	950000	2023-01-12	$950,000	0	0	0		528.0	Smile Elite	42-keystone-way-box-hill-nsw-2765
69199	Townhouse	2022-10-29	$825,000	2023-08-09	Undisclosed	3	2	2			Ben Bate Real Estate	3-10-12-marine-drive-narooma-nsw-2546
69201	House	2022-10-29	$780,000	2023-03-08	$780,000	3	1	1		632.0	Hallmark Real Estate Advisors	12-coila-avenue-tuross-head-nsw-2537
69209	House	2022-10-31	$380,000	2022-10-26	$380,000	3	1	1		847.3	Raine & Horne Young	6-watson-street-young-nsw-2594
69221	House	2022-10-31	Price undisclosed	2022-11-15	Undisclosed	5	2	2	5.0	543.0	Blackshaw Gungahlin	17-essie-coffey-street-bonner-act-2914
69224	House	2022-10-31	Auction 24/11/2022	2022-11-24	Undisclosed	4	2	2	2.0	993.0	Ray White Canberra	91-mckillop-circuit-kambah-act-2902
69225	Land	2022-10-31	$380,000 - $420,000	2023-02-03	$310,000	0	0	0		1347.0	LJ Hooker Batemans Bay	48-catalina-drive-catalina-nsw-2536
69226	Apartment	2022-10-31	Auction 24/11/2022	2022-11-24	Undisclosed	2	1	1	6.0		Ray White Canberra	95-116-easty-street-phillip-act-2606
69232	Land	2022-10-31	$509,900	2023-02-12	Undisclosed	0	0	0	0.0	443.0	Village	lot-908-alpine-ash-way-tralee-nsw-2620
69238	House	2022-10-31	$795,000	2023-03-31	$762,000	3	2	2		556.0	My Agent Team	9-parks-parade-tomakin-nsw-2537
69240	House	2022-10-31	$995,000 - $1,090,000	2023-02-27	Undisclosed	3	3	1		809.0	LJ Hooker Ulladulla	14-turner-street-mollymook-nsw-2539
69256	Apartment	2022-10-31	$240,000+	2023-01-31	$250,000	1	1	0	6.0		LJ Hooker Canberra City	109-2-akuna-street-city-act-2601
69260	House	2022-10-31	Price Guide: $2,000,000 - $2,100,000	2023-02-16	Undisclosed	4	3	7			McGoldrick Estate Agents	33-tartarian-crescent-bomaderry-nsw-2541
69264	House	2022-10-31	By Negotiation	2023-02-02	$1,015,000	3	1	0		1098.0	LJ Hooker Moruya	234-meringo-road-meringo-nsw-2537
69279	House	2022-10-31	$849,000	2023-03-17	$880,000	4	3	2		1286.0	Whale Coast Realty	14-emma-close-dalmeny-nsw-2546
69280	House	2022-10-31	$900,000 - $950,000	2022-12-07	Undisclosed	4	2	1		613.0	Sails Real Estate	41-culgoa-crescent-pambula-beach-nsw-2549
69286	Other	2022-11-01	Auction 26 November 9.45 am	2022-11-26	$1,420,000	4	3	2		4157.0	Ward Estate Agents	24-taylor-place-greenleigh-nsw-2620
69287	House	2022-11-01	Guide $2,300,00 to $2,500,000	2023-02-20	Undisclosed	4	3	5		2449.0	Ray White Bowral	44a-oxley-drive-mittagong-nsw-2575
69290	House	2022-11-01	$699,000	2022-12-08	$625,000	2	1	2		613.4	Ray White Batemans Bay	5-view-place-moruya-heads-nsw-2537
69291	House	2022-11-01	Auction	2022-11-14	$1,080,000	4	2	2	3.5	613.0	Luton Gungahlin	6-numiari-street-bonner-act-2914
69296	House	2022-11-01	$1,100,000-$1,200,000	2023-04-05	$1,100,000	4	2	2		554.0	LJ Hooker Canberra City	52-pannamena-crescent-jerrabomberra-nsw-2619
69299	House	2022-11-01	$1,225,000	2023-02-21	$1,100,000	3	1	2		4.9	Whale Coast Realty	490-punkalla-tilba-rd-central-tilba-nsw-2546
69306	House	2022-11-01	By Negotiation	2022-12-05	$430,000	2	1	1	6.0		New Door Properties	1011-2-gribble-street-gungahlin-act-2912
69311	House	2022-11-01	Auction 26 November @ 10.00am	2022-11-26	$1,200,000	2	1	1	0.5		Maloney's Property	26-winnecke-street-ainslie-act-2602
69312	House	2022-11-01	$395,000 - $415,000	2023-02-13	Undisclosed	2	1	0		1012.0	Ray White Wagga Wagga	7-eugene-avenue-san-isidore-nsw-2650
69314	Apartment	2022-11-01	Preview	2022-11-01	$295,000	1	1	0			Ray White Wagga Wagga	27-56-fitzmaurice-street-wagga-wagga-nsw-2650
69317	House	2022-11-01	$399,000	2023-01-16	Undisclosed	4	2	2		651.0	Macarthur Real Estate Agency	67-raye-street-tolland-nsw-2650
69319	House	2022-11-01	$992,500	2023-01-19	$992,500	3	1	3	0.0	588.0	home.by holly	17-percival-road-googong-nsw-2620
69322	Townhouse	2022-11-01	$607,000	2023-03-18	$607,000	3	1	1	2.5		home.by holly	10-59-pinkerton-circuit-kambah-act-2902
69327	Land	2022-11-02	Guide $580,000 - $620,000	2023-02-14	$607,500	0	0	0		750.0	Henley Property - Jindabyne	23-heysen-drive-east-jindabyne-nsw-2627
69340	Other	2022-11-02	$750,000 - 2023m2 Development Block	2023-08-09	Undisclosed	3	2	2		2023.0	Ray White Batemans Bay	15-queen-street-moruya-nsw-2537
69341	Apartment	2022-11-02	$480,000+	2022-11-11	$499,500	2	1	1	3.0		Luton Dickson	122-26-oliver-street-lyneham-act-2602
69342	House	2022-11-02	Buyers Guide $1,100,000	2022-12-06	$1,100,000	4	2	4		1169.0	Ray White Goulburn	15-angela-place-goulburn-nsw-2580
69356	Apartment	2022-11-02	$485,000	2023-01-24	$485,000	1	1	1	6.0	57.0	home.by holly	821-81-cooyong-street-reid-act-2612
69357	House	2022-11-02	Auction	2022-11-26	Undisclosed	4	2	4	4.0	768.0	LJ Hooker Dickson	45-marsden-street-dickson-act-2602
69359	House	2022-11-02	$880,000	2023-05-01	$880,000	4	2	2		822.0	Ray White Bungendore	57-modbury-street-bungendore-nsw-2621
69362	House	2022-11-02	$610,000	2022-11-02	$570,000	3	1	2		767.0	Raine & Horne Goulburn	17-college-street-goulburn-nsw-2580
69369	Apartment	2022-11-02	$505,000	2022-12-08	$505,000	2	2	1	6.0		MARQ Property	68-75-elizabeth-jolley-crescent-franklin-act-2913
69370	House	2022-11-02	$1,775,000	2023-06-01	Undisclosed	4	3	7		10.0	Luton Tuggeranong	524-micalago-road-michelago-nsw-2620
69372	Townhouse	2022-11-02	$880,000	2022-11-23	$880,000	3	2	2	5.0		home.by holly	58-215-aspinall-street-watson-act-2602
69384	House	2022-11-02	$1,550,000	2022-12-06	Undisclosed	4	2	2	4.5	1430.0	LJ Hooker Belconnen	31-marrakai-street-hawker-act-2614
69385	Land	2022-11-02	Contact Agent	2023-02-13	$505,000	0	0	0			Henley Property - Berridale	18-william-street-berridale-nsw-2628
69386	House	2022-11-02	$987,500	2022-11-26	$987,500	3	1	1	1.5		home.by holly	7-stow-place-watson-act-2602
69388	House	2022-11-02	Auction	2022-11-26	$1,525,000	5	3	1	1.5	1397.0	Luton Dickson	307-antill-street-watson-act-2602
69390	House	2022-11-02	contact agent	2023-02-20	Undisclosed	3	1	3	0.0		home.by holly	12-durack-street-downer-act-2602
69394	House	2022-11-02	$705,000	2022-12-05	$700,000	3	1	1	4.0	316.0	LJ Hooker Belconnen	2-bural-court-ngunnawal-act-2913
69396	Land	2022-11-02	$399,000	2023-11-01	$380,000	0	0	0		556.4	LJ Hooker Malua Bay	25-mulgowrie-street-malua-bay-nsw-2536
69401	Land	2022-11-02	$379,000	2023-03-01	$379,000	0	0	0		1066.0	Ray White Batemans Bay	2-millers-crescent-moruya-heads-nsw-2537
69405	AcreageSemi-rural	2022-11-02	$1,275,000	2022-11-02	Undisclosed	4	2	3		4.9	Whale Coast Realty	237-old-highway-narooma-nsw-2546
69407	MixedFarming	2022-11-02	$2,675,000	2023-04-12	Undisclosed	0	0	0		378.5	LAWD	sunny-slopes-warraderry-way-gooloogong-nsw-2805
69408	House	2022-11-02	$694,000	2023-02-06	$684,000	3	1	2		3996.0	Marshall and Tacheci Real Estate	2-6-moruya-street-quaama-nsw-2550
69409	House	2022-11-03	Auction	2022-11-10	Undisclosed	3	2	1	0.5	891.0	Luton Weston Creek & Molonglo Valley	18-drevermann-street-farrer-act-2607
69411	House	2022-11-03	Auction	2022-11-23	Undisclosed	3	2	2	6.0	727.0	Luton Weston Creek & Molonglo Valley	10-eungella-street-duffy-act-2611
69413	House	2022-11-03	Auction	2022-11-26	Undisclosed	4	2	2	0.5		Luton Manuka	2-hertz-place-chapman-act-2611
69416	Apartment	2022-11-03	Offers Above $350,000	2023-01-30	$350,000	1	1	1	6.0		Cream Residential	49-byron-court-phillip-act-2606
69418	Townhouse	2022-11-03	Auction Saturday 26/11/2022 10am On Site	2022-11-23	$875,000	3	2	2	3.0	0.0	Morrissey Property	1-29-anne-clark-avenue-nicholls-act-2913
69420	House	2022-11-03	$709,000	2022-12-09	$700,000	3	2	1	6.0	193.5	Ray White Canberra	62-cocoparra-crescent-crace-act-2911
69423	House	2022-11-03	Auction	2022-11-05	Undisclosed	3	3	3	4.0		Blackshaw Manuka	82-dawes-street-kingston-act-2604
69424	House	2022-11-03	Auction: Saturday 26 November, on site at 10:00am	2022-11-26	Undisclosed	4	3	3	5.0	726.0	LJ Hooker Manuka	27-carrington-street-deakin-act-2600
69429	House	2022-11-03	$1,240,000	2023-01-25	$1,240,000	5	2	2	4.5		home.by holly	34-negus-crescent-watson-act-2602
69431	House	2022-11-03	Auction	2022-11-26	$680,000	3	1	1	4.0	351.0	Luton Belconnen	18-guginya-crescent-ngunnawal-act-2913
69435	House	2022-11-03	$799,000 - $829,000	2023-03-07	Undisclosed	5	2	1	2.0		LJ Hooker Manuka	5-geach-place-chisholm-act-2905
69437	House	2022-11-03	Auction	2022-11-24	Undisclosed	5	2	2	1.0	910.0	LJ Hooker Belconnen	7-mcgowan-street-dickson-act-2602
69439	House	2022-11-03	contact agent	2023-02-03	Undisclosed	4	2	2	2.0		home.by holly	1-cawthorn-crescent-evatt-act-2617
69441	House	2022-11-03	Auction	2022-11-26	Undisclosed	4	2	2	5.0	598.0	Luton Gungahlin	41-hyslop-crescent-casey-act-2913
69445	House	2022-11-03	Offers over $720,000	2023-01-25	Undisclosed	3	1	1	4.0	452.0	McIntyre Property	2-lockhart-place-amaroo-act-2914
69448	House	2022-11-03	$700,000 - $750,000	2023-03-21	$705,000	3	2	2		588.0	Sails Real Estate	280a-pacific-way-tura-beach-nsw-2548
69456	House	2022-11-03	By Negotiation	2023-01-11	$897,500	3	2	2	6.0	487.0	LJ Hooker Gungahlin	75-anna-morgan-circuit-bonner-act-2914
69462	Studio	2022-11-03	Offers Above $219,000	2022-11-18	Undisclosed	1	1	0	2.5		Cream Residential	11-27-coxen-street-hughes-act-2605
69466	Villa	2022-11-03	$569,000	2022-11-17	Undisclosed	2	2	2	5.0		Badenoch Real Estate	30-1-beissel-street-belconnen-act-2617
69469	Land	2022-11-03	$240,000 - $260,000	2023-02-09	$230,000	0	0	0		944.0	Henley Property - Cooma	8-campsite-place-cooma-nsw-2630
69471	House	2022-11-03	$1,300,000+	2023-02-21	Undisclosed	4	4	2	5.0	615.0	LJ Hooker Kaleen	38-dargin-crescent-moncrieff-act-2914
69475	Townhouse	2022-11-03	Auction	2022-11-23	$750,000	3	3	2	5.0		LJ Hooker Kaleen	64-2-rouseabout-street-lawson-act-2617
69477	Land	2022-11-03	$550,000	2023-08-23	$520,000	0	0	0		646.0	LJ Hooker Kaleen	18-alpine-ash-way-tralee-nsw-2620
69479	House	2022-11-03	Contact Agent	2022-11-24	Undisclosed	3	2	3	3.0	725.0	My Morris	7-serpentine-street-duffy-act-2611
69480	House	2022-11-03	$750,000	2023-02-07	$650,000	3	1	0		1075.0	LJ Hooker Moruya	6-emmott-street-moruya-nsw-2537
69482	House	2022-11-03	$1,700,000	2023-03-03	$1,700,000	4	2	2	2.0	780.0	home.by holly	12-duffy-street-ainslie-act-2602
69496	House	2022-11-03	Contact Agent	2023-02-04	Undisclosed	4	2	2	1.5	898.0	Ray White Canberra	4-jagara-street-aranda-act-2614
69499	House	2022-11-03	Auction	2022-11-26	$1,260,000	4	2	3	4.5	780.0	LJ Hooker Woden/Weston	9-scottsdale-street-lyons-act-2606
69505	House	2022-11-03	$1,050,000	2023-05-15	$1,080,000	4	3	3	3.5	791.0	LJ Hooker Woden/Weston	39-mcinnes-street-weston-act-2611
69507	House	2022-11-03	Auction 26/11/2022	2022-11-26	Undisclosed	4	2	1	2.5	634.0	Ray White Canberra	17-jarrah-street-oconnor-act-2602
69509	Townhouse	2022-11-03	Contact Agent	2022-12-09	$572,000	2	1	2			LJ Hooker Queanbeyan  Jerrabomberra  Googong	13-3-gerald-street-queanbeyan-nsw-2620
69510	Townhouse	2022-11-03	$1,075,000	2023-01-31	$1,100,000	3	2	2	8.0		LJ Hooker Canberra City	8-11-moncrieff-street-dickson-act-2602
69512	House	2022-11-03	$1,165,000	2022-11-25	$1,165,000	4	2	2		928.0	Smile Elite	6-vantage-place-thornleigh-nsw-2120
69513	Apartment	2022-11-03	$690,000 - $710,000	2023-05-23	Undisclosed	3	2	2		158.0	Smile Elite	c109-5-demeter-street-rouse-hill-nsw-2155
69524	House	2022-11-03	$779,000 New Price	2023-05-26	Undisclosed	4	2	2		701.0	Ray White Goulburn	26-walsh-drive-goulburn-nsw-2580
69529	House	2022-11-03	UPDATED Price Guide $1,195,000 - $1,245,000	2023-02-17	$1,210,000	4	2	2		664.0	Raine & Horne Southern Highlands	67-darraby-drive-moss-vale-nsw-2577
69532	House	2022-11-03	$600,000	2023-02-17	Undisclosed	7	2	1		749.0	Smile Elite	9-northview-circuit-muswellbrook-nsw-2333
69533	Unit	2022-11-03	$440,000 - $470,000	2022-11-17	Undisclosed	2	1	1	0.0	555.0	Upside	2-1-matthew-parade-batehaven-nsw-2536
69534	Apartment	2022-11-03	$245,000	2023-04-06	Undisclosed	1	1	1	6.0		Badenoch Real Estate	56-84-northbourne-avenue-braddon-act-2612
69535	House	2022-11-03	Guide $1,530,000 - $1,595,000	2023-01-13	Undisclosed	3	1	2		2498.0	Ray White Bowral	10-north-street-moss-vale-nsw-2577
69537	House	2022-11-03	Auction 26/11/2022	2022-11-26	Undisclosed	3	2	2	4.0	826.0	Ray White Canberra	6-slessor-crescent-mckellar-act-2617
69538	Apartment	2022-11-04	Auction	2022-11-24	Undisclosed	2	2	2	6.0		Luton Weston Creek & Molonglo Valley	609-21-marcus-clarke-street-city-act-2601
69545	Townhouse	2022-11-04	$635,000+	2023-01-10	$650,000	3	2	1	3.5	190.0	LJ Hooker Kippax	20-11-flack-street-holt-act-2615
69547	House	2022-11-04	$670,000+	2022-11-23	$702,000	3	1	2	0.5	795.0	LJ Hooker Kippax	45-bingle-street-flynn-act-2615
69549	House	2022-11-04	Reasonable Offers Considered	2023-01-16	$927,000	4	3	1			My Agent Team	24b-mulgowrie-street-malua-bay-nsw-2536
69550	Apartment	2022-11-04	Under Offer	2023-01-18	Undisclosed	1	1	1	6.0	1868.4	Ray White Canberra	1-50-moore-street-turner-act-2612
69551	House	2022-11-04	Auction 26/11/2022	2022-11-26	Undisclosed	4	2	1	3.5	834.76	Ray White Canberra	179-majura-avenue-dickson-act-2602
69556	Apartment	2022-11-04	Auction 24/11/2022	2022-11-23	Undisclosed	2	2	2	6.0		Ray White Canberra	207-21-state-circle-forrest-act-2603
69557	House	2022-11-04	$1,450,000	2023-01-10	Undisclosed	5	3	2	0.0	758.0	Ray White Canberra	69-scrivener-street-oconnor-act-2602
69558	Livestock	2022-11-04	Contact Agent	2022-12-07	$1,680,000	0	0	0		230.0	LJ Hooker Queanbeyan  Jerrabomberra  Googong	58-black-flat-road-burra-nsw-2620
69563	Unit	2022-11-04	Contact Agent	2022-11-03	$185,000	1	1	1			LJ Hooker Queanbeyan  Jerrabomberra  Googong	4-22-carrington-street-queanbeyan-east-nsw-2620
69564	Townhouse	2022-11-04	Auction Sat, 26th Nov at 1pm	2022-11-26	$925,000	3	2	2	5.0	0.0	LJ Hooker Gungahlin	64-121-thynne-street-bruce-act-2617
69565	House	2022-11-04	$820,000	2023-02-10	$820,000	4	2	1		640.0	Smile Elite	70-browns-road-south-nowra-nsw-2541
69566	House	2022-11-04	Price on Application	2022-11-02	Undisclosed	3	1	2		1012.0	Raine & Horne Young	56-east-street-grenfell-nsw-2810
69570	House	2022-11-04	Auction	2022-11-24	Undisclosed	4	2	2	5.5		Badenoch Real Estate	26-bromham-street-forde-act-2914
69573	Other	2022-11-04	$155,000	2023-02-06	$155,000	2	1	0			Bella Coastal Property	site-g6-381-murramarang-road-bawley-point-nsw-2539
69589	House	2022-11-04	$570,000 - $590,000	2024-02-29	$547,500	2	1	1		607.0	LJ Hooker Batemans Bay	79-ridge-street-batemans-bay-nsw-2536
69591	House	2022-11-04	Auction 26/11/2022	2022-11-23	Undisclosed	3	2	1	2.0	1358.0	Ray White Canberra	78-david-street-turner-act-2612
69599	AcreageSemi-rural	2022-11-04	AUCTION or SALE PRIOR	2023-05-04	Undisclosed	4	2	2		17.5	Raine & Horne Young	100-rifle-range-road-burrangong-nsw-2594
69605	Apartment	2022-11-04	$399,000+	2023-04-12	$412,000	1	1	1	6.0	26.0	LJ Hooker Dickson	3-10-ipima-street-braddon-act-2612
69621	House	2022-11-05	$730,000 - $770,000	2023-01-19	$740,000	4	2	2		690.0	One Agency Wagga Wagga	24-chang-avenue-lloyd-nsw-2650
69623	House	2022-11-05	AUCTION Dec 6th	2022-12-07	Undisclosed	5	5	4		48.05	Raine & Horne Southern Highlands	741-wattamolla-road-kangaroo-valley-nsw-2577
69624	House	2022-11-05	Under Contract	2023-01-23	Undisclosed	3	2	2		613.0	Ben Bate Real Estate	21-binalong-street-dalmeny-nsw-2546
69628	Townhouse	2022-11-07	$579,000	2023-02-27	$565,000	2	1	1			McCann Properties	12-14-short-street-yass-nsw-2582
69634	Other	2022-11-07	AUCTION	2023-02-10	$580,000	0	0	0		23.7	Ray White Goulburn	515-pejar-road-crookwell-nsw-2583
69641	House	2022-11-07	Expressions of Interest	2023-05-26	$1,950,000	4	3	2		5213.0	Ray White Batemans Bay	133-vista-avenue-catalina-nsw-2536
69643	House	2022-11-07	$1,185,000	2022-12-05	$1,185,000	4	2	2		480.0	Smile Elite	119-dongola-circuit-schofields-nsw-2762
69688	Apartment	2022-11-07	$475,000	2023-02-01	$475,000	1	1	1	6.0		home.by holly	171-15-coranderrk-street-city-act-2601
69691	AcreageSemi-rural	2022-11-07	Contact Agent	2023-03-21	Undisclosed	5	3	8		28.0	Smile Elite	172-daintree-drive-albion-park-nsw-2527
69692	House	2022-11-08	$1,200,000 - $1,250,000	2022-12-05	Undisclosed	5	3	3		931.0	One Agency Wagga Wagga	6-florey-street-lloyd-nsw-2650
69694	House	2022-11-08	Preview	2022-11-24	Undisclosed	4	2	5		2023.0	Ray White Wagga Wagga	10-mirrool-street-south-coolamon-nsw-2701
69696	House	2022-11-08	$775,000	2022-11-15	$750,000	3	2	2		850.0	LJ Hooker Malua Bay	17-yarrabee-drive-catalina-nsw-2536
69701	Unit	2022-11-08	$525,000	2023-06-08	$504,000	2	2	1	6.0		Luton Gungahlin	7-2-hinder-street-gungahlin-act-2912
69703	House	2022-11-08	$1,785,000	2023-01-20	$1,700,000	4	2	10		7577.0	LJ Hooker Malua Bay	2-the-inlet-mossy-point-nsw-2537
69708	House	2022-11-08	$1,395,000	2023-12-08	$1,390,000	4	2	2		766.0	Dwyer Properties Sapphire Coast	198-mirador-drive-mirador-nsw-2548
69709	House	2022-11-08	SOLD OFF MARKET	2022-11-08	$1,280,000	4	2	3	3.0	770.2	LJ Hooker Woden/Weston	19-reveley-crescent-stirling-act-2611
69713	House	2022-11-08	$629,000	2023-01-18	Undisclosed	3	1	1		562.8	First National Real Estate Batemans Bay	83-bavarde-avenue-batemans-bay-nsw-2536
69716	House	2022-11-08	$849,000+	2023-05-02	Undisclosed	3	2	1	0.5		Ray White Canberra	7-lorne-place-palmerston-act-2913
69718	House	2022-11-08	$550,000	2023-02-28	$525,000	2	1	2		792.0	Belle Property Braidwood	23-coronation-avenue-braidwood-nsw-2622
69722	House	2022-11-08	Auction	2022-11-17	$660,000	3	1	1	6.0	226.0	LJ Hooker Belconnen	24-audrey-cahn-street-macgregor-act-2615
69726	House	2022-11-08	$900,000	2023-02-13	$900,000	3	2	1		791.0	Clearwater Real Estate Narooma	28-warbler-cres-north-narooma-nsw-2546
69730	House	2022-11-08	$790,000 - $840,000	2022-12-09	$780,000	4	3	3		847.0	My Agent Team	62-northcove-road-long-beach-nsw-2536
69731	House	2022-11-08	$750,000	2023-03-09	$690,000	4	2	2		1082.0	Ray White Batemans Bay	91-hawdon-street-moruya-nsw-2537
69733	House	2022-11-08	$529,000	2023-01-20	Undisclosed	3	1	1		757.0	One Agency Craig Schofield	6-woolalla-street-cooma-nsw-2630
69734	House	2022-11-08	$999,000	2023-02-03	$955,000	4	2	2		628.0	Ray White Queanbeyan | Jerrabomberra	12-alder-close-jerrabomberra-nsw-2619
69747	Lifestyle	2022-11-08	$820,000	2022-11-08	$720,000	4	1	1		40.2	Raine & Horne Young	280-elliotts-road-crowther-nsw-2803
69750	Townhouse	2022-11-08	$749,000+	2023-03-14	$715,000	3	2	1	3.0		Confidence Real Estate	20-28-ringrose-crescent-isaacs-act-2607
69754	Land	2022-11-08	$235,000	2023-10-03	Undisclosed	0	0	0		654.0	Macarthur Real Estate Agency	lot-124-flintwood-street-forest-hill-nsw-2651
69756	Land	2022-11-08	$219,000	2023-10-12	Undisclosed	0	0	0		850.0	Macarthur Real Estate Agency	lot-106-flintwood-street-forest-hill-nsw-2651
69758	Land	2022-11-08	$249,000	2023-06-28	Undisclosed	0	0	0		661.0	Macarthur Real Estate Agency	lot-150-cnr-lacebark-drive-marri-place-forest-hill-nsw-2651
69762	Land	2022-11-08	$249,000	2023-06-30	Undisclosed	0	0	0		661.0	Macarthur Real Estate Agency	lot-149-cnr-lacebark-drive-marri-place-forest-hill-nsw-2651
69763	Land	2022-11-08	$239,000	2023-10-16	Undisclosed	0	0	0		664.0	Macarthur Real Estate Agency	lot-121-flintwood-street-forest-hill-nsw-2651
69770	Unit	2022-11-08	$735,000	2022-12-05	Undisclosed	2	1	1			Whale Coast Realty	2-4-warbler-crescent-north-narooma-nsw-2546
69772	Land	2022-11-08	$15,000	2023-02-02	$15,000	0	0	0		2022.0	Kitson Property	5-rathdown-street-milbrulong-nsw-2656
69779	Townhouse	2022-11-09	Auction	2022-11-26	$790,000	3	2	2	3.5		LJ Hooker Belconnen	2-35-lochbuy-street-macquarie-act-2614
69786	House	2022-11-09	$660,000	2022-11-28	$660,000	3	1	0		463.0	Smile Elite	29-rankin-street-bathurst-nsw-2795
69788	House	2022-11-09	Preview	2022-11-29	Undisclosed	4	2	2		657.0	Ray White Wagga Wagga	38-grove-street-kooringal-nsw-2650
69789	Townhouse	2022-11-09	By Negotiation	2023-02-17	$762,500	3	2	2	6.0	0.0	IQ Real Estate	22-33-braybrooke-street-bruce-act-2617
69792	House	2022-11-09	$779,000	2023-02-16	Undisclosed	3	1	2	1.5	809.0	Luton Tuggeranong	14-baynton-street-richardson-act-2905
69793	House	2022-11-09	$439,000	2023-03-28	Undisclosed	2	1	1		173.0	Macarthur Real Estate Agency	7-1-small-street-wagga-wagga-nsw-2650
69796	Townhouse	2022-11-09	$790,000	2022-12-07	Undisclosed	3	2	2	6.0	174.0	Bastion Property Group	2-8-courtney-street-googong-nsw-2620
69798	House	2022-11-09	$1,150,000-$1,250,000	2023-03-03	$1,175,000	4	2	2	6.0	516.0	Stone Gungahlin	4-coomera-street-harrison-act-2914
69815	House	2022-11-09	$1,500,000 - $1,600,000	2023-01-27	$1,350,000	4	2	2		1760.0	Ray White Batemans Bay	10-blaxland-crescent-sunshine-bay-nsw-2536
69817	Townhouse	2022-11-09	Contact Agent	2023-02-15	Undisclosed	2	1	3			Smile Elite	1-4-drinnan-close-surf-beach-nsw-2536
69824	Townhouse	2022-11-09	Auction Wed, 7th of Dec at 6:00pm	2022-12-07	$600,000	2	2	2	6.0	0.0	LJ Hooker Gungahlin	12-3-trist-street-franklin-act-2913
69832	DuplexSemi-detached	2022-11-09	660,000+	2023-01-27	$670,000	3	1	1	4.5		LJ Hooker Canberra City	4-dagmar-berne-street-macgregor-act-2615
69835	Townhouse	2022-11-09	$776,000	2022-11-29	$776,000	2	2	2	6.0		home.by holly	3-45-stockdale-street-dickson-act-2602
69838	Land	2022-11-09	Contact Agent	2023-01-20	Undisclosed	0	0	0		2089.0	Smile Elite	38-ibis-place-scone-nsw-2337
69839	House	2022-11-09	Offers Over $770,000+	2023-02-01	Undisclosed	3	1	2	1.0	1170.0	Luton Tuggeranong	6-hardie-close-macarthur-act-2904
69842	Townhouse	2022-11-09	$599,000+	2023-02-24	Undisclosed	2	2	2	5.5	0.0	LJ Hooker Gungahlin	24-dalkin-crescent-casey-act-2913
69854	House	2022-11-09	$385,000	2023-01-24	$367,000	3	1	2		840.0	John Mooney Real Estate	158-ashmont-avenue-ashmont-nsw-2650
69856	House	2022-11-09	$789,000	2022-12-07	$789,000	3	2	1		746.0	Hallmark Real Estate Advisors	42-hector-mcwilliam-drive-tuross-head-nsw-2537
69859	Unit	2022-11-09	$359,000	2023-01-09	$351,000	2	1	1			Ray White Goulburn	5-8-cowper-street-goulburn-nsw-2580
69860	Apartment	2022-11-09	$375,000	2022-11-09	$375,000	1	1	1	6.0		Impact Properties	374-1-anthony-rolfe-avenue-gungahlin-act-2912
69863	Unit	2022-11-09	Under Contract	2023-01-09	Undisclosed	1	1	1			Ben Bate Real Estate	36-147-princes-highway-narooma-nsw-2546
69872	Townhouse	2022-11-09	Offers over $549,000	2023-01-16	$566,500	2	2	1	6.0		Independent Gungahlin	3-141-mapleton-avenue-harrison-act-2914
69875	House	2022-11-09	Auction	2022-11-28	$835,000	4	2	0		801.0	Henley Property - Jindabyne	12-lotus-avenue-kalkite-nsw-2627
69878	House	2022-11-09	By Negotiation	2022-11-11	Undisclosed	4	2	3	2.5		Berkely Residential	18-monaro-crescent-red-hill-act-2603
69884	House	2022-11-10	$1,150,000	2023-01-25	Undisclosed	4	2	2		727.0	Luton Tuggeranong	2-binaburra-place-karabar-nsw-2620
69894	Apartment	2022-11-10	$619,000+	2023-04-24	$605,000	2	1	1	3.5		LJ Hooker Manuka	109-10-currie-crescent-griffith-act-2603
69895	House	2022-11-10	$725,000+	2023-02-20	$725,000	3	2	2	0.5	703.0	LJ Hooker Kippax	8-foley-place-holt-act-2615
69896	Apartment	2022-11-10	$695,000+	2022-12-05	$720,000	2	2	2	6.0		LJ Hooker Canberra City	232-2-anzac-park-campbell-act-2612
69898	Townhouse	2022-11-10	$1,050,000	2023-01-11	$1,050,000	3	2	2	4.0		home.by holly	71-395-antill-street-watson-act-2602
69903	House	2022-11-10	$480,000	2023-11-13	$460,000	4	1	2		1208.0	Ray White Canberra	35-cromwell-street-cooma-nsw-2630
69906	Apartment	2022-11-10	$360,000+	2022-11-28	Undisclosed	1	1	1	6.0		Ray White Canberra	80-35-oakden-street-greenway-act-2900
69918	Townhouse	2022-11-10	$650,000+	2023-01-23	$670,000	3	2	1	6.0	9831.0	LJ Hooker Gungahlin	13-562a-cotter-road-coombs-act-2611
69925	Apartment	2022-11-10	$599,000+	2022-12-06	Undisclosed	2	2	1	6.0		Badenoch Real Estate	8a-21-beissel-street-belconnen-act-2617
69931	Unit	2022-11-10	$459,000	2023-02-23	Undisclosed	2	1	1	3.5		My Morris	34-181-mcbryde-crescent-wanniassa-act-2903
69932	House	2022-11-10	$774,000	2023-03-31	$750,000	2	1	4		1169.0	Marshall and Tacheci Real Estate	38-bunga-street-bermagui-nsw-2546
69934	Townhouse	2022-11-10	$630,000	2022-11-09	$630,000	2	2	2	6.0		Stone Gungahlin	1-5-keith-waller-street-casey-act-2913
69941	House	2022-11-10	$545,000	2023-02-20	$530,000	2	1	1		3239.0	Ray White Batemans Bay	11-230-beach-road-batehaven-nsw-2536
69942	House	2022-11-10	$685,000	2022-12-06	$685,000	3	1	2	3.5		home.by holly	1b-brigden-crescent-theodore-act-2905
69944	House	2022-11-10	$1,595,000	2023-02-03	Undisclosed	4	3	4	5.5	489.0	Luton Manuka	17-mari-funaki-street-whitlam-act-2611
69945	House	2022-11-10	By Negotiation	2022-12-07	Undisclosed	4	2	3	4.0	1288.0	Ray White Canberra	83-erldunda-circuit-hawker-act-2614
69954	House	2022-11-10	By Negotiation	2023-01-25	Undisclosed	3	2	1	4.5	811.0	Ray White Canberra	55-wilshire-street-dickson-act-2602
69956	Townhouse	2022-11-10	$790,000	2023-01-11	Undisclosed	3	2	2	4.0		Luton Weston Creek & Molonglo Valley	11-9-tristania-street-rivett-act-2611
69958	Unit	2022-11-10	Price Guide $560,000	2022-12-09	$560,000	2	1	1			Dwyer Properties Sapphire Coast	13-1b-golf-circuit-tura-beach-nsw-2548
69959	House	2022-11-10	$799,000 - $849,000	2023-04-13	$805,000	4	2	2		961.0	Ray White Batemans Bay	20-craig-mostyn-place-moruya-nsw-2537
69971	House	2022-11-10	Auction 27/11/2022	2022-11-18	Undisclosed	4	2	1	1.0	825.0	Ray White Canberra	39-alroy-circuit-hawker-act-2614
69981	House	2022-11-10	$765,000 +	2023-01-24	$750,000	3	1	2	2.0	628.0	LJ Hooker Woden/Weston	7-bussau-close-wanniassa-act-2903
69989	Land	2022-11-10	$69,000	2023-04-26	$69,000	0	0	0		2024.0	Kitson Property	66-68-reid-street-lockhart-nsw-2656
69992	House	2022-11-10	$684,000	2023-02-10	$670,000	4	2	2		594.7	Kitson Property	1-bonner-street-lloyd-nsw-2650
69995	House	2022-11-10	$1,049,000 +	2023-02-03	Undisclosed	4	2	2	4.5	552.0	Edge - Luanne Stapleton	28b-lutana-street-lyons-act-2606
69996	House	2022-11-11	PREVIEW	2022-12-07	$860,000	5	2	4		1851.0	One Agency Wagga Wagga	2-banner-street-forest-hill-nsw-2651
70007	Lifestyle	2022-11-11	Price $1,000,000 - $1,100,000	2023-02-23	$1,000,000	4	2	2		42.32	Ray White Goulburn	1721-rhyanna-road-goulburn-nsw-2580
70009	DuplexSemi-detached	2022-11-11	980,000+	2023-09-06	$980,000	3	2	1	2.5	0.0	Wright Dunn Real Estate	48-morphett-street-dickson-act-2602
70014	Apartment	2022-11-11	$679,000	2023-01-11	$670,000	3	3	1			Sails Real Estate	23-1-5-ocean-view-avenue-merimbula-nsw-2548
70023	House	2022-11-11	$1,000,000+	2023-01-30	Undisclosed	4	2	2	0.5	761.0	Bertram Ellis	1-folingsby-street-weston-act-2611
70025	House	2022-11-11	$1,135,000	2022-11-09	$1,135,000	4	2	2		1010.0	Ray White Bungendore	4-chinnery-close-bungendore-nsw-2621
70031	Townhouse	2022-11-11	Auction	2022-12-07	$625,000	2	2	1	1.0		LJ Hooker Dickson	13-2-sexton-street-cook-act-2614
70035	House	2022-11-11	Auction	2022-11-25	Undisclosed	4	2	2	4.5		Badenoch Real Estate	8-howmans-street-harrison-act-2914
70038	House	2022-11-11	$770,000 - $790,000	2023-05-10	$775,000	4	2	2		660.0	Raine & Horne Goulburn	3-heath-street-goulburn-nsw-2580
70040	House	2022-11-11	$558,000	2022-12-08	$558,000	6	2	5		744.0	Smile Elite	4-millard-close-muswellbrook-nsw-2333
70042	Unit	2022-11-11	AUCTION	2022-12-09	Undisclosed	2	1	1			Elders Real Estate Batemans Bay	203-202-208-beach-road-batehaven-nsw-2536
70043	House	2022-11-11	$960,000	2022-11-24	$960,000	5	2	6		1170.0	LJ Hooker Moruya	16-keightley-street-moruya-nsw-2537
70045	House	2022-11-11	$699,000	2022-12-06	$662,000	3	1	1		2175.15	Ray White Batemans Bay	7-10-newth-place-surf-beach-nsw-2536
70059	House	2022-11-11	$599,000	2023-01-16	Undisclosed	3	2	2			Macarthur Real Estate Agency	4-hollows-crescent-lloyd-nsw-2650
70072	Apartment	2022-11-11	$549,500	2023-04-28	$549,500	2	2	2	6.8	0.0	POD Projects Group	13-2-bamblett-rise-denman-prospect-act-2611
70076	Lifestyle	2022-11-11	Contact Agent	2022-11-11	Undisclosed	6	4	4		10.16	McGoldrick Estate Agents	500-woodhill-mountain-road-berry-nsw-2535
70078	Land	2022-11-11	890000	2023-05-12	$890,000	0	0	0		828.7	Smile Elite	67-dongola-circuit-schofields-nsw-2762
70079	Townhouse	2022-11-11	885000	2023-01-30	$885,000	4	2	1			Smile Elite	53-sciberras-avenue-schofields-nsw-2762
70082	House	2022-11-12	$625,000	2023-02-03	Undisclosed	2	2	2		619.0	Ben Bate Real Estate	7-hillside-crescent-kianga-nsw-2546
70084	Lifestyle	2022-11-12	$495,000	2023-03-31	$480,000	0	0	0		97.12	Raine & Horne Goulburn	500-tallygang-mountain-road-wombeyan-caves-nsw-2580
70089	House	2022-11-14	Auction	2022-11-11	$520,000	3	1	1		490.0	Ray White Goulburn	28-colyer-street-crookwell-nsw-2583
70093	AcreageSemi-rural	2022-11-14	$1,150,000	2023-07-27	$1,100,000	4	2	2		3.52	LJ Hooker Moruya	309-pollwombra-road-moruya-nsw-2537
70101	House	2022-11-14	AUCTION Guide $680,000	2023-03-03	$690,000	3	1	0		602.0	Ray White Goulburn	252-cowper-street-goulburn-nsw-2580
70110	House	2022-11-14	$530,000 - $550,000	2022-12-08	Undisclosed	3	1	2		627.0	Ray White Wagga Wagga	17-malumba-crescent-kooringal-nsw-2650
70116	Apartment	2022-11-14	$2,100,000+	2023-01-30	Undisclosed	3	3	2	5.0		LJ Hooker Canberra City	81-44-constitution-avenue-campbell-act-2612
70119	Land	2022-11-14	$385,000 New Price	2023-05-03	$348,000	0	0	0		1103.0	Ray White Goulburn	72-hoskins-street-goulburn-nsw-2580
70134	House	2022-11-14	$1,550,000 - $1,650,000	2023-01-23	$1,550,000	5	2	2		4040.0	Ray White Bowral	1642-kangaloon-road-kangaloon-nsw-2576
70139	House	2022-11-14	Offers Invited	2023-02-12	Undisclosed	3	2	1		992.74	LJ Hooker Sussex Inlet	45-dacres-street-vincentia-nsw-2540
70142	House	2022-11-14	$585,000	2023-01-16	Undisclosed	3	2	2		525.0	Macarthur Real Estate Agency	1-8-kellerman-crescent-boorooma-nsw-2650
70162	House	2022-11-14	$799,000	2023-05-03	Undisclosed	4	2	2		701.0	PRD Wagga Wagga	70-coppabella-drive-gobbagombalin-nsw-2650
70190	Townhouse	2022-11-15	$650,000	2023-01-20	Undisclosed	3	2	2			Ray White Queanbeyan | Jerrabomberra	12-41-carinya-street-queanbeyan-nsw-2620
70198	House	2022-11-15	Auction: 10th December 12:30pm on site	2022-12-09	Undisclosed	3	1	1		1707.0	Raine & Horne Southern Highlands	21-sierra-street-yerrinbool-nsw-2575
70209	Apartment	2022-11-15	$419,000	2023-02-03	Undisclosed	1	1	1	6.0		Ray White Canberra	12-38-40-torrens-street-braddon-act-2612
70218	Apartment	2022-11-15	Guide $365,000-$400,000	2022-11-29	$405,000	1	1	1			Henley Property - Jindabyne	1-24-clyde-street-jindabyne-nsw-2627
70221	House	2022-11-15	$770,000+	2022-12-08	Undisclosed	4	2	0	3.0	795.0	McIntyre Property	76-fullerton-crescent-richardson-act-2905
70225	House	2022-11-15	$940,000 - $990,000	2022-12-06	$955,000	3	2	1		885.0	My Agent Team	14-denise-drive-lilli-pilli-nsw-2536
70239	House	2022-11-15	Auction	2022-12-10	$785,000	3	1	2	1.0	907.0	Luton Gungahlin	1-swift-place-macgregor-act-2615
70256	Townhouse	2022-11-16	$649,000+	2023-03-28	$639,000	3	1	2	2.5	426.0	Impact Properties	9-48-sid-barnes-crescent-gordon-act-2906
70261	Apartment	2022-11-16	$849,000+	2022-11-24	$840,000	2	2	2	6.0		PURNELL	4-7-light-street-griffith-act-2603
70264	House	2022-11-16	SOLD $590,000	2022-12-08	Undisclosed	3	1	1			Blackshaw Queanbeyan & Jerrabomberra	15-john-bull-street-queanbeyan-nsw-2620
70267	Apartment	2022-11-16	$1,295,000+	2023-01-11	$1,300,000	3	2	2	5.5		Luton Manuka	17-12-national-circuit-barton-act-2600
70269	House	2022-11-16	$975,000	2023-02-02	$950,000	4	2	2		745.0	LJ Hooker Batemans Bay	19-michener-court-long-beach-nsw-2536
70271	Townhouse	2022-11-16	$890,000+	2024-02-02	$875,000	3	2	2	1.0	632.0	Ray White Canberra	2-gladman-close-isaacs-act-2607
70276	House	2022-11-16	Auction 07/12/2022	2022-12-07	$355,000	1	1	1	6.0		Ray White Canberra	27-27-avalon-court-phillip-act-2606
70277	House	2022-11-16	$1,099,000+	2023-01-24	$1,090,000	4	2	2	5.5	780.0	LJ Hooker Gungahlin	17-ringarooma-circle-amaroo-act-2914
70291	House	2022-11-16	$1,250,000	2023-02-28	Undisclosed	4	2	1	3.0	770.0	Stone Gungahlin	32-mcclelland-avenue-nicholls-act-2913
70292	Townhouse	2022-11-16	SOLD PRIOR TO AUCTION-$761,000	2022-12-08	$761,000	3	2	2	5.5		Stone Gungahlin	5-133-kelleway-avenue-nicholls-act-2913
70293	House	2022-11-16	Sold at Auction-$905,000	2022-12-10	$905,000	5	2	1	2.0	914.0	Stone Gungahlin	12-burnett-street-kaleen-act-2617
70300	Unit	2022-11-16	Auction	2022-11-25	$380,000	2	1	1	2.0		LJ Hooker Belconnen	13-11-tryon-street-hackett-act-2602
70305	House	2022-11-16	Auction	2022-12-08	$780,000	3	1	0	1.0	888.0	LJ Hooker Belconnen	23-kinkead-street-evatt-act-2617
70308	House	2022-11-16	$580,000	2022-11-16	$580,000	3	1	0			Henley Property - Cooma	8-sellar-street-cooma-nsw-2630
70309	House	2022-11-16	AUCTION	2023-03-06	$1,500,000	4	3	2	0.5	892.0	Michael Potter Real Estate	3-couvreur-street-garran-act-2605
70310	House	2022-11-16	$870,000+	2023-03-20	Undisclosed	3	1	2	6.0	520.0	VERV Property	3-justice-kelly-street-forde-act-2914
70311	House	2022-11-16	AUCTION	2022-11-24	$960,000	3	3	2	2.5	1048.0	Michael Potter Real Estate	106-allchin-circuit-kambah-act-2902
70317	House	2022-11-16	Contact Agent	2022-12-08	Undisclosed	5	3	7	1.0	766.0	One Agency Scott Crossman	29-carr-crescent-wanniassa-act-2903
70319	House	2022-11-16	$406,000	2023-03-02	Undisclosed	3	1	1		600.7	PRD Wagga Wagga	11-karen-street-tolland-nsw-2650
70320	House	2022-11-16	AUCTION	2022-11-25	$1,220,000	4	1	0	1.5	1132.0	McIntyre Property	16-perkins-place-torrens-act-2607
70322	House	2022-11-16	Auction	2023-04-28	Undisclosed	4	2	2		1900.0	Ray White Rural Canberra | Yass	35-cullavin-street-gunning-nsw-2581
70326	House	2022-11-16	$950,000 - $995,000	2023-09-11	Undisclosed	4	2	2	5.0	514.0	LJ Hooker Woden/Weston	14-mellington-loop-googong-nsw-2620
70331	House	2022-11-16	Auction 10/12/2022	2022-12-10	$755,000	3	1	2	3.5	800.0	Ray White Canberra	55-perrin-circuit-banks-act-2906
70332	House	2022-11-16	$1,180,000 - $1,220,000	2023-02-07	$1,200,000	4	3	3		1082.0	Ray White Bungendore	3-shanahan-street-bungendore-nsw-2621
70333	Land	2022-11-16	By Negotiation	2023-02-21	Undisclosed	0	0	0		10.37	Ray White Canberra	36-mcleods-creek-drive-gundaroo-nsw-2620
70335	House	2022-11-16	$725,000	2023-02-07	$710,000	3	1	1		773.0	LJ Hooker Batemans Bay	67-melaleuca-crescent-catalina-nsw-2536
70345	House	2022-11-16	Auction  10 December @ 10 am	2022-12-10	$1,280,000	3	1	0	1.5	780.0	Maloney's Property	23-myall-street-oconnor-act-2602
70347	House	2022-11-16	Auction	2022-12-07	Undisclosed	5	2	2	4.5	800.0	Luton Gungahlin	17-hattersley-court-nicholls-act-2913
70351	Townhouse	2022-11-17	$949,000	2023-02-03	Undisclosed	3	2	2	2.5	550.0	Luton Weston Creek & Molonglo Valley	21-1-wilkins-street-mawson-act-2607
70352	House	2022-11-17	Auction	2022-12-10	Undisclosed	5	2	2	3.5	937.0	LJ Hooker Tuggeranong	12-hallstrom-circuit-monash-act-2904
70353	House	2022-11-17	By Negotiation	2023-03-31	Undisclosed	4	2	2	1.0	890.0	Luton Weston Creek & Molonglo Valley	13-perry-drive-chapman-act-2611
70355	House	2022-11-17	$869,000	2023-01-23	$840,000	4	2	2		700.0	Raine & Horne Goulburn	4-hunter-street-goulburn-nsw-2580
70356	House	2022-11-17	$849,000	2023-02-22	$849,000	5	3	2		671.0	Raine & Horne Goulburn	71-victoria-street-goulburn-nsw-2580
70357	House	2022-11-17	Auction	2022-12-08	Undisclosed	3	2	2	5.0	419.0	Luton Kippax	51-hugh-mckay-crescent-dunlop-act-2615
70358	House	2022-11-17	$1,149,000 +	2023-01-23	$1,150,000	4	2	3	3.0	702.3	LJ Hooker Woden/Weston	16-jindabyne-street-duffy-act-2611
70359	House	2022-11-17	$640,000+	2022-12-07	$677,000	2	1	1	5.0	405.0	LJ Hooker Kippax	8-bandt-place-dunlop-act-2615
70364	House	2022-11-17	$829,000	2023-02-17	$750,000	4	2	2		1134.0	Ray White Goulburn	11-boomerang-drive-goulburn-nsw-2580
70365	House	2022-11-17	$1,270,000 - $1,310,000	2023-02-01	$1,250,000	4	2	3		1181.0	Ray White Bungendore	10-bluskie-close-bungendore-nsw-2621
70366	Lifestyle	2022-11-17	$975,000	2023-01-10	$915,000	2	1	4		40.8	Ray White Goulburn	126-glynmar-road-marulan-nsw-2579
70369	Townhouse	2022-11-17	$700,000	2023-02-07	$700,000	3	2	2			Luton Manuka	10-20-kenny-place-karabar-nsw-2620
70371	Apartment	2022-11-17	$699,000	2023-02-22	Undisclosed	2	2	1	3.0		Luton Manuka	503-2-marcus-clarke-street-city-act-2601
70372	Apartment	2022-11-17	Auction	2022-12-10	$654,000	2	2	1	4.0		Luton Manuka	16-4-jardine-street-kingston-act-2604
70373	Apartment	2022-11-17	$449,000+	2022-12-08	Undisclosed	1	1	1	6.0		LJ Hooker Manuka	602-222-city-walk-city-act-2601
70376	House	2022-11-17	Auction	2022-12-10	$1,287,000	3	1	0	1.5	849.0	LJ Hooker Dickson	54-cullen-street-watson-act-2602
70378	Townhouse	2022-11-17	$710,000 - $760,000	2023-01-09	Undisclosed	4	2	2	4.5		LJ Hooker Manuka	5-54-handasyde-street-conder-act-2906
70384	House	2022-11-17	$950,000	2023-02-06	Undisclosed	4	2	2	2.5	844.0	My Morris	15-severne-crescent-kambah-act-2902
70389	Unit	2022-11-17	$850,000+	2023-02-20	$840,000	3	2	2	5.0		LJ Hooker Dickson	45-12-challis-street-dickson-act-2602
70390	House	2022-11-17	$990,000	2023-02-08	$960,000	5	3	1		1378.0	Henley Property - Cooma	35-culey-avenue-cooma-nsw-2630
70401	House	2022-11-17	Guide $1,390,000 to $1,440,000	2023-01-19	$1,335,000	4	1	2		2.0	Henley Property - Jindabyne	68-ridge-avenue-jindabyne-nsw-2627
70403	Land	2022-11-17	Price By Negotiation	2023-05-29	Undisclosed	0	0	0		658.0	Bella Coastal Property	89-sunset-strip-manyana-nsw-2539
70406	House	2022-11-17	Auction 10/12/2022	2022-12-10	$752,500	3	1	2	3.0	575.0	Ray White Canberra	31-werriwa-crescent-isabella-plains-act-2905
70409	Land	2022-11-17	Contact Agent	2022-11-17	$650,000	0	0	0		670.0	LJ Hooker Queanbeyan  Jerrabomberra  Googong	14-urila-street-crestwood-nsw-2620
70410	House	2022-11-17	$2,100,000+	2023-02-27	$2,030,000	4	2	2	4.0	1561.0	LJ Hooker Dickson	3-peacock-place-curtin-act-2605
70412	House	2022-11-17	$649,000	2023-02-15	$630,000	3	1	4		727.0	Raine & Horne Goulburn	21-station-street-marulan-nsw-2579
70417	House	2022-11-17	$690,000 - $730,000	2023-03-06	$700,000	3	1	2		667.0	Ward Estate Agents	9-namai-place-queanbeyan-nsw-2620
70420	House	2022-11-17	contact agent	2023-01-10	Undisclosed	4	2	2	0.0	877.0	home.by holly	30-canning-street-ainslie-act-2602
70423	AcreageSemi-rural	2022-11-17	$2,500,000	2023-03-02	Undisclosed	5	3	5		66.0	Kitson Property	55-flowerdale-road-moorong-nsw-2650
70428	House	2022-11-17	$1,249,000	2023-03-14	$1,150,000	3	2	1		485.1	Henley Property - Jindabyne	2b-pilot-close-jindabyne-nsw-2627
70431	House	2022-11-17	By Negotiation	2022-12-06	$915,000	5	3	2	1.0	1232.0	Luton Gungahlin	14-trenwith-close-spence-act-2615
70432	Land	2022-11-17	605000	2023-01-20	$605,000	0	0	0		422.0	Smile Elite	6-23-jacobs-drive-sussex-inlet-nsw-2540
