id	type	ListingDate	PriceLabel	SoldDate	SoldPrice	Beds	Baths	Cars	EER	PlotSize	Agency.Name	Slug
56224	House	2022-04-01	Auction	2022-04-12	Undisclosed	5	3	2	3.5	1285.0	Luton Tuggeranong	5-sawicki-place-gordon-act-2906
56225	House	2022-04-01	$950,000 +	2022-05-31	$975,000	4	3	2	1.0	937.0	LJ Hooker Tuggeranong	7-mclellan-place-wanniassa-act-2903
56227	Unit	2022-04-01	$310,000+	2022-05-17	$330,000	1	1	1	6.0		LJ Hooker Manuka	9-26-moulden-court-belconnen-act-2617
56229	Apartment	2022-04-01	$579,000+	2022-04-14	Undisclosed	3	2	2	5.5		Badenoch Real Estate	25-12-byron-court-phillip-act-2606
56232	House	2022-04-01	$2,150,000+	2022-05-23	Undisclosed	4	2	1	0.5	654.0	Bastion Property Group	18-frome-street-griffith-act-2603
56238	House	2022-04-01	$2,500,000	2022-04-13	$2,500,000	3	1	1	0.5	1045.0	LJ Hooker Dickson	5-forbes-street-turner-act-2612
56240	House	2022-04-01	Auction	2022-04-20	$790,000	3	1	1	2.5	753.0	Luton Dickson	10-garrard-street-spence-act-2615
56246	House	2022-04-01	By Negotiation	2022-05-04	Undisclosed	4	2	2		670.0	Elders Murrumbateman	14-discovery-drive-yass-nsw-2582
56247	Townhouse	2022-04-01	Auction 21/04/2022	2022-04-08	Undisclosed	3	2	1	2.0		Ray White Canberra	33-28-ringrose-crescent-isaacs-act-2607
56252	Townhouse	2022-04-01	Auction 12/04/2022	2022-04-12	Undisclosed	3	2	2	6.0		Ray White Canberra	89-9-braybrooke-street-bruce-act-2617
56253	House	2022-04-01	SOLD	2022-05-01	$1,241,000	4	2	2		375.0	Smile Elite	29-mary-jane-parade-schofields-nsw-2762
56254	House	2022-04-01	SOLD	2022-07-22	Undisclosed	4	3	2		1241.0	Smile Elite	4-ginahgulla-drive-bowral-nsw-2576
56255	House	2022-04-01	SOLD	2022-04-12	$1,505,000	4	2	2		628.2	Smile Elite	1c-westminster-street-schofields-nsw-2762
56261	Land	2022-04-01	$790,000	2022-05-20	$760,000	0	0	0		830.0	Henley Property - Jindabyne	9-echidna-place-east-jindabyne-nsw-2627
56269	House	2022-04-01	Auction	2022-04-21	$1,375,000	5	3	2	2.0		Luton Manuka	2-yampi-place-fisher-act-2611
56271	Studio	2022-04-01	$335,000	2022-07-13	$335,000	0	1	1	6.0		The Real Estate Shop	19-47-abena-aveue-crace-act-2911
56274	House	2022-04-02	$678,000	2022-10-31	$660,000	5	2	2		1214.0	Clearwater Real Estate Narooma	9-tarlinton-st-cobargo-nsw-2550
56275	House	2022-04-02	Expressions of Interest	2022-06-02	Undisclosed	4	3	3		2.0	Raine & Horne Young	46-curtis-place-young-nsw-2594
56277	Apartment	2022-04-04	$799,000	2022-06-20	$785,000	2	1	1			Ray White Batemans Bay	3-33-35-clyde-street-batemans-bay-nsw-2536
56279	House	2022-04-04	$1,295,000	2022-07-06	$1,290,000	4	3	4		706.0	LJ Hooker Malua Bay	72-freycinet-drive-sunshine-bay-nsw-2536
56280	House	2022-04-04	$870,000	2023-03-03	Undisclosed	3	2	2		708.0	LJ Hooker Narooma	19-cresswick-parade-dalmeny-nsw-2546
56281	House	2022-04-04	Auction	2022-05-06	$550,000	3	1	1		2023.0	Ray White Goulburn	40-wollondilly-ave-goulburn-nsw-2580
56284	House	2022-04-04	$890,000 - $940,000	2022-04-22	$895,000	3	1	2		556.0	LJ Hooker Malua Bay	64-ainslie-parade-tomakin-nsw-2537
56294	House	2022-04-04	AUCTION	2022-04-11	$1,340,000	4	2	1	0.5		Michael Potter Real Estate	7-maria-place-lyons-act-2606
56296	Lifestyle	2022-04-04	$770,000 - $830,000	2022-10-19	$500,000	0	0	0	0.0	40.0	LJ Hooker Moruya	lot-10-dp752144-araluen-road-deua-river-valley-nsw-2537
56297	Land	2022-04-04	Contact agent	2023-07-13	$275,000	0	0	0			Ray White Batemans Bay	8-the-vista-surfside-nsw-2536
56304	House	2022-04-04	Contact Agent	2022-04-12	$1,390,000	4	2	2		714.0	Ray White Bowral	4-sherwin-crescent-renwick-nsw-2575
56318	House	2022-04-04	$520,000	2022-07-11	$520,000	3	1	3		857.0	Henley Property - Cooma	16-walla-street-cooma-nsw-2630
56322	House	2022-04-05	$960,000+	2022-04-05	$960,000	3	2	2	4.0	420.0	McGrath Canberra	45-burraly-court-ngunnawal-act-2913
56323	House	2022-04-05	$859,000+	2022-05-31	Undisclosed	3	1	2	2.5	810.0	Luton Gungahlin	2-driver-place-evatt-act-2617
56326	Lifestyle	2022-04-05	Reduced to $420,000	2022-08-08	Undisclosed	0	0	0		78.0	One Agency Craig Schofield	5177-monaro-highway-rockton-nsw-2632
56334	House	2022-04-05	$749,000+	2022-05-20	Undisclosed	3	1	1	1.0	926.0	Ray White Canberra	10-porteous-crescent-theodore-act-2905
56337	House	2022-04-05	By Negotiation	2022-04-04	$860,000	3	2	2		696.0	Bella Coastal Property	3-spencer-street-ulladulla-nsw-2539
56340	Apartment	2022-04-05	Auction 07/05/2022	2022-05-06	Undisclosed	1	1	1	6.0		One Agency Gamarra & Co	1103-19-marcus-clarke-street-canberra-act-2601
56344	House	2022-04-05	SOLD	2022-07-06	$280,000	3	1	1		613.0	Smile Elite	7-north-street-lismore-nsw-2480
56352	House	2022-04-05	AUCTION	2022-05-02	$700,000	3	1	1		872.0	Elders Real Estate Batemans Bay	22-calton-road-batehaven-nsw-2536
56359	Lifestyle	2022-04-05	$550,000	2022-07-20	Undisclosed	1	1	0		55.0	One Agency Craig Schofield	narrowness-road-glen-allen-nsw-2631
56361	House	2022-04-05	$989,000	2022-05-03	$970,000	4	3	3	2.0	706.0	Cream Residential	128-outtrim-avenue-calwell-act-2905
56362	House	2022-04-05	PRICE GUIDE $940,000	2022-11-02	$860,000	3	2	2			Tathra Beach Real Estate	7-45c-andy-poole-drive-tathra-nsw-2550
56363	House	2022-04-05	Price Guide $650,000	2022-07-18	$618,000	3	2	3		708.0	One Agency Dwyer Properties	2-beverley-street-merimbula-nsw-2548
56365	Apartment	2022-04-05	Offers above $529,000	2022-07-18	$536,000	2	1	1	6.0		Town Residential	149-7-irving-street-phillip-act-2606
56366	House	2022-04-05	$440,000 - $450,000	2022-08-25	Undisclosed	3	1	1		613.0	One Agency Craig Schofield	37-bligh-street-cooma-nsw-2630
56367	Unit	2022-04-05	Price Guide $525,000	2022-05-03	$520,000	2	1	1			One Agency Dwyer Properties	2-41-yarrawood-avenue-merimbula-nsw-2548
56369	DuplexSemi-detached	2022-04-05	$960,000+	2022-07-22	Undisclosed	3	2	1	6.0	337.0	Bastion Property Group	1-82-dixon-drive-holder-act-2611
56370	House	2022-04-05	$465,000	2022-07-06	Undisclosed	3	1	2		1378.0	Raine & Horne Young	8-russell-street-young-nsw-2594
56375	House	2022-04-05	Auction	2022-04-08	Undisclosed	5	5	4		4850.0	Ray White Bowral	10-riversdale-avenue-burradoo-nsw-2576
56379	House	2022-04-05	$1,800,000 to $1,850,000	2022-09-08	Undisclosed	6	4	6		1146.0	Impact Properties	30-cunningham-street-karabar-nsw-2620
56381	Villa	2022-04-05	$599,000	2022-07-06	Undisclosed	2	1	2			Whale Coast Realty	26-11-payne-street-narooma-nsw-2546
56382	House	2022-04-05	$1,395,000	2022-08-08	Undisclosed	3	3	1		1322.0	Whale Coast Realty	36-coastal-court-dalmeny-nsw-2546
56384	House	2022-04-06	Auction Tuesday 31st May at 6pm	2022-05-20	$1,100,000	4	3	1	3.5	699.0	McCann Properties	5-sargeant-place-wanniassa-act-2903
56393	House	2022-04-06	By Negotiation	2022-06-10	$1,860,000	4	3	2	5.5	498.0	Canberry Properties	6-echidna-street-throsby-act-2914
56394	Villa	2022-04-06	$699,000	2022-07-22	$699,000	3	1	2			Clearwater Real Estate Narooma	unit-29-11-payne-st-narooma-nsw-2546
56396	Unit	2022-04-06	Auction	2022-04-13	$650,000	2	2	2	6.0		LJ Hooker Belconnen	8-15-19-fox-place-lyneham-act-2602
56401	Apartment	2022-04-06	$339,000+	2022-05-31	$370,000	1	1	1	6.0		LJ Hooker Canberra City	18-128-flemington-road-harrison-act-2914
56410	House	2022-04-06	$700,000 - $730,000	2022-05-31	$735,000	3	1	2		663.0	Luton Tuggeranong	1-glenn-place-crestwood-nsw-2620
56417	Apartment	2022-04-06	By Negotiation	2022-05-27	Undisclosed	2	2	1	6.0	7380.0	New Door Properties	346-1-anthony-rolfe-avenue-gungahlin-act-2912
56419	House	2022-04-06	$900,000+	2022-06-24	$950,000	4	2	1	1.5	837.0	LJ Hooker Kaleen	1-phoenix-place-giralang-act-2617
56420	Unit	2022-04-06	$165,000	2022-07-01	$165,000	1	1	1			Fisk & Nagle Property	24-24-mittagang-road-cooma-nsw-2630
56422	Villa	2022-04-06	Contact Agent	2022-06-29	$705,000	3	2	2			Clearwater Real Estate Narooma	unit-80-11-payne-st-narooma-nsw-2546
56423	House	2022-04-06	$1,000,000+	2022-05-20	$1,000,000	4	2	2	4.0		McIntyre Property	58-charterisville-avenue-conder-act-2906
56425	House	2022-04-06	$699,000	2022-06-03	$649,000	3	1	1		766.0	LJ Hooker Moruya	44-hawdon-street-moruya-nsw-2537
56433	Unit	2022-04-06	Contact Agent	2022-06-09	$225,000	1	1	1			LJ Hooker Queanbeyan – Jerrabomberra – Googong	2-38-isabella-street-queanbeyan-nsw-2620
56441	Apartment	2022-04-06	$375,000.00	2022-04-05	$375,000	1	1	1	6.0		One Agency Gungahlin	5-47-abena-avenue-crace-act-2911
56443	Land	2022-04-06	PRICE GUIDE $495,000	2022-08-16	$450,000	0	0	0		10800.0	Tathra Beach Real Estate	lot-137-jellat-way-kalaru-nsw-2550
56448	House	2022-04-07	Auction	2022-04-19	Undisclosed	4	2	2	4.5	654.0	Luton Weston Creek & Molonglo Valley	8-benson-crescent-calwell-act-2905
56453	House	2022-04-07	Auction	2022-05-07	$1,300,000	4	2	3	4.5	748.0	Luton Weston Creek & Molonglo Valley	110-dixon-drive-holder-act-2611
56454	House	2022-04-07	Buyers price guide $1,190,000+	2022-05-07	Undisclosed	4	3	2	6.0		One Agency Sandy Morris	2-croll-street-wright-act-2611
56455	Unit	2022-04-07	$535,000	2022-04-14	$535,000	1	1	1	6.0		home.by holly	2-62-henty-street-braddon-act-2612
56459	Apartment	2022-04-07	$599,000	2022-04-19	Undisclosed	1	1	1	6.0		Luton Manuka	17-43-blackall-street-barton-act-2600
56461	House	2022-04-07	$890,000+	2022-05-20	$910,000	4	2	3	2.5	821.0	Michael Potter Real Estate	13-dyett-circuit-theodore-act-2905
56463	Land	2022-04-07	$525,000	2022-06-29	$490,000	0	0	0		713.0	LJ Hooker Moruya	9-gum-leaf-drive-congo-nsw-2537
56468	House	2022-04-07	AUCTION	2022-05-06	$510,000	3	1	1			Ray White Goulburn	159-nicholson-street-goulburn-nsw-2580
56469	Apartment	2022-04-07	$379,000+	2022-04-14	$397,000	2	1	2	6.0		LJ Hooker Gungahlin	113-77-gozzard-street-gungahlin-act-2912
56478	Townhouse	2022-04-07	$770,000+	2022-06-29	$765,000	3	2	2	2.5		LJ Hooker Tuggeranong	5-35-tenison-woods-circuit-bonython-act-2905
56480	House	2022-04-07	Under Offer	2022-07-18	$1,080,000	4	2	3	1.5	809.0	Bertram Ellis	14-maplestone-place-chapman-act-2611
56485	House	2022-04-07	$1,195,000 - $1,250,000	2022-06-29	$1,185,000	4	2	5		1216.0	VERV Property	28-eyre-street-bungendore-nsw-2621
56486	House	2022-04-07	$1,250,000	2022-06-29	$1,225,000	4	2	2	0.5	855.0	Michael Potter Real Estate	67-collings-street-pearce-act-2607
56487	House	2022-04-07	$1,250,000+	2022-05-17	$1,280,000	5	3	2	2.5	797.0	Bertram Ellis	78-darwinia-terrace-chapman-act-2611
56492	House	2022-04-07	$800,000+	2022-06-01	$825,000	4	2	2	2.0	837.0	LJ Hooker Kippax	1-macintyre-place-charnwood-act-2615
56493	Townhouse	2022-04-07	$1,159,000+	2022-07-08	Undisclosed	4	2	2	6.0	327.0	Bastion Property Group	4-1-judith-macintosh-crescent-taylor-act-2913
56498	House	2022-04-07	$600,000	2022-06-22	$625,000	3	1	1		1068.0	Henley Property - Jindabyne	13-church-road-cooma-nsw-2630
56500	Unit	2022-04-07	$680,000 to $720,000	2022-06-08	$680,000	4	2	2		251.0	Sails Real Estate	1-312-pacific-way-tura-beach-nsw-2548
56501	House	2022-04-07	Auction 07/05/2022	2022-05-05	Undisclosed	4	2	2	1.5	778.0	Ray White Canberra	5-etheridge-street-page-act-2614
56506	House	2022-04-07	$550,000 - $600,000	2022-04-07	$590,000	3	1	1			My Agent Christine Ewin	60-riverview-crescent-catalina-nsw-2536
56510	Unit	2022-04-07	$429,000	2022-07-12	$410,000	2	1	1			Elders Real Estate Batemans Bay	1-25-wharf-road-north-batemans-bay-nsw-2536
56517	House	2022-04-07	NEW PRICE - $930,000	2022-07-15	$875,000	4	1	2		835.0	Fraser-Gray Real Estate	25-river-road-mossy-point-nsw-2537
56523	House	2022-04-07	Contact Agent	2022-07-29	$1,275,000	5	5	2		624.0	Smile Elite	132-pioneer-drive-flinders-nsw-2529
56524	House	2022-04-07	Contact Agent	2022-09-05	$410,000	2	1	1			Smile Elite	43-1-norman-street-lake-conjola-nsw-2539
56528	Apartment	2022-04-07	Contact Agent	2022-05-16	Undisclosed	2	2	1	6.0		One Agency Gamarra & Co	70-8-dominion-circuit-forrest-act-2603
56529	House	2022-04-07	Contact Agent	2022-08-19	Undisclosed	3	1	2		648.0	Smile Elite	33-chalmers-street-port-macquarie-nsw-2444
56532	House	2022-04-07	Auction	2022-05-04	Undisclosed	3	2	1	2.0	495.0	LJ Hooker Dickson	17-slessor-crescent-mckellar-act-2617
56533	House	2022-04-07	SOLD prior to Auction	2022-05-25	$820,000	3	1	1	1.5	799.0	LJ Hooker Gungahlin	23-maranboy-street-fisher-act-2611
56534	House	2022-04-07	Contact Agent	2022-07-29	Undisclosed	4	2	2		661.0	Smile Elite	3-jaranda-street-berowra-nsw-2081
56536	Apartment	2022-04-08	$575,000	2022-05-04	$575,000	2	1	1	6.0		home.by holly	88-1-mouat-street-lyneham-act-2602
56537	House	2022-04-08	$1,099,000+	2022-07-25	$1,030,000	4	2	4	3.0	914.0	LJ Hooker Dickson	63-alabaster-street-monash-act-2904
56538	House	2022-04-08	$799,000	2022-04-08	$790,000	3	2	1			Sails Real Estate	56-kowara-crescent-merimbula-nsw-2548
56539	House	2022-04-08	Auction	2022-05-07	$785,000	3	1	1	5.0	356.0	Infinity Residential	180-macfarlane-burnet-avenue-macgregor-act-2615
56549	House	2022-04-08	By Negotiation	2022-04-13	Undisclosed	2	1	1	3.0		Luton Weston Creek & Molonglo Valley	28-8-corinna-street-lyons-act-2606
56555	Apartment	2022-04-08	By Negotiation	2022-04-08	$595,000	2	2	2	6.0		Impact Properties	263-1-anthony-rolfe-avenue-gungahlin-act-2912
56556	House	2022-04-08	$825,000+	2022-06-09	$765,000	3	1	0	6.0	433.0	LJ Hooker Gungahlin	5-grace-place-amaroo-act-2914
56560	Apartment	2022-04-08	$750,000-$770,000	2022-05-18	$800,000	3	2	2			Henley Property - Jindabyne	4-39-gippsland-street-jindabyne-nsw-2627
56568	House	2022-04-08	Price Guide $750,000	2022-04-14	$761,706	3	2	2		767.0	One Agency Dwyer Properties	66-tura-beach-drive-tura-beach-nsw-2548
56569	House	2022-04-08	$949,000	2022-09-23	Undisclosed	3	2	2	5.0	369.0	Bastion Property Group	1-bright-street-franklin-act-2913
56570	House	2022-04-08	Price Guide $900,000	2022-05-20	$900,000	4	2	2		703.0	One Agency Dwyer Properties	71-surf-circle-tura-beach-nsw-2548
56574	Apartment	2022-04-08	$462500	2022-07-14	$462,500	1	1	1	6.0		Luton Dickson	3-19-21-norton-street-evatt-act-2617
56583	Farmlet	2022-04-08	Contact Agent	2022-04-08	Undisclosed	6	1	0		13.5	One Agency Craig Schofield	peak-view-road-peak-view-nsw-2630
56592	Townhouse	2022-04-09	$950,000	2022-04-09	$950,000	2	2	2			Henley Property - Jindabyne	9a-ethridge-close-jindabyne-nsw-2627
56593	Land	2022-04-09	Guide $1,150,000 - $1,235,000	2022-06-03	$1,130,000	0	0	0		4181.0	Ray White Bowral	lot-5-19-hazelton-drive-moss-vale-nsw-2577
56595	House	2022-04-21	$850,000	2022-06-07	$820,000	2	1	2		10000.0	Burchell Higgins Property Sales	67-nutleys-creek-road-bermagui-nsw-2546
56602	House	2022-04-11	$1,350,000	2022-07-19	Undisclosed	4	2	2	5.0	406.0	Ray White Canberra	12-hibberd-crescent-forde-act-2914
56605	Land	2022-04-11	$1,500,000	2022-10-20	$1,225,000	0	0	0		40.38	LJ Hooker Batemans Bay	210-nelligen-creek-road-nelligen-nsw-2536
56610	House	2022-04-11	$649,000	2022-05-30	$647,500	3	2	1		588.0	LJ Hooker Malua Bay	55-country-club-drive-catalina-nsw-2536
56611	Cropping	2022-04-11	Auction	2022-04-08	$2,850,000	0	0	0		144.8	Raine & Horne Goulburn	1115-windellama-road-goulburn-nsw-2580
56618	House	2022-04-11	$925,000	2022-06-02	$915,000	3	1	0	2.0	523.0	Maloney's Property	110-cowper-street-dickson-act-2602
56620	Unit	2022-04-11	$395,000 - $415,000	2022-05-16	$410,000	2	2	2			Sails Real Estate	20-1-dunns-lane-merimbula-nsw-2548
56624	AcreageSemi-rural	2022-04-11	Auction	2022-05-05	$676,000	3	1	2		1.0	Henley Property - Jindabyne	24-cove-hill-road-eucumbene-nsw-2628
56625	Unit	2022-04-11	Contact Agent	2022-05-24	$335,000	2	1	1			LJ Hooker Queanbeyan – Jerrabomberra – Googong	11-9-crest-road-crestwood-nsw-2620
56629	House	2022-04-11	SOLD	2022-07-08	$1,550,000	3	2	2		607.0	Smile Elite	26-fitzroy-street-umina-beach-nsw-2257
56630	House	2022-04-11	SOLD	2022-05-17	$1,050,000	3	2	3		563.0	Smile Elite	306-blackwall-road-blackwall-nsw-2256
56631	House	2022-04-11	$625,000	2022-06-24	$605,000	3	2	3		771.0	Henley Property - Cooma	51-wangie-street-cooma-nsw-2630
56632	House	2022-04-12	AUCTION	2022-05-07	$1,196,000	4	2	3	4.0		Michael Potter Real Estate	29-dixon-drive-duffy-act-2611
56635	Townhouse	2022-04-12	$875,000	2022-06-17	Undisclosed	4	3	2	6.0	8952.54	Ray White Canberra	52-23-wanderlight-avenue-lawson-act-2617
56637	House	2022-04-12	$825,000	2022-06-23	$792,500	3	1	5		2256.0	Belle Property Braidwood	63-araluen-road-braidwood-nsw-2622
56640	House	2022-04-12	$610,000	2022-05-05	Undisclosed	4	2	2		660.0	Raine & Horne Goulburn	12-wright-place-goulburn-nsw-2580
56646	Apartment	2022-04-12	$430,000 to $450,000	2022-06-22	$421,500	3	2	1			Impact Properties	30-39-thurralilly-street-queanbeyan-east-nsw-2620
56647	Unit	2022-04-12	$330,000	2022-04-20	$330,000	2	1	1		73.0	Ray White Queanbeyan | Jerrabomberra	4-59-donald-road-karabar-nsw-2620
56650	House	2022-04-12	$729,000+	2022-06-02	Undisclosed	3	1	1	4.5	414.0	Ray White Canberra	2-iterra-grove-ngunnawal-act-2913
56653	House	2022-04-12	AUCTION	2022-05-03	Undisclosed	6	3	2		1094.0	Ray White Queanbeyan | Jerrabomberra	2-eecen-road-karabar-nsw-2620
56656	House	2022-04-12	By Negotiation	2022-06-24	Undisclosed	4	2	2	5.0	457.0	Independent Gungahlin	22-feilman-street-taylor-act-2913
56657	House	2022-04-12	By Negotiation	2022-10-05	$1,020,000	4	2	2	6.0		Confidence Real Estate	15-buckingham-street-amaroo-act-2914
56659	House	2022-04-12	$1,250,000	2022-05-27	$1,200,000	4	2	3		597.1	LJ Hooker Malua Bay	15-gillan-grove-broulee-nsw-2537
56660	Townhouse	2022-04-12	$460,000 - $490,000	2022-05-20	$475,000	1	1	1		167.0	Ray White Queanbeyan | Jerrabomberra	9a-aprasia-avenue-googong-nsw-2620
56666	House	2022-04-12	$749,000	2022-06-30	$740,000	4	2	1		1084.0	Elders Real Estate Batemans Bay	68-catalina-drive-catalina-nsw-2536
56669	House	2022-04-12	Price Guide $745,000 - $795,000	2022-05-04	$775,000	3	1	1		1227.0	Raine & Horne Southern Highlands	39-ella-street-hill-top-nsw-2575
56676	House	2022-04-12	$2,100,000	2022-06-30	Undisclosed	3	2	12		4.3	LJ Hooker Narooma	73-rainforest-parkway-narooma-nsw-2546
56679	House	2022-04-12	Auction Register Your Interest	2022-05-28	$2,390,000	4	2	2	0.0	5.0	Raine & Horne Southern Highlands	46-greenhills-road-berrima-nsw-2577
56683	Unit	2022-04-12	$489,000	2022-06-03	$480,000	2	1	1			Elders Real Estate Batemans Bay	7-676-678-beach-road-surf-beach-nsw-2536
56685	Unit	2022-04-12	$210,000	2023-01-11	$210,000	1	1	1			LJ Hooker Queanbeyan – Jerrabomberra – Googong	19-122-henderson-road-crestwood-nsw-2620
56689	House	2022-04-12	Auction	2022-05-07	$1,304,000	3	1	1	1.5	694.0	Luton Gungahlin	39-gingana-street-aranda-act-2614
56691	House	2022-04-12	SOLD	2022-05-06	Undisclosed	3	2	1		721.0	Smile Elite	22-kings-point-drive-kings-point-nsw-2539
56693	House	2022-04-12	$800,000	2022-07-08	$750,000	5	2	2		838.0	Henley Property - Cooma	9-campsite-place-cooma-nsw-2630
56696	Apartment	2022-04-13	$595,000	2022-05-04	$595,000	2	2	1	6.0	1262.0	Maloney's Property	17-77-leichhardt-street-kingston-act-2604
56697	Unit	2022-04-13	Price Guide $989,000 - $1,029,000	2023-12-12	$950,000	4	2	2			Sails Real Estate	1-8-tern-close-merimbula-nsw-2548
56707	Townhouse	2022-04-13	Price undisclosed	2022-06-06	Undisclosed	3	2	2	6.0		McGrath Canberra	32-11-wanderlight-avenue-lawson-act-2617
56708	Apartment	2022-04-13	$460,000+	2022-05-05	$555,000	2	2	1	6.0		McIntyre Property	16-108-athllon-drive-greenway-act-2900
56709	House	2022-04-13	$719,000	2022-05-05	$700,000	3	2	4		892.0	Elders Real Estate Batemans Bay	17-heron-road-catalina-nsw-2536
56710	House	2022-04-13	$1,200,000	2022-06-15	$1,200,000	3	1	1	1.0	764.0	home.by holly	20-molesworth-street-watson-act-2602
56712	House	2022-04-13	Price Guide $460,000	2022-06-27	Undisclosed	3	1	2		644.9	InHouse Real Estate	4-young-st-eden-nsw-2551
56722	Apartment	2022-04-13	$789,000	2022-10-26	$725,000	3	2	1			Sails Real Estate	18-10-marine-parade-merimbula-nsw-2548
56728	House	2022-04-13	Auction	2022-05-05	$640,000	3	1	2	0.5	755.0	LJ Hooker Belconnen	2-small-place-charnwood-act-2615
56732	Villa	2022-04-13	Price Guide $860,000	2022-06-10	$860,000	2	2	2			Raine & Horne Southern Highlands	2-44-kangaloon-road-bowral-nsw-2576
56740	House	2022-04-13	Offer over $1,400,000	2022-06-03	$1,370,000	5	3	3	3.0	0.0	Edge Adil Iqbal	17-darwinia-terrace-rivett-act-2611
56744	House	2022-04-14	$1,139,000	2022-06-24	$1,139,000	3	2	1	1.0	685.0	Luton Weston Creek & Molonglo Valley	9-gulgong-place-fisher-act-2611
56745	House	2022-04-14	Auction	2022-04-20	Undisclosed	3	1	2	1.0	962.0	Luton Weston Creek & Molonglo Valley	23-cargelligo-street-duffy-act-2611
56746	Townhouse	2022-04-14	Auction: Saturday 7th May 9.45am	2022-05-07	$942,000	4	2	2	4.0	341.0	McGrath Canberra	1-29-moonlight-avenue-harrison-act-2914
56747	Townhouse	2022-04-14	$1,290,000+	2022-06-01	$1,290,000	3	2	2	6.0		McGrath Canberra	8-2-torrens-street-braddon-act-2612
56748	House	2022-04-14	Auction	2022-05-04	Undisclosed	3	2	2	4.0	781.0	Blackshaw Belconnen	1-quaife-place-florey-act-2615
56749	House	2022-04-14	$860,000	2022-09-16	$850,000	4	2	2		654.0	Elders Real Estate Batemans Bay	72-litchfield-crescent-long-beach-nsw-2536
56753	Townhouse	2022-04-14	Offers over $895,000	2022-05-20	$961,000	3	2	2	1.5		LJ Hooker Manuka	5-3-hansen-circuit-isaacs-act-2607
56754	House	2022-04-14	$1,275,000-$1,310,000	2022-07-19	$1,275,000	4	2	4		821.3	Ray White Batemans Bay	22-hedley-way-broulee-nsw-2537
56758	Townhouse	2022-04-14	Auction 05/05/2022	2022-05-05	Undisclosed	3	2	2	5.0		Ray White Canberra	55-zakharov-avenue-forde-act-2914
56760	House	2022-04-14	$1,200,000	2023-03-28	Undisclosed	3	1	1		696.0	Bella Coastal Property	106-malibu-drive-bawley-point-nsw-2539
56764	Townhouse	2022-04-14	By Negotiation	2022-05-31	$650,000	2	2	2	5.5		Impact Properties	8-skewes-street-casey-act-2913
56766	House	2022-04-14	$1,450,000 - $1,550,000	2022-08-18	$1,320,000	4	2	2		879.0	LJ Hooker Sussex Inlet	59-collier-drive-cudmirrah-nsw-2540
56767	House	2022-04-14	Auction	2022-05-07	$1,550,000	4	3	2	1.5	757.0	Bertram Ellis	101-appel-crescent-fadden-act-2904
56770	House	2022-04-14	$695,000	2023-03-30	Undisclosed	4	2	2		669.0	LJ Hooker Sussex Inlet	32-suncrest-avenue-sussex-inlet-nsw-2540
56771	Unit	2022-04-14	SOLD	2022-05-03	$960,000	3	2	2			Smile Elite	12-7-11-rickard-road-empire-bay-nsw-2257
56773	House	2022-04-14	Auction 05/05/2022	2022-05-05	Undisclosed	3	1	1	2.0	443.0	Ray White Canberra	29-slessor-crescent-mckellar-act-2617
56777	House	2022-04-14	$759,000 - $800,000	2022-05-03	$799,000	3	1	2	3.0	601.0	Aird Property Group	7-rouse-charnwood-act-2615
56782	Apartment	2022-04-14	$499,000+	2022-07-05	$504,000	2	1	1	4.5		Luton Gungahlin	1214-6-grazier-lane-belconnen-act-2617
56783	Warehouse	2022-04-14	$450,000	2022-04-14	$450,000	1	1	0			Sails Real Estate	1-11-tura-beach-drive-tura-beach-nsw-2548
56785	House	2022-04-14	$970,000 - $1,020,000	2022-05-06	Undisclosed	4	2	2		761.0	My Agent Christine Ewin	48-wattlebird-way-malua-bay-nsw-2536
56793	House	2022-04-14	$1,285,000	2022-08-02	$1,200,000	4	2	2		891.0	Fraser-Gray Real Estate	11-woolabar-drive-broulee-nsw-2537
56795	House	2022-04-14	Price Guide $1,000,000	2022-05-02	$1,040,000	3	2	3		998.0	Sails Real Estate	218-mirador-drive-merimbula-nsw-2548
56796	Unit	2022-04-14	$379,000+	2022-05-23	$410,000	2	1	1	6.0	51.0	LJ Hooker Gungahlin	602-6-gribble-street-gungahlin-act-2912
56797	House	2022-04-14	Auction 26/05/2022	2022-05-20	$1,110,000	3	2	2	6.0	920.0	Ray White Canberra	15-spalding-street-flynn-act-2615
56798	House	2022-04-14	$759,000	2022-08-05	$743,000	3	3	4		753.0	Elders Real Estate Batemans Bay	8-south-street-batemans-bay-nsw-2536
56803	Land	2022-04-14		2022-05-27	Undisclosed	0	0	0			Hallmark Real Estate Advisors	17-pleasant-place-tuross-head-nsw-2537
56808	House	2022-04-14	$1,150,000	2022-05-02	$1,150,000	4	3	2		588.0	LJ Hooker Batemans Bay	55-karoo-crescent-malua-bay-nsw-2536
56816	Townhouse	2022-04-14	$1,055,000	2022-05-06	$1,055,000	3	2	2	5.0	1149.0	home.by holly	5-17-wise-street-braddon-act-2612
56817	Apartment	2022-04-14	$425,000	2022-06-08	$408,000	1	1	1	6.0		LJ Hooker Kaleen	817-17-dooring-street-braddon-act-2612
56823	Unit	2022-04-14	$1,100,000	2022-06-03	$1,100,000	2	2	2			Sails Real Estate	87-1-elizabeth-street-merimbula-nsw-2548
56824	Unit	2022-04-14	$690,000 - $730,000	2022-05-04	$730,000	3	2	2		3028.0	My Agent Christine Ewin	3-272-276-beach-road-batehaven-nsw-2536
56826	House	2022-04-14	AUCTION	2022-05-03	Undisclosed	3	1	2	4.0	396.0	McIntyre Property	16-kellick-place-gordon-act-2906
56827	House	2022-04-14	Auction	2022-05-05	$1,650,000	4	2	4		4046.86	Henley Property - Jindabyne	29-geehi-circuit-jindabyne-nsw-2627
56831	Lifestyle	2022-04-14	$2,100,000	2022-10-11	Undisclosed	4	3	0		25.0	LAWD	woorigol-362-back-brawlin-road-cootamundra-nsw-2590
56834	House	2022-04-15	Guide $2,200,000 - $2,300,000	2022-06-10	$2,350,000	4	2	4		7353.0	Ray White Bowral	7a-hopewood-road-bowral-nsw-2576
56836	House	2022-04-16		2022-06-27	Undisclosed	3	2	2		910.0	Hallmark Real Estate Advisors	26-hawkins-road-tuross-head-nsw-2537
56847	Apartment	2022-04-19	$869,000	2022-06-10	$869,000	2	2	2	6.0		Luton Manuka	19-7-sydney-avenue-barton-act-2600
56848	Townhouse	2022-04-19	$700,000+	2022-05-31	Undisclosed	3	1	1	2.0		One Agency Sandy Morris	14-15-wyselaskie-circuit-kambah-act-2902
56849	House	2022-04-19	Auction	2022-05-03	Undisclosed	4	2	2	3.0	815.0	LJ Hooker Canberra City	5-burrowa-street-palmerston-act-2913
56852	BlockOfUnits	2022-04-19	$720,000+	2022-05-26	Undisclosed	3	2	2	4.5		One Agency Sandy Morris	1-174-ellerston-avenue-isabella-plains-act-2905
56858	House	2022-04-19	By Negotiation	2022-04-20	$1,650,000	4	3	2	5.5	741.0	Confidence Real Estate	22-kalgoorlie-crescent-fisher-act-2611
56860	House	2022-04-19	By negotiation	2022-06-03	Undisclosed	3	1	2	1.5	1139.0	Ray White Canberra	12-spencer-street-turner-act-2612
56868	House	2022-04-19	Auction: Saturday 7th May 11.15am	2022-05-07	$785,000	3	1	1	5.5	362.0	McGrath Canberra	81-wunderly-circuit-macgregor-act-2615
56869	House	2022-04-19	$869,000	2022-04-19	$869,000	5	3	2			Raine & Horne Goulburn	14-madeleine-drive-goulburn-nsw-2580
56872	House	2022-04-19	Contact Agent	2022-07-15	$810,000	4	2	2		696.0	LJ Hooker Queanbeyan – Jerrabomberra – Googong	30-morton-street-queanbeyan-nsw-2620
56874	House	2022-04-19	$1,000,000 - $1,100,000	2022-05-20	$1,010,000	3	2	2		450.0	LJ Hooker Malua Bay	3-martin-place-broulee-nsw-2537
56875	House	2022-04-19	$569,000	2022-05-27	$555,000	3	1	6		713.0	Raine & Horne Goulburn	1-combermere-street-goulburn-nsw-2580
56877	House	2022-04-19	$549,000	2022-06-09	$540,000	3	1	1		385.0	Raine & Horne Goulburn	33-park-street-goulburn-nsw-2580
56878	House	2022-04-19	$1,250,000	2022-07-15	$1,240,000	4	1	0	2.5	850.0	McIntyre Property	140-kitchener-street-garran-act-2605
56895	House	2022-04-19	Price guide $2,550,000 - $2,750,000	2022-05-23	$2,600,000	4	2	2		556.4	Ray White Batemans Bay	43-lake-view-drive-wallaga-lake-nsw-2546
56898	House	2022-04-20	SOLD	2022-05-25	$700,000	3	1	1		344.0	Smile Elite	15-britten-close-cranebrook-nsw-2749
56901	Apartment	2022-04-20	Contact Agent	2022-05-04	Undisclosed	2	1	1	4.0		Luton Manuka	14-7-medley-street-chifley-act-2606
56905	House	2022-04-20	$1,050,000	2022-05-04	$1,050,000	4	2	2	0.5	1152.0	One Agency Sandy Morris	3-mackerras-crescent-theodore-act-2905
56907	Townhouse	2022-04-20	$840,000 - $880,000	2022-08-22	$850,000	4	3	2	5.0	353.0	Luton Tuggeranong	1-1-templestowe-avenue-conder-act-2906
56908	Apartment	2022-04-20	$480,000	2022-06-17	$470,000	1	1	1	3.5		Luton Manuka	3-10-12-randell-street-dickson-act-2602
56911	House	2022-04-20	AUCTION 7th MAY at 10:30am	2022-05-07	$760,000	3	2	1	6.0		McGrath Canberra	3-windradyne-street-ngunnawal-act-2913
56912	House	2022-04-20	AUCTION 7th of MAY at 12:00pm	2022-05-07	$1,002,500	3	2	2	5.0		McGrath Canberra	14-stowport-avenue-crace-act-2911
56913	House	2022-04-20	SOLD - $1,260,000	2022-05-15	$1,260,000	4	2	2	3.5	811.0	Stone Gungahlin	16-mellor-circuit-florey-act-2615
56915	Land	2022-04-20	$500,000 - $550,000	2022-08-25	$475,000	0	0	0		1.16	LJ Hooker Batemans Bay	lot-5-sanctuary-forest-place-long-beach-nsw-2536
56920	House	2022-04-20	Auction	2022-05-07	$810,000	3	1	2	0.5	676.0	LJ Hooker Belconnen	7-holyman-street-scullin-act-2614
56922	Unit	2022-04-20	Auction	2022-05-02	$460,000	2	1	2	6.0		LJ Hooker Belconnen	43-16-david-miller-crescent-casey-act-2913
56923	House	2022-04-20	Auction	2022-05-07	$916,000	4	2	2	1.0	1046.0	LJ Hooker Belconnen	81-chewings-street-scullin-act-2614
56924	House	2022-04-20	$950,000	2022-10-19	$900,000	4	2	2		1262.0	Raine & Horne Goulburn	16-banksia-way-goulburn-nsw-2580
56930	House	2022-04-20	By Negotiation	2022-05-31	Undisclosed	3	2	2	6.0		New Door Properties	59-36-dulcie-holland-crescent-moncrieff-act-2914
56932	Land	2022-04-20	$340,000 - $360,000	2022-06-01	$330,000	0	0	0		655.0	My Agent Team	7-gannet-place-catalina-nsw-2536
56935	House	2022-04-20	Auction 14/5/22	2022-05-17	$1,380,000	4	2	2		1046.0	Ian McNamee & Partners - Queanbeyan	183-bicentennial-drive-jerrabomberra-nsw-2619
56939	Unit	2022-04-20	$440,000 - $470,000	2022-05-04	$465,000	2	2	1			My Agent Christine Ewin	5-230-beach-road-batehaven-nsw-2536
56948	House	2022-04-20	$370,000	2022-09-01	Undisclosed	3	1	2		759.0	Raine & Horne Young	29-clarke-street-harden-nsw-2587
56951	House	2022-04-20	$910,000	2022-05-05	$910,000	4	2	2	1.5	709.0	home.by holly	12-clifford-crescent-melba-act-2615
56952	House	2022-04-20	$1,000,000-$1,100,000	2022-06-14	$915,000	4	2	2		801.0	Bella Coastal Property	3-wilga-place-ulladulla-nsw-2539
56954	Land	2022-04-20	670,000	2022-07-23	$655,000	0	0	0	0.0	458.0	LJ Hooker Gungahlin	25-slim-dusty-circuit-moncrieff-act-2914
56955	House	2022-04-20	$830,000	2022-09-29	$820,000	4	2	2		734.0	Henley Property - Cooma	6-hain-street-cooma-nsw-2630
56963	House	2022-04-20	Contact Agent	2022-09-01	$600,000	3	1	1		487.0	Smile Elite	106-keppel-street-bathurst-nsw-2795
56966	House	2022-04-20	$989,000	2022-05-16	$975,000	4	3	2			Raine & Horne Goulburn	5-east-street-goulburn-nsw-2580
56970	Apartment	2022-04-21	$440,000	2022-06-08	Undisclosed	1	1	1	6.0		Ray White Canberra	80-217-northbourne-avenue-turner-act-2612
56971	Townhouse	2022-04-21	$855,000+	2022-08-05	Undisclosed	3	2	2	6.0	23346.0	Ray White Canberra	8-45-negus-crescent-watson-act-2602
56978	Apartment	2022-04-21	$749,000	2022-06-21	Undisclosed	2	2	2	6.0		Luton Manuka	214-2-kerridge-street-kingston-act-2604
56984	House	2022-04-21	contact agent	2022-06-01	Undisclosed	2	1	1	0.5	650.0	home.by holly	9-hanson-place-watson-act-2602
56985	House	2022-04-21	$1,210,000	2022-08-25	$1,210,000	5	2	2	0.5		home.by holly	2-flierl-place-flynn-act-2615
56989	House	2022-04-21	Contact Agent	2022-06-08	Undisclosed	3	1	1			VERV Property	15-feint-street-conder-act-2906
56994	Lifestyle	2022-04-21	By Negotiation - Vicinity of $690,000- $720,000	2022-05-25	$735,000	2	1	0		7.16	Marshall and Tacheci Real Estate	120-lyrebird-ridge-road-coolagolite-nsw-2550
56995	House	2022-04-21	Auction	2022-05-18	$1,075,000	3	2	2	1.5	517.0	LJ Hooker Dickson	28-dorrit-black-crescent-lyneham-act-2602
56997	Unit	2022-04-21	$453,000	2022-05-24	$453,000	2	2	2	6.0		home.by holly	115-68-hardwick-crescent-holt-act-2615
56998	House	2022-04-21	Auction	2022-05-07	$1,060,000	4	2	2	1.0	1039.0	One Agency Sandy Morris	12-osmand-street-wanniassa-act-2903
57000	House	2022-04-21	Auction 28/05/2022	2022-05-28	Undisclosed	3	1	2	1.0	833.0	Ray White Canberra	16-molloy-crescent-cook-act-2614
57002	House	2022-04-21	Auction	2022-05-28	Undisclosed	4	2	2	4.0	1104.0	One Agency Sandy Morris	8-tuckson-place-conder-act-2906
57006	House	2022-04-21	SOLD: $800,000	2022-05-25	$800,000	4	3	1	6.0	0.0	Blackshaw Belconnen	11-22-dulcie-holland-crescent-moncrieff-act-2914
57017	House	2022-04-21	By Negotiation	2022-05-05	$1,205,000	4	2	6			Ray White Bungendore	11-hopkins-street-bungendore-nsw-2621
57018	House	2022-04-21	Auction	2022-05-03	Undisclosed	4	2	2	4.5	735.0	Luton Gungahlin	2-kettle-street-gungahlin-act-2912
57029	House	2022-04-21	Auction 10:15am Saturday 7 May	2022-05-07	$1,040,000	3	1	2	4.5	737.0	home.by holly	4-wilari-place-giralang-act-2617
57036	House	2022-04-21	Contact Agent	2022-06-06	$1,100,000	3	1	1	0.0	0.0	Wright Dunn Real Estate	55-lowanna-street-braddon-act-2612
57039	Land	2022-04-21	Contact Agent	2022-07-26	Undisclosed	0	0	0		580.0	Smile Elite	21-birkdale-circuit-sussex-inlet-nsw-2540
57040	House	2022-04-21	$860,000	2022-07-06	$790,000	4	3	2		990.0	Henley Property - Jindabyne	2-kiah-avenue-cooma-nsw-2630
57042	House	2022-04-21	Auction	2022-05-06	$990,000	4	2	2	3.0	654.0	Luton Gungahlin	3-hughes-crescent-ngunnawal-act-2913
57045	Apartment	2022-04-22	By Negotiation	2022-09-12	$740,000	3	2	2			Ray White Queanbeyan | Jerrabomberra	103-189-gorman-drive-googong-nsw-2620
57046	Apartment	2022-04-22	$699,000+	2022-08-19	$665,000	2	2	1	6.0		Luton Gungahlin	132-11-trevillian-quay-kingston-act-2604
57049	House	2022-04-22	Auction 12/05/2022	2022-05-05	$781,000	3	1	2	3.5	660.0	Ray White Canberra	10-landale-place-charnwood-act-2615
57052	Townhouse	2022-04-22	$650,000+	2022-06-03	Undisclosed	3	1	1	2.0		One Agency Sandy Morris	6-49-pinkerton-circuit-kambah-act-2902
57058	House	2022-04-22	$1,209,000+	2022-06-10	$1,175,000	4	2	4	2.5	488.0	Impact Properties	5-john-winter-street-gungahlin-act-2912
57061	Apartment	2022-04-22	$330,000+	2022-07-29	Undisclosed	1	1	1	6.0		Ray White Canberra	26-6-gungahlin-place-gungahlin-act-2912
57065	Unit	2022-04-22	$375,000+	2022-05-18	$392,500	2	1	1	6.0	0.0	LJ Hooker Kaleen	27-2-ranken-place-belconnen-act-2617
57074	House	2022-04-22	Auction 14/05/2022	2022-05-04	$1,450,000	4	2	3	1.0	784.0	Ray White Canberra	37-castlereagh-crescent-macquarie-act-2614
57079	House	2022-04-22	$2,200,000.00	2022-06-24	$2,100,000	7	4	1	1.0	1008.0	One Agency Scott Crossman	41-dalrymple-street-narrabundah-act-2604
57089	House	2022-04-22	$1,050,000	2023-01-20	$1,035,000	5	2	2		600.0	LJ Hooker Batemans Bay	72-courtenay-crescent-long-beach-nsw-2536
57096	House	2022-04-22	$800,000	2022-06-14	$760,000	5	3	6		3.04	One Agency Craig Schofield	2-22-mort-street-bombala-nsw-2632
57098	House	2022-04-22		2022-05-06	Undisclosed	4	3	2		1160.0	Hallmark Real Estate Advisors	19-viewpoint-court-tuross-head-nsw-2537
57100	Livestock	2022-04-22	$1,795,000	2022-09-09	$1,700,000	0	0	0		177.0	Belle Property Braidwood	102-black-sallee-lane-braidwood-nsw-2622
57104	House	2022-04-23	$699,000	2022-05-30	$699,000	4	1	1		855.0	Ray White Batemans Bay	3-sandpiper-place-catalina-nsw-2536
57106	Land	2022-04-23	$495,000	2022-05-03	Undisclosed	0	0	0		1300.0	Whale Coast Realty	21-lamont-young-drive-mystery-bay-nsw-2546
57109	Unit	2022-04-26	$780,000+	2022-07-25	Undisclosed	2	2	2	6.0	0.0	Zango Private Listers	30-2-archibald-street-lyneham-act-2602
57110	Land	2022-04-26	$359,000	2022-08-04	$350,000	0	0	0		1003.0	McCann Properties	15-green-avenue-gunning-nsw-2581
57112	DuplexSemi-detached	2022-04-26	AUCTION	2022-05-19	Undisclosed	3	2	2	3.0	917.0	McIntyre Property	76a-stuart-street-narrabundah-act-2604
57118	House	2022-04-26	AUCTION	2022-06-20	$1,460,000	4	2	3	5.0	1266.0	McIntyre Property	6-macneil-place-kambah-act-2902
57121	House	2022-04-26	$879,000	2022-05-24	$879,000	3	2	3		556.0	Hallmark Real Estate Advisors	10-manly-street-tuross-head-nsw-2537
57122	Apartment	2022-04-26	$550,000	2022-05-31	$550,000	2	1	1	6.0		home.by holly	3-1-pipeclay-street-lawson-act-2617
57123	Townhouse	2022-04-26	Sold $520,000	2022-05-18	$520,000	2	1	1	6.0		Blackshaw Gungahlin	6-27-whitmore-crescent-watson-act-2602
57126	House	2022-04-26	Auction, 15 May 2022	2022-05-15	$933,500	3	2	2	4.0	386.0	Impact Properties	4-myulung-street-ngunnawal-act-2913
57128	Townhouse	2022-04-26	SOLD - $1,475,000	2022-05-21	$1,475,000	4	2	2	5.5		Blackshaw Gungahlin	4-6-farrer-street-braddon-act-2612
57130	House	2022-04-26	Auction	2022-05-19	$1,360,000	4	2	2		1.87	Ray White Rural Canberra | Yass	6-grevillea-close-murrumbateman-nsw-2582
57132	House	2022-04-26	$980,000	2022-07-04	$920,000	4	3	2		696.0	Bella Coastal Property	42-anglers-parade-fishermans-paradise-nsw-2539
57133	House	2022-04-26	Sold off market $1,200,000	2022-06-09	$1,200,000	3	1	2	2.5	745.0	McGrath Canberra	79-bandjalong-crescent-aranda-act-2614
57140	Townhouse	2022-04-26	$429,000-$449,000	2022-07-07	$430,000	1	1	1	6.0		LJ Hooker Manuka	69-39-jerrabomberra-avenue-narrabundah-act-2604
57142	Unit	2022-04-26	$290,000-$320,000	2022-11-03	Undisclosed	2	1	1		64.0	Ray White Queanbeyan | Jerrabomberra	4-88a-fergus-road-karabar-nsw-2620
57150	House	2022-04-26	Contact Agent	2022-07-15	Undisclosed	4	3	2	1.0	695.0	Cream Residential	11-buggy-crescent-mckellar-act-2617
57151	House	2022-04-26	$789,000	2022-11-09	Undisclosed	3	2	1		594.0	Whale Coast Realty	14-john-reilly-street-dalmeny-nsw-2546
57152	Apartment	2022-04-26	By Negotiation	2022-06-10	$530,000	1	1	1	6.0		Impact Properties	509-104-northbourne-avenue-braddon-act-2612
57159	House	2022-04-26	$900,000+	2022-07-12	$890,000	4	2	2	1.0	817.0	Ray White Queanbeyan | Jerrabomberra	20-maltby-circuit-wanniassa-act-2903
57160	House	2022-04-26	$779,000	2022-07-08	$740,000	2	1	3		582.0	LJ Hooker Batemans Bay	7-millers-crescent-moruya-heads-nsw-2537
57161	Unit	2022-04-26	Price Guide $800,000	2022-05-24	$775,000	2	2	2			Sails Real Estate	2-65-main-street-merimbula-nsw-2548
57162	Land	2022-04-26	Contact Agent	2022-05-28	$1,240,000	0	0	0		765.0	Burchell Higgins Property Sales	13-illoura-st-tathra-nsw-2550
57163	Apartment	2022-04-26	AUCTION 21 MAY 2022	2022-05-21	$860,000	2	2	2	6.0	0.0	P & P Real Estate	8-1-provan-street-campbell-act-2612
57167	House	2022-04-27	Contact Agent	2022-07-08	Undisclosed	4	2	3		1129.0	New Wave Property	141-lake-conjola-entrance-road-lake-conjola-nsw-2539
57168	House	2022-04-27	Auction	2022-05-18	$930,000	4	2	0	5.0	886.0	LJ Hooker Belconnen	1-alda-place-melba-act-2615
57169	House	2022-04-27	SOLD	2022-05-31	$800,000	3	1	1		3140.0	Smile Elite	11-duncan-road-numulgi-nsw-2480
57170	House	2022-04-27	$1,099,000 - $1,149,000	2022-06-02	$1,220,000	4	3	2		1211.0	Ray White Queanbeyan | Jerrabomberra	39-mccusker-drive-bungendore-nsw-2621
57171	Unit	2022-04-27	Auction	2022-05-18	$477,000	1	1	1	6.0		LJ Hooker Belconnen	22-35-chandler-street-belconnen-act-2617
57175	Apartment	2022-04-27	$350,000+	2022-05-05	$400,000	1	1	1	6.0		LJ Hooker Canberra City	32-1-gungahlin-place-gungahlin-act-2912
57177	Townhouse	2022-04-27	Auction 19/05/2022	2022-05-19	$760,000	3	2	2	4.5		Ray White Canberra	1-3-fernando-street-bonner-act-2914
57179	Unit	2022-04-27	$210,000- $230,000	2022-09-13	Undisclosed	1	1	1		34.0	Ray White Queanbeyan | Jerrabomberra	6-122-henderson-road-crestwood-nsw-2620
57181	House	2022-04-27	By Negotiation	2022-07-04	$950,000	4	2	3		10.5	Ray White Queanbeyan | Jerrabomberra	101-willandra-lane-tarago-nsw-2580
57183	Apartment	2022-04-27	$360,000+	2022-05-20	Undisclosed	1	1	1	6.0		Morrissey Property	247-1-anthony-rolfe-avenue-gungahlin-act-2912
57184	Apartment	2022-04-27	Auction	2022-05-25	$1,065,000	3	2	2	6.0		LJ Hooker Canberra City	305-6-provan-street-campbell-act-2612
57189	Apartment	2022-04-27	$499,000+	2022-06-03	$542,000	2	2	1	6.0		LJ Hooker Canberra City	55-136-thynne-street-bruce-act-2617
57190	House	2022-04-27	By Negotiation	2022-06-07	$1,050,000	4	2	2		982.0	Ray White Bungendore	5-ellendon-street-bungendore-nsw-2621
57192	DuplexSemi-detached	2022-04-27	$749,000+	2022-08-01	$790,000	3	2	1	6.0	237.0	LJ Hooker Gungahlin	10-gudamang-street-ngunnawal-act-2913
57193	House	2022-04-27	SOLD - $1,190,000	2022-05-15	$1,190,000	5	2	4	4.0	1009.0	Stone Gungahlin	92-ashkanasy-crescent-evatt-act-2617
57200	House	2022-04-27	Auction 18/05/2022	2022-05-18	$1,205,000	3	2	2	2.0		Ray White Canberra	3-coburn-place-isaacs-act-2607
57201	House	2022-04-27	$1,149,000 - $1,249,000	2022-05-31	$1,170,000	4	2	2		748.0	Ian McNamee & Partners - Queanbeyan	42-stringybark-drive-jerrabomberra-nsw-2619
57206	Townhouse	2022-04-27	AUCTION	2022-05-03	Undisclosed	2	1	1	2.5		McIntyre Property	22-29-popplewell-place-gordon-act-2906
57211	House	2022-04-27	Under Offer	2023-03-28	$800,000	3	1	1	1.0	661.0	Bertram Ellis	24-duncan-street-torrens-act-2607
57215	House	2022-04-27	Auction	2022-05-19	$841,000	3	1	1	6.0	748.0	Bertram Ellis	5-epacris-place-rivett-act-2611
57216	House	2022-04-27	Under Offer	2022-07-06	$705,000	3	1	1	0.5	473.0	Bertram Ellis	27-le-souef-crescent-florey-act-2615
57217	House	2022-04-27	Guide $1,200,000	2022-06-16	$1,225,000	4	2	2		1000.0	Ray White Bowral	6-bronwyn-place-bowral-nsw-2576
57220	House	2022-04-27	By Negotiation	2022-09-02	Undisclosed	3	2	4	4.5	469.0	Impact Properties	6-chipperfield-circuit-gordon-act-2906
57221	House	2022-04-27	$695,000	2022-08-10	Undisclosed	3	3	1		1442.0	Henley Property - Cooma	16-elizabeth-street-cooma-nsw-2630
57223	Land	2022-04-27	Online Auction - 19-5-22	2022-05-19	$950,000	0	0	0	0.0	662.0	Independent Gungahlin	11-borovansky-street-whitlam-act-2611
57224	Townhouse	2022-04-27	$1,375,000	2022-09-29	Undisclosed	4	2	2	5.0		Ray White Canberra	2-9-borrowdale-street-red-hill-act-2603
57225	House	2022-04-27	UNDER OFFER $845,000	2022-06-21	$845,000	3	2	2	0.0	578.0	All Real Estate NSW	52-cooma-street-queanbeyan-nsw-2620
57226	Unit	2022-04-27	$675,000 - $730,000	2022-05-21	Undisclosed	2	2	1	5.0		One Agency Gamarra & Co	1-79-torrens-street-braddon-act-2612
57227	House	2022-04-28	$2,007,000	2022-05-31	$2,007,000	4	1	2	2.5	1036.0	Blackshaw Gungahlin	50-amaroo-street-reid-act-2612
57229	House	2022-04-28	Auction 21/05/2022	2022-05-21	Undisclosed	3	1	2	1.5	923.0	Ray White Canberra	4-meiklejohn-place-flynn-act-2615
57234	House	2022-04-28	Auction	2022-05-21	Undisclosed	4	2	4	1.5	1316.0	Solely Properties	85-learmonth-drive-kambah-act-2902
57235	House	2022-04-28	AUCTION	2022-05-18	$725,000	3	1	4	4.5	718.0	McIntyre Property	7-altson-circuit-conder-act-2906
57237	House	2022-04-28	SOLD $1,085,000	2022-05-21	$1,085,000	4	2	2	4.0	892.0	Blackshaw Belconnen	16-murrell-place-flynn-act-2615
57238	Unit	2022-04-28	$585,000	2022-08-02	$605,000	2	1	1			Fraser-Gray Real Estate	3-20-cambridge-crescent-broulee-nsw-2537
57240	House	2022-04-28	Auction	2022-05-18	$1,170,000	4	3	2	6.0	0.0	Confidence Real Estate	11-warup-street-moncrieff-act-2914
57242	House	2022-04-28	AUCTION	2022-05-20	$1,080,000	4	2	2	2.5		Michael Potter Real Estate	22-charleston-street-monash-act-2904
57243	Townhouse	2022-04-28	Auction 19/05/2022	2022-05-19	Undisclosed	3	2	2	6.0		Ray White Canberra	106-1-rowland-rees-crescent-greenway-act-2900
57246	House	2022-04-28	$1,525,000+	2022-06-14	Undisclosed	4	2	2	6.0	506.0	Bastion Property Group	26-chipp-street-coombs-act-2611
57247	House	2022-04-28	Auction Thursday 19th May at 6pm	2022-05-19	$825,000	3	1	3	1.0	719.0	McCann Properties	73-wheeler-crescent-wanniassa-act-2903
57250	Townhouse	2022-04-28	$769,000	2022-09-05	Undisclosed	2	1	1	2.5	443.0	Luton Tuggeranong	2-34-bindel-street-aranda-act-2614
57251	Townhouse	2022-04-28	$769,000	2022-08-10	Undisclosed	2	1	1	2.5	402.0	Luton Tuggeranong	1-34-bindel-street-aranda-act-2614
57252	Apartment	2022-04-28	$489,000 - $519,000	2022-07-01	Undisclosed	1	1	1	6.0		Ray White Canberra	1-18-devonport-street-lyons-act-2606
57253	Townhouse	2022-04-28	$580,000+	2022-08-19	$585,000	2	2	2	6.0	226.0	LJ Hooker Gungahlin	3-71-lawrenson-circuit-jacka-act-2914
57254	Unit	2022-04-28	$450,000	2022-08-02	$415,000	2	1	0		1378.0	Sails Real Estate	1-4-cameron-street-merimbula-nsw-2548
57255	House	2022-04-28	Auction	2022-05-21	$1,175,000	4	2	2	2.0	1212.0	Bertram Ellis	24-ironside-street-weston-act-2611
57256	House	2022-04-28	SOLD at Auction $1,760,000	2022-05-21	$1,760,000	5	3	2	4.5		New Door Properties	44-zanci-street-crace-act-2911
57257	House	2022-04-28	Auction	2022-05-20	Undisclosed	4	2	2	4.5	480.0	Luton Tuggeranong	20-stump-jump-crescent-dunlop-act-2615
57258	House	2022-04-28	$950,000+	2022-05-20	Undisclosed	4	2	2	2.0	1291.0	McIntyre Property	27-fingleton-crescent-gordon-act-2906
57261	House	2022-04-28	PRICE GUIDE $1,000,000	2022-06-24	$980,000	3	1	2		668.0	Tathra Beach Real Estate	3-stafford-crescent-tathra-nsw-2550
57263	House	2022-04-28	AUCTION Saturday, May 21 at 10:00am	2022-05-21	Undisclosed	4	2	2	4.0	518.0	LJ Hooker Gungahlin	26-djerrkura-street-bonner-act-2914
57265	House	2022-04-28	Auction	2022-05-18	Undisclosed	4	1	1	1.0	721.0	Luton Gungahlin	93-davenport-street-dickson-act-2602
57266	House	2022-04-28	Auction	2022-05-21	$915,000	3	2	2	5.5	326.0	Luton Kippax	110-lionel-rose-street-holt-act-2615
57267	House	2022-04-28	$1,190,000	2022-06-06	$1,190,000	4	2	2	3.0	747.0	Luton Tuggeranong	10-orange-thorn-crescent-banks-act-2906
57270	House	2022-04-28	Auction	2022-05-21	Undisclosed	4	2	2	3.0	1281.0	Luton Tuggeranong	26-greeves-street-wanniassa-act-2903
57271	House	2022-04-28	Auction 28/05/2022	2022-05-23	Undisclosed	3	1	1	1.0	767.0	Ray White Canberra	28-longworth-place-holt-act-2615
57272	House	2022-04-28	Auction 28/05/2022	2022-05-28	Undisclosed	4	2	2	2.0	865.0	Ray White Canberra	20-prescott-street-farrer-act-2607
57276	Apartment	2022-04-28	$400,000+	2022-08-09	$414,000	1	1	1	6.0	0.0	Wright Dunn Real Estate	54-35-37-torrens-street-braddon-act-2612
57278	Townhouse	2022-04-28	$1,075,000	2022-06-15	$1,075,000	4	2	2	1.5		home.by holly	9-146-shackleton-circuit-mawson-act-2607
57282	House	2022-04-28	$715,000+	2022-06-06	$720,000	3	1	2	1.0	603.0	LJ Hooker Tuggeranong	51-sherwood-circuit-gordon-act-2906
57284	House	2022-04-28	$850,000+	2022-08-09	$835,000	4	2	1	1.5	817.0	LJ Hooker Tuggeranong	8-mighell-place-theodore-act-2905
57285	Apartment	2022-04-28	Auction on 21st May, 11:00AM	2022-05-21	Undisclosed	4	2	2	6.0		LJ Hooker Manuka	319-1-kalma-way-campbell-act-2612
57296	House	2022-04-28	$1,300,000	2022-07-29	$1,300,000	3	1	2	0.5	529.0	home.by holly	10a-hargraves-crescent-ainslie-act-2602
57298	Land	2022-04-28	$625,000	2022-05-31	$636,000	0	0	0		854.0	Henley Property - Jindabyne	43-jillamatong-street-jindabyne-nsw-2627
57300	House	2022-04-28	Auction 21/05/2022	2022-05-04	$655,000	3	1	1	5.0	313.0	Ray White Canberra	7-birrigai-square-ngunnawal-act-2913
57304	Apartment	2022-04-28	$530,000+	2022-05-26	$550,000	2	2	1	6.0		LJ Hooker Tuggeranong	223-12-limburg-way-greenway-act-2900
57307	Apartment	2022-04-28	$399,000+	2022-05-25	Undisclosed	1	1	1	6.0		Badenoch Real Estate	110-7-irving-street-phillip-act-2606
57311	House	2022-04-28	SOLD	2022-05-21	$1,500,000	5	3	2		350.0	Smile Elite	10-xuereb-street-schofields-nsw-2762
57312	Unit	2022-04-28	Contact Agent	2022-08-24	$513,000	2	1	1			Smile Elite	6-6-toxana-street-richmond-nsw-2753
57319	Apartment	2022-04-28	Auction	2022-05-19	$690,000	3	2	2	4.0	91.0	LJ Hooker Woden/Weston	18-37-39-ainsworth-street-mawson-act-2607
57324	House	2022-04-28	$639,000 - $679,000	2022-06-02	$675,000	4	1	1	0.0	698.0	Ian McNamee & Partners - Queanbeyan	10-cassia-crescent-karabar-nsw-2620
57326	House	2022-04-28	Auction 19/05/2022	2022-05-19	$680,000	3	1	1	5.0	365.0	Ray White Canberra	2-toft-street-dunlop-act-2615
57327	House	2022-04-28	Price Guide $980,000	2022-08-03	Undisclosed	4	2	2		992.0	InHouse Real Estate	4-bimmil-st-eden-nsw-2551
57328	House	2022-04-29	1637000	2022-05-29	$1,637,000	7	4	2	1.5	1991.0	Maria Selleck Properties	11-castlereagh-crescent-macquarie-act-2614
57335	House	2022-04-29	Auction 28/05/2022	2022-05-20	$695,000	3	1	1	6.0	293.0	Ray White Canberra	1-jeff-snell-crescent-dunlop-act-2615
57336	Apartment	2022-04-29	$1,000,000	2022-05-31	$1,000,000	2	2	2	6.0		home.by holly	1201-19-marcus-clarke-street-city-act-2601
57337	House	2022-04-29	679,000.00	2022-08-01	$650,000	3	2	5		4097.0	LJ Hooker Tuross Head	32-princes-highway-bodalla-nsw-2545
57343	Apartment	2022-04-29	$619,000 - $639,000	2022-08-02	Undisclosed	2	1	1	6.0		LJ Hooker Manuka	10-16-eyre-street-griffith-act-2603
57348	House	2022-04-29	Auction - 28/5/2022	2022-05-24	Undisclosed	4	2	2		789.0	Ian McNamee & Partners - Queanbeyan	24-carolyn-jackson-drive-jerrabomberra-nsw-2619
57351	House	2022-04-29	$640,000+	2022-05-19	$660,000	2	1	1	6.0	270.0	LJ Hooker Gungahlin	25-bamir-square-ngunnawal-act-2913
57358	House	2022-04-29	$880,000	2022-07-12	$840,000	4	1	1			LJ Hooker Moruya	14-emmott-street-moruya-nsw-2537
57362	House	2022-04-29	$700,000	2022-06-29	Undisclosed	2	1	4		3010.0	Elders Real Estate Tathra	157-shady-lane-kalaru-nsw-2550
57363	Townhouse	2022-04-29	Contact Agent	2022-08-23	$500,000	2	1	1			Smile Elite	3-141-havannah-street-bathurst-nsw-2795
57364	House	2022-04-29	SOLD	2022-05-24	$699,000	2	1	1		835.0	Smile Elite	29-anglers-parade-fishermans-paradise-nsw-2539
57365	House	2022-04-29	SOLD	2022-06-09	$660,000	3	1	2		894.0	Smile Elite	27-kurumben-place-west-bathurst-nsw-2795
57366	House	2022-04-29	$495,000	2022-08-03	$495,000	3	1	1		834.0	One Agency Craig Schofield	23-harris-street-cooma-nsw-2630
57374	House	2022-04-29	AUCTION - 17 June 2022	2022-06-16	$1,575,000	7	2	4		2694.0	Ray White Goulburn	62-64-mundy-street-goulburn-nsw-2580
57386	House	2022-05-01	$910,000	2022-05-02	$910,000	3	2	2			Sails Real Estate	14-tern-close-merimbula-nsw-2548
57387	House	2022-05-01	$1,290,000	2022-07-11	$1,270,000	3	2	2		1043.0	Sails Real Estate	14-the-dress-circle-tura-beach-nsw-2548
57391	House	2022-05-02	Contact Agent!	2022-08-15	Undisclosed	3	1	3		506.0	Raine & Horne Young	169-neill-street-harden-nsw-2587
57392	House	2022-05-02	$550,000	2022-06-02	Undisclosed	3	2	1		1012.0	Whale Coast Realty	19-princes-highway-north-narooma-nsw-2546
57393	House	2022-05-02	$1,050,000 - $1,100,000	2022-06-03	$980,000	4	2	1		835.0	My Agent Team	70-northcove-road-long-beach-nsw-2536
57400	House	2022-05-02	$870,000	2022-05-02	$870,000	5	3	2		720.0	Raine & Horne Goulburn	6-vincent-avenue-goulburn-nsw-2580
57401	Lifestyle	2022-05-02	$825,000	2022-05-25	$825,000	3	2	4		8.25	Belle Property Braidwood	45-tea-tree-road-braidwood-nsw-2622
57402	House	2022-05-02	Auction 28/05/2022	2022-05-28	Undisclosed	5	2	2	3.0	1446.0	Ray White Canberra	28-crichton-crescent-kambah-act-2902
57403	House	2022-05-02	Price Withheld	2022-08-25	Undisclosed	5	3	2	4.5	429.0	One Agency Gungahlin	25-hyslop-crescent-casey-act-2913
57405	Unit	2022-05-02	sold $375,000	2022-05-28	$375,000	2	1	1			Blackshaw Queanbeyan & Jerrabomberra	22-3-5-davison-street-crestwood-nsw-2620
57407	Townhouse	2022-05-02	SOLD $600,000	2022-05-28	$600,000	2	1	1		159.0	Blackshaw Queanbeyan & Jerrabomberra	2-41-ross-road-queanbeyan-nsw-2620
57410	Lifestyle	2022-05-02	$795,000	2022-08-16	Undisclosed	2	2	0		12.39	LAWD	125-rogerson-lane-binalong-nsw-2584
57412	Apartment	2022-05-02	$350,000+	2022-06-07	$361,000	1	1	1	6.0		LJ Hooker Canberra City	118-140-thynne-street-bruce-act-2617
57415	Land	2022-05-02	$310,000	2022-09-26	$300,000	0	0	0		2318.0	LJ Hooker Moruya	8-spinnaker-place-moruya-heads-nsw-2537
57417	House	2022-05-02	AUCTION - 3rd June 2022	2022-05-20	$790,000	3	2	2		1296.0	Ray White Goulburn	48-cathcart-street-goulburn-nsw-2580
57422	House	2022-05-02	$810,000	2022-05-20	$787,000	3	1	2			Henley Property - Berridale	10-jindalee-street-berridale-nsw-2628
57423	House	2022-05-02	$810,000	2022-05-20	$787,000	3	1	2			Henley Property - Cooma	10-jindalee-street-berridale-nsw-2628
57426	Apartment	2022-05-02	$495,500	2022-06-07	$495,500	2	1	1	6.0		Luton Dickson	braddon-2612-act
57439	Lifestyle	2022-05-03	Auction	2022-07-18	$1,800,000	3	1	12		150.0	Ray White Goulburn	783-bannister-lane-goulburn-nsw-2580
57442	House	2022-05-03	$1.6m - $1.7m	2022-05-17	$1,625,000	4	3	2		1185.0	Sails Real Estate	146-mirador-drive-merimbula-nsw-2548
57443	Townhouse	2022-05-03	Auction	2022-06-01	$630,000	1	1	1	6.0		LJ Hooker Canberra City	11-3-banjine-street-oconnor-act-2602
57446	House	2022-05-03	By Openn Negotiation	2022-05-24	Undisclosed	3	2	1		677.0	Whale Coast Realty	9-field-street-narooma-nsw-2546
57448	House	2022-05-03	$939,000	2022-05-17	$939,000	3	2	1	6.0	391.0	Hugo. Canberra	6-powley-street-casey-act-2913
57449	House	2022-05-03	$959,000+	2022-06-28	Undisclosed	4	2	2	5.0	693.0	Ray White Canberra	27-mentone-view-conder-act-2906
57450	Unit	2022-05-03	$650,000-$705,000	2022-05-25	Undisclosed	2	2	1	6.0		One Agency Gamarra & Co	617-1-elouera-street-braddon-act-2612
57451	House	2022-05-03	$1,050,000 - $1,100,000	2022-09-08	Undisclosed	4	2	1		607.03	Bella Coastal Property	32-murramarang-road-bawley-point-nsw-2539
57453	DuplexSemi-detached	2022-05-03	SOLD	2022-06-30	$1,350,000	4	3	2			Smile Elite	110-the-promontory-drive-shell-cove-nsw-2529
57454	House	2022-05-03	Auction Saturday 28th May at 10:00am, On Site	2022-05-28	$840,000	3	2	1	4.5	423.0	Cream Residential	193-clive-steele-avenue-monash-act-2904
57457	House	2022-05-03	Auction 28/05/2022	2022-05-28	$865,000	3	2	2	6.0	450.0	Ray White Canberra	59-bryan-hudson-street-macgregor-act-2615
57462	Townhouse	2022-05-03	SOLD - $642,500	2022-05-31	$642,500	2	2	1	6.0		Stone Gungahlin	1-2-neil-currie-street-casey-act-2913
57464	Apartment	2022-05-03	$490,000 - $510,000	2022-05-31	$490,000	2	1	1		2953.0	LJ Hooker Woden/Weston	16-94-collett-street-queanbeyan-nsw-2620
57468	House	2022-05-03	$930,000 - $980,000	2022-07-04	$930,000	3	2	2		811.0	My Agent Team	36-peninsula-drive-north-batemans-bay-nsw-2536
57470	Unit	2022-05-03	$899,000	2022-05-03	$899,000	3	2	2			Sails Real Estate	3-5-cameron-street-merimbula-nsw-2548
57473	Land	2022-05-03	BIDDING GUIDE $1,000,000	2022-06-04	$1,665,000	0	0	0		2406.0	My Agent Team	38-peninsula-drive-north-batemans-bay-nsw-2536
57478	Apartment	2022-05-03	$450,000	2022-07-22	Undisclosed	2	2	1	6.0		Ray White Canberra	greenway-2900-act
57480	Unit	2022-05-03	SOLD	2022-06-10	$455,000	2	1	1	4.5		Cream Residential	20-4-heard-street-mawson-act-2607
57481	House	2022-05-03	Contact Agent	2022-05-03	Undisclosed	3	1	2		784.1	Raine & Horne Young	5-willawong-street-young-nsw-2594
57485	House	2022-05-03	New Price $575,000	2022-10-26	$570,000	3	1	1		727.0	Henley Property - Berridale	1-pryce-street-berridale-nsw-2628
57486	House	2022-05-03	New Price $575,000	2022-10-26	$570,000	3	1	1		727.0	Henley Property - Cooma	1-pryce-street-berridale-nsw-2628
57489	Apartment	2022-05-03	By Negotiation	2022-07-06	$510,000	2	2	1	6.0	0.0	LJ Hooker Gungahlin	66-2-hinder-street-gungahlin-act-2912
57490	Apartment	2022-05-03	$430,000.00	2022-05-03	$430,000	1	1	1	6.0		One Agency Gungahlin	8-50-hillcrest-street-crace-act-2911
57491	Townhouse	2022-05-03	$770,000.00	2022-05-03	$770,000	3	2	1	6.0		One Agency Gungahlin	6-17-margaret-tucker-street-bonner-act-2914
57492	House	2022-05-03	$1,000,000	2023-11-14	Undisclosed	4	2	6		556.0	Smile Elite	111-jacobs-drive-sussex-inlet-nsw-2540
57493	House	2022-05-04	AUCTION	2022-05-20	$1,750,000	4	2	2	5.0	548.0	Michael Potter Real Estate	13-david-fleay-street-wright-act-2611
57494	House	2022-05-04	Auction	2022-05-26	Undisclosed	4	2	2	3.0	931.0	Luton Weston Creek & Molonglo Valley	47-ballarat-street-fisher-act-2611
57496	House	2022-05-04	SOLD	2022-06-16	Undisclosed	3	1	2		651.0	Smile Elite	107-kerry-street-sanctuary-point-nsw-2540
57497	Apartment	2022-05-04	$425,000+	2022-07-28	Undisclosed	2	2	2	6.0		Ray White Canberra	121-68-hardwick-crescent-holt-act-2615
57498	House	2022-05-04	$932,000	2022-07-04	$932,000	3	1	2	4.0	813.0	home.by holly	15-keartland-street-page-act-2614
57499	House	2022-05-04	$1,430,000+	2022-06-13	$1,430,000	5	3	2	2.5	784.0	McGrath Canberra	10-buderim-place-palmerston-act-2913
57500	Townhouse	2022-05-04	Auction	2022-05-21	$825,000	3	1	1	2.0	299.0	LJ Hooker Belconnen	4-greene-place-belconnen-act-2617
57501	House	2022-05-04	Auction	2022-05-21	$1,285,000	4	2	3	3.5	1077.0	LJ Hooker Belconnen	7-wilkinson-street-flynn-act-2615
57502	House	2022-05-04	Contact Agent	2022-07-04	Undisclosed	3	1	2	1.5	664.0	Ray White Canberra	24-westhoven-street-higgins-act-2615
57504	House	2022-05-04	$950,000	2022-05-26	$950,000	4	2	2	5.0	499.0	Bastion Property Group	27-mundang-crescent-ngunnawal-act-2913
57505	House	2022-05-04	Auction	2022-05-28	$1,175,000	4	2	2	6.0	457.0	Luton Gungahlin	31-kubbadang-street-ngunnawal-act-2913
57508	House	2022-05-04	Price Guide $595,000 - $645,000	2022-05-25	$612,500	3	1	1		563.0	Raine & Horne Southern Highlands	54-cumberteen-street-hill-top-nsw-2575
57509	House	2022-05-04	Sold - $1,175,000	2022-05-31	$1,175,000	4	2	2	6.0	492.0	Stone Gungahlin	15-sphinx-street-harrison-act-2914
57511	House	2022-05-04	$1,100,000+	2022-06-28	$1,150,000	5	2	5	2.0	970.0	McCann Properties	30-longmore-crescent-wanniassa-act-2903
57514	House	2022-05-04	AUCTION	2022-05-18	$775,000	3	1	2	2.0	799.0	McIntyre Property	10-harford-street-richardson-act-2905
57516	House	2022-05-04	$1,121,000	2022-05-24	$1,121,000	4	2	2	4.0	481.0	McGrath Canberra	18-haven-street-harrison-act-2914
57517	House	2022-05-04	Auction	2022-05-28	Undisclosed	3	1	1	0.5	755.0	Luton Manuka	536-northbourne-avenue-downer-act-2602
57518	Townhouse	2022-05-04	$729,000+	2022-06-29	Undisclosed	3	2	2	6.0		LJ Hooker Tuggeranong	87-woodberry-avenue-coombs-act-2611
57521	House	2022-05-04	Auction: Thursday 26th May 6.30pm	2022-05-26	$710,000	2	2	1	6.0		McGrath Canberra	124-stockman-avenue-lawson-act-2617
57522	House	2022-05-04	Price Guide $1,000,000 to $1,100,000	2022-06-09	$1,100,000	3	3	4		999.0	One Agency Dwyer Properties	24-collins-street-merimbula-nsw-2548
57524	House	2022-05-04	SOLD $1,010,000	2022-05-26	$1,010,000	4	2	2	1.5	685.0	Blackshaw Belconnen	29-barnard-circuit-florey-act-2615
57525	House	2022-05-04	Auction	2022-06-01	$1,082,000	5	2	2	2.0	1062.0	LJ Hooker Kippax	17-powers-place-latham-act-2615
57528	House	2022-05-04	Auction	2022-05-28	$2,350,000	4	3	6		30.28	Luton Tuggeranong	1735-old-cooma-road-royalla-nsw-2620
57530	House	2022-05-04	Auction 28th May at 10:00am	2022-05-28	$1,220,000	4	2	2	1.5	747.0	LJ Hooker Tuggeranong	25-william-hudson-crescent-monash-act-2904
57531	House	2022-05-04	$399,000	2022-09-08	Undisclosed	3	1	4		5185.0	Raine & Horne Young	4707-olympic-highway-young-nsw-2594
57532	Townhouse	2022-05-04	Auction - 21 May at 12.30pm	2022-05-16	$688,000	3	1	2	1.0	213.0	LJ Hooker Tuggeranong	3-54-deamer-crescent-richardson-act-2905
57534	House	2022-05-04	Sold at Auction $830,000	2022-05-28	$830,000	3	2	1	4.0		McGrath Canberra	59-neil-currie-street-casey-act-2913
57535	Unit	2022-05-04	Price Guide $475000	2022-08-02	$445,000	2	1	1		838.0	One Agency Dwyer Properties	1-51-monaro-street-merimbula-nsw-2548
57536	House	2022-05-04	Auction	2022-05-28	$1,150,000	4	2	2	1.5	800.0	Bertram Ellis	49-fowles-street-weston-act-2611
57537	House	2022-05-04	Auction	2022-05-28	$1,000,000	3	1	1	4.0	902.0	Bertram Ellis	17-souter-place-weston-act-2611
57538	House	2022-05-04	$475,000+	2022-07-13	Undisclosed	2	2	1	6.0	7380.0	Ray White Canberra	269-1-anthony-rolfe-avenue-gungahlin-act-2912
57540	House	2022-05-04	Auction Sunday 29th May at 12:30pm	2022-05-29	$624,000	3	2	0		2000.0	McCann Properties	130-yass-street-gunning-nsw-2581
57547	House	2022-05-04	$709,000	2022-07-22	$700,000	3	2	1	0.0	1000.0	McCann Properties	94-yass-street-gunning-nsw-2581
57551	House	2022-05-04	$735,000	2022-05-19	Undisclosed	3	2	2		555.0	Professionals Batemans Bay	35-dominic-drive-batehaven-nsw-2536
57553	House	2022-05-04	Contact Agent	2022-08-05	$320,000	4	2	4		780.0	Smile Elite	109-terania-street-north-lismore-nsw-2480
57554	Townhouse	2022-05-04	UNDER OFFER	2022-07-06	Undisclosed	3	2	2	6.0		New Door Properties	76-29-jimmy-little-street-moncrieff-act-2914
57559	Townhouse	2022-05-04	Sold for $590,000	2022-08-08	$590,000	2	1	2			McGrath Canberra	2-21-elm-way-jerrabomberra-nsw-2619
57568	House	2022-05-04	Auction	2022-05-28	$695,000	3	2	1	0.5	382.0	LJ Hooker Belconnen	13-burge-close-holt-act-2615
57571	Cropping	2022-05-04	$899,000	2022-06-10	Undisclosed	0	0	1			Ray White Goulburn	143-breadalbane-road-goulburn-nsw-2580
57573	House	2022-05-05	Sold $964,000	2022-05-21	$964,000	4	2	2	4.0	472.0	Blackshaw Gungahlin	8-bendora-crescent-palmerston-act-2913
57574	Apartment	2022-05-05	$418,500+	2022-05-19	$418,500	1	1	1	3.5		McGrath Canberra	4-44-otway-street-harrison-act-2914
57576	House	2022-05-05	Auction 04/06/2022	2022-06-04	Undisclosed	4	2	2	4.0	803.0	Ray White Canberra	1-solus-place-palmerston-act-2913
57577	Apartment	2022-05-05	Auction	2022-05-28	$430,000	2	1	1	4.5		Solely Properties	8-7-hyndes-crescent-holder-act-2611
57579	Apartment	2022-05-05	$595,000+	2022-06-10	Undisclosed	2	1	1	6.0		VERV Property	221-24-lonsdale-street-braddon-act-2612
57580	Apartment	2022-05-05	$399,900+	2022-06-02	$460,500	1	1	1	6.0		LJ Hooker Canberra City	55-25-john-gorton-drive-wright-act-2611
57581	House	2022-05-05	$879,000+	2022-05-28	$912,000	3	2	1	1.0	716.0	LJ Hooker Kippax	43-hinkler-street-scullin-act-2614
57582	Lifestyle	2022-05-05	Contact Agent	2022-08-10	$770,000	2	1	10		144.5	Smile Elite	931-swan-bay-new-italy-road-new-italy-nsw-2472
57583	Townhouse	2022-05-05	Auction 28/05/2022	2022-05-28	$770,000	3	2	2	3.5		Ray White Canberra	10-47-slessor-crescent-mckellar-act-2617
57586	House	2022-05-05	$620,000	2022-07-18	$605,000	3	2	0		1359.0	Henley Property - Cooma	63-bent-street-cooma-nsw-2630
57587	Townhouse	2022-05-05	Auction 19/05/2022	2022-05-19	$653,500	2	1	1	2.5		Ray White Canberra	1-33-hargrave-street-scullin-act-2614
57588	Townhouse	2022-05-05	$755,000	2022-05-17	$755,000	2	2	2	5.0		home.by holly	38-1-skuta-place-denman-prospect-act-2611
57589	Townhouse	2022-05-05	Auction Sat, 28th May at 1:00pm	2022-05-28	$709,000	2	1	2	6.0	227.0	LJ Hooker Gungahlin	32-hibberd-crescent-forde-act-2914
57590	Land	2022-05-05	$379,000	2022-05-31	$372,000	0	0	0		482.0	Ray White Batemans Bay	71-freycinet-drive-sunshine-bay-nsw-2536
57591	House	2022-05-05	$2,100,000 to $2,225,000	2022-08-09	Undisclosed	5	2	12		3.33	Rapport Property	73-royalla-drive-royalla-nsw-2620
57593	House	2022-05-05	Auction	2022-05-21	Undisclosed	4	2	2	4.0	786.0	Blackshaw Belconnen	11-challinor-crescent-florey-act-2615
57594	House	2022-05-05	Auction	2022-06-01	$1,075,000	3	2	0	1.0	844.0	LJ Hooker Kaleen	9-tweed-place-kaleen-act-2617
57597	House	2022-05-05	Auction	2022-05-19	Undisclosed	4	2	2	5.0	700.0	Luton Gungahlin	25-tarrabool-street-amaroo-act-2914
57598	House	2022-05-05	AUCTION	2022-05-27	$1,100,000	4	2	2	2.5	1288.0	McIntyre Property	95-lewis-luxton-avenue-gordon-act-2906
57601	House	2022-05-05	SOLD PRIOR AUCTION - CONTACT AGENT	2022-05-24	Undisclosed	4	1	2	2.0	812.0	New Door Properties	9-fallins-place-monash-act-2904
57602	House	2022-05-05	Auction	2022-05-26	$1,200,000	4	1	2	1.0	924.0	Luton Gungahlin	9-blackman-crescent-macquarie-act-2614
57603	Apartment	2022-05-05	$542,500	2022-05-20	$542,500	1	1	1	6.0		home.by holly	319-24-lonsdale-street-braddon-act-2612
57607	Townhouse	2022-05-05	$620,000+	2022-09-02	$625,000	2	2	1	6.0	117.0	LJ Hooker Dickson	29-hedditch-court-strathnairn-act-2615
57609	House	2022-05-05	$1,050,000+	2022-11-17	$1,000,000	4	1	1	1.0	694.0	LJ Hooker Dickson	203-phillip-avenue-hackett-act-2602
57610	Apartment	2022-05-05	$380,000	2022-06-24	$380,000	1	1	0	6.0		home.by holly	713-39-london-circuit-city-act-2601
57611	House	2022-05-05	$890,000+	2022-07-18	$875,000	4	2	1	0.0	0.0	McIntyre Property	16-mountain-circuit-calwell-act-2905
57615	Townhouse	2022-05-05	By Negotiation	2022-06-09	$755,000	3	2	2	6.0		New Door Properties	9-17-pickup-close-casey-act-2913
57619	Townhouse	2022-05-05	Auction 26/05/2022	2022-05-26	Undisclosed	2	1	2	6.0	1571.5	Ray White Canberra	4-30-lyttleton-crescent-cook-act-2614
57620	House	2022-05-05	$795,000	2022-07-01	$795,000	4	2	2		847.0	Belle Property Braidwood	70-cowper-street-braidwood-nsw-2622
57622	House	2022-05-05	On site 1:30pm Saturday 28th May	2022-05-28	Undisclosed	4	2	2	4.0		home.by holly	34-selwyn-street-hackett-act-2602
57623	House	2022-05-05	Auction 19/5/22	2022-05-20	$825,000	3	1	1		701.0	Ian McNamee & Partners - Queanbeyan	162-donald-road-karabar-nsw-2620
57627	House	2022-05-05	Auction 26/05/2022	2022-05-26	$1,085,000	4	2	2	4.5	782.3	Ray White Canberra	57-ligertwood-street-evatt-act-2617
57630	House	2022-05-05	$1,015,000+	2022-06-21	$1,010,000	3	2	6	1.0	828.0	Impact Properties	137-chuculba-crescent-giralang-act-2617
57631	Apartment	2022-05-05	$380,000	2022-06-10	$380,000	1	1	1	5.5		home.by holly	58-31-thynne-street-bruce-act-2617
57634	House	2022-05-05	$990,000 - $1,080,000	2022-05-16	Undisclosed	4	2	2		792.0	My Agent Team	28-parker-avenue-surf-beach-nsw-2536
57636	House	2022-05-05	$1,500,000	2022-10-11	$1,400,000	4	2	1	5.5	700.0	Ward Estate Agents	6-grevillea-street-oconnor-act-2602
57641	Cropping	2022-05-05	EOI	2022-05-03	Undisclosed	0	0	0		652.7	LAWD	narromine-2821-nsw
57643	Apartment	2022-05-06	$359,000+	2022-06-03	Undisclosed	1	1	1	6.0		Luton Weston Creek & Molonglo Valley	82-20-fairhall-street-coombs-act-2611
57644	House	2022-05-06	SOLD $1,435,000	2022-05-25	$1,435,000	5	2	2	3.5	822.0	Ward Estate Agents	140-paul-coe-crescent-ngunnawal-act-2913
57645	Apartment	2022-05-06	$415,000	2022-07-22	Undisclosed	1	1	1	6.0		Ray White Canberra	7-11-forbes-street-turner-act-2612
57646	House	2022-05-06	$765,000	2022-09-26	$765,000	3	2	2		601.0	Clearwater Real Estate Narooma	34-manly-st-tuross-head-nsw-2537
57648	Townhouse	2022-05-06	$630,000+	2022-05-25	$677,000	3	1	1	2.0	444.0	LJ Hooker Kippax	3-111-keverstone-circuit-isabella-plains-act-2905
57653	House	2022-05-06	$1,200,000 - $1,250,000	2022-05-23	$1,250,000	3	2	1		575.0	My Agent Team	28-moorong-crescent-malua-bay-nsw-2536
57657	House	2022-05-06	$1,000,000-$1,080,000	2022-07-01	$950,000	4	2	2		654.0	Bella Coastal Property	37-walpole-avenue-ulladulla-nsw-2539
57666	House	2022-05-06	$1,260,000	2022-06-03	$1,260,000	4	2	2	0.0	1326.0	Berkely Residential	9-jasmine-garden-jerrabomberra-nsw-2619
57667	Apartment	2022-05-06	Auction	2022-06-01	$485,000	1	1	1	6.0	0.0	LJ Hooker Canberra City	2-7-lowanna-street-braddon-act-2612
57673	Townhouse	2022-05-06	Auction	2022-05-28	$997,500	4	2	2	3.0	574.0	LJ Hooker Woden/Weston	128-de-little-circuit-greenway-act-2900
57674	House	2022-05-06	Auction	2022-06-22	$1,100,000	3	1	1	0.0	694.0	LJ Hooker Dickson	45-williams-street-watson-act-2602
57678	House	2022-05-06	Auction Wed 18th May 6PM	2022-05-18	$1,635,000	3	1	2		1107.0	Ray White Bowral	29-clearview-street-bowral-nsw-2576
57682	House	2022-05-06	Contact Agent	2022-06-07	$1,500,000	4	3	2		847.0	Raine & Horne Southern Highlands	11-payten-street-mittagong-nsw-2575
57683	House	2022-05-06	Guide $695,000	2022-06-10	$690,000	2	1	0		695.6	Ray White Bowral	11-melbourne-street-new-berrima-nsw-2577
57688	Townhouse	2022-05-06	Auction 04/06/2022	2022-06-04	$1,155,000	3	2	2	6.0	0.0	LJ Hooker Dickson	185-50-ellenborough-street-lyneham-act-2602
57690	House	2022-05-06	SOLD	2022-06-01	$1,072,000	4	2	2		438.0	Smile Elite	36-hennesy-street-flinders-nsw-2529
57692	House	2022-05-07	$599,000 - $629,000	2022-06-10	$615,000	3	1	1		861.0	Ray White Batemans Bay	13-queen-street-moruya-nsw-2537
57707	House	2022-05-09	$639,000	2022-07-06	$639,000	3	1	1		1016.0	LJ Hooker Malua Bay	30-haslingden-street-moruya-nsw-2537
57722	House	2022-05-09	$670,000 - $700,000	2022-05-27	$690,000	3	2	1		601.0	My Agent Team	37-riverview-crescent-catalina-nsw-2536
57726	House	2022-05-09	Contact Agent	2022-09-06	Undisclosed	5	3	2		1404.0	Ray White Bowral	31-oxley-drive-bowral-nsw-2576
57729	House	2022-05-09	Price Guide $980,000 - $1,050,000	2022-08-04	$1,000,000	4	2	2		1014.0	Ray White Batemans Bay	57-broomfield-crescent-long-beach-nsw-2536
57734	House	2022-05-09	SOLD	2022-05-20	$905,000	5	2	2		973.0	Smile Elite	17-john-hall-drive-taree-nsw-2430
57735	House	2022-05-09	SOLD	2022-05-16	$1,311,000	4	2	2		709.0	Smile Elite	41-bolin-street-schofields-nsw-2762
57737	Apartment	2022-05-09	$415,000	2022-06-10	$420,000	1	1	1	6.0		The Real Estate Shop	503-86-88-northbourne-avenue-braddon-act-2612
57739	House	2022-05-10	Auction	2022-05-28	Undisclosed	3	1	2	6.0	929.0	Blackshaw Gungahlin	7-edmunds-place-spence-act-2615
57740	House	2022-05-10	$720,000	2022-07-22	$720,000	3	1	2	4.0	474.0	home.by holly	24-mimosa-close-isabella-plains-act-2905
57741	House	2022-05-10	Auction, 8/06/2022	2022-06-08	$1,220,000	4	3	4	5.0	482.0	Impact Properties	12-anakie-court-ngunnawal-act-2913
57744	House	2022-05-10	$875,000	2022-06-03	$890,000	3	2	0		519.0	Bella Coastal Property	61-mcdonald-parade-burrill-lake-nsw-2539
57750	Townhouse	2022-05-10	$670,000 - $720,000	2022-06-24	Undisclosed	3	2	2		0.0	Ward Estate Agents	7-36-cameron-road-queanbeyan-nsw-2620
57754	House	2022-05-10	$2,350,000	2022-05-18	$2,350,000	5	4	4		1677.0	LJ Hooker Malua Bay	14-tranquil-bay-place-rosedale-nsw-2536
57755	Unit	2022-05-10	$590,000	2022-06-02	$590,000	2	1	1			One Agency Dwyer Properties	5-12-14-cameron-street-merimbula-nsw-2548
57758	Apartment	2022-05-10	By Negotiation	2022-07-04	Undisclosed	2	2	1	6.0		Impact Properties	423-335-anketell-street-greenway-act-2900
57759	Apartment	2022-05-10	$469,000+	2022-05-19	$505,000	2	1	2	6.0		LJ Hooker Canberra City	37-21-braybrooke-street-bruce-act-2617
57761	House	2022-05-10	AUCTION 1 June 5.00pm	2022-06-01	Undisclosed	4	2	2		651.0	Ward Estate Agents	12-beard-street-queanbeyan-nsw-2620
57764	House	2022-05-10	$960,000	2022-09-21	$890,000	3	2	1		556.0	LJ Hooker Malua Bay	19-pyang-avenue-malua-bay-nsw-2536
57769	Unit	2022-05-10	$499,000	2022-11-02	$499,000	2	1	1			Sails Real Estate	12-9-11-kyeamba-street-merimbula-nsw-2548
57770	Land	2022-05-10	$550,000	2022-07-02	Undisclosed	0	0	0		600.0	Whale Coast Realty	30-songlark-street-bermagui-nsw-2546
57771	Unit	2022-05-10	$180,000 - $190,000	2022-08-01	Undisclosed	1	1	1			Ian McNamee & Partners - Queanbeyan	1-22-carrington-street-queanbeyan-nsw-2620
57773	House	2022-05-10	SOLD - $803,000	2022-06-04	$803,000	2	2	2	6.0	180.0	Stone Gungahlin	23-vandyke-street-crace-act-2911
57774	House	2022-05-10	$1,295,000 - $1,380,000	2022-07-27	Undisclosed	4	2	1	1.0		LJ Hooker Manuka	16-fenton-street-downer-act-2602
57775	AcreageSemi-rural	2022-05-10	$1,900,000 - $1,950,000	2022-09-07	$1,885,000	5	4	4		24281.14	Sails Real Estate	33-belmont-drive-bald-hills-nsw-2549
57776	Other	2022-05-10	SOLD	2022-07-05	Undisclosed	4	2	4		2.02	Smile Elite	176-evelyn-road-tomerong-nsw-2540
57778	Apartment	2022-05-10	$1,100,000+	2022-08-19	$1,095,000	3	2	2	6.0	0.0	LJ Hooker Gungahlin	120-45-west-row-city-act-2601
57781	House	2022-05-11	$975,000	2022-06-04	$975,000	3	2	2	4.5		McGrath Canberra	32-bywaters-street-amaroo-act-2914
57783	Apartment	2022-05-11	Auction	2022-05-26	$543,500	1	1	1	6.0		Luton Manuka	1-18-de-burgh-street-lyneham-act-2602
57784	House	2022-05-11	Contact Agent	2022-08-04	Undisclosed	3	1	1	6.0		McGrath Canberra	12-john-holt-street-macgregor-act-2615
57786	House	2022-05-11	Auction	2022-05-28	Undisclosed	3	1	1	1.5	713.0	LJ Hooker Belconnen	4-hancock-street-spence-act-2615
57788	House	2022-05-11	$2,000,000+	2022-07-20	$2,000,000	4	3	2	4.5	632.0	McGrath Canberra	11-grannall-street-forde-act-2914
57790	House	2022-05-11	SOLD	2022-06-04	Undisclosed	3	2	2	4.0	880.0	Stone Gungahlin	92-gurrang-avenue-ngunnawal-act-2913
57791	Apartment	2022-05-11	$435000+	2022-07-04	Undisclosed	1	1	1	6.0		Edge - Luanne Stapleton	7-77-leichhardt-street-kingston-act-2604
57800	Townhouse	2022-05-11	AUCTION	2022-05-31	$740,000	3	2	2	1.0		McIntyre Property	2-18-kenyon-circuit-monash-act-2904
57801	Land	2022-05-11	$429,000	2022-09-05	$400,000	0	0	0		1070.0	LJ Hooker Malua Bay	6-honeyeater-place-malua-bay-nsw-2536
57804	Townhouse	2022-05-11	$975,000	2022-06-27	$940,000	3	2	2	1.5	453.0	Luton Manuka	12-leeper-place-isaacs-act-2607
57805	Other	2022-05-11	Auction	2022-06-04	Undisclosed	4	2	3		19.4	Luton Manuka	1426-federal-highway-services-road-sutton-nsw-2620
57807	House	2022-05-11	$605,000	2022-06-01	$650,000	3	1	3	0.0	601.0	LJ Hooker Kippax	7-boronia-crescent-karabar-nsw-2620
57813	Other	2022-05-11	$845,000	2023-02-10	$795,000	3	1	1		5.45	Belle Property Braidwood	3-boppings-crossing-road-braidwood-nsw-2622
57815	Apartment	2022-05-11	$360,000+	2022-06-01	$397,000	1	1	1	6.0	0.0	LJ Hooker Gungahlin	35-303-flemington-road-franklin-act-2913
57817	House	2022-05-11	Auction	2022-06-04	$1,142,500	4	3	3	2.0	686.0	LJ Hooker Dickson	36-fitzhardinge-crescent-evatt-act-2617
57818	House	2022-05-11	$795,000	2022-09-12	$722,500	4	2	2		680.0	Elders Real Estate Batemans Bay	5-correa-place-catalina-nsw-2536
57821	House	2022-05-11	Auction	2022-05-31	$1,350,000	4	2	2	5.5	941.0	Town Residential	7-beal-place-nicholls-act-2913
57822	House	2022-05-11	Auction	2022-05-28	Undisclosed	3	2	2	3.0	394.0	McGrath Canberra	61-kavangal-circuit-ngunnawal-act-2913
57823	House	2022-05-11	Expressions of Interest	2022-06-06	$1,030,000	4	2	4		1209.0	Belle Property Braidwood	7-nomchong-street-braidwood-nsw-2622
57825	Unit	2022-05-11	$475,000-$500,000	2022-05-27	$480,000	1	1	1	6.0		LJ Hooker Kaleen	28-38-mort-street-braddon-act-2612
57828	House	2022-05-11	Auction Saturday 4th June at 3:30 PM - Onsite	2022-06-04	Undisclosed	4	2	2	6.0		New Door Properties	8-gudgenby-close-palmerston-act-2913
57829	House	2022-05-11	Contact Agent	2022-07-07	Undisclosed	4	2	2		1030.0	Raine & Horne Young	14-bailes-crescent-young-nsw-2594
57830	House	2022-05-11	AUCTION	2022-05-31	$820,000	3	1	1	0.5		McIntyre Property	5-halfrey-circuit-wanniassa-act-2903
57831	Unit	2022-05-11	$479,000	2022-06-09	$479,600	2	1	1			Sails Real Estate	11-49-monaro-street-merimbula-nsw-2548
57832	House	2022-05-11	Price Guide $1,650,000	2022-06-16	$1,580,000	4	2	3		1011.0	One Agency Dwyer Properties	7-the-dress-circle-tura-beach-nsw-2548
57835	House	2022-05-11	Under Offer	2022-05-23	$710,000	3	1	2		819.0	Henley Property - Cooma	7-florence-street-berridale-nsw-2628
57840	House	2022-05-11	$1,150,000	2022-07-14	$1,150,000	4	2	4	1.0		McIntyre Property	7-twynam-street-holder-act-2611
57842	House	2022-05-11	$700,000+	2022-07-14	$705,000	3	1	1	6.0	212.0	LJ Hooker Gungahlin	4-rockwood-street-casey-act-2913
57847	Townhouse	2022-05-11	AUCTION	2022-05-31	$650,000	3	1	1	3.5		McIntyre Property	13-11-togo-place-gordon-act-2906
57848	Unit	2022-05-11	$379,000	2022-07-01	$340,000	2	1	1			Raine & Horne Goulburn	5-4-albion-street-goulburn-nsw-2580
57855	House	2022-05-11	$1.195million	2022-07-13	$1,175,000	3	2	2		1185.0	LJ Hooker Batemans Bay	22-peninsula-drive-north-batemans-bay-nsw-2536
57856	House	2022-05-11	$3,250,000	2022-08-25	Undisclosed	4	4	6		983.0	Ray White Bowral	46-oxley-drive-mittagong-nsw-2575
57857	House	2022-05-11	Auction	2022-06-01	$1,105,000	4	2	2	6.0	387.0	Town Residential	54-greg-urwin-circuit-casey-act-2913
57860	Unit	2022-05-11	Contact Agent	2022-05-27	$301,000	2	1	1			LJ Hooker Queanbeyan – Jerrabomberra – Googong	18-38-isabella-street-queanbeyan-nsw-2620
57863	House	2022-05-11	$1,650,000	2022-06-28	Undisclosed	3	2	1		1454.0	Whale Coast Realty	25-hillcrest-avenue-north-narooma-nsw-2546
57864	Unit	2022-05-11	Auction	2022-09-13	$195,000	1	1	1			Ray White Rural Canberra | Yass	42-22-mowatt-st-queanbeyan-east-nsw-2620
57865	Townhouse	2022-05-12	Auction	2022-06-04	Undisclosed	3	2	1	6.0		Luton Weston Creek & Molonglo Valley	11-bakewell-street-coombs-act-2611
57868	Flat	2022-05-12	Auction	2022-05-24	Undisclosed	2	1	1			Henley Property - Jindabyne	5-12-cobbon-crescent-jindabyne-nsw-2627
57869	Apartment	2022-05-12	Offers over $350,000	2022-07-06	Undisclosed	1	1	1	6.0		LJ Hooker Manuka	52-126-thynne-street-bruce-act-2617
57870	House	2022-05-12	Auction	2022-06-04	Undisclosed	3	1	1	1.5		Luton Manuka	8-longman-street-richardson-act-2905
57871	House	2022-05-12	Offers over $2,900,000.00 considered	2022-09-18	Undisclosed	5	3	3	3.0	2000.0	One Agency Scott Crossman	17-ngunawal-drive-omalley-act-2606
57872	House	2022-05-12	$950,000+	2022-07-05	$955,000	5	2	2	2.5	742.0	Solely Properties	19-darebin-place-conder-act-2906
57874	House	2022-05-12	Auction	2022-06-04	$1,200,000	4	2	5	4.0	835.0	Solely Properties	97-templestowe-avenue-conder-act-2906
57875	House	2022-05-12	$1,300,000 - $1,350,000	2022-06-27	Undisclosed	4	2	2	1.5		LJ Hooker Manuka	3-bluett-place-chapman-act-2611
57878	House	2022-05-12	$1,050,000 - $1,090,000	2022-09-19	$1,022,500	3	2	2		830.0	Sails Real Estate	3-hillmeads-street-merimbula-nsw-2548
57880	Apartment	2022-05-12	$520,000	2022-09-07	$515,000	2	1	2	4.0		Maloney's Property	252-7-irving-street-phillip-act-2606
57882	House	2022-05-12	Auction: Saturday June 4th, on site at 12:30pm	2022-06-04	$1,920,000	4	2	1	1.5		LJ Hooker Manuka	43-frome-street-griffith-act-2603
57883	House	2022-05-12	$685,000+	2022-07-22	Undisclosed	3	1	2	1.0	510.0	Ray White Canberra	8-nerli-place-conder-act-2906
57884	Townhouse	2022-05-12	$625,000+	2022-07-18	$650,000	3	1	1	5.5	148.5	Canberry Properties	32-bill-ferguson-circuit-bonner-act-2914
57885	House	2022-05-12	SOLD	2022-05-30	$1,030,000	4	2	3		863.0	Smile Elite	12-cain-drive-kelso-nsw-2795
57886	House	2022-05-12	$1,620,000	2022-06-04	$1,620,000	4	2	2	5.0	934.0	home.by holly	8-abeckett-street-watson-act-2602
57887	House	2022-05-12	Auction 04/06/2022	2022-06-04	Undisclosed	3	1	2	4.5	601.0	Ray White Canberra	16-luckman-place-banks-act-2906
57888	Apartment	2022-05-12	$570,000	2022-06-16	$570,000	2	2	2	5.5		home.by holly	63-23-aspinall-street-watson-act-2602
57889	House	2022-05-12	contact agent	2022-06-07	Undisclosed	3	1	1	4.5	649.0	home.by holly	20-windeyer-street-watson-act-2602
57892	House	2022-05-12	contact agent	2022-06-01	Undisclosed	3	1	2	1.0	808.0	home.by holly	14-bennet-street-spence-act-2615
57893	Townhouse	2022-05-12	Auction: Saturday June 4th, on site at 2:00pm	2022-06-04	$1,200,000	3	3	2	3.0		LJ Hooker Manuka	102-arthur-circle-forrest-act-2603
57894	House	2022-05-12	Auction 28/05/2022	2022-05-28	$805,000	3	2	2	3.5	1018.0	Ray White Canberra	11-foskett-street-fraser-act-2615
57895	Townhouse	2022-05-12	Contact Agent	2022-05-26	Undisclosed	4	3	2	6.0		VERV Property	237-john-gorton-drive-wright-act-2611
57896	House	2022-05-12	Auction	2022-06-01	$1,800,000	4	2	2	4.0	669.0	LJ Hooker Tuggeranong	33-melba-street-downer-act-2602
57897	House	2022-05-12	$1,358,000	2022-06-28	Undisclosed	5	3	3	2.5		Maloney's Property	23-bean-crescent-mckellar-act-2617
57898	House	2022-05-12	Offers Invited	2023-03-06	Undisclosed	4	3	3		653.0	LJ Hooker Sussex Inlet	39-whimbrel-drive-sussex-inlet-nsw-2540
57899	House	2022-05-12	Auction	2022-06-04	Undisclosed	1	1	2	0.5	0.0	LJ Hooker Dickson	1-24-wade-street-watson-act-2602
57901	DuplexSemi-detached	2022-05-12	Auction	2022-06-04	Undisclosed	3	1	2	0.0	0.0	LJ Hooker Dickson	2-24-wade-street-watson-act-2602
57904	Townhouse	2022-05-12	Auction 4/6/22	2022-05-31	$555,000	3	1	1	2.0		Ian McNamee & Partners - Queanbeyan	21-6-beazley-crescent-calwell-act-2905
57905	Townhouse	2022-05-12	Auction	2022-06-04	$755,000	3	2	2	5.0	238.3	LJ Hooker Canberra City	32-keppel-street-harrison-act-2914
57909	House	2022-05-12	Auction: Saturday June 4th, on site at 11:00am	2022-06-04	Undisclosed	4	2	1	4.0		LJ Hooker Manuka	50-girrahween-street-braddon-act-2612
57911	House	2022-05-12	$979,000+	2022-06-09	Undisclosed	6	3	2	6.0		PURNELL	10-kable-lane-gungahlin-act-2912
57914	Apartment	2022-05-12	$415,000	2022-06-02	$415,000	2	1	1	4.5		home.by holly	20-6-antis-street-phillip-act-2606
57915	Apartment	2022-05-12	$599,000	2022-06-16	$599,000	2	2	2	6.0		home.by holly	24-31-thynne-street-bruce-act-2617
57917	Townhouse	2022-05-12	Auction	2022-06-02	$812,500	4	3	2	4.0		Luton Gungahlin	164-plimsoll-drive-casey-act-2913
57918	Apartment	2022-05-12	$465,000	2022-07-20	$445,000	2	1	2	6.0		Luton Manuka	16-16-david-miller-crescent-casey-act-2913
57919	House	2022-05-12	Auction	2022-06-01	$1,000,000	4	1	2	1.5	753.0	LJ Hooker Kaleen	76-daintree-crescent-kaleen-act-2617
57921	House	2022-05-12	$980,000	2022-09-02	$970,000	4	2	6		1953.0	Raine & Horne Goulburn	92-cathcart-street-goulburn-nsw-2580
57922	House	2022-05-12	Auction	2022-06-04	Undisclosed	4	2	2	0.0	1193.0	One Agency Sandy Morris	6-purnell-place-calwell-act-2905
57929	Unit	2022-05-12	Price Guide $550,000	2022-06-01	$542,500	2	2	1			One Agency Dwyer Properties	3-27-ocean-drive-merimbula-nsw-2548
57930	Unit	2022-05-12	$530,000+	2022-06-06	$611,500	2	2	1	6.0	0.0	LJ Hooker Dickson	33-77-leichhardt-street-kingston-act-2604
57931	Lifestyle	2022-05-12	$590,000	2022-07-11	$590,000	0	0	0		19.0	LJ Hooker Moruya	lot-2-3-donnelly-drive-moruya-nsw-2537
57932	House	2022-05-12	$1,100,000+	2022-06-22	$1,020,000	4	2	2	0.5	813.0	LJ Hooker Woden/Weston	59-hilder-street-weston-act-2611
57933	House	2022-05-12	Auction 04/06/2022	2022-06-04	Undisclosed	5	2	2	2.0	1331.0	Ray White Canberra	5-smith-street-weetangera-act-2614
57937	House	2022-05-12	Offers Over $1,049,900	2022-08-24	Undisclosed	3	1	2	1.0	805.0	Civium Property Group - Residential	116-phillip-avenue-downer-act-2602
57938	House	2022-05-12	$1,150,000+	2022-06-27	Undisclosed	3	1	1	1.0	938.8	Ray White Canberra	45-skinner-street-cook-act-2614
57939	House	2022-05-12	$660,000+	2022-07-07	Undisclosed	3	1	1	1.0	308.0	Ray White Canberra	26-fullerton-crescent-richardson-act-2905
57940	House	2022-05-12	$759,000	2022-08-22	Undisclosed	3	1	1		594.0	Whale Coast Realty	6-brice-street-narooma-nsw-2546
57944	Townhouse	2022-05-12	Auction	2022-06-01	Undisclosed	4	2	2	2.5		Luton Tuggeranong	19-53-derrington-crescent-bonython-act-2905
57947	Townhouse	2022-05-12	Auction 02/06/2022	2022-06-02	$990,000	3	3	2	5.5		Ray White Canberra	43-11-joy-cummings-place-belconnen-act-2617
57949	House	2022-05-12	Contact Agent	2022-09-09	$1,075,000	4	2	2		536.0	LJ Hooker Queanbeyan – Jerrabomberra – Googong	1-heazlett-street-googong-nsw-2620
57953	House	2022-05-12	Auction	2022-05-28	$842,000	3	1	4	2.5	1016.0	Luton Tuggeranong	1-tannabar-place-isabella-plains-act-2905
57954	Apartment	2022-05-12	$489,000+	2022-08-31	$489,000	2	1	1	3.5		LJ Hooker Woden/Weston	130-26-oliver-street-lyneham-act-2602
57955	Apartment	2022-05-12	$485,000+	2022-07-21	$490,573	2	1	2	6.0	0.0	LJ Hooker Dickson	8-15-mower-place-phillip-act-2606
57958	House	2022-05-13	Auction on Saturday 11th June 2022 at 9:30am	2022-06-11	Undisclosed	3	2	2	4.0	538.0	Hugo. Canberra	12-archel-place-palmerston-act-2913
57959	Townhouse	2022-05-13	Auction	2022-06-04	Undisclosed	2	2	2	6.0		Luton Weston Creek & Molonglo Valley	78-60-john-gorton-drive-coombs-act-2611
57960	Apartment	2022-05-13	$595,000+	2022-08-10	$600,000	1	1	1	6.0		Morrissey Property	1-29-state-circle-deakin-act-2600
57961	House	2022-05-13	Upcoming Auction	2022-06-10	Undisclosed	4	2	1	2.5	716.0	Luton Tuggeranong	11-riordan-street-fadden-act-2904
57964	House	2022-05-13	$750,000	2022-05-27	$730,000	3	2	2		816.0	Elders Real Estate Batemans Bay	28-long-beach-road-long-beach-nsw-2536
57965	Apartment	2022-05-13	$719,000 - $749,000	2022-05-17	Undisclosed	2	2	1	6.0		Ray White Canberra	203-19-marcus-clarke-street-city-act-2601
57967	House	2022-05-13	SOLD	2022-06-24	$800,000	4	2	2		762.0	Smile Elite	69-newlands-drive-kelso-nsw-2795
57973	House	2022-05-13	$649,000	2022-08-18	$625,000	3	1	1		633.0	Elders Real Estate Batemans Bay	26-bavarde-avenue-batemans-bay-nsw-2536
57974	House	2022-05-13	Price guide $1,625,000 - $1,700,000	2022-06-23	Undisclosed	3	1	2		776.0	Ray White Bowral	152-merrigang-street-bowral-nsw-2576
57976	House	2022-05-13	By Negotiation	2022-09-26	Undisclosed	5	4	2	5.0	429.0	Hugo. Canberra	50-mulgara-loop-throsby-act-2914
58010	House	2022-05-13	Auction	2022-06-04	$1,120,000	5	4	4	6.0	970.0	Luton Tuggeranong	2-mayfield-hill-bonython-act-2905
58013	House	2022-05-13	Auction Sat 4th June 12.30 PM Onsite	2022-05-28	$757,000	3	1	2	1.5	651.0	New Door Properties	6-creed-place-macgregor-act-2615
58014	Land	2022-05-13	$625,000	2022-06-17	$620,000	0	0	0		2000.0	Raine & Horne Goulburn	20-snowgums-drive-goulburn-nsw-2580
58016	House	2022-05-13	$690,000	2022-06-23	$659,000	4	2	1		1277.0	Henley Property - Cooma	3-minawa-street-cooma-nsw-2630
58018	House	2022-05-13	$1,200,000	2022-08-05	$1,100,000	4	2	6			Ray White Goulburn	74-run-o-waters-drive-goulburn-nsw-2580
58020	House	2022-05-13	Auction	2022-06-04	Undisclosed	4	2	3	1.5	713.0	Blackshaw Manuka	30-mcgowan-street-dickson-act-2602
58025	Apartment	2022-05-13	Auction 04/06/2022	2022-06-03	Undisclosed	2	2	2	3.5		Ray White Canberra	160-81-kennedy-street-kingston-act-2604
58027	Unit	2022-05-13	Contact Agent	2022-06-06	$350,000	2	1	1			LJ Hooker Queanbeyan – Jerrabomberra – Googong	35-86-derrima-road-crestwood-nsw-2620
58028	DuplexSemi-detached	2022-05-13	$1,099,000	2023-07-14	$1,099,999	2	2	1	2.0	586.0	Luton Dickson	2-49-boldrewood-street-turner-act-2612
58034	Apartment	2022-05-13	$530,000	2022-06-06	$530,000	1	1	1	6.0		home.by holly	21-76-stockman-avenue-lawson-act-2617
58037	Unit	2022-05-13	Contact Agent	2022-06-20	$370,000	2	1	1			LJ Hooker Queanbeyan – Jerrabomberra – Googong	1-17-mowatt-street-queanbeyan-east-nsw-2620
58040	House	2022-05-13	NEW PRICE $1,350,000 - $1,450,000	2023-07-21	$1,300,000	5	2	1		999.0	Ray White Batemans Bay	133-tuross-boulevard-tuross-head-nsw-2537
58049	House	2022-05-15		2022-06-29	Undisclosed	4	2	4		891.0	Hallmark Real Estate Advisors	13-allenby-road-tuross-head-nsw-2537
58052	House	2022-05-16	Auction	2022-06-08	$2,001,000	6	2	3		1506.0	Henley Property - Jindabyne	7-ryrie-lane-jindabyne-nsw-2627
58058	House	2022-05-16	AUCTION 11 June 9 am	2022-06-11	$1,310,000	3	1	2	0.5	702.0	Ward Estate Agents	314-goyder-street-narrabundah-act-2604
58062	House	2022-05-16	Price Guide $1,450,000	2022-06-29	$1,450,000	5	3	6		9.52	One Agency Dwyer Properties	3729-princes-highway-south-pambula-nsw-2549
58063	House	2022-05-16	$945,000+	2022-07-27	$972,000	4	2	3	0.5	869.4	LJ Hooker Woden/Weston	37-spowers-circuit-holder-act-2611
58069	AcreageSemi-rural	2022-05-16	$1,350,000-$1,450,000	2023-03-28	$1,370,000	4	2	2		34800.0	LJ Hooker Batemans Bay	15-cullendulla-drive-long-beach-nsw-2536
58070	House	2022-05-16	$399,000	2022-05-16	Undisclosed	3	1	1		3.5	Raine & Horne Young	122-old-monteagle-road-young-nsw-2594
58081	House	2022-05-16	Auction Cancelled - Sale in Progress	2022-06-20	$1,000,000	3	1	0		1308.0	LJ Hooker Batemans Bay	8-tallwood-crescent-rosedale-nsw-2536
58090	House	2022-05-16	Auction	2022-06-10	$990,000	3	1	2	1.5		Confidence Real Estate	8-houghton-place-spence-act-2615
58093	House	2022-05-16	$1,295,000	2022-08-26	Undisclosed	4	2	2		563.0	Whale Coast Realty	38-hillside-crescent-kianga-nsw-2546
58095	House	2022-05-16	$595,000	2022-10-28	Undisclosed	3	2	1		567.0	Raine & Horne Goulburn	93-kinghorne-street-goulburn-nsw-2580
58102	House	2022-05-17	SOLD	2022-05-27	$753,000	4	2	2		946.0	Smile Elite	24-farmgate-drive-abercrombie-nsw-2795
58103	House	2022-05-17	SOLD	2022-07-01	$980,000	4	2	2		896.0	Smile Elite	113-hughes-street-kelso-nsw-2795
58105	Land	2022-05-13	$489,000	2022-06-21	$475,000	0	0	0		720.0	Professionals Batemans Bay	78-sylvan-street-malua-bay-nsw-2536
58109	Unit	2022-05-17	Price Guide $615,000	2022-06-03	$621,250	3	2	1		1312.0	One Agency Dwyer Properties	3-3-brodribb-court-merimbula-nsw-2548
58110	Land	2022-05-17	Auction 09/06/2022	2022-06-07	Undisclosed	0	0	0		958.0	Ray White Canberra	5-bandjalong-crescent-aranda-act-2614
58111	House	2022-05-17	$590,000	2022-06-16	$587,000	3	1	0		777.0	Henley Property - Berridale	1-mackay-street-berridale-nsw-2628
58113	Land	2022-05-17	$375,000	2023-01-12	$375,000	0	0	0		751.0	McGrath Batemans Bay & Moruya	67-broomfield-crescent-long-beach-nsw-2536
58114	House	2022-05-17	Auction Guide $830,000	2022-06-17	$800,000	4	3	2		1012.0	Ray White Goulburn	26-emma-street-goulburn-nsw-2580
58116	Apartment	2022-05-17	$545,000	2022-06-23	Undisclosed	2	2	2	6.0		Luton Manuka	161-41-philip-hodgins-street-wright-act-2611
58118	Apartment	2022-05-17	By Negotiation	2022-07-22	Undisclosed	2	2	2	6.0		Impact Properties	94-77-gozzard-street-gungahlin-act-2912
58119	AcreageSemi-rural	2022-05-17	Auction	2022-06-02	$1,490,000	3	2	5	0.0	8996.0	Agent Residential	48-mcdonnell-drive-bungendore-nsw-2621
58120	Townhouse	2022-05-17	Auction Sat, 11th June at 1:00pm	2022-06-11	$710,000	3	2	2	2.5	0.0	LJ Hooker Gungahlin	2-42-kenyon-circuit-monash-act-2904
58121	Townhouse	2022-05-17	$659,000+	2022-08-15	$670,000	3	2	1	5.0	228.0	LJ Hooker Gungahlin	8-14-len-waters-street-ngunnawal-act-2913
58123	Apartment	2022-05-17	$380,000-$400,000	2023-02-21	Undisclosed	1	1	1			Luton Tuggeranong	15-6-high-street-queanbeyan-east-nsw-2620
58124	House	2022-05-17	$980,000+	2022-07-04	$997,000	3	2	2	6.0		Confidence Real Estate	8-jelinek-street-taylor-act-2913
58126	Apartment	2022-05-17	$345,000	2022-06-02	$355,000	1	1	1	6.0		Luton Belconnen	39-6-gungahlin-place-gungahlin-act-2912
58132	Apartment	2022-05-17	$419,950+	2022-07-26	$415,000	1	1	1	6.0		LJ Hooker Gungahlin	110-100-swain-street-gungahlin-act-2912
58134	House	2022-05-17	$790,000	2022-09-01	$775,000	4	2	1		607.0	My Agent Team	68-palana-street-surfside-nsw-2536
58135	House	2022-05-17	Offers over $1,025,000	2022-06-28	Undisclosed	4	1	3	1.0	772.0	Ray White Canberra	6-lyle-place-chifley-act-2606
58141	Apartment	2022-05-17	SOLD	2022-06-14	$450,000	1	1	1	6.0		Cream Residential	33-121-easty-street-phillip-act-2606
58142	House	2022-05-17	$1,350,000+	2022-06-28	Undisclosed	5	3	2	4.0	746.0	Luton Gungahlin	13-ayers-fowler-street-nicholls-act-2913
58152	House	2022-05-18	Auction 09/06/2022	2022-06-09	Undisclosed	5	3	2	1.0	1110.0	Ray White Canberra	25-burnett-street-kaleen-act-2617
58155	House	2022-05-18	SOLD PRIOR TO AUCTION	2022-05-31	Undisclosed	3	2	2	1.0		McGrath Canberra	3-smart-place-evatt-act-2617
58156	Townhouse	2022-05-18	$479,000 - $519,000	2022-06-06	$485,000	2	1	1			Ian McNamee & Partners - Queanbeyan	7-43-45-booth-street-queanbeyan-east-nsw-2620
58159	House	2022-05-18	$515,000	2022-08-03	$495,000	3	1	1		548.0	Raine & Horne Goulburn	23-victoria-street-goulburn-nsw-2580
58162	House	2022-05-18	AUCTION GUIDE $400,000 - 17th June 2022	2022-06-17	$493,000	3	1	1		645.0	Ray White Goulburn	107-finlay-road-goulburn-nsw-2580
58163	Unit	2022-05-18	Auction Price Guide - $370,000	2022-06-14	$384,000	2	1	1	6.0		LJ Hooker Belconnen	5-21-battye-street-bruce-act-2617
58165	House	2022-05-18	SOLD - $1,400,000	2022-06-12	$1,400,000	4	2	2	6.0	606.0	Stone Gungahlin	59-langtree-crescent-crace-act-2911
58168	House	2022-05-18	$1,190,000	2022-06-10	$1,200,000	4	2	2	5.0	979.0	The Real Estate Shop	88-summerville-crescent-florey-act-2615
58169	Unit	2022-05-18	Auction	2022-06-04	$380,000	2	1	1	2.0		LJ Hooker Belconnen	5-28-springvale-drive-hawker-act-2614
58170	House	2022-05-18	Auction	2022-06-04	$860,000	4	2	2	4.0		LJ Hooker Belconnen	10-80-buckingham-street-amaroo-act-2914
58172	Townhouse	2022-05-18	$569,000+	2022-05-27	$590,000	2	1	1	4.5	206.0	Luton Tuggeranong	6-40-sid-barnes-crescent-gordon-act-2906
58176	House	2022-05-18	$825,000	2022-10-27	$780,000	2	1	6		921.0	Ray White Batemans Bay	2-sunpatch-parade-tomakin-nsw-2537
58178	House	2022-05-18	SOLD	2022-06-12	Undisclosed	3	2	2	6.0		Stone Gungahlin	16-20-clare-burton-crescent-franklin-act-2913
58179	House	2022-05-18	$785,000-$815,000	2022-06-10	$785,000	3	2	2		722.0	Bella Coastal Property	12-howes-place-ulladulla-nsw-2539
58180	Land	2022-05-18	$250,000	2022-07-27	$235,000	0	0	0		711.0	My Agent Team	19-broomfield-crescent-long-beach-nsw-2536
58184	House	2022-05-18	$949,000	2022-06-07	$950,000	4	2	2		2428.0	LJ Hooker Malua Bay	28-costin-street-moruya-nsw-2537
58185	AcreageSemi-rural	2022-05-18	Current High Bid $670,000	2022-08-22	Undisclosed	5	2	4		60.0	One Agency Craig Schofield	lots-39-69-1-bobeyan-road-bolaro-bolaro-nsw-2629
58187	House	2022-05-18	Auction	2022-06-08	$977,000	4	2	1	4.5	760.0	LJ Hooker Kaleen	9-foley-place-holt-act-2615
58190	House	2022-05-18	$1,150,000+	2022-06-28	$1,180,000	4	3	3	6.0		Confidence Real Estate	3-10-pollock-street-chifley-act-2606
58191	Unit	2022-05-18	$399,000+	2022-06-08	$430,000	1	1	1	6.0	0.0	LJ Hooker Dickson	3-10-ipima-street-braddon-act-2612
58194	House	2022-05-18	Price Guide $1,450,000	2022-05-27	$1,450,000	3	2	2	0.0	1665.0	Raine & Horne Southern Highlands	78-railway-parade-mittagong-nsw-2575
58195	House	2022-05-18	AUCTION 11 June 3.00 pm	2022-06-11	$1,560,000	6	3	3		1090.0	Ward Estate Agents	60-carolyn-jackson-drive-jerrabomberra-nsw-2619
58198	House	2022-05-18	Auction 11/6/22	2022-06-11	$665,000	4	2	1		600.0	Ian McNamee & Partners - Queanbeyan	11-waratah-street-karabar-nsw-2620
58200	House	2022-05-18	$1,150,000 - $1,250,000	2022-06-22	Undisclosed	2	2	1		8.09	Ray White Canberra	697-bungendore-road-bungendore-nsw-2621
58205	House	2022-05-18	$1,100,000	2022-07-06	Undisclosed	5	2	2		645.0	Whale Coast Realty	18-hillside-crescent-kianga-nsw-2546
58208	Apartment	2022-05-18	$349,000+	2022-06-07	$350,000	2	1	1	6.0		Independent Gungahlin	24-21-wiseman-street-macquarie-act-2614
58216	Apartment	2022-05-18	$482,500	2022-06-23	$482,500	1	1	1	6.0		home.by holly	86-29-dawes-street-kingston-act-2604
58217	Other	2022-05-18	$420,000	2022-10-28	$420,000	0	0	0		20200.0	Smile Elite	4-selbys-road-budgong-nsw-2577
58219	House	2022-05-19	$820,000+	2022-08-12	$815,000	3	2	3	1.5	744.0	Solely Properties	9-rose-scott-circuit-chisholm-act-2905
58220	Apartment	2022-05-19	$375,000+	2022-06-22	$407,000	1	1	1	6.0		LJ Hooker Dickson	81-57-benjamin-way-belconnen-act-2617
58223	Unit	2022-05-19	$430,000	2022-07-08	$430,000	1	1	1	6.0	4623.0	home.by holly	91-10-ipima-street-braddon-act-2612
58224	Apartment	2022-05-19	$1,000,000 - $1,100,000	2022-07-08	$980,000	3	2	2	6.0		LJ Hooker Manuka	117-1-kalma-way-campbell-act-2612
58228	Townhouse	2022-05-19	$750,000	2022-08-05	$750,000	3	1	2	2.0	378.0	home.by holly	19-9-tristiana-street-rivett-act-2611
58229	House	2022-05-19	Auction 09/06/2022	2022-06-09	$710,000	3	1	2	4.5	452.0	Ray White Canberra	19-elyard-place-dunlop-act-2615
58232	House	2022-05-19	$1,250,000+	2022-08-18	Undisclosed	3	1	2	1.0	705.0	Ray White Canberra	42-ayers-street-curtin-act-2605
58234	House	2022-05-19	By Negotiation	2022-07-15	Undisclosed	3	1	2	0.5	803.0	Ray White Canberra	11-whitfeld-street-monash-act-2904
58235	House	2022-05-19	$829,000+	2022-06-07	$860,000	3	1	1	6.0		Ray White Canberra	20-eaves-street-holt-act-2615
58238	Apartment	2022-05-19	$520,000+	2022-07-15	$512,500	2	2	1	6.0		Impact Properties	12-15-bill-ferguson-circuit-bonner-act-2914
58243	House	2022-05-19	Contact Agent	2022-08-31	$725,000	3	1	2		807.0	Smile Elite	2-ryley-close-moruya-nsw-2537
58245	Lifestyle	2022-05-19	$555,000	2022-06-28	Undisclosed	0	0	0		195.0	Ray White Goulburn	lot-101-collector-road-gunning-nsw-2581
58246	Apartment	2022-05-19	$450,000+	2022-07-05	$455,000	1	1	1	4.5		LJ Hooker Canberra City	1-7-irving-street-phillip-act-2606
58248	House	2022-05-19	$1,000,000 to $1,100,000	2022-08-26	$990,000	4	2	4		873.0	LJ Hooker Batemans Bay	24-calton-road-batehaven-nsw-2536
58250	Land	2022-05-19	$489,000	2022-10-27	$475,000	0	0	0		946.6	Sails Real Estate	6-jacaranda-place-merimbula-nsw-2548
58253	House	2022-05-19	Price Range: $795,000 - $830,000	2022-06-15	$810,000	3	2	2		698.0	LJ Hooker Batemans Bay	30-broomfield-crescent-long-beach-nsw-2536
58254	Townhouse	2022-05-19	Auction 11/06/2022	2022-06-11	Undisclosed	3	2	2	2.0		Ray White Canberra	7-30-bourne-street-cook-act-2614
58255	Apartment	2022-05-19	Auction 02/06/2022	2022-06-02	Undisclosed	3	2	1	2.0		Ray White Canberra	2a-2-araluen-street-fisher-act-2611
58258	Land	2022-05-19	$265,000 Offers Considered	2023-08-15	Undisclosed	0	0	0		11.0	Henley Property - Cooma	2354-tom-groggin-road-nimmitabel-nsw-2631
58261	House	2022-05-19	$1,130,000 - $1,210,000	2022-05-27	$1,180,000	4	2	2		835.0	Michael Potter Real Estate	31-forest-drive-jerrabomberra-nsw-2619
58265	AcreageSemi-rural	2022-05-19	$1,395,000	2022-09-02	Undisclosed	3	1	6		3.27	Rapport Property	168-shearer-drive-royalla-nsw-2620
58268	House	2022-05-19	$750,000	2022-06-09	$750,000	2	1	1	2.5		home.by holly	27-hallen-close-swinger-hill-act-2606
58273	Apartment	2022-05-19	$340,000	2022-09-14	$340,000	2	1	1	4.0		LJ Hooker Woden/Weston	7-2-8-corinna-street-lyons-act-2606
58275	Apartment	2022-05-19	Offers Over $389,000 +	2022-06-15	$395,000	1	1	1	6.0		Town Residential	33-311-flemington-road-franklin-act-2913
58282	House	2022-05-19	Auction 11/06/2022	2022-06-02	$785,900	3	2	1	4.0	191.0	Ray White Canberra	54-bronhill-street-moncrieff-act-2914
58287	Unit	2022-05-19	Contact Agent	2022-07-22	$216,000	1	1	1			LJ Hooker Queanbeyan – Jerrabomberra – Googong	17-2-donald-road-queanbeyan-nsw-2620
58288	Land	2022-05-19	Price on Application	2022-07-08	$730,000	0	0	0		559.0	Town Residential	14-karl-langer-crescent-taylor-act-2913
58289	Apartment	2022-05-19	265,000 +	2022-07-15	$280,000	1	1	1	5.0		LJ Hooker Gungahlin	22-127-madigan-street-hackett-act-2602
58293	House	2022-05-20	Auction	2022-06-08	Undisclosed	3	1	2	1.0	732.0	Luton Weston Creek & Molonglo Valley	26-bangalay-crescent-rivett-act-2611
58294	Unit	2022-05-20	$219,000 - $239,000	2022-06-27	$227,000	1	1	1			Ian McNamee & Partners - Queanbeyan	5-3-mowatt-street-queanbeyan-nsw-2620
58296	Apartment	2022-05-20	$345,000	2022-06-23	$345,000	1	1	1	2.5		home.by holly	12-25-mackennal-street-lyneham-act-2602
58297	Townhouse	2022-05-20	Auction 08/06/2022	2022-06-08	$890,000	2	1	1	3.0	140.0	Ray White Canberra	5-5-lane-poole-place-yarralumla-act-2600
58298	House	2022-05-20	contact agent	2022-06-08	Undisclosed	3	2	2	2.0	587.0	home.by holly	25-bemboka-crescent-kaleen-act-2617
58301	House	2022-05-20	Auction 08/06/2022	2022-06-08	$820,000	4	2	2	0.0	487.0	LJ Hooker Dickson	7-thomas-royal-gardens-queanbeyan-east-nsw-2620
58302	Apartment	2022-05-20	$1,075,000	2022-06-27	$1,075,000	3	2	2	6.0		Maria Selleck Properties	235-26-anzac-park-campbell-act-2612
58308	House	2022-05-20	Auction 08/06/2022	2022-06-08	$975,000	3	1	0	2.0	652.15	Ray White Canberra	3-boyd-street-lyneham-act-2602
58310	House	2022-05-20	By Negotiation	2022-07-29	$2,000,000	5	3	2	3.0	0.0	Berkely Residential	100-pridham-street-farrer-act-2607
58311	Townhouse	2022-05-20	By Negotiation	2022-07-15	Undisclosed	3	2	2	6.0		Impact Properties	2-1-rouseabout-street-lawson-act-2617
58312	House	2022-05-20	Price Guide $1,180,000	2022-08-31	Undisclosed	4	2	2		525.0	Raine & Horne Southern Highlands	29-red-gum-drive-braemar-nsw-2575
58313	House	2022-05-20	$875,000	2022-07-22	Undisclosed	3	1	1	4.0	664.0	Ray White Canberra	16-jarrahdale-street-fisher-act-2611
58320	House	2022-05-20	$595,000	2022-08-16	$585,000	3	1	1		696.0	Ray White Goulburn	26-sloane-street-goulburn-nsw-2580
58321	House	2022-05-20	By Negotiation	2022-07-15	Undisclosed	4	2	2	1.5	911.0	One Agency Sandy Morris	63-meredith-circuit-kambah-act-2902
58323	House	2022-05-20	$1,245,000	2022-08-18	Undisclosed	5	2	2		5.4	LJ Hooker Malua Bay	103-clyde-road-north-batemans-bay-nsw-2536
58325	Apartment	2022-05-20	$615,000	2022-06-24	$615,000	2	2	1	6.0		home.by holly	712-253-northbourne-avenue-lyneham-act-2602
58326	Townhouse	2022-05-20	$699,000+	2022-05-26	$716,500	3	2	2	4.0		LJ Hooker Woden/Weston	2-58-betty-maloney-crescent-banks-act-2906
58329	Horticulture	2022-04-04	Contact	2022-08-23	Undisclosed	4	2	8		36.24	Ray White Rural Tumbarumba	2289-batlow-road-laurel-hill-nsw-2649
58334	House	2022-05-20	$675,000	2022-07-19	$650,000	3	1	2			Ray White Batemans Bay	3-54-smith-street-broulee-nsw-2537
58343	House	2022-05-20	Auction 09/06/2022	2022-06-09	Undisclosed	5	3	3	3.5	2300.0	Ray White Canberra	10-cobby-street-campbell-act-2612
58346	House	2022-05-20	$1,895,000 - $1,950,000	2022-07-25	Undisclosed	5	3	2		720.0	Raine & Horne Southern Highlands	105-darraby-drive-moss-vale-nsw-2577
58348	Other	2022-05-21	$450,000	2022-09-01	$435,000	0	0	0		7.04	Belle Property Braidwood	48-quong-tart-close-araluen-nsw-2622
58351	BlockOfUnits	2022-05-21	Price Guide $1,200,000	2022-09-13	Undisclosed	6	3	4		767.0	Dwyer Properties Sapphire Coast	16-pitt-street-south-pambula-nsw-2549
58352	Apartment	2022-05-21	$495,000 Plus	2022-07-07	$500,000	2	1	1	6.0		Maloney's Property	99-29-dawes-street-kingston-act-2604
58354	Unit	2022-05-21	Offers over $420,000	2022-07-18	Undisclosed	1	1	1	6.0	0.0	Bolton & co	17-17-helemon-street-braddon-act-2612
58360	House	2022-05-23	$1,259,000+	2022-05-27	$1,270,000	4	3	2	7.0		Confidence Real Estate	11-baldwinson-street-taylor-act-2913
58362	DuplexSemi-detached	2022-05-23	$665,000	2022-08-08	$655,000	3	2	2		373.0	LJ Hooker Sussex Inlet	16b-peacehaven-way-sussex-inlet-nsw-2540
58363	Unit	2022-05-23	$195,000	2022-07-04	$189,000	1	1	1			LJ Hooker Moruya	1-67-evans-street-moruya-nsw-2537
58364	House	2022-05-23	Auction	2022-06-22	Undisclosed	4	2	4	4.5	1030.0	LJ Hooker Kaleen	72-longmore-crescent-wanniassa-act-2903
58371	Apartment	2022-05-23	$410,000+	2022-06-17	$415,000	1	1	1	6.0		LJ Hooker Dickson	180-1-mouat-street-lyneham-act-2602
58372	House	2022-05-23	SOLD	2022-06-23	$550,000	3	1	2		998.0	Smile Elite	12-crescent-avenue-taree-nsw-2430
