id	type	ListingDate	PriceLabel	SoldDate	SoldPrice	Beds	Baths	Cars	EER	PlotSize	Agency.Name	Slug
32689	House	2022-08-31	$9,000,000	2022-10-07	$9,000,000	5	4	6	3.0	0.0	Berkely Residential	82-empire-circuit-deakin-act-2600
54762	House	2022-08-30	$6,770,000	2023-02-24	$6,770,000	7	4	4	4.5	0.0	Berkely Residential	9-northcote-crescent-deakin-act-2600
55566	Apartment	2022-08-31	$750,000	2022-09-08	$750,000	2	2	2	6.0	0.0	Berkely Residential	158-46-macquarie-street-barton-act-2600
59716	Townhouse	2022-08-30	$2,500,000	2022-09-06	$2,500,000	3	3	2	6.0	0.0	Berkely Residential	46-lawley-street-deakin-act-2600
60438	House	2022-07-01	Contact Agent	2022-07-29	$950,000	4	2	1		484.0	Smile Elite	25-alison-drive-glenmore-park-nsw-2745
60440	House	2022-07-01	Contact agent	2022-07-22	$968,000	3	1	1		538.0	Smile Elite	54-lone-pine-avenue-umina-beach-nsw-2257
60441	House	2022-07-01	Price Guide $495,000	2023-07-25	Undisclosed	2	1	1		569.0	dwell Realty	124-east-street-nowra-nsw-2541
60442	House	2022-07-01	Price Guide $1,025,000	2022-10-31	$1,025,000	4	2	2		1622.0	InHouse Real Estate	26b-elizabeth-pde-tura-beach-nsw-2548
60452	House	2022-07-01	Auction 23/07/2022	2022-07-23	Undisclosed	3	2	2	4.5		Ray White Canberra	5-60-boldrewood-street-turner-act-2612
60454	House	2022-07-01	By Negotiation - Vicinity of $1,150,000-$1,175,000	2022-11-09	$1,160,000	4	2	7		1001.0	Marshall and Tacheci Real Estate	62-ocean-view-drive-bermagui-nsw-2546
60455	House	2022-07-01	$995,000	2022-09-19	Undisclosed	3	2	2		607.0	Whale Coast Realty	17-riverview-street-potato-point-nsw-2545
60469	House	2022-07-01	$870,000 - $899,000	2022-08-03	$889,250	5	3	2		929.0	PRD Wagga Wagga	19-amaroo-street-kooringal-nsw-2650
60472	House	2022-07-01	Auction	2022-07-21	Undisclosed	4	2	2	4.5		Luton Gungahlin	8-oshane-street-bonner-act-2914
60476	Unit	2022-07-01	$489,000+	2022-07-15	Undisclosed	2	1	1	5.0		Luton Tuggeranong	7-181-mcbryde-crescent-wanniassa-act-2903
60481	House	2022-07-01	Auction 24/07/2022	2022-07-23	Undisclosed	5	2	4	3.5	1509.0	Ray White Canberra	26-packer-street-weetangera-act-2614
60490	House	2022-07-01	Contact agent	2022-10-27	Undisclosed	4	3	1		651.0	Smile Elite	2-muli-muli-avenue-ocean-shores-nsw-2483
60498	House	2022-07-01	$1,850,000 - $2,030,000	2022-07-12	Undisclosed	5	3	5	0.0	80680.0	Ray White Canberra	340-macs-reef-road-bywong-nsw-2621
60503	House	2022-07-02	Price Reduction - $690,000	2022-11-15	$680,000	4	2	4		556.0	Fraser-Gray Real Estate	6-bernadette-boulevard-batehaven-nsw-2536
60505	House	2022-07-04	Contact Agent	2022-07-27	$800,010	4	1	2	0.0	694.0	The Real Estate Guy	20-hinkler-street-scullin-act-2614
60506	House	2022-07-04	$350,000 - $380,000	2022-07-27	Undisclosed	3	1	1		595.0	Macarthur Real Estate Agency	13-lockett-place-tolland-nsw-2650
60507	House	2022-07-04	PREVIEW	2022-08-24	Undisclosed	3	1	2		974.0	Macarthur Real Estate Agency	20-langi-crescent-glenfield-park-nsw-2650
60509	House	2022-07-04	$355,000	2022-07-04	$355,000	2	1	1			Raine & Horne Goulburn	7-31-newton-street-goulburn-nsw-2580
60519	Unit	2022-07-04	Contact Agent	2022-09-29	$335,000	2	1	1			LJ Hooker Queanbeyan – Jerrabomberra – Googong	14-18-booth-street-queanbeyan-east-nsw-2620
60521	House	2022-07-04	Contact Agent	2022-11-01	$1,165,000	4	3	2			Smile Elite	39-blackheath-street-the-ponds-nsw-2769
60522	House	2022-07-04	$98,500	2022-07-29	Undisclosed	2	1	0			Ray White Wagga Wagga	9-egan-street-ardlethan-nsw-2665
60523	Land	2022-07-04	$500,000 - $550,000	2022-08-19	Undisclosed	0	0	0			Ray White Wagga Wagga	springvale-2650-nsw
60527	House	2022-07-04	$349,000	2022-07-08	Undisclosed	3	1	1			Ray White Wagga Wagga	2-loughnan-street-coolamon-nsw-2701
60528	House	2022-07-04	Contact Agent	2022-08-11	Undisclosed	2	1	2			Ray White Wagga Wagga	116-coleman-street-turvey-park-nsw-2650
60529	House	2022-07-04	Contact Agent	2022-07-13	Undisclosed	3	2	1		644.9	Ray White Wagga Wagga	10-malumba-crescent-kooringal-nsw-2650
60530	House	2022-07-04	$449,000	2022-11-02	Undisclosed	3	1	1		543.8	Ray White Wagga Wagga	7-heath-street-turvey-park-nsw-2650
60531	House	2022-07-04	$460,000 - $480,000	2022-07-22	Undisclosed	3	1	2		739.0	Ray White Wagga Wagga	11-willow-street-kooringal-nsw-2650
60533	House	2022-07-04	Offers above $799,000	2022-07-29	$775,000	3	2	2	6.0	245.0	Town Residential	143-bernard-heinz-avenue-moncrieff-act-2914
60534	BlockOfUnits	2022-07-04	Contact Agent	2022-10-31	Undisclosed	6	6	1			Ray White Wagga Wagga	1-6-24-willow-street-kooringal-nsw-2650
60535	House	2022-07-04	Contact Agent	2022-07-18	Undisclosed	3	2	3		800.0	Ray White Wagga Wagga	14-melkin-avenue-glenfield-park-nsw-2650
60536	House	2022-07-04	$795,000	2022-10-26	Undisclosed	5	2	2		672.7	Ray White Wagga Wagga	100-brooklyn-drive-bourkelands-nsw-2650
60544	Unit	2022-07-04	Contact Agent	2022-07-27	$266,000	1	1	1			LJ Hooker Queanbeyan – Jerrabomberra – Googong	6-20-trinculo-place-queanbeyan-east-nsw-2620
60546	House	2022-07-04	Auction 20/07/2022	2022-07-19	Undisclosed	3	2	1	1.5	766.0	LJ Hooker Dickson	68-paterson-street-ainslie-act-2602
60549	Unit	2022-07-04	$489,000	2022-07-28	$460,000	2	1	1			Elders Real Estate Batemans Bay	8-13-17-herarde-street-batemans-bay-nsw-2536
60552	House	2022-07-04	Contact Agent	2022-08-15	$850,000	3	2	2		501.0	LJ Hooker Queanbeyan – Jerrabomberra – Googong	18-tooroonga-crescent-jerrabomberra-nsw-2619
60553	House	2022-07-04	$749,000	2022-10-07	Undisclosed	4	2	2		563.0	PRD Wagga Wagga	1-sturrock-drive-boorooma-nsw-2650
60557	House	2022-07-04	$980,000 - $1,060,000	2022-07-20	$1,040,000	4	2	2		812.0	My Agent Team	10-escape-place-malua-bay-nsw-2536
60563	House	2022-07-05	$1,900,000+	2022-11-10	$1,850,000	6	4	2	4.0	554.0	Dynamics Estate Agents	22-toorale-terrace-lawson-act-2617
60564	House	2022-07-05	Under Contract	2022-10-10	Undisclosed	4	3	1	3.5		MARQ Property	8-gang-gang-court-ngunnawal-act-2913
60568	House	2022-07-05	Auction, Saturday July 30 at 11:30am	2022-07-30	$1,050,000	4	2	2	4.0	451.0	LJ Hooker Gungahlin	55-anakie-court-ngunnawal-act-2913
60571	House	2022-07-05	Contact Agent	2022-07-06	Undisclosed	4	2	2		1358.0	Ray White Wagga Wagga	9-william-kelly-drive-coolamon-nsw-2701
60573	House	2022-07-05	Price Guide $1,150,000	2022-11-17	Undisclosed	3	2	2		667.0	Dwyer Properties Sapphire Coast	15-lakewood-drive-merimbula-nsw-2548
60576	House	2022-07-05	$760,000	2022-08-04	$760,000	3	1	0	0.5	679.0	Blackshaw Gungahlin	30-burkitt-street-page-act-2614
60580	DuplexSemi-detached	2022-07-05	Preview	2022-09-02	Undisclosed	6	3	2		575.0	Macarthur Real Estate Agency	1-2-1-ronald-street-gobbagombalin-nsw-2650
60581	House	2022-07-05	$849,000	2022-10-10	Undisclosed	3	1	2		838.0	Sails Real Estate	19-berrambool-drive-merimbula-nsw-2548
60582	Unit	2022-07-05	Price Guide $575,000	2022-08-04	$525,000	3	2	2			One Agency Dwyer Properties	5-5-brodribb-court-merimbula-nsw-2548
60584	House	2022-07-05	$850,000+	2022-09-16	Undisclosed	3	1	1	0.0	834.0	LJ Hooker Woden/Weston	38-streeton-drive-rivett-act-2611
60586	Unit	2022-07-05	$430,000+	2022-08-24	$430,000	1	1	1	7.0		LJ Hooker Tuggeranong	301-13-15-challis-street-dickson-act-2602
60594	House	2022-07-05	865000	2023-03-08	$865,000	4	2	3		2796.0	Smile Elite	13-denbos-crescent-east-lismore-nsw-2480
60597	House	2022-07-05	$1,100,000 - $1,200,000	2022-07-15	Undisclosed	3	1	2		80.0	Ray White Canberra	5388-gundaroo-road-bellmount-forest-nsw-2581
60598	House	2022-07-05	By Negotiation	2022-08-23	$1,090,000	4	2	2	5.0	857.0	Town Residential	7-tazewell-circuit-nicholls-act-2913
60601	House	2022-07-05	SOLD BY Nicholas Lyell	2022-11-04	Undisclosed	5	2	2		643.0	McGoldrick Estate Agents	80-parker-crescent-berry-nsw-2535
60603	House	2022-07-05	AUCTION	2022-07-25	$1,220,000	4	2	3	2.0	1000.3	McIntyre Property	31-bernacchi-street-mawson-act-2607
60605	House	2022-07-05	$580,000	2022-09-12	$580,000	2	1	1		696.0	Smile Elite	41-wattle-street-fishermans-paradise-nsw-2539
60606	House	2022-07-05	$1,375,000 - $1,500,000	2022-08-23	Undisclosed	4	2	4		1433.0	PRD Wagga Wagga	9-hughes-court-lloyd-nsw-2650
60611	Apartment	2022-07-05	Offers over $685,000	2022-07-22	$695,000	2	2	1	6.0		Independent Gungahlin	204-55-dooring-street-dickson-act-2602
60613	House	2022-07-05	Contact Agent	2022-07-22	$575,000	2	1	1		293.0	Smile Elite	195a-havannah-street-bathurst-nsw-2795
60614	House	2022-07-05	$966,000	2022-09-16	$920,000	3	1	4	0.5	775.0	Michael Potter Real Estate	5-johnson-place-farrer-act-2607
60618	House	2022-07-05	Price Guide $1,300,000	2022-08-02	$1,210,000	4	3	2		928.0	Sails Real Estate	9-robin-close-merimbula-nsw-2548
60622	Apartment	2022-07-05	$455,000+	2022-07-29	$459,000	1	1	1	6.0	7061.0	Edge Ally Smith	211-7-irving-street-trilogy-apartments-phillip-act-2606
60623	House	2022-07-06	Auction	2022-07-30	Undisclosed	4	2	2	2.0		Luton Weston Creek & Molonglo Valley	21-pavonia-street-rivett-act-2611
60624	House	2022-07-06	Auction Guide $600,000	2022-07-30	$602,500	3	1	1	0.0	467.0	McCann Properties	40-greeves-street-wanniassa-act-2903
60629	Apartment	2022-07-06	SOLD	2022-08-23	Undisclosed	1	1	1	6.0		McGrath Canberra	34-21-battye-street-bruce-act-2617
60630	House	2022-07-06	Auction	2022-07-30	Undisclosed	4	2	2	6.0	582.0	Luton Gungahlin	109-everist-street-taylor-act-2913
60639	House	2022-07-06	Bidding Guide: $600,000	2022-07-30	$600,000	1	1	1		588.0	My Agent Team	35-golf-links-drive-batemans-bay-nsw-2536
60641	House	2022-07-06	Price Guide $850,000	2022-07-20	$860,000	4	2	2		764.0	Bella Coastal Property	127-warden-street-ulladulla-nsw-2539
60642	House	2022-07-06	Auction 10/09/2022	2022-09-10	Undisclosed	4	2	2	5.0	450.0	Ray White Canberra	123-christina-stead-street-franklin-act-2913
60646	House	2022-07-06	$540,000 - $560,000	2022-08-12	Undisclosed	4	2	3		760.0	Ray White Wagga Wagga	10-bandera-avenue-glenfield-park-nsw-2650
60647	House	2022-07-06	$450,000 - $490,000	2022-07-29	Undisclosed	3	2	1		962.0	PRD Wagga Wagga	26-fairbairn-crescent-kooringal-nsw-2650
60648	Townhouse	2022-07-06	$820,000	2022-09-23	$820,000	4	2	2	4.0		home.by holly	27-1-nevertire-street-lawson-act-2617
60650	House	2022-07-06	Auction	2022-07-30	$1,766,000	4	2	2	5.0	664.0	LJ Hooker Belconnen	186-majura-avenue-ainslie-act-2602
60653	House	2022-07-06	$1,450,000+	2022-08-18	Undisclosed	3	1	1	0.0	1008.0	LJ Hooker Belconnen	5-suttor-street-ainslie-act-2602
60654	Apartment	2022-07-06	$499,000+	2022-07-29	Undisclosed	1	1	1	6.0		Badenoch Real Estate	107-39-london-circuit-city-act-2601
60656	Townhouse	2022-07-06	600,000+	2022-08-02	$635,000	3	1	1	3.5	264.0	LJ Hooker Tuggeranong	11-41-ern-florence-crescent-theodore-act-2905
60662	Townhouse	2022-07-06	Auction	2022-07-21	$1,000,000	3	2	2	3.0		Luton Manuka	26-34-leahy-close-narrabundah-act-2604
60667	Townhouse	2022-07-06	offers over $845,000	2022-11-07	Undisclosed	3	2	2	1.5		Maloney's Property	17-23-jondol-place-isabella-plains-act-2905
60670	House	2022-07-06	$940,000	2022-09-05	$920,000	2	1	0		496.0	Sadil Quinlan	15-dorrit-black-crecent-lyneham-act-2602
60673	House	2022-07-06	$1,500,000	2022-09-20	$1,475,000	3	1	0	1.0	695.0	Sadil Quinlan	26-lawley-place-deakin-act-2600
60677	Townhouse	2022-07-06	$695,000+	2022-09-26	Undisclosed	3	2	2	6.0	5802.0	New Door Properties	24-12-dulcie-holland-crescent-moncrieff-act-2914
60678	House	2022-07-06	$625,000	2022-08-12	$610,000	2	1	1		949.0	My Agent Team	504-beach-road-denhams-beach-nsw-2536
60679	House	2022-07-06	$699,000	2022-11-01	$690,000	3	1	1	2.0	834.98	McIntyre Property	19-fullerton-crescent-richardson-act-2905
60681	House	2022-07-06	$439,000	2022-07-16	$439,000	3	1	2			Raine & Horne Goulburn	50-yarrowlow-street-goulburn-nsw-2580
60682	House	2022-07-06	Contact Agent	2022-07-26	Undisclosed	3	3	2		394.0	Smile Elite	44-shallows-drive-shell-cove-nsw-2529
60683	House	2022-07-06	Contact Agent	2022-08-09	$445,000	2	1	1			Smile Elite	2-7a-dees-close-gormans-hill-nsw-2795
60684	House	2022-07-06	$775,000- $825,000	2022-08-16	Undisclosed	3	1	0		879.0	Ray White Queanbeyan | Jerrabomberra	7-breden-place-crestwood-nsw-2620
60685	House	2022-07-06	Auction 08/10/2022	2022-10-08	Undisclosed	4	2	2	2.5	766.0	LJ Hooker Dickson	3-gow-street-ainslie-act-2602
60686	House	2022-07-06	By Negotiation	2022-08-04	$896,500	3	1	1	0.0	0.0	Wright Dunn Real Estate	19-novar-street-yarralumla-act-2600
60695	Apartment	2022-07-06	515,000+	2022-10-05	$520,000	1	1	1	6.0		LJ Hooker Canberra City	55-5-hely-street-griffith-act-2603
60697	Townhouse	2022-07-07	Auction	2022-07-28	$785,000	3	2	2	5.0		Luton Weston Creek & Molonglo Valley	1-2-rouseabout-street-lawson-act-2617
60698	House	2022-07-07	$899,000	2022-09-06	Undisclosed	3	1	1	1.0	790.0	Luton Weston Creek & Molonglo Valley	42-kambalda-crescent-fisher-act-2611
60699	House	2022-07-07	Auction	2022-07-30	Undisclosed	3	1	1	1.5	764.0	Luton Weston Creek & Molonglo Valley	67-croton-street-rivett-act-2611
60700	House	2022-07-07	Auction 10/09/2022	2022-09-21	Undisclosed	3	2	1		616.0	Ray White Canberra	24-elliott-street-crestwood-nsw-2620
60701	House	2022-07-07	Contact Agent	2022-07-30	Undisclosed	5	3	2	4.5		Independent Gungahlin	17-haddon-street-hackett-act-2602
60702	Apartment	2022-07-07	$522,500	2022-08-04	$522,500	2	2	2	6.0		McGrath Canberra	87-77-gozzard-street-gungahlin-act-2912
60704	Land	2022-07-07	By negotiation	2022-09-15	Undisclosed	0	0	0		1593.0	Morrissey Property	6-feltus-place-kambah-act-2902
60705	Apartment	2022-07-07	$465,000	2022-07-20	$465,000	2	1	1	4.0		home.by holly	52-53-mcmillan-crescent-griffith-act-2603
60706	House	2022-07-07	By Negotiation	2022-09-05	$1,205,000	4	2	2	4.0		Luton Gungahlin	45-clancy-mckenna-crescent-bonner-act-2914
60708	Apartment	2022-07-07	$350,000	2022-07-26	Undisclosed	1	1	1	6.0		Ray White Canberra	2-1-gungahlin-place-gungahlin-act-2912
60709	House	2022-07-07	$725,000+	2022-08-08	$725,000	3	1	1	5.5		home.by holly	14-whitmore-crescent-watson-act-2602
60710	Apartment	2022-07-07	$535,000	2022-08-23	$535,000	2	2	2	5.0		home.by holly	3-20-federal-highway-watson-act-2602
60711	House	2022-07-07	Auction: Saturday July 30th, on site at 9:00am	2022-07-30	Undisclosed	3	1	2	2.0		LJ Hooker Manuka	20-luffman-crescent-gilmore-act-2905
60712	House	2022-07-07	Auction 30/07/2022	2022-07-30	Undisclosed	3	1	4	1.0	664.0	Ray White Canberra	18-yaldwyn-place-kambah-act-2902
60715	Townhouse	2022-07-07	$549,000	2022-12-07	Undisclosed	2	1	1	3.5		My Morris	31-25-pinkerton-circuit-kambah-act-2902
60717	Apartment	2022-07-07	$439,000+	2022-08-30	$430,000	1	1	1	4.0		Ray White Canberra	3-2-henshall-way-macquarie-act-2614
60718	House	2022-07-07	Auction 23/07/2022	2022-07-23	Undisclosed	3	1	4	2.0	609.0	Ray White Canberra	52-goldstein-crescent-chisholm-act-2905
60719	MixedFarming	2022-07-07	EOI close 11th August 2022 at 10am	2022-09-13	Undisclosed	0	0	0		326.13	Raine & Horne Young	2-sandy-creek-road-grenfell-nsw-2810
60722	House	2022-07-07	$650,000+	2022-07-21	$721,000	2	1	2	3.5	563.0	Ray White Canberra	35-thornhill-crescent-dunlop-act-2615
60725	House	2022-07-07	$950,000+	2022-09-14	$935,000	3	1	2	1.5	694.0	Solely Properties	211-phillip-avenue-hackett-act-2602
60726	Land	2022-07-07	580000	2022-07-06	Undisclosed	0	0	0		5.2	Elders Real Estate Batemans Bay	55-old-bolaro-road-nelligen-nsw-2536
60728	House	2022-07-07	$1,000,000	2022-09-21	$1,000,000	3	2	1	2.0		home.by holly	10-letters-street-evatt-act-2617
60731	Unit	2022-07-07	Auction - Price Guide $349,000+	2022-07-28	$350,000	1	1	1	6.0		Luton Gungahlin	82-140-anketell-street-greenway-act-2900
60732	House	2022-07-07	Auction - Buyer's Guide: $1,050,000	2022-08-06	$1,000,000	3	1	0		158800.0	Ray White Rural Canberra | Yass	311-fairy-hole-road-yass-nsw-2582
60742	House	2022-07-07	Contact Agent	2022-08-18	Undisclosed	3	1	3		561.0	Smile Elite	12-scenic-circuit-cranebrook-nsw-2749
60743	House	2022-07-07	Auction 28/07/2022	2022-07-28	$612,000	3	1	0	2.5	381.0	Ray White Canberra	39-reader-court-banks-act-2906
60744	Townhouse	2022-07-07	$635,000+	2022-08-25	$650,000	3	2	2	6.0	0.0	LJ Hooker Gungahlin	52-36-dulcie-holland-crescent-moncrieff-act-2914
60745	Townhouse	2022-07-07	$770,000+	2022-08-05	Undisclosed	3	2	2	1.0	401.0	One Agency Sandy Morris	7-43-derrington-crescent-bonython-act-2905
60748	House	2022-07-07	$790,000 - $830,000	2022-10-20	$810,000	3	2	2		414.7	Ward Estate Agents	48-thomas-royal-gardens-queanbeyan-nsw-2620
60749	Apartment	2022-07-07	$525,000+	2022-07-22	Undisclosed	2	2	2	6.0		Badenoch Real Estate	404-9-watkin-street-bruce-act-2617
60750	Apartment	2022-07-07	contact agent	2022-07-28	Undisclosed	3	2	1	3.5		home.by holly	59-18-leichhardt-street-griffith-act-2603
60752	House	2022-07-07	Contact Agent	2022-08-16	Undisclosed	2	1	2		1094.0	dwell Realty	87-tallyan-point-road-basin-view-nsw-2540
60753	House	2022-07-07	Auction	2022-08-03	$1,425,000	5	2	3	2.0	887.0	LJ Hooker Kaleen	59-gascoyne-circuit-kaleen-act-2617
60760	Apartment	2022-07-07	$485,000+	2022-11-10	$471,000	1	1	1	4.5		LJ Hooker Dickson	13-34-dooring-street-dickson-act-2602
60761	House	2022-07-07	Contact Agent	2022-08-04	$840,000	3	1	1		465.0	Smile Elite	7-sextans-place-cranebrook-nsw-2749
60763	House	2022-07-07	Contact Agent	2022-09-21	Undisclosed	5	3	2		8272.0	Henley Property - Jindabyne	19-acacia-place-east-jindabyne-nsw-2627
60767	House	2022-07-07	$730,000+	2022-08-03	$725,000	3	1	1	0.5	694.31	McIntyre Property	4-grice-place-kambah-act-2902
60768	House	2022-07-07	Auction 30/07/2022	2022-07-30	Undisclosed	3	1	1	1.0	891.0	Ray White Canberra	3-greenhood-place-oconnor-act-2602
60788	Apartment	2022-07-07	$340,000+	2022-09-09	Undisclosed	1	1	1	5.0		Luton Kippax	18-68-hardwick-crescent-holt-act-2615
60789	House	2022-07-08	Auction	2022-07-30	Undisclosed	5	3	2	0.5		Luton Weston Creek & Molonglo Valley	22-golden-grove-red-hill-act-2603
60790	House	2022-07-08	$985,000	2022-07-30	$985,000	3	2	2	5.0		Hugo. Canberra	48-sugarloaf-circle-palmerston-act-2913
60791	Apartment	2022-07-08	Auction	2022-07-20	Undisclosed	1	1	1	5.5		Luton Manuka	29-17-oxley-street-griffith-act-2603
60794	Apartment	2022-07-08	$585,000+	2022-09-08	$605,000	2	2	1	6.0		LJ Hooker Dickson	14-1-ijong-street-braddon-act-2612
60795	House	2022-07-08	Auction 30/07/2022	2022-07-30	Undisclosed	3	1	1	3.0	407.0	Ray White Canberra	2-41-wilson-crescent-banks-act-2906
60798	House	2022-07-08	$780,000+	2022-09-01	$800,000	3	1	4	2.0	836.0	LJ Hooker Kippax	5-thomas-place-macgregor-act-2615
60803	House	2022-07-08	AUCTION	2022-08-01	$1,350,000	5	2	3	2.0	946.0	McIntyre Property	30-richter-close-fadden-act-2904
60806	Apartment	2022-08-30	$1,620,000	2022-11-01	Undisclosed	3	2	2	3.5	0.0	Berkely Residential	45-11-trevillian-quay-kingston-act-2604
60807	Townhouse	2022-08-31	$2,290,000	2022-09-02	$2,270,000	3	2	2	5.5	0.0	Berkely Residential	5-70-franklin-street-forrest-act-2603
60808	House	2022-07-08	$820,000 - $870,000	2022-08-08	$850,000	2	1	1		677.0	My Agent Team	27-iluka-avenue-malua-bay-nsw-2536
60812	Townhouse	2022-07-08	SOLD - $750,000	2022-07-21	$750,000	3	2	2	6.0		Stone Gungahlin	4-75-bellhouse-crescent-moncrieff-act-2914
60816	Unit	2022-07-08	$350,000 - $370,000	2022-07-29	$362,500	2	1	1		2215.0	McIntyre Property	2-30-trinculo-place-queanbeyan-nsw-2620
60819	House	2022-07-08	$439,000+	2022-08-29	Undisclosed	1	1	1			Bastion Property Group	81-99-eastern-valley-way-belconnen-act-2617
60820	Townhouse	2022-07-08	$988,000+	2022-07-28	Undisclosed	3	2	2	5.0		Bastion Property Group	10-61-launceston-street-lyons-act-2606
60823	DuplexSemi-detached	2022-07-08	contact agent	2022-08-04	Undisclosed	3	2	1	3.0	524.0	home.by holly	60-blamey-crescent-campbell-act-2612
60826	House	2022-07-08	$849,000+	2022-08-11	Undisclosed	3	2	2	3.0	667.9	Ray White Canberra	29-hillebrand-street-page-act-2614
60828	House	2022-07-08	$859,000	2022-09-02	$850,000	4	2	2		1000.0	Ray White Goulburn	11-straker-road-goulburn-nsw-2580
60839	Villa	2022-07-08	$344,000	2023-05-26	$332,000	2	1	1		180.0	Marshall and Tacheci Real Estate	7-891-wallaga-lake-road-wallaga-lake-nsw-2546
60840	Lifestyle	2022-07-08	By Negotiation- Vicinity of $490,000-$530,000	2022-09-23	$510,000	0	0	1		16.82	Marshall and Tacheci Real Estate	720-yowrie-road-yowrie-nsw-2550
60847	Alpine	2022-07-08	Auction	2022-08-09	Undisclosed	4	2	6		21.09	Henley Property - Jindabyne	6069-snowy-mountains-highway-adaminaby-nsw-2629
60854	House	2022-07-11	Contact Agent	2022-09-26	$1,170,000	5	3	2		300.0	Smile Elite	15-carisbrook-street-north-kellyville-nsw-2155
60855	House	2022-07-11	Contact Agent	2022-07-20	$1,270,000	4	2	2		416.0	Smile Elite	64-carney-crescent-schofields-nsw-2762
60859	Townhouse	2022-07-11	Contact Agent	2022-08-18	$845,000	4	2	1			Smile Elite	20-raspberry-crescent-schofields-nsw-2762
60860	House	2022-07-11	$1,160,000	2022-08-19	$1,160,000	4	2	1		342.3	Smile Elite	33-antonia-parade-schofields-nsw-2762
60861	House	2022-07-11	Contact Agent	2022-07-21	$1,351,000	5	3	2		300.0	Smile Elite	16-valiant-street-schofields-nsw-2762
60865	House	2022-07-11	$1,110,000	2022-09-29	$1,110,000	5	3	1		250.0	Smile Elite	59-christy-drive-schofields-nsw-2762
60866	House	2022-07-11	AUCTION GUIDE $450,000	2022-08-19	$475,000	2	1	1			Ray White Goulburn	22-auburn-street-goulburn-nsw-2580
60872	House	2022-07-11	AUCTION - 19th August 2022	2022-08-01	$625,000	3	1	1		526.0	Ray White Goulburn	45-victoria-street-goulburn-nsw-2580
60888	House	2022-07-11	$859,000	2022-09-27	$828,000	4	2	2		1897.0	Ray White Goulburn	12-george-street-collector-nsw-2581
60895	House	2022-07-11	$470,000	2022-08-11	$470,000	3	1	1		687.0	PRD Wagga Wagga	103-pugsley-avenue-estella-nsw-2650
60897	Apartment	2022-07-11	Auction 06/08/2022	2022-08-06	Undisclosed	2	2	2	6.0		Ray White Canberra	154-15-coranderrk-street-city-act-2601
60901	Townhouse	2022-07-11	$719,990+	2022-08-17	$715,000	3	1	1	6.0		LJ Hooker Gungahlin	10-2-lander-crescent-amaroo-act-2914
60902	Unit	2022-07-11	$520,000+	2022-09-06	$520,000	2	1	1	6.0		LJ Hooker Dickson	1-18-whitmore-crescent-watson-act-2602
60907	House	2022-07-12	Sold prior to Auction	2022-07-28	$740,000	3	1	1	6.0	250.0	LJ Hooker Gungahlin	4-schrieber-place-bonner-act-2914
60916	House	2022-07-12	SOLD	2022-08-16	Undisclosed	4	2	2	6.0	553.0	Stone Gungahlin	6-oshane-street-bonner-act-2914
60921	Townhouse	2022-07-12	Sold - $855,750	2022-07-27	$855,750	3	2	2	4.5		Stone Gungahlin	88-121-thynne-street-bruce-act-2617
60922	Townhouse	2022-07-12	SOLD - $625,000	2022-08-17	$625,000	2	2	1	6.0		Stone Gungahlin	6-2-neil-currie-street-casey-act-2913
60924	House	2022-07-12	Contact Agent	2022-09-14	$426,777	3	1	2		911.0	Smile Elite	15-mount-street-blayney-nsw-2799
60925	House	2022-07-12	Contact agent	2022-07-27	$486,500	3	1	1		761.0	Smile Elite	19-gormans-hill-road-gormans-hill-nsw-2795
60927	House	2022-07-12	$880,000	2022-12-01	$850,000	2	1	1		715.0	Bella Coastal Property	602-murramarang-road-kioloa-nsw-2539
60928	House	2022-07-12	$1,185,000	2022-10-24	Undisclosed	4	1	5		8000.0	Ray White Canberra	18-sorrell-close-bungendore-nsw-2621
60930	House	2022-07-12	$675,000	2022-09-13	$625,000	3	1	0			LJ Hooker Moruya	63-evans-street-moruya-nsw-2537
60931	Apartment	2022-07-12	$490,000+	2022-09-01	$485,000	2	1	1	5.0	0.0	Wright Dunn Real Estate	38-12-oliver-street-lyneham-act-2602
60938	Unit	2022-07-12	$390,000 - $410,000	2022-09-15	Undisclosed	2	1	1		223.0	Macarthur Real Estate Agency	1-6-chambers-place-wagga-wagga-nsw-2650
60942	House	2022-07-12	$859,000	2022-10-13	$842,500	4	2	2		700.0	Ray White Goulburn	7-success-street-goulburn-nsw-2580
60947	House	2022-07-12	$689,000	2023-10-23	Undisclosed	3	2	3		972.0	Smile Elite	14-wyrallah-road-east-lismore-nsw-2480
60948	Townhouse	2022-07-12	$849,000+	2022-08-10	Undisclosed	4	2	2	4.5		Luton Gungahlin	1-11-breen-street-casey-act-2913
60951	House	2022-07-12	$950,000	2022-09-19	$950,000	3	2	2	6.0	355.0	New Door Properties	1-vahland-street-taylor-act-2913
60953	House	2022-07-12	$990,000 - $1,060,000	2022-07-26	$1,040,000	4	2	3		830.0	My Agent Team	43-bunderra-circuit-malua-bay-nsw-2536
60955	House	2022-07-12	$659,000	2022-09-13	Undisclosed	3	1	2	0.0	600.0	Raine & Horne Queanbeyan | Jerrabomberra	17-derham-court-wanniassa-act-2903
60962	House	2022-07-12	Auction 06/08/2022	2022-08-06	Undisclosed	5	3	3		60.0	Ray White Canberra	93-mundays-lane-springrange-nsw-2618
60966	Townhouse	2022-07-12	Contact Agent	2022-09-05	$575,000	2	1	2			LJ Hooker Queanbeyan – Jerrabomberra – Googong	4-3-gerald-street-queanbeyan-nsw-2620
60968	Townhouse	2022-07-12	Auction 30/07/2022	2022-07-30	Undisclosed	3	2	2	6.0	5618.3	Ray White Canberra	9-7-eldridge-crescent-garran-act-2605
60971	House	2022-07-12	$325,000	2022-08-01	Undisclosed	3	1	1			Ray White Wagga Wagga	165-macleay-street-mount-austin-nsw-2650
60975	House	2022-07-12	$469,000	2022-07-28	$465,000	3	1	1		986.0	PRD Wagga Wagga	1-waranga-avenue-mount-austin-nsw-2650
60977	House	2022-07-12	Auction 6th August 1.30pm	2022-08-05	Undisclosed	4	3	2	6.0		McGrath Canberra	51-fairbrother-street-strathnairn-act-2615
60979	House	2022-07-12	Auction 6th August 3pm	2022-08-05	Undisclosed	3	2	1	6.0		McGrath Canberra	190-pro-hart-avenue-strathnairn-act-2615
60982	House	2022-07-13	Auction Saturday 6th August at 11:15am	2022-08-06	$802,000	3	1	1	2.5	400.0	McCann Properties	185-clive-steele-avenue-monash-act-2904
60984	House	2022-07-13	Auction	2022-08-06	$1,100,000	3	2	2	5.5	340.0	Luton Gungahlin	80-krantzcke-circuit-nicholls-act-2913
60989	House	2022-07-13	$1,175,000	2022-09-05	Undisclosed	4	2	2	4.5	525.0	Luton Manuka	72-carpentaria-street-harrison-act-2914
60990	Apartment	2022-07-13	$499,000 - $529,000	2022-08-04	Undisclosed	2	1	1	4.0		LJ Hooker Manuka	6-40-leahy-close-narrabundah-act-2604
60992	Land	2022-07-13	$633,900	2023-09-13	$621,900	0	0	0	0.0	654.0	Village	lot-840-34-speargrass-road-tralee-nsw-2620
60997	Apartment	2022-07-13	Auction	2022-08-11	$750,000	2	2	2	6.0		LJ Hooker Canberra City	622-2-anzac-park-campbell-act-2612
60998	House	2022-07-13	Auction 04/08/2022	2022-08-03	$900,000	3	2	4	2.0	727.0	Ray White Canberra	18-skardon-street-kaleen-act-2617
61002	House	2022-07-13	AUCTION Guide $580,000	2022-08-13	$618,000	3	1	2		436.0	Raine & Horne Goulburn	19-lithgow-street-goulburn-nsw-2580
61004	House	2022-07-13	Price Guide $650,000	2023-05-24	Undisclosed	1	1	0		567.0	Whale Coast Realty	17-bate-street-central-tilba-nsw-2546
61006	House	2022-07-13	$795,000+	2022-08-01	$845,000	3	1	2	1.5	773.0	LJ Hooker Kippax	12-brazel-street-higgins-act-2615
61009	Unit	2022-07-13	$499,950	2022-08-12	$490,000	2	1	1	4.0		LJ Hooker Belconnen	7-48-madigan-street-hackett-act-2602
61010	House	2022-07-13	Auction	2022-07-30	$800,000	3	1	1	2.0	894.0	LJ Hooker Belconnen	5-chuculba-crescent-giralang-act-2617
61011	House	2022-07-13	Auction	2022-07-30	$1,685,000	3	2	1	1.0	948.0	LJ Hooker Belconnen	58-ormond-street-turner-act-2612
61013	House	2022-07-13	$850,000	2022-08-10	$825,000	4	2	0			My Agent Team	8-malua-street-malua-bay-nsw-2536
61017	House	2022-07-13	Sold at auction for $1,620,000	2022-07-30	$1,620,000	5	3	2	6.0	540.0	McGrath Canberra	8-quenda-close-throsby-act-2914
61018	House	2022-07-13	$830,000 +	2022-08-08	$855,000	3	2	2	3.0	800.0	LJ Hooker Tuggeranong	2-abercrombie-circuit-banks-act-2906
61019	Apartment	2022-07-13	$720,000+	2022-10-13	Undisclosed	3	2	2	4.0	7026.29	Ray White Canberra	38-11-stockman-avenue-lawson-act-2617
61020	Apartment	2022-07-13	$670,000+	2022-08-23	$690,000	2	2	2	6.0		LJ Hooker Tuggeranong	176-15-coranderrk-street-canberra-act-2601
61021	Unit	2022-07-13	Price Guide $699,000	2022-07-12	$699,000	3	2	4			One Agency Dwyer Properties	2-22-berrambool-drive-merimbula-nsw-2548
61026	House	2022-07-13	$440,000 - $480,000	2022-09-23	Undisclosed	3	2	3		702.0	Macarthur Real Estate Agency	3-waranga-avenue-mount-austin-nsw-2650
61027	Apartment	2022-07-13	$800,000+	2022-08-17	Undisclosed	3	2	2	6.0		LJ Hooker Canberra City	806-102-swain-street-gungahlin-act-2912
61030	House	2022-07-13	Contact Agent	2022-08-08	$1,210,000	4	3	3		664.0	Smile Elite	13-sandalwood-avenue-st-clair-nsw-2759
61031	Townhouse	2022-07-13	Contact Agent	2022-08-03	Undisclosed	2	1	1			Smile Elite	5-12-16-cupania-court-tweed-heads-west-nsw-2485
61036	Unit	2022-07-13	$300,000	2022-09-30	$290,000	2	1	1			InHouse Real Estate	unit-1-6-12-irene-cres-eden-nsw-2551
61040	House	2022-07-13	Auction 04/08/2022	2022-08-04	$925,000	3	1	2	4.5	846.0	Ray White Canberra	140-chuculba-crescent-giralang-act-2617
61041	House	2022-07-13	$529,000	2022-08-03	Undisclosed	3	1	2		680.7	PRD Wagga Wagga	45-barrima-drive-glenfield-park-nsw-2650
61042	Unit	2022-07-13	$430,000-$450,000	2022-10-21	$420,000	2	2	2		6550.0	Sails Real Estate	22-1-dunns-lane-merimbula-nsw-2548
61043	House	2022-07-13	Contact Agent	2022-09-08	$552,000	3	1	2		827.0	Smile Elite	51a-morrisset-street-bathurst-nsw-2795
61048	House	2022-07-13	Contact Agent	2022-08-31	$840,000	3	1	2	0.5	792.0	Maria Selleck Properties	20-burkitt-street-page-act-2614
61059	House	2022-07-14	Auction	2022-08-06	Undisclosed	4	2	4	2.5	887.0	Luton Weston Creek & Molonglo Valley	22-hyndes-crescent-holder-act-2611
61061	House	2022-07-14	Auction	2022-08-06	Undisclosed	4	2	2	1.5	867.0	Luton Manuka	60-rosenthal-street-campbell-act-2612
61063	House	2022-07-14	Contact agent	2022-08-12	Undisclosed	3	2	1	2.0	725.0	home.by holly	12-castlereagh-crescent-macquarie-act-2614
61065	House	2022-07-14	$1,275,000	2022-10-13	Undisclosed	3	2	2	5.0	1210.0	Luton Manuka	37-hurley-street-mawson-act-2607
61068	Apartment	2022-07-14	$379,000+	2022-07-21	Undisclosed	2	1	1	3.0		Ray White Canberra	18-1-9-totterdell-street-belconnen-act-2617
61069	House	2022-07-14	$949,000+	2022-08-19	Undisclosed	3	1	4	2.0	786.0	Ray White Canberra	53-liverpool-street-macquarie-act-2614
61071	House	2022-07-14	$429,000	2022-08-08	Undisclosed	3	1	2			Ray White Wagga Wagga	32-temerloh-avenue-tolland-nsw-2650
61073	House	2022-07-14	$995,000	2022-08-06	$995,000	4	2	2	3.0	679.0	McGrath Canberra	29-mornington-street-amaroo-act-2914
61077	House	2022-07-14	Auction	2022-08-03	$675,000	3	1	0	2.5	742.0	Bertram Ellis	34-harford-street-richardson-act-2905
61078	Townhouse	2022-07-14	Auction	2022-08-06	$1,010,000	3	2	1	1.5		Luton Dickson	6-6-8-fawkner-street-braddon-act-2612
61079	House	2022-07-14	Auction	2022-07-22	$820,000	3	2	2	5.0	480.0	LJ Hooker Belconnen	38-simonetti-street-dunlop-act-2615
61080	Land	2022-07-14	Contact Agent	2022-10-07	$410,000	0	0	0		3640.0	Ray White Braidwood	29-station-street-braidwood-nsw-2622
61081	Townhouse	2022-07-14	$830,000+	2022-08-05	$832,500	4	2	2	4.5	259.0	McGrath Canberra	43-katoomba-street-harrison-act-2914
61084	Unit	2022-07-14	Under Offer	2022-08-12	$397,000	2	1	0	2.0		Cream Residential	14-9-wark-street-hughes-act-2605
61086	Unit	2022-07-14	Price Guide $440,000	2022-08-10	$417,000	2	1	1			One Agency Dwyer Properties	4-121-merimbula-drive-merimbula-nsw-2548
61092	House	2022-07-14	$469,000 - $489,000	2022-08-05	Undisclosed	3	1	2		744.0	Ray White Wagga Wagga	30-incarnie-crescent-wagga-wagga-nsw-2650
61093	Townhouse	2022-07-14	contact agent	2022-08-11	Undisclosed	3	2	2	4.5		home.by holly	11-2-6-merri-place-conder-act-2906
61094	House	2022-07-14	$739,000	2022-10-24	Undisclosed	3	1	0	1.0	766.0	My Morris	10-broad-place-kambah-act-2902
61095	Apartment	2022-07-14	Auction, Wednesday August 10th at 6:00pm	2022-08-05	$590,000	2	2	2	6.0		LJ Hooker Gungahlin	16-92-mcmichael-terrace-denman-prospect-act-2611
61096	House	2022-07-14	$639,000+	2022-08-11	Undisclosed	3	1	1	5.0	314.0	Ray White Canberra	2-syron-place-ngunnawal-act-2913
61097	House	2022-07-14	SOLD AT AUCTION	2022-08-06	$1,500,000	5	3	2	3.0	977.0	Cream Residential	18-brookman-street-torrens-act-2607
61098	Apartment	2022-07-14	$545,000	2022-07-22	$545,000	1	1	1	6.0		home.by holly	104-17-state-circle-forrest-act-2603
61100	Apartment	2022-07-14	Auction	2022-07-22	Undisclosed	2	2	2	6.0		Luton Tuggeranong	38-29-dawes-street-kingston-act-2604
61102	Apartment	2022-07-14	By Negotiation	2022-07-25	Undisclosed	2	2	2	6.0		Ray White Canberra	12-50-lowanna-street-braddon-act-2612
61103	House	2022-07-14	$880,000+	2022-08-03	Undisclosed	4	2	2	4.0	542.61	LJ Hooker Kippax	5-quinlivan-crescent-dunlop-act-2615
61104	House	2022-07-14	$1,700,000+	2022-10-19	Undisclosed	5	3	2	1.5	1089.0	My Morris	6-clark-place-kambah-act-2902
61108	Land	2022-07-14	$339,000	2022-07-26	$315,000	0	0	0		580.0	LJ Hooker Malua Bay	5a-litchfield-crescent-long-beach-nsw-2536
61109	House	2022-07-14	$900,000+	2022-10-07	$890,000	4	2	2	3.5	1029.0	McIntyre Property	21-dobell-circuit-conder-act-2906
61114	Townhouse	2022-07-14	Auction 06/08/2022	2022-08-06	Undisclosed	2	1	1	2.5	498.0	Ray White Canberra	6-70-bourne-street-cook-act-2614
61119	Townhouse	2022-07-14	Auction	2022-08-06	Undisclosed	3	2	2	5.0		Luton Tuggeranong	2-30-lyttleton-crescent-cook-act-2614
61120	House	2022-07-14	$1,088,000+	2022-09-02	Undisclosed	4	2	2	5.5	450.0	Bastion Property Group	26-ruby-hunter-rise-moncrieff-act-2914
61121	Apartment	2022-07-14	Contact Agent	2022-10-21	Undisclosed	1	1	1			Smile Elite	2313-43-45-wilson-street-botany-nsw-2019
61122	House	2022-07-14	$1,099,000	2022-09-13	Undisclosed	3	1	0	0.0	562.0	Ray White Canberra	20-piper-street-ainslie-act-2602
61123	House	2022-07-14	Auction 30/07/2022	2022-07-30	Undisclosed	3	2	1	3.5	242.0	Ray White Canberra	12-gosse-street-kingston-act-2604
61124	House	2022-07-14	Auction 04/08/2022	2022-08-04	$615,000	2	1	1	2.0	385.0	Ray White Canberra	1-burdon-place-holt-act-2615
61125	Apartment	2022-07-14	$325,000	2022-08-11	$330,000	1	1	1	5.0		LJ Hooker Belconnen	12-31-moulden-court-belconnen-act-2617
61126	House	2022-07-14	$750,000	2022-08-25	Undisclosed	3	1	1	3.0	694.0	Civium Property Group - Residential	1-sharland-place-holder-act-2611
61128	House	2022-07-14	Auction	2022-08-11	$903,000	3	2	2	4.5	429.0	Luton Gungahlin	19-rollston-street-amaroo-act-2914
61131	Unit	2022-07-14	$239,000	2022-09-27	Undisclosed	1	1	1		100.0	Macarthur Real Estate Agency	3-2-banks-avenue-kooringal-nsw-2650
61137	House	2022-07-14	Auction	2022-08-06	$1,160,000	5	3	2	1.0	992.2	LJ Hooker Woden/Weston	5-bock-place-weston-act-2611
61138	Townhouse	2022-07-14	$675,000	2022-08-30	Undisclosed	3	2	2	5.0		Badenoch Real Estate	7-15-wanliss-street-latham-act-2615
61139	House	2022-07-14	$590,000 - $620,000	2022-09-23	$575,000	3	1	1		582.0	One Agency Craig Schofield	2-smith-street-cooma-nsw-2630
61142	Land	2022-07-14	SOLD	2022-08-04	$780,000	0	0	0		852.0	Henley Property - Jindabyne	11-alice-street-jindabyne-nsw-2627
61145	Apartment	2022-07-15	Offers over $430,000	2022-08-24	$437,000	1	1	1	6.0		Luton Manuka	102-8-jardine-street-kingston-act-2604
61146	House	2022-07-15	$1,075,000	2022-10-26	Undisclosed	3	2	3		2040.0	Ray White Canberra	3-lind-street-gundaroo-nsw-2620
61150	House	2022-07-15	$1,700,000	2022-10-27	Undisclosed	3	3	4		556.0	LJ Hooker Narooma	101-dalmeny-drive-kianga-nsw-2546
61152	House	2022-07-15	Auction	2022-08-06	Undisclosed	4	2	2	1.5	988.0	Luton Kippax	126-osburn-drive-macgregor-act-2615
61162	Livestock	2022-07-15	Auction Guide $5,600,000	2022-08-05	Undisclosed	4	2	5		58.5	Ray White Bowral	662-sheepwash-road-avoca-nsw-2577
61169	House	2022-07-15	AUCTION - Saturday 20th of August at 11am	2022-08-20	$1,040,000	4	2	5		1.73	LJ Hooker Moruya	19-glenduart-grove-moruya-nsw-2537
61170	House	2022-07-15	$890,000	2023-03-23	$820,000	3	2	1		1897.0	Henley Property - Cooma	43-james-street-berridale-nsw-2628
61171	House	2022-07-15	$650,000	2022-08-11	$650,000	5	3	2		881.0	Raine & Horne Goulburn	3-dianella-place-goulburn-nsw-2580
61172	Apartment	2022-07-15	$830,000 Plus	2022-08-29	$864,000	2	2	2	6.0		Maloney's Property	22-43-blackall-street-barton-act-2600
61177	House	2022-07-15	Forthcoming Auction	2022-10-14	$1,420,000	2	1	1		834.7	Ray White Batemans Bay	92-annetts-parade-mossy-point-nsw-2537
61179	House	2022-07-15	Contact Agent	2022-08-03	$1,190,000	5	3	2		248.0	Smile Elite	57-heathland-avenue-schofields-nsw-2762
61182	Apartment	2022-07-15	Contact Agent	2022-09-07	Undisclosed	2	2	1		150.0	Smile Elite	93-459-463-church-street-parramatta-nsw-2150
61183	House	2022-07-15	Contact Agent	2022-08-01	$1,168,000	4	2	2		325.1	Smile Elite	6-mayfair-street-schofields-nsw-2762
61193	Apartment	2022-07-15	Price Guide $400,000 - $440,000	2022-08-29	$410,000	2	1	1			Sails Real Estate	1-3-philip-wolumla-nsw-2550
61194	House	2022-07-15	Price Guide: $925,000 to $940,000	2022-09-29	$930,000	4	2	3		686.0	McGoldrick Estate Agents	7-fantail-street-south-nowra-nsw-2541
61204	House	2022-07-15	$2,250,000	2022-11-03	$2,050,000	2	3	4		2.0	Henley Property - Jindabyne	101-spring-hill-road-east-jindabyne-nsw-2627
61205	Apartment	2022-07-15	$559,000	2022-08-29	$575,000	2	1	1	6.0		The Real Estate Shop	114-55-dooring-street-dickson-act-2602
61206	House	2022-07-16	NEW PRICE - $799,500	2022-11-15	$799,000	4	2	4		632.0	Fraser-Gray Real Estate	18-kingston-place-tomakin-nsw-2537
61211	House	2022-07-18	$940,000	2023-02-14	Undisclosed	4	2	4		917.0	LJ Hooker Narooma	9-brighton-park-road-wallaga-lake-nsw-2546
61223	Lifestyle	2022-07-18	Price Range $690,000 - $750,000	2022-09-13	$700,000	0	0	0			Ray White Goulburn	241-marian-vale-road-goulburn-nsw-2580
61228	Alpine	2022-07-18	Auction	2022-08-09	Undisclosed	8	4	4		38.5	Henley Property - Jindabyne	6067-snowy-mountains-highway-adaminaby-nsw-2629
61232	House	2022-07-18	$839,000	2022-09-16	$810,000	3	2	2	4.0	755.2	McIntyre Property	65-lewis-luxton-avenue-gordon-act-2906
61233	House	2022-07-18	$805,000+	2022-08-08	$806,000	3	1	1	2.0	406.0	Stone Gungahlin	26-rubicon-street-kaleen-act-2617
61237	Lifestyle	2022-07-18	AUCTION - 19th August 2022	2022-08-19	$1,750,000	5	3	3		25.0	Ray White Goulburn	19-marble-hill-road-goulburn-nsw-2580
61240	House	2022-07-18	AUCTION GUIDE $500,000	2022-08-19	$531,000	3	1	2		947.0	Ray White Goulburn	6-komungla-crescent-goulburn-nsw-2580
61243	House	2022-07-18	Auction	2022-08-12	Undisclosed	4	2	3	1.5	1485.0	Luton Tuggeranong	5-lomman-place-kambah-act-2902
61252	House	2022-07-18	$879,000	2022-09-29	Undisclosed	4	2	2		1000.0	Macarthur Real Estate Agency	49-brindabella-drive-tatton-nsw-2650
61255	Apartment	2022-07-18	$399,000+	2022-12-09	$421,000	1	1	1	6.0		Stone Gungahlin	134-10-ipima-street-braddon-act-2612
61261	Apartment	2022-07-18	$720,000	2022-08-26	$715,000	3	1	2			Henley Property - Jindabyne	15-121-gippsland-street-jindabyne-nsw-2627
61265	House	2022-07-19	AUCTION 13 August 12.45 pm	2022-07-28	$1,100,000	4	2	2		916.2	Ward Estate Agents	1-bocciarini-court-jerrabomberra-nsw-2619
61266	House	2022-07-19	AUCTION 13 August 9.45 am	2022-08-03	Undisclosed	4	2	1		657.0	Ward Estate Agents	6-wangara-cres-queanbeyan-nsw-2620
61270	Unit	2022-07-19	$290,000 - $319,000	2022-08-10	Undisclosed	2	1	1			McGrath Canberra	27-5-crest-road-crestwood-nsw-2620
61271	Townhouse	2022-07-19	$849,000+	2022-08-16	Undisclosed	3	2	2	5.0	301.0	Luton Gungahlin	70-ayrton-street-gungahlin-act-2912
61273	House	2022-07-19	Auction (If not sold prior!)	2022-08-13	Undisclosed	4	2	2		11.42	Raine & Horne Young	481-bribbaree-road-maimuru-nsw-2594
61277	House	2022-07-19	$959,000	2022-10-24	Undisclosed	3	2	2	5.0	401.0	LJ Hooker Woden/Weston	7-hibberd-crescent-forde-act-2914
61278	Apartment	2022-07-19	Offers over $295,000	2022-07-22	$300,000	2	1	1	1.0	0.0	Edge Adil Iqbal	18-153-muranji-hawker-act-2614
61280	House	2022-07-19	Auction	2022-08-13	$710,000	3	1	1	5.0	292.0	Luton Dickson	11-bunima-crescent-ngunnawal-act-2913
61281	House	2022-07-19	Contact Agent	2022-10-13	Undisclosed	4	2	2		770.0	Smile Elite	10-fairleigh-place-kelso-nsw-2795
61283	Apartment	2022-07-19	Sold at Auction $690,000	2022-08-13	$690,000	2	1	1	6.0		McGrath Canberra	503-22-lonsdale-street-braddon-act-2612
61284	BlockOfUnits	2022-07-19	AUCTION (If not sold prior)	2022-08-12	Undisclosed	2	2	2		536.0	Raine & Horne Young	1-2-86-nasmyth-street-young-nsw-2594
61287	House	2022-07-19	$850,000 - $890,000	2022-08-18	$825,000	4	2	1		556.0	My Agent Team	56-surf-beach-avenue-surf-beach-nsw-2536
61289	House	2022-07-19	MUST BE SOLD - $780,000	2022-09-19	$792,000	3	2	0		796.3	Ray White Rural Canberra | Yass	30-yeo-crescent-yass-nsw-2582
61293	House	2022-07-19	Auction 11/8/2022	2022-08-11	Undisclosed	4	2	2	1.5		Ray White Canberra	14-sanford-place-kaleen-act-2617
61295	House	2022-07-19	$699,000	2022-10-11	$699,000	4	2	2			McCann Properties	18-wombat-street-gunning-nsw-2581
61300	House	2022-07-19	$839,000+	2022-08-30	Undisclosed	4	2	2	4.5	878.0	Ray White Canberra	23-karney-street-kambah-act-2902
61305	House	2022-07-19	$279 000	2022-08-09	Undisclosed	2	1	3		784.0	Raine & Horne Young	40-forsythe-avenue-young-nsw-2594
61306	House	2022-07-19	AUCTION	2022-08-04	$620,000	3	1	5		1011.0	Raine & Horne Goulburn	54-mulwaree-street-goulburn-nsw-2580
61310	Townhouse	2022-07-19	$615,000	2022-08-24	Undisclosed	3	1	2	1.5		Ray White Canberra	23-8-jondol-place-isabella-plains-act-2905
61312	House	2022-07-19	$1,070,000 - $1,170,000	2022-08-19	$1,100,000	4	2	4		603.0	My Agent Team	107-northcove-road-long-beach-nsw-2536
61314	House	2022-07-19	$1,200,000	2022-09-26	$1,100,000	3	2	3			LJ Hooker Moruya	8-burra-place-congo-nsw-2537
61316	House	2022-07-19	Guide $1,395,000 to $1,495,000	2022-08-26	$1,387,750	5	3	2		743.0	Ray White Bowral	1-hercules-close-moss-vale-nsw-2577
61317	House	2022-07-20	$960,000	2022-08-25	Undisclosed	4	2	2	4.5	387.0	McGrath Canberra	15-kowalski-street-casey-act-2913
61322	Apartment	2022-07-20	$460,000	2022-09-12	$460,000	2	2	1	6.0		home.by holly	132-61-john-gorton-drive-wright-act-2611
61327	Unit	2022-07-20	$693,000	2022-09-30	$693,000	2	1	1			Dwyer Properties Sapphire Coast	7-52-fishpen-road-merimbula-nsw-2548
61329	House	2022-07-20	$1,050,000 - $1,100,000	2022-11-04	$980,000	4	2	2		753.0	Ray White Queanbeyan | Jerrabomberra	1-stringybark-drive-jerrabomberra-nsw-2619
61330	House	2022-07-20	Auction 10/09/2022	2022-08-12	Undisclosed	3	1	2	4.5	288.0	Ray White Canberra	16-gamban-square-ngunnawal-act-2913
61331	AcreageSemi-rural	2022-07-20	$409,000	2023-06-08	Undisclosed	1	1	6		21700.0	InHouse Real Estate	20-22-nangutta-st-towamba-nsw-2550
61332	Land	2022-07-20	$325,000	2022-11-23	$320,000	0	0	0		4097.0	Clearwater Real Estate Narooma	23-31-bermaguee-st-quaama-nsw-2550
61335	Townhouse	2022-07-20	Auction 13th Aug 11:00am	2022-08-13	$673,000	3	1	1	1.0	600.0	LJ Hooker Tuggeranong	18-210-newman-morris-circuit-oxley-act-2903
61337	Townhouse	2022-07-20	Auction	2022-08-13	Undisclosed	3	1	1	4.0	3945.7	Ray White Canberra	4-4-biddell-place-nicholls-act-2913
61338	House	2022-07-20	$799,000+	2022-10-27	Undisclosed	4	1	4	1.0	719.0	Ray White Canberra	96-enid-lorimer-circuit-chisholm-act-2905
61339	House	2022-07-20	Auction	2022-08-02	Undisclosed	4	2	2		1714.0	Timothy Road	13-wilson-place-yass-nsw-2582
61341	Apartment	2022-07-20	$560,000	2022-09-16	$560,000	2	2	1	6.0		LJ Hooker Belconnen	149-41-chandler-street-belconnen-act-2617
61342	House	2022-07-20	$769,000	2022-09-20	Undisclosed	4	2	2		704.5	PRD Wagga Wagga	79-jumbuck-drive-gobbagombalin-nsw-2650
61343	House	2022-07-20	Auction	2022-08-13	$1,362,000	4	2	2	4.0	1105.0	LJ Hooker Belconnen	87-erldunda-circuit-hawker-act-2614
61344	House	2022-07-20	$689,000+	2022-08-04	$700,000	2	1	2	4.5	530.0	Luton Tuggeranong	7-pullar-place-gordon-act-2906
61348	House	2022-07-20	SOLD PRIOR TO AUCTION-$1,107,000	2022-08-05	$1,107,000	5	2	2	4.0	699.0	Stone Gungahlin	5-tubman-place-nicholls-act-2913
61349	House	2022-07-20	$790,000 - $850,000	2022-11-25	$780,000	4	2	2		659.0	My Agent Team	7-rodgers-street-long-beach-nsw-2536
61358	House	2022-07-20	Price Guide $995,000	2022-08-10	$975,000	4	3	2		754.0	One Agency Dwyer Properties	30-tantawangalo-street-merimbula-nsw-2548
61360	Apartment	2022-07-20	$633,500	2022-08-09	$633,500	2	2	2	6.0		home.by holly	805-17-dooring-street-braddon-act-2612
61362	House	2022-07-20	Contact Agent	2023-02-14	Undisclosed	4	2	2			Smile Elite	8-pluto-place-dunmore-nsw-2529
61367	House	2022-07-20	SOLD at Auction $1,110,000	2022-08-13	$1,110,000	4	2	2	6.0	525.0	New Door Properties	110-rob-riley-circuit-bonner-act-2914
61374	House	2022-07-20	By Negotiation	2022-09-14	$1,655,000	5	4	3	4.5	0.0	Confidence Real Estate	6-pownall-street-franklin-act-2913
61381	Lifestyle	2022-07-20	Auction	2022-08-12	$757,500	4	1	0			Ray White Goulburn	371-tyrl-tyrl-road-crookwell-nsw-2583
61383	House	2022-07-21	Auction	2022-08-13	Undisclosed	4	2	2	1.0	770.0	Luton Weston Creek & Molonglo Valley	25-spalding-street-flynn-act-2615
61384	House	2022-07-21	Auction	2022-08-13	Undisclosed	5	2	4	5.0		Luton Gungahlin	15-neales-street-kaleen-act-2617
61387	Lifestyle	2022-07-21	Auction	2022-08-09	Undisclosed	8	4	4		38.5	Henley Property - Jindabyne	6067-snowy-mountains-highway-adaminaby-nsw-2629
61388	House	2022-07-21	By negotiation	2022-09-08	$857,500	4	1	4	4.5	859.0	Morrissey Property	57-badenoch-crescent-evatt-act-2617
61394	House	2022-07-21	$769,000	2022-10-18	$740,000	3	2	1			LJ Hooker Malua Bay	unit-6-62-64-smith-street-broulee-nsw-2537
61395	House	2022-07-21	Auction 11/08/2022	2022-08-11	Undisclosed	3	2	2	3.5	470.0	Ray White Canberra	23-hugh-mckay-crescent-dunlop-act-2615
61397	House	2022-07-21	AUCTION - DECLARED RESERVE: $695,000	2022-08-20	$741,000	3	2	1		668.0	LJ Hooker Batemans Bay	60-maloneys-drive-maloneys-beach-nsw-2536
61398	Apartment	2022-07-21	$635,000	2022-08-12	$635,000	2	2	1	6.0		home.by holly	402-45-furzer-street-phillip-act-2606
61400	House	2022-07-21	Auction 11/08/2022	2022-08-11	Undisclosed	4	2	2	2.0	823.0	Ray White Canberra	7-dumas-street-mckellar-act-2617
61404	House	2022-07-21	Auction 11/08/2022	2022-08-11	$1,300,000	4	2	2	1.0	1066.0	Ray White Canberra	31-mathieson-crescent-weetangera-act-2614
61405	House	2022-07-21	$980 000	2022-08-10	Undisclosed	3	2	2		5.46	Raine & Horne Young	83-donges-road-young-nsw-2594
61407	House	2022-07-21	Auction	2022-08-06	Undisclosed	3	1	1	2.0		Badenoch Real Estate	7-abbott-street-yarralumla-act-2600
61408	House	2022-07-21	Auction 10/09/2022	2022-08-31	$1,450,000	5	3	2	5.5	605.0	Ray White Canberra	20-gourgaud-street-casey-act-2913
61409	House	2022-07-21	AUCTION	2022-08-04	Undisclosed	4	1	2	4.0	988.0	McIntyre Property	22-dalyell-street-chisholm-act-2905
61410	Unit	2022-07-21	$589,000+	2022-08-18	$595,000	2	2	2	0.0		Michael Potter Real Estate	417-1-anthony-rolfe-avenue-gungahlin-act-2912
61412	House	2022-07-21	$1,140,000+	2022-11-09	Undisclosed	5	3	2	4.5	545.0	McIntyre Property	15-lucy-beeton-crescent-bonner-act-2914
61413	Townhouse	2022-07-21	$780,000	2022-09-12	$800,000	3	1	2	2.0	305.0	Luton Tuggeranong	43-32-bunbury-street-stirling-act-2611
61415	House	2022-07-21	Auction	2022-08-20	$1,157,000	4	2	2	2.0	988.0	LJ Hooker Woden/Weston	2-cobar-place-fisher-act-2611
61417	Apartment	2022-07-21	Under Offer	2022-08-22	$377,000	1	1	1	0.0		Cream Residential	8-5-garran-place-garran-act-2605
61427	House	2022-07-21	Auction 13/08/2022	2022-08-13	Undisclosed	4	2	2	3.0		Ray White Canberra	3-holley-place-kaleen-act-2617
61428	Apartment	2022-07-21	Under Offer	2022-08-17	$445,000	1	1	1	6.0		Cream Residential	18-15-mower-place-phillip-act-2606
61430	House	2022-07-21	Contact Agent	2022-08-20	Undisclosed	5	2	2		481.0	VERV Property	30-carver-street-googong-nsw-2620
61434	Apartment	2022-07-21	$690,000	2022-08-20	$690,000	2	2	2	6.0		home.by holly	1-42-henty-street-braddon-act-2612
61436	House	2022-07-21	$999,000+	2022-08-01	Undisclosed	3	1	1	1.0		Badenoch Real Estate	62-blamey-crescent-campbell-act-2612
61437	House	2022-07-21	SOLD at Auction $925,000	2022-08-13	$925,000	3	2	2	6.0	350.0	New Door Properties	3-tredwell-street-strathnairn-act-2615
61438	House	2022-07-21	Auction 13/08/2022	2022-08-13	$1,488,000	2	1	1	1.0	1038.0	LJ Hooker Dickson	1-stephen-street-ainslie-act-2602
61441	Townhouse	2022-07-21	$565,000+	2022-08-27	Undisclosed	2	2	2	6.0		Luton Gungahlin	18-815-horse-park-drive-amaroo-act-2914
61442	Townhouse	2022-07-21	Auction	2022-08-17	$645,000	3	1	1	4.0	413.0	LJ Hooker Kaleen	100-mainwaring-rich-circuit-palmerston-act-2913
61444	House	2022-07-21	Auction	2022-08-17	$760,000	3	1	1	2.0	353.89	LJ Hooker Kaleen	49-ashkanasy-crescent-evatt-act-2617
61446	House	2022-07-21	$1,110,000+	2022-08-25	$1,100,000	4	3	4	6.0	458.0	Impact Properties	7-dymphna-place-franklin-act-2913
61450	Townhouse	2022-07-22	$1,280,000	2022-08-06	$1,280,000	3	2	4	5.0		home.by holly	1-126-blamey-crescent-campbell-act-2612
61451	Townhouse	2022-07-22	$639,000+	2022-08-08	Undisclosed	3	1	1	2.0		Badenoch Real Estate	16-boulton-close-scullin-act-2614
61452	Land	2022-07-22	EOI 10/08/22	2022-08-22	Undisclosed	0	0	0	0.0	823.0	Ian McNamee & Partners - Jerrabomberra	lot-1216-jumping-creek-queanbeyan-nsw-2620
61453	Townhouse	2022-07-22	$762,000	2022-08-30	$762,000	3	2	2	3.0		Luton Tuggeranong	8-15-oxenham-circuit-gordon-act-2906
61454	House	2022-07-22	$999,000+	2022-09-20	Undisclosed	3	1	4	0.5		Bastion Property Group	11-fairweather-circuit-lyneham-act-2602
61455	House	2022-07-22	$1,800,000	2022-08-09	Undisclosed	4	2	1		562.77	LJ Hooker Sussex Inlet	63-jacobs-drive-sussex-inlet-nsw-2540
61456	Apartment	2022-07-22	Auction 13 August 2.15 pm	2022-08-13	$470,000	2	2	2		0.0	Ward Estate Agents	18-3a-stornaway-road-queanbeyan-nsw-2620
61457	House	2022-07-22	Auction 13/08/2022	2022-08-12	$495,000	3	1	1		562.0	Ian McNamee & Partners - Queanbeyan	16-margaret-street-karabar-nsw-2620
61458	House	2022-07-22	Contact Agent	2023-06-28	$715,000	3	1	2		571.0	Raine & Horne Southern Highlands	17-dangar-street-moss-vale-nsw-2577
61461	House	2022-07-22	Auction 13/08/2022	2022-07-22	$1,403,000	4	3	2	6.0	540.0	Independent Gungahlin	94-robin-boyd-crescent-taylor-act-2913
61468	Apartment	2022-08-31	$610,000	2022-10-14	$599,000	1	1	1	7.0	13517.0	Berkely Residential	204-44-constitution-avenue-parkes-act-2600
61470	House	2022-07-22	Auction 13/08/2022	2022-08-12	$1,690,000	4	3	1	2.5	694.0	Ray White Canberra	18-earle-street-lyneham-act-2602
61471	House	2022-07-22	Contact Agent	2022-09-05	Undisclosed	5	2	2		4.01	Raine & Horne Young	70-crowe-road-young-nsw-2594
61473	Townhouse	2022-07-22	$590,000+	2022-09-20	$600,000	3	1	1	3.5		LJ Hooker Tuggeranong	10-25-youl-court-banks-act-2906
61475	House	2022-07-22	235000	2023-04-06	$235,000	3	2	0			Smile Elite	38-phyllis-street-south-lismore-nsw-2480
61477	House	2022-07-22	$550,000	2022-08-10	Undisclosed	3	2	2		941.0	Ray White Wagga Wagga	45-balmoral-crescent-lake-albert-nsw-2650
61478	Land	2022-07-22	$550,000 - $585,000	2022-10-21	Undisclosed	0	0	0		1223.0	Ray White Goulburn	33a-taralga-road-goulburn-nsw-2580
61499	DuplexSemi-detached	2022-07-22	Price Guide $900,000 to $925,000	2023-02-22	Undisclosed	4	2	1		556.0	InHouse Real Estate	228-imlay-st-eden-nsw-2551
61503	Apartment	2022-07-22	$520,000+	2022-08-18	$528,000	2	2	2	6.0		Impact Properties	121-77-gozzard-street-gungahlin-act-2912
61506	DuplexSemi-detached	2022-07-22	Contact Agent	2022-08-30	$882,000	3	1	1			Smile Elite	40a-sherridon-crescent-quakers-hill-nsw-2763
61508	House	2022-07-22	Contact Agent	2022-08-25	$865,000	3	1	1		296.0	Smile Elite	30-oliveri-place-schofields-nsw-2762
61510	House	2022-07-22	Contact Agent	2022-10-04	$1,180,000	4	2	2		310.0	Smile Elite	42-tanunda-drive-the-ponds-nsw-2769
61511	Apartment	2022-07-22	Contact Agent	2022-08-01	$540,000	2	2	1			Smile Elite	31-6-bingham-street-schofields-nsw-2762
61512	House	2022-07-22	Contact Agent	2022-09-19	$1,675,000	5	2	2			Smile Elite	9-cheval-street-beaumont-hills-nsw-2155
61513	Apartment	2022-07-22	Contact Agent	2022-10-05	$485,000	2	1	1			Smile Elite	204-27-rebecca-street-schofields-nsw-2762
61517	Land	2022-07-23	$1,100,000	2022-09-01	$1,100,000	0	0	0		931.0	McGoldrick Estate Agents	7-tilgman-street-berry-nsw-2535
61525	House	2022-07-25	Expressions of Interest!	2022-09-07	Undisclosed	3	1	3		2023.0	Raine & Horne Young	15-north-street-grenfell-nsw-2810
61526	House	2022-07-25	$1,049,900	2022-11-04	Undisclosed	5	2	2	1.0		Luton Tuggeranong	12-bavay-place-page-act-2614
61530	House	2022-07-25	$915,000	2022-11-14	$905,000	4	2	2		800.0	Ray White Goulburn	10-heath-street-goulburn-nsw-2580
61535	House	2022-07-25	Offers $600,000 + 	2022-07-25	$600,000	5	2	2		664.0	One Agency Craig Schofield	69-illawong-road-anglers-reach-nsw-2629
61537	House	2022-07-25	Contact Agent	2022-10-05	$500,000	3	1	3		581.0	Smile Elite	71-rose-street-bathurst-nsw-2795
61542	Apartment	2022-07-25	Sold $445,000	2022-09-14	$445,000	2	1	1	3.5		MARQ Property	4-3-garran-place-garran-act-2605
61547	House	2022-07-25	Price Guide $550,000	2022-08-16	$510,000	5	1	1		1.7	One Agency Dwyer Properties	7-13-pericoe-street-burragate-nsw-2550
61548	Land	2022-07-25	$419,000	2022-08-29	$395,000	0	0	0		826.0	LJ Hooker Batemans Bay	10-seaview-way-long-beach-nsw-2536
61552	House	2022-07-25	$869,000	2022-08-10	$869,000	4	3	1		534.0	LJ Hooker Malua Bay	42-carramar-drive-lilli-pilli-nsw-2536
61553	House	2022-07-25	$975,000	2022-08-12	$975,000	4	3	2		604.0	My Agent Team	39-courtenay-crescent-long-beach-nsw-2536
61554	Lifestyle	2022-07-25	$475,000	2022-09-05	$450,000	0	0	0		13.23	Raine & Horne Goulburn	625-mullins-creek-road-gurrundah-nsw-2581
61555	Land	2022-07-25	$98,000	2022-10-13	Undisclosed	0	0	0		1005.0	Ray White Rural Tumbarumba	28-clara-street-tumbarumba-nsw-2653
61562	Townhouse	2022-07-25	$825,000+	2023-03-06	$855,000	4	2	2	6.5	180.0	LJ Hooker Canberra City	44-everist-street-taylor-act-2913
61568	House	2022-07-25	Auction (Unless Sold Prior)	2022-08-19	$1,150,000	3	2	1		2478.0	Ray White Goulburn	6-princess-street-goulburn-nsw-2580
61572	Land	2022-07-25	$260,000	2022-12-06	Undisclosed	0	0	0		854.0	PRD Wagga Wagga	4-warrock-place-bourkelands-nsw-2650
61573	Land	2022-07-25	$260,000	2022-12-06	Undisclosed	0	0	0		891.0	PRD Wagga Wagga	3-warrock-place-bourkelands-nsw-2650
61581	House	2022-07-26	$1,200,000-$1,300,000	2022-09-29	$1,150,000	4	2	2		790.0	Sails Real Estate	6-kangaroo-run-tura-beach-nsw-2548
61591	House	2022-07-26	$547,000	2022-10-05	Undisclosed	4	2	2		987.0	Raine & Horne Young	16-acacia-avenue-harden-nsw-2587
61592	House	2022-07-26	$1,100,000	2022-10-20	Undisclosed	3	2	2		2057.0	Ray White Canberra	82-cork-street-gundaroo-nsw-2620
61595	Apartment	2022-07-26	$459,000+	2023-01-13	$453,000	2	2	1	6.0	7380.0	LJ Hooker Gungahlin	194-1-anthony-rolfe-avenue-gungahlin-act-2912
61598	Apartment	2022-07-26	$360,000+	2022-08-31	Undisclosed	1	1	1	6.0		Ray White Canberra	39-15-braybrooke-street-bruce-act-2617
61600	House	2022-07-26	$1,090,000 - $1,199,000	2022-08-26	$1,180,000	3	2	3		1.28	Luton Tuggeranong	26-nirta-drive-murrumbateman-nsw-2582
61603	DuplexSemi-detached	2022-07-26	$1,450,000	2022-08-29	$1,375,000	3	2	2		310.0	Elders Real Estate Batemans Bay	1-16-iluka-avenue-malua-bay-nsw-2536
61606	House	2022-07-26	In Room Auction, Wednesday August 17th at 6:00pm	2022-08-17	$820,000	3	2	2	3.5	487.0	LJ Hooker Gungahlin	61-paul-coe-crescent-ngunnawal-act-2913
61609	Townhouse	2022-07-26	Auction	2022-08-18	Undisclosed	1	1	1	3.5		Ray White Canberra	63-canopus-crescent-giralang-act-2617
61612	House	2022-07-26	$895,000+	2022-09-21	$896,250	4	2	2	0.0	751.0	LJ Hooker Tuggeranong	4-langley-place-kambah-act-2902
61615	House	2022-07-26		2022-09-20	Undisclosed	4	1	0		435.0	Tathra Beach Real Estate	43a-bega-street-tathra-nsw-2550
61617	Townhouse	2022-07-26	$549,000+	2022-08-16	Undisclosed	2	2	1	6.0		Luton Gungahlin	20-48-abena-avenue-crace-act-2911
61619	House	2022-07-26	$149,000	2022-08-16	Undisclosed	2	1	1		550.0	Ray White Wagga Wagga	8-hannah-street-ganmain-nsw-2702
61622	House	2022-07-26	$750,000 - $800,000	2022-09-01	$770,000	3	1	3		737.0	My Agent Team	2-thomas-mitchell-crescent-sunshine-bay-nsw-2536
61623	Apartment	2022-07-26	$560,000	2022-09-09	$560,000	2	2	1	6.0		Edge - Luanne Stapleton	13-92-mcmichael-terrace-denman-prospect-act-2611
61629	Unit	2022-07-26		2022-10-10	Undisclosed	2	1	1			Hallmark Real Estate Advisors	15-105-113-tuross-boulevard-tuross-head-nsw-2537
61631	House	2022-07-26	Contact Agent	2022-08-18	$951,000	4	2	2		550.1	Smile Elite	56-narcissus-avenue-quakers-hill-nsw-2763
61636	Land	2022-07-26	$870,000	2022-10-07	$870,000	0	0	0		450.1	Smile Elite	6-gambrel-street-box-hill-nsw-2765
61645	House	2022-07-26	Contact Agent	2022-08-05	$920,000	4	2	3		650.0	Smile Elite	41-baruah-parade-harrington-nsw-2427
61647	House	2022-07-26	Contact  Agent	2022-08-10	$1,180,000	4	3	1		248.0	Smile Elite	42-wangolove-street-schofields-nsw-2762
61654	House	2022-07-26	Contact Agent	2022-08-10	$925,100	3	2	1		280.0	Smile Elite	17-dolphin-street-schofields-nsw-2762
61659	House	2022-07-27	$799,000+	2022-09-08	Undisclosed	3	2	2	5.0	294.0	Ray White Canberra	59-tenison-woods-circuit-bonython-act-2905
61660	Townhouse	2022-07-27	In Room Auction	2022-08-18	$525,000	2	1	1			Ray White Queanbeyan | Jerrabomberra	1-10-booth-street-queanbeyan-east-nsw-2620
61665	Apartment	2022-07-27	$549,000+	2022-11-28	$520,000	2	2	2	6.0		Confidence Real Estate	98-51-catalano-street-wright-act-2611
61668	Townhouse	2022-07-27	$630,000+	2022-08-31	$640,000	3	1	1	1.5		McIntyre Property	13-11-derrington-crescent-bonython-act-2905
61669	House	2022-07-27	By Negotiation	2022-08-29	$900,000	3	2	1	6.0		Confidence Real Estate	6-myulung-street-ngunnawal-act-2913
61670	House	2022-07-27	$320,000	2022-09-21	Undisclosed	2	1	1		1012.0	Macarthur Real Estate Agency	5-best-street-uranquinty-nsw-2652
61673	Apartment	2022-07-27	Contact Agent	2022-08-31	$550,500	2	2	2	6.0		MARQ Property	95-1-dunphy-street-wright-act-2611
61680	Townhouse	2022-07-27	$729,000+	2022-09-28	$720,000	3	2	2	6.0		PURNELL	39-18-cornelius-street-coombs-act-2611
61686	Apartment	2022-07-27	Auction 20/08/2022	2022-08-16	$450,500	2	1	2	6.0		McGrath Canberra	28-16-david-miller-crescent-casey-act-2913
61687	Townhouse	2022-07-27	Auction 18/08/2022	2022-08-18	$1,200,000	3	2	2	5.0	87858.5	Ray White Canberra	53-50-ellenborough-street-lyneham-act-2602
61690	Townhouse	2022-07-27	Auction	2022-08-20	$987,000	3	2	2	2.5		LJ Hooker Belconnen	5-14-jalanga-place-aranda-act-2614
61691	House	2022-07-27	Auction	2022-08-13	$755,000	3	1	1	1.0	810.0	LJ Hooker Belconnen	41-dalley-crescent-latham-act-2615
61692	House	2022-07-27	Auction	2022-08-13	$960,000	4	2	2	4.5	471.0	LJ Hooker Belconnen	4-hilda-kincaid-crescent-macgregor-act-2615
61693	Apartment	2022-07-27	Auction	2022-08-13	$416,000	2	1	1	4.0		LJ Hooker Belconnen	8b-4-beetaloo-street-hawker-act-2614
61694	Unit	2022-07-27	$259,000	2022-10-04	Undisclosed	2	1	1			Ray White Wagga Wagga	1-3-henschke-avenue-tolland-nsw-2650
61696	Townhouse	2022-07-27	$679,000 - $729,000	2022-12-07	$670,000	4	2	2			Ian McNamee & Partners - Queanbeyan	5-13-gerald-street-queanbeyan-nsw-2620
61699	Apartment	2022-07-27	$670,000+	2022-08-23	$672,000	2	2	1	6.0		LJ Hooker Dickson	608-55-dooring-street-dickson-act-2602
61700	Unit	2022-07-27	$499,000	2022-07-27	$499,000	2	1	1		2330.0	Sails Real Estate	3-2-view-street-merimbula-nsw-2548
61701	Apartment	2022-07-27	By Negotiation	2022-08-19	Undisclosed	2	2	2	6.0		Impact Properties	93-77-gozzard-street-gungahlin-act-2912
61703	Unit	2022-07-27	By Negotiation	2022-10-20	Undisclosed	2	2	2	6.0		Bastion Property Group	7-1-fawkner-street-braddon-act-2612
61705	House	2022-07-27	Auction	2022-08-13	$910,000	4	2	2	2.0	858.0	LJ Hooker Belconnen	44-stretton-crescent-latham-act-2615
61707	Apartment	2022-07-27	$450,000	2022-09-16	$450,000	1	1	1	6.0		home.by holly	55-26-antill-street-dickson-act-2602
61709	Unit	2022-07-27	Sold $365,000	2022-09-08	$365,000	1	1	1	6.0		MARQ Property	29-329-flemington-road-franklin-act-2913
61710	House	2022-07-27	Auction 20/08/2022	2022-08-20	Undisclosed	6	2	2		674.0	Ian McNamee & Partners - Queanbeyan	123-ross-road-crestwood-nsw-2620
61712	House	2022-07-27	Auction	2022-08-10	Undisclosed	3	2	2	4.0	477.0	Luton Gungahlin	15-wirria-circuit-ngunnawal-act-2913
61716	AcreageSemi-rural	2022-07-27	$2,600,000	2022-08-25	$2,600,000	4	3	6		4.38	Smile Elite	194-kennedys-lane-ewingsdale-nsw-2481
61717	House	2022-07-27	Online Auction via Openn Negotiation	2022-08-17	Undisclosed	3	1	1		629.0	PRD Wagga Wagga	1-eyre-street-lake-albert-nsw-2650
61720	House	2022-07-27	$463,500	2022-08-18	Undisclosed	3	1	2		685.6	PRD Wagga Wagga	18-buchhorn-street-tolland-nsw-2650
61723	Apartment	2022-07-27	$619,000+	2022-09-02	$616,000	3	2	2	6.0		Impact Properties	79-51-nullarbor-avenue-franklin-act-2913
61725	Unit	2022-07-27	$470,000+	2022-10-14	$480,000	2	1	1	4.0	0.0	LJ Hooker Dickson	96-9-murdoch-street-lyneham-act-2602
61728	House	2022-07-27	AUCTION	2022-08-20	Undisclosed	3	1	1	0.0	432.0	McIntyre Property	11-zincke-close-calwell-act-2905
61729	House	2022-07-27	Auction	2022-08-25	$2,500,000	5	3	2		746.0	Henley Property - Jindabyne	4-banjo-paterson-crescent-jindabyne-nsw-2627
61732	House	2022-07-28	Auction	2022-08-20	Undisclosed	4	2	2	2.0	917.0	Luton Weston Creek & Molonglo Valley	2-prescott-street-farrer-act-2607
61734	Townhouse	2022-07-28	Auction 20/08/2022 3pm On Site	2022-08-20	$660,000	2	1	1	2.5	0.0	Morrissey Property	6-81-bimberi-crescent-palmerston-act-2913
61737	House	2022-07-28	Auction 20/08/2022 10am On Site	2022-08-20	$930,000	3	1	1	1.0	725.0	Morrissey Property	3-coliban-place-duffy-act-2611
61738	House	2022-07-28	$1,200,000	2022-08-22	$1,200,000	5	2	2	4.5	834.0	home.by holly	1-rowley-place-nicholls-act-2913
61739	House	2022-07-28	Auction 21/08/2022 12pm On Site	2022-08-21	Undisclosed	5	3	2	4.0	0.0	Morrissey Property	3-42-adder-street-harrison-act-2914
61740	Apartment	2022-07-28	Offers over $750,000	2022-09-14	Undisclosed	2	2	2	6.0		LJ Hooker Manuka	72-106-giles-street-kingston-act-2604
61741	Apartment	2022-07-28	$480,000 Plus	2022-08-15	$480,000	1	1	1	6.0		Maloney's Property	708-51-mort-street-braddon-act-2612
61744	House	2022-07-28	Auction	2022-08-11	Undisclosed	4	1	2	1.5	818.0	Luton Gungahlin	111-burrinjuck-crescent-duffy-act-2611
61745	House	2022-07-28	Auction 18/08/2022	2022-08-18	$825,000	3	1	1	0.5	732.0	Ray White Canberra	22-castieau-street-higgins-act-2615
61747	House	2022-07-28	$869,000+	2022-10-14	Undisclosed	4	2	2	3.0	760.0	McIntyre Property	8-bandulla-street-isabella-plains-act-2905
61748	Apartment	2022-07-28	Contact Agent	2022-08-24	$426,101	1	1	1	4.5		McGrath Canberra	4-45-majura-avenue-dickson-act-2602
61749	House	2022-07-28	Auction 18/08/2022	2022-08-18	$990,000	3	2	2	4.5	511.0	Ray White Canberra	26-fairweather-circuit-lyneham-act-2602
61751	House	2022-07-28	By Negotiation	2022-09-28	$1,150,000	4	2	2	4.5	556.0	Luton Gungahlin	5-numiari-street-bonner-act-2914
61752	House	2022-07-28	Auction, Saturday 20th August at 10am	2022-08-05	$687,000	3	2	2	2.0	541.0	LJ Hooker Gungahlin	13-napthali-crescent-charnwood-act-2615
61754	Townhouse	2022-07-28	contact agent	2022-08-19	Undisclosed	3	2	2	5.5		home.by holly	3-59-torrens-street-braddon-act-2612
61759	Apartment	2022-07-28	$749,000	2022-08-04	Undisclosed	2	2	2	5.5		Badenoch Real Estate	12-30-blackall-street-barton-act-2600
61762	Apartment	2022-07-28	$359,000+	2022-10-28	Undisclosed	1	1	1	6.0		Ray White Canberra	503-2-akuna-street-city-act-2601
61764	Unit	2022-07-28	$349,000+	2022-08-11	$370,000	2	1	1	6.0		LJ Hooker Kippax	1-7-keith-street-scullin-act-2614
61765	Land	2022-07-28	$364,000	2023-08-17	$345,000	0	0	0		593.2	Marshall and Tacheci Real Estate	48-songlark-street-bermagui-nsw-2546
61766	House	2022-07-28	$715,000+	2022-10-06	Undisclosed	3	2	1	6.0	152.0	Ray White Canberra	50-bronhill-street-moncrieff-act-2914
61768	House	2022-07-28	$1,275,000+	2022-10-05	$1,240,000	3	1	0	3.5	604.0	LJ Hooker Dickson	5-piper-street-ainslie-act-2602
61773	Townhouse	2022-07-28	$639,000+	2022-08-17	$698,000	3	2	2	6.0		LJ Hooker Kippax	40-60-copland-drive-evatt-act-2617
61774	Townhouse	2022-07-28	Auction	2022-08-17	$640,000	2	1	1	4.0	331.0	LJ Hooker Kaleen	24-macfarlan-place-latham-act-2615
61775	Land	2022-07-28	$475,000	2022-11-25	$462,500	0	0	0		5.66	Henley Property - Jindabyne	360-dalgety-road-berridale-nsw-2628
61777	House	2022-07-28	$450,000	2022-08-30	$435,000	3	1	3		732.7	PRD Wagga Wagga	12-wren-street-mount-austin-nsw-2650
61778	House	2022-07-28	Auction 20/08/2022	2022-08-20	Undisclosed	4	2	4	5.5	350.0	Ray White Canberra	64-lorraway-street-holt-act-2615
61780	Apartment	2022-07-28	By Negotiation	2022-08-30	Undisclosed	2	2	1	6.0		Luton Weston Creek & Molonglo Valley	83-15-darling-street-barton-act-2600
61785	House	2022-07-28	Auction	2022-08-20	Undisclosed	4	2	2	3.0	767.0	Luton Gungahlin	4-mewton-place-melba-act-2615
61787	Townhouse	2022-07-28	$520,000+	2022-08-22	$520,000	2	1	2	2.0		LJ Hooker Tuggeranong	3-15-tallon-place-gordon-act-2906
61795	Apartment	2022-07-28	Contact Agent	2022-12-06	Undisclosed	2	2	1	6.0		New Door Properties	114-335-anketell-street-greenway-act-2900
61796	Unit	2022-07-28	$529,000 +	2022-09-23	Undisclosed	2	2	1	6.0	9729.0	New Door Properties	208-12-limburg-way-greenway-act-2900
61798	Townhouse	2022-07-28	contact agent	2022-09-09	Undisclosed	2	2	1	6.0		home.by holly	2-82-dooring-street-dickson-act-2602
61799	House	2022-07-28	$765,000	2022-10-20	$750,000	3	2	2		671.0	My Agent Team	66-melaleuca-crescent-catalina-nsw-2536
61804	Townhouse	2022-07-28	$930,000+	2022-09-08	$920,000	4	3	2	5.0		LJ Hooker Tuggeranong	8-1-rowland-rees-crescent-greenway-act-2900
61808	House	2022-07-28	By Negotiation	2022-09-30	Undisclosed	3	2	2		40.0	Ray White Bungendore	250-sandhills-road-mount-fairy-nsw-2580
61811	House	2022-07-28	Auction 18/08/2022	2022-08-16	Undisclosed	5	2	1	0.5	1136.0	Ray White Canberra	52-bindaga-street-aranda-act-2614
61813	Villa	2022-07-28	Under Contract	2022-09-06	Undisclosed	2	1	1			Ben Bate Real Estate	48-princes-highway-narooma-nsw-2546
61814	House	2022-07-28	$399,000	2022-08-12	$385,000	3	1	4		720.0	PRD Wagga Wagga	9-raye-street-tolland-nsw-2650
61815	House	2022-07-29	By Negotiation	2022-10-07	Undisclosed	3	1	2	2.5	527.0	Luton Manuka	5-gelane-street-ngunnawal-act-2913
61817	Townhouse	2022-07-29	$799,000	2022-08-29	$790,000	3	2	2			Sails Real Estate	2-52-pacific-way-tura-beach-nsw-2548
61819	House	2022-07-29	Auction	2022-08-18	$910,000	3	1	3	2.5	1178.0	Luton Tuggeranong	12-max-henry-crescent-macarthur-act-2904
61820	Villa	2022-07-29	Under Offer	2022-08-24	Undisclosed	2	1	1			Ben Bate Real Estate	l21-easts-narooma-village-narooma-nsw-2546
61822	House	2022-07-29	$990,000	2023-01-18	Undisclosed	5	3	5		658.0	Fraser-Gray Real Estate	3-dell-parade-moruya-heads-nsw-2537
61826	House	2022-07-29	$989,000	2022-10-06	Undisclosed	4	2	2	6.0		Bastion Property Group	2-82-dixon-drive-holder-act-2611
61827	Apartment	2022-07-29	$575,000 +	2022-08-31	$565,000	2	2	2	6.0		Luton Manuka	38-15-aspinall-street-watson-act-2602
61828	House	2022-07-29	Contact Agent	2022-09-23	$1,170,000	6	2	2		588.0	Smile Elite	15-lambeth-road-schofields-nsw-2762
61829	Other	2022-07-29	Price Guide $2,350,000	2022-10-19	Undisclosed	0	0	1		90.62	Ray White Goulburn	152-drews-road-goulburn-nsw-2580
61831	AcreageSemi-rural	2022-07-29	Guide $1.8 to $2M	2022-09-16	$1,800,000	4	3	6		7830.0	Henley Property - Jindabyne	40-hawthorn-close-jindabyne-nsw-2627
61833	Unit	2022-07-29	$499,000	2022-10-04	Undisclosed	2	1	1			Sails Real Estate	3-3-kyeamba-street-merimbula-nsw-2548
61834	House	2022-07-29	Contact Agent	2022-08-15	$1,010,000	4	2	2		250.0	Smile Elite	161-hambledon-road-schofields-nsw-2762
61839	House	2022-07-29	By Negotiation	2022-11-04	$975,000	4	2	2	2.5		Confidence Real Estate	1-10-pollock-street-chifley-act-2606
61841	AcreageSemi-rural	2022-07-29	EOI - Closed 14th September, 2022	2022-09-16	Undisclosed	5	5	6		15.93	Whale Coast Realty	135-riverview-road-north-narooma-nsw-2546
61845	Unit	2022-07-29	AUCTION - 18/08/2022	2022-08-17	$350,000	2	1	1			Ian McNamee & Partners - Queanbeyan	11-2-booth-street-queanbeyan-nsw-2620
61847	House	2022-07-29	$1,450,000	2022-08-29	Undisclosed	4	3	2	4.5	0.0	Badenoch Real Estate	58-osburn-drive-macgregor-act-2615
61849	Lifestyle	2022-07-29	Contact Agent	2022-08-27	$2,385,000	7	4	4		7.3	LJ Hooker Queanbeyan – Jerrabomberra – Googong	1446-federal-highway-sutton-nsw-2620
61850	Unit	2022-07-29	$440,000+	2022-08-31	$475,000	1	1	1	5.5		LJ Hooker Dickson	2-68-macleay-street-turner-act-2612
61854	House	2022-07-29	Price Guide $650,000	2022-08-19	$665,000	3	1	3		836.0	Sails Real Estate	17-lloyd-street-south-pambula-nsw-2549
61856	House	2022-07-29	$695,000+	2022-09-09	Undisclosed	3	1	1	5.5		Ray White Canberra	12b-hickenbotham-street-gordon-act-2906
61861	House	2022-08-01	$499,000	2022-11-08	$499,000	3	2	1			Ray White Goulburn	20-31-newton-street-village-high-road-goulburn-nsw-2580
61862	House	2022-08-01	$820,000 - $850,000	2022-09-13	$780,000	3	1	0		1897.0	Henley Property - Berridale	8-morrice-street-berridale-nsw-2628
61864	House	2022-08-01	$750,000 - $775,000	2022-09-16	Undisclosed	3	1	2	0.0	664.0	IQ Real Estate	21-ernest-street-crestwood-nsw-2620
61870	House	2022-08-01	Contact Agent	2022-08-17	$620,000	3	2	2		607.0	Smile Elite	26-melbee-street-rutherford-nsw-2320
61873	Apartment	2022-08-01	$371,000	2022-08-30	$371,000	1	1	1	6.0		Luton Dickson	42-120-thynne-street-bruce-act-2617
61874	House	2022-08-01	$1,100,000 - $1,200,000	2022-09-08	$1,100,830	4	2	2		1300.0	Sails Real Estate	116-pacific-way-tura-beach-nsw-2548
61881	House	2022-08-01	$990,000	2023-10-20	$970,000	3	2	4		878.0	Sails Real Estate	21-tantawangalo-street-merimbula-nsw-2548
61885	House	2022-08-01	Auction	2022-09-03	$1,270,000	5	3	2	6.0	466.0	LJ Hooker Woden/Weston	13-solong-street-lawson-act-2617
61897	House	2022-08-01	$599,000	2022-09-15	Undisclosed	3	2	2		724.0	Macarthur Real Estate Agency	28-charlton-street-boorooma-nsw-2650
61903	House	2022-08-01	$650,000	2022-08-12	$635,000	2	1	2		1201.0	My Agent Team	502-beach-road-denhams-beach-nsw-2536
61904	House	2022-08-01	$145,000	2022-09-14	$140,000	2	1	0			LJ Hooker Batemans Bay	cabin-90-55-sunpatch-parade-tomakin-nsw-2537
61908	House	2022-08-01	Auction 10/09/2022	2022-08-26	Undisclosed	3	1	2	1.0	636.71	Ray White Canberra	67-norriss-street-chisholm-act-2905
61920	House	2022-08-01	Contact agent	2022-11-15	Undisclosed	5	2	5		7546.0	Smile Elite	3-ewandale-close-clunes-nsw-2480
61921	Unit	2022-08-01	Contact Agent	2022-09-13	$350,000	2	1	1			LJ Hooker Queanbeyan – Jerrabomberra – Googong	9-3-5-davison-street-crestwood-nsw-2620
61928	House	2022-08-02	AUCTION	2022-08-30	$455,000	3	1	1		702.0	Raine & Horne Goulburn	4-hollis-ave-goulburn-nsw-2580
61932	House	2022-08-02	$695,000	2022-08-08	$675,000	2	1	1		696.0	Elders Real Estate Batemans Bay	11-golf-links-drive-batemans-bay-nsw-2536
61948	House	2022-08-02	$435,000	2022-10-11	Undisclosed	3	1	2			Ray White Wagga Wagga	61-dalman-parkway-glenfield-park-nsw-2650
61949	Apartment	2022-08-02	Auction	2022-08-31	$475,000	1	1	1	6.0		LJ Hooker Canberra City	6-7-lowanna-street-braddon-act-2612
61951	House	2022-08-02	Auction	2022-09-04	$852,500	3	2	2		1.7	Ray White Rural Canberra | Yass	1-cullavin-st-gunning-nsw-2581
61952	House	2022-08-02	505000	2023-01-18	$505,000	3	1	3		720.0	Smile Elite	64-gilmour-street-kelso-nsw-2795
61953	House	2022-08-02	$900,000	2022-09-09	Undisclosed	4	1	2		4158.0	Bella Coastal Property	12-voyager-crescent-bawley-point-nsw-2539
61954	House	2022-08-02	By Negotiation	2022-08-19	Undisclosed	4	1	2		905.0	Ray White Bungendore	17-finch-street-bungendore-nsw-2621
61958	Land	2022-08-02	Price Guide $950,000	2022-09-12	$950,000	0	0	0		40.0	Raine & Horne Southern Highlands	lot-6-2060-brayton-road-big-hill-nsw-2579
61960	House	2022-08-02	$1,230,000	2023-01-31	$1,210,000	5	2	3		1504.0	Ray White Bungendore	1-mccusker-drive-bungendore-nsw-2621
61963	House	2022-08-03	$1,499,000+	2023-02-07	Undisclosed	4	3	2	6.0	498.0	Luton Gungahlin	12-fingal-street-crace-act-2911
61965	House	2022-08-03	CONTACT AGENT	2022-09-29	Undisclosed	3	1	1		562.8	Macarthur Real Estate Agency	7-mair-street-turvey-park-nsw-2650
61966	Townhouse	2022-08-03	$449,000 - $479,000	2022-09-07	$487,000	1	1	1		132.0	Ray White Queanbeyan | Jerrabomberra	276-gorman-drive-googong-nsw-2620
61967	House	2022-08-03	Contact Agent	2022-09-02	$1,625,000	5	2	2		1471.0	Raine & Horne Southern Highlands	1268-nowra-road-fitzroy-falls-nsw-2577
61968	House	2022-08-03	Sold $910,000	2022-09-06	$911,000	4	2	2	4.0	713.0	Blackshaw Gungahlin	16-mawalan-street-ngunnawal-act-2913
61971	House	2022-08-03	Auction	2022-09-01	Undisclosed	3	2	2		1062.0	Luton Manuka	1-wharf-street-nelligen-nsw-2536
61972	Townhouse	2022-08-03	$729,000	2022-09-21	Undisclosed	3	1	2	4.0	0.0	Badenoch Real Estate	77-mobourne-street-bonner-act-2914
61973	Apartment	2022-08-03	$449,000	2022-09-20	Undisclosed	1	1	1	6.0		Badenoch Real Estate	12-37-chandler-street-belconnen-act-2617
61974	House	2022-08-03	$819,950	2022-08-27	$808,000	3	1	1	0.5	803.0	LJ Hooker Belconnen	43-macrossan-crescent-latham-act-2615
61975	House	2022-08-03	$935,000- $965,000	2022-10-10	$920,000	4	2	2		760.0	Ray White Bungendore	15-angus-place-bungendore-nsw-2621
61981	House	2022-08-03	$275,000 - $295,000	2023-02-24	Undisclosed	3	1	2		809.0	Macarthur Real Estate Agency	19-matthews-street-lockhart-nsw-2656
61985	House	2022-08-03	Contact Agent	2022-08-29	$999,999	4	2	3	0.5	1057.0	VERV Property	73-holden-crescent-wanniassa-act-2903
61988	Apartment	2022-08-03	$435,000	2022-09-07	Undisclosed	2	1	1	2.0		Badenoch Real Estate	52-22-archibald-street-lyneham-act-2602
61992	House	2022-08-03	$539,000	2022-08-22	$563,500	3	1	2		524.0	PRD Wagga Wagga	56-heath-street-turvey-park-nsw-2650
61996	House	2022-08-03	$879,000	2022-10-18	Undisclosed	5	3	2		1263.0	Macarthur Real Estate Agency	49-henwood-avenue-kooringal-nsw-2650
62001	House	2022-08-03	$875,000	2023-03-20	Undisclosed	4	4	3		942.16	LJ Hooker Sussex Inlet	132-jacobs-drive-sussex-inlet-nsw-2540
62002	House	2022-08-03	By Negotiation	2022-09-13	$1,600,000	5	3	3		976.7	Bella Coastal Property	17-rose-gum-avenue-ulladulla-nsw-2539
62003	Land	2022-08-03	$450,000	2022-10-13	$430,000	0	0	0		824.0	Raine & Horne Goulburn	16-madeleine-drive-goulburn-nsw-2580
62005	House	2022-08-03	$1,050,000+	2022-09-21	$1,040,000	5	2	2	5.0	978.0	LJ Hooker Gungahlin	3-galmarra-street-ngunnawal-act-2913
62006	House	2022-08-03	Under Offer	2022-08-19	Undisclosed	3	1	2		603.0	Ben Bate Real Estate	35-attunga-street-dalmeny-nsw-2546
62008	House	2022-08-03	Contact Agent	2022-08-24	Undisclosed	3	1	1			Smile Elite	33-stroud-street-bulahdelah-nsw-2423
62009	House	2022-08-03	Contact Agent	2022-10-10	$1,200,000	4	2	2		438.0	Smile Elite	1-setaria-street-marsden-park-nsw-2765
62012	Townhouse	2022-08-03	Auction 27th Aug 11:00am	2022-08-18	$625,000	2	2	1	6.0		LJ Hooker Tuggeranong	9-17-ashley-drive-wanniassa-act-2903
62015	House	2022-08-03	$1,850,000	2022-09-05	$1,850,000	4	3	2	6.0	500.0	MARQ Property	2-cocoparra-crescent-crace-act-2911
62016	Townhouse	2022-08-03	Auction	2022-08-27	Undisclosed	3	2	2	6.0		Luton Gungahlin	3-19-dallachy-street-page-act-2614
62019	Townhouse	2022-08-03	$579,000+	2022-10-20	Undisclosed	3	1	1	3.5		LJ Hooker Woden/Weston	36-146-ellerston-avenue-isabella-plains-act-2905
62020	House	2022-08-03	$999,000+	2022-09-19	Undisclosed	4	2	2	5.5	399.0	New Door Properties	109-rob-riley-circuit-bonner-act-2914
62022	House	2022-08-03		2022-09-13	Undisclosed	3	2	1		803.0	Hallmark Real Estate Advisors	22-salmon-street-tuross-head-nsw-2537
62023	House	2022-08-03	$650,000	2022-08-31	$635,000	4	1	1		996.0	Henley Property - Berridale	3-nightingale-lane-berridale-nsw-2628
62024	Townhouse	2022-08-03	Auction	2022-08-27	Undisclosed	2	1	2	2.5		LJ Hooker Woden/Weston	12-16-damala-street-waramanga-act-2611
62026	Land	2022-08-03	By Negotiation	2022-08-24	Undisclosed	0	0	0	0.0	676.0	Ian McNamee & Partners - Jerrabomberra	lot-1415-jumping-creek-queanbeyan-nsw-2620
62031	House	2022-08-03	Price Negotiable - Contact Agent	2023-02-24	Undisclosed	3	2	2		669.0	McGoldrick Estate Agents	5-lincoln-close-berry-nsw-2535
62032	House	2022-08-03	$1,250,000	2022-09-16	Undisclosed	3	2	2	6.0	603.0	Bertram Ellis	12-maria-place-lyons-act-2606
62033	House	2022-08-03	Auction	2022-08-15	$920,000	3	2	2	6.0	250.0	Town Residential	11-cricket-street-throsby-act-2914
62036	Land	2022-08-03	Contact Agent	2022-08-24	Undisclosed	0	0	0	0.0	751.0	Ian McNamee & Partners - Jerrabomberra	lot-1416-jumping-creek-queanbeyan-nsw-2620
62046	House	2022-08-03	$520,000	2022-09-06	Undisclosed	2	1	5		734.0	One Agency Craig Schofield	4-hain-street-cooma-nsw-2630
62047	AcreageSemi-rural	2022-08-03	Contact Agent - Nicholas Lyell	2023-02-14	Undisclosed	4	2	4		2.5	McGoldrick Estate Agents	248-back-forest-road-berry-nsw-2535
62049	House	2022-08-03	Offers over $520,000	2022-09-29	$545,000	2	1	2	2.0	247.0	Sadil Quinlan	38-enright-crescent-florey-act-2615
62050	House	2022-08-03	$730,000	2022-09-19	Undisclosed	4	2	2		630.0	dwell Realty	16-bluewattle-road-worrigee-nsw-2540
62051	House	2022-08-03	Offers over $895,000	2022-09-30	$880,000	4	2	1	3.5		Sadil Quinlan	33-79-87-crozier-circuit-kambah-act-2902
62058	Land	2022-08-03	$359,000	2023-03-31	$332,000	0	0	0		647.0	Ray White Batemans Bay	5-clarence-street-long-beach-nsw-2536
62061	AcreageSemi-rural	2022-08-04	For Sale - Nicholas Lyell	2022-10-04	Undisclosed	5	3	4		5.0	McGoldrick Estate Agents	80-agars-lane-berry-nsw-2535
62062	House	2022-08-04	Auction	2022-08-27	Undisclosed	4	2	2	1.5	975.0	Luton Weston Creek & Molonglo Valley	80-streeton-drive-rivett-act-2611
62063	House	2022-08-04	Auction	2022-08-19	Undisclosed	4	2	2	6.0	544.0	Luton Weston Creek & Molonglo Valley	5-kemmis-street-denman-prospect-act-2611
62064	House	2022-08-04	Auction	2022-08-27	$905,000	4	2	2	0.5	609.0	Luton Weston Creek & Molonglo Valley	38-jemalong-street-duffy-act-2611
62066	House	2022-08-04	SOLD	2023-03-27	Undisclosed	3	1	4		2023.0	Flemings Property Services	155-157-hovell-street-cootamundra-nsw-2590
62068	House	2022-08-04	Contact Agent	2022-09-08	Undisclosed	4	2	2		1186.0	Flemings Property Services	6-harold-conkey-avenue-cootamundra-nsw-2590
62069	House	2022-08-04	REVISED ASKING PRICE $325,000	2022-11-25	Undisclosed	4	2	1		310.0	Flemings Property Services	94-temora-street-cootamundra-nsw-2590
62072	Land	2022-08-04	$410,000	2022-09-28	Undisclosed	0	0	0		5.53	Flemings Property Services	405-back-brawlin-road-cootamundra-nsw-2590
62075	Land	2022-08-04	$170,000	2022-09-05	$150,000	0	0	0		2027.0	Flemings Property Services	27-bobbara-street-harden-nsw-2587
62076	House	2022-08-04	$540,000	2022-10-04	Undisclosed	3	1	4		5880.0	Flemings Property Services	39-mcmahon-street-galong-nsw-2585
62077	House	2022-08-04	$1,650,000	2022-09-28	$1,650,000	4	2	0	2.5	1049.0	home.by holly	7-dakin-place-hackett-act-2602
62081	House	2022-08-04	Sold	2023-03-08	Undisclosed	4	2	4		1911.0	Flemings Property Services	26-smith-street-harden-nsw-2587
62082	DuplexSemi-detached	2022-08-04	$545,000	2022-11-29	Undisclosed	2	2	4		525.0	Flemings Property Services	23-25-wallendoon-street-cootamundra-nsw-2590
62083	House	2022-08-04	$720,000	2022-08-19	Undisclosed	4	2	2		904.0	Macarthur Real Estate Agency	2-ulandra-place-estella-nsw-2650
62085	Apartment	2022-08-04	Auction: Saturday August 27th, On site at 10:00am	2022-08-27	Undisclosed	4	2	2	6.0		LJ Hooker Manuka	116-1-kalma-way-campbell-act-2612
62086	House	2022-08-04	$429,000	2022-08-23	Undisclosed	3	1	1		721.0	Flemings Property Services	20-barwang-street-young-nsw-2594
62089	House	2022-08-04	$385,000	2022-08-26	Undisclosed	3	1	2		1017.0	Flemings Property Services	5-william-street-young-nsw-2594
62090	Unit	2022-08-04	$459,000	2022-08-24	Undisclosed	5	2	2		1281.0	Flemings Property Services	12-49-hills-street-young-nsw-2594
62091	Land	2022-08-04	$485,000	2024-02-15	Undisclosed	0	0	0		4.14	Flemings Property Services	141-forbes-lane-young-nsw-2594
62092	Townhouse	2022-08-04	$579,000 +	2022-09-09	$608,000	2	2	2	6.0		Carter and Co Agents	8-2-travers-street-gordon-act-2906
62093	Townhouse	2022-08-04	Auction 27/08/2022	2022-08-27	$797,500	3	1	1	2.5	366.0	LJ Hooker Dickson	15-21-cossington-smith-crescent-lyneham-act-2602
62095	Townhouse	2022-08-04	offers over $1,050,000	2022-09-15	$980,000	3	2	2	1.5		Maloney's Property	4-72-shackleton-circuit-mawson-act-2607
62096	House	2022-08-04	Auction	2022-08-27	Undisclosed	3	2	2	0.5	810.0	One Agency Sandy Morris	2-chappell-street-lyons-act-2606
62101	Apartment	2022-08-04	By Negotiation	2022-09-12	Undisclosed	2	2	1	6.0		Ray White Canberra	6-50-lowanna-street-braddon-act-2612
62102	House	2022-08-04	Sold Price on Request	2022-09-20	Undisclosed	4	2	2	2.5	882.0	Belle Property Canberra	34-mawson-drive-mawson-act-2607
62103	Townhouse	2022-08-04	$795,000+	2022-10-04	Undisclosed	3	2	2	6.0		My Morris	7a-aitken-circuit-kambah-act-2902
62105	House	2022-08-04	Auction	2022-08-27	$870,000	3	2	2	3.5	790.0	Solely Properties	14-muir-close-isabella-plains-act-2905
62107	Unit	2022-08-04	Offers over $475,000	2022-11-02	Undisclosed	1	1	1	1.5		McIntyre Property	1-11-wise-street-braddon-act-2612
62110	House	2022-08-04	Auction	2022-09-27	$790,000	3	2	2	6.0	435.0	Luton Kippax	9-isbister-street-macgregor-act-2615
62112	House	2022-08-04	contact agent	2022-11-02	Undisclosed	4	2	2	2.0	1062.0	home.by holly	97-florey-drive-macgregor-act-2615
62116	House	2022-08-04	SOLD AT AUCTION	2022-08-27	$1,700,000	5	2	2	0.0		Cream Residential	7-pope-street-hughes-act-2605
62117	Apartment	2022-08-04	$455,000	2022-08-18	$455,000	1	1	1	6.0		home.by holly	9-21-norton-street-evatt-act-2617
62119	House	2022-08-04	$1,300,000	2022-08-27	$1,300,000	4	2	3	4.5	911.0	Luton Tuggeranong	22-tom-roberts-avenue-conder-act-2906
62123	House	2022-08-04	$749,000+	2022-09-04	Undisclosed	3	1	2	2.0	467.0	Luton Tuggeranong	52-house-circuit-banks-act-2906
62124	House	2022-08-04	Auction 26/08/2022	2022-08-26	Undisclosed	4	2	4	3.0	943.0	Ray White Canberra	9-bracker-place-macarthur-act-2904
62125	House	2022-08-04	$2,495,000	2022-11-08	Undisclosed	4	2	2		569.0	Whale Coast Realty	21-lake-view-drive-wallaga-lake-nsw-2546
62127	House	2022-08-04	$699,000+	2022-09-15	Undisclosed	3	1	2	6.0	578.0	McIntyre Property	8-ferry-place-gordon-act-2906
62130	House	2022-08-04	$1,150,000	2022-09-06	$1,050,000	3	1	1		480.0	Henley Property - Jindabyne	5-girvin-place-east-jindabyne-nsw-2627
62131	House	2022-08-04	$680,000 - $710,000	2022-09-23	$670,000	5	2	1		1003.0	One Agency Craig Schofield	50-bent-street-cooma-nsw-2630
62135	House	2022-08-04	$1,100,000 +	2022-09-05	$1,085,000	3	2	2	3.5	914.0	LJ Hooker Tuggeranong	20-mawson-drive-mawson-act-2607
62136	AcreageSemi-rural	2022-08-04	Contact Agent	2022-08-12	Undisclosed	5	3	3		26300.0	home.by holly	93-ridgeway-road-the-ridgeway-nsw-2620
62139	House	2022-08-04	$849,000	2022-10-19	Undisclosed	4	2	2	3.5	722.0	Luton Tuggeranong	3-oddie-place-conder-act-2906
62144	House	2022-08-04	$729,000	2022-11-23	$715,000	3	1	1		762.0	Elders Real Estate Batemans Bay	15-karoola-crescent-surfside-nsw-2536
62146	House	2022-08-04	Auction	2022-09-21	$1,020,000	4	2	3	4.5	851.0	LJ Hooker Dickson	61-jane-sutherland-street-conder-act-2906
62148	House	2022-08-04	$1,900,000	2022-08-04	$1,900,000	5	2	5		2.04	Ray White Goulburn	47-knowlman-road-run-o-waters-nsw-2580
62149	Townhouse	2022-08-04	$763,000	2022-09-26	$763,000	3	2	1	2.5	430.0	home.by holly	5-27-jinka-street-hawker-act-2614
62152	House	2022-08-04	Contact Agent	2022-09-05	$687,500	3	1	0		615.0	LJ Hooker Queanbeyan – Jerrabomberra – Googong	9-jordan-place-queanbeyan-west-nsw-2620
62153	Unit	2022-08-04	$479,000	2022-10-07	$475,000	2	1	1			Sails Real Estate	2-4-kyeamba-street-merimbula-nsw-2548
62154	House	2022-08-04	Auction 27/08/2022	2022-08-27	$2,000,000	3	1	1	1.5	1254.39	Ray White Canberra	78-boldrewood-street-turner-act-2612
62157	House	2022-08-04	$570,000	2023-05-29	$551,000	3	2	1		587.0	McGrath Batemans Bay & Moruya	22-vista-avenue-catalina-nsw-2536
62161	Townhouse	2022-08-04	Auction 27th Aug 2:30pm	2022-08-27	$737,500	3	2	2	6.0		LJ Hooker Tuggeranong	1-166-ellerston-avenue-isabella-plains-act-2905
62168	Land	2022-08-04	$920,000	2022-09-19	$950,000	0	0	0		11.58	LJ Hooker Batemans Bay	517-denley-drive-wamboin-nsw-2620
62174	Land	2022-08-04	$2,125,000	2022-10-14	Undisclosed	0	0	0		499.0	Whale Coast Realty	5371-princes-highway-bodalla-nsw-2545
62183	Townhouse	2022-08-04	Contact Agent	2022-09-02	$880,000	4	2	2			Smile Elite	42-570-sunnyholt-road-stanhope-gardens-nsw-2768
62185	House	2022-08-04	$685,000	2022-08-12	Undisclosed	3	2	2		770.0	PRD Wagga Wagga	53-barmedman-avenue-gobbagombalin-nsw-2650
62188	House	2022-08-05	$1,065,000	2022-10-17	$1,062,000	4	2	2	4.0	483.0	MARQ Property	19-careel-street-harrison-act-2914
62190	House	2022-08-05	$350,000	2022-09-08	Undisclosed	3	1	2		8094.0	Flemings Property Services	12-ellwood-street-stockinbingal-nsw-2725
62195	House	2022-08-05	Contact Agent	2022-10-13	Undisclosed	2	2	2		5.0	Macarthur Real Estate Agency	11-devlin-street-coolamon-nsw-2701
62196	House	2022-08-05	Contact Agent	2022-08-25	$490,000	3	1	2		752.0	Smile Elite	109-sydney-road-kelso-nsw-2795
62209	House	2022-08-04	$1,199,000	2022-11-09	$1,150,000	5	3	2		803.0	First National Real Estate Batemans Bay	8-hilltop-crescent-surf-beach-nsw-2536
62213	Land	2022-08-04	$630,000	2022-10-21	$550,000	0	0	0		2.0	First National Real Estate Batemans Bay	lot-22-worthy-drive-malua-bay-nsw-2536
62214	Land	2022-08-04	$630,000	2022-10-12	$600,000	0	0	0		2.0	First National Real Estate Batemans Bay	lot-21-worthy-drive-malua-bay-nsw-2536
62216	Livestock	2022-08-05	Expressions of Interest	2022-09-12	Undisclosed	0	0	0		318.0	Belle Property Braidwood	483-little-river-road-braidwood-nsw-2622
62222	Unit	2022-08-05	$329,000 - $359,000	2022-09-23	Undisclosed	2	1	1			Ian McNamee & Partners - Queanbeyan	30-14-22-booth-street-queanbeyan-nsw-2620
62229	Townhouse	2022-08-05	$775,000	2022-11-25	$775,000	3	2	2	6.0	449.0	home.by holly	5-21-thunder-circuit-harrison-act-2914
62231	AcreageSemi-rural	2022-08-05	$935,000	2022-08-26	$920,000	3	1	0		1.4	LJ Hooker Moruya	83-bodalla-park-drive-bodalla-nsw-2545
62232	House	2022-08-05	By Negotiation	2022-11-23	$775,000	3	1	2	0.5	515.0	LJ Hooker Woden/Weston	94-blackwood-terrace-holder-act-2611
62239	Lifestyle	2022-08-05	$1,175,000	2023-04-27	$1,062,000	4	2	2		3.01	Raine & Horne Goulburn	156-short-street-collector-nsw-2581
62244	Livestock	2022-08-06	$3,350,000	2023-05-24	$3,350,000	0	0	0		640.0	Belle Property Braidwood	1170-euradux-road-braidwood-nsw-2622
62247	Townhouse	2022-08-08	Auction 27 August 10.30 am	2022-08-12	$715,000	3	2	2		0.0	Ward Estate Agents	5-16-telopea-place-queanbeyan-nsw-2620
62248	House	2022-08-08	$1,795,000	2023-01-06	Undisclosed	4	3	1		885.0	Ben Bate Real Estate	2-comerang-place-potato-point-nsw-2545
62252	House	2022-08-08	AUCTION, price guide $480,000	2022-09-02	$493,500	3	1	4			Ray White Goulburn	8-evans-street-goulburn-nsw-2580
62253	House	2022-08-08	$759,000 +	2022-11-16	Undisclosed	3	1	4	3.0	0.0	Upside	32-stacy-street-gowrie-act-2904
62254	Apartment	2022-08-08	$619,000+	2022-09-02	$610,000	2	2	1	6.0		PURNELL	38-5-hely-street-griffith-act-2603
62255	Apartment	2022-08-08	$585,000+	2022-09-06	Undisclosed	1	1	1	6.0		PURNELL	18-22-canberra-avenue-forrest-act-2603
62257	Apartment	2022-08-08	$649,000+	2022-11-11	$662,000	2	1	1	6.0		PURNELL	19-24-forbes-street-turner-act-2612
62260	House	2022-08-08	Contact Agent	2022-10-27	$610,000	2	1	2		590.0	Smile Elite	3-oakley-avenue-east-lismore-nsw-2480
62263	House	2022-08-08	Price Guide $799,000	2022-09-30	$750,000	3	1	2		714.0	Dwyer Properties Sapphire Coast	38-surf-circle-tura-beach-nsw-2548
62266	House	2022-08-08	Auction Price Guide $650,000	2022-09-02	$660,000	4	2	2		700.0	Ray White Goulburn	126-gibson-street-goulburn-nsw-2580
62269	House	2022-08-08	SOLD PRIOR TO AUCTION	2022-08-26	$500,000	3	1	0			McCann Properties	5-nelanglo-street-gunning-nsw-2581
62270	Apartment	2022-08-08	$569,000	2022-08-23	$565,000	2	2	2		122.0	Raine & Horne Goulburn	24b-29-clinton-street-goulburn-nsw-2580
62276	House	2022-08-08	Price Guide $799,000	2022-11-10	$750,000	3	2	2		814.0	Dwyer Properties Sapphire Coast	260-pacific-way-tura-beach-nsw-2548
62279	House	2022-08-08	$200,000	2022-12-06	$220,000	3	1	2		2023.0	PRD Wagga Wagga	58-reid-street-lockhart-nsw-2656
62280	House	2022-08-08	$415,000	2022-10-25	$405,000	3	1	2		634.0	PRD Wagga Wagga	20-adjin-street-mount-austin-nsw-2650
62288	Lifestyle	2022-08-08	AUCTION	2022-09-30	$2,650,000	0	0	0		346.0	Ray White Goulburn	2597-laggan-taralga-road-crookwell-nsw-2583
62293	House	2022-08-08	$450,000	2022-09-29	$450,000	3	1	1		629.0	One Agency Craig Schofield	37-lambie-street-cooma-nsw-2630
62295	Land	2022-08-08	Contact Agent	2022-09-01	$720,000	0	0	0		2.0	Smile Elite	99-yarragee-road-moruya-nsw-2537
62300	House	2022-08-09	$529,000	2022-10-19	$505,000	2	1	1		575.0	My Agent Team	12-berrima-parade-surfside-nsw-2536
62303	Apartment	2022-08-09	$470,000	2023-05-16	$466,000	1	1	1	6.0		Luton Gungahlin	43-20-allara-street-city-act-2601
62304	House	2022-08-09	Auction Sat, 3rd Sep at 1:00pm	2022-09-03	$1,121,000	4	2	2	1.0	1095.0	LJ Hooker Gungahlin	80-springvale-drive-hawker-act-2614
62306	Apartment	2022-08-09	Auction	2022-09-03	$855,000	2	2	2	6.0		LJ Hooker Dickson	7-20-gould-street-turner-act-2612
62308	Other	2022-08-09	$1,750,000	2022-09-06	$1,820,000	3	3	6		89.0	Belle Property Braidwood	14-dawsons-lane-braidwood-nsw-2622
62313	House	2022-08-09	$840,000	2022-08-30	$840,000	3	1	2	3.5	420.0	McIntyre Property	34-britten-jones-drive-holt-act-2615
62314	House	2022-08-09	$690,000 - $740,000	2022-11-03	Undisclosed	5	3	2		721.2	Macarthur Real Estate Agency	12-fletcher-place-kooringal-nsw-2650
62319	House	2022-08-09	$500,000	2022-11-04	Undisclosed	3	1	1		477.0	Raine & Horne Goulburn	68-victoria-st-goulburn-nsw-2580
62324	House	2022-08-09	$650,000+	2022-10-07	$650,000	3	1	1	2.5	357.0	LJ Hooker Tuggeranong	2-16-armfield-place-chisholm-act-2905
62327	House	2022-08-09	$820,000	2022-11-15	$790,000	4	3	2		756.0	Henley Property - Cooma	6-stratos-place-cooma-nsw-2630
62330	House	2022-08-09	$380,000	2022-09-15	Undisclosed	2	1	2		559.0	Henley Property - Cooma	8-nulgarra-place-cooma-nsw-2630
62331	House	2022-08-09	$679,000 - $699,000	2022-08-29	$700,000	3	1	2	3.0	309.0	McIntyre Property	33-amagula-avenue-ngunnawal-act-2913
62333	House	2022-08-09	$865,000	2022-09-29	$800,000	4	2	2			LJ Hooker Batemans Bay	21-kingston-place-tomakin-nsw-2537
62335	House	2022-08-09	AUCTION GUIDE $450,000	2022-09-16	$442,000	3	1	1		556.5	Ray White Goulburn	57-churchill-street-goulburn-nsw-2580
62337	House	2022-08-09	$595,000	2022-10-17	$575,000	1	1	2		232.0	Ray White Goulburn	10-cartwright-place-goulburn-nsw-2580
62341	House	2022-08-09	$849,000	2022-11-15	$830,000	4	3	2		1012.0	Raine & Horne Goulburn	57-eleanor-street-goulburn-nsw-2580
62351	Apartment	2022-08-10	$449,000+	2022-08-31	$455,000	2	1	1	6.0		MARQ Property	21-54-ernest-cavanagh-street-gungahlin-act-2912
62352	Apartment	2022-08-10	$385,000+	2022-08-31	$400,000	1	1	1	6.0	0.0	McCann Properties	253-325-anketell-street-greenway-act-2900
62353	House	2022-08-10	Auction Saturday 3rd September at 12pm	2022-09-03	$1,020,000	4	2	4	3.0	963.0	McCann Properties	7-mcwhae-circuit-wanniassa-act-2903
62354	Townhouse	2022-08-10	SOLD PRIOR AUCTION - CONTACT AGENT	2022-08-23	$721,000	3	2	2	6.0	5996.0	New Door Properties	13-18-zamia-place-palmerston-act-2913
62355	House	2022-08-10	$495,000 - $515,000	2022-10-20	Undisclosed	3	1	2		704.8	Macarthur Real Estate Agency	24-paldi-crescent-glenfield-park-nsw-2650
62357	Townhouse	2022-08-10	Auction 03/09/2022	2022-08-26	$1,045,000	3	2	2	6.0		MARQ	8-11-wattle-street-oconnor-act-2602
62360	House	2022-08-10	Auction 03/09/2022	2022-09-03	Undisclosed	3	1	1	5.0	1004.4	Ray White Canberra	109-bandjalong-crescent-aranda-act-2614
62361	House	2022-08-10	$749,000	2023-05-16	$720,000	3	2	1		266.0	Luton Manuka	37-unwin-avenue-jerrabomberra-nsw-2619
62363	Unit	2022-08-10	Auction	2022-08-31	Undisclosed	2	2	2	5.5		Luton Gungahlin	60-23-aspinall-street-watson-act-2602
62364	Townhouse	2022-08-10	Auction	2022-09-03	$825,000	3	2	2	5.5		Luton Gungahlin	2-13-conner-close-palmerston-act-2913
62365	House	2022-08-10	Auction	2022-08-27	$925,000	3	2	1	2.5	838.0	LJ Hooker Belconnen	10-gibbs-place-kambah-act-2902
62367	House	2022-08-10	Auction	2022-09-01	$607,000	3	1	2	2.0	539.0	LJ Hooker Belconnen	7-emmott-place-charnwood-act-2615
62368	Unit	2022-08-10	Auction	2022-08-27	$510,000	2	2	1	6.0		LJ Hooker Belconnen	4-8-jeff-snell-crescent-dunlop-act-2615
62369	Land	2022-08-10	Under Contract	2022-10-11	$350,000	0	0	3		691.0	Clearwater Real Estate Narooma	59-kalandar-st-nowra-nsw-2541
62370	Apartment	2022-08-10	Sold prior to auction	2022-09-09	$500,000	2	1	1	6.0	0.0	LJ Hooker Gungahlin	6-38-mort-street-braddon-act-2612
62372	House	2022-08-10	$3,700,000	2022-09-21	Undisclosed	5	2	2	6.0	1077.0	Luton Manuka	43-euree-street-reid-act-2612
62373	Land	2022-08-10	$459,000	2022-10-04	$440,000	0	0	0		834.0	Elders Real Estate Batemans Bay	8-buguri-crescent-malua-bay-nsw-2536
62374	House	2022-08-10	Auction	2022-08-27	$795,000	3	2	2	0.0	765.0	LJ Hooker Belconnen	6-spensley-place-wanniassa-act-2903
62375	House	2022-08-10	$745,000+	2022-09-21	$746,000	3	1	2	2.0		Stone Gungahlin	29-rubicon-street-kaleen-act-2617
62376	House	2022-08-10	By Negotiation	2022-08-25	Undisclosed	4	3	2	3.5	916.0	McGrath Canberra	2-zelman-place-melba-act-2615
62377	House	2022-08-10	Auction	2022-09-03	Undisclosed	5	2	2	4.5	822.0	Luton Gungahlin	57-westbury-circuit-nicholls-act-2913
62378	Apartment	2022-08-10	$525,000+	2022-08-31	$525,500	2	2	1	6.0		Stone Gungahlin	25-21-christina-stead-street-franklin-act-2913
62379	House	2022-08-10	Auction	2022-08-29	$1,240,000	4	2	2	4.5	409.0	Luton Gungahlin	9-alan-watt-crescent-casey-act-2913
62384	Townhouse	2022-08-10	$820,000	2022-10-27	$820,000	3	2	2	6.0		Stone Gungahlin	88-wanderlight-avenue-lawson-act-2617
62388	House	2022-08-10	Contact Agent	2022-08-31	$815,000	3	2	1	4.0	401.0	Independent Gungahlin	29-corringle-close-amaroo-act-2914
62397	Apartment	2022-08-10	Price Guide : $430,000+	2022-09-01	$440,000	2	2	1	6.0	2.12	LJ Hooker Woden/Weston	101-51-catalano-street-wright-act-2611
62402	House	2022-08-10	$679,000	2022-09-01	$690,000	2	1	1		1516.0	LJ Hooker Tuross Head	62-trafalgar-road-tuross-head-nsw-2537
62406	House	2022-08-10	$845,000- $875,000	2022-09-05	$862,000	4	2	4			Ray White Bungendore	15-waratah-street-karabar-nsw-2620
62408	Townhouse	2022-08-10	Auction (if not sold prior)	2022-09-07	Undisclosed	3	2	1		246.0	Flemings Property Services	22a-thornhill-street-young-nsw-2594
62409	House	2022-08-11	Auction	2022-09-03	Undisclosed	4	2	2	6.0	601.0	Luton Weston Creek & Molonglo Valley	36-cazneaux-crescent-weston-act-2611
62410	House	2022-08-11	Auction	2022-08-24	Undisclosed	3	1	0	1.0	882.0	Luton Weston Creek & Molonglo Valley	7-thom-crescent-kambah-act-2902
62411	Apartment	2022-08-11	By Negotiation	2022-09-05	Undisclosed	2	2	2	6.0	0.0	McCann Properties	37-2-newchurch-street-coombs-act-2611
62412	House	2022-08-11	$820,000	2022-09-27	$820,000	3	2	3	1.0	682.0	LJ Hooker Belconnen	22-harrison-street-scullin-act-2614
62414	Townhouse	2022-08-11	$1,249,000	2023-02-13	Undisclosed	3	2	3	4.0		Luton Manuka	4-70-henty-street-braddon-act-2612
62415	Apartment	2022-08-11	$1,395,000+	2022-08-12	$1,400,000	2	2	2	6.0		PURNELL	g03-45-honeysett-view-kingston-act-2604
62416	House	2022-08-11	$1,075,000	2022-09-03	$1,075,000	4	2	3	5.5	738.0	home.by holly	4-cawthorn-crescent-evatt-act-2617
62417	Apartment	2022-08-11	$220,000 - $240,000	2022-08-30	$240,000	1	1	0			Ray White Queanbeyan | Jerrabomberra	15-10-arthur-street-crestwood-nsw-2620
62419	Townhouse	2022-08-11	$625,000	2022-09-02	$625,000	2	1	1	3.5		home.by holly	10-moulden-court-belconnen-act-2617
62420	Apartment	2022-08-11	$719,000 - $749,000	2022-08-18	Undisclosed	2	2	1	6.0		Ray White Canberra	38-10-burke-crescent-kingston-act-2604
62422	House	2022-08-11	$800,000+	2022-10-26	$825,000	3	2	1	0.0	762.0	My Morris	15-buckley-circuit-kambah-act-2902
62423	Apartment	2022-08-11	AUCTION: Saturday September 3rd, on site at 10:00a	2022-09-03	Undisclosed	2	2	1	6.0		LJ Hooker Manuka	34-4-jardine-street-kingston-act-2604
62424	House	2022-08-11	$899,000+	2022-11-14	$892,500	4	2	2	4.0		PURNELL	16-maharatta-circuit-isabella-plains-act-2905
62425	House	2022-08-11	Auction	2022-09-03	Undisclosed	4	2	3	6.0	651.0	Luton Gungahlin	9-boyer-street-casey-act-2913
62428	House	2022-08-11	AUCTION	2022-09-12	$1,090,000	5	2	2		907.0	Ray White Goulburn	4-fraser-close-goulburn-nsw-2580
62429	Unit	2022-08-11	Auction	2022-08-27	$600,000	2	2	2	6.0		LJ Hooker Belconnen	62-20-beissel-street-belconnen-act-2617
62430	House	2022-08-11	$1,272,500	2022-09-07	$1,272,500	4	2	1	2.0	1584.0	home.by holly	43-mayo-street-weetangera-act-2614
62431	Townhouse	2022-08-11	Auction	2022-09-03	$920,000	3	2	2	4.0	379.0	LJ Hooker Tuggeranong	21-6-dods-place-greenway-act-2900
62432	House	2022-08-11	Auction 03/09/2022	2022-09-03	Undisclosed	4	2	4	6.0	592.0	Impact Properties	71-fred-daly-avenue-coombs-act-2611
62433	House	2022-08-11	Contact Agent	2022-08-29	Undisclosed	3	2	4		762.0	Smile Elite	46a-nancy-place-galston-nsw-2159
62436	House	2022-08-11	Contact Agent	2022-10-21	$753,000	3	2	2		652.0	Bella Coastal Property	17-mckail-street-ulladulla-nsw-2539
62439	Unit	2022-08-11	$425,000	2023-07-26	$420,000	2	1	1			Whale Coast Realty	10-16-mcmillan-road-narooma-nsw-2546
62443	Apartment	2022-08-11	$465,000	2023-04-05	$465,000	2	2	2	6.0		home.by holly	32-20-federal-highway-watson-act-2602
62444	House	2022-08-11	$899,000	2022-10-28	Undisclosed	3	1	2		588.1	Ray White Wagga Wagga	48-kincaid-street-wagga-wagga-nsw-2650
62445	Apartment	2022-08-11	Auction	2022-08-27	$605,000	2	2	1	6.0		LJ Hooker Belconnen	111-15-irving-street-phillip-act-2606
62449	Apartment	2022-08-11	Contact Agent	2022-09-01	$560,000	3	2	1	6.0		Ray White Canberra	34-112-baldwin-drive-kaleen-act-2617
62450	Unit	2022-08-11	$475,000	2022-09-09	Undisclosed	2	1	0			Whale Coast Realty	26-16-mcmillan-road-narooma-nsw-2546
62453	House	2022-08-11	Auction, Saturday August 27th at 11:30am	2022-08-23	$695,000	3	1	2	4.0	412.0	LJ Hooker Gungahlin	23-mundang-crescent-ngunnawal-act-2913
62455	House	2022-08-11	Auction 01/09/2022	2022-09-01	$962,000	3	2	1	4.5		Ray White Canberra	76-templeton-street-cook-act-2614
62458	House	2022-08-11	Auction	2022-09-03	$1,225,000	4	2	2	5.0		LJ Hooker Dickson	1-flos-greig-street-watson-act-2602
62459	House	2022-08-11	$1,000,000	2023-02-09	$1,000,000	3	1	0	1.0	556.0	Civium Property Group - Residential	68-walker-crescent-narrabundah-act-2604
62460	Unit	2022-08-11	$325,000	2022-10-11	$370,000	1	1	1		2630.0	Marshall and Tacheci Real Estate	5-8-narira-street-bermagui-nsw-2546
62462	House	2022-08-11	Auction 03/09/2022	2022-09-03	Undisclosed	4	2	4	5.0	621.0	Impact Properties	23-buttfield-street-coombs-act-2611
62464	House	2022-08-11	Auction 03/09/2022	2022-09-03	Undisclosed	4	2	2	2.5	928.0	Ray White Canberra	29-shepherdson-place-isaacs-act-2607
62465	House	2022-08-11	Auction 31/08/22	2022-08-31	$1,700,000	3	1	0	0.5	633.0	Civium Property Group - Residential	9-loch-street-yarralumla-act-2600
62466	House	2022-08-11	$895,000	2022-09-19	$890,000	3	2	2	3.0	813.0	The Real Estate Shop	23-clutterbuck-crescent-oxley-act-2903
62467	House	2022-08-11	$1,925,000 ONO	2023-02-07	Undisclosed	5	2	2		4.33	Rapport Property	43-fox-road-royalla-nsw-2620
62469	Townhouse	2022-08-11	Auction	2022-09-03	Undisclosed	3	2	2	3.0		Luton Belconnen	6-50-fred-williams-crescent-lyneham-act-2602
62471	House	2022-08-11	$795,000+	2022-11-10	Undisclosed	3	1	1	1.0	787.0	Ray White Canberra	20-east-place-kambah-act-2902
62472	House	2022-08-11	$1,230,000	2023-02-01	$1,230,000	4	2	2	6.0	349.0	New Door Properties	8-malcolm-cole-terrace-whitlam-act-2611
62474	House	2022-08-11	Auction	2022-09-02	Undisclosed	6	3	2	4.0	1174.0	Luton Tuggeranong	13-richter-close-fadden-act-2904
62475	Land	2022-08-11	$479,000	2023-06-20	$470,000	0	0	0		808.8	Sails Real Estate	159-pacific-way-tura-beach-nsw-2548
62476	House	2022-08-11	Auction	2022-08-26	$1,100,000	4	2	2	6.0	509.0	Luton Gungahlin	1-ted-richards-street-casey-act-2913
62479	Townhouse	2022-08-11	Auction	2022-09-03	Undisclosed	3	1	1	4.5	362.0	Luton Kippax	224-kerrigan-street-dunlop-act-2615
62483	House	2022-08-11	$530,000	2022-09-28	Undisclosed	3	2	4		876.9	Macarthur Real Estate Agency	69-balleroo-crescent-glenfield-park-nsw-2650
62484	House	2022-08-11	AUCTION - Unless Sold Prior	2022-09-02	$585,000	3	1	3		978.0	Ray White Goulburn	162-kinghorne-street-goulburn-nsw-2580
62490	Apartment	2022-08-11	$409,000 +	2022-09-20	$422,000	2	1	1	5.0		LJ Hooker Woden/Weston	35-7-medley-street-chifley-act-2606
