id	type	ListingDate	PriceLabel	SoldDate	SoldPrice	Beds	Baths	Cars	EER	PlotSize	Agency.Name	Slug
82421	Unit	2023-07-01	$429,000	2023-09-01	$410,000	2	2	1		206.0	One Agency Wagga Wagga	1-2-4-macquarie-street-mount-austin-nsw-2650
82434	House	2023-07-03	$430,000	2023-12-20	$425,000	3	1	1		1012.0	PRD Wagga Wagga	228-lake-albert-road-kooringal-nsw-2650
82444	House	2023-07-03	$499,000	2023-10-10	$480,000	2	1	1		683.0	Smile Elite	18-myrtle-street-dorrigo-nsw-2453
82445	House	2023-07-03	$949,000	2023-08-18	$949,000	4	2	2	0.0		Henley Property - Berridale	3-katri-close-berridale-nsw-2628
82453	House	2023-07-03	$877,000	2023-09-04	$877,000	4	3	2			LJ Hooker Queanbeyan – Jerrabomberra – Googong	1-heather-street-crestwood-nsw-2620
82454	House	2023-07-03	$910,000 - $930,000	2023-08-11	$902,500	4	2	2		1079.0	Smile Elite	83-freeman-circuit-llanarth-nsw-2795
82457	Apartment	2023-07-03	By Negotiation	2023-07-21	$475,000	2	1	1	6.0		Impact Properties	44-43-hibberson-street-gungahlin-act-2912
82462	House	2023-07-03	$539,000	2023-07-25	$515,000	3	1	2		689.0	Ray White Goulburn	34-garfield-avenue-goulburn-nsw-2580
82467	Land	2023-07-03	$389,000	2024-01-09	Undisclosed	0	0	0		3466.00	Beaches & Bush Properties	north-batemans-bay-2536-nsw
82469	Land	2023-07-03	$449,000	2024-01-09	Undisclosed	0	0	0		8916.0	Beaches & Bush Properties	north-batemans-bay-2536-nsw
82471	House	2023-07-03	$535,000	2023-08-04	Undisclosed	3	1	2		773.0	Ray White Wagga Wagga	66-balleroo-crescent-glenfield-park-nsw-2650
82474	House	2023-07-03	$639,000+	2023-08-02	$671,000	3	1	1	0.5	413.0	MARQ Property	108-mainwaring-rich-circuit-palmerston-act-2913
82475	Townhouse	2023-07-03	Under Offer	2023-09-05	Undisclosed	2	2	1	2.0		Bertram Ellis	65-6-jardine-street-kingston-act-2604
82476	DuplexSemi-detached	2023-07-03	$790,000 - $820,000	2023-08-14	$770,000	3	2	2			Merimbula Realty	2-212-pacific-way-tura-beach-nsw-2548
82484	Unit	2023-07-04	$490,000 - $520,000	2023-08-24	$490,000	2	1	1			My Agent Team	7-676-678-beach-road-surf-beach-nsw-2536
82487	House	2023-07-04	$575,000	2023-07-26	$575,000	3	2	1		594.0	LJ Hooker Batemans Bay	9-hillview-place-sunshine-bay-nsw-2536
82498	House	2023-07-04	Price Guide: $420,000 - $440,000	2023-08-03	$410,000	3	1	1		563.0	Harcourts Greater Port Macquarie & The Rocks	38-alverton-street-greenhill-nsw-2440
82511	House	2023-07-04	$775,000	2023-09-13	$740,000	3	2	1			Merimbula Realty	15-sapphire-crescent-merimbula-nsw-2548
82516	Unit	2023-07-04	$550,000	2023-08-23	$540,000	2	1	1		1002.0	Dwyer Properties Sapphire Coast	4-21-marine-parade-merimbula-nsw-2548
82520	House	2023-07-04	SOLD	2024-01-10	Undisclosed	4	2	2		716.00	Flemings Property Services	22-bullecourt-street-cootamundra-nsw-2590
82522	House	2023-07-04	$1,050,000+	2023-08-04	$1,091,000	4	2	2	5.0	832.0	LJ Hooker Gungahlin	11-burdekin-avenue-amaroo-act-2914
82523	Retirement	2023-07-04	Contact Agent	2023-10-11	$440,000	2	1	1			Bella Coastal Property	69-385-princes-highway-ulladulla-nsw-2539
82525	House	2023-07-04	$550,000	2023-09-20	Undisclosed	3	1	1		3.5	Ray White Wagga Wagga	36-iverach-street-coolamon-nsw-2701
82526	Unit	2023-07-04	$187,500	2023-08-21	$187,500	1	1	1			LJ Hooker Queanbeyan – Jerrabomberra – Googong	8-10-wanniassa-street-queanbeyan-east-nsw-2620
82529	House	2023-07-04	$1,650,000	2023-11-03	Undisclosed	4	3	1		826.0	Smile Elite	21-redwood-avenue-berowra-nsw-2081
82539	Apartment	2023-07-04	$740,000+	2023-08-02	$777,000	2	2	2	6.0		LJ Hooker Canberra City	g01-165-northbourne-avenue-turner-act-2612
82545	House	2023-07-04	Expressions of Interest	2023-09-15	$1,362,000	3	1	1		500.0	Smile Elite	135-brick-wharf-road-woy-woy-nsw-2256
82555	House	2023-07-04	$1,150,000	2023-08-17	$1,151,750	5	3	2		2.0	Kitson Property	18-mallee-road-springvale-nsw-2650
82558	House	2023-07-04	Guide $980,000 - $1,060,000	2023-07-21	$970,000	4	2	1		929.5	Ray White Bowral	3-retford-road-bowral-nsw-2576
82559	House	2023-07-05	Auction	2023-07-29	$565,000	2	1	1	2.5	403.0	LJ Hooker Belconnen	16-brownlow-place-holt-act-2615
82561	House	2023-07-05	Price By Negotiation	2023-12-11	$2,350,000	4	3	2		517.0	Bella Coastal Property	29-lake-view-drive-burrill-lake-nsw-2539
82563	Apartment	2023-07-05	$455,000+	2023-07-21	Undisclosed	2	1	1	6.0		Morrissey Property	74-1-braybrooke-street-bruce-act-2617
82564	House	2023-07-05	Auction	2023-07-20	Undisclosed	3	3	2	4.0	374.0	Luton Gungahlin	51-nellie-hamilton-avenue-gungahlin-act-2912
82567	House	2023-07-05	AUCTION	2023-08-01	$1,035,000	3	1	1	2.0	627.0	McIntyre Property	46-warramoo-crescent-narrabundah-act-2604
82568	Villa	2023-07-05	$620,000 - $640,000	2023-09-05	$600,000	3	2	2			Smile Elite	4-49-hillcrest-avenue-south-nowra-nsw-2541
82569	Unit	2023-07-05	$599,000+	2023-07-20	$593,000	2	2	2	6.0	7622.2	Ray White Canberra	101-99-eastern-valley-way-belconnen-act-2617
82570	House	2023-07-05	Auction 15/07/2023	2023-07-15	$710,000	2	1	1	4.5	249.0	Ray White Canberra	2-loveday-crescent-casey-act-2913
82572	House	2023-07-05	$540,000	2023-07-10	$540,000	2	1	1	4.0	244.69	Ray White Canberra	8-48-goldner-circuit-melba-act-2615
82574	House	2023-07-05	$410,000	2023-12-08	$390,000	3	2	1		735.0	One Agency Craig Schofield	21-maybe-street-bombala-nsw-2632
82577	House	2023-07-05	Auction	2023-07-29	Undisclosed	4	2	2	5.5	565.0	LJ Hooker Belconnen	107-wunderly-circuit-macgregor-act-2615
82578	House	2023-07-05	$609,000	2023-07-31	Undisclosed	3	2	2		479.0	Ray White Wagga Wagga	57-heydon-avenue-turvey-park-nsw-2650
82580	Apartment	2023-07-05	$360,000+	2023-09-01	$380,000	1	1	1	6.0		LJ Hooker Canberra City	139-140-thynne-street-bruce-act-2617
82581	House	2023-07-05	Auction	2023-07-29	Undisclosed	3	2	2	6.0	234.0	Luton Gungahlin	3-david-miller-crescent-casey-act-2913
82584	House	2023-07-05	Auction	2023-07-12	Undisclosed	3	1	2	2.0		Luton Gungahlin	13-kelsall-place-spence-act-2615
82586	House	2023-07-05	$739,000	2023-08-09	$739,000	3	1	1	3.5	711.4	Ray White Canberra	6-mcilveen-place-oxley-act-2903
82594	House	2023-07-05	Auction	2023-07-22	$1,000,000	5	2	2	0.5	1130.0	LJ Hooker Belconnen	57-bingley-crescent-fraser-act-2615
82596	House	2023-07-05	$732,000	2023-07-26	$732,000	3	2	2	3.5		home.by holly	7-traynor-court-melba-act-2615
82600	House	2023-07-05	$599,000	2023-10-18	Undisclosed	3	1	2	1.0	373.0	McIntyre Property	48-tepper-circuit-kambah-act-2902
82608	Land	2023-07-05	Guide $890,000 - $980,000	2023-12-01	Undisclosed	0	0	0		2795.0	Ray White Bowral	36-cordeaux-street-willow-vale-nsw-2575
82614	House	2023-07-05	$669,000+	2023-08-03	$670,000	3	1	1	1.5	730.0	McIntyre Property	6-ampt-place-theodore-act-2905
82615	Apartment	2023-07-05	$380,000	2023-07-26	Undisclosed	1	1	1	6.0		Luton Tuggeranong	304-325-anketell-street-greenway-act-2900
82625	House	2023-07-06	Auction 27/07/23	2023-07-27	$765,000	3	1	1	1.5	723.0	Ray White Canberra	31-ologhlen-street-latham-act-2615
82629	Townhouse	2023-07-06	$515,000+	2023-07-21	$543,500	2	1	1	2.0		Morrissey Property	19-2-postle-circuit-holt-act-2615
82634	Unit	2023-07-06	$850,000	2023-09-20	Undisclosed	3	2	1			Harcourts Greater Port Macquarie & The Rocks	3-12-prince-of-wales-avenue-south-west-rocks-nsw-2431
82637	House	2023-07-06	Auction	2023-07-29	$832,500	3	1	1	1.0	978.0	Bastion Property Group	19-heydon-crescent-evatt-act-2617
82638	Land	2023-07-06	Contact Agent	2023-07-27	Undisclosed	0	0	0		616.0	Flemings Property Services	2-harvest-circuit-cowra-nsw-2794
82639	House	2023-07-06	$339,000	2023-11-14	Undisclosed	3	1	1		455.0	Flemings Property Services	5-main-street-cowra-nsw-2794
82647	Land	2023-07-06	Contact Agent	2023-07-27	Undisclosed	0	0	0		1062.0	Flemings Property Services	lot-7-koorawatha-street-cowra-nsw-2794
82650	Retirement	2023-07-06	$595,000	2023-10-17	$580,000	3	2	3		696.0	Jo Jones Property Specialists	77-cornfield-parade-fishermans-paradise-nsw-2539
82652	House	2023-07-06	$1,100,000	2023-10-18	$1,035,000	3	2	1		848.0	Jo Jones Property Specialists	24-valley-drive-mollymook-beach-nsw-2539
82658	Unit	2023-07-06	Owner Invites Offers - Guide $80,000	2023-09-03	Undisclosed	2	1	0			Jo Jones Property Specialists	49-396-princes-highway-ulladulla-nsw-2539
82671	Land	2023-07-06	Contact Agent	2023-07-27	Undisclosed	0	0	0		2000.0	Flemings Property Services	9-11-carrington-street-woodstock-nsw-2793
82674	House	2023-07-06	$965,000	2023-08-21	$965,000	3	1	0	0.0		home.by holly	1-hanson-place-watson-act-2602
82675	Land	2023-07-06	$169,000	2023-10-10	Undisclosed	0	0	0		919.0	Flemings Property Services	28-bourke-street-cowra-nsw-2794
82686	Townhouse	2023-07-06	$590,000	2023-12-07	Undisclosed	2	1	2	0.0		Luton Tuggeranong	17-27-elm-way-jerrabomberra-nsw-2619
82690	House	2023-07-06	Price Guide: $880,000.00 to $920,000.00	2023-08-14	Undisclosed	4	2	4		667.0	dwell Realty	15-brassia-rise-south-nowra-nsw-2541
82692	Apartment	2023-07-06	$875,000+	2023-08-03	Undisclosed	2	2	2	6.0		LJ Hooker Manuka	57-7-light-street-griffith-act-2603
82693	House	2023-07-06	Auction 02/08/2023	2023-08-02	Undisclosed	7	5	2	0.5	986.0	LJ Hooker Dickson	6-cowan-street-downer-act-2602
82694	Townhouse	2023-07-06	$720,000+	2023-08-04	$740,000	3	2	2	1.5	580.0	LJ Hooker Tuggeranong	9-7-preddey-way-gordon-act-2906
82695	Townhouse	2023-07-06	$720,000+	2023-09-05	$718,000	3	2	2	1.5		Maloney's Property	6-22-port-jackson-circuit-phillip-act-2606
82696	Townhouse	2023-07-06	$550,000+	2023-08-09	$575,000	2	1	1	5.5	159.0	LJ Hooker Tuggeranong	13-25-pinkerton-circuit-kambah-act-2902
82697	House	2023-07-06	AUCTION 27/7/2023	2023-07-27	$840,000	3	2	2	1.0	834.0	Ray White Canberra	23-elizabeth-crescent-macquarie-act-2614
82702	House	2023-07-06	Auction	2023-07-24	Undisclosed	3	1	1	6.0	313.0	LJ Hooker Kippax	6-hazelton-street-macgregor-act-2615
82705	House	2023-07-06	$580,000 to $620,000	2023-10-10	$580,000	3	1	1		410.0	Smile Elite	28-boomerang-street-sanctuary-point-nsw-2540
82712	House	2023-07-06	Auction	2023-07-29	Undisclosed	3	2	2	5.0		LJ Hooker Dickson	65-whitmore-crescent-watson-act-2602
82725	House	2023-07-06	$800,000 - $850,000	2023-07-27	$810,000	4	2	2		1039.0	My Agent Team	60-long-beach-road-long-beach-nsw-2536
82729	House	2023-07-06	Auction 26/07/2023	2023-07-25	Undisclosed	4	2	2	3.0	817.0	Ray White Canberra	29-hollway-street-calwell-act-2905
82732	Land	2023-07-06	$550,000 to $590,000 Price Guide	2023-10-24	$530,000	0	0	0		934.0	Sails Real Estate	19-jacaranda-place-merimbula-nsw-2548
82734	House	2023-07-06	PRICE GUIDE 1,160,000 - $1,220,000	2023-08-17	$1,186,500	4	2	1		337.0	Smile Elite	55-pridham-avenue-box-hill-nsw-2765
82736	House	2023-07-06	Price Guide $1,220,000	2023-07-14	$1,385,000	4	2	2		407.1	Smile Elite	6-bejar-street-schofields-nsw-2762
82737	Townhouse	2023-07-06	For Sale $880,000 - $920,000	2023-09-11	$885,000	4	2	1		192.0	Smile Elite	120-sciberras-avenue-schofields-nsw-2762
82738	House	2023-07-06	SOLD AT AUCTION $1,205,000.00	2023-08-14	$1,205,000	4	2	1		364.6	Smile Elite	43-wildflower-street-schofields-nsw-2762
82739	House	2023-07-06	Price Guide $1,375,000	2023-07-24	$1,510,000	5	3	2		340.0	Smile Elite	17-coursebrook-sreet-box-hill-nsw-2765
82740	House	2023-07-07	By Negotiation	2023-08-02	$721,000	3	1	1	4.0	381.0	LJ Hooker Gungahlin	8-laptz-close-palmerston-act-2913
82742	House	2023-07-07	$429,900	2023-09-12	$420,000	3	1	1		752.5	Kitson Property	96-grove-street-kooringal-nsw-2650
82743	House	2023-07-07	Preview	2023-08-07	Undisclosed	3	2	2		809.0	Ray White Wagga Wagga	31-nunkeri-street-glenfield-park-nsw-2650
82745	Townhouse	2023-07-07	$595,000	2023-08-09	$575,000	2	2	1	6.0	119.0	McCann Properties	14-81-mcwhae-circuit-wanniassa-act-2903
82746	Townhouse	2023-07-07	$475,000	2023-09-22	$465,000	3	1	1			LJ Hooker Batemans Bay	1-53-golf-links-drive-batemans-bay-nsw-2536
82758	Townhouse	2023-07-07	$385,000	2023-11-09	$380,000	3	1	1			Smile Elite	12-29-carolina-street-lismore-heights-nsw-2480
82759	House	2023-07-07	$400,000 - $430,000	2023-07-19	$432,500	4	1	1		365.0	Smile Elite	230-william-street-bathurst-nsw-2795
82770	House	2023-07-07	$1,180,000 - $1,250,000	2023-08-11	$1,125,000	4	2	3		734.0	My Agent Team	25-sandy-place-long-beach-nsw-2536
82776	Unit	2023-07-07	$315,000	2023-09-20	$315,000	2	1	1			LJ Hooker Batemans Bay	69-49-old-princes-highway-batemans-bay-nsw-2536
82777	House	2023-07-07	Auction	2023-08-02	$911,000	3	2	2	5.0	495.0	LJ Hooker Kaleen	45-fred-johns-crescent-mckellar-act-2617
82783	House	2023-07-07	AUCTION - 4th August	2023-08-04	$721,000	3	1	1		378.0	Ray White Goulburn	3-beppo-street-goulburn-nsw-2580
82788	Townhouse	2023-07-07	$880,000	2023-09-01	Undisclosed	4	2	2	1.0	468.0	Luton Tuggeranong	74-de-little-circuit-greenway-act-2900
82795	House	2023-07-07	$549,900	2023-08-14	$561,000	3	2	1		594.0	John Mooney Real Estate	80-macleay-street-turvey-park-nsw-2650
82798	House	2023-07-07	Price Guide $1,180,000	2023-07-27	$1,212,500	4	2	2		338.5	Smile Elite	68-boundary-road-schofields-nsw-2762
82800	House	2023-07-07	AUCTION 12/8/2023	2023-08-12	$1,260,000	4	2	2	5.5	574.0	Ray White Canberra	22-ashton-calvert-casey-act-2913
82815	House	2023-07-09	SOLD	2023-10-11	Undisclosed	4	1	2		594.6	Flemings Property Services	32-congou-street-cootamundra-nsw-2590
82820	House	2023-07-10	$550,000	2023-08-30	$535,000	2	1	0			Ray White Braidwood	36-coronation-braidwood-nsw-2622
82826	Lifestyle	2023-07-10	Auction	2023-07-17	$1,350,000	3	1	4		68.79	Ray White Goulburn	378-tickner-valley-road-marulan-nsw-2579
82828	House	2023-07-10	Sold $1,186,000	2023-07-28	$1,186,000	4	2	2	6.0	448.0	Blackshaw Gungahlin	3-berents-street-strathnairn-act-2615
82832	House	2023-07-10	$865,000 - $951,500	2023-09-04	$900,000	4	2	3		713.0	Smile Elite	62-talleyrand-circuit-greta-nsw-2334
82839	House	2023-07-10	$650,000 - $695,000	2023-09-04	$660,000	6	3	3		1114.0	Smile Elite	15-merlot-street-muswellbrook-nsw-2333
82842	Land	2023-07-10	$435,000	2023-12-05	$414,000	0	0	0		667.0	LJ Hooker Tuross Head	31-marlin-street-tuross-head-nsw-2537
82847	Land	2023-07-10	$448,900	2023-07-28	$448,900	0	0	0	0.0	417.0	Village	lot-683-alpine-ash-way-tralee-nsw-2620
82852	Unit	2023-07-10	$225,000	2023-07-10	$225,000	1	1	1			LJ Hooker Queanbeyan – Jerrabomberra – Googong	17-5-mowatt-street-queanbeyan-east-nsw-2620
82854	House	2023-07-10	$875,000 to $920,000	2023-08-09	$850,000	4	2	1		642.0	LJ Hooker Ulladulla	4-capricorn-avenue-narrawallee-nsw-2539
82855	Apartment	2023-07-10	$661,000	2023-07-29	$661,000	2	2	1	6.0		home.by holly	11-63a-torrens-street-braddon-act-2612
82862	Apartment	2023-07-10	By Negotiation	2023-07-10	$410,000	1	1	1	6.0		Impact Properties	74-275-flemington-road-franklin-act-2913
82865	House	2023-07-11	$349,000	2023-09-12	$340,000	3	1	2		733.0	One Agency Wagga Wagga	90-bolger-avenue-mount-austin-nsw-2650
82867	House	2023-07-11	$740,000 - $770,000	2023-08-28	Undisclosed	4	2	2		678.0	Ray White Wagga Wagga	109-bradman-drive-boorooma-nsw-2650
82872	Apartment	2023-07-11	Auction	2023-07-28	Undisclosed	2	2	2	6.0		LJ Hooker Dickson	46-11-stockman-avenue-lawson-act-2617
82876	Apartment	2023-07-11	$399,999	2023-08-21	$395,000	1	1	1	6.0		LJ Hooker Belconnen	1310-3-grazier-lane-belconnen-act-2617
82884	Unit	2023-07-11	$250,000- $255,000	2023-08-24	$254,000	1	1	1	4.0		Ray White Queanbeyan | Jerrabomberra	20-30-river-street-oaks-estate-act-2620
82886	Apartment	2023-07-11	Offers over $435,000	2023-09-12	$437,000	1	1	1	6.0		Luton Manuka	10-11-13-majura-avenue-dickson-act-2602
82887	Apartment	2023-07-11	Sold	2023-09-27	$580,000	3	2	2			The Property Collective	2-12-waniassa-street-queanbeyan-nsw-2620
82889	House	2023-07-11	$779,000	2023-09-13	$755,000	2	2	2		765.0	Hallmark Real Estate Advisors	6-hawkins-road-tuross-head-nsw-2537
82898	Unit	2023-07-11	$227,000	2023-07-11	$227,000	1	1	1			LJ Hooker Queanbeyan – Jerrabomberra – Googong	7-2-donald-road-queanbeyan-nsw-2620
82907	Apartment	2023-07-11	Auction 16th August	2023-08-16	$570,000	2	2	2	6.0		LJ Hooker Canberra City	17-1-drew-street-greenway-act-2900
82909	House	2023-07-11	$395,000 - $425,000	2023-07-31	$365,000	4	2	3			Smile Elite	2-east-street-uralla-nsw-2358
82910	House	2023-07-11	Auction - Sold $1,460,000	2023-08-05	$1,460,000	4	3	2	7.0	628.0	Altair Property	4-nell-edeson-street-taylor-act-2913
82912	House	2023-07-11	$799,000	2023-12-12	$785,000	4	2	1		859.0	Hallmark Real Estate Advisors	33-grenville-avenue-tuross-head-nsw-2537
82913	House	2023-07-11	$769,000	2023-11-09	$745,000	3	1	4		872.0	McGrath Batemans Bay & Moruya	30-runnyford-road-nelligen-nsw-2536
82916	House	2023-07-11	$1,050,000	2023-08-11	Undisclosed	4	2	2	4.0	785.0	Luton Tuggeranong	6-van-praag-place-gordon-act-2906
82921	Apartment	2023-07-11	Offers Above $710,000	2023-08-23	$715,000	2	2	2	6.0		LJ Hooker Dickson	33-193-mouat-street-lyneham-act-2602
82924	House	2023-07-11	$989,000+	2023-08-24	Undisclosed	4	2	2	5.0	461.0	MARQ Property	33-mummery-terrace-moncrieff-act-2914
82927	House	2023-07-11	Guide $700,000 Auction (Unless Sold Prior)	2023-07-31	$750,000	4	2	3		700.0	Ray White Goulburn	2-riverview-place-goulburn-nsw-2580
82935	Townhouse	2023-07-12	Auction onsite	2023-08-05	$1,500,000	5	3	2	4.5	434.0	MARQ Property	1-42-adder-street-harrison-act-2914
82937	Apartment	2023-07-12	$395,000	2023-10-31	$389,000	1	1	1	6.0		LJ Hooker Dickson	34-10-burke-crescent-kingston-act-2604
82940	House	2023-07-12	$690,000 - $720,000	2023-09-09	$690,000	3	2	2		740.0	Smile Elite	12-bunderra-drive-nowra-nsw-2541
82941	House	2023-07-12	AUCTION	2023-08-05	$842,000	3	2	1	5.5	249.0	Ray White Canberra	7-sliprail-street-lawson-act-2617
82942	House	2023-07-12	UNDER CONTRACT	2023-08-04	Undisclosed	5	3	2		797.0	Raine & Horne Mollymook Milton	3-cliff-avenue-mollymook-beach-nsw-2539
82943	Townhouse	2023-07-12	$665,000-$695,000	2023-09-04	Undisclosed	3	2	2			Ray White Queanbeyan | Jerrabomberra	2-11-adams-street-queanbeyan-west-nsw-2620
82948	House	2023-07-12	AUCTION	2023-08-09	$1,000,000	3	1	1	0.5	716.0	McIntyre Property	10-tardent-street-downer-act-2602
82950	AcreageSemi-rural	2023-07-12	$1,295,000 - $1,395,000	2023-12-11	Undisclosed	3	1	3		40.06	Smile Elite	2535-taylors-arm-road-taylors-arm-nsw-2447
82956	House	2023-07-12	$960,000+	2023-08-08	Undisclosed	5	2	2	3.0	671.0	My Morris	10-fernie-place-monash-act-2904
82959	House	2023-07-12	Sold Prior to Auction	2023-08-05	$1,350,000	5	3	2		1189.0	Ian McNamee & Partners - Queanbeyan	11-jacaranda-drive-jerrabomberra-nsw-2619
82962	Apartment	2023-07-12	Auction 2nd August at 6pm	2023-08-02	Undisclosed	1	1	1	6.0	2769.0	LJ Hooker Gungahlin	58-40-swain-street-gungahlin-act-2912
82966	House	2023-07-12	$839,000	2023-08-02	$828,000	3	2	2			LJ Hooker Malua Bay	2-mimosa-place-malua-bay-nsw-2536
82968	House	2023-07-12	Auction	2023-07-21	Undisclosed	3	1	1	2.5	820.0	Luton Kippax	4-sinnett-place-mckellar-act-2617
82969	House	2023-07-12	Price Guide $550,000-$585,000	2023-09-08	$565,000	3	1	4			Smile Elite	33-rowan-avenue-uralla-nsw-2358
82971	House	2023-07-12	$699,000	2023-08-29	$685,000	4	2	3		1151.0	Kitson Property	29-plumpton-road-kooringal-nsw-2650
82977	House	2023-07-12	$685,000+	2023-08-30	Undisclosed	3	1	2	3.5		Luton Tuggeranong	2-44-deamer-crescent-richardson-act-2905
82978	House	2023-07-12	$399,000 - $419,000	2023-09-12	$419,000	3	1	1		790.0	Macarthur Real Estate Agency	19-karen-street-tolland-nsw-2650
82981	House	2023-07-12	$900,000+	2023-10-04	Undisclosed	3	2	2	3.0	715.0	Luton Gungahlin	57-tazewell-circuit-nicholls-act-2913
82983	Townhouse	2023-07-13	Auction	2023-08-05	Undisclosed	3	2	2	6.0		Luton Weston Creek & Molonglo Valley	24a-edgeworth-parade-coombs-act-2611
82985	Townhouse	2023-07-13	contact agent	2023-08-22	Undisclosed	2	1	1	1.5		home.by holly	43-wybalena-grove-cook-act-2614
82988	House	2023-07-13	$1,105,000	2023-08-21	$1,105,000	3	2	2	5.0	588.0	home.by holly	12-phyllis-frost-street-forde-act-2914
82989	Apartment	2023-07-13	$880,000	2023-09-12	$880,000	2	2	2	6.0		home.by holly	23-11-15-kerridge-street-kingston-act-2604
82990	House	2023-07-13	$1,025,000+	2023-09-01	$1,050,000	4	2	3	6.0	712.0	Ray White Canberra	5-koerstz-street-dunlop-act-2615
82991	Unit	2023-07-13	$470,000+	2023-08-04	$475,000	2	1	2	6.0	0.0	Agent Team Belconnen	47-46-paul-coe-crescent-ngunnawal-act-2913
82993	Townhouse	2023-07-13	$530,000	2023-07-29	$530,000	1	1	1	5.0		home.by holly	3-30-ijong-street-braddon-act-2612
82995	Unit	2023-07-13	$549,000+	2023-08-03	$565,000	2	1	2	6.0		Luton Gungahlin	4-217-northbourne-avenue-turner-act-2612
82996	Land	2023-07-13	Auction	2023-08-05	$651,000	0	0	0	0.0	542.0	Luton Gungahlin	3-iwanoff-street-taylor-act-2913
82997	House	2023-07-13	$555,000	2023-10-17	$550,000	3	1	2		898.4	PRD Wagga Wagga	27-gunn-drive-estella-nsw-2650
83001	House	2023-07-13	NEW PRICE! $555,000	2023-08-31	$535,000	3	1	4			Ray White Goulburn	60-sloane-street-goulburn-nsw-2580
83004	House	2023-07-13	Offers over $630,000	2023-08-14	$645,000	3	1	1	5.0		Luton Kippax	24-james-harrison-street-dunlop-act-2615
83005	Apartment	2023-07-13	$670,000+	2023-09-13	$680,000	2	2	3	6.0		Solely Properties	26-15-cynthea-teague-crescent-greenway-act-2900
83009	House	2023-07-13	Auction 02/08/2023	2023-08-02	$662,500	2	2	1	6.0		Ray White Canberra	18-128-easty-street-phillip-act-2606
83010	Townhouse	2023-07-13	$560,000+	2023-08-03	$572,000	3	1	2	3.5		Luton Kippax	6-12-luke-street-holt-act-2615
83013	Other	2023-07-13	$65,000	2023-07-12	$65,000	0	0	0		9533.0	LJ Hooker Queanbeyan – Jerrabomberra – Googong	2085-sutton-road-sutton-nsw-2620
83016	Apartment	2023-07-13	Auction	2023-08-05	Undisclosed	3	2	2	6.0		Luton Manuka	31-9-light-street-griffith-act-2603
83017	House	2023-07-13	$725,000 - $775,000	2023-08-28	$735,000	3	2	2		1813.0	Sails Real Estate	12-clarke-street-wolumla-nsw-2550
83018	House	2023-07-13	$900,000 - $950,000 Price Guide	2023-10-03	$880,000	4	2	2		1005.0	Sails Real Estate	13-forest-court-tura-beach-nsw-2548
83019	House	2023-07-13	$600,000	2023-08-28	$590,000	4	1	4		664.0	Professionals Nowra	13-hockey-street-nowra-nsw-2541
83024	House	2023-07-13	Auction 29/07/2023	2023-07-29	$865,000	4	3	2	1.0		Ray White Canberra	8-keeling-place-kambah-act-2902
83029	House	2023-07-13	$1,050,000+	2023-09-12	$1,050,000	5	2	2	5.0	569.0	Stone Gungahlin	13-frearson-street-strathnairn-act-2615
83032	Townhouse	2023-07-13	$780,000 +	2023-09-07	$775,000	3	2	2	5.0		LJ Hooker Woden/Weston	13-44-catalano-street-wright-act-2611
83034	House	2023-07-13	AUCTION 5/8/2023	2023-08-03	$800,000	3	1	1	3.5	735.0	Ray White Canberra	78-ross-smith-crescent-scullin-act-2614
83035	House	2023-07-13	$880,000+	2023-09-15	Undisclosed	4	2	3	0.5	712.0	Luton Tuggeranong	83-sternberg-crescent-wanniassa-act-2903
83040	Apartment	2023-07-13	$580,000+	2023-09-13	$590,000	2	2	2	6.0		Ray White Canberra	46-2-mcmichael-terrace-denman-prospect-act-2611
83044	Townhouse	2023-07-13	$690,000+	2023-10-16	Undisclosed	3	2	2	2.0		McIntyre Property	5-6-blackett-crescent-greenway-act-2900
83048	House	2023-07-13	Auction	2023-08-05	Undisclosed	4	2	1	0.5	986.0	LJ Hooker Dickson	44-knox-street-watson-act-2602
83056	House	2023-07-13	By Negotiation	2023-09-22	$785,000	3	1	2	0.5	1124.0	McIntyre Property	77-alfred-hill-drive-melba-act-2615
83058	House	2023-07-13	Auction	2023-08-05	$855,000	3	2	2	1.5	740.0	LJ Hooker Tuggeranong	13-kingsbury-street-gowrie-act-2904
83059	House	2023-07-13	Auction 9 August @ 12.30pm	2023-08-09	$746,000	3	1	0	3.0	852.0	Maloney's Property	13-maidment-place-kambah-act-2902
83060	House	2023-07-13	$699,000	2023-07-11	$670,000	4	2	4		910.9	Raine & Horne Young	6-mayoh-place-young-nsw-2594
83062	House	2023-07-13	$739,000+	2023-08-02	$799,000	3	2	2	6.0	378.0	LJ Hooker Kippax	70-britten-jones-drive-holt-act-2615
83064	Apartment	2023-07-13	$395,000	2023-09-22	$395,000	1	1	1	6.0		home.by holly	39-25-aspinall-street-watson-act-2602
83066	House	2023-07-13	$550,000	2023-10-11	$535,000	3	1	6		2023.0	Smile Elite	51-pagan-street-jerrys-plains-nsw-2330
83073	House	2023-07-13	For Sale $1,150,000 - $1,200,000	2023-07-25	$1,175,000	4	2	1		318.0	Smile Elite	21-tinline-street-box-hill-nsw-2765
83104	House	2023-07-14	Auction on Site 10 August @ 12.30pm	2023-08-10	$1,090,000	3	1	1	2.0		Maloney's Property	30-jensen-street-hughes-act-2605
83107	House	2023-07-14	$670,000+	2023-09-12	$682,500	3	1	1	0.5	401.0	Ray White Canberra	8-luckman-place-banks-act-2906
83110	Unit	2023-07-14	$380,000+	2023-08-02	$387,000	2	1	1	6.0	5519.0	LJ Hooker Kippax	18-8-beetaloo-street-hawker-act-2614
83114	House	2023-07-14	$770,000	2023-07-24	$745,000	3	2	2		828.0	Professionals Nowra	31-sheraton-circuit-bomaderry-nsw-2541
83116	House	2023-07-14	AUCTION THIS SUNDAY 10AM Price Guide $720,000	2023-08-01	$931,000	3	1	2		682.9	Smile Elite	41-anthony-street-blacktown-nsw-2148
83119	House	2023-07-14	Auction Saturday 29th July 2023 at 10:00am	2023-07-29	Undisclosed	4	2	2	5.0	672.0	Hugo. Canberra	1-gurrang-avenue-ngunnawal-act-2913
83120	Unit	2023-07-14	$500,000 - $530,000	2023-10-16	$515,000	2	1	1			My Agent Team	11-1-george-bass-drive-batehaven-nsw-2536
83130	House	2023-07-14	$695,000	2023-08-28	$685,000	3	1	2		651.0	Bella Coastal Property	53-mercury-drive-lake-tabourie-nsw-2539
83131	House	2023-07-14	$1,549,000 - $1,599,00	2023-09-29	Undisclosed	4	2	2		1082.0	Smile Elite	2a-alder-place-bowral-nsw-2576
83133	Lifestyle	2023-07-14	$1,150,000	2023-10-04	$1,130,000	3	2	7		41.83	Smile Elite	745-sandy-point-road-lower-boro-nsw-2580
83147	House	2023-07-14	Auction	2023-08-05	$705,000	3	1	2	1.5		LJ Hooker Tuggeranong	105-livingston-avenue-kambah-act-2902
83151	Townhouse	2023-07-14	$738,000	2023-08-05	$738,000	3	2	2	3.0		home.by holly	1-47-foxall-street-holder-act-2611
83160	Unit	2023-07-14	$590,000	2023-10-06	$590,000	2	1	1	6.0		Berkely Residential	26-21-eastlake-parade-kingston-act-2604
83165	House	2023-07-14	Price Guide $650,000 - $670,000	2023-07-14	$0	4	2	1		1701.0	One Agency Craig Schofield	48-hawkins-street-cooma-nsw-2630
83166	House	2023-07-14	Guide $580,000 - $600,000	2023-07-14	$0	3	2	1		777.0	One Agency Craig Schofield	6-doondoo-place-cooma-nsw-2630
83167	House	2023-07-14	Offers $620,000 - $650,000	2023-07-14	$0	4	1	3		1100.0	One Agency Craig Schofield	7-egan-street-cooma-nsw-2630
83168	House	2023-07-14	Price Guide $610,000 - $625,000	2023-07-14	$0	3	1	1		892.0	One Agency Craig Schofield	29-buchan-parade-cooma-nsw-2630
83169	House	2023-07-14	$440,000	2023-07-14	$0	3	1	0		765.0	One Agency Craig Schofield	12-ernest-phillips-avenue-cooma-nsw-2630
83170	AcreageSemi-rural	2023-07-14	$1,200,000 - $1,300,000	2023-07-14	$0	6	3	1		73.2	One Agency Craig Schofield	290-moons-road-bemboka-nsw-2550
83171	House	2023-07-14	Offers $920,000 +	2023-07-14	$0	4	2	2		1360.0	One Agency Craig Schofield	4a-morundah-street-cooma-nsw-2630
83172	Townhouse	2023-07-14	Guide $970,000 - $990,000	2023-07-14	$0	6	4	2		550.0	One Agency Craig Schofield	40a-40-wangie-street-cooma-nsw-2630
83180	DuplexSemi-detached	2023-07-14	SOLD	2023-08-23	$925,000	4	2	1		256.0	Smile Elite	9b-multan-street-riverstone-nsw-2765
83184	House	2023-07-15	$578,000	2023-09-28	$578,000	2	1	1		1011.0	Elders Real Estate Batemans Bay	16-murray-street-moruya-nsw-2537
83185	House	2023-07-15	$745,000	2023-09-18	$708,000	4	2	2		702.3	LJ Hooker Sussex Inlet	17-tradewinds-avenue-sussex-inlet-nsw-2540
83186	House	2023-07-15	$1,220,000+	2023-12-18	$1,150,000	4	3	4	6.0	450.0	Impact Properties	187-robin-boyd-crescent-taylor-act-2913
83187	House	2023-07-15	Price By Negotiation	2023-09-06	$1,200,000	4	2	2		2026.0	Raine & Horne Mollymook Milton	4-callemondah-close-narrawallee-nsw-2539
83192	House	2023-07-17	$495,000	2023-08-01	$495,000	4	2	2		664.0	John Mooney Real Estate	6-boronia-street-kooringal-nsw-2650
83197	House	2023-07-17	Auction Must Be Sold!	2023-08-18	$360,000	2	1	0		600.0	Ray White Goulburn	17-kelso-street-goulburn-nsw-2580
83199	House	2023-07-17	$970,000	2023-08-08	$925,000	3	2	2		556.0	Dwyer Properties Sapphire Coast	27-imlay-street-merimbula-nsw-2548
83203	House	2023-07-17	Auction Guide $350,000	2023-08-18	$355,000	1	1	2		771.4	Ray White Goulburn	137-mundy-street-goulburn-nsw-2580
83204	House	2023-07-17	Auction 12/08/2023	2023-08-08	$720,000	3	1	2	2.5		Ray White Canberra	22-ferrett-circuit-kambah-act-2902
83209	House	2023-07-17	$769,000	2023-08-10	Undisclosed	3	1	2	1.5	747.0	The Real Estate Shop	11-stewart-crescent-melba-act-2615
83211	Townhouse	2023-07-17	$775,000	2023-08-07	$775,000	3	2	2	6.0		home.by holly	3-24-bindaga-place-aranda-act-2614
83222	House	2023-07-17	$330,000	2023-07-17	Undisclosed	3	1	1		626.0	Raine & Horne Young	10-crowther-street-young-nsw-2594
83223	Lifestyle	2023-07-17	Guide $249,000	2023-09-06	$225,000	0	0	0		50.0	Ray White Goulburn	976-mares-forest-road-taralga-nsw-2580
83236	Townhouse	2023-07-18	$679,000	2023-09-05	$655,000	3	2	2		0.0	Ward Estate Agents	4-36-cameron-road-queanbeyan-nsw-2620
83238	House	2023-07-18	Offers Above $799,000+	2023-07-15	$830,000	4	2	2	6.0	184.0	Town Residential	49-francis-forde-boulevard-forde-act-2914
83239	House	2023-07-18	$990,000 - $1,050,000	2023-09-08	$991,000	4	2	2		787.0	Ward Estate Agents	128-bicentennial-drive-jerrabomberra-nsw-2619
83245	House	2023-07-18	$785,000	2023-08-30	Undisclosed	5	2	2		720.0	Professionals Nowra	35-burradoo-crescent-nowra-nsw-2541
83248	Unit	2023-07-18	$360,000	2023-09-29	$342,000	2	1	1		111.0	PRD Wagga Wagga	4-51-kincaid-street-wagga-wagga-nsw-2650
83249	Land	2023-07-18	$135,000	2023-10-04	$116,000	0	0	0		617.0	Flemings Property Services	137-albury-street-harden-nsw-2587
83256	DuplexSemi-detached	2023-07-18	$635,000 - $665,000	2023-09-15	$615,000	4	2	2		451.9	Smile Elite	1-2-13-foley-lane-muswellbrook-nsw-2333
83259	Townhouse	2023-07-18	$589,000+	2023-08-28	$595,700	2	2	1	6.0		MARQ Property	24-2-bulletin-street-lawson-act-2617
83261	House	2023-07-18	$765,000	2023-09-01	$740,000	4	1	2		556.0	My Agent Team	19-kingston-place-tomakin-nsw-2537
83264	DuplexSemi-detached	2023-07-18	$930,000	2023-10-30	$925,000	2	2	0	1.5		Maloney's Property	17-arinya-street-narrabundah-act-2604
83267	House	2023-07-18	$399,000	2023-08-22	$395,000	3	1	1		675.0	Kitson Property	47-regent-street-junee-nsw-2663
83268	House	2023-07-18	New Price $399,000	2023-09-08	$370,000	2	1	1		582.0	Henley Property - Cooma	12-buchan-parade-cooma-nsw-2630
83269	House	2023-07-18	$795,000 - $835,000	2023-07-12	$790,000	3	2	2		833.0	LJ Hooker Malua Bay	3-banks-place-sunshine-bay-nsw-2536
83270	Land	2023-07-18	$499,000 - $525,000	2023-10-26	$485,000	0	0	0		563.0	Ray White Canberra	26-hungerford-street-googong-nsw-2620
83280	Apartment	2023-07-18	$299,500	2023-09-23	Undisclosed	1	1	1			Ben Bate Real Estate	48-147-princes-highway-narooma-nsw-2546
83282	House	2023-07-19	$1,790,000 Suburb Record	2023-08-14	$1,790,000	5	3	2	4.0		Altair Property	14-bev-lawson-street-casey-act-2913
83284	Townhouse	2023-07-19	Auction	2023-08-05	$665,000	4	3	2	3.0		LJ Hooker Belconnen	1-40-henry-kendall-street-franklin-act-2913
83286	Townhouse	2023-07-19	$750,000	2023-10-24	Undisclosed	3	3	2	6.0		Luton Gungahlin	2-243-john-gorton-drive-wright-act-2611
83288	DuplexSemi-detached	2023-07-19	$799,000	2023-09-04	$785,000	2	2	1		212.0	Raine & Horne Mollymook Milton	2-53-gordon-street-milton-nsw-2538
83292	DuplexSemi-detached	2023-07-19	$595,000	2023-10-17	Undisclosed	3	1	1			Ben Bate Real Estate	1-3a-montague-street-narooma-nsw-2546
83294	House	2023-07-19	Offers above $900,000	2023-08-16	$880,000	4	2	2	1.5	924.0	McIntyre Property	10-laby-place-theodore-act-2905
83296	House	2023-07-19	Auction	2023-08-05	$1,132,000	4	2	2	4.0	736.0	LJ Hooker Dickson	25-auburn-street-amaroo-act-2914
83298	House	2023-07-19	Auction	2023-08-12	Undisclosed	4	2	2	5.0	525.0	Luton Gungahlin	38-louisa-briggs-circuit-bonner-act-2914
83299	Apartment	2023-07-19	Offers Over $350,000	2023-08-09	$385,000	2	1	1	5.5	0.0	Ward Estate Agents	8-113-115-knox-street-watson-act-2602
83301	Apartment	2023-07-19	$689,000+	2023-10-17	Undisclosed	2	2	2	6.0		LJ Hooker Canberra City	51-26-antill-street-dickson-act-2602
83302	House	2023-07-19	$740,000 - $780,000	2023-09-11	$755,000	4	2	2		694.4	Macarthur Real Estate Agency	7-morris-crescent-gobbagombalin-nsw-2650
83304	House	2023-07-19	$1,825,000	2023-08-12	$1,825,000	3	2	2	6.0		home.by holly	10a-hoddle-gardens-ainslie-act-2602
83305	House	2023-07-19	$1,950,000	2023-08-12	$1,950,000	2	2	2	6.0		home.by holly	10b-hoddle-gardens-ainslie-act-2602
83308	House	2023-07-19	$750,000	2023-11-13	$740,000	3	1	1		1067.0	Ray White Batemans Bay	19-dell-parade-moruya-heads-nsw-2537
83309	House	2023-07-19	$699,000	2023-08-17	$699,000	3	1	1		701.0	Sails Real Estate	4-idlewilde-crescent-pambula-nsw-2549
83312	Unit	2023-07-19	$395,000	2023-08-04	$395,000	2	1	1			Ray White Goulburn	4-114-clifford-street-goulburn-nsw-2580
83314	Land	2023-07-19	$220,000	2023-12-11	$210,000	0	0	0		1037.0	LJ Hooker Moruya	lot-4-4-8-gulph-street-nerrigundah-nsw-2545
83319	Unit	2023-07-19	Auction	2023-08-05	$362,500	2	1	1	2.0		LJ Hooker Belconnen	6-30-springvale-drive-hawker-act-2614
83328	House	2023-07-19	Contact Agent	2023-08-16	$1,150,000	4	2	2	1.0	875.0	The Real Estate Guy	9-doyle-terrace-chapman-act-2611
83330	Apartment	2023-07-19	$550,000	2023-09-22	$548,000	1	1	1	6.0		LJ Hooker Dickson	1017-240-bunda-street-city-act-2601
83335	Apartment	2023-07-19	Auction	2023-08-15	$585,000	2	2	2	6.0		LJ Hooker Belconnen	1-37-chandler-street-belconnen-act-2617
83336	House	2023-07-19	$495,000	2023-09-27	$450,000	3	1	1		811.0	Henley Property - Cooma	35-baroona-avenue-cooma-nsw-2630
83340	House	2023-07-19	Price on Application	2023-11-07	Undisclosed	5	3	14		5.0	Ray White Bowral	8-kimberley-drive-bowral-nsw-2576
83341	House	2023-07-19	$429,000	2023-08-17	$429,000	3	1	2		1011.0	Kitson Property	12-mimosa-street-coolamon-nsw-2701
83343	House	2023-07-19	Guide $2,750,000 - $2,950,000	2023-08-14	$2,750,000	5	3	2		2340.0	Ray White Bowral	42-toongoon-road-burradoo-nsw-2576
83344	House	2023-07-19	Price Guide $1,100,000	2023-08-31	Undisclosed	5	2	4		1.15	Raine & Horne Southern Highlands	20-lomatia-close-tallong-nsw-2579
83347	House	2023-07-19	Auction 12/08/2023	2023-08-12	$740,000	3	1	2	1.0	1013.0	Ray White Canberra	2-moor-place-evatt-act-2617
83348	Apartment	2023-07-19	Auction	2023-07-27	$559,000	2	2	1	6.0		Ray White Canberra	811-4-grazier-lane-belconnen-act-2617
83358	House	2023-07-19	$680,000 - $710,000	2023-10-27	$690,000	5	2	2		905.2	Macarthur Real Estate Agency	60-graham-street-lake-albert-nsw-2650
83359	House	2023-07-19	$980,000-$1,040,000	2023-08-18	$980,000	5	2	5		1549.0	Ray White Bungendore	2-forster-street-bungendore-nsw-2621
83361	House	2023-07-19	$1,249,000	2023-08-09	$1,200,000	4	2	0		753.0	My Agent Team	25-yugura-street-malua-bay-nsw-2536
83362	Apartment	2023-07-19	$1,040,000+	2023-08-16	$1,040,000	3	2	2	6.0		LJ Hooker Canberra City	121-81-constitution-avenue-campbell-act-2612
83363	House	2023-07-20	Auction	2023-08-12	Undisclosed	3	1	1	0.5	881.0	Luton Weston Creek & Molonglo Valley	3-salmond-street-chifley-act-2606
83366	House	2023-07-20	Auction	2023-08-12	$2,850,000	5	2	3	2.5		Luton Manuka	137-hawkesbury-crescent-farrer-act-2607
83367	House	2023-07-20	Auction	2023-08-14	$1,475,000	4	2	3	2.5	711.0	Luton Manuka	46-hawdon-street-ainslie-act-2602
83371	House	2023-07-20	$695,000+	2023-08-14	$720,000	3	1	2	3.5	398.0	McIntyre Property	40-james-smith-circuit-conder-act-2906
83372	House	2023-07-20	$715,000 +	2023-08-16	$715,000	3	1	1	6.0	293.0	Timothy Road	21-refshauge-crescent-macgregor-act-2615
83373	Townhouse	2023-07-20	$810,000+	2023-10-04	$805,000	3	2	2	4.5	407.0	LJ Hooker Gungahlin	5a-waghorn-street-gungahlin-act-2912
83374	House	2023-07-20	$815,000+	2023-08-29	Undisclosed	3	1	2	1.0		LJ Hooker Manuka	54-tepper-circuit-kambah-act-2902
83375	House	2023-07-20	$680,000+	2023-09-07	$690,000	4	1	2	1.0	856.0	McIntyre Property	26-bateman-street-kambah-act-2902
83377	House	2023-07-20	$790,000+	2023-09-08	$840,000	3	1	2	3.0		LJ Hooker Dickson	12-antares-crescent-giralang-act-2617
83378	House	2023-07-20	$899,000+	2023-08-21	Undisclosed	4	2	2	2.5		LJ Hooker Manuka	65-clift-crescent-richardson-act-2905
83379	House	2023-07-20	Auction 09/08/2023	2023-08-09	$770,000	4	2	2	3.5	848.0	Ray White Canberra	23-john-russell-circuit-conder-act-2906
83380	House	2023-07-20	$1,048,000 - $1,148,000	2023-08-03	$1,080,000	5	2	2		790.0	Smile Elite	7-curtin-grove-penrith-nsw-2750
83381	Land	2023-07-20	$640,000	2023-11-13	$640,000	0	0	0			home.by holly	8-malbec-drive-murrumbateman-nsw-2582
83386	House	2023-07-20	$599,000+	2023-09-08	$605,000	2	1	1	6.0		Ray White Canberra	22-15-howitt-street-kingston-act-2604
83388	Apartment	2023-07-20	$425000+	2023-09-13	$415,000	1	1	1	6.0		LJ Hooker Dickson	27-28-watson-street-turner-act-2612
83389	Townhouse	2023-07-20	Auction	2023-08-01	Undisclosed	2	1	1	4.5		Luton Tuggeranong	35-25-pinkerton-circuit-kambah-act-2902
83390	Townhouse	2023-07-20	$649,000+	2023-09-26	Undisclosed	3	2	2	5.5		Luton Gungahlin	33-54-paul-coe-crescent-ngunnawal-act-2913
83391	Apartment	2023-07-20	$520,000 to $535,000	2023-09-04	$516,000	2	2	2	6.0		Impact Properties	14-77-gozzard-street-gungahlin-act-2912
83393	House	2023-07-20	$590,000	2023-08-04	$590,000	2	1	1	6.0		home.by holly	101-burrumarra-avenue-ngunnawal-act-2913
83394	Apartment	2023-07-20	By Negotiation	2023-09-06	Undisclosed	1	1	1	6.0		Luton Gungahlin	23-4-thadoona-street-crace-act-2911
83397	Apartment	2023-07-20	$450,000	2023-12-20	Undisclosed	3	2	2	6.0		Impact Properties	46-2-eardley-street-bruce-act-2617
83402	House	2023-07-20	$699,000+	2023-08-29	$705,000	3	2	2	4.0	3537.4	Ray White Canberra	2-11-tea-gardens-gungahlin-act-2912
83404	House	2023-07-20	Under offer	2023-10-24	$630,000	3	2	1		570.0	MUM Real Estate	34-glanville-road-sussex-inlet-nsw-2540
83407	House	2023-07-20	$830,000 - $860,000	2023-08-17	$808,000	4	2	2		903.0	Smile Elite	7-grimes-street-windradyne-nsw-2795
83408	House	2023-07-20	$2,000,000	2023-08-12	$2,000,000	5	3	1	1.0		home.by holly	212-duffy-street-ainslie-act-2602
83409	House	2023-07-20	Auction 12/08/2023	2023-08-12	Undisclosed	4	2	4	4.5	712.0	Ray White Canberra	14-meerup-street-amaroo-act-2914
83410	House	2023-07-20	$740,000 - $780,000	2023-09-12	$745,000	4	2	1		568.0	My Agent Team	47-tasman-street-surf-beach-nsw-2536
83412	Townhouse	2023-07-20	Auction On site 19 Augst 10.00am	2023-08-19	Undisclosed	3	2	2	3.5		Maloney's Property	8-50-ellenborough-street-lyneham-act-2602
83413	House	2023-07-20	$690,000 - $730,000	2023-10-05	$710,000	2	2	1		822.0	Ray White Batemans Bay	11-waroo-crescent-malua-bay-nsw-2536
83415	House	2023-07-20	Auction 12/08/2023	2023-08-12	$1,625,000	3	2	2	5.5	459.0	Ray White Canberra	26a-edmondson-street-campbell-act-2612
83420	Townhouse	2023-07-20	Price Guide $569,000+	2023-08-17	$580,000	2	1	1	1.5		LJ Hooker Canberra City	9-26-schonell-circuit-oxley-act-2903
83423	House	2023-07-20	Auction	2023-08-02	$1,081,000	4	2	3	2.0	774.0	LJ Hooker Kaleen	39-tyrrell-circuit-kaleen-act-2617
83428	House	2023-07-20	Auction 12/08/2023	2023-08-12	$1,305,000	5	2	1	1.0	796.0	Ray White Canberra	23-dwyer-street-cook-act-2614
83430	House	2023-07-20	Price Guide $730,000 to $780,000	2023-10-17	Undisclosed	3	1	7		958.0	Harcourts Greater Port Macquarie & The Rocks	23-blackbutt-drive-wauchope-nsw-2446
83433	Apartment	2023-07-20	$520,000	2023-09-20	$520,000	2	2	2	6.0		Impact Properties	22-283-flemington-road-franklin-act-2913
83439	Townhouse	2023-07-20	Auction 19/08/23	2023-08-16	Undisclosed	3	2	2		0.0	Ward Estate Agents	7-15-ironbark-circuit-jerrabomberra-nsw-2619
83440	House	2023-07-20	Contact Agent	2023-08-08	Undisclosed	5	3	3		1137.0	Harcourts Greater Port Macquarie & The Rocks	478-fishermans-reach-road-fishermans-reach-nsw-2441
83445	House	2023-07-20	SOLD PRIOR AUCTION FOR A NEW ALTROVE RECORD	2023-08-14	$1,100,000	3	2	1		296.3	Smile Elite	47-aerodrome-drive-schofields-nsw-2762
83446	House	2023-07-20	SOLD PRIOR TO AUCTION $2,185,000	2023-08-05	$2,185,000	6	2	2		719.0	Smile Elite	19-brandon-grove-kellyville-nsw-2155
83451	House	2023-07-21	Auction	2023-08-12	Undisclosed	2	1	2	2.5	235.0	Luton Weston Creek & Molonglo Valley	4-english-court-swinger-hill-act-2606
83460	House	2023-07-21	$2,500,000 - $2,600,000	2023-10-05	$2,400,000	4	2	6		5374.0	Ray White Batemans Bay	25-clearwater-terrace-mossy-point-nsw-2537
83461	House	2023-07-21	$529,000	2023-08-09	$526,000	3	3	2		860.0	PRD Wagga Wagga	27-cooinbil-crescent-kooringal-nsw-2650
83466	House	2023-07-21	$759,000 - $779,000	2023-09-15	$699,000	4	1	2		556.4	Ray White Batemans Bay	22-catlin-avenue-batemans-bay-nsw-2536
83467	House	2023-07-21	$1,150,000 - $1,190,000	2023-08-18	$1,195,000	4	2	2		489.0	Smile Elite	25-hicks-terrace-shell-cove-nsw-2529
83472	House	2023-07-21	Auction 12/08/23	2023-08-12	$2,025,000	5	3	2	2.0	911.5	Ray White Canberra	14-nardoo-crescent-oconnor-act-2602
83478	AcreageSemi-rural	2023-07-21	$850,000-$890,000	2023-12-15	$850,000	5	2	3		2.5	Smile Elite	16-sawpit-gully-road-uralla-nsw-2358
83480	House	2023-07-21	$549,000	2023-09-29	$530,000	4	1	1		594.0	Raine & Horne Goulburn	24-broughton-street-goulburn-nsw-2580
83481	House	2023-07-21	$1,345,000- $1,395,000	2023-10-12	$1,310,000	4	2	3		8000.0	Ray White Bungendore	102-mcdonnell-drive-bungendore-nsw-2621
83485	House	2023-07-21	$1,040,000	2023-09-01	$1,040,000	4	2	2	5.0		home.by holly	1-maza-place-bonner-act-2914
83486	Townhouse	2023-07-21	UNDER OFFER BY AMIT KUMAR	2023-08-23	$891,000	4	2	1			Smile Elite	4-duff-glade-schofields-nsw-2762
83487	Townhouse	2023-07-21	For Sale $890,000 - $940,000	2023-08-11	$923,000	4	2	1		200.0	Smile Elite	23-agave-glade-schofields-nsw-2762
83489	Land	2023-07-21	$470,000	2023-07-21	$470,000	0	0	0			Sails Real Estate	167-pacific-way-tura-beach-nsw-2548
83490	Land	2023-07-21	$400,000	2023-10-09	$400,000	0	0	0		754.3	LJ Hooker Queanbeyan – Jerrabomberra – Googong	1-burra-street-queanbeyan-east-nsw-2620
83501	Land	2023-07-21	$509,900	2023-08-04	$509,900	0	0	0	0.0	443.0	Village	lot-908-alpine-ash-way-tralee-nsw-2620
83507	House	2023-07-21	$699,000	2023-08-29	Undisclosed	3	2	2		738.0	Ben Bate Real Estate	22-dorothy-drive-narooma-nsw-2546
83509	Land	2023-07-21	$1,000,000 - $1,030,000	2023-09-15	Undisclosed	0	0	4		4.1	Ray White Canberra	lot-4-newington-road-bywong-nsw-2621
83511	House	2023-07-21	AUCTION	2023-12-05	$540,000	3	1	4		696.0	Smile Elite	182-island-point-road-st-georges-basin-nsw-2540
83514	House	2023-07-21	Auction Guide $1,100,000	2023-09-01	$1,450,000	4	2	9		8.5	Ray White Goulburn	lot-2-cullen-street-crookwell-nsw-2583
83516	House	2023-07-22	$620,000	2023-08-09	$620,000	3	1	4		519.0	Raine & Horne Goulburn	28-victoria-street-goulburn-nsw-2580
83517	Other	2023-07-23	$1,550,000	2023-08-09	$1,500,000	8	5	3		868.0	Tathra Beach Real Estate	30-edna-drive-tathra-nsw-2550
83518	House	2023-07-23	$1,775,000	2023-10-04	Undisclosed	5	3	3		932.0	Henley Property - Jindabyne	38-rushes-bay-avenue-east-jindabyne-nsw-2627
83520	Townhouse	2023-07-24	Contact agent	2023-07-20	$789,000	2	2	1	6.0		home.by holly	29-frencham-street-downer-act-2602
83524	House	2023-07-24	$659,000	2023-09-27	Undisclosed	3	1	2		968.0	Ray White Goulburn	109-taralga-road-goulburn-nsw-2580
83527	Apartment	2023-07-24	$439,000+	2023-11-02	$437,500	1	1	1	6.0		LJ Hooker Woden/Weston	8-2-mcmichael-terrace-denman-prospect-act-2611
83532	Townhouse	2023-07-24	$550,000 - $570,000	2023-09-04	$550,000	2	1	2		0.0	Ward Estate Agents	7-157-159-uriarra-road-queanbeyan-nsw-2620
83534	House	2023-07-24	$649,000	2023-12-21	$620,000	5	1	3		951.0	LJ Hooker Moruya	17-haslingden-street-moruya-nsw-2537
83537	Apartment	2023-07-24	$515,000	2023-10-09	$490,000	2	2	1			Merimbula Realty	6-67-main-street-merimbula-nsw-2548
83538	Townhouse	2023-07-24	$1,150,000 - $1,200,000 Guide	2023-07-24	$1,050,000	3	2	3		892.0	Sails Real Estate	2-28-lakeview-avenue-merimbula-nsw-2548
83540	House	2023-07-24	SOLD Prior to Marketing	2023-07-21	$1,085,000	5	2	1	1.5	762.0	LJ Hooker Woden/Weston	5-tompson-street-garran-act-2605
83562	House	2023-07-24	$1,249,000	2023-08-17	$1,199,000	4	2	2		569.0	Smile Elite	5-the-mall-culburra-beach-nsw-2540
83572	House	2023-07-24	$905,000	2023-09-04	$900,000	3	1	1		835.0	Smile Elite	5-fairlands-street-culburra-beach-nsw-2540
83586	House	2023-07-25	$735,000	2023-10-27	Undisclosed	3	1	1		648.0	Raine & Horne Mollymook Milton	3-dickson-close-ulladulla-nsw-2539
83587	House	2023-07-25	$469,000	2023-08-14	Undisclosed	3	1	1		778.0	Raine & Horne Goulburn	56-taralga-rd-goulburn-nsw-2580
83588	House	2023-07-25	$499,000	2023-09-21	$470,000	3	1	1		310.0	Raine & Horne Goulburn	13-erith-street-goulburn-nsw-2580
83589	House	2023-07-25	$830,000 - $870,000	2023-08-04	$870,000	4	2	2		773.0	My Agent Team	1-caley-place-sunshine-bay-nsw-2536
83593	House	2023-07-25	SOLD PRIOR TO AUCTION	2023-08-10	Undisclosed	3	2	2	6.0	207.0	Altair Property	11-woodward-loop-taylor-act-2913
83599	House	2023-07-25	AUCTION	2023-08-21	$705,000	3	1	4	0.5	787.0	McIntyre Property	179-ellerston-avenue-isabella-plains-act-2905
83607	House	2023-07-25	$699,000	2023-09-20	Undisclosed	3	1	1	4.5		Luton Gungahlin	10-pajong-street-ngunnawal-act-2913
83609	Apartment	2023-07-25	$455,000+	2023-09-14	$470,000	2	1	1	6.0		Ray White Canberra	316-43-arthur-blakeley-way-coombs-act-2611
83616	House	2023-07-25	$880,000 - $925,000	2023-10-06	$901,000	4	3	4		752.0	Smile Elite	64-cammaray-drive-st-georges-basin-nsw-2540
83632	House	2023-07-25	Sold	2023-09-28	$660,000	3	1	1			The Property Collective	29-charles-street-queanbeyan-nsw-2620
83634	House	2023-07-25	$1,158,000	2023-10-12	$1,158,000	4	2	2	5.0	457.0	MARQ Property	37-lanaba-street-crace-act-2911
83639	House	2023-07-25	$719,000	2023-09-05	$705,000	4	2	2		2194.0	Kitson Property	6-hakea-drive-coolamon-nsw-2701
83649	House	2023-07-26	$585,000	2023-11-07	$545,000	4	2	2		695.0	One Agency Wagga Wagga	136-fernleigh-road-mount-austin-nsw-2650
83650	House	2023-07-26	$890,000 - $925,000	2023-09-01	$900,000	4	2	2		681.0	One Agency Wagga Wagga	15-dallas-avenue-gobbagombalin-nsw-2650
83652	Townhouse	2023-07-26	$678,000+	2023-08-16	$690,000	3	1	1	4.5		Hugo. Canberra	11-15-namadgi-circuit-palmerston-act-2913
83656	Land	2023-07-26	Contact Agent For Price Guide 	2023-08-29	$581,000	0	0	0			Whale Coast Realty	boatshed-riverside-drive-narooma-nsw-2546
83657	Unit	2023-07-26	Auction	2023-08-12	$417,000	1	1	1	6.0		LJ Hooker Belconnen	8-36-petterd-street-page-act-2614
83658	House	2023-07-26	Auction	2023-08-12	$855,000	4	2	2	1.0	1134.0	LJ Hooker Belconnen	27-daley-crescent-fraser-act-2615
83659	House	2023-07-26	$865,000	2023-08-13	Undisclosed	4	2	2	5.5	472.0	LJ Hooker Belconnen	54-marchant-circuit-dunlop-act-2615
83660	Townhouse	2023-07-26	$560,000+	2023-10-13	$560,000	3	1	1	2.5		McIntyre Property	15-13-sherwood-circuit-gordon-act-2906
83662	House	2023-07-26	$359,000	2023-08-21	Undisclosed	3	1	1		588.1	Ray White Wagga Wagga	114-ashmont-avenue-ashmont-nsw-2650
83671	House	2023-07-26	UNDER CONTRACT	2023-11-13	$550,000	2	1	4		809.0	Smile Elite	236-paterson-road-bolwarra-heights-nsw-2320
83673	House	2023-07-26	$800,000+ 	2023-09-11	$846,000	3	2	2	1.5	644.0	Ray White Canberra	41-nambucca-street-kaleen-act-2617
83677	House	2023-07-26	$530,000	2023-08-18	$515,000	3	1	1		658.0	Professionals Nowra	41-mcdonald-avenue-nowra-nsw-2541
83679	House	2023-07-26	Contact Agent	2023-08-16	$1,502,000	2	1	2		500.0	Smile Elite	129-lakes-boulevard-wooloweyah-nsw-2464
83683	House	2023-07-26	$845,000	2023-10-18	$820,000	3	2	2		441.0	PRD Wagga Wagga	10-paroo-place-tatton-nsw-2650
83687	House	2023-07-26	Sold for $865,000	2023-08-08	$865,000	3	2	2	6.0	376.0	MARQ Property	65-john-crawford-crescent-casey-act-2913
83688	House	2023-07-26	$698,000+	2023-08-29	$732,000	3	1	1	6.0	293.0	MARQ Property	81-yumba-avenue-ngunnawal-act-2913
83689	House	2023-07-26	$549,000	2023-09-25	$500,000	4	3	2		796.7	Macarthur Real Estate Agency	20-willow-street-kooringal-nsw-2650
83690	House	2023-07-26	Contact Agent	2023-07-21	$1,350,000	4	2	2		981.0	Ray White Bowral	9-price-street-bowral-nsw-2576
83692	House	2023-07-26	$730,000	2023-09-21	$715,000	3	1	0	0.0	712.0	Luton Dickson	3-palana-place-giralang-act-2617
83693	House	2023-07-26	Auction	2023-08-21	$715,000	3	1	2	1.5	869.0	Luton Dickson	3-harland-place-flynn-act-2615
83694	House	2023-07-26	Auction	2023-08-19	$935,000	4	2	4	2.0	916.0	Luton Tuggeranong	37-alston-street-chisholm-act-2905
83698	Apartment	2023-07-26	$650,000+	2023-09-06	$660,000	2	2	1	6.0		LJ Hooker Dickson	205-55-dooring-street-dickson-act-2602
83699	House	2023-07-26	$2,650,000	2023-10-16	$2,500,000	4	2	2	5.0	780.0	Ray White Canberra	143-miller-street-oconnor-act-2602
83706	Unit	2023-07-26	Auction	2023-08-17	Undisclosed	2	1	1	4.0		Luton Gungahlin	36-toorale-terrace-lawson-act-2617
83710	House	2023-07-26	Auction 26/08/2023	2023-08-24	$920,000	4	2	1	0.5	805.0	Ray White Canberra	58-harbison-crescent-wanniassa-act-2903
83711	House	2023-07-26	$995,000	2023-10-17	Undisclosed	4	2	2		661.0	Jo Jones Property Specialists	4-laurel-avenue-ulladulla-nsw-2539
83714	House	2023-07-26	$890,000	2023-08-30	$880,000	5	3	4		661.0	McGrath Batemans Bay & Moruya	42-cook-avenue-surf-beach-nsw-2536
83715	House	2023-07-26	$619,000	2023-08-09	$619,000	4	2	2		736.2	Kitson Property	11-bindari-avenue-glenfield-park-nsw-2650
83720	House	2023-07-26	$987,500	2023-12-04	Undisclosed	4	2	2		1101.0	Macarthur Real Estate Agency	5-eureka-street-estella-nsw-2650
83723	Apartment	2023-07-26	$299,500	2023-09-23	Undisclosed	1	1	1			Ben Bate Real Estate	16-147-princes-highway-narooma-nsw-2546
83725	House	2023-07-27	Auction	2023-08-19	Undisclosed	3	1	1	4.0		Luton Weston Creek & Molonglo Valley	4a-gunn-street-yarralumla-act-2600
83727	Apartment	2023-07-27	$505,000	2023-09-12	$505,000	2	1	1	3.5		Luton Weston Creek & Molonglo Valley	2-38-bootle-place-phillip-act-2606
83728	House	2023-07-27	Auction	2023-08-19	Undisclosed	3	1	1	4.5	735.0	Luton Weston Creek & Molonglo Valley	9-tantangara-street-duffy-act-2611
83729	House	2023-07-27	Auction	2023-08-19	Undisclosed	4	2	2	0.5	1499.0	Luton Weston Creek & Molonglo Valley	24-chauvel-circle-chapman-act-2611
83730	Apartment	2023-07-27	Offers over $789,000	2023-11-13	Undisclosed	2	2	2	6.0		Crowthers	408-27-lonsdale-street-braddon-act-2612
83733	House	2023-07-27	Auction, Sat 19th Aug at 11:30 am	2023-08-19	$992,000	4	2	2	4.0	490.0	LJ Hooker Gungahlin	2-adlard-place-gungahlin-act-2912
83734	House	2023-07-27	Auction 19/08/23	2023-08-19	Undisclosed	3	2	2	4.0	450.0	Ray White Canberra	12-akubra-place-dunlop-act-2615
83736	Townhouse	2023-07-27	$689,000+	2023-10-06	Undisclosed	3	3	2	6.0		McIntyre Property	36-58-max-jacobs-avenue-wright-act-2611
83737	Unit	2023-07-27	$400,000+	2023-09-06	$424,500	2	1	1	6.0	1465.0	Wright Dunn Real Estate	7-39-gardiner-street-downer-act-2602
83738	House	2023-07-27	$1,450,000	2023-08-31	$1,450,000	3	2	2	0.0	658.0	home.by holly	9-banjine-street-oconnor-act-2602
83748	House	2023-07-27	$600,000+	2023-08-17	$622,000	3	2	2	4.5	439.0	Ray White Canberra	1-19-hedger-street-dunlop-act-2615
83751	House	2023-07-27	Auction	2023-08-26	$854,000	3	2	2	5.5	432.0	LJ Hooker Dickson	28-olary-street-amaroo-act-2914
83753	House	2023-07-27	$825,000-$875,000	2023-08-04	$850,000	3	2	2	0.0	671.0	My Agent Team	4-dr-king-close-moruya-nsw-2537
83756	House	2023-07-27	$550,000	2023-09-28	Undisclosed	3	1	1		1081.0	PRD Wagga Wagga	18-higgins-avenue-wagga-wagga-nsw-2650
83760	House	2023-07-27	Auction 19/08/2023	2023-08-19	$785,000	3	1	1	6.0		Ray White Canberra	4-elizabeth-jolley-crescent-franklin-act-2913
83763	Apartment	2023-07-27	By Negotiation	2023-10-10	Undisclosed	2	2	2	6.0		Berkely Residential	705-21-marcus-clarke-street-city-act-2601
83765	House	2023-07-27	$379,000	2023-09-04	Undisclosed	2	1	1		343.0	Ray White Wagga Wagga	4-418-lake-albert-road-kooringal-nsw-2650
83766	House	2023-07-27	$930,000+	2023-11-04	Undisclosed	4	2	6	0.5	728.0	LJ Hooker Kaleen	6-darby-street-kaleen-act-2617
83768	Apartment	2023-07-27	$575,000+	2023-09-07	Undisclosed	2	2	1	6.0		LJ Hooker Woden/Weston	28-2-veryard-lane-belconnen-act-2617
83769	House	2023-07-27	$780,000	2023-11-07	$760,000	4	2	2		858.0	Henley Property - Berridale	1-morrice-street-berridale-nsw-2628
83770	House	2023-07-27	$930,000+	2023-09-28	$925,000	3	1	2	3.5	336.0	LJ Hooker Kaleen	7-guthrie-street-dickson-act-2602
83771	Apartment	2023-07-27	$449,000 +	2023-10-16	Undisclosed	1	1	1	6.0		LJ Hooker Woden/Weston	316-7-irving-street-phillip-act-2606
83772	House	2023-07-27	Auction	2023-08-18	$1,050,000	4	2	2	5.0	481.0	Luton Gungahlin	29-scholtens-street-casey-act-2913
83773	House	2023-07-27	Auction Tuesday 5th September at 4pm	2023-09-05	Undisclosed	3	1	3		664.0	McCann Properties	311-dalton-road-gunning-nsw-2581
83775	House	2023-07-27	$749,000+	2023-10-05	Undisclosed	3	1	2	3.0	426.0	LJ Hooker Woden/Weston	26-wedgwood-close-chisholm-act-2905
83777	Townhouse	2023-07-27	$749,000+	2023-09-15	Undisclosed	4	2	1	2.0	285.0	Ray White Canberra	44-gillespie-street-weetangera-act-2614
83778	House	2023-07-27	Contact Agent	2023-08-14	$2,060,000	4	3	2		700.0	Smile Elite	13-hamish-court-beaumont-hills-nsw-2155
83782	Townhouse	2023-07-27	$580,000+	2023-10-06	$590,000	2	2	2	5.5		Impact Properties	25-89-gungahlin-place-gungahlin-act-2912
83786	Retirement	2023-07-27	$349,000	2023-10-10	Undisclosed	2	1	1			LJ Hooker Sussex Inlet	96-157-the-springs-road-sussex-inlet-nsw-2540
83791	House	2023-07-27	$959,000	2023-09-20	Undisclosed	4	2	4		3035.0	McCann Properties	2-wombat-street-gunning-nsw-2581
83792	House	2023-07-27	$649,000	2024-01-11	$620,000	3	3	2		816.00	LJ Hooker Batemans Bay	29-country-club-drive-catalina-nsw-2536
83793	Land	2023-07-27	$650,000	2023-10-16	Undisclosed	0	0	0		5.0	Ray White Goulburn	52-greendale-crescent-run-o-waters-nsw-2580
83797	House	2023-07-27	Guide $590,000	2023-11-13	$555,000	3	1	2		727.0	Ray White Goulburn	155-kinghorne-street-goulburn-nsw-2580
83799	House	2023-07-27	Price by Negotiation	2023-12-08	Undisclosed	4	2	2		687.0	Raine & Horne Mollymook Milton	10-amaroo-drive-narrawallee-nsw-2539
83800	House	2023-07-27	$520,000	2023-09-14	$510,000	3	2	3		689.2	Smile Elite	24-cousins-street-muswellbrook-nsw-2333
83804	AcreageSemi-rural	2023-07-27	$1,500,000 - $1,600,000	2023-11-03	Undisclosed	4	4	6		10.01	Smile Elite	1471-mid-western-highway-evans-plains-nsw-2795
83810	Apartment	2023-07-27	$395,000+	2023-09-27	$415,000	1	1	1	6.0	3377.0	LJ Hooker Gungahlin	901-15-bowes-street-phillip-act-2606
83814	House	2023-07-27	$820,000+	2023-08-15	Undisclosed	4	2	2	1.5	747.0	LJ Hooker Kippax	31-lachlan-street-macquarie-act-2614
83819	House	2023-07-27	Price Guide $880,000	2023-08-31	$982,000	3	1	1		550.0	Smile Elite	24-gladstone-parade-riverstone-nsw-2765
83821	House	2023-07-28	$859,000 - 899,000	2023-09-19	$890,000	4	2	2		836.0	One Agency Wagga Wagga	25-turramia-crescent-gobbagombalin-nsw-2650
83822	Apartment	2023-07-28	$355,000	2023-09-21	Undisclosed	2	1	1	3.0		Luton Weston Creek & Molonglo Valley	2-26-springvale-drive-hawker-act-2614
83827	House	2023-07-28	$849,000+	2023-09-14	Undisclosed	3	2	2	4.5	383.0	LJ Hooker Woden/Weston	26a-wedgwood-close-chisholm-act-2905
83828	House	2023-07-28	$699,000	2023-10-26	Undisclosed	2	1	2			Ben Bate Real Estate	32-casey-crescent-mystery-bay-nsw-2546
83829	House	2023-07-28	CONTACT AGENT	2023-10-03	$752,000	4	2	4		946.0	Harcourts Greater Port Macquarie & The Rocks	25-springfields-drive-greenhill-nsw-2440
83830	Townhouse	2023-07-28	$699,000 +	2023-09-13	$710,000	3	2	2	6.0		Luton Gungahlin	34-363-mirrabei-drive-moncrieff-act-2914
83831	House	2023-07-28	Sold	2023-09-25	$610,000	2	1	1	0.0		The Property Collective	6-47-walker-crescent-jerrabomberra-nsw-2619
83836	Apartment	2023-07-28	$875,000	2023-09-29	$875,000	3	3	2	4.5		home.by holly	6-1-mouat-street-lyneham-act-2602
83837	House	2023-07-28	$925,000	2023-08-17	$931,000	3	2	2	2.5	940.0	The Real Estate Shop	10-carr-crescent-wanniassa-act-2903
83846	House	2023-07-28	$1,195,000	2023-08-24	$1,150,000	4	2	2		855.0	LJ Hooker Batemans Bay	23-blairs-road-long-beach-nsw-2536
83848	House	2023-07-28	$260,000	2023-08-11	Undisclosed	3	1	1		462.0	Flemings Property Services	6-lee-street-cowra-nsw-2794
83849	House	2023-07-28	$1,100,000 - $1,200,000	2023-10-06	Undisclosed	3	1	2		658.3	LJ Hooker Sussex Inlet	10-ibis-place-sussex-inlet-nsw-2540
83853	House	2023-07-28	$616,100	2023-08-18	$616,100	2	1	1	6.0		home.by holly	63-whitmore-crescent-watson-act-2602
83863	House	2023-07-28	$745,000	2023-09-19	Undisclosed	3	1	1		844.0	Raine & Horne Mollymook Milton	4-church-street-ulladulla-nsw-2539
83866	House	2023-07-28	AUCTION GUIDE $950,000	2023-09-01	$960,000	4	2	6		14.1	Ray White Goulburn	7-brennan-street-collector-nsw-2581
83868	House	2023-07-28	$470,000 - $490,000	2023-08-23	$520,000	3	1	1		677.0	Smile Elite	332-rocket-street-west-bathurst-nsw-2795
83874	House	2023-07-29	$940,000 - $990,000	2023-09-12	Undisclosed	5	3	4		743.08	LJ Hooker Sussex Inlet	9-avocet-street-sussex-inlet-nsw-2540
83876	Land	2023-07-29	$350,000	2023-08-15	Undisclosed	0	0	0		1119.0	Ben Bate Real Estate	61-warbler-crescent-north-narooma-nsw-2546
83882	DuplexSemi-detached	2023-07-30	Guide $890,000 to $910,000	2023-09-19	$900,000	3	3	2			Henley Property - Jindabyne	2-1-penders-court-jindabyne-nsw-2627
83883	House	2023-07-31	Offers over $839,000	2023-08-15	$870,000	3	2	2	2.0	836.0	Crowthers	30-rischbieth-crescent-gilmore-act-2905
83890	House	2023-07-31	$640,000	2023-09-01	$640,000	2	1	1		607.0	Clearwater Real Estate Narooma	50-mcmillan-rd-narooma-nsw-2546
83895	Apartment	2023-07-31	Offers above $405,000	2023-09-07	$415,000	1	1	1	6.0		McIntyre Property	72-140-anketell-street-greenway-act-2900
83896	Apartment	2023-07-31	Auction	2023-08-29	$721,000	3	2	1	4.5		LJ Hooker Canberra City	18-19-aspinall-street-watson-act-2602
83897	Unit	2023-07-31	$685,000	2023-09-12	$685,000	2	1	1		999.75	Coast Property Group	4-6-monaro-street-merimbula-nsw-2548
83899	Apartment	2023-07-31	$650,000	2023-08-17	$625,000	3	2	2			My Agent Team	1-14-corrigan-crescent-batehaven-nsw-2536
83900	Townhouse	2023-07-31	$705,000	2023-10-27	$705,000	3	2	1			Belle Property Batemans Bay	4-1a-1b-myamba-parade-surfside-nsw-2536
83905	House	2023-07-31	$899,000	2023-11-09	$899,000	4	2	2			Dwyer Properties Sapphire Coast	31b-mulloway-circuit-merimbula-nsw-2548
83913	House	2023-07-31	$599,000	2023-10-13	$575,000	3	2	2		860.0	Henley Property - Cooma	21-nimby-place-cooma-nsw-2630
83917	Townhouse	2023-07-31	$205,000 - $215,000	2023-09-25	$215,000	2	1	1			Smile Elite	4-28-skellatar-street-muswellbrook-nsw-2333
83919	House	2023-07-31	$621,500	2023-10-20	$621,500	3	2	2		556.0	Belle Property Batemans Bay	29-beauty-crescent-surfside-nsw-2536
83921	House	2023-07-31	Contact the Agent	2023-09-06	Undisclosed	4	3	2		759.0	Smile Elite	25-atlas-street-east-lismore-nsw-2480
83932	House	2023-07-31	$525,000	2023-11-13	$500,000	4	1	2		6074.0	Macarthur Real Estate Agency	2-6-alfred-street-oura-nsw-2650
83938	House	2023-07-31	Price on Application	2023-07-26	$1,350,000	4	2	4		2200.0	Ray White Goulburn	55-river-street-goulburn-nsw-2580
83943	Townhouse	2023-08-01	Auction Saturday 26 August 2023, 10am On Site	2023-08-26	Undisclosed	3	2	2	3.0		Morrissey Property	1-6-edith-place-amaroo-act-2914
83946	Unit	2023-08-01	$495,000	2023-09-08	Undisclosed	3	1	1	0.5	398.0	McIntyre Property	3-6-beazley-crescent-calwell-act-2905
83947	Apartment	2023-08-01	$720,000+	2023-10-12	$740,000	2	2	2	6.0		VERV Property	101-59-constitution-avenue-campbell-act-2612
83953	House	2023-08-01	Auction	2023-08-18	Undisclosed	5	2	8		3.75	Ray White Rural Canberra | Yass	3-bradley-close-murrumbateman-nsw-2582
83957	House	2023-08-01	$2,500,000	2023-08-28	Undisclosed	4	3	4		3200.0	Whale Coast Realty	66-old-highway-narooma-nsw-2546
83960	House	2023-08-01	$460,000	2023-09-19	$455,000	4	2	2		921.0	Kitson Property	4-rockliff-court-lockhart-nsw-2656
83961	DuplexSemi-detached	2023-08-01	$800,000 - $850,000 Price Guide	2023-09-18	$825,000	3	3	2			Sails Real Estate	2-32-jinjera-parade-pambula-beach-nsw-2549
83965	Apartment	2023-08-01	$360,000+	2023-09-01	$370,000	1	1	1	6.0		Ray White Canberra	70-13-chandler-street-belconnen-act-2617
83966	House	2023-08-01	Price By Negotiation	2023-10-11	Undisclosed	4	2	2		556.0	Raine & Horne Mollymook Milton	20-ross-avenue-narrawallee-nsw-2539
83970	Lifestyle	2023-08-01	$500,000	2023-07-26	$500,000	0	0	0		10.85	Ray White Goulburn	417-sunninghill-road-windellama-nsw-2580
83972	House	2023-08-01	$735,000	2023-11-10	$735,000	3	2	2		792.0	Belle Property Batemans Bay	10-hume-road-surf-beach-nsw-2536
83974	Unit	2023-08-01	$569,000	2023-08-01	$565,000	2	1	1	0.0		My Agent Team	2-230-beach-road-batehaven-nsw-2536
83975	House	2023-08-01	Price By Negotiation	2023-08-21	$917,000	4	2	2		760.8	Bella Coastal Property	40-did-dell-street-ulladulla-nsw-2539
83976	House	2023-08-01	$778,000+	2023-08-16	Undisclosed	3	1	1	5.0	405.0	MARQ Property	25-windradyne-street-ngunnawal-act-2913
83979	Apartment	2023-08-01	Offers Over $250,000	2023-10-27	Undisclosed	1	1	1			Sadil Quinlan	8b-109-knox-street-watson-act-2602
83994	House	2023-08-01	Guide $800,000 - $850,000	2023-09-08	$790,000	3	1	2		1000.0	Ray White Bowral	6-semkin-street-moss-vale-nsw-2577
83997	BlockOfUnits	2023-08-01	$699,900	2023-08-31	$689,900	7	3	3			Kitson Property	1-3-1-moran-street-tolland-nsw-2650
84011	Unit	2023-08-01	$449,000	2023-10-23	Undisclosed	3	1	1			Ben Bate Real Estate	4-2a-harrington-street-narooma-nsw-2546
84015	House	2023-08-02	$630,000 - $660,000	2023-09-15	$617,500	3	2	2		600.0	Macarthur Real Estate Agency	1-12-trumper-street-boorooma-nsw-2650
84016	Townhouse	2023-08-02	Auction	2023-08-09	Undisclosed	2	1	1	1.0		Luton Tuggeranong	1a-tristania-street-rivett-act-2611
84017	Apartment	2023-08-02	$545,000+	2023-08-23	Undisclosed	2	2	2	6.0		Stone Gungahlin	1405-6-gribble-street-gungahlin-act-2912
84019	House	2023-08-02	$1,550,000 - $1,650,000	2023-10-13	$1,590,000	4	2	5		1015.0	Smile Elite	7-whittaker-street-flinders-nsw-2529
84020	Unit	2023-08-02	$375,000	2023-08-30	Undisclosed	2	1	1		90.0	Ray White Wagga Wagga	2-36-murray-street-wagga-wagga-nsw-2650
84024	House	2023-08-02	$920,000 to $960,000	2023-10-31	Undisclosed	3	2	4		939.0	Impact Properties	1-winter-place-jerrabomberra-nsw-2619
84025	House	2023-08-02	$1,665,000- $1,775,000	2023-12-07	$1,610,000	5	3	2		10610.0	Ray White Bungendore	11-reardon-place-bungendore-nsw-2621
84027	Apartment	2023-08-02	Auction 31/08/23	2023-08-31	$395,500	1	1	1	6.0		Ray White Canberra	81-39-benjamin-way-belconnen-act-2617
84028	House	2023-08-02	Auction	2023-08-17	Undisclosed	3	2	2	4.5	415.0	LJ Hooker Belconnen	12-angora-street-harrison-act-2914
84032	House	2023-08-02	Contact Agent	2023-09-14	Undisclosed	4	4	2		914.4	Ray White Bowral	11-plane-tree-close-bowral-nsw-2576
84033	Apartment	2023-08-02	$430,000	2023-09-25	$415,000	1	1	1	6.0		LJ Hooker Belconnen	201-9-watkin-street-bruce-act-2617
84046	Townhouse	2023-08-02	$590,000+	2023-08-28	$611,000	3	1	1	3.0	345.0	McIntyre Property	13-34-christmas-street-theodore-act-2905
84050	House	2023-08-02	$680,000+	2023-08-10	$690,000	3	1	1	4.5	354.0	Ray White Canberra	19-gamban-square-ngunnawal-act-2913
84051	House	2023-08-02	$1,799,000	2023-09-11	$1,710,000	3	2	2		734.0	Smile Elite	3-the-mall-culburra-beach-nsw-2540
84053	House	2023-08-02	Auction 19/08/2023	2023-09-01	Undisclosed	5	2	2	2.5	798.0	Ray White Canberra	73-ohalloran-circuit-kambah-act-2902
84054	Unit	2023-08-02	$250,000+	2023-10-02	$253,000	1	1	1	3.0	4365.0	Wright Dunn Real Estate	1c-6-irvine-street-watson-act-2602
84057	House	2023-08-02	Auction	2023-08-26	Undisclosed	4	3	2	5.0	513.0	Luton Gungahlin	15-ted-richards-street-casey-act-2913
84058	House	2023-08-02	Auction	2023-08-18	$1,600,000	5	3	5	0.0	6094.0	Luton Gungahlin	16-governor-drive-murrumbateman-nsw-2582
84060	Apartment	2023-08-02	$410,000+	2023-12-05	$416,000	1	1	1	6.0		LJ Hooker Canberra City	511-16-moore-street-city-act-2601
84066	House	2023-08-02	$879,000	2023-11-15	Undisclosed	4	2	2		879.6	PRD Wagga Wagga	5-kentucky-crescent-gobbagombalin-nsw-2650
84068	Unit	2023-08-02	$560,000	2023-09-01	$560,000	2	1	2		1066.0	Coast Property Group	2-14-hakea-place-tura-beach-nsw-2548
84070	House	2023-08-02	Contact Agent	2023-10-19	$552,500	3	1	3		664.0	Smile Elite	167-mckay-street-nowra-nsw-2541
84071	Apartment	2023-08-02	$385,000+	2023-09-22	$380,000	1	1	1	6.0		Impact Properties	16-1-anthony-rolfe-avenue-gungahlin-act-2912
84073	Apartment	2023-08-02	Offers Over $520,000	2023-10-25	$535,000	1	1	1	6.0		Crowthers	910-25-edinburgh-avenue-city-act-2601
84076	House	2023-08-03	$1,895,000	2023-09-11	Undisclosed	4	2	2	4.0		Luton Manuka	10-smyth-place-hughes-act-2605
84079	House	2023-08-03	$850,000+	2023-12-07	$865,000	4	2	2	5.0	397.0	Ray White Canberra	43-overall-avenue-casey-act-2913
84080	House	2023-08-03	Auction 24/08/23	2023-08-24	$770,000	3	1	2	4.5	518.0	Ray White Canberra	23-coverdale-street-holt-act-2615
84084	House	2023-08-03	$649,000	2024-01-10	$615,000	3	1	1		696.0	Whale Coast Realty	3-goolara-avenue-dalmeny-nsw-2546
84086	House	2023-08-03	$640,000+	2023-10-08	$640,000	3	1	1	1.5	289.0	LJ Hooker Gungahlin	24-bungaree-crescent-ngunnawal-act-2913
84088	House	2023-08-03	contact agent	2023-08-26	Undisclosed	4	2	1	0.0	731.0	home.by holly	83-price-place-downer-act-2602
84089	House	2023-08-03	Auction 26/08/2023	2023-08-26	$1,502,000	3	1	2	2.5	715.8	LJ Hooker Dickson	25-archer-street-dickson-act-2602
84091	DuplexSemi-detached	2023-08-03	Auction 30/08/2023	2023-08-30	$1,175,000	3	1	2	6.0	619.0	LJ Hooker Dickson	4-dooring-street-braddon-act-2612
84095	House	2023-08-03	$785,000	2023-09-22	$775,000	3	2	1	4.0	362.0	Luton Tuggeranong	34-corringle-close-amaroo-act-2914
84099	House	2023-08-03	$1,250,000+	2023-08-29	$1,250,000	4	2	2	3.0	806.0	LJ Hooker Tuggeranong	49-olive-pink-crescent-banks-act-2906
84100	House	2023-08-03	Auction 24/08/2023	2023-08-12	$751,000	3	1	1	2.0	439.0	Ray White Canberra	39-morrison-street-kambah-act-2902
84102	Apartment	2023-08-03	$1,185,000+	2023-09-08	Undisclosed	2	2	2	6.0		VERV Property	53-7-state-circle-forrest-act-2603
84105	House	2023-08-03	Auction 24/08/23	2023-08-24	$970,000	4	2	2	3.5	707.0	Ray White Canberra	7-haverfield-place-mckellar-act-2617
84106	Townhouse	2023-08-03	Auction 26/08/2023	2023-08-26	$1,141,000	3	2	2	6.0		Ray White Canberra	1-15-tompson-street-garran-act-2605
84107	House	2023-08-03	Auction 26/08/23	2023-08-17	Undisclosed	4	3	2	1.5	1004.0	Ray White Canberra	38-southwell-street-weetangera-act-2614
84109	House	2023-08-03	Auction 26/08/2023	2023-08-15	$877,000	2	1	1	2.0		Ray White Canberra	46-mackennal-street-lyneham-act-2602
84110	House	2023-08-03	$880,000	2023-09-11	$850,000	3	2	4			Raine & Horne Mollymook Milton	20-parkland-drive-kings-point-nsw-2539
84112	Apartment	2023-08-03	$569,000+	2023-08-30	$578,000	2	2	2	6.0		VERV Property	20-566-cotter-road-wright-act-2611
84113	Apartment	2023-08-03	Contact Agent	2023-08-28	Undisclosed	2	1	1	6.0		Luton Weston Creek & Molonglo Valley	20-9-wedge-crescent-turner-act-2612
84115	House	2023-08-03	Auction	2023-08-30	$915,000	3	1	2	0.5	741.0	LJ Hooker Kaleen	19-terewah-circuit-kaleen-act-2617
84117	Apartment	2023-08-03	$575,000+	2023-09-04	Undisclosed	2	2	1	6.0	1733.8	Ray White Canberra	23-5-gould-street-turner-act-2612
84123	Land	2023-08-03	$170,000	2023-10-04	$167,000	0	0	0		2633.0	Kitson Property	16-urana-street-collingullie-nsw-2650
84124	House	2023-08-03	$952,900	2023-09-09	$952,900	5	2	2	0.0	442.0	Village	61-oxalis-crescent-tralee-nsw-2620
84125	House	2023-08-03	By negotiation	2023-09-18	$780,000	3	2	1	3.5	446.92	Timothy Road	96-macfarlane-burnet-avenue-macgregor-act-2615
84128	House	2023-08-03	Auction 26/08/2023	2023-08-26	$1,650,000	2	1	2	0.5	1017.0	Ray White Canberra	43-foveaux-street-ainslie-act-2602
84129	House	2023-08-03	Price Guide $1m to $1,1m	2023-08-03	$1,050,000	4	2	2		5098.0	Raine & Horne Southern Highlands	5-nugents-creek-road-kangaroo-valley-nsw-2577
84132	Apartment	2023-08-03	$650,000	2023-09-29	$650,000	2	2	2	6.0		home.by holly	3-19-de-burgh-street-lyneham-act-2602
84133	Apartment	2023-08-03	$780,000	2023-08-29	$780,000	3	2	2	6.0		home.by holly	8-16-bradfield-street-downer-act-2602
84134	Townhouse	2023-08-03	Auction	2023-08-26	Undisclosed	3	2	2	4.5		LJ Hooker Dickson	13-21-aspinall-street-watson-act-2602
84135	Apartment	2023-08-03	Offers Above $599,000	2023-11-13	$622,000	3	2	2	6.0		Cream Residential	170-15-mower-place-phillip-act-2606
84136	House	2023-08-03	Auction 26/08/2023	2023-08-26	Undisclosed	4	2	1	3.5	824.0	Ray White Canberra	66-mackellar-crescent-cook-act-2614
84137	Apartment	2023-08-03	By Negotiation	2023-09-04	$572,500	2	2	1	6.0		MARQ Property	56-20-beissel-street-belconnen-act-2617
84139	House	2023-08-03	$780,000 - $858,000	2023-08-22	$820,000	3	2	2		707.0	Smile Elite	30-greygums-road-cranebrook-nsw-2749
84143	House	2023-08-03	$930,000+	2023-09-22	$955,000	4	2	2	2.0	765.0	LJ Hooker Tuggeranong	14-cracknell-street-monash-act-2904
84144	House	2023-08-03	$880,000-$920,000	2023-08-18	Undisclosed	4	3	2			My Agent Team	22-yarrabee-drive-catalina-nsw-2536
84152	Unit	2023-08-03	$435,000	2023-10-10	$435,000	2	1	1	0.5	82.0	Ray White Canberra	2-4-thurlow-place-belconnen-act-2617
84153	House	2023-08-03	$745,000	2023-08-28	$745,000	3	1	1	4.5		home.by holly	32-tregellas-crescent-banks-act-2906
84155	Apartment	2023-08-03	Offers Above $339,000	2023-09-19	$340,000	1	1	0	3.0		Cream Residential	62-27-coxen-street-hughes-act-2605
84157	House	2023-08-03	Auction	2023-08-16	$1,456,000	4	2	2	3.5	872.0	LJ Hooker Kippax	28-selwyn-street-hackett-act-2602
84158	House	2023-08-03	$779,000+	2023-09-25	$750,000	4	1	4	3.5	777.0	Ray White Canberra	31-deamer-crescent-richardson-act-2905
84161	House	2023-08-03	Auction	2023-08-30	$1,120,000	4	2	1	2.0	760.0	LJ Hooker Kaleen	11-wakool-circuit-kaleen-act-2617
84163	House	2023-08-03	Auction	2023-09-06	Undisclosed	4	2	2	3.0	690.0	Luton Tuggeranong	6-currey-street-gowrie-act-2904
84164	Unit	2023-08-03	$500,000+	2023-09-08	$490,000	1	1	1	6.0		LJ Hooker Dickson	3-25-forbes-street-turner-act-2612
84166	House	2023-08-03	AUCTION	2023-08-30	$1,440,000	3	2	1	0.0	732.0	LJ Hooker Dickson	5-hardman-street-oconnor-act-2602
84167	House	2023-08-03	$625,000	2023-08-31	$600,000	3	1	1		658.0	Professionals Nowra	78-salisbury-drive-nowra-nsw-2541
84169	House	2023-08-03	$715,000	2023-12-20	$715,000	3	1	2		922.0	Belle Property Batemans Bay	124-edward-road-batehaven-nsw-2536
84172	House	2023-08-03	SOLD PRIOR AUCTION	2023-08-22	$1,335,400	4	2	2		473.0	Smile Elite	29-tonkin-crescent-schofields-nsw-2762
84173	Land	2023-08-03	$550,000	2023-08-11	$490,000	0	0	0		11200.0	Tathra Beach Real Estate	194-bournda-park-way-wallagoot-nsw-2550
84174	Townhouse	2023-08-03	For Sale $828,000	2023-09-18	Undisclosed	3	2	1			Smile Elite	78-ludhiana-glade-schofields-nsw-2762
84175	House	2023-08-03	$1,195,000	2023-09-29	$1,080,000	3	3	2			Henley Property - Jindabyne	20-rainbow-drive-east-jindabyne-nsw-2627
84176	House	2023-08-03	Auction	2023-08-28	$998,000	4	2	1	1.0	823.0	Luton Dickson	25-elizabeth-crescent-macquarie-act-2614
84181	Unit	2023-08-04	$490,000	2023-08-04	$490,000	3	1	1			Sails Real Estate	4-28-merimbula-drive-merimbula-nsw-2548
84186	Townhouse	2023-08-04	$599,000+	2023-10-04	Undisclosed	2	2	2	6.0		Luton Gungahlin	6a-junee-street-crace-act-2911
84188	House	2023-08-04	$990,000 +	2023-09-25	$950,000	3	1	2	1.5	889.0	LJ Hooker Woden/Weston	31-spafford-crescent-farrer-act-2607
84195	House	2023-08-04	SOLD PRIOR AUCTION FOR A NEW SUBURB RECORD	2023-08-23	$1,425,000	5	3	1		300.0	Smile Elite	39-westminster-street-schofields-nsw-2762
84199	House	2023-08-04	$520,000	2023-08-23	$500,000	2	2	1	6.0		Ray White Canberra	1-46-shumack-street-weetangera-act-2614
84210	Land	2023-08-04	$369,000 - $379,000	2023-10-27	$372,000	0	0	0		396.0	Raine & Horne Queanbeyan | Jerrabomberra	39-mccauley-avenue-googong-nsw-2620
84215	House	2023-08-04	$1,400,000 - $1,500,000	2023-08-15	$1,400,000	4	2	3		8363.0	Smile Elite	24-lakes-folly-drive-branxton-nsw-2335
84223	House	2023-08-04	Auction 27/08/2023	2023-08-27	Undisclosed	4	3	2	2.0	1002.0	Ray White Canberra	86-murranji-street-hawker-act-2614
84225	House	2023-08-04	$499,000	2023-08-03	$495,000	4	2	2		812.0	Raine & Horne Young	74-templemore-st-young-nsw-2594
84229	House	2023-08-04	Price Guide $1,800,000	2023-10-06	Undisclosed	3	2	1		556.0	Ben Bate Real Estate	22-ballingalla-street-narooma-nsw-2546
84233	Apartment	2023-08-04	$595,000+	2023-09-07	Undisclosed	2	2	2	7.5		LJ Hooker Project Marketing	9-koko-76-steve-irwin-avenue-wright-act-2611
84242	House	2023-08-05	$829,000	2023-09-13	$790,000	4	2	1		2030.0	Ray White Batemans Bay	1-church-street-moruya-nsw-2537
84248	House	2023-08-07	$549,000 Negotiable!!!	2023-11-03	Undisclosed	3	1	1		468.0	Ray White Goulburn	94-coromandel-street-goulburn-nsw-2580
84250	House	2023-08-07	Auction 2/09/23	2023-09-02	$801,000	3	1	2		644.9	Ward Estate Agents	49-the-crescent-queanbeyan-nsw-2620
84251	Apartment	2023-08-07	Auction	2023-08-30	$548,000	2	2	2	6.0		LJ Hooker Canberra City	59-241-flemington-road-franklin-act-2913
84258	Alpine	2023-08-07	$695,000	2023-09-13	$680,000	3	2	2			Henley Property - Jindabyne	7-lake-road-eucumbene-nsw-2628
84261	House	2023-08-07	$595,000	2023-08-28	$565,000	3	1	1		556.4	Ray White Batemans Bay	3-paul-place-batehaven-nsw-2536
84262	House	2023-08-07	$769,900	2023-09-09	$769,900	3	1	2	0.0	405.0	Village	47-oxalis-crescent-tralee-nsw-2620
84264	House	2023-08-07	Price on Request	2023-08-24	$765,000	4	2	2		5196.0	Smile Elite	41-judith-street-armidale-nsw-2350
84266	Apartment	2023-08-07	$520,000+	2023-09-29	Undisclosed	2	2	2	6.0		LJ Hooker Woden/Weston	36-60-john-gorton-drive-coombs-act-2611
84275	Apartment	2023-08-07	$450,777	2023-08-24	$450,777	1	1	1	6.0		MARQ Property	501-86-88-northbourne-avenue-braddon-act-2612
84278	House	2023-08-07	$1,100,000	2023-09-20	$1,090,000	3	2	2		278.0	Smile Elite	7-green-crescent-shell-cove-nsw-2529
84279	Land	2023-08-07	$249,900	2023-09-06	$249,900	0	0	0		4208.0	John Mooney Real Estate	14-carson-road-the-rock-nsw-2655
84288	House	2023-08-07	SOLD	2023-09-19	Undisclosed	3	2	2		1012.0	Flemings Property Services	150-temora-street-cootamundra-nsw-2590
84289	House	2023-08-07	$925,000	2023-08-02	$910,000	4	2	2		784.0	PRD Wagga Wagga	24-bonner-street-lloyd-nsw-2650
84291	House	2023-08-07	Auction	2023-08-07	$1,200,000	4	2	2		429.2	PRD Wagga Wagga	38a-fox-street-wagga-wagga-nsw-2650
84292	House	2023-08-07	SOLD	2023-09-25	Undisclosed	2	1	1		575.0	Flemings Property Services	56-gundagai-road-cootamundra-nsw-2590
84296	Land	2023-08-07	$730,000 - $780,000	2023-08-21	$750,000	0	0	0		859.0	Henley Property - Jindabyne	21-alice-street-jindabyne-nsw-2627
84299	Townhouse	2023-08-07	Sold	2023-09-15	$505,000	2	1	2			The Property Collective	3-25-henderson-road-queanbeyan-nsw-2620
84300	House	2023-08-08	By Negotiation	2023-09-21	Undisclosed	2	1	1			Smile Elite	29-oakley-avenue-east-lismore-nsw-2480
84307	House	2023-08-08	Contact Agent	2023-10-26	Undisclosed	2	1	2		316.0	dwell Realty	50-35-the-basin-road-st-georges-basin-nsw-2540
84309	House	2023-08-08	$1,495,000	2023-12-18	$1,500,000	5	2	10		5.4	My Agent Team	38-collett-place-meringo-nsw-2537
84312	House	2023-08-08	$620,000	2023-10-11	Undisclosed	3	2	2		524.0	PRD Wagga Wagga	2-48-ross-parkway-gobbagombalin-nsw-2650
84313	House	2023-08-08	$800,000 - $850,000	2023-10-09	Undisclosed	4	3	2		913.0	My Agent Team	28-eric-fenning-drive-surf-beach-nsw-2536
84334	Villa	2023-08-08	$360,000	2023-10-05	$350,000	2	1	1			Macarthur Real Estate Agency	5-22-dove-street-mount-austin-nsw-2650
84336	House	2023-08-08	$280,000	2023-08-07	$280,000	3	1	1		582.0	Raine & Horne Southern Highlands	5-mulga-street-captains-flat-nsw-2623
84340	House	2023-08-08	$1,275,000	2023-08-22	$1,240,000	5	2	2		851.0	Ray White Bungendore	5-cobb-court-bungendore-nsw-2621
84341	Townhouse	2023-08-08	$560,000+	2023-09-18	Undisclosed	3	1	1	2.0		McIntyre Property	40-81-box-hill-avenue-conder-act-2906
84351	House	2023-08-08	$1,250,000 - $1,350,000	2023-11-10	$1,300,000	4	2	3		965.0	Ward Estate Agents	8-bailey-crescent-googong-nsw-2620
84375	Townhouse	2023-08-09	By Negotiation	2023-09-15	Undisclosed	4	2	2	4.0		Morrissey Property	2-2-ridding-street-forde-act-2914
84378	House	2023-08-09	Auction 2/09/23	2023-09-02	$1,435,000	4	2	6		656.0	Ward Estate Agents	11-meredith-street-queanbeyan-nsw-2620
84381	House	2023-08-09	Auction	2023-09-02	$700,000	3	1	1	4.0	766.0	LJ Hooker Belconnen	74-petterd-street-page-act-2614
84382	Apartment	2023-08-09	$519,000	2023-09-13	$519,000	2	2	1	6.0		LJ Hooker Belconnen	243-325-anketell-street-greenway-act-2900
84386	House	2023-08-09	SOLD $750,000	2023-08-26	Undisclosed	3	2	2	6.0		Blackshaw Belconnen	5-bakewell-street-coombs-act-2611
84388	Townhouse	2023-08-09	$630,000+	2023-09-13	$625,000	3	2	1	2.0		McIntyre Property	9-40-sid-barnes-crescent-gordon-act-2906
84391	House	2023-08-09	$675,000	2023-09-04	$675,000	1	1	1		1882.0	Belle Property Braidwood	45-cowper-street-braidwood-nsw-2622
84394	Apartment	2023-08-09	$577,000	2023-08-08	$577,000	2	2	1			Smile Elite	426-45-manchester-drive-schofields-nsw-2762
84397	House	2023-08-09	$659,000+	2023-11-14	$650,000	3	1	2	0.5	371.0	Ray White Canberra	39-beattie-crescent-chisholm-act-2905
84401	House	2023-08-09	$695,000+	2023-09-27	$720,000	3	1	1	1.5	936.0	LJ Hooker Tuggeranong	19-chippindall-circuit-theodore-act-2905
84402	House	2023-08-09	$469,000	2023-09-14	Undisclosed	3	1	0		1012.0	Ray White Wagga Wagga	108-mirrool-street-coolamon-nsw-2701
84403	House	2023-08-09	$1,520,000 - $1,590,000	2023-09-18	$1,505,000	5	2	4		8175.0	Ray White Bungendore	20-john-dwyer-crescent-bungendore-nsw-2621
84407	House	2023-08-09	$469,000	2023-10-25	$465,000	2	2	1			LJ Hooker Moruya	5-13-15-native-way-moruya-heads-nsw-2537
84408	House	2023-08-09	$760,000	2023-11-09	Undisclosed	5	2	2	3.5	615.0	Luton Kippax	8-sax-place-macgregor-act-2615
84410	House	2023-08-09	$720,000	2023-10-27	Undisclosed	3	2	2		301.0	dwell Realty	15-146-plunkett-street-nowra-nsw-2541
84413	House	2023-08-09	$730,000	2023-09-25	$708,000	5	2	2		686.0	PRD Wagga Wagga	18-fay-avenue-kooringal-nsw-2650
84416	House	2023-08-09	$995,000	2023-10-03	Undisclosed	4	2	4	1.0	718.0	Bertram Ellis	37-nangor-street-waramanga-act-2611
84417	House	2023-08-09	$1,295,000-$1,320,000	2023-09-06	$1,295,000	4	2	2		660.0	Ray White Bungendore	29-montgomery-avenue-googong-nsw-2620
84418	House	2023-08-09	Auction	2023-09-02	$1,040,000	3	2	3	1.0	937.0	Luton Manuka	13-woolrych-street-holder-act-2611
84419	House	2023-08-09	$1,240,000 - $1,290,000	2023-09-08	$1,250,000	4	2	4		1013.0	Ray White Bungendore	13-ricketts-place-bungendore-nsw-2621
84420	Unit	2023-08-09	$295,000 - $325,000	2023-11-02	$315,000	2	1	1		1050.0	Raine & Horne Queanbeyan | Jerrabomberra	2-120-henderson-road-crestwood-nsw-2620
84424	Apartment	2023-08-09	SOLD QUIETLY	2023-08-09	Undisclosed	1	1	1	6.0		Stone Gungahlin	48-65-constitution-avenue-campbell-act-2612
84425	Townhouse	2023-08-09	$768,000+	2023-09-01	$811,000	3	2	2	3.0	254.0	MARQ Property	4-tuffin-lane-gungahlin-act-2912
84426	Townhouse	2023-08-09	$559,000-$599,000	2023-10-05	$567,500	2	2	2	6.0		Stone Gungahlin	6-quealy-street-casey-act-2913
84428	Land	2023-08-09	$620,000	2023-09-22	Undisclosed	0	0	0		6809.0	MARQ Property	16-cabernet-way-murrumbateman-nsw-2582
84445	Townhouse	2023-08-09	contact agent	2023-08-24	$880,000	3	2	1			Smile Elite	1-11-hamlin-circuit-holsworthy-nsw-2173
84449	House	2023-08-09	$880,000+	2023-10-23	$860,000	4	2	2	4.0	476.0	LJ Hooker Gungahlin	20-swallow-street-dunlop-act-2615
84453	AcreageSemi-rural	2023-08-09	$1,600,000 - $1,650,000	2023-09-22	$1,650,000	4	2	8		10.1	Smile Elite	150-rusty-lane-branxton-nsw-2335
84454	House	2023-08-10	Auction	2023-09-02	Undisclosed	4	1	3	5.0	1124.0	Luton Weston Creek & Molonglo Valley	17-yate-gardens-rivett-act-2611
84455	House	2023-08-10	Auction	2023-09-02	Undisclosed	4	2	2	3.5	856.0	Luton Weston Creek & Molonglo Valley	114-jackie-howe-crescent-macarthur-act-2904
84456	House	2023-08-10	Auction	2023-09-02	Undisclosed	5	4	3	5.0	746.0	Luton Weston Creek & Molonglo Valley	40-heysen-street-weston-act-2611
84457	House	2023-08-10	$1,038,000 - $1,088,000	2023-10-04	$1,065,000	4	2	2	3.0	325.0	MARQ Property	10-cleggett-street-forde-act-2914
84458	House	2023-08-10	$855,000	2023-09-08	$855,000	4	1	2	1.5	955.0	home.by holly	169-namatijira-drive-fisher-act-2611
84459	House	2023-08-10	$2,095,000	2023-10-13	$2,050,000	5	4	7		17185.0	VERV Property	2-marquess-place-murrumbateman-nsw-2582
84460	House	2023-08-10	$705,000+	2023-09-13	$705,500	3	2	2	4.5		MARQ Property	24-20-pumpurs-crescent-taylor-act-2913
84462	House	2023-08-10	Auction 31/08/23	2023-08-31	$1,085,000	4	2	3	3.0	714.0	Ray White Canberra	4-willyama-place-flynn-act-2615
84463	House	2023-08-10	Auction 31/08/23	2023-08-31	$876,000	3	2	2	1.5	515.0	Ray White Canberra	3-levine-street-evatt-act-2617
84464	Townhouse	2023-08-10	$560,000+	2023-09-08	$590,000	2	1	1	2.5	295.0	LJ Hooker Tuggeranong	3-47-ashby-circuit-kambah-act-2902
84471	House	2023-08-10	$2,850,000	2023-10-11	Undisclosed	5	3	2	4.0	783.0	Luton Manuka	49-investigator-street-red-hill-act-2603
84475	Unit	2023-08-10	$499,950	2023-10-25	Undisclosed	3	1	1			LJ Hooker Manuka	3-16-mcinnes-street-karabar-nsw-2620
84476	Apartment	2023-08-10	$430,000	2023-09-27	$430,000	2	1	1	6.0		LJ Hooker Gungahlin	508-6-8-gribble-street-gungahlin-act-2912
84488	Apartment	2023-08-10	Offers over $700,000	2023-10-19	$705,000	3	2	1	1.5		Ray White Canberra	38-54-forbes-street-turner-act-2612
84491	Apartment	2023-08-10	$399,000+	2023-12-01	$400,000	1	1	1	5.0	21898.89	Ray White Canberra	6-68-college-street-belconnen-act-2617
84492	Townhouse	2023-08-10	$829,000+	2023-09-04	Undisclosed	3	2	2	6.0		Luton Gungahlin	5-25-hurrell-street-forde-act-2914
84493	Apartment	2023-08-10	$565,000	2023-10-10	$565,000	1	1	1	6.0		home.by holly	23-30-lonsdale-street-braddon-act-2612
84496	House	2023-08-10	contact agent	2023-08-22	Undisclosed	3	1	2	0.5		home.by holly	3-bragg-street-hackett-act-2602
84502	House	2023-08-10	Auction 02/09/23	2023-09-02	Undisclosed	3	2	2	6.0		Ray White Canberra	2-4-lorraway-street-holt-act-2615
84504	House	2023-08-10	Auction	2023-09-02	$940,000	3	2	2	4.0	645.0	Luton Tuggeranong	13-hickenbotham-street-gordon-act-2906
84505	House	2023-08-10	$895,000+	2023-12-01	$910,000	4	2	2	2.5	712.0	LJ Hooker Tuggeranong	7-wedgwood-close-chisholm-act-2905
84508	House	2023-08-10	Auction 31/08/2023	2023-08-31	$832,500	4	1	0	4.5	843.0	Ray White Canberra	108-louisa-lawson-crescent-gilmore-act-2905
84514	House	2023-08-10	Under Offer	2023-10-06	$780,000	3	2	1	3.0	429.0	Ray White Canberra	4-a-gleadow-street-evatt-act-2617
84515	House	2023-08-10	$820,000 - $880,000	2023-09-27	$830,000	3	2	2	0.0	374.8	McIntyre Property	9-elkhorn-road-tralee-nsw-2620
84517	House	2023-08-10	Auction	2023-08-17	Undisclosed	3	2	2	4.0		Luton Dickson	20-29-thynne-street-bruce-act-2617
84519	House	2023-08-10	$435,000	2023-09-04	$425,000	3	1	1		654.0	Smile Elite	16-beech-street-muswellbrook-nsw-2333
84520	House	2023-08-10	$1,425,000	2023-08-18	$1,425,000	3	1	1	5.0		home.by holly	61-sherbrooke-street-ainslie-act-2602
84524	House	2023-08-10	Auction 26/08/2023	2023-08-26	$1,130,000	4	2	4	1.0	938.0	Ray White Canberra	33-enderby-street-mawson-act-2607
84525	House	2023-08-10	$580,000 - $610,000	2023-11-02	Undisclosed	4	1	3		936.9	Ray White Wagga Wagga	20-dalkeith-avenue-lake-albert-nsw-2650
84526	Apartment	2023-08-10	Auction 31/08/2023	2023-08-31	$750,000	2	2	2	5.0	6921.75	Ray White Canberra	57-3-london-circuit-city-act-2601
84528	House	2023-08-10	Auction	2023-08-17	$1,200,000	5	2	2	4.5	506.0	LJ Hooker Kippax	26-alice-cummins-street-gungahlin-act-2912
84529	Apartment	2023-08-10	Auction 02/09/2023	2023-08-14	$428,000	1	1	1	6.0		Luton Manuka	86-40-philip-hodgins-street-wright-act-2611
84530	House	2023-08-10	$565,000	2023-09-29	$540,000	3	2	2		558.0	Macarthur Real Estate Agency	53-melaleuca-drive-forest-hill-nsw-2651
84532	House	2023-08-10	Auction	2023-09-02	$2,200,000	4	2	2	4.5	758.0	LJ Hooker Woden/Weston	7-brinsmead-street-pearce-act-2607
84533	Villa	2023-08-10	$549,000	2023-09-07	$533,500	3	2	1			Professionals Nowra	3-28-sugarwood-road-worrigee-nsw-2540
84534	House	2023-08-10	Auction	2023-09-02	$915,000	6	2	2	1.5	817.5	LJ Hooker Belconnen	11-stuckey-place-charnwood-act-2615
84537	House	2023-08-10	$470,000 - $490,000	2023-09-13	Undisclosed	3	1	2		846.3	Ray White Wagga Wagga	44-karoom-drive-glenfield-park-nsw-2650
84538	House	2023-08-10	$1,070,000	2023-09-12	$1,050,000	4	2	2	0.0	1007.0	Luton Gungahlin	22-hopkins-street-bungendore-nsw-2621
84541	House	2023-08-10	Auction	2023-09-02	$950,000	4	2	2	3.5	639.0	Luton Gungahlin	51-shoalhaven-avenue-amaroo-act-2914
84542	Apartment	2023-08-11	$599,000+	2023-08-31	$635,000	2	1	1	6.0		Luton Weston Creek & Molonglo Valley	31-4-tench-street-kingston-act-2604
84547	Villa	2023-08-11	$525,000	2023-10-16	$507,000	3	2	1		384.0	Professionals Wagga Wagga	4-124-mima-street-glenfield-park-nsw-2650
84550	Townhouse	2023-08-11	$710,000+	2023-08-29	$721,000	3	2	2	4.5		LJ Hooker Tuggeranong	9-48-knoke-avenue-gordon-act-2906
84554	Apartment	2023-08-11	For Sale $570,000 - $590,000	2023-11-06	$579,000	2	2	1			Smile Elite	106-4a-isla-street-schofields-nsw-2762
84556	House	2023-08-11	$449,000	2023-09-05	$440,000	4	1	1		1012.0	Kitson Property	28-hebden-street-lockhart-nsw-2656
84563	House	2023-08-11	AUCTION SUNDAY 3:30PM Price Guide $1,050,000	2023-09-18	$1,236,000	5	3	1		257.6	Smile Elite	162b-sciberras-avenue-schofields-nsw-2762
84564	House	2023-08-11	Price Guide $1,080,000	2023-08-29	$1,207,007	4	2	1		364.0	Smile Elite	129-alex-avenue-schofields-nsw-2762
84568	House	2023-08-11	$780,000 - $820,000	2023-11-16	$785,000	5	3	2		994.0	Professionals Wagga Wagga	40-andrews-avenue-kooringal-nsw-2650
84572	House	2023-08-11	Guide $600,000	2023-12-04	$570,000	3	2	1		350.0	Ray White Goulburn	1-24-matchless-avenue-goulburn-nsw-2580
84576	DuplexSemi-detached	2023-08-11	$710,000	2023-09-11	$710,000	3	1	1	6.0	271.0	home.by holly	37-carmody-street-casey-act-2913
84583	Apartment	2023-08-11	$475,000+	2023-10-12	$480,000	1	1	1	6.0		LJ Hooker Dickson	403-254-northbourne-avenue-dickson-act-2602
84590	House	2023-08-11	$979,000	2023-09-15	$975,000	4	2	2		759.0	My Agent Team	16-mawson-place-sunshine-bay-nsw-2536
84599	House	2023-08-12	SOLD	2023-10-24	$310,000	3	1	1		1012.0	Flemings Property Services	209-hovell-street-cootamundra-nsw-2590
84612	Land	2023-08-14	$436,900	2023-09-22	$436,900	0	0	0	0.0	417.0	Village	lot-683-alpine-ash-way-tralee-nsw-2620
84614	Townhouse	2023-08-14	Auction 09/09/2023	2023-09-09	Undisclosed	3	2	2	4.0		Ray White Canberra	10-6-webber-crescent-calwell-act-2905
84617	DuplexSemi-detached	2023-08-14	$555,000	2023-09-22	$535,000	2	1	0			Merimbula Realty	2-13-tura-circuit-tura-beach-nsw-2548
84618	Townhouse	2023-08-14	Contact Agent	2023-08-11	Undisclosed	2	1	1			LJ Hooker Queanbeyan – Jerrabomberra – Googong	4-4-booth-street-queanbeyan-east-nsw-2620
84619	Townhouse	2023-08-14	$1,588,000+	2023-10-19	Undisclosed	4	2	2	5.0		MARQ Property	75-forbes-street-turner-act-2612
84623	Townhouse	2023-08-14	$420,000 - $460,000	2023-09-25	$461,000	2	1	1		0.0	Ward Estate Agents	2-31-gilmore-place-queanbeyan-nsw-2620
84624	Unit	2023-08-14	Price Range $196,000 - $215,000	2023-10-11	$185,000	1	1	1			Clearwater Real Estate Narooma	unit-10-67-evans-st-moruya-nsw-2537
84628	House	2023-08-14	Auction 9/09/23	2023-09-09	$945,000	3	2	2		608.0	Ward Estate Agents	32-garraway-crescent-googong-nsw-2620
84629	House	2023-08-14	$1,100,000 - $1,190,000	2023-09-14	$1,120,000	3	2	2		552.0	My Agent Team	8-red-hill-parade-tomakin-nsw-2537
84631	House	2023-08-14	$780,000 - $850,000	2023-09-29	$680,000	4	2	4		6.09	LJ Hooker Batemans Bay	155-mccardys-creek-road-nelligen-nsw-2536
84634	House	2023-08-14	AUCTION GUIDE $730,000	2023-09-15	$800,000	4	2	2		1347.0	Ray White Goulburn	4-lorn-street-collector-nsw-2581
84657	House	2023-08-14	$580,000	2023-12-13	Undisclosed	3	1	2		664.0	Smile Elite	8-lagoon-street-moruya-nsw-2537
84661	Land	2023-08-14	$550,000	2023-08-15	Undisclosed	0	0	0		2.2	Ray White Rural Tumbarumba	lot-11-71-albury-street-tumbarumba-nsw-2653
84668	House	2023-08-14	$990,000 - $1,050,000	2023-08-22	$1,050,000	4	2	3		557.0	My Agent Team	51-kingston-place-tomakin-nsw-2537
84678	House	2023-08-15	$995,000 +	2023-10-13	Undisclosed	4	2	2	0.5	763.0	Timothy Road	4-dobinson-place-flynn-act-2615
84679	House	2023-08-15	$489,000	2023-08-14	$380,000	3	1	2		1020.0	Kitson Property	408-lake-albert-road-kooringal-nsw-2650
84681	Other	2023-08-15	1451000	2023-08-14	$1,451,000	5	3	2		300.0	Smile Elite	12-coursebrook-st-box-hill-nsw-2765
84690	AcreageSemi-rural	2023-08-15	$1,425,000	2023-12-20	Undisclosed	5	2	2		1.0	Smile Elite	2b-hardy-close-korora-nsw-2450
84692	House	2023-08-15	$1,075,000+	2023-09-11	$1,124,000	4	2	2	5.0	549.0	LJ Hooker Gungahlin	17-phantom-street-harrison-act-2914
84698	House	2023-08-15	$799,000	2023-11-07	$785,000	4	2	2		782.0	Raine & Horne Goulburn	30-banksia-way-goulburn-nsw-2580
84699	Townhouse	2023-08-15	$599,000	2023-10-11	$558,000	3	1	2	2.5	189.0	McIntyre Property	6-3-peron-place-banks-act-2906
84700	House	2023-08-15	AUCTION	2023-09-09	Undisclosed	3	1	1	1.0	650.0	McIntyre Property	14-candelo-place-isabella-plains-act-2905
84704	AcreageSemi-rural	2023-08-15	$700,000	2023-09-12	$720,000	1	1	4		4.02	Burchell Higgins Property Sales	13-raktari-place-kalaru-nsw-2550
84705	House	2023-08-15	$739,000	2023-08-30	$720,000	3	1	1		712.0	McGrath Batemans Bay & Moruya	98-maloneys-drive-maloneys-beach-nsw-2536
84708	House	2023-08-15	Auction	2023-09-09	Undisclosed	4	2	2	3.5	963.0	Timothy Road	9-somerville-street-spence-act-2615
84709	Apartment	2023-08-15	$459,000 - $489,000	2023-10-25	$470,000	2	1	1	6.0		McIntyre Property	22-2-trist-street-franklin-act-2913
84711	Unit	2023-08-15	$399,950	2023-10-03	$390,000	2	1	1			Ray White Queanbeyan | Jerrabomberra	1-56-58-trinculo-place-queanbeyan-east-nsw-2620
84717	Land	2023-08-15	$650,000	2023-09-27	Undisclosed	2	1	24		110.0	Flemings Property Services	2359-rugby-road-rugby-nsw-2583
84718	House	2023-08-15	AUCTION	2023-09-09	$720,000	3	1	1	0.5	851.0	McIntyre Property	39-ragless-circuit-kambah-act-2902
84726	House	2023-08-15	Guide $870,000	2023-11-02	$865,000	5	3	2		703.0	Ray White Goulburn	13-13a-success-street-goulburn-nsw-2580
84735	House	2023-08-15	$700,000 GUIDE - AUCTION SUN 10TH SEP 11AM	2023-09-08	$750,000	3	1	4		1024.0	Ray White Rural Canberra | Yass	18a-ford-street-yass-nsw-2582
84737	Apartment	2023-08-15	$220,000	2023-10-04	$220,000	1	1	0	1.0		Berkely Residential	36-47-mcmillan-street-griffith-act-2603
84739	Apartment	2023-08-15	$465,000+	2023-10-06	Undisclosed	1	1	1	6.0		Luton Gungahlin	320-83-cooyong-street-reid-act-2612
84740	Townhouse	2023-08-15	$699,000	2023-09-26	$680,000	3	2	2	5.0		Ray White Queanbeyan | Jerrabomberra	69-15-john-cleland-crescent-florey-act-2615
84744	House	2023-08-15	$710,000	2023-09-20	$710,000	5	3	2		2023.0	Kitson Property	13-15-mirrool-street-coolamon-nsw-2701
84748	House	2023-08-15	$1,070,000 - $1,100,000	2023-09-15	$1,085,000	4	2	2	0.0	1689.0	Ray White Bungendore	22-mecca-lane-bungendore-nsw-2621
84750	Townhouse	2023-08-15	Price undisclosed	2023-09-14	$701,000	3	2	2	5.0		MARQ Property	3-51-blackwood-terrace-holder-act-2611
84759	Apartment	2023-08-15	$399,000+	2023-09-01	$405,000	1	1	1	6.0	9269.0	Edge Rhonda Coleman	15-297-flemmington-road-franklin-act-2913
84761	House	2023-08-16	Auction Saturday 9th September at 10:30am	2023-09-09	$870,000	3	2	2	3.0	878.0	McCann Properties	7-mcmanus-place-calwell-act-2905
84764	House	2023-08-16	Auction	2023-09-02	$850,000	3	2	2	6.0	294.0	LJ Hooker Belconnen	92-tredwell-street-strathnairn-act-2615
84765	Unit	2023-08-16	$389,980	2023-09-12	$400,000	2	1	1	6.0		LJ Hooker Belconnen	31-311-flemington-road-franklin-act-2913
84766	House	2023-08-16	$999,000 - $1,090,000	2023-10-16	Undisclosed	4	2	3	0.0	2.05	My Agent Team	43-margaret-drive-bimbimbie-nsw-2536
84767	Townhouse	2023-08-16	$639,000	2023-10-03	$635,000	3	2	1	4.5	191.0	LJ Hooker Belconnen	41-60-copland-drive-evatt-act-2617
84771	Unit	2023-08-16	$435,000+	2023-09-08	Undisclosed	2	1	2	6.0		Luton Gungahlin	13-16-david-miller-crescent-casey-act-2913
84773	Apartment	2023-08-16	$535,000	2023-10-13	$525,000	2	2	2	6.0		LJ Hooker Belconnen	509-335-anketell-street-greenway-act-2900
84774	House	2023-08-16	$550,000 - $570,000	2023-10-30	$560,000	3	1	1		627.0	Smile Elite	124-regiment-road-rutherford-nsw-2320
84777	House	2023-08-16	$740,000 - $770,000	2023-08-31	$755,000	3	1	1		726.0	My Agent Team	7-pacific-road-surf-beach-nsw-2536
84778	Apartment	2023-08-16	$538,000+	2023-09-18	$555,000	2	1	1	6.0		MARQ Property	54-217-northbourne-avenue-turner-act-2612
84779	House	2023-08-16	Offers Over $699,000	2023-11-01	Undisclosed	3	1	4	4.5	469.0	McIntyre Property	15-chalker-circuit-banks-act-2906
84780	House	2023-08-16	$882,000	2023-08-30	$882,000	3	2	2	5.5		home.by holly	1-yoornie-way-strathnairn-act-2615
84782	Apartment	2023-08-16	$689,000+	2023-09-13	Undisclosed	2	2	2	6.0		LJ Hooker Canberra City	24-18-bradfield-street-downer-act-2602
84784	House	2023-08-16	$819,000	2023-11-03	$810,000	4	3	4		944.0	Dwyer Properties Sapphire Coast	42-garden-circle-merimbula-nsw-2548
84785	House	2023-08-16	$929,000 - $969,000	2023-09-26	$925,000	4	2	2		457.0	Ian McNamee & Partners - Queanbeyan	63-bluestone-gardens-jerrabomberra-nsw-2619
84786	House	2023-08-16	$795,000	2023-12-05	Undisclosed	3	2	4		4000.0	Ray White Rural Canberra | Yass	10-12-little-street-boorowa-nsw-2586
84789	MixedFarming	2023-08-16	CONTACT AGENT	2023-10-13	$1,400,000	3	2	6		394800.0	Raine & Horne Goulburn	320-merilla-lane-parkesbourne-via-goulburn-nsw-2580
84793	House	2023-08-16	$1,800,000 to $2,000,000	2023-10-30	Undisclosed	4	3	2		30.0	Luton Gungahlin	343-kaveneys-road-wallaroo-nsw-2618
84794	House	2023-08-16	Contact Agent	2023-08-14	$980,000	3	2	4		1816.0	Smile Elite	82-spencer-street-moruya-nsw-2537
84795	House	2023-08-16	Auction 09/09/2023	2023-09-09	Undisclosed	3	2	3	4.0		Ray White Canberra	19-templestowe-avenue-conder-act-2906
84797	House	2023-08-16	$899,000+	2023-11-07	$875,000	3	1	2	2.0	497.1	LJ Hooker Dickson	11-lowrie-street-dickson-act-2602
84804	Apartment	2023-08-16	For Sale  $1,075,000	2023-12-01	Undisclosed	3	1	2			Smile Elite	3-67-ballina-street-lennox-head-nsw-2478
84818	House	2023-08-16	$820,000	2023-09-26	Undisclosed	4	2	3	4.0	650.0	Luton Gungahlin	65-bargang-crescent-ngunnawal-act-2913
84822	House	2023-08-16	Price by Negotiation	2023-09-20	$1,205,000	5	3	3		747.0	Raine & Horne Mollymook Milton	3-bonnie-troon-close-dolphin-point-nsw-2539
84826	House	2023-08-16	Contact Agent	2023-08-24	$775,000	3	1	2		779.0	Ray White Bowral	19-arborea-place-bowral-nsw-2576
84830	Unit	2023-08-17	Offers above $469,000	2023-09-06	$485,000	2	1	1	6.0		Michael Potter Real Estate	15-10-wilkins-street-the-crest-mawson-act-2607
84831	House	2023-08-17	Auction	2023-09-09	Undisclosed	3	2	2	1.5	673.0	Luton Weston Creek & Molonglo Valley	13-bunny-street-weston-act-2611
84832	House	2023-08-17	Auction	2023-09-09	Undisclosed	3	2	2	1.5	837.0	Luton Weston Creek & Molonglo Valley	24-halfrey-circuit-wanniassa-act-2903
84833	House	2023-08-17	$1,499,000	2023-09-29	Undisclosed	4	2	2	2.5	524.0	Luton Weston Creek & Molonglo Valley	90-wyndham-avenue-denman-prospect-act-2611
84834	House	2023-08-17	Auction: 9:45am Sat 9 Sept.	2023-09-09	Undisclosed	4	3	2	4.0	1000.0	MARQ Property	21-hendry-close-nicholls-act-2913
84835	House	2023-08-17	$660,000+	2023-09-13	$662,000	3	1	2	0.0	723.0	MARQ Property	1-connor-place-kambah-act-2902
84836	DuplexSemi-detached	2023-08-17	By Negotiation	2023-12-15	Undisclosed	3	1	4	2.0	471.0	Impact Properties	2-60-mainwaring-rich-circuit-palmerston-act-2913
84837	Apartment	2023-08-17	$570,000	2023-12-05	$570,000	2	2	2	6.0		Luton Manuka	28-34-leahy-close-narrabundah-act-2604
84839	Apartment	2023-08-17	By Negotiation	2023-09-19	$440,000	2	1	1	6.0		Morrissey Property	30-68-hardwick-crescent-holt-act-2615
84840	House	2023-08-17	$1,565,000	2023-09-29	$1,565,000	3	1	1	1.5		home.by holly	26-dryandra-street-oconnor-act-2602
84841	DuplexSemi-detached	2023-08-17	AUCTION	2023-09-09	Undisclosed	3	2	2	6.0		Bastion Property Group	14b-buriga-street-giralang-act-2617
84845	Townhouse	2023-08-17	contact agent	2023-08-30	Undisclosed	4	2	3	1.5	662.0	home.by holly	19-govett-place-holder-act-2611
84846	Land	2023-08-17	Auction, Wed 27th Sept at 6pm	2023-10-19	$850,000	0	0	0	0.0	33.96	LJ Hooker Gungahlin	267-lawtons-road-bellmount-forest-nsw-2581
84847	Townhouse	2023-08-17	$925,000	2023-08-30	$925,000	2	1	2	1.5		home.by holly	58-wybalena-grove-cook-act-2614
84848	Townhouse	2023-08-17	$780,000	2023-09-09	$780,000	2	1	2	2.5		home.by holly	16-44-medworth-crescent-lyneham-act-2602
84850	House	2023-08-17	Price Guide $720,000+	2023-09-13	$750,000	3	1	2	1.0	446.0	LJ Hooker Kaleen	58-ashkanasy-crescent-evatt-act-2617
84851	House	2023-08-17	Auction: Saturday 9th Sept, On site at 12:00PM	2023-09-09	Undisclosed	4	2	2	5.5	616.0	LJ Hooker Manuka	5-banks-street-yarralumla-act-2600
84852	House	2023-08-17	$1,000,000- $1,100,000	2023-12-07	$1,008,000	4	2	2		2.5	Ray White Queanbeyan | Jerrabomberra	158-wickerslack-lane-googong-nsw-2620
84853	Apartment	2023-08-17	$395,000+	2023-10-20	$400,000	1	1	1	6.0		Morrissey Property	10-8-baudinette-circuit-bruce-act-2617
84854	House	2023-08-17	Auction: Saturday 9th Sept, On site at 10:00am	2023-09-09	Undisclosed	4	2	2	6.0	653.0	LJ Hooker Manuka	18-bedford-street-deakin-act-2600
84855	House	2023-08-17	$859,000+	2023-12-21	Undisclosed	4	2	2	3.5	479.0	Stone Gungahlin	111-katherine-avenue-amaroo-act-2914
84866	House	2023-08-17	$850,000+	2023-09-08	Undisclosed	3	2	1	3.5	244.0	My Morris	86-barnet-close-swinger-hill-act-2606
84872	Apartment	2023-08-17	By Negotiation	2023-10-24	$493,000	1	1	1	6.0		Ray White Canberra	75-43-constitution-avenue-reid-act-2612
84873	House	2023-08-17	By Negotiation	2023-10-09	Undisclosed	5	3	2	6.0	549.0	New Door Properties	23-ellis-stones-terrace-taylor-act-2913
84874	House	2023-08-17	$925,000 +	2023-10-10	$920,000	3	1	1	1.5	847.0	LJ Hooker Woden/Weston	22-mcinnes-street-weston-act-2611
84877	Townhouse	2023-08-17	$900,000	2023-10-06	$900,000	3	2	2	6.0		home.by holly	9-39-majura-avenue-dickson-act-2602
84881	Apartment	2023-08-17	$485,000+	2023-10-20	Undisclosed	2	2	2	6.0		LJ Hooker Canberra City	133-2-windjana-street-harrison-act-2914
84884	Apartment	2023-08-17	Auction	2023-08-30	Undisclosed	2	2	2	6.0		Luton Gungahlin	68-68-hardwick-crescent-holt-act-2615
84890	Land	2023-08-17	$330,000	2023-09-14	$330,000	0	0	0		5.0	Kitson Property	1-jerricks-lane-coolamon-nsw-2701
84895	House	2023-08-17	$750,000 - $780,000	2023-09-12	$770,000	3	2	1		334.0	Smile Elite	2-2-kianga-close-flinders-nsw-2529
84896	House	2023-08-17	Contact Agent	2023-10-10	$820,000	3	2	1		772.0	Bella Coastal Property	9-harold-street-kings-point-nsw-2539
84903	Apartment	2023-08-17	Auction	2023-09-13	Undisclosed	2	2	1	6.0		LJ Hooker Canberra City	69-14-boolee-street-reid-act-2612
84905	Alpine	2023-08-17	$1,575,000	2023-09-28	$1,450,000	2	1	1			Henley Property - Jindabyne	7-18-bobuck-lane-thredbo-nsw-2625
84910	Apartment	2023-08-17	$497,000	2023-09-13	$497,000	1	1	1	6.0		home.by holly	18-7-coolac-place-braddon-act-2612
84912	House	2023-08-17	Auction 13/09/2023	2023-09-14	$735,000	3	1	6	3.0	812.0	Ray White Canberra	70-chauncy-crescent-richardson-act-2905
84916	House	2023-08-17	Auction	2023-09-13	$721,000	3	1	1	1.5	708.0	LJ Hooker Kaleen	6-gonzaga-place-richardson-act-2905
84918	Townhouse	2023-08-17	$790,000+	2023-09-18	$800,000	3	2	2	3.5		McIntyre Property	11-1-wilkins-street-mawson-act-2607
84925	House	2023-08-17	AUCTION THIS SUNDAY 12PM Price Guide $790,000	2023-09-11	$918,000	3	1	1		287.0	Smile Elite	6a-tonkin-crescent-schofields-nsw-2762
84928	DuplexSemi-detached	2023-08-18	Auction	2023-09-09	Undisclosed	4	2	2	6.0	410.0	Luton Weston Creek & Molonglo Valley	61a-hyndes-crescent-holder-act-2611
84929	House	2023-08-18	Auction 9/9/23	2023-09-09	$1,910,000	3	3	1	3.5		Ray White Canberra	27-nardoo-crescent-oconnor-act-2602
84940	House	2023-08-18	$600,000 - $630,000	2023-09-29	$600,000	3	1	2		663.0	Smile Elite	20-lavelle-street-windradyne-nsw-2795
