id	type	ListingDate	PriceLabel	SoldDate	SoldPrice	Beds	Baths	Cars	EER	PlotSize	Agency.Name	Slug
87562	House	2023-10-03	Auction 21/10/2023 - 10.00am On Site	2023-10-21	$750,000	3	1	1	4.0	418.0	Morrissey Property	5-cann-close-palmerston-act-2913
87571	House	2023-10-03	Auction 29/10/23	2023-10-29	$1,025,000	4	2	3		925.0	Ward Estate Agents	104-barracks-flat-drive-queanbeyan-nsw-2620
87579	Unit	2023-10-03	Auction	2023-10-13	Undisclosed	3	2	2			Smile Elite	2-28-folkestone-parade-botany-nsw-2019
87588	House	2023-10-03	$569,000	2023-11-08	Undisclosed	3	1	2		730.7	Ray White Wagga Wagga	9-undurra-drive-glenfield-park-nsw-2650
87591	House	2023-10-03	AUCTION (Unless Sold Prior)	2023-11-03	Undisclosed	3	1	1		490.0	Ray White Goulburn	122-faithfull-street-goulburn-nsw-2580
87594	House	2023-10-03	Auction Price Guide $550,000	2023-10-30	$570,000	3	1	3			Ray White Goulburn	6-brownhill-street-goulburn-nsw-2580
87601	House	2023-10-03	$630,000	2024-01-18	$610,000	4	1	1		840.0	LJ Hooker Narooma	23-isabel-street-narooma-nsw-2546
87604	House	2023-10-03	$879,000	2023-11-10	Undisclosed	5	2	2		849.4	Kitson Property	41-kimberley-drive-tatton-nsw-2650
87607	DuplexSemi-detached	2023-10-03	Price Range $780,000 - $820,000	2024-01-15	$800,000	4	2	2		645.0	LJ Hooker Batemans Bay	26-joseph-street-batehaven-nsw-2536
87614	Townhouse	2023-10-03	$742,500	2023-11-07	$742,500	4	2	2	6.0		MARQ Property	7-75-bellhouse-crescent-moncrieff-act-2914
87618	Apartment	2023-10-03	$390,000+	2023-12-04	$395,000	2	1	1	3.0		LJ Hooker Canberra City	65-7-medley-street-chifley-act-2606
87619	House	2023-10-03	$840,000+	2023-12-19	$820,000	3	1	1	0.0	713.0	Southern Property Canberra	27-alawa-street-waramanga-act-2611
87620	House	2023-10-03	$865,000	2023-12-18	Undisclosed	3	2	2		1043.0	Merimbula Realty	156-mirador-drive-mirador-nsw-2548
87622	Lifestyle	2023-10-03	$820,000	2024-02-05	Undisclosed	0	0	0		43.0	Henley Property - Jindabyne	1081-avonside-road-avonside-nsw-2628
87625	House	2023-10-04	$850,000+	2023-11-09	$860,000	3	2	4	3.0	828.0	McCann Properties	132-clift-crescent-richardson-act-2905
87628	House	2023-10-04	$850,000+	2023-10-23	$840,000	3	2	2	4.5	622.0	LJ Hooker Gungahlin	8-loxton-place-dunlop-act-2615
87632	House	2023-10-04	Auction: Sat 21st October 3.00pm	2023-10-21	$1,200,000	4	2	2	4.0	742.0	MARQ Property	4-nankervis-street-casey-act-2913
87636	Townhouse	2023-10-04	Auction	2023-10-11	Undisclosed	1	1	1	6.0		LJ Hooker Canberra City	59-60-kingsland-parade-casey-act-2913
87642	House	2023-10-04	AUCTION	2023-10-28	$1,310,000	5	2	2	2.5	1755.0	McIntyre Property	32-mclarty-court-kambah-act-2902
87647	House	2023-10-04	Auction	2023-10-21	$605,000	3	1	1	3.5	387.0	LJ Hooker Belconnen	9-wardill-close-holt-act-2615
87656	House	2023-10-04	SOLD	2023-10-26	Undisclosed	4	2	2	6.0	555.0	MARQ Property	92-drooka-crescent-crace-act-2911
87657	Villa	2023-10-04	$649,000	2023-10-16	$644,500	3	1	1			Merimbula Realty	2-16-cameron-street-merimbula-nsw-2548
87663	House	2023-10-04	$950,000 - $1,045,000	2023-12-07	$960,000	3	3	2		4048.0	Smile Elite	323a-old-coast-road-korora-nsw-2450
87665	House	2023-10-04	$1,195,000 - $1,295,000	2023-11-13	Undisclosed	6	4	2	0.0		McIntyre Property	24-erskine-loop-googong-nsw-2620
87667	House	2023-10-04	$625,000	2024-02-15	$600,000	2	1	0		657.0	InHouse Real Estate	31-bungo-st-eden-nsw-2551
87669	Apartment	2023-10-04	Auction	2023-10-26	$610,000	2	2	2	4.5		LJ Hooker Belconnen	48-39-benjamin-way-belconnen-act-2617
87673	House	2023-10-04	$315,000	2024-02-28	$310,000	2	1	1		480.5	Flemings Property Services	336-parker-street-cootamundra-nsw-2590
87675	Townhouse	2023-10-04	$609,000+	2023-10-25	$612,000	3	1	1	6.0		LJ Hooker Gungahlin	12-85-macfarlane-burnet-avenue-macgregor-act-2615
87677	Unit	2023-10-04	$679,000	2024-01-18	$679,000	3	2	2			Elders Real Estate Batemans Bay	5-224-beach-road-batehaven-nsw-2536
87687	Townhouse	2023-10-04	Auction	2023-10-21	$570,000	2	1	2	3.5	238.0	LJ Hooker Belconnen	13-gatehouse-place-belconnen-act-2617
87689	House	2023-10-04	$950,000	2023-12-15	$935,000	4	2	2		741.0	Professionals Nowra	11-silvereye-close-south-nowra-nsw-2541
87690	House	2023-10-04	$380,000	2023-11-01	$407,750	4	1	2		638.6	PRD Wagga Wagga	24-mckell-avenue-mount-austin-nsw-2650
87692	House	2023-10-04	$545,000	2023-11-01	Undisclosed	2	1	2		537.5	Ray White Wagga Wagga	9-roma-street-wagga-wagga-nsw-2650
87697	House	2023-10-04	$630,000 +	2023-11-03	$656,800	2	1	1	1.0	463.0	Ray White Canberra	40-wolstenholme-street-chisholm-act-2905
87699	House	2023-10-04	Auction - 25/10/2023	2023-10-25	$1,050,000	4	2	2	3.5	480.3	Ray White Canberra	19-saltbush-street-harrison-act-2914
87702	House	2023-10-04	$1,215,000	2023-10-21	$1,215,000	3	1	1	2.5	809.0	home.by holly	27-aston-crescent-cook-act-2614
87704	Townhouse	2023-10-04	$525,000+	2023-11-03	$550,000	2	1	1	3.5	276.91	Ray White Canberra	12-15-tallon-place-gordon-act-2906
87709	House	2023-10-04	$1,188,000	2023-10-31	Undisclosed	5	3	3		678.0	Smile Elite	3-mount-close-cranebrook-nsw-2749
87711	Apartment	2023-10-04	Contact Agent	2023-11-01	Undisclosed	2	2	2	3.0		MARQ Property	63-8-dominion-circuit-forrest-act-2603
87714	House	2023-10-05	$1,795,000	2023-11-03	Undisclosed	4	2	2	3.0	1157.0	Luton Weston Creek & Molonglo Valley	50-doyle-terrace-chapman-act-2611
87715	House	2023-10-05	Auction	2023-10-28	Undisclosed	4	2	1	4.0	1852.0	Luton Weston Creek & Molonglo Valley	6-guinness-place-chapman-act-2611
87717	House	2023-10-05	Auction	2023-10-25	Undisclosed	3	1	1	4.0	763.0	Luton Weston Creek & Molonglo Valley	5-shore-place-weston-act-2611
87718	Apartment	2023-10-05	$349,999	2023-12-08	Undisclosed	2	1	1	3.5		Luton Weston Creek & Molonglo Valley	26-2-8-corinna-street-lyons-act-2606
87721	House	2023-10-05	$1,895,000	2024-02-29	Undisclosed	5	3	2	3.5	664.0	Luton Manuka	13-glossop-crescent-campbell-act-2612
87724	House	2023-10-05	$1,795,000	2024-01-19	$1,800,000	4	2	2	2.5	747.0	Luton Manuka	41-norman-street-deakin-act-2600
87726	House	2023-10-05	$1,299,000	2023-12-18	Undisclosed	4	2	2	2.5	880.0	Luton Manuka	2-7-broinowski-place-isaacs-act-2607
87727	House	2023-10-05	Offers Over $785,000+.	2023-10-28	Undisclosed	4	2	2	3.0	679.0	Luton Manuka	1-10-champion-place-fraser-act-2615
87728	House	2023-10-05	$775,000	2024-02-13	$762,000	2	1	1	2.0	737.0	Luton Manuka	3-themeda-place-rivett-act-2611
87729	House	2023-10-05	Auction	2023-10-28	$2,520,000	4	2	3	0.0	1498.0	Luton Manuka	8-farrer-street-braddon-act-2612
87732	House	2023-10-05	$1,080,000	2023-12-13	Undisclosed	4	3	2	3.0	881.0	Luton Manuka	29-willoughby-crescent-gilmore-act-2905
87733	House	2023-10-05	Auction	2023-10-28	$1,242,500	3	2	2	5.0	782.0	Luton Dickson	36-padbury-street-downer-act-2602
87734	House	2023-10-05	$949,000 +	2023-11-03	$970,000	4	2	2	1.5	891.0	Luton Manuka	7-muntz-street-chisholm-act-2905
87735	House	2023-10-05	Auction	2023-10-28	$999,000	4	2	2	5.5	706.0	Luton Belconnen	7-oakover-circuit-kaleen-act-2617
87737	Townhouse	2023-10-05	$930,000	2023-10-23	$947,000	4	3	2	6.0	199.0	Luton Gungahlin	34-chanter-terrace-coombs-act-2611
87740	House	2023-10-05	Contact Agent	2023-10-10	Undisclosed	3	1	3		975.5	Ray White Wagga Wagga	40-stinson-street-coolamon-nsw-2701
87741	House	2023-10-05	Auction	2023-10-27	$1,005,000	4	2	3	0.5	828.0	Luton Kippax	16-crofts-crescent-spence-act-2615
87742	House	2023-10-05	Auction	2023-10-30	$1,300,000	4	3	3	1.0	2282.0	Luton Tuggeranong	23-learmonth-drive-kambah-act-2902
87744	House	2023-10-05	$740,000	2023-12-07	$740,000	3	1	2	3.5	797.0	Luton Tuggeranong	9-babinda-place-isabella-plains-act-2905
87745	House	2023-10-05	Auction	2023-10-27	$820,000	3	1	2	0.5	1070.0	Luton Tuggeranong	12-collyburl-crescent-isabella-plains-act-2905
87746	Townhouse	2023-10-05	$583,000	2023-10-30	$583,000	2	2	1			Luton Tuggeranong	3-5-waterloo-street-queanbeyan-east-nsw-2620
87748	House	2023-10-05	$880,000	2023-11-07	$880,000	4	2	4	4.0	1040.0	Luton Tuggeranong	27-turriff-street-chisholm-act-2905
87750	Townhouse	2023-10-05	$658,000	2023-10-24	$658,000	3	2	1	6.0		home.by holly	26-10-charles-perkins-circuit-bonner-act-2914
87755	Apartment	2023-10-05	$465,000	2024-03-05	Undisclosed	2	1	1	6.00		Luton Weston Creek & Molonglo Valley	50-112-mcmichael-terrace-denman-prospect-act-2611
87756	House	2023-10-05	$675,000	2023-11-10	Undisclosed	3	1	1	0.5	796.0	Luton Kippax	14-jauncey-court-charnwood-act-2615
87761	Apartment	2023-10-05	$585,000	2023-11-02	$585,000	2	2	2	5.0		home.by holly	31-8-baudinette-circuit-bruce-act-2617
87762	House	2023-10-05	$742,000	2023-12-05	$742,000	3	1	2	1.0		home.by holly	16-jacobs-street-evatt-act-2617
87763	House	2023-10-05	Auction Guide $799,000+	2023-10-24	$805,000	4	2	2	5.0	235.0	Luton Gungahlin	95-plimsoll-drive-casey-act-2913
87764	House	2023-10-05	Auction	2023-10-28	Undisclosed	3	2	2	5.0	343.0	Luton Gungahlin	18-kowalski-street-casey-act-2913
87765	House	2023-10-05	Auction	2023-10-28	Undisclosed	5	3	3	3.5	1045.0	Luton Gungahlin	6-ryder-place-nicholls-act-2913
87767	House	2023-10-05	Auction	2023-10-28	Undisclosed	4	2	2	4.5		Luton Gungahlin	38-elia-ware-crescent-bonner-act-2914
87768	House	2023-10-05	Auction 29/10/2023	2023-10-19	$980,000	3	2	2	6.0	503.0	Ray White Canberra	36b-gallagher-street-kambah-act-2902
87770	House	2023-10-05	Auction	2023-10-13	$1,142,500	6	3	2	5.0	1113.0	Luton Tuggeranong	6-6a-adinda-street-waramanga-act-2611
87772	House	2023-10-05	Auction 26/10/23	2023-10-26	$740,000	3	1	1	4.0	357.0	Ray White Canberra	13-audrey-cahn-street-macgregor-act-2615
87773	House	2023-10-05	$499,000	2024-01-30	$470,000	3	1	2		556.0	Raine & Horne Goulburn	21-broughton-street-goulburn-nsw-2580
87774	House	2023-10-05	$780,000	2023-11-14	$765,000	4	2	2	4.0	392.0	McIntyre Property	31-opal-street-banks-act-2906
87776	Apartment	2023-10-05	$690,000	2023-11-30	$675,000	2	2	2	6.0		Ray White Canberra	32-20-moore-street-turner-act-2612
87777	House	2023-10-05	$1,245,000	2024-01-11	$1,245,000	3	2	2	1.0	763.0	home.by holly	14-padbury-street-downer-act-2602
87778	House	2023-10-05	$645,000 - $665,000	2023-11-02	$650,000	4	2	2		1320.0	Smile Elite	12-hermitage-place-muswellbrook-nsw-2333
87779	House	2023-10-05	$1,270,000	2023-10-28	$1,270,000	3	1	2	0.5		home.by holly	34-cockle-street-oconnor-act-2602
87780	House	2023-10-05	Auction 26/10/2023	2023-10-26	$1,270,000	5	3	3	1.0	821.0	Ray White Canberra	15-bean-crescent-mckellar-act-2617
87781	House	2023-10-05	Auction 25/10/2023	2023-10-26	$1,050,000	4	2	1	3.0	835.0	Ray White Canberra	3-salmon-place-kambah-act-2902
87782	DuplexSemi-detached	2023-10-05	$650,000+	2024-01-24	$650,000	3	1	1	3.5	897.0	McIntyre Property	2-1-stead-place-banks-act-2906
87787	House	2023-10-05	Auction 28/10/2023	2023-10-28	$962,000	4	2	2	6.0	413.0	Ray White Canberra	35-walter-crocker-crescent-casey-act-2913
87788	House	2023-10-05	$950,000+	2023-12-21	Undisclosed	4	3	2	3.5	702.0	McIntyre Property	4-kenyon-circuit-monash-act-2904
87791	Land	2023-10-05	Guide $300,000-$330,000	2024-02-15	$300,000	0	0	0		891.0	Henley Property - Berridale	100-jindabyne-road-berridale-nsw-2628
87792	Townhouse	2023-10-05	$1,380,000	2023-12-07	$1,380,000	3	2	2	5.0		home.by holly	26-macleay-street-turner-act-2612
87797	House	2023-10-05	$899,000+	2023-11-15	Undisclosed	4	2	2	2.5	1080.0	LJ Hooker Woden/Weston	5-sheaffe-street-holder-act-2611
87798	Apartment	2023-10-05	$599,000+	2023-11-03	$594,000	2	1	1	6.0		Ray White Canberra	16-47-eyre-street-kingston-act-2604
87799	Apartment	2023-10-05	$629,000+	2023-10-20	$630,000	2	2	2	6.0		PURNELL	44-35-chandler-street-belconnen-act-2617
87801	House	2023-10-05	Auction 28/10/23	2023-10-28	$840,000	4	2	2	1.0	796.0	Ray White Canberra	33-alleyne-close-macgregor-act-2615
87804	House	2023-10-05	$1,079,000+	2023-11-10	$1,100,000	4	2	3	5.0	500.0	LJ Hooker Gungahlin	4-djerrkura-street-bonner-act-2914
87807	Villa	2023-10-05	Auction	2023-10-27	$550,000	2	1	1		200.0	Fitzpatricks	106a-tompson-street-wagga-wagga-nsw-2650
87808	House	2023-10-05	Auction: 28/10/2023	2023-10-28	$965,000	4	2	2	4.0	770.0	Ray White Canberra	8-brigden-crescent-theodore-act-2905
87810	House	2023-10-05	Auction 28/10/2023	2023-10-28	$787,000	3	1	1	1.0		Ray White Canberra	9-flowerdale-place-kaleen-act-2617
87813	House	2023-10-05	$799,000+	2023-10-24	$815,000	3	2	1	6.0	332.0	Ray White Canberra	87-carman-loop-macgregor-act-2615
87814	House	2023-10-05	Auction	2023-10-28	$750,000	3	1	2	4.5	778.0	Luton Tuggeranong	8-meares-place-wanniassa-act-2903
87816	House	2023-10-05	$1,250,000	2023-10-04	$1,150,000	4	2	2			Blackshaw Real Estate Coastal	2-hedley-way-broulee-nsw-2537
87823	House	2023-10-05	$919,000	2023-12-19	Undisclosed	4	2	1	0.5	847.0	McIntyre Property	20-chubb-place-latham-act-2615
87825	House	2023-10-05	$699,000	2023-10-25	$695,000	3	1	1			LJ Hooker Batemans Bay	18-kennedy-crescent-denhams-beach-nsw-2536
87833	Apartment	2023-10-05	$740,000	2023-10-26	$740,000	2	2	1	6.0		Ray White Canberra	908-161-emu-bank-belconnen-act-2617
87835	Apartment	2023-10-05	$410,000 - $440,000	2023-12-05	$420,000	2	1	1	4.5	1.72	LJ Hooker Gungahlin	6-54-56-ernest-cavanagh-street-gungahlin-act-2912
87836	House	2023-10-05	Auction 11/11/2023	2023-11-11	$623,000	2	1	1	4.5	457.0	Ray White Canberra	21-gelane-street-ngunnawal-act-2913
87842	House	2023-10-05	$549,000	2023-11-30	$535,000	3	2	1		406.0	Kitson Property	2-clipper-way-estella-nsw-2650
87844	House	2023-10-05	Price Guide $1,050,000	2023-11-08	$1,180,000	4	3	2		271.0	Smile Elite	92-nabthorpe-parade-schofields-nsw-2762
87845	Apartment	2023-10-05	For Sale $590,000 - $610,000	2023-11-09	$582,000	2	2	1			Smile Elite	328-121c-jerralong-drive-schofields-nsw-2762
87847	House	2023-10-05	$995,000	2024-01-18	Undisclosed	4	2	2		635.0	Raine & Horne Mollymook Milton	12-kennedy-crescent-milton-nsw-2538
87848	House	2023-10-06	$560,000	2023-10-18	$556,000	2	2	1	4.0		MARQ Property	1-329-flemington-road-franklin-act-2913
87862	House	2023-10-06	$699,000	2024-01-31	$660,000	3	1	1		955.0	Whale Coast Realty	45-hillcrest-avenue-north-narooma-nsw-2546
87865	Land	2023-10-06	$570,000	2023-11-14	$555,000	0	0	0		1314.0	Ray White Bungendore	17-rosella-place-bungendore-nsw-2621
87866	Apartment	2023-10-06	$561,000	2023-11-06	$561,000	1	1	1	6.0		home.by holly	406-51-mort-street-braddon-act-2612
87870	House	2023-10-06	Contact agent	2023-10-11	Undisclosed	3	1	2		740.0	Smile Elite	7-elizabeth-street-berowra-heights-nsw-2082
87876	House	2023-10-06	$800,000 - $840,000	2023-10-13	$830,000	4	2	2		1231.0	My Agent Team	13-haven-place-batehaven-nsw-2536
87877	House	2023-10-06	Guide $799,000	2024-03-01	$760,000	4	2	2		837.0	Ray White Goulburn	2-quadrant-place-goulburn-nsw-2580
87878	House	2023-10-06	$1,200,000	2023-10-05	$1,200,000	4	3	2		778.0	Blackshaw Real Estate Coastal	28-golf-links-drive-batemans-bay-nsw-2536
87880	Villa	2023-10-06	$495,000	2023-11-06	$495,000	2	2	1			Blackshaw Real Estate Coastal	6-4-eric-fenning-drive-surf-beach-nsw-2536
87883	House	2023-10-06	Auction	2023-10-17	$1,251,000	4	2	4	3.0	1210.0	Timothy Road	71-barnard-circuit-florey-act-2615
87884	Land	2023-10-06	$395,000	2024-02-02	Undisclosed	0	0	0		1080.0	Henley Property - Berridale	6-robert-street-berridale-nsw-2628
87887	Unit	2023-10-06	$515,000	2024-01-09	$487,500	3	1	1		278.0	Fitzpatricks	17-11-crampton-street-wagga-wagga-nsw-2650
87888	House	2023-10-06	Auction Onsite - 28th October at 10am	2023-10-28	$850,000	3	2	2	5.0		Cream Residential	5-malcolm-place-kambah-act-2902
87892	House	2023-10-06	$940,000	2023-10-06	$940,000	4	2	4	2.5	1132.0	MARQ Property	25-merriman-crescent-macarthur-act-2904
87895	Unit	2023-10-06	$629,000	2023-10-05	$629,000	3	2	2			Kitson Property	3-38-stirling-boulevard-tatton-nsw-2650
87896	House	2023-10-06	$320,000	2023-11-16	$320,000	3	1	1		619.0	PRD Wagga Wagga	46-callaghan-street-ashmont-nsw-2650
87908	BlockOfUnits	2023-10-06	$775,000	2024-02-20	$730,000	6	3	3		988.0	PRD Wagga Wagga	1-3-12-dunn-avenue-forest-hill-nsw-2651
87911	House	2023-10-06	For Sale $1,525,000	2024-01-25	$1,462,500	4	2	2		608.0	Ray White Bowral	15-plumb-street-renwick-nsw-2575
87927	House	2023-10-06	$1,060,000	2023-10-26	$1,060,000	4	2	2		556.0	Belle Property Batemans Bay	1-john-street-batehaven-nsw-2536
87929	House	2023-10-06	$1,825,000	2023-10-06	$1,825,000	4	2	2			My Agent Team	31b-beach-road-batemans-bay-nsw-2536
87936	House	2023-10-08	$799,000 - $829,000 Price Guide	2023-10-26	$820,000	3	1	1		903.0	Sails Real Estate	91-golf-circuit-tura-beach-nsw-2548
87949	Apartment	2023-10-09	$640,000 - $670,000	2023-11-13	Undisclosed	2	2	2	5.5		LJ Hooker Manuka	13-2-namatjira-drive-weston-act-2611
87958	House	2023-10-09	Deposit Accepted	2023-12-12	Undisclosed	4	2	2		688.0	Ben Bate Real Estate	14-clarke-street-narooma-nsw-2546
87963	House	2023-10-09	AUCTION - 01/11/23	2023-10-27	$830,000	5	1	1		1030.0	Ian McNamee & Partners - Queanbeyan	2-oneill-street-queanbeyan-nsw-2620
87967	Land	2023-10-09	$135,000	2023-12-05	Undisclosed	0	0	0		1008.0	Flemings Property Services	12-ranken-street-cowra-nsw-2794
87969	Apartment	2023-10-09	$349,000 - $369,000	2024-02-14	$335,000	2	1	1			Merimbula Realty	2-14-fishpen-road-merimbula-nsw-2548
87970	Townhouse	2023-10-09	Contact Agent	2023-10-09	Undisclosed	3	2	2	6.0		MARQ Property	61-forbes-street-turner-act-2612
87976	Apartment	2023-10-09	$440,000+	2023-11-09	$445,000	2	1	1	6.0		LJ Hooker Gungahlin	46-289-flemington-road-franklin-act-2913
87979	Apartment	2023-10-09	Auction	2023-11-04	$2,275,000	3	2	2	6.0		LJ Hooker Canberra City	77-44-constitution-avenue-campbell-act-2612
88006	House	2023-10-09	$765,000	2023-11-02	$765,000	3	1	1		1005.0	Belle Property Braidwood	74-cowper-street-braidwood-nsw-2622
88016	House	2023-10-10	$539,000	2023-11-07	$500,000	3	1	4		835.0	One Agency Wagga Wagga	20-copland-street-kooringal-nsw-2650
88017	Townhouse	2023-10-10	Sold $690,000	2023-11-03	$690,000	2	1	1	6.0	169.0	MARQ Property	30-hibberd-crescent-forde-act-2914
88022	House	2023-10-10	$849,000	2024-02-16	Undisclosed	4	2	4		700.0	Harcourts Greater Port Macquarie & The Rocks	15-rosedale-avenue-south-west-rocks-nsw-2431
88032	House	2023-10-10	$450,000	2024-01-13	Undisclosed	3	1	2		630.0	Harcourts Greater Port Macquarie & The Rocks	23-mitchell-avenue-west-kempsey-nsw-2440
88034	House	2023-10-10	$680,000	2023-10-25	$665,000	4	2	4		1107.0	Harcourts Greater Port Macquarie & The Rocks	29-mitchell-avenue-west-kempsey-nsw-2440
88038	House	2023-10-10	$980,000	2023-10-25	$950,000	3	1	1		651.3	My Agent Team	7-illabunda-drive-malua-bay-nsw-2536
88039	House	2023-10-10	Guide $1,500,000	2023-11-08	$1,480,000	4	3	1		740.0	Ray White Bowral	21-lovelle-street-moss-vale-nsw-2577
88041	DuplexSemi-detached	2023-10-10	$649,000	2023-11-08	$650,000	3	1	1	1.0		McIntyre Property	1-12-penton-place-gilmore-act-2905
88044	House	2023-10-10	$970,000 - $1,020,000	2023-10-27	$990,000	4	2	2		672.0	Ray White Batemans Bay	37-freycinet-drive-sunshine-bay-nsw-2536
88048	House	2023-10-10	$799,000	2024-02-09	Undisclosed	4	2	1		740.0	Kitson Property	9-sunshine-avenue-turvey-park-nsw-2650
88060	House	2023-10-10	Auction on site Saturday 4th November	2023-11-04	$1,565,000	4	3	3		730.0	PRD Wagga Wagga	92-best-street-wagga-wagga-nsw-2650
88065	House	2023-10-10	$765,000+	2023-11-15	$768,000	3	1	2	1.5	1086.0	Ray White Canberra	17-lavery-place-monash-act-2904
88080	House	2023-10-10	$759,000	2023-11-13	Undisclosed	3	2	1		342.0	PRD Wagga Wagga	57-spring-street-wagga-wagga-nsw-2650
88083	Lifestyle	2023-10-10	AUCTION GUIDE $2,500,000 - 3 November	2023-11-03	Undisclosed	5	2	12		100.0	Ray White Goulburn	350-painters-lane-goulburn-nsw-2580
88087	House	2023-10-10	$1,295,000	2023-11-14	$1,285,000	5	2	2		6003.0	PRD Wagga Wagga	3-banksia-place-springvale-nsw-2650
88091	House	2023-10-10	$639,000 - $659,000	2023-12-07	$635,000	4	2	2		752.0	Fitzpatricks	58-jack-avenue-mount-austin-nsw-2650
88098	House	2023-10-10	Sold - $903,000	2023-11-04	$903,000	3	2	2	4.0	442.0	MARQ Property	7-auburn-street-amaroo-act-2914
88101	House	2023-10-11	$639,000	2023-12-06	$620,000	3	2	2		645.0	One Agency Wagga Wagga	16-roberts-way-kooringal-nsw-2650
88105	Apartment	2023-10-11	Auction	2023-10-26	$630,000	1	1	1	6.0		LJ Hooker Canberra City	420-2-grose-street-deakin-act-2600
88109	House	2023-10-11	Auction: Saturday 4th November  9.45am	2023-11-04	$1,225,000	4	2	2	3.5	574.0	MARQ Property	28-nimbera-street-harrison-act-2914
88110	Unit	2023-10-11	Auction	2023-10-13	$338,000	2	1	1	3.0		LJ Hooker Belconnen	22-8-beetaloo-street-hawker-act-2614
88111	House	2023-10-11	Auction	2023-10-16	$760,000	3	2	1	2.5	285.0	LJ Hooker Belconnen	25-dalkin-crescent-casey-act-2913
88112	House	2023-10-11	Auction	2023-11-08	$1,525,000	3	2	1	0.0		LJ Hooker Canberra City	40-booroondara-street-reid-act-2612
88123	Townhouse	2023-10-11	Auction	2023-10-28	$525,000	2	1	1	4.0		LJ Hooker Belconnen	2-14-earle-place-page-act-2614
88125	House	2023-10-11	Auction	2023-10-28	$885,000	4	3	2	1.0	981.0	LJ Hooker Belconnen	115-florey-drive-macgregor-act-2615
88127	Apartment	2023-10-11	$365,000+	2023-10-19	$372,500	1	1	1	6.0		Impact Properties	171-1-anthony-rolfe-avenue-gungahlin-act-2912
88128	Townhouse	2023-10-11	Auction 9/11/2023	2023-11-09	$485,000	2	2	1		0.0	Ward Estate Agents	1-24-booth-street-queanbeyan-nsw-2620
88133	Townhouse	2023-10-11	Auction	2023-11-11	Undisclosed	3	2	2	4.5		LJ Hooker Canberra City	177-50-ellenborough-street-lyneham-act-2602
88134	House	2023-10-11	$780,000	2023-11-03	$772,000	4	2	2		611.0	Professionals Nowra	37-basil-street-south-nowra-nsw-2541
88139	House	2023-10-11	AUCTION: 4/11/2023	2023-11-04	$1,315,000	4	1	4	5.0		Ray White Canberra	9-clisby-close-cook-act-2614
88142	House	2023-10-11	Auction 03/02/2024	2024-02-03	$1,410,000	4	2	2	4.5	1032.0	Ray White Canberra	16-darke-street-torrens-act-2607
88145	Unit	2023-10-11	$458,000+	2023-10-26	$470,000	2	1	1	6.0		MARQ Property	208-48-gungahlin-place-gungahlin-act-2912
88149	AcreageSemi-rural	2023-10-11	$695,000	2023-11-15	$695,000	3	1	2		4867.0	Smile Elite	1387-coramba-road-megan-nsw-2453
88150	Townhouse	2023-10-11	Auction	2023-11-02	Undisclosed	3	2	2	6.0		Luton Gungahlin	4-11-laseron-place-mawson-act-2607
88151	House	2023-10-11	$620,000	2023-11-09	Undisclosed	3	2	1		370.0	LJ Hooker Sussex Inlet	13-ellmoos-avenue-sussex-inlet-nsw-2540
88153	House	2023-10-11	Auction 08/11/2023	2023-11-07	$680,000	3	1	0	2.0	695.0	Ray White Canberra	41-mcdermott-street-kambah-act-2902
88155	Townhouse	2023-10-11	$450,000	2023-10-23	$450,000	1	1	2	6.0		Stone Gungahlin	41-144-flemington-road-harrison-act-2914
88159	Townhouse	2023-10-11	Auction	2023-11-03	$870,000	3	2	2	3.0		Luton Weston Creek & Molonglo Valley	86-215-aspinall-street-watson-act-2602
88178	House	2023-10-11	Auction	2023-11-04	$900,000	3	2	2	4.0		Luton Gungahlin	11-olga-masters-street-franklin-act-2913
88196	Townhouse	2023-10-12	$595,000+	2023-10-27	Undisclosed	2	1	1	1.5	159.0	Luton Weston Creek & Molonglo Valley	24-5-tristania-street-rivett-act-2611
88197	Unit	2023-10-12	$340,000	2024-02-07	$325,000	2	1	1	3.0		Maloney's Property	22-6-wilkins-street-mawson-act-2607
88200	House	2023-10-12	$970,000+	2023-11-13	Undisclosed	4	2	2	4.5		My Morris	60-rosman-circuit-gilmore-act-2905
88201	House	2023-10-12	$1,250,000+	2023-11-15	Undisclosed	4	2	2	4.5		My Morris	14-james-scott-close-kambah-act-2902
88206	House	2023-10-12	Auction	2023-11-04	$1,145,000	4	2	2	1.0	894.0	LJ Hooker Woden/Weston	41-tullaroop-street-duffy-act-2611
88211	House	2023-10-12	$970,000	2023-12-13	$970,000	3	2	1	1.5	1209.0	home.by holly	39-lee-steere-crescent-kambah-act-2902
88214	Unit	2023-10-12	$400,000+	2024-02-23	$400,500	2	1	1	4.5		LJ Hooker Dickson	35-126-thynne-street-bruce-act-2617
88217	House	2023-10-12	$850,000+	2023-11-09	$850,000	4	2	4	0.0	780.0	Ray White Canberra	19-spalding-street-flynn-act-2615
88218	House	2023-10-12	Auction 04/11/23	2023-11-04	Undisclosed	4	3	2	4.0	845.0	Ray White Canberra	30-southwell-street-weetangera-act-2614
88219	House	2023-10-12	$840,000+	2023-11-04	$855,000	4	2	2	1.5	842.0	Ray White Canberra	10-blackwell-circuit-flynn-act-2615
88226	Apartment	2023-10-12	$450,000+	2023-10-25	$467,000	1	1	1	6.0	5075.0	LJ Hooker Dickson	35-15-fox-place-lyneham-act-2602
88228	House	2023-10-12	Auction	2023-11-04	$1,417,500	3	2	0	1.5	677.0	Luton Dickson	66-hannan-crescent-ainslie-act-2602
88230	House	2023-10-12	$785,000 +	2023-12-20	$740,000	3	1	2	4.5	815.0	LJ Hooker Woden/Weston	20-guthridge-crescent-wanniassa-act-2903
88232	House	2023-10-12	Auction: Saturday 4th November, On site at 2:00 PM	2023-10-26	Undisclosed	3	1	1	1.0	751.0	LJ Hooker Manuka	12-coobina-place-fisher-act-2611
88233	House	2023-10-12	$1,950,000+	2024-01-25	$1,940,000	4	2	2	4.5	982.0	LJ Hooker Dickson	12-officer-crescent-ainslie-act-2602
88235	House	2023-10-12	$600,000 - $650,000	2023-11-02	$620,000	5	1	3		575.0	Smile Elite	13-cringila-street-cringila-nsw-2502
88236	Townhouse	2023-10-12	Auction, Sat 4th Nov at 2:30pm	2023-10-27	$820,000	3	2	2	4.0		LJ Hooker Gungahlin	7-22-aroona-court-ngunnawal-act-2913
88237	House	2023-10-12	$1,070,000	2023-11-06	Undisclosed	4	2	2	3.0	733.0	Luton Gungahlin	13-daintree-crescent-kaleen-act-2617
88239	Townhouse	2023-10-12	Auction 04/11/2023	2023-11-02	$1,200,000	3	2	2	4.0	867.5	Ray White Canberra	1-14-walu-street-aranda-act-2614
88241	House	2023-10-12	$1,400,000 +	2023-11-30	$1,390,000	5	2	2	4.5	824.0	Ray White Canberra	16-kulgera-street-hawker-act-2614
88242	House	2023-10-12	Auction 03/11/2023	2023-11-03	$1,475,000	4	2	2	4.5	940.0	Ray White Canberra	82-eucumbene-drive-duffy-act-2611
88244	Townhouse	2023-10-12	$550,000	2023-12-08	$550,000	2	2	1	6.0		home.by holly	54-2-rouseabout-street-lawson-act-2617
88246	Townhouse	2023-10-12	contact agent	2024-02-05	Undisclosed	3	2	2	6.0		home.by holly	3-17-wise-street-braddon-act-2612
88250	House	2023-10-12	$914,000	2023-11-04	$914,000	3	1	2	3.0		home.by holly	6-vickers-crescent-flynn-act-2615
88251	Apartment	2023-10-12	$845,000+	2024-01-10	Undisclosed	3	2	2	6.0		PURNELL	2504-1-grazier-lane-belconnen-act-2617
88254	House	2023-10-12	Auction	2023-10-20	$875,000	4	2	2	4.5	641.0	LJ Hooker Kaleen	4-coolgardie-street-dunlop-act-2615
88255	House	2023-10-12	$975,000 - $1,050,000	2024-01-30	$985,000	4	2	2		678.0	Ray White Canberra	139-barracks-flat-drive-karabar-nsw-2620
88258	Apartment	2023-10-12	$380,000	2023-11-01	$380,000	1	1	1	6.0		home.by holly	10-64-hardwick-crescent-holt-act-2615
88261	Apartment	2023-10-12	Offers Above $469,000	2023-12-12	$486,000	2	1	1	3.5		Cream Residential	16-12-wilkins-street-mawson-act-2607
88262	House	2023-10-12	$1,440,000	2024-02-20	$1,440,000	4	2	2	6.0	584.0	home.by holly	8-jegorow-street-denman-prospect-act-2611
88263	House	2023-10-12	$2,270,000	2023-11-07	$2,270,000	4	2	2	5.0		home.by holly	2-hearn-street-watson-act-2602
88264	Townhouse	2023-10-12	$815,000	2023-10-27	$815,000	3	3	2	5.5		home.by holly	33-215-aspinall-street-watson-act-2602
88265	House	2023-10-12	$980,000	2023-10-17	$980,000	4	2	2	4.5	919.0	home.by holly	44-horsley-crescent-melba-act-2615
88269	House	2023-10-12	Auction	2023-11-08	Undisclosed	7	3	2	4.0	753.0	LJ Hooker Kaleen	15-ebeling-court-nicholls-act-2913
88270	House	2023-10-12	$1,190,000 - $1,240,000	2024-03-01	$1,200,000	4	3	2		742.0	Ward Estate Agents	12-bailey-crescent-googong-nsw-2620
88273	House	2023-10-12	$1,865,000	2023-11-08	$1,865,000	3	2	2	1.5	703.0	home.by holly	68-duffy-street-ainslie-act-2602
88274	Townhouse	2023-10-12	$1,900,000+	2023-12-19	Undisclosed	3	3	4	5.5		VERV Property	3-130-blamey-crescent-campbell-act-2612
88275	Apartment	2023-10-12	contact agent	2023-10-20	Undisclosed	4	3	2	2.0		home.by holly	118-3-london-circuit-city-act-2601
88282	House	2023-10-12	$830,000 - $860,000	2023-10-20	$860,000	4	3	4		651.0	My Agent Team	12-ridge-street-catalina-nsw-2536
88285	House	2023-10-12	$920,000 +	2023-11-08	$935,000	4	2	2	1.0		Ray White Canberra	12-shannon-circuit-kaleen-act-2617
88288	House	2023-10-12	$899,000+	2024-02-13	$870,000	3	2	2	6.0	455.0	LJ Hooker Gungahlin	5-bondfield-street-gungahlin-act-2912
88291	House	2023-10-12	$1,795,000	2024-01-12	Undisclosed	5	2	2	3.5	721.0	Luton Manuka	34a-farrer-street-braddon-act-2612
88294	House	2023-10-12	Auction, Sat 4th Nov at 10:30am	2023-11-04	$1,000,000	4	2	2	4.0	771.0	LJ Hooker Gungahlin	8-gage-place-macgregor-act-2615
88295	House	2023-10-12	$875,000	2023-12-11	Undisclosed	4	2	2		909.0	Fitzpatricks	18-preston-crescent-lloyd-nsw-2650
88308	Apartment	2023-10-12	$720,000	2023-12-18	$720,000	2	2	2	5.0		home.by holly	12-3-gordon-street-city-act-2601
88311	Unit	2023-10-12	$470,000	2023-11-30	$470,000	2	1	1			Merimbula Realty	11-1-monaro-street-merimbula-nsw-2548
88312	House	2023-10-12	Auction	2023-11-03	$1,480,000	5	1	2	3.0	705.0	Luton Dickson	12-bates-street-dickson-act-2602
88313	House	2023-10-12	Auction 04/11/23 at 12:00pm On Site	2023-11-04	Undisclosed	4	1	1	0.5	780.0	Cream Residential	28-leane-street-hughes-act-2605
88317	House	2023-10-13	$1,081,000	2023-10-24	$1,081,000	5	2	3	3.0	530.0	Hugo. Canberra	8-cann-close-palmerston-act-2913
88322	House	2023-10-13	$725,000+	2023-11-30	$726,000	3	1	1	6.0	250.0	Ray White Canberra	10-hinde-street-franklin-act-2913
88324	House	2023-10-13	$850,000+	2023-11-03	$880,000	3	2	2	3.5	978.0	LJ Hooker Tuggeranong	2-mcburney-crescent-richardson-act-2905
88330	Unit	2023-10-13	$319,000	2023-12-13	$320,000	2	1	1		81.0	Macarthur Real Estate Agency	7-69-beckwith-street-wagga-wagga-nsw-2650
88336	House	2023-10-13	Offers Above $899,000	2023-11-30	$900,000	3	2	1	5.5		Cream Residential	20-curtain-place-wanniassa-act-2903
88340	House	2023-10-13	$2,950,000	2023-12-05	$2,850,000	5	2	2	4.5	960.0	Luton Dickson	3-syme-crescent-oconnor-act-2602
88341	Apartment	2023-10-13	$465,000+	2023-11-03	$470,000	2	2	1	6.0		Impact Properties	256-1-anthony-rolfe-avenue-gungahlin-act-2912
88360	Townhouse	2023-10-13	For Sale $910,000 - $940,000	2023-10-27	$932,000	4	2	1			Smile Elite	3-mercy-glade-schofields-nsw-2762
88361	House	2023-10-13	Price Guide $1,170,000	2023-11-06	$1,350,000	4	1	2		473.3	Smile Elite	27-tonkin-crescent-schofields-nsw-2762
88364	Apartment	2023-10-13	For Sale $490,000-$508,000	2023-12-18	$506,500	2	2	1		106.0	Smile Elite	g8-27-rebecca-street-schofields-nsw-2762
88392	House	2023-10-13	Auction	2023-11-01	$876,500	2	1	0	3.5	490.0	Luton Dickson	12-stephen-street-ainslie-act-2602
88402	House	2023-10-13	$1,045,000	2023-11-09	$1,045,000	3	1	1	1.0	664.0	home.by holly	4-williams-street-watson-act-2602
88403	Other	2023-10-13	$715,000	2024-02-16	$715,000	0	0	0		7.51	LJ Hooker Queanbeyan – Jerrabomberra – Googong	155-captain-robertson-drive-burra-nsw-2620
88406	House	2023-10-13	Contact agent	2023-10-13	$690,000	4	2	2		881.1	Ray White Goulburn	13-crestwood-drive-goulburn-nsw-2580
88409	Land	2023-10-13	$450,000	2024-01-19	$440,000	0	0	0		1170.83	Ray White Batemans Bay	19-caswell-street-moruya-nsw-2537
88413	House	2023-10-13	$645,000	2023-11-14	$645,000	3	1	2		1012.0	Ray White Batemans Bay	48-evans-street-moruya-nsw-2537
88416	House	2023-10-13	$950,000	2023-12-15	$950,000	4	2	2		740.0	Smile Elite	163-paterson-road-bolwarra-nsw-2320
88419	House	2023-10-13	$1,145,000 - By Negotiation - Vicinity Of	2023-12-18	$1,145,000	3	2	3		1028.0	Marshall and Tacheci Real Estate	14-narira-street-bermagui-nsw-2546
88420	House	2023-10-14	$795,000	2023-12-05	$785,000	4	2	2		689.0	One Agency Wagga Wagga	11-chang-avenue-lloyd-nsw-2650
88421	House	2023-10-14	$775,000 - $795,000	2023-11-07	$765,000	4	2	4		947.0	One Agency Wagga Wagga	27-missouri-avenue-tolland-nsw-2650
88422	House	2023-10-14	$650,000 - $680,000	2023-11-16	$680,000	4	3	1		860.0	Smile Elite	9-mendos-place-parkes-nsw-2870
88425	House	2023-10-15	$789,000	2023-12-20	$770,000	3	1	1		657.0	Hallmark Real Estate Advisors	14-pleasant-place-tuross-head-nsw-2537
88426	House	2023-10-15	$899,000	2023-11-08	$886,000	3	2	2		973.0	Hallmark Real Estate Advisors	5-beatty-crescent-tuross-head-nsw-2537
88435	House	2023-10-16	$769,000	2024-02-01	$740,000	2	2	2		879.0	LJ Hooker Tuross Head	8-jutland-avenue-tuross-head-nsw-2537
88437	House	2023-10-16	AUCTION (Unless Sold Prior)	2023-11-06	Undisclosed	4	1	2		2024.0	Ray White Goulburn	40-emma-street-goulburn-nsw-2580
88454	Villa	2023-10-16	$670,000	2023-12-04	$670,000	3	2	2		464.0	Macarthur Real Estate Agency	2-246-muttama-parade-gobbagombalin-nsw-2650
88459	House	2023-10-16	$1,800,000 - $1,980,000	2023-11-30	Undisclosed	3	2	2		828.3	LJ Hooker Sussex Inlet	86-collier-drive-cudmirrah-nsw-2540
88460	House	2023-10-16	$650,000	2023-11-14	$620,000	2	1	1		531.0	Whale Coast Realty	22-ernest-street-dalmeny-nsw-2546
88480	Unit	2023-10-16	$600,000 - $650,000 Price Guide	2023-11-14	$635,000	3	1	1			Sails Real Estate	3-16-cameron-street-merimbula-nsw-2548
88485	House	2023-10-16	$919,000	2023-11-30	$915,000	4	2	2	3.0	786.0	McIntyre Property	8-mccarten-place-gordon-act-2906
88487	House	2023-10-16	$675,000	2024-01-10	$630,000	4	2	2		699.6	Macarthur Real Estate Agency	44-kaldari-crescent-glenfield-park-nsw-2650
88489	House	2023-10-16	$500,000	2024-03-05	$500,000	4	1	3		803.0	Flemings Property Services	17-inala-place-cootamundra-nsw-2590
88490	House	2023-10-16	$740,000+	2023-11-03	$730,000	3	2	4	0.5		McIntyre Property	19-baynton-street-richardson-act-2905
88492	House	2023-10-16	$650,000	2024-01-31	$630,000	4	2	0		2156.0	Henley Property - Cooma	44-walker-street-bredbo-nsw-2626
88496	House	2023-10-16	Guide $1,090,000 to $1,120,000	2023-12-01	$1,090,000	4	2	3		816.0	Henley Property - Jindabyne	7-kunama-drive-east-jindabyne-nsw-2627
88497	House	2023-10-16	Property Launch	2023-12-07	$620,000	4	2	2		739.8	Smile Elite	4-mill-street-parkes-nsw-2870
88502	House	2023-10-17	$1,200,000	2023-12-18	$1,165,000	3	2	2		995.0	Sails Real Estate	73-the-crest-merimbula-nsw-2548
88509	House	2023-10-17	$799,000	2024-02-15	$780,000	4	2	2		850.0	Smile Elite	32-mooney-valley-place-west-bathurst-nsw-2795
88512	House	2023-10-17	$620,000	2023-12-05	$620,000	2	1	2			LJ Hooker Queanbeyan – Jerrabomberra – Googong	17-buttle-street-queanbeyan-east-nsw-2620
88515	Apartment	2023-10-17	$399,000+	2023-11-09	$407,500	1	1	1	6.0		Raine & Horne Queanbeyan | Jerrabomberra	87-311-anketell-street-greenway-act-2900
88516	Lifestyle	2023-10-17	$1,350,000	2024-01-25	$1,330,000	4	2	4		20.73	Belle Property Braidwood	147-brick-kiln-lane-braidwood-nsw-2622
88518	House	2023-10-17	$495,000 - $510,000	2023-12-08	$480,000	3	1	1		766.4	Smile Elite	40-sowerby-street-muswellbrook-nsw-2333
88521	House	2023-10-17	Onsite Auction	2023-11-11	$810,000	3	2	2		650.0	Ray White Queanbeyan | Jerrabomberra	25-bilkurra-street-queanbeyan-west-nsw-2620
88533	House	2023-10-17	$790,000	2024-02-16	$747,225	4	2	0		751.0	Henley Property - Cooma	5-stratos-place-cooma-nsw-2630
88535	House	2023-10-17	$459,000	2023-12-01	$455,000	3	1	4		561.0	Kitson Property	21-oconnor-street-tolland-nsw-2650
88540	House	2023-10-17	Auction 12/11/2023	2023-10-26	$800,000	4	2	2		749.0	Ward Estate Agents	61-barracks-flat-drive-queanbeyan-nsw-2620
88547	House	2023-10-17	$745,000	2023-11-10	Undisclosed	4	2	3		599.0	LJ Hooker Sussex Inlet	66-tradewinds-avenue-sussex-inlet-nsw-2540
88571	Land	2023-10-17	$500,000 to $530,000	2023-10-17	$500,000	0	0	0		1005.0	Sails Real Estate	24-jacaranda-place-merimbula-nsw-2548
88573	Townhouse	2023-10-17	$579,000	2024-02-14	$565,000	3	2	1		415.0	Raine & Horne Goulburn	2-25-kidd-circuit-goulburn-nsw-2580
88577	House	2023-10-17	$1,295,000	2023-12-16	$1,265,000	4	2	3		636.0	Whale Coast Realty	49-warbler-crescent-north-narooma-nsw-2546
88579	House	2023-10-17	$1,295,000-$1,395,000	2024-02-14	$1,280,000	4	1	4		6.53	Ray White Bungendore	31-bernallah-close-carwoola-nsw-2620
88582	House	2023-10-18	$1,025,000	2023-12-05	Undisclosed	4	2	2	6.0	405.0	LJ Hooker Belconnen	25-marjorie-matthews-street-taylor-act-2913
88584	House	2023-10-18	Auction	2023-11-04	$711,000	3	1	1	5.5	450.0	LJ Hooker Belconnen	65-bryan-hudson-street-macgregor-act-2615
88586	House	2023-10-18	Auction	2023-11-04	$750,000	3	2	2	2.0	440.0	LJ Hooker Belconnen	53-traeger-street-dunlop-act-2615
88588	House	2023-10-18	$265,000	2023-12-19	$265,000	3	1	0			One Agency Craig Schofield	15-wellington-street-bombala-nsw-2632
88590	Apartment	2023-10-18	Auction 08/11/2023	2023-10-30	$210,000	1	1	1	6.0		Ray White Canberra	5-30-river-street-oaks-estate-act-2620
88595	Land	2023-10-18	$900,000 - $950,000	2023-12-06	$850,000	0	0	0		4851.0	Bella Coastal Property	36-voyager-crescent-bawley-point-nsw-2539
88597	House	2023-10-18	Auction Saturday 11 November 2023, 10am On Site	2023-12-07	Undisclosed	6	4	2	4.0	626.0	Morrissey Property	16-joe-croft-street-bonner-act-2914
88603	House	2023-10-18	Auction	2023-10-31	Undisclosed	3	2	0	0.5	565.0	Luton Manuka	49-newdegate-street-deakin-act-2600
88606	House	2023-10-18	Sold Prior to Auction-$950,000	2023-11-10	$950,000	4	2	2	5.5	464.0	Stone Gungahlin	23-bindugan-crescent-ngunnawal-act-2913
88607	Unit	2023-10-18	$522,500	2023-12-08	$522,500	3	2	2	3.5		home.by holly	65-20-federal-highway-watson-act-2602
88608	House	2023-10-18	Auction 07/11/2023	2023-11-07	$688,000	3	1	4	1.5	688.0	Ray White Canberra	7-amos-place-kambah-act-2902
88612	House	2023-10-18	$669,000	2023-10-17	$669,000	3	2	1			Ray White Goulburn	1-14-mundy-street-goulburn-nsw-2580
88613	House	2023-10-18	Sold Prior to Auction	2023-11-16	$670,000	3	2	1		827.9	Ray White Batemans Bay	7-headland-grove-moruya-heads-nsw-2537
88614	House	2023-10-18	$1,350,000 - $1,450,000	2024-02-22	$1,305,000	4	2	2		613.0	Ward Estate Agents	10-styles-street-googong-nsw-2620
88615	House	2023-10-18	AUCTION	2023-11-10	Undisclosed	3	1	2		619.0	The Property Collective	26-bendora-avenue-queanbeyan-nsw-2620
88618	House	2023-10-18	$290,000 - $310,000	2024-02-23	$275,000	4	1	1			Smile Elite	208-sandon-street-south-guyra-nsw-2365
88623	House	2023-10-18	$930,000 +	2023-11-14	Undisclosed	4	2	2	1.5	885.0	Ray White Canberra	1-davis-street-weetangera-act-2614
88624	Townhouse	2023-10-18	Auction on the 4/11/2023 at 12:00pm	2023-11-03	$715,000	3	2	2	4.5		Stone Gungahlin	7-77-freda-bennett-circuit-nicholls-act-2913
88625	Apartment	2023-10-18	$630,000 Plus	2024-03-01	$612,000	2	2	1	6.0		Maloney's Property	109-72-wentworth-avenue-kingston-act-2604
88626	House	2023-10-18	$640,000 - $660,000	2023-11-09	$660,000	4	2	2		681.6	PRD Wagga Wagga	1-eucalypt-street-forest-hill-nsw-2651
88629	House	2023-10-18	Price By Negotiation	2023-12-15	Undisclosed	3	2	3		684.0	Raine & Horne Mollymook Milton	211-green-street-ulladulla-nsw-2539
88630	House	2023-10-18	Contact Agent	2024-01-25	Undisclosed	5	2	1	3.0	775.0	home.by holly	103-atherton-street-downer-act-2602
88632	House	2023-10-18	$925,000	2023-12-06	Undisclosed	4	2	2	1.5	812.0	Ray White Canberra	13-fuhrman-street-evatt-act-2617
88633	House	2023-10-18	$779,000	2023-12-01	$740,000	4	2	2		705.0	PRD Wagga Wagga	81-jumbuck-drive-gobbagombalin-nsw-2650
88638	House	2023-10-18	Auction 11/11/2023	2023-11-11	$841,000	3	2	2	5.5	703.0	Ray White Canberra	4-15-rainbow-place-latham-act-2615
88645	Unit	2023-10-18	$599,000	2024-03-05	Undisclosed	2	1	1			Belle Property Batemans Bay	3-2-4-newth-place-surf-beach-nsw-2536
88646	House	2023-10-18	$650,000	2024-02-12	$625,000	3	1	4		1285.0	McGrath Batemans Bay & Moruya	37-bergalia-street-moruya-nsw-2537
88648	House	2023-10-18	$400,000 - $420,000	2023-12-05	$410,000	3	2	2		506.0	McIntyre Property	6-willow-road-captains-flat-nsw-2623
88664	Apartment	2023-10-18	$615,000	2023-11-02	$615,000	3	2	2	4.0		MARQ Property	8-15-bill-ferguson-circuit-bonner-act-2914
88668	House	2023-10-19	$870,000 - $920,000	2024-02-15	$890,000	5	2	2		1119.0	One Agency Wagga Wagga	55-kimberley-drive-tatton-nsw-2650
88669	House	2023-10-19	$599,000 - $629,000	2023-11-13	$620,000	3	1	1		784.0	One Agency Wagga Wagga	25-croaker-street-turvey-park-nsw-2650
88671	Unit	2023-10-19	$379,000	2024-01-19	Undisclosed	2	1	1	0.0		Luton Manuka	18-6-wilkins-street-mawson-act-2607
88673	House	2023-10-19	Auction	2023-10-31	Undisclosed	4	2	2	5.5	474.0	Luton Weston Creek & Molonglo Valley	9-reveley-crescent-stirling-act-2611
88675	House	2023-10-19	Auction	2023-11-14	Undisclosed	4	1	0	1.0	836.0	Luton Manuka	45-scrivener-street-oconnor-act-2602
88678	House	2023-10-19	Auction, Fri 3rd Nov at 6pm	2023-11-03	$880,000	3	2	2	6.0	420.0	LJ Hooker Gungahlin	3-munjuwa-street-ngunnawal-act-2913
88680	Apartment	2023-10-19	$475,000	2023-11-08	$475,000	2	1	1	4.5		home.by holly	2-22-discovery-street-red-hill-act-2603
88681	House	2023-10-19	$1,216,000	2023-11-11	$1,216,000	3	1	0	1.0	700.0	home.by holly	6-gillies-street-curtin-act-2605
88684	House	2023-10-19	$840,000	2023-10-25	$840,000	3	1	1	1.0		home.by holly	143-ross-smith-crescent-scullin-act-2614
88686	Apartment	2023-10-19	$575,000+	2024-02-10	$560,000	2	1	1	6.0		LJ Hooker Dickson	71-109-canberra-avenue-griffith-act-2603
88688	House	2023-10-19	Auction 9/11/23	2023-11-09	$830,000	3	2	2	2.5	765.0	Ray White Canberra	3-cussen-street-higgins-act-2615
88689	House	2023-10-19	Auction 9/11/23	2023-11-09	$1,080,000	4	2	0	0.0	1167.0	Ray White Canberra	4-mayo-street-weetangera-act-2614
88690	House	2023-10-19	$1,100,000 +	2023-12-11	$1,170,000	6	3	3	1.0	1322.0	Ray White Canberra	6-andado-place-hawker-act-2614
88692	House	2023-10-19	$995,000	2023-12-20	$980,000	4	3	4		556.0	Bella Coastal Property	32-kurrajong-crescent-conjola-park-nsw-2539
88695	House	2023-10-19	Auction	2023-11-04	$690,000	3	1	1	4.0	403.0	LJ Hooker Belconnen	6-bimbiang-crescent-ngunnawal-act-2913
88696	House	2023-10-19	Auction 15/11/2023	2023-11-16	$923,000	4	2	2	5.0	941.0	Ray White Canberra	42-harry-hopman-circuit-gordon-act-2906
88698	House	2023-10-19	Price Guide $1,590,000 - $1,690,000	2023-11-10	Undisclosed	5	2	2		457.0	Smile Elite	60-sundowner-parkway-the-gables-box-hill-nsw-2765
88699	House	2023-10-19	Auction 12/11/2023	2023-11-12	$806,000	3	1	1		1113.0	Ward Estate Agents	39-early-street-queanbeyan-nsw-2620
88701	DuplexSemi-detached	2023-10-19	$960,000+	2024-01-15	$965,000	3	1	1	1.5	587.0	LJ Hooker Dickson	37-atherton-street-downer-act-2602
88702	House	2023-10-19	AUCTION 11/11/2023	2023-11-11	$1,207,000	4	2	3	3.5		Ray White Canberra	15-withnell-circuit-kambah-act-2902
88703	House	2023-10-19	AUCTION 11/11/2023	2023-11-11	$1,155,000	4	3	4	3.0		Ray White Canberra	18-stapylton-street-holder-act-2611
88707	Townhouse	2023-10-19	$890,000+	2023-12-07	$897,000	4	3	2	5.0	325.0	LJ Hooker Gungahlin	332-anthony-rolfe-avenue-gungahlin-act-2912
88718	House	2023-10-19	$990,000	2023-12-19	$985,000	3	2	2		4.65	Belle Property Batemans Bay	13-clyde-view-drive-long-beach-nsw-2536
88719	House	2023-10-19	By Negotiation	2024-01-25	Undisclosed	3	1	1	3.0	306.0	LJ Hooker Kippax	2-80-britten-jones-drive-holt-act-2615
88721	House	2023-10-19	$995,000+	2024-01-24	$998,000	4	2	2	2.0		Ray White Canberra	90-darwinia-terrace-chapman-act-2611
88735	Apartment	2023-10-19	$350,000+	2023-11-02	$370,000	2	1	1	6.0		Ray White Canberra	6-21-mcginness-street-scullin-act-2614
88740	Townhouse	2023-10-19	$610,000+	2024-03-05	$595,000	3	1	2	1.50		McIntyre Property	22-3-peron-place-banks-act-2906
88743	House	2023-10-19	$699,000	2023-11-14	$695,000	4	2	2		701.9	Fitzpatricks	19-tinga-crescent-kooringal-nsw-2650
88748	House	2023-10-19	contact agent	2023-12-11	Undisclosed	6	2	1	2.5	909.0	home.by holly	264-duffy-street-ainslie-act-2602
88750	House	2023-10-19	$675,000+	2023-11-08	$740,000	2	1	1	1.0	405.0	LJ Hooker Kippax	93-dexter-street-cook-act-2614
88752	Other	2023-10-19	$1,000,000	2024-02-07	Undisclosed	0	0	0	0.0	0.0	Capital Plus 1 Real Estate	woodbury-drive-sutton-nsw-2620
88756	Land	2023-10-19	$800,000 to $850,000	2023-11-10	$825,000	0	0	0		4.2	Blackshaw Real Estate Coastal	85-yarragee-road-moruya-nsw-2537
88759	House	2023-10-19	Auction onsite	2023-11-04	Undisclosed	5	3	2	2.0	865.0	MARQ Property	22-nulsen-circuit-flynn-act-2615
88761	House	2023-10-19	$900,000	2024-01-18	$900,000	4	2	2		618.0	Blackshaw Real Estate Coastal	30-bellbird-drive-malua-bay-nsw-2536
88765	House	2023-10-19	Auction, Sat 11th Nov at 11:30am	2023-11-11	$1,020,000	4	2	2	4.0	683.0	LJ Hooker Gungahlin	29-ironside-street-weston-act-2611
88766	House	2023-10-19	Auction	2023-11-11	$1,621,000	4	2	2	5.0	825.0	Luton Dickson	96-melba-place-downer-act-2602
88768	House	2023-10-19	Price By Negotiation	2023-12-18	Undisclosed	3	1	1		669.0	Raine & Horne Mollymook Milton	11-nelson-drive-ulladulla-nsw-2539
88773	Townhouse	2023-10-19	Auction	2023-11-03	$655,000	3	2	2	4.5	142.0	LJ Hooker Kippax	2-66-68-paul-coe-crescent-ngunnawal-act-2913
88774	House	2023-10-19	$781,000	2024-02-09	$781,000	3	2	2	5.0		home.by holly	34-melomys-circuit-throsby-act-2914
88776	BlockOfUnits	2023-10-19	Auction 1 December 10am	2023-12-01	$1,400,000	11	10	11		2164.0	Whale Coast Realty	13-17-mort-avenue-dalmeny-nsw-2546
88783	House	2023-10-19	Auction	2023-11-11	Undisclosed	3	1	3	2.0	748.0	Luton Dickson	81-melba-street-downer-act-2602
88791	House	2023-10-19	$745,000	2023-11-06	$745,000	1	1	0		10300.0	Tathra Beach Real Estate	151-bournda-park-way-wallagoot-nsw-2550
88795	House	2023-10-20	Auction 11/11/23 at 10:00am On Site	2023-11-03	$1,450,000	4	2	2	1.5	985.0	Cream Residential	11-colvin-street-hughes-act-2605
88799	Townhouse	2023-10-20	Auction	2023-11-03	$560,000	2	1	1	3.5	214.0	LJ Hooker Dickson	39-46-paul-coe-crescent-ngunnawal-act-2913
88803	House	2023-10-20	$420,000	2024-01-25	$410,000	4	1	1		815.7	Macarthur Real Estate Agency	190-ashmont-avenue-ashmont-nsw-2650
88808	House	2023-10-20	Auction	2023-11-11	Undisclosed	3	1	2	5.0	464.0	Luton Gungahlin	6-mundang-crescent-ngunnawal-act-2913
88809	House	2023-10-20	$659,000	2024-03-06	$640,000	4	2	2		775.9	Macarthur Real Estate Agency	72-mima-street-glenfield-park-nsw-2650
88818	House	2023-10-20	Auction	2023-11-11	$841,000	3	2	2	2.0	745.0	Luton Tuggeranong	10-gunning-place-kambah-act-2902
88820	House	2023-10-20	$690,000	2023-12-01	$665,000	4	2	2		1075.0	Smile Elite	28-chivers-circuit-muswellbrook-nsw-2333
88822	House	2023-10-20	$740,000 - $770,000	2024-01-29	$750,000	4	2	2		501.0	Smile Elite	23-connelly-drive-kelso-nsw-2795
88827	House	2023-10-20	$1,700,000 - $1,850,000	2023-11-16	$1,825,000	4	2	7		5.6	My Agent Team	99-worthy-drive-malua-bay-nsw-2536
88833	House	2023-10-20	Contact Agent	2023-10-20	$640,000	4	1	1			Ray White Goulburn	69-fitzroy-street-goulburn-nsw-2580
88846	House	2023-10-20	$1,250,000	2023-11-10	$1,200,000	4	2	3			John Mooney Real Estate	1-featherwood-road-springvale-nsw-2650
88848	Villa	2023-10-20	$575,000	2024-01-09	$565,000	2	1	1			Merimbula Realty	1-5-monaro-street-pambula-nsw-2549
88850	House	2023-10-20	$799,000	2023-11-13	$799,000	3	2	2		688.0	Dwyer Properties Sapphire Coast	1-andes-place-tura-beach-nsw-2548
88855	House	2023-10-20	AUCTION THIS SUNDAY 2:30 PM - Price Guide $880,000	2023-11-13	$987,500	3	2	1		275.1	Smile Elite	22-annalyse-street-schofields-nsw-2762
88856	House	2023-10-20	Contact Agent	2023-12-20	$1,165,000	4	2	1		347.4	Smile Elite	2-arcadia-street-schofields-nsw-2762
88858	House	2023-10-20	AUCTION THIS SUNDAY 12 PM - Price Guide $1,425,000	2023-11-13	$1,625,000	5	3	2		416.0	Smile Elite	20-vopi-street-schofields-nsw-2762
88860	House	2023-10-20	Sold Prior to Auction	2023-11-06	$1,062,000	3	1	1		328.0	Smile Elite	48-dongola-circuit-schofields-nsw-2762
88861	House	2023-10-20	Price Guide $1,080,000	2023-11-07	$1,200,450	5	3	1		257.0	Smile Elite	162a-sciberras-avenue-schofields-nsw-2762
88872	Land	2023-10-21	Both Lots Under Offer 	2023-12-21	Undisclosed	0	0	0		2000.0	One Agency Craig Schofield	lot-8-9-1-11-chusan-street-bombala-nsw-2632
88881	House	2023-10-22	Price By Negotiation	2023-12-20	Undisclosed	4	2	2		702.0	Raine & Horne Mollymook Milton	37-treetops-crescent-mollymook-beach-nsw-2539
88888	Apartment	2023-10-23	$430,000+	2023-12-04	Undisclosed	2	1	2	6.0	2279.0	LJ Hooker Gungahlin	113-77-gozzard-street-gungahlin-act-2912
88896	House	2023-10-23	$1,899,000 - $2,050,000	2023-11-10	$1,970,000	4	3	2		64.24	Ray White Canberra	294-dairy-creek-road-gundaroo-nsw-2620
88898	Land	2023-10-23	By Negotiation	2024-02-02	Undisclosed	0	0	0		2.26	Elders Murrumbateman	13-vallance-drive-murrumbateman-nsw-2582
88912	House	2023-10-23	AUCTION - 11/11/23	2023-11-10	Undisclosed	4	1	0		1246.0	Ian McNamee & Partners - Queanbeyan	40-munro-road-crestwood-nsw-2620
88924	AcreageSemi-rural	2023-10-23	$4,000,000	2024-01-13	$3,850,000	4	2	6		7.8	Burchell Higgins Property Sales	39-geall-road-cuttagee-nsw-2546
88927	House	2023-10-23	$1,220,000	2023-10-20	$1,220,000	4	2	1		330.0	Smile Elite	35-prairie-street-schofields-nsw-2762
88931	House	2023-10-23	$449,000	2024-03-04	$449,000	3	1	2		671.4	PRD Wagga Wagga	27-karoom-drive-glenfield-park-nsw-2650
88939	House	2023-10-24	NEW PRICE $995,000	2024-02-09	$998,000	3	2	1		911.0	Henley Property - Jindabyne	24-mitchell-circuit-jindabyne-nsw-2627
88940	Unit	2023-10-24	$239,000	2023-11-16	$237,000	2	1	1		94.0	PRD Wagga Wagga	1-42-tichborne-crescent-kooringal-nsw-2650
88946	House	2023-10-24	$1,000,000 - $1,100,000	2024-02-16	$1,035,000	2	1	0		696.0	My Agent Team	75-northcove-road-long-beach-nsw-2536
88957	House	2023-10-24	Preview	2023-11-09	Undisclosed	4	2	2		638.2	Ray White Wagga Wagga	22-barton-avenue-lloyd-nsw-2650
88962	House	2023-10-24	$689,000	2024-01-22	$675,000	3	2	1		705.0	Raine & Horne Goulburn	15-robinson-street-goulburn-nsw-2580
88968	Unit	2023-10-24	$637,000	2023-11-10	$637,000	2	2	1	4.5		home.by holly	36-19-ijong-street-braddon-act-2612
88976	House	2023-10-24	Preview	2023-11-15	Undisclosed	4	2	3		958.0	Ray White Wagga Wagga	115-bradman-drive-boorooma-nsw-2650
88988	House	2023-10-24	$750,000 - $795,000	2024-01-24	$770,000	3	1	5		765.0	Ward Estate Agents	40-lorn-road-queanbeyan-nsw-2620
88995	Unit	2023-10-24	$439,000+	2023-11-30	$428,000	1	1	1	6.0		LJ Hooker Dickson	56-14-hoolihan-street-denman-prospect-act-2611
89007	House	2023-10-25	Auction	2023-10-30	$2,685,000	4	2	2	4.0	725.0	Luton Manuka	3-le-hunte-street-deakin-act-2600
89008	House	2023-10-25	$1,650,000	2023-12-08	Undisclosed	4	3	2	3.0		Luton Gungahlin	53-westbury-circuit-nicholls-act-2913
89010	Unit	2023-10-25	By Negotiation	2023-12-06	Undisclosed	2	2	2	5.5		Luton Weston Creek & Molonglo Valley	2-40-philip-hodgins-street-wright-act-2611
89011	House	2023-10-25	$660,000	2023-11-15	$660,000	2	2	3		556.0	Blackshaw Real Estate Coastal	3-ocean-close-surf-beach-nsw-2536
89012	Townhouse	2023-10-25	Auction	2023-11-02	$650,000	2	1	1	2.5		LJ Hooker Belconnen	17-35-crisp-circuit-bruce-act-2617
89013	House	2023-10-25	Auction	2023-11-11	$730,000	3	2	2	3.0	500.0	LJ Hooker Belconnen	16-westall-place-dunlop-act-2615
89014	House	2023-10-25	$849,000	2023-11-02	$849,000	3	2	2		701.0	My Agent Team	36-carramar-drive-lilli-pilli-nsw-2536
89016	House	2023-10-25	Auction	2023-11-09	$900,000	3	2	2	4.5	420.5	LJ Hooker Canberra City	8-27-temperley-street-nicholls-act-2913
89018	DuplexSemi-detached	2023-10-25	Contact agent	2024-01-30	$940,000	4	2	2			Smile Elite	17a-marine-parade-lake-cathie-nsw-2445
89024	Unit	2023-10-25	$595,000+	2024-02-02	$580,000	2	1	1	5.0		Maloney's Property	25-11-howitt-street-kingston-act-2604
89031	Lifestyle	2023-10-25	$1,200,000	2024-01-09	$1,150,000	4	1	8		14.0	Ray White Braidwood	127-foxs-elbow-braidwood-nsw-2622
89033	House	2023-10-25	$549,000 - $579,000	2023-11-30	Undisclosed	3	1	3		841.0	Ray White Wagga Wagga	14-colong-place-kooringal-nsw-2650
89035	House	2023-10-25	Auction	2023-11-02	$1,125,000	4	2	2	1.5	976.0	Luton Manuka	25-airey-crescent-fadden-act-2904
89036	Land	2023-10-25	$790,000 - $820,000	2023-11-08	$750,000	0	0	0		635.4	My Agent Team	23-oceanview-way-tomakin-nsw-2537
89043	Townhouse	2023-10-25	$550,000+	2023-12-15	$545,000	3	1	1	4.0		McIntyre Property	6-5-harry-hopman-circuit-gordon-act-2906
89044	House	2023-10-25	Auction	2023-11-06	$730,000	3	1	0	4.5	529.0	Luton Gungahlin	6-lark-place-ngunnawal-act-2913
89045	Lifestyle	2023-10-25	$310,000	2023-12-15	$305,000	0	0	0		8.55	One Agency Craig Schofield	1005-yaouk-road-yaouk-nsw-2629
89046	Townhouse	2023-10-25	$679,000	2023-12-08	Undisclosed	3	2	2	4.5	152.0	Luton Gungahlin	9-60-copland-drive-evatt-act-2617
89056	Apartment	2023-10-25	$510,000	2024-02-20	$510,000	2	2	2	6.0		LJ Hooker Gungahlin	7-1-anthony-rolfe-avenue-gungahlin-act-2912
89061	Apartment	2023-10-25	$620,000	2023-12-19	$611,000	2	1	1	5.0		Maloney's Property	38-15-howitt-street-kingston-act-2604
89065	House	2023-10-25	Auction 16/11/23	2023-11-08	$695,000	3	1	2	6.0	199.8	Ray White Canberra	31-chanter-terrace-coombs-act-2611
89067	Apartment	2023-10-25	$589,990	2024-02-23	$568,000	2	2	1	6.0		LJ Hooker Canberra City	107-6-cape-street-dickson-act-2602
89072	House	2023-10-25	$849,000 - $879,000	2023-12-07	Undisclosed	4	2	2		720.0	Ray White Wagga Wagga	75-bradman-drive-boorooma-nsw-2650
89075	House	2023-10-25	Auction	2023-11-11	$745,000	3	2	2	1.0	492.0	LJ Hooker Belconnen	51-mundawari-circuit-ngunnawal-act-2913
89078	House	2023-10-25	$2,000,000	2023-12-18	Undisclosed	5	3	2	5.0	560.0	Altair Property	10-rouseabout-street-lawson-act-2617
89085	Apartment	2023-10-25	$1,995,000	2024-01-16	Undisclosed	3	3	2			Whale Coast Realty	3-89-93-campbell-street-narooma-nsw-2546
89086	Townhouse	2023-10-25	$559,000	2023-10-24	$559,000	2	2	2			LJ Hooker Queanbeyan – Jerrabomberra – Googong	4-161-uriarra-road-queanbeyan-nsw-2620
89104	House	2023-10-25	$619,000	2023-12-13	Undisclosed	3	1	0		935.0	McCann Properties	35-yass-street-gunning-nsw-2581
89114	Apartment	2023-10-26	Contact Agent	2024-02-22	Undisclosed	2	2	1	5.0		Luton Weston Creek & Molonglo Valley	35-34-gosse-street-kingston-act-2604
89117	House	2023-10-26	Auction	2023-11-13	Undisclosed	3	1	2	5.0	984.0	Luton Weston Creek & Molonglo Valley	1-broad-place-kambah-act-2902
89118	Townhouse	2023-10-26	$750,000	2023-11-03	$750,000	3	1	1	3.5		home.by holly	12-hargrave-street-scullin-act-2614
89120	House	2023-10-26	$1,020,000+	2023-12-20	$1,000,000	4	2	2	4.5	747.0	Solely Properties	56-lewis-luxton-avenue-gordon-act-2906
89126	House	2023-10-26	$640,000	2023-12-20	$630,000	3	2	2		333.8	Macarthur Real Estate Agency	4-zara-street-gobbagombalin-nsw-2650
89127	House	2023-10-26	$871,000	2023-12-08	$871,000	3	1	1	3.5		home.by holly	7-munga-place-giralang-act-2617
89136	Townhouse	2023-10-26	Offers Over $630,000	2024-01-12	$631,000	3	2	1	1.0	398.0	McIntyre Property	3-6-beazley-crescent-calwell-act-2905
89142	Unit	2023-10-26	$520,000	2024-01-31	$520,000	2	1	1			Coast Property Group	2-6-fishpen-road-merimbula-nsw-2548
89143	Townhouse	2023-10-26	$595,000+	2024-01-09	$580,000	3	1	1	1.0	329.0	LJ Hooker Tuggeranong	8-15-wyselaskie-circuit-kambah-act-2902
89144	Apartment	2023-10-26	$619,000+	2023-11-16	Undisclosed	2	2	2	6.0		LJ Hooker Woden/Weston	307-253-northbourne-avenue-lyneham-act-2602
89148	House	2023-10-26	$520,000 - $540,000	2023-11-03	$520,000	3	1	1		272.0	Smile Elite	83-alexandra-street-kurri-kurri-nsw-2327
89150	Unit	2023-10-26	contact agent	2023-12-12	Undisclosed	2	1	1	5.0		home.by holly	20-8-beetaloo-street-hawker-act-2614
89153	House	2023-10-26	$285,000	2023-10-25	$275,000	3	1	1		1012.0	Kitson Property	10-centenary-avenue-tarcutta-nsw-2652
89158	House	2023-10-26	$680,000 - $710,000	2023-12-08	$695,000	3	1	1		556.0	My Agent Team	19-sunset-street-surfside-nsw-2536
89160	Apartment	2023-10-26	$535,000	2024-01-19	Undisclosed	1	1	1	6.0	3074.0	Morrissey Property	4-29-state-circle-deakin-act-2600
89171	Townhouse	2023-10-26	$720,000+	2023-12-19	$710,000	3	2	2	5.5		Ray White Canberra	21-22-henry-kendall-street-franklin-act-2913
89174	House	2023-10-26	$790,000+	2023-11-13	Undisclosed	3	2	2	4.0		Luton Gungahlin	20-92-casey-crescent-calwell-act-2905
89182	Apartment	2023-10-26	$475,000+	2024-02-06	$480,000	2	1	1	6.0		Impact Properties	14-54-ernest-cavanagh-street-gungahlin-act-2912
89192	House	2023-10-26	$569,000	2023-12-01	$575,000	3	1	2		1027.34	Fitzpatricks	104-meadow-street-kooringal-nsw-2650
89195	House	2023-10-26	Price Guide $590,000 to $645,000	2023-10-25	Undisclosed	2	1	4		518.0	Harcourts Greater Port Macquarie & The Rocks	63-waugh-street-wauchope-nsw-2446
89201	House	2023-10-26	AUCTION - 18/11/23	2023-11-16	Undisclosed	4	2	2		928.0	Ian McNamee & Partners - Queanbeyan	25-brudenell-drive-jerrabomberra-nsw-2619
89204	House	2023-10-26	UNDER OFFER	2023-12-20	Undisclosed	5	2	2		413.0	Smile Elite	26-tinline-street-box-hill-nsw-2765
89209	House	2023-10-26	For Sale $980,000 - $1,000,000	2024-01-31	$972,000	4	2	2		383.3	Smile Elite	7-30-station-street-schofields-nsw-2762
89211	House	2023-10-26	Price Guide $1,150,000	2023-11-15	Undisclosed	5	3	1			Smile Elite	21-max-glade-schofields-nsw-2762
89212	House	2023-10-26	$780,000	2023-12-04	$750,000	4	2	2		518.5	Fitzpatricks	32-kildare-street-turvey-park-nsw-2650
89223	Apartment	2023-10-26	$494,000+	2024-01-15	$494,000	2	2	2	6.0		Impact Properties	921-335-anketell-street-greenway-act-2900
89225	House	2023-10-27	$795,000 - $839,000	2023-12-06	$820,000	5	3	2		1147.0	One Agency Wagga Wagga	26-stellway-close-kooringal-nsw-2650
89226	House	2023-10-27	$930,000 - $980,000	2023-12-06	$940,000	5	2	2		779.0	One Agency Wagga Wagga	22-jumbuck-drive-gobbagombalin-nsw-2650
89228	Townhouse	2023-10-27	$550,000+	2023-11-10	Undisclosed	2	1	1	2.5	156.0	Luton Weston Creek & Molonglo Valley	14-16-damala-street-waramanga-act-2611
89234	Unit	2023-10-27	Offers over $390,000	2023-12-18	Undisclosed	2	1	1	6.0		LJ Hooker Kippax	10-117-redfern-street-macquarie-act-2614
89242	Townhouse	2023-10-27	$1,300,000	2024-03-01	Undisclosed	2	2	2	4.5		Maloney's Property	23-51-musgrave-street-yarralumla-act-2600
89245	House	2023-10-27	Sale by Negotiation	2023-12-19	Undisclosed	4	2	2	0.5	933.0	LJ Hooker Kippax	11-wassell-place-macgregor-act-2615
89257	DuplexSemi-detached	2023-10-27	$1,080,000	2023-12-06	$1,080,000	4	1	2	6.0		home.by holly	266-antill-street-hackett-act-2602
89261	Apartment	2023-10-27	$435,000+	2023-11-03	$445,000	1	1	1	6.0		Ray White Canberra	55-10-ipima-street-braddon-act-2612
89263	House	2023-10-27	$780,000	2023-11-14	Undisclosed	3	1	2	1.0	972.0	The Real Estate Shop	67-smalley-circuit-giralang-act-2617
89270	Unit	2023-10-27	Contact Agent	2024-02-19	$1,200,000	2	1	1			McGoldrick Estate Agents	12-72-owen-street-huskisson-nsw-2540
89271	House	2023-10-27	$725,000	2024-01-16	Undisclosed	4	2	2		556.0	LJ Hooker Sussex Inlet	1-voyager-avenue-sussex-inlet-nsw-2540
89281	Land	2023-10-27	$385,000	2023-10-27	$385,000	0	0	0		701.1	Ray White Goulburn	lot-lot-528-teneriffe-133-mary-mount-road-goulburn-nsw-2580
89282	House	2023-10-27	$680,000	2023-12-12	$655,000	3	1	2		765.1	Fitzpatricks	19-darlow-street-wagga-wagga-nsw-2650
89283	House	2023-10-27	$589,000	2024-02-19	$580,000	2	1	1		765.1	Fitzpatricks	21-darlow-street-wagga-wagga-nsw-2650
89296	DuplexSemi-detached	2023-10-27	$605,000	2024-02-08	$585,000	3	2	1		385.0	Smile Elite	17a-bexhill-avenue-sussex-inlet-nsw-2540
89312	House	2023-10-28	$675,000	2024-02-27	$675,000	2	2	4	0.0	601.0	Lyne Gatty Real Estate	24-beach-street-tuross-head-nsw-2537
89315	House	2023-10-28	$799,000	2024-01-16	Undisclosed	4	2	2		1026.0	Ben Bate Real Estate	18-riley-street-narooma-nsw-2546
89321	House	2023-10-29	$1,474,000	2024-01-19	$1,425,000	3	3	4		4046.0	Marshall and Tacheci Real Estate	88-nutleys-creek-road-bermagui-nsw-2546
89331	House	2023-10-30	$890,000+	2023-12-15	Undisclosed	3	2	2	3.0	654.0	McIntyre Property	20-whiteley-street-conder-act-2906
89342	House	2023-10-30	$675,000	2024-02-13	$650,000	3	1	1			Smile Elite	199-hope-street-bathurst-nsw-2795
89348	Unit	2023-10-30	$215,000	2023-12-18	$205,000	2	1	1		59.0	Macarthur Real Estate Agency	6-187-lake-albert-road-kooringal-nsw-2650
89349	Unit	2023-10-30	$479,000	2024-01-31	$470,000	2	1	1		1053.0	Sails Real Estate	1-19-marine-parade-merimbula-nsw-2548
89357	House	2023-10-30	$900,000-$990,000	2023-11-08	$945,000	4	2	4		556.0	My Agent Team	37-ainslie-parade-tomakin-nsw-2537
89358	House	2023-10-30	$675,000	2023-11-15	$660,000	3	2	1		556.0	My Agent Team	28-vista-avenue-catalina-nsw-2536
89360	House	2023-10-30	$440,000	2023-11-30	$410,000	3	1	1		624.0	Ray White Goulburn	10-caoura-crescent-goulburn-nsw-2580
89361	House	2023-10-30	$749,000	2023-12-15	Undisclosed	4	2	2			Raine & Horne Goulburn	33-wade-street-crookwell-nsw-2583
89388	House	2023-10-30	$1,200,000 - $1,290,000	2024-01-19	$1,200,000	4	2	3		560.0	Ward Estate Agents	20-charlow-street-googong-nsw-2620
89390	House	2023-10-30	Contact Agent	2023-10-30	Undisclosed	4	2	2	4.5	930.0	Stone Gungahlin	23-gadali-crescent-ngunnawal-act-2913
89399	House	2023-10-31	$634,000	2024-01-16	$590,000	3	2	2		928.4	Macarthur Real Estate Agency	8-amsterdam-crescent-tolland-nsw-2650
89403	House	2023-10-31	$440,000	2024-02-26	Undisclosed	3	2	6			Flemings Property Services	50-kite-street-cowra-nsw-2794
89405	House	2023-10-31	By negotiation	2023-10-27	$990,000	4	2	4		1290.0	Ray White Bungendore	9-ellendon-street-bungendore-nsw-2621
89410	DuplexSemi-detached	2023-10-31	Auction 16/11/2023	2023-11-15	$760,000	4	2	2		817.0	Ian McNamee & Partners - Queanbeyan	7-kenneth-place-karabar-nsw-2620
89425	Unit	2023-10-31	$200,000	2023-12-12	$200,000	1	1	1		43.0	LJ Hooker Queanbeyan – Jerrabomberra – Googong	16-39-thurralilly-street-queanbeyan-east-nsw-2620
89430	Lifestyle	2023-10-31	Auction	2023-12-01	$960,000	0	0	0		555.9	Ray White Rural Canberra | Yass	treorchy-lochinvar-rye-park-road-gunning-nsw-2581
89437	House	2023-10-31	AUCTION 19/11/2023	2023-11-07	$1,165,000	4	2	2	1.0	748.0	Ray White Canberra	4-dungowan-street-hawker-act-2614
89439	BlockOfUnits	2023-10-31	$620,000	2024-01-29	$595,000	6	3	0		758.0	Henley Property - Berridale	26-illawong-road-anglers-reach-nsw-2629
89440	House	2023-10-31	By Negotiation	2023-12-08	$800,000	2	2	2		715.0	Bella Coastal Property	18-butler-street-kioloa-nsw-2539
89448	Land	2023-10-31	$2,100,000 - $2,300,000	2024-01-12	Undisclosed	0	0	0		1691.0	My Agent Team	11-knowlman-road-rosedale-nsw-2536
89450	Land	2023-10-31	$385,000	2024-01-30	$385,000	0	0	0		701.1	Ray White Goulburn	lot-lot-517-133-teneriffe-marys-mount-road-goulburn-nsw-2580
89452	Apartment	2023-10-31	$410,000	2023-12-15	$410,000	1	1	1	6.0		Luton Tuggeranong	30-4-thadoona-street-crace-act-2911
89457	House	2023-10-31	$979,000	2024-01-25	$970,000	3	2	3		3503.0	Belle Property Braidwood	71-bombay-road-braidwood-nsw-2622
89469	House	2023-10-31	AUCTION	2023-11-10	Undisclosed	3	2	2	4.0	448.0	Agent Team Belconnen	7-higham-place-dunlop-act-2615
89477	House	2023-10-31	$795,000	2023-12-10	Undisclosed	3	2	1			Luton Gungahlin	15-saltbush-parade-tralee-nsw-2620
89484	DuplexSemi-detached	2023-10-31	$580,000 - $620,000	2024-01-24	$580,000	4	2	1		347.0	Ray White Goulburn	23b-matchless-avenue-goulburn-nsw-2580
89485	House	2023-10-31	$399,000	2023-12-05	Undisclosed	3	1	2		727.0	Ray White Wagga Wagga	23-raye-street-tolland-nsw-2650
89491	House	2023-10-31	$1,300,000	2023-11-13	$1,300,000	5	3	2		689.0	Smile Elite	9-jellore-street-flinders-nsw-2529
89495	House	2023-10-31	$749,000+	2023-12-21	$750,000	3	2	1	6.0	213.0	LJ Hooker Kaleen	38-tarling-street-casey-act-2913
89513	House	2023-11-01	$684,000+	2024-01-22	$695,000	3	2	2	5.5	184.0	Impact Properties	90-bernard-heinze-avenue-moncrieff-act-2914
89515	House	2023-11-01	$945,000	2023-11-06	$945,000	3	2	2	5.0	584.0	home.by holly	14-collicott-circuit-macquarie-act-2614
89519	House	2023-11-01	$698,000	2023-12-19	$665,000	2	2	1			Whale Coast Realty	53a-tatiara-street-dalmeny-nsw-2546
89520	Land	2023-11-01	$470,000	2024-01-05	$455,000	0	0	0		615.0	My Agent Team	68-blairs-road-long-beach-nsw-2536
89525	House	2023-11-01	$870,000	2024-02-08	$850,000	3	2	4		1505.0	LJ Hooker Tuross Head	37-jutland-avenue-tuross-head-nsw-2537
89528	House	2023-11-01	$1,150,000 - $1,250,000	2024-01-25	Undisclosed	4	2	2	6.0	499.0	MARQ Property	3-keach-close-strathnairn-act-2615
89529	House	2023-11-01	$1,035,000+	2023-12-15	Undisclosed	4	2	2	1.0	1116.0	Bastion Property Group	17-purbrick-street-chisholm-act-2905
89542	Unit	2023-11-01	$279,000	2023-11-01	$279,000	2	1	1			LJ Hooker Queanbeyan – Jerrabomberra – Googong	30-5-crest-road-crestwood-nsw-2620
89546	House	2023-11-01	AUCTION Saturday 2nd December at 12pm onsite	2023-12-01	$550,000	2	1	0		575.0	LJ Hooker Batemans Bay	49-bavarde-avenue-batemans-bay-nsw-2536
89548	House	2023-11-01	$1,100,000+	2024-02-15	$1,150,000	5	2	2	2.5	754.0	McIntyre Property	22-kneebone-street-bonython-act-2905
89570	House	2023-11-01	$910,000	2024-01-22	Undisclosed	4	2	2	6.0	317.0	Luton Tuggeranong	6-holford-street-taylor-act-2913
89577	House	2023-11-01	$510,000	2024-01-17	$520,000	3	1	1		518.5	Macarthur Real Estate Agency	31-blamey-street-turvey-park-nsw-2650
89578	Townhouse	2023-11-01	$480,000	2023-12-11	$480,000	2	1	1	6.0		LJ Hooker Belconnen	35-14-grace-munro-crescent-strathnairn-act-2615
89594	Land	2023-11-01	$720,000	2023-12-21	$720,000	0	0	0		1005.0	LJ Hooker Queanbeyan – Jerrabomberra – Googong	2-chimney-rise-googong-nsw-2620
89611	DuplexSemi-detached	2023-11-01	$660,000.00 - $680,000.00	2024-03-05	Undisclosed	4	2	2		330.0	dwell Realty	26b-hogbin-crescent-sanctuary-point-nsw-2540
89612	House	2023-11-02	$425,000	2023-12-05	$427,000	3	1	2		788.0	One Agency Wagga Wagga	7-dunn-avenue-forest-hill-nsw-2651
89614	DuplexSemi-detached	2023-11-02	$799,000	2023-12-18	Undisclosed	3	2	2	1.5	797.0	Luton Weston Creek & Molonglo Valley	12-27-gamor-street-waramanga-act-2611
89618	House	2023-11-02	Price Guide $1,150,000	2024-01-29	$1,150,000	5	4	2			Smile Elite	18-lakeside-parade-jordan-springs-nsw-2747
89621	Townhouse	2023-11-02	$665,000	2023-11-15	$665,000	2	1	1	5.5		home.by holly	18-fairfield-street-crace-act-2911
89626	House	2023-11-02	$710,000+	2023-12-06	$711,000	2	1	2	6.0	390.0	MARQ Property	57-irinyili-street-bonner-act-2914
89627	House	2023-11-02	$1,610,000+	2024-01-25	Undisclosed	4	2	2	4.0	482.0	MARQ Property	16-alan-watt-crescent-casey-act-2913
89628	Apartment	2023-11-02	$515,000+	2024-01-24	$505,000	2	2	1	6.0		LJ Hooker Tuggeranong	909-15-bowes-street-phillip-act-2606
89629	House	2023-11-02	$740,000+	2023-12-07	$768,000	3	2	2	5.0	591.0	Ray White Canberra	50-shrivell-circuit-dunlop-act-2615
89630	House	2023-11-02	Auction 25/11/2023	2023-11-09	$1,165,000	4	3	1	2.0		Ray White Canberra	7-nullagine-street-fisher-act-2611
89633	Townhouse	2023-11-02	AUCTION 03/02/2024	2024-01-24	Undisclosed	3	2	1	4.0		Ray White Canberra	31-14-federal-highway-watson-act-2602
89634	Apartment	2023-11-02	$399,000+	2023-12-18	$418,000	1	1	1	6.0		Ray White Canberra	9-33-moore-street-turner-act-2612
89636	House	2023-11-02	$1,350,000+	2024-02-21	Undisclosed	4	2	2	1.0	1416.0	Ray White Canberra	40-shumack-street-weetangera-act-2614
89645	House	2023-11-02	$890,000 - $930,000	2023-12-01	$930,000	4	2	3		1092.0	Smile Elite	8-quinn-court-llanarth-nsw-2795
89648	House	2023-11-02	$470,000	2024-01-22	$465,000	3	1	2		761.2	Kitson Property	4-darri-street-glenfield-park-nsw-2650
89653	House	2023-11-02	$1,100,000	2023-10-30	Undisclosed	4	2	2			Blackshaw Real Estate Coastal	17-gillan-grove-broulee-nsw-2537
89657	Apartment	2023-11-02	$610,000+	2024-02-07	Undisclosed	2	2	2	6.0		McIntyre Property	14-120-athllon-drive-greenway-act-2900
89663	House	2023-11-02	$1,250,000	2023-12-05	$1,150,000	2	1	1		866.0	Hallmark Real Estate Advisors	12-monash-avenue-tuross-head-nsw-2537
89666	House	2023-11-02	$3,295,000	2023-12-21	Undisclosed	5	3	2	4.5	762.0	Luton Manuka	104-jansz-crescent-griffith-act-2603
89668	House	2023-11-02	$540,000	2024-01-09	$520,000	4	2	1		778.0	Macarthur Real Estate Agency	25-willow-street-kooringal-nsw-2650
89672	Apartment	2023-11-02	$560,000+	2023-12-21	$580,000	2	2	2	6.0		LJ Hooker Canberra City	510-86-88-northbourne-avenue-braddon-act-2612
89678	Apartment	2023-11-02	By Negotiation	2024-01-16	$550,000	2	2	2	6.0		Ray White Canberra	19-36-morell-close-belconnen-act-2617
89679	Apartment	2023-11-02	Offers Above $749,000	2024-02-09	$758,500	2	2	2	6.0		Cream Residential	41-3-gordon-street-canberra-act-2601
89689	House	2023-11-02	Price Guide $2,700,000 - $2,900,000	2023-12-13	Undisclosed	4	3	3		852.0	Sails Real Estate	1-coraki-drive-pambula-beach-nsw-2549
89693	Apartment	2023-11-02	489000	2024-01-30	Undisclosed	1	1	1	6.0		Ray White Canberra	113-45-eastlake-parade-kingston-act-2604
89703	Unit	2023-11-02	$525,000	2024-02-05	$520,000	2	1	1	4.5		Luton Manuka	7-7-tenison-woods-circuit-bonython-act-2905
89715	House	2023-11-02	$850,000	2023-12-12	$850,000	4	1	1	1.5	714.0	home.by holly	22-skardon-street-kaleen-act-2617
89717	Unit	2023-11-02	$335,000	2024-02-27	Undisclosed	2	1	1	2.0	11172.0	Ray White Canberra	36b-60-wattle-street-lyneham-act-2602
89718	House	2023-11-02	$995,000	2024-01-22	$950,000	4	2	2		834.1	Ray White Batemans Bay	9-dr-king-close-moruya-nsw-2537
89721	House	2023-11-02	$1,025,000+	2023-11-30	$1,027,000	4	2	2	4.5	603.0	LJ Hooker Gungahlin	5-cooloola-street-amaroo-act-2914
89722	House	2023-11-02	$1,090,000 +	2023-12-20	$1,060,000	4	2	3	1.5	905.0	LJ Hooker Woden/Weston	75-nangor-street-waramanga-act-2611
89724	House	2023-11-02	Price Guide $1,030,000 - $1,070,000	2023-12-19	$1,012,000	4	2	1		364.0	Smile Elite	18-carbine-street-box-hill-nsw-2765
89725	Apartment	2023-11-02	By Negotiation	2024-01-30	$550,000	2	2	2	5.5		Impact Properties	93-104-henry-kendall-street-franklin-act-2913
89729	Apartment	2023-11-02	$585,000 +	2023-12-06	$575,000	2	2	2	6.0		LJ Hooker Woden/Weston	1210-15-bowes-street-phillip-act-2606
89734	House	2023-11-02	$599,000	2023-12-07	$585,000	4	3	1		645.0	PRD Wagga Wagga	18-sherwood-avenue-kooringal-nsw-2650
89741	House	2023-11-02	For Sale $1,050,000 - $1,150,000	2023-12-18	$1,120,000	4	2	1		289.0	Smile Elite	30a-alex-avenue-schofields-nsw-2762
89743	Apartment	2023-11-02	For Sale $590,000 - $650,000	2023-12-07	$612,000	2	2	1			Smile Elite	108-4b-isla-street-schofields-nsw-2762
89747	House	2023-11-03	$865,000	2023-12-07	$870,000	4	2	2		670.0	One Agency Wagga Wagga	18-bondi-crescent-gobbagombalin-nsw-2650
89748	House	2023-11-03	$975,000	2024-01-22	Undisclosed	4	2	1	4.5	694.0	Luton Weston Creek & Molonglo Valley	53-salsola-street-rivett-act-2611
89757	House	2023-11-03	$600,000 - $640,000	2024-01-22	$610,000	4	2	2		547.3	Fitzpatricks	28-franklin-drive-estella-nsw-2650
89759	DuplexSemi-detached	2023-11-03	$850,000	2024-01-10	$830,000	4	2	1		354.0	Smile Elite	2-23-wollingurry-street-haywards-bay-nsw-2530
89769	Unit	2023-11-03	$410,000+	2023-12-13	Undisclosed	1	1	1	6.0		Luton Gungahlin	85-10-ipima-street-braddon-act-2612
89774	House	2023-11-03	$305,000	2023-12-08	$290,000	3	1	1		594.0	Smile Elite	1-gallop-avenue-parkes-nsw-2870
89783	House	2023-11-03	$720,000	2023-12-01	$725,000	3	1	1	6.0	329.0	The Real Estate Shop	18-bryan-hudson-street-macgregor-act-2615
89784	House	2023-11-03	Auction	2023-12-06	Undisclosed	4	3	4		751.0	Henley Property - Jindabyne	33-townsend-street-jindabyne-nsw-2627
89791	Townhouse	2023-11-03	$785,000	2023-12-07	Undisclosed	4	2	2	5.0		Edge - Luanne Stapleton	8-70-hurtle-avenue-bonython-act-2905
89792	Land	2023-11-03	$980,000	2024-02-20	Undisclosed	0	0	0	0.0	2716.0	Elders Real Estate Batemans Bay	13-15-wharf-street-nelligen-nsw-2536
89795	House	2023-11-03	$950,000-$1,000,000	2023-11-03	$1,025,000	4	3	2		1283.0	My Agent Team	31-village-road-south-durras-nsw-2536
89804	House	2023-11-03	$599,000	2024-01-16	$588,000	4	2	2		1252.0	PRD Wagga Wagga	5-sunvale-crescent-estella-nsw-2650
89810	Unit	2023-11-03	$430,000	2024-01-17	$410,000	2	1	1		1386.0	Professionals Nowra	3-42-lyndhurst-drive-bomaderry-nsw-2541
89818	House	2023-11-03	For Sale $1,190,000 - $1,250,000	2024-01-22	Undisclosed	5	3	2			Smile Elite	57-opah-street-marsden-park-nsw-2765
89834	DuplexSemi-detached	2023-11-03	$673,000	2024-01-09	$660,000	3	2	2		460.0	Ray White Goulburn	66b-kidd-circuit-goulburn-nsw-2580
89836	Townhouse	2023-11-03	$1,850,000+	2023-12-12	Undisclosed	3	2	2	6.0	194.0	VERV Property	1-28-chauvel-street-campbell-act-2612
89839	House	2023-11-03	$1,450,000	2024-01-15	$1,370,000	5	4	3			Ray White Goulburn	133-mary-street-goulburn-nsw-2580
89842	House	2023-11-04	$595,000 - $645,000	2023-12-06	$595,000	3	1	3		902.0	One Agency Wagga Wagga	10-gunyah-place-glenfield-park-nsw-2650
89846	House	2023-11-04	$689,000	2023-12-12	Undisclosed	3	3	2		815.0	Ben Bate Real Estate	7-tatiara-street-dalmeny-nsw-2546
89854	House	2023-11-06	$750,000	2024-02-01	$745,000	3	1	0		2555.0	LJ Hooker Tuross Head	24-26-old-princes-highway-turlinjah-nsw-2537
89861	House	2023-11-06	$800,000	2024-01-16	$775,000	4	2	2		823.5	PRD Wagga Wagga	10-fisher-place-lloyd-nsw-2650
89879	House	2023-11-06	$659,000	2023-12-20	$645,000	3	1	1		601.0	McGrath Batemans Bay & Moruya	52-berrima-parade-surfside-nsw-2536
89880	DuplexSemi-detached	2023-11-06	Auction	2023-12-09	$1,025,000	3	1	0	0.0	586.0	LJ Hooker Woden/Weston	94-macarthur-place-oconnor-act-2602
89884	Unit	2023-11-06	$300,000 - $330,000	2023-12-18	$300,000	2	1	1		64.0	Ray White Queanbeyan | Jerrabomberra	13-67-macquoid-street-queanbeyan-east-nsw-2620
89889	Townhouse	2023-11-06	$410,000	2023-12-19	Undisclosed	3	1	2			Raine & Horne Young	1-13-lachlan-close-young-nsw-2594
89890	House	2023-11-06	$1,085,000	2023-12-01	$1,063,000	5	3	4		992.0	My Agent Team	55-broomfield-crescent-long-beach-nsw-2536
89893	Townhouse	2023-11-06	$585,000	2024-02-14	$565,000	2	1	1			Whale Coast Realty	22-11-payne-street-narooma-nsw-2546
89904	House	2023-11-07	Auction	2023-12-09	$835,100	3	1	1	1.0	764.0	LJ Hooker Woden/Weston	40-devonport-street-lyons-act-2606
89905	Alpine	2023-11-07	$775,000	2024-01-18	$770,000	2	1	2			Henley Property - Jindabyne	18-11-wollondibby-road-crackenback-nsw-2627
89906	House	2023-11-07	Auction	2023-12-12	Undisclosed	3	1	0	3.0	683.0	LJ Hooker Woden/Weston	16-nelumbo-street-rivett-act-2611
89911	Other	2023-11-07	$850,000	2024-01-15	$850,000	0	0	0		47.0	LJ Hooker Queanbeyan – Jerrabomberra – Googong	854-hoskinstown-road-bungendore-nsw-2621
89912	Other	2023-11-07	Contact Agent	2024-01-30	Undisclosed	0	0	0		62.2	LJ Hooker Queanbeyan – Jerrabomberra – Googong	854-hoskinstown-road-bungendore-nsw-2621
89922	Apartment	2023-11-07	Auction	2023-11-30	Undisclosed	1	1	1	6.0		LJ Hooker Canberra City	616-253-northbourne-avenue-lyneham-act-2602
89929	House	2023-11-07	$565,000	2024-02-19	$565,000	3	1	2		696.0	Coast Property Group	19-bullara-street-pambula-nsw-2549
89931	Townhouse	2023-11-07	$600,000	2024-02-23	$590,000	2	2	1	4.5		Luton Manuka	5-11-cavanough-street-phillip-act-2606
89938	House	2023-11-07	By Negotiation	2024-02-06	$805,000	3	1	5		730.0	New Wave Property	6-libra-place-narrawallee-nsw-2539
89945	House	2023-11-07	$495,000 - $540,000	2023-12-12	$530,000	5	2	2		600.7	Fitzpatricks	14-marama-parade-mount-austin-nsw-2650
89952	House	2023-11-07	Auction 02/12/2023	2023-12-02	$752,000	3	1	1	1.5	633.0	Ray White Canberra	6-milford-street-latham-act-2615
89953	House	2023-11-07	$499,000	2024-01-19	$499,000	3	2	2		718.5	Kitson Property	1-japonica-place-forest-hill-nsw-2651
89955	House	2023-11-07	$825,000	2024-02-02	$810,000	5	2	1	4.5	743.89	Ray White Canberra	4-cremorne-place-conder-act-2906
89962	House	2023-11-07	$1,599,000	2024-01-12	$1,706,000	6	3	3		7870.0	Ray White Rural Canberra | Yass	32-south-street-murrumbateman-nsw-2582
89965	House	2023-11-08	$416,000	2024-02-13	Undisclosed	3	1	1		752.5	Ray White Wagga Wagga	288-bourke-street-tolland-nsw-2650
89971	Apartment	2023-11-08	$569,000	2024-01-23	$560,000	2	1	1	6.0		Ray White Canberra	152-264-city-walk-city-act-2601
89973	House	2023-11-08	$519,000	2024-01-18	$529,000	4	2	2		708.7	Macarthur Real Estate Agency	16-kurrajong-avenue-forest-hill-nsw-2651
89979	House	2023-11-08	Contact Agent	2023-12-02	Undisclosed	5	3	2	3.5	980.0	MARQ Property	15-sue-geh-circuit-nicholls-act-2913
89980	House	2023-11-08	$740,000 - $760,000	2024-01-24	$730,000	4	2	2		740.3	PRD Wagga Wagga	42-rainbow-drive-estella-nsw-2650
89991	House	2023-11-08	$200,000	2023-12-15	Undisclosed	3	1	1		1007.0	Flemings Property Services	3-daly-street-cowra-nsw-2794
89998	Land	2023-11-08	$410,000 - $450,000	2024-02-27	$425,000	0	0	0		777.0	Blackshaw Real Estate Coastal	3-corymbia-place-malua-bay-nsw-2536
89999	House	2023-11-08	$790,000+	2024-01-19	$807,000	3	2	2	3.5	683.0	LJ Hooker Tuggeranong	36-moonbi-crescent-isabella-plains-act-2905
90009	House	2023-11-08	Auction	2023-12-02	$1,270,000	4	2	3	1.5	1132.0	LJ Hooker Dickson	2-parkhill-street-pearce-act-2607
90017	Townhouse	2023-11-08	$989,000	2024-01-16	Undisclosed	4	3	2	6.0		Luton Gungahlin	40-edgeworth-parade-coombs-act-2611
90022	Unit	2023-11-08	$480,000 - $510,000	2023-12-08	$525,000	3	1	0		116.59	Fitzpatricks	16-225-tarcutta-street-wagga-wagga-nsw-2650
90025	House	2023-11-08	AUCTION	2023-12-15	$3,300,000	3	1	2		1126.0	Raine & Horne Mollymook Milton	17-surfers-avenue-narrawallee-nsw-2539
90028	House	2023-11-08	Auction 2/12/23 at 10:00am On Site	2023-12-01	$1,430,000	5	2	2	2.0	843.0	Cream Residential	40-lynch-street-hughes-act-2605
90031	House	2023-11-08	Auction	2023-12-02	$1,170,000	5	3	2	2.0	877.0	Luton Dickson	3-beddome-place-florey-act-2615
90032	House	2023-11-08	$569,000+	2023-11-30	$583,000	2	1	2	2.0		Stone Gungahlin	8-3-redcliffe-street-palmerston-act-2913
90036	House	2023-11-08	$699,950	2024-02-05	$690,000	3	1	3	1.5	864.0	McIntyre Property	57-pennington-crescent-calwell-act-2905
90040	Apartment	2023-11-08	Auction	2023-12-02	Undisclosed	3	2	2	6.0		LJ Hooker Canberra City	15-44-constitution-avenue-parkes-act-2600
90047	Townhouse	2023-11-08	Auction	2023-12-02	Undisclosed	3	2	2	6.0		Altair Property	36-21-bakewell-street-coombs-act-2611
90053	House	2023-11-09	$1,199,000	2023-12-21	Undisclosed	4	2	2	5.0	491.0	Luton Weston Creek & Molonglo Valley	23-ulysses-circuit-wright-act-2611
90054	House	2023-11-09	Auction	2023-12-02	Undisclosed	3	2	2	6.0	378.0	Luton Weston Creek & Molonglo Valley	4a-philp-place-curtin-act-2605
90055	Townhouse	2023-11-09	Auction	2023-12-02	Undisclosed	3	2	2	2.5	346.0	Luton Weston Creek & Molonglo Valley	9-123-kelleway-avenue-nicholls-act-2913
90056	Apartment	2023-11-09	$559,000	2024-03-01	$550,000	1	1	1	6.00		Luton Weston Creek & Molonglo Valley	40-30-lonsdale-street-braddon-act-2612
90057	House	2023-11-09	Auction	2023-12-02	$1,270,000	3	1	1	0.5	766.0	Luton Manuka	21-piddington-street-watson-act-2602
90058	House	2023-11-09	Auction	2023-12-04	Undisclosed	2	1	1	2.0	317.0	Luton Manuka	107-macrossan-crescent-latham-act-2615
90060	House	2023-11-09	$1,730,000	2024-02-09	Undisclosed	4	2	2	2.5	533.0	Luton Manuka	28-10-taronga-place-omalley-act-2606
90063	Apartment	2023-11-09	495000	2024-01-24	$495,000	1	1	1	6.0		home.by holly	21-34-dooring-street-dickson-act-2602
90064	House	2023-11-09	Auction 30/11/2023	2023-11-30	$1,013,000	4	2	2	5.0		Ray White Canberra	24-brittlebank-circuit-banks-act-2906
90067	House	2023-11-09	$995,000	2023-11-16	$990,000	3	3	3		14010.0	Whale Coast Realty	68-flying-fox-road-narooma-nsw-2546
90071	Unit	2023-11-09	$520,000	2023-11-08	$520,000	2	1	1			Sails Real Estate	7-4-calendo-court-merimbula-nsw-2548
90073	House	2023-11-09	$749,000	2023-12-12	$705,000	3	3	2		715.0	LJ Hooker Batemans Bay	52-calga-crescent-catalina-nsw-2536
90076	House	2023-11-09	$1,395,000	2024-03-05	$1,350,000	4	2	6		1.31	Ray White Rural Canberra | Yass	11-craig-cl-yass-nsw-2582
90080	House	2023-11-09	$700,000	2024-02-27	$692,500	3	1	2	2.5	547.0	Luton Kippax	32-noakes-court-charnwood-act-2615
90081	House	2023-11-09	$750,000+	2023-12-01	$750,000	3	2	1	1.5		MARQ Property	12-74-britten-jones-drive-holt-act-2615
90083	Townhouse	2023-11-09	Contact Agent	2023-11-06	$1,250,000	4	2	2			Henley Property - Jindabyne	3-30-nettin-circuit-jindabyne-nsw-2627
90085	Apartment	2023-11-09	Offers Over $475,000	2024-01-24	$475,000	2	2	1	6.0		Altair Property	263-325-anketell-street-greenway-act-2900
90087	House	2023-11-09	$1,079,000	2024-01-23	Undisclosed	4	2	1	1.0	733.0	Luton Weston Creek & Molonglo Valley	77-sheaffe-street-holder-act-2611
90102	House	2023-11-09	$2450000	2024-01-24	$2,450,000	4	3	2	3.0	824.0	home.by holly	19a-farrer-street-braddon-act-2612
90103	Apartment	2023-11-09	By Negotiation	2024-02-07	$625,000	2	2	1	6.0		LJ Hooker Canberra City	13-16-bradfield-street-downer-act-2602
90115	House	2023-11-09	Auction - Pre Auction offers considered	2023-12-12	$1,170,001	4	2	2	4.0	442.0	LJ Hooker Woden/Weston	19-ulysses-circuit-wright-act-2611
90118	Apartment	2023-11-09	$480,000+	2024-01-18	$500,000	1	1	1	6.0		LJ Hooker Dickson	19-6-cunningham-street-griffith-act-2603
90119	Apartment	2023-11-09	$393,000	2024-02-15	$393,000	2	1	1	2.0		home.by holly	8-28-frencham-street-downer-act-2602
90123	House	2023-11-09	$875,000	2024-01-17	$825,000	3	2	2		780.0	Bella Coastal Property	14-walpole-avenue-ulladulla-nsw-2539
90131	House	2023-11-09	Auction	2023-12-06	$830,000	3	1	1	0.5	725.0	LJ Hooker Kaleen	66-osullivan-street-higgins-act-2615
90138	House	2023-11-09	$790,000+	2024-01-12	Undisclosed	3	1	2	6.0	948.3	LJ Hooker Dickson	27-boyland-close-spence-act-2615
90139	Unit	2023-11-09	Auction	2023-11-13	$360,000	1	1	1	0.5		LJ Hooker Belconnen	21-41-david-street-oconnor-act-2602
90140	House	2023-11-09	Auction	2023-12-02	Undisclosed	6	3	10	1.5	751.0	LJ Hooker Belconnen	18-powlett-street-kaleen-act-2617
90141	House	2023-11-09	$900,000	2023-12-19	$910,000	4	2	0	2.5	835.0	LJ Hooker Belconnen	24-delegate-street-kaleen-act-2617
90143	House	2023-11-09	$709,000+	2024-02-09	$720,000	3	1	1	5.0	249.0	LJ Hooker Kaleen	11-rolls-street-franklin-act-2913
90144	DuplexSemi-detached	2023-11-09	Auction 6/12/23	2023-12-06	Undisclosed	3	1	1	2.5	512.0	Ray White Canberra	58-hampton-circuit-yarralumla-act-2600
90145	House	2023-11-09	$695,000	2024-02-05	$680,000	3	1	1			Merimbula Realty	4-tura-beach-drive-tura-beach-nsw-2548
90154	House	2023-11-09	Auction	2023-12-07	Undisclosed	4	2	4	2.0	699.0	Luton Manuka	25-kingsbury-street-gowrie-act-2904
90160	House	2023-11-09	$320,000	2024-01-17	$315,000	3	1	2		500.0	Flemings Property Services	151-neill-street-harden-nsw-2587
90161	House	2023-11-09	contact agent	2023-12-11	Undisclosed	4	2	2			home.by holly	45-severne-street-greenleigh-nsw-2620
90167	House	2023-11-09	$969,000	2023-12-06	$965,000	4	2	2		684.0	Jo Jones Property Specialists	18-black-bean-grove-ulladulla-nsw-2539
90169	Unit	2023-11-09	$289,000	2024-01-23	$280,000	1	1	1	4.5		LJ Hooker Belconnen	20-1-gungahlin-place-gungahlin-act-2912
90170	House	2023-11-09	$585,000	2024-02-09	$585,000	3	1	1		575.4	Kitson Property	28-blamey-street-turvey-park-nsw-2650
90177	House	2023-11-09	By Negotiation	2024-01-16	Undisclosed	4	3	2		1300.0	Blackshaw Real Estate Coastal	13-tranquil-bay-place-rosedale-nsw-2536
90178	House	2023-11-09	Price Gude $1,280,000	2023-12-01	$1,470,000	5	2	2		400.0	Smile Elite	8-glory-street-schofields-nsw-2762
90179	House	2023-11-09	SOLD AT AUCTION FOR A NEW ALL TIME SUBURB RECORD	2023-12-03	$2,005,000	5	4	2		538.5	Smile Elite	38-wangolove-street-schofields-nsw-2762
90185	House	2023-11-10	$975,000 Plus	2023-12-05	$975,000	4	2	2	1.0		Maloney's Property	1b-buntine-crescent-isaacs-act-2607
90194	House	2023-11-10	Offers Above $959,000	2023-12-19	$954,000	3	1	2	3.5	353.0	Cream Residential	12-carroll-street-hughes-act-2605
90196	Unit	2023-11-10	By Negotiation	2024-01-08	Undisclosed	2	2	2	6.0	15769.0	Morrissey Property	212-76-steve-irwin-avenue-wright-act-2611
90198	House	2023-11-10	$1,300,000	2023-12-09	Undisclosed	4	3	2	1.0		Berkely Residential	51-monkman-street-chapman-act-2611
90205	House	2023-11-10	$1,375,000	2024-02-22	Undisclosed	3	2	2		1003.0	Dwyer Properties Sapphire Coast	14-shearwater-court-tura-beach-nsw-2548
90206	House	2023-11-10	Auction	2023-12-06	Undisclosed	4	2	2	0.5	861.0	LJ Hooker Kippax	9-millard-place-flynn-act-2615
90212	Apartment	2023-11-10	$310,000+	2023-12-06	$332,000	1	1	1	6.0		LJ Hooker Kippax	813-120-eastern-valley-way-belconnen-act-2617
90213	House	2023-11-10	Guide $975,000	2023-12-07	$925,000	3	2	2		758.8	Ray White Bowral	11-13-meryla-street-robertson-nsw-2577
90220	Unit	2023-11-10	$460,000+	2024-02-12	$469,000	2	1	1	6.0	21899.0	Ray White Canberra	193-60-college-street-belconnen-act-2617
90224	House	2023-11-10	$829,000	2024-01-08	$820,000	3	2	2			My Agent Team	2-239-beach-road-denhams-beach-nsw-2536
90227	House	2023-11-10	Auction 29/11/23	2023-11-30	$1,160,000	4	2	2	4.0		Ray White Canberra	2-maccallum-circuit-florey-act-2615
90230	House	2023-11-10	$359,000	2023-11-09	$345,000	1	1	1			My Agent Team	12-21-peter-crescent-batehaven-nsw-2536
90236	House	2023-11-10	$895,000	2023-11-30	$910,000	4	2	2		1140.0	PRD Wagga Wagga	6-greenway-street-lloyd-nsw-2650
90241	Land	2023-11-10	Contact Frank Barker on 0456 555 422	2024-02-22	Undisclosed	0	0	0		2.0	Raine & Horne Southern Highlands	65a-glenmurray-road-kangaroo-valley-nsw-2577
90242	House	2023-11-10	$739,000	2024-01-26	$730,000	4	2	1		588.1	PRD Wagga Wagga	8-blamey-street-turvey-park-nsw-2650
90243	House	2023-11-10	$1,450,000	2023-12-06	$1,450,000	4	2	6		8.0	Ray White Bungendore	256-radcliffe-circuit-carwoola-nsw-2620
90247	House	2023-11-10	$680,000	2024-02-07	Undisclosed	4	2	3		855.7	Raine & Horne Young	8-hills-street-young-nsw-2594
90252	Land	2023-11-10	$385,000	2023-11-09	$385,000	0	0	0		700.0	Ray White Goulburn	lot-lot-554-teneriffe-133-mary-mount-road-goulburn-nsw-2580
90254	Land	2023-11-10	$385,000	2023-11-09	$385,000	0	0	0		700.8	Ray White Goulburn	lot-604-teneriffe-goulburn-nsw-2580
90255	Land	2023-11-10	$385,000	2023-11-09	$385,000	0	0	0		700.0	Ray White Goulburn	lot-559-c10-teneriffe-goulburn-nsw-2580
90258	Land	2023-11-10	$385,000	2023-11-09	$385,000	0	0	0		700.3	Ray White Goulburn	lot-607-teneriffe-goulburn-nsw-2580
90262	Unit	2023-11-10	$1,200,000 - $1,300,000	2024-01-24	$1,250,000	8	4	4		866.28	Fitzpatricks	1-4-78-docker-street-wagga-wagga-nsw-2650
90264	Land	2023-11-10	$385,000	2023-11-09	$385,000	0	0	0		700.7	Ray White Goulburn	lot-602-teneriffe-goulburn-nsw-2580
90266	House	2023-11-10	$489,000	2023-12-04	Undisclosed	3	1	2		701.9	Ray White Wagga Wagga	16-white-avenue-kooringal-nsw-2650
90283	House	2023-11-13	Auction 8th December	2023-12-05	$650,000	3	2	3		567.0	Ray White Goulburn	52-opal-street-goulburn-nsw-2580
90290	House	2023-11-13	$930,000 - $950,000	2024-03-05	$865,000	3	2	2		705.0	Sails Real Estate	19-john-close-merimbula-nsw-2548
90293	House	2023-11-13	Contact Agent	2024-02-16	Undisclosed	3	3	2		1857.0	Raine & Horne Berry	2-rectory-park-way-kangaroo-valley-nsw-2577
90308	Townhouse	2023-11-13	$505,000	2023-11-10	$505,000	2	1	2			LJ Hooker Queanbeyan – Jerrabomberra – Googong	1-24-bungendore-road-queanbeyan-east-nsw-2620
90324	House	2023-11-13	$690,000 - $720,000	2024-02-05	$705,000	4	2	2		898.0	Smile Elite	4-miller-street-windradyne-nsw-2795
90327	House	2023-11-13	$380,000	2024-03-01	$380,000	2	1	1			Ben Bate Real Estate	l4-easts-narooma-village-narooma-nsw-2546
90332	Townhouse	2023-11-13	$650,000	2024-01-17	Undisclosed	3	1	1	2.0		Sadil Quinlan	46-were-street-calwell-act-2905
90339	Townhouse	2023-11-13	Contact Agent	2024-02-09	Undisclosed	2	1	2			McGoldrick Estate Agents	8-154-fern-street-gerringong-nsw-2534
90341	House	2023-11-13	$750,000 - $790,000	2024-01-17	$730,000	3	2	2		720.0	My Agent Team	6-poole-place-sunshine-bay-nsw-2536
90344	House	2023-11-13	$849,000	2023-12-20	$820,000	4	2	2		700.0	My Agent Team	6-protea-place-catalina-nsw-2536
90351	House	2023-11-13	$640,000 - $670,000	2024-02-05	$630,000	3	1	2		613.0	Smile Elite	113-mitre-street-west-bathurst-nsw-2795
90352	House	2023-11-13	$970,000	2024-01-22	$970,000	4	3	3		562.0	Belle Property Batemans Bay	11-martin-place-broulee-nsw-2537
90357	Land	2023-11-13	$68,000	2024-02-23	$64,000	0	0	0			Macarthur Real Estate Agency	29-loch-street-ganmain-nsw-2702
90368	Apartment	2023-11-14	$480,000	2024-01-31	$470,000	2	1	2	6.0		The Real Estate Shop	89-2-hinder-street-gungahlin-act-2912
90369	House	2023-11-14	Auction	2023-12-06	Undisclosed	3	1	2	2.0	767.0	Luton Weston Creek & Molonglo Valley	102-bangalay-crescent-rivett-act-2611
90387	House	2023-11-14	$849,000	2024-02-23	$840,000	3	1	1		715.0	Sails Real Estate	64-sapphire-crescent-merimbula-nsw-2548
90390	House	2023-11-14	Sold at Auction - $1,090,000	2023-12-02	$1,090,000	4	2	2	2.0	943.0	MARQ Property	5-bidia-place-waramanga-act-2611
90400	House	2023-11-14	GUIDE $650,000	2024-01-31	$641,000	3	2	1		368.0	Ray White Goulburn	12-wollondilly-avenue-goulburn-nsw-2580
90402	DuplexSemi-detached	2023-11-14	AUCTION	2023-12-08	$850,000	3	1	0	4.0	627.0	McIntyre Property	21-matina-street-narrabundah-act-2604
90407	House	2023-11-14	$790,000	2023-12-05	$790,000	3	1	1		1101.0	Belle Property Batemans Bay	40-kennedy-crescent-denhams-beach-nsw-2536
90409	Townhouse	2023-11-14	$610,000+	2024-02-08	$620,000	3	1	1	2.0	267.0	LJ Hooker Tuggeranong	5-23-kellick-place-gordon-act-2906
90412	House	2023-11-14	Auction on the 09/12/2023 at 4:30pm	2023-12-09	$1,105,000	4	2	4	1.5	750.0	Stone Gungahlin	55-balonne-street-kaleen-act-2617
90423	House	2023-11-14	$265,000	2023-11-30	Undisclosed	2	1	2		1008.0	Flemings Property Services	10-ranken-street-cowra-nsw-2794
90424	Apartment	2023-11-14	$430,000+	2024-01-22	$440,000	2	1	1	6.0		LJ Hooker Canberra City	5-22-cornelius-street-coombs-act-2611
90435	Apartment	2023-11-14	Auction	2023-12-01	$770,000	3	3	2	6.0		LJ Hooker Canberra City	27-217-northbourne-avenue-turner-act-2612
90439	House	2023-11-14	Sold at auction	2023-12-09	Undisclosed	4	2	2	5.0	486.0	MARQ Property	12-kimmorley-street-casey-act-2913
90444	House	2023-11-14	$500,000 - $550,000	2023-12-19	$540,000	3	1	1		985.0	Smile Elite	146-donnelly-street-armidale-nsw-2350
90445	Apartment	2023-11-14	$260,000-$280,000	2024-01-09	Undisclosed	2	1	1			Smile Elite	1-6-bellevue-road-armidale-nsw-2350
90448	House	2023-11-14	$885,000 to $925,000	2024-01-30	$890,000	4	2	4		514.0	Smile Elite	29-tobago-parade-lake-cathie-nsw-2445
90449	Townhouse	2023-11-14	$775,000+	2023-12-08	Undisclosed	4	2	2	5.0		MARQ Property	66-plimsoll-drive-casey-act-2913
90451	House	2023-11-14	Price Guide $815,000	2024-01-12	Undisclosed	3	1	1		561.0	Smile Elite	36-seaton-crescent-cranebrook-nsw-2749
90455	House	2023-11-14	$1,070,000	2024-02-27	Undisclosed	3	2	2		601.0	Coast Property Group	50-pambula-beach-rd-road-pambula-beach-nsw-2549
90475	House	2023-11-14	$299,000	2024-01-16	$285,000	3	1	1		588.1	Kitson Property	7-victoria-street-mount-austin-nsw-2650
90476	House	2023-11-14	Auction on the 09/12/2023 at 2:15pm	2023-12-09	$930,000	3	2	1	1.0	885.0	Stone Gungahlin	28-burnett-street-kaleen-act-2617
90478	House	2023-11-14	$385,000	2023-11-30	$370,000	4	1	1		754.0	Flemings Property Services	139-albury-street-harden-nsw-2587
90486	House	2023-11-15	$1,825,000 - $1,875,000	2024-01-29	Undisclosed	4	2	2		792.0	Raine & Horne Berry	2-boran-place-berry-nsw-2535
90500	Lifestyle	2023-11-15	New to Market	2024-01-23	Undisclosed	3	2	2		3.5	Raine & Horne Berry	273-bundewallah-road-berry-nsw-2535
90501	House	2023-11-15	$890,000 - $950,000	2023-12-19	$900,000	4	3	2		661.0	Raine & Horne Berry	48-caladenia-crescent-south-nowra-nsw-2541
90502	DuplexSemi-detached	2023-11-15	$1,450,000	2024-02-09	$1,400,000	3	2	2		500.0	Raine & Horne Berry	13b-tressider-close-berry-nsw-2535
90531	House	2023-11-15	Contact Agent	2024-03-05	$880,000	4	2	2		777.0	Raine & Horne Berry	38-gardenia-crescent-bomaderry-nsw-2541
90535	House	2023-11-15	$910,000 to $940,000	2024-03-04	$915,000	4	2	2		751.0	Raine & Horne Berry	25-freesia-crescent-bomaderry-nsw-2541
90540	House	2023-11-15	$1,080,000	2024-01-24	$1,015,000	3	1	1		613.0	Raine & Horne Berry	32-belinda-street-gerringong-nsw-2534
90548	Villa	2023-11-15	$1,500,000 - $1,600,000	2024-01-19	$1,550,000	3	2	1		456.0	Raine & Horne Berry	3-69-albert-street-berry-nsw-2535
90550	DuplexSemi-detached	2023-11-15	$1,450,000	2024-02-12	$1,415,000	3	2	2			Raine & Horne Berry	13a-tressider-close-berry-nsw-2535
90557	House	2023-11-15	UNDER CONTRACT	2024-02-26	Undisclosed	4	2	2		4315.0	Raine & Horne Berry	3-sabal-close-berry-nsw-2535
90560	House	2023-11-15	Auction Thursday 7th December at 6:00pm	2023-12-02	$750,000	3	1	2	1.0	678.0	Cream Residential	16-embley-street-holder-act-2611
90561	Apartment	2023-11-15	Auction	2023-12-11	$510,000	1	1	1	6.0		LJ Hooker Canberra City	32-16-elouera-street-braddon-act-2612
90565	House	2023-11-15	Sold	2024-02-21	$855,000	3	2	2		526.0	The Property Collective	44-stonehaven-circuit-queanbeyan-nsw-2620
90567	Unit	2023-11-15	$485,000	2024-02-20	$480,000	2	1	1	4.5		LJ Hooker Belconnen	30b-9-chandler-street-belconnen-act-2617
90570	House	2023-11-15	$1,600,000- $1,700,000	2024-02-16	Undisclosed	4	2	2		609.0	Ray White Queanbeyan | Jerrabomberra	10-lenane-street-queanbeyan-nsw-2620
90572	Townhouse	2023-11-15	$769,000 +	2024-02-22	$780,000	3	3	2	6.0		LJ Hooker Canberra City	9-15-calaby-street-coombs-act-2611
90573	Townhouse	2023-11-15	$599,000+	2023-12-21	$608,000	2	2	2	6.0	190.0	LJ Hooker Gungahlin	8-25-burnum-burnum-close-bonner-act-2914
90575	House	2023-11-15	$559,000	2023-12-04	Undisclosed	3	1	1		617.4	PRD Wagga Wagga	54-maple-road-lake-albert-nsw-2650
90580	House	2023-11-15	$725,000	2024-02-16	Undisclosed	4	1	2		581.0	LJ Hooker Sussex Inlet	5-boatharbour-drive-sussex-inlet-nsw-2540
90581	House	2023-11-15	Auction 09/12/2023	2023-12-01	Undisclosed	4	2	2	1.0	1119.0	Ray White Canberra	37-hawker-street-torrens-act-2607
90582	House	2023-11-15	$675,000	2024-01-19	Undisclosed	2	1	2	0.0	683.0	Lyne Gatty Real Estate	20-coila-avenue-tuross-head-nsw-2537
90584	House	2023-11-15	$1,600,000-$1,650,000 Price Guide	2024-01-16	$1,525,000	2	2	4		980.0	Sails Real Estate	23-hill-street-merimbula-nsw-2548
90588	AcreageSemi-rural	2023-11-15	$3,950,000	2024-02-01	Undisclosed	9	5	8		221.0	Whale Coast Realty	8193-princes-highway-central-tilba-nsw-2546
90589	MixedFarming	2023-11-15	$3,950,000	2024-02-01	Undisclosed	9	5	8		221.0	Whale Coast Realty	8193-princes-highway-central-tilba-nsw-2546
90592	House	2023-11-15	$995,000 - $1,095,000	2023-12-06	$1,000,000	4	1	4	1.0		Ian McNamee & Partners - Queanbeyan	33-wakelin-circuit-weston-act-2611
90594	House	2023-11-15	Auction 07/12/23	2023-11-30	Undisclosed	4	2	5	1.5	932.0	Ray White Canberra	24-beaney-street-macgregor-act-2615
90595	House	2023-11-15	Price $580,000	2024-01-31	$575,000	3	2	2		596.0	Ray White Goulburn	19-hampden-street-goulburn-nsw-2580
90599	House	2023-11-15	$1,280,000	2024-03-01	Undisclosed	5	2	4		1.29	Ray White Rural Canberra | Yass	3-suffolk-avenue-murrumbateman-nsw-2582
90601	Land	2023-11-15	$75,000	2024-03-01	$75,000	0	0	0		2000.0	One Agency Craig Schofield	lot-7-1-11-chusan-street-bombala-nsw-2632
90608	House	2023-11-15	Auction	2023-12-09	Undisclosed	6	4	2	4.5	969.0	Luton Gungahlin	92-macrossan-crescent-latham-act-2615
90616	House	2023-11-15	$635,000	2024-01-18	$610,000	3	1	2		600.7	Ray White Canberra	13-brigalow-street-karabar-nsw-2620
90617	House	2023-11-15	Auction Guide: $1,299,000	2023-12-06	Undisclosed	4	2	2	5.0	669.0	Luton Gungahlin	103-slim-dusty-circuit-moncrieff-act-2914
90624	House	2023-11-15	$720,000	2023-12-20	$733,000	4	2	1	5.0	153.0	LJ Hooker Belconnen	28-helmrich-street-moncrieff-act-2914
90629	Townhouse	2023-11-15	By Negotiation	2023-11-30	$750,000	3	2	2	6.0	175.0	Impact Properties	123-sutherland-crescent-taylor-act-2913
90630	House	2023-11-15	Auction Saturday 9th December at 10:00am	2023-12-07	$1,250,000	4	2	1	3.5	894.0	Cream Residential	52-groom-street-hughes-act-2605
90634	Unit	2023-11-15	$440,000+	2024-01-25	Undisclosed	2	1	1	3.0		LJ Hooker Kippax	37-1-playfair-place-belconnen-act-2617
90641	House	2023-11-15	New Price $520,000	2024-02-14	$530,000	3	2	2		2112.0	Henley Property - Cooma	20-mulach-street-cooma-nsw-2630
90642	House	2023-11-15	$489,000	2023-12-07	$489,000	4	1	3		885.0	Kitson Property	30-william-street-junee-nsw-2663
90643	House	2023-11-15	Auction	2023-12-09	Undisclosed	3	1	1	1.5	809.0	Luton Weston Creek & Molonglo Valley	6-shann-place-chifley-act-2606
90647	Townhouse	2023-11-15	Guide $1,200,000 to $1,250,000	2024-03-05	$1,190,000	4	3	2			Henley Property - Jindabyne	2-11-beloka-close-jindabyne-nsw-2627
90648	Townhouse	2023-11-15	895,000+	2024-02-08	$885,000	4	2	2	4.0		LJ Hooker Canberra City	78-2-woodberry-avenue-coombs-act-2611
90651	House	2023-11-15	$600,000 to $650,000	2023-12-18	$620,000	3	2	3		556.0	Smile Elite	54-idlewild-avenue-sanctuary-point-nsw-2540
90652	Land	2023-11-15	$425,000	2024-02-22	$398,500	0	0	0		8094.0	Smile Elite	271-maynards-plains-road-dorrigo-mountain-nsw-2453
90656	House	2023-11-15	$350,000	2024-01-29	$320,000	2	1	1			Ray White Batemans Bay	119-11195-princes-highway-benandarah-nsw-2536
90667	House	2023-11-16	Auction	2023-12-09	Undisclosed	4	2	2	4.5	894.0	Luton Weston Creek & Molonglo Valley	5-mcphail-place-fadden-act-2904
90668	House	2023-11-16	Auction	2023-12-04	Undisclosed	4	2	2	1.0	560.0	Luton Weston Creek & Molonglo Valley	8-loder-place-kambah-act-2902
90669	DuplexSemi-detached	2023-11-16	Auction	2023-12-09	$855,000	2	1	1	4.0	410.0	Luton Manuka	33-groom-street-hughes-act-2605
90671	House	2023-11-16	$359,000	2024-01-23	Undisclosed	3	1	1			Ray White Wagga Wagga	21-stinson-street-coolamon-nsw-2701
90675	House	2023-11-16	$925,000	2023-12-09	$925,000	4	2	1	1.0	772.0	home.by holly	56-fitzhardinge-crescent-evatt-act-2617
90677	House	2023-11-16	$799,000 +	2024-01-19	$808,000	3	1	4	1.5	757.0	LJ Hooker Woden/Weston	15-gritten-street-weston-act-2611
90680	House	2023-11-16	$1,650,000	2023-12-02	$1,650,000	3	2	1	0.5	739.0	home.by holly	36-ferdinand-street-campbell-act-2612
90681	House	2023-11-16	$1,230,000	2024-02-19	$1,230,000	5	2	1	0.0	723.0	home.by holly	56-maitland-street-hackett-act-2602
90682	House	2023-11-16	$1,406,000	2023-12-09	$1,406,000	3	2	1	3.5		home.by holly	67-higinbotham-street-watson-act-2602
90683	House	2023-11-16	Auction on Saturday 9th December 2023 at 1:00pm	2023-12-09	$876,000	3	2	2	5.0	402.0	Hugo. Canberra	5-bendora-crescent-palmerston-act-2913
90684	House	2023-11-16	$649,000	2024-01-19	$649,000	4	2	2		733.0	Fitzpatricks	4-randall-street-kooringal-nsw-2650
90692	House	2023-11-16	$762,000	2023-12-12	$762,000	3	2	2	1.5	649.0	home.by holly	6-gething-place-macgregor-act-2615
90693	Apartment	2023-11-16	$430,000 - $450,000	2024-02-29	$435,000	2	2	1	6.0		LJ Hooker Gungahlin	333-1-anthony-rolfe-avenue-gungahlin-act-2912
90695	House	2023-11-16	Auction 12th December at 1pm	2023-12-12	$585,000	3	1	2	1.5	767.34	Ray White Canberra	7-imlay-place-charnwood-act-2615
90700	House	2023-11-16	$775,000	2024-02-13	$750,000	4	1	1		855.0	LJ Hooker Batemans Bay	3-sandpiper-place-catalina-nsw-2536
90707	Townhouse	2023-11-16	Auction	2023-12-02	$740,000	3	2	2	3.5	318.0	LJ Hooker Belconnen	3-48-siroset-close-dunlop-act-2615
90711	DuplexSemi-detached	2023-11-16	$780,000	2024-02-06	$765,000	4	2	2		700.2	Fitzpatricks	45-47-gasnier-loop-boorooma-nsw-2650
90713	House	2023-11-16	$765,000	2024-02-12	$760,000	3	2	2	1.0	422.0	LJ Hooker Gungahlin	35-ferguson-circuit-ngunnawal-act-2913
90716	Lifestyle	2023-11-16	$1,050,000	2023-12-09	$1,050,000	4	2	3		17.0	LJ Hooker Queanbeyan – Jerrabomberra – Googong	71-bowen-street-carwoola-nsw-2620
90723	House	2023-11-16	Auction	2023-12-02	$793,000	3	1	2	2.5	835.0	LJ Hooker Belconnen	11-sloane-place-florey-act-2615
90724	House	2023-11-16	$945,000	2024-01-23	Undisclosed	4	2	2	3.5	729.0	Luton Tuggeranong	5-tuross-close-amaroo-act-2914
90729	DuplexSemi-detached	2023-11-16	AUCTION	2023-12-04	Undisclosed	3	3	2	6.0	590.0	Bastion Property Group	22-godfrey-street-campbell-act-2612
90732	Land	2023-11-16	$340,000 - $370,000	2024-03-01	$310,000	0	0	0		1891.0	Smile Elite	20-mooga-avenue-spencer-nsw-2775
90735	House	2023-11-16	Auction	2023-12-08	Undisclosed	5	2	2	2.0	724.0	My Morris	73-harrington-circuit-kambah-act-2902
90739	Townhouse	2023-11-16	$649,000	2024-02-05	$655,000	2	2	2	4.5		Ray White Canberra	20-25-jerrabomberra-avenue-narrabundah-act-2604
90744	House	2023-11-16	UNDER OFFER	2024-02-21	$1,950,000	5	3	3		4052.0	Ray White Bowral	7-stratford-way-burradoo-nsw-2576
90745	Lifestyle	2023-11-16	$750,000	2024-02-26	$750,000	4	2	4		81.58	Raine & Horne Goulburn	2766-oallen-ford-road-windellama-nsw-2580
90746	House	2023-11-16	$1,010,000	2023-12-02	$1,010,000	3	1	1	2.0		home.by holly	28-haddon-street-hackett-act-2602
90748	Apartment	2023-11-16	$990,000	2024-01-19	$990,000	3	2	2	6.0		home.by holly	804-1-elouera-street-braddon-act-2612
90751	Townhouse	2023-11-16	Auction 09/12/2023	2023-12-09	$1,237,000	3	2	2	4.5		LJ Hooker Dickson	1-20-campbell-street-ainslie-act-2602
90753	Apartment	2023-11-16	$499,000+	2023-12-15	$500,000	1	1	1	6.0		PURNELL	26-76-leichhardt-street-griffith-act-2603
