id	type	ListingDate	PriceLabel	SoldDate	SoldPrice	Beds	Baths	Cars	EER	PlotSize	Agency.Name	Slug
68694	Apartment	2023-01-24	$599,000+	2023-03-01	Undisclosed	2	1	1	6.0		PURNELL	40-109-canberra-avenue-griffith-act-2603
70881	Apartment	2023-01-24	$849,000+	2023-03-03	Undisclosed	3	2	1	3.0		PURNELL	18-47-eyre-street-kingston-act-2604
71927	Townhouse	2023-01-24	$549,000+	2023-02-06	$515,000	2	1	1	5.5		PURNELL	196a-beasley-street-farrer-act-2607
72833	Unit	2023-01-02	$599,000	2023-04-06	$560,000	2	1	1			Sails Real Estate	7-55-merimbula-drive-merimbula-nsw-2548
72834	House	2023-01-02	988000	2023-02-02	$988,000	5	4	2		1324.0	Smile Elite	8-bursaria-place-south-bowenfels-nsw-2790
72843	House	2023-01-03	$680,000 - $720,0000	2023-02-13	$685,000	4	2	2		706.0	My Agent Team	14-thomas-mitchell-crescent-sunshine-bay-nsw-2536
72851	House	2023-01-03	New To Market	2023-02-24	$495,000	2	1	2		803.0	Professionals Nowra	33-edwards-avenue-bomaderry-nsw-2541
72859	House	2023-01-03	$1,100,000	2023-03-14	$990,000	3	1	8		25.0	Ray White Goulburn	2042-crookwell-road-goulburn-nsw-2580
72865	House	2023-01-03	$950,000	2023-01-17	$900,000	3	1	2		639.0	Professionals Nowra	24-carlton-crescent-culburra-beach-nsw-2540
72888	Apartment	2023-01-03	By Negotiation	2023-01-20	$470,000	3	2	2	6.0		Impact Properties	106-10-thynne-street-bruce-act-2617
72892	Apartment	2023-01-03	$799,000	2023-05-30	$780,000	3	2	2			Ray White Batemans Bay	8-33-35-clyde-street-batemans-bay-nsw-2536
72907	House	2023-01-04	Auction 11th February 10am Onsite	2023-02-11	Undisclosed	5	3	2		2946.0	LJ Hooker Moruya	775-congo-road-congo-nsw-2537
72909	House	2023-01-04	Auction	2023-01-27	$1,300,000	5	2	2	2.5	1123.0	LJ Hooker Tuggeranong	2-akhurst-grove-gordon-act-2906
72951	House	2023-01-05	Auction 04/02/2023	2023-02-04	$680,000	3	1	0	4.5	804.0	Ray White Canberra	149-lawrence-wackett-crescent-theodore-act-2905
72960	House	2023-01-05	$348,000	2023-03-17	Undisclosed	3	2	1		600.7	Macarthur Real Estate Agency	20-menzies-avenue-kooringal-nsw-2650
72965	House	2023-01-05	$635,000+	2023-03-21	Undisclosed	2	2	2	5.5		Ray White Canberra	32-76-stockman-avenue-lawson-act-2617
72966	House	2023-01-05	$847,5000	2023-02-04	$847,500	5	2	4		650.0	MARQ Property	21-koorong-place-queanbeyan-west-nsw-2620
72967	House	2023-01-05	$550,000	2023-03-21	$540,000	3	1	2		752.0	Henley Property - Cooma	4-kanuna-place-cooma-nsw-2630
72973	House	2023-01-05	$985,000	2023-02-08	Undisclosed	4	2	2		1091.0	Ben Bate Real Estate	10-tilba-street-narooma-nsw-2546
72978	House	2023-01-05	Guide $849,000	2023-03-24	$810,000	5	3	2		700.1	Ray White Goulburn	7-7a-quadrant-place-goulburn-nsw-2580
73026	Land	2023-01-06	Not disclosed	2023-06-07	Undisclosed	0	0	0		891.0	McGrath Batemans Bay & Moruya	lot-38-73-bevian-road-rosedale-nsw-2536
73048	Townhouse	2023-01-09	$850,000+	2023-01-27	$880,000	3	2	2	5.0		McIntyre Property	2-115-mortimer-lewis-drive-greenway-act-2900
73055	House	2023-01-09	Auction 04/02/2023	2023-02-04	Undisclosed	3	2	2		631.0	Ray White Canberra	31-macadamia-close-jerrabomberra-nsw-2619
73061	Townhouse	2023-01-09	Auction 04/02/2023	2023-02-04	$597,000	3	1	1	2.0		Ray White Canberra	3-30-christmas-street-theodore-act-2905
73062	House	2023-01-09	$790,000	2023-02-27	$790,000	3	1	8	5.0	803.0	The Real Estate Shop	47-bettington-circuit-charnwood-act-2615
73066	House	2023-01-09	Auction Friday 17th February at 6pm	2023-02-17	$680,000	4	2	0		2023.0	McCann Properties	60-biala-street-gunning-nsw-2581
73069	House	2023-01-09	$649,000	2023-03-28	Undisclosed	4	2	2		674.2	Macarthur Real Estate Agency	5-willang-crescent-glenfield-park-nsw-2650
73070	House	2023-01-09	560,000	2023-02-01	$560,000	5	2	2		636.0	Smile Elite	8-hamley-street-south-bathurst-nsw-2795
73091	House	2023-01-09	$599,000 - $615,000	2023-07-18	$599,000	3	1	1		556.0	My Agent Team	15-irene-avenue-batehaven-nsw-2536
73092	House	2023-01-09	PRICE GUIDE $250,000 - $280,000	2023-03-14	$275,000	2	1	2			Raine & Horne Southern Highlands	16-43-53-willow-drive-moss-vale-nsw-2577
73095	Townhouse	2023-01-09	Auction	2023-02-03	$670,000	3	2	2	6.0		Luton Gungahlin	6-6-renouf-street-casey-act-2913
73096	Townhouse	2023-01-09	Auction	2023-02-04	$780,000	3	2	2	5.0		Luton Gungahlin	13-whatmore-court-nicholls-act-2913
73105	Apartment	2023-01-10	$469,000	2023-02-01	Undisclosed	2	2	2	6.0		Luton Gungahlin	37-16-david-miller-crescent-casey-act-2913
73106	House	2023-01-10	$670,000	2023-02-27	Undisclosed	3	2	1	3.5	213.0	Ray White Canberra	1-43-tenison-woods-circuit-bonython-act-2905
73113	House	2023-01-10	$669,000+	2023-03-15	Undisclosed	3	2	2	4.0		Ray White Canberra	67-jumbuck-crescent-lawson-act-2617
73117	AcreageSemi-rural	2023-01-10	Offers $1,100,000+	2023-03-16	Undisclosed	4	2	4		2.99	One Agency Craig Schofield	211-bidgee-road-cooma-nsw-2630
73128	Townhouse	2023-01-10	Auction Tue, 31st Jan at 6:00pm	2023-01-31	$815,000	3	2	2	6.0	256.0	LJ Hooker Gungahlin	4-42-dengate-crescent-moncrieff-act-2914
73137	House	2023-01-10	680000	2023-03-03	$680,000	3	1	2		1416.0	Smile Elite	15-griffin-street-mitchell-nsw-2795
73140	Townhouse	2023-01-10	Auction 04/02/2023	2023-02-04	$640,000	3	2	2	5.5		Ray White Canberra	32a-coane-street-holder-act-2611
73144	House	2023-01-10	$689,000	2023-02-23	$680,000	3	2	4		1006.0	Henley Property - Cooma	5-nambucca-street-cooma-nsw-2630
73150	Other	2023-01-10	$465,000-$515,000	2023-04-27	$480,000	1	1	1		2023.0	Ray White Bungendore	31-molonglo-street-bungendore-nsw-2621
73151	Townhouse	2023-01-10	$600,000+	2023-01-20	$610,000	2	1	1	5.5		Stone Gungahlin	5-11-len-waters-street-ngunnawal-act-2913
73152	Townhouse	2023-01-10	$669,000+	2023-02-07	$685,000	3	2	2	6.0		Stone Gungahlin	9-6-renouf-street-casey-act-2913
73158	House	2023-01-10	$1,650,000	2023-04-11	Undisclosed	5	2	5			Ray White Wagga Wagga	25-cummins-drive-san-isidore-nsw-2650
73166	Unit	2023-01-10	$290,000	2023-01-10	$290,000	1	1	1			LJ Hooker Queanbeyan – Jerrabomberra – Googong	26-46-trinculo-place-queanbeyan-east-nsw-2620
73170	House	2023-01-10	$689,000	2023-02-10	Undisclosed	4	2	4		1043.0	Whale Coast Realty	208-208a-princes-highway-narooma-nsw-2546
73174	Townhouse	2023-01-11	$599,000+	2023-01-27	$630,000	2	1	1	3.0	312.0	Luton Weston Creek & Molonglo Valley	9-61-ashby-circuit-kambah-act-2902
73176	House	2023-01-11	Auction	2023-02-04	$1,420,000	6	4	2	6.0	1123.0	LJ Hooker Belconnen	2-halford-crescent-page-act-2614
73177	House	2023-01-11	$529,000	2023-04-04	$505,000	4	1	2		2000.0	McCann Properties	98-biala-street-gunning-nsw-2581
73178	Unit	2023-01-11	Auction	2023-02-04	$524,500	2	2	1	5.0		LJ Hooker Belconnen	62-13-chandler-street-belconnen-act-2617
73179	House	2023-01-11	Auction	2023-02-04	$785,000	3	1	2	1.5	682.0	LJ Hooker Belconnen	46-halford-crescent-page-act-2614
73181	House	2023-01-11	Auction	2023-02-04	$555,000	2	1	1	6.0	165.0	LJ Hooker Belconnen	4-11-starcevich-crescent-jacka-act-2914
73183	Townhouse	2023-01-11	$599,000+	2023-03-16	Undisclosed	3	1	1	3.5		Ray White Canberra	3-13-15-troughton-street-banks-act-2906
73186	House	2023-01-11	$870,000	2023-03-28	$870,000	3	2	2	7.0	250.0	Luton Gungahlin	23-speldewinde-street-strathnairn-act-2615
73187	House	2023-01-11	$795,000+	2023-03-14	$811,000	3	1	1	1.0	736.0	LJ Hooker Gungahlin	69-bennelong-crescent-macquarie-act-2614
73189	House	2023-01-11	$739,000 - $759,000	2023-01-31	Undisclosed	4	2	2		725.3	Ray White Wagga Wagga	15-sturrock-drive-boorooma-nsw-2650
73190	House	2023-01-11	$890,000	2023-03-10	$870,000	3	2	2		6638.0	Henley Property - Cooma	16-obrien-avenue-berridale-nsw-2628
73191	House	2023-01-11	$890,000	2023-03-10	$870,000	3	2	2		6638.0	Henley Property - Berridale	16-obrien-avenue-berridale-nsw-2628
73193	House	2023-01-11	Auction	2023-02-04	Undisclosed	3	1	2	4.5	783.0	LJ Hooker Belconnen	7-bennett-place-flynn-act-2615
73195	Townhouse	2023-01-11	$649,000	2023-03-28	$659,000	3	1	1	5.0	270.0	LJ Hooker Belconnen	26-gamban-square-ngunnawal-act-2913
73209	House	2023-01-11	Auction	2023-01-28	$990,000	5	3	2	3.0	805.0	LJ Hooker Belconnen	18-evelyn-owen-crescent-dunlop-act-2615
73210	House	2023-01-11	$930,000	2023-02-17	Undisclosed	3	2	2		774.0	Whale Coast Realty	3-john-place-north-narooma-nsw-2546
73211	House	2023-01-11	$875,000	2023-02-22	Undisclosed	4	2	2		785.0	Dwyer Properties Sapphire Coast	70-tura-beach-drive-tura-beach-nsw-2548
73212	House	2023-01-11	Auction	2023-02-11	$1,270,000	4	2	2	4.0	539.0	Luton Gungahlin	71-dorrie-crescent-moncrieff-act-2914
73216	House	2023-01-11	Auction 04/02/2023	2023-02-04	$1,100,000	4	2	2	4.5	802.0	Ray White Canberra	23-hattersley-court-nicholls-act-2913
73218	House	2023-01-11	Auction 04/02/2023	2023-02-17	Undisclosed	3	2	2	1.5	1166.0	Ray White Canberra	16-dowthwaite-street-fraser-act-2615
73219	Apartment	2023-01-11	Offers over $620,000	2023-03-17	Undisclosed	2	2	2	6.0		Crowthers	57-41-chandler-street-belconnen-act-2617
73222	Apartment	2023-01-11	$395,900+	2023-01-25	$417,100	1	1	1	6.0		VERV Property	301-9-watkin-street-bruce-act-2617
73226	Townhouse	2023-01-11	$549,000	2023-02-22	$530,000	3	1	1	1.0		McIntyre Property	30-75-box-hill-avenue-conder-act-2906
73228	House	2023-01-11	$1,400,000	2023-02-21	$1,420,000	7	4	0	0.5	908.0	LJ Hooker Belconnen	34-kulgera-street-hawker-act-2614
73229	Townhouse	2023-01-11	Auction	2023-02-04	$615,000	3	1	1	4.5	301.0	LJ Hooker Belconnen	16-hargrave-street-scullin-act-2614
73238	House	2023-01-11	AUCTION	2023-02-02	$401,000	3	2	0		828.0	McGrath Batemans Bay & Moruya	21-pleasurelea-drive-sunshine-bay-nsw-2536
73246	House	2023-01-11	$759,000+	2023-03-10	$740,000	4	2	2	6.0	213.0	Impact Properties	36-helmrich-street-moncrieff-act-2914
73248	House	2023-01-11	$800,000 - $840,000	2023-03-17	$810,000	4	3	1		559.0	My Agent Team	24-millers-crescent-moruya-heads-nsw-2537
73249	Townhouse	2023-01-11	$850,000	2023-04-05	$850,000	3	2	2			Dwyer Properties Sapphire Coast	1-34a-monaro-street-merimbula-nsw-2548
73251	House	2023-01-11	$530,000 - $580,000	2023-02-08	$565,500	2	1	3		1146.0	My Agent Team	21-keightley-street-moruya-nsw-2537
73252	Unit	2023-01-11	$449,000	2023-02-20	$420,000	2	1	1			Ray White Batemans Bay	5-25-wharf-road-north-batemans-bay-nsw-2536
73253	House	2023-01-11	$1,650,000	2023-06-07	$1,650,000	5	2	2	1.5		Berkely Residential	19-logan-street-narrabundah-act-2604
73255	Townhouse	2023-01-11	Auction	2023-02-01	$621,000	3	2	2	1.0	276.0	LJ Hooker Kaleen	5-31-moyes-crescent-holt-act-2615
73257	House	2023-01-11	$639,000	2023-03-02	Undisclosed	3	1	1	0.0	730.0	Luton Kippax	22-pennefather-street-higgins-act-2615
73260	House	2023-01-11	$1,550,000	2023-02-16	$1,400,000	4	3	1		650.0	My Agent Team	17-fauna-avenue-long-beach-nsw-2536
73263	Apartment	2023-01-11	$449,000 - $479,000	2023-02-03	$465,000	2	2	1			Ian McNamee & Partners - Queanbeyan	55-39-43-crawford-street-queanbeyan-nsw-2620
73269	House	2023-01-11	$1,349,000	2023-03-10	Undisclosed	3	3	3		651.0	Raine & Horne Mollymook Milton	20-garside-road-mollymook-beach-nsw-2539
73270	House	2023-01-11	SOLD AT AUCTION $1,252,000	2023-01-30	$1,252,000	4	2	2		325.0	Smile Elite	29-balfour-street-schofields-nsw-2762
73271	House	2023-01-11	Contact Agent	2023-02-06	$1,362,500	5	3	2		375.0	Smile Elite	28-lockheed-drive-schofields-nsw-2762
73272	House	2023-01-11	Open House Cancelled	2023-01-18	$1,900,000	4	2	2		696.0	Smile Elite	71-pound-avenue-frenchs-forest-nsw-2086
73273	Townhouse	2023-01-11	Contact Agent	2023-03-03	$850,000	3	2	1			Smile Elite	11-wilbur-glade-schofields-nsw-2762
73277	House	2023-01-12	$1,249,000+	2023-06-28	$1,245,000	4	2	4	5.0	405.0	Impact Properties	14-dunnart-circuit-throsby-act-2914
73278	Townhouse	2023-01-12	Auction 04/02/2023	2023-02-04	$650,000	3	2	2	6.0		Ray White Canberra	19-25-burnum-burnum-close-bonner-act-2914
73280	House	2023-01-12	Offers Invited	2023-03-24	Undisclosed	4	1	2	0.5	793.0	Agent Team Belconnen	1-edwards-street-higgins-act-2615
73281	House	2023-01-12	$879,000	2023-01-27	$875,000	4	3	2		883.0	Raine & Horne Goulburn	17-wran-street-goulburn-nsw-2580
73283	House	2023-01-12	Auction 04/02/2023	2023-02-04	$975,000	4	2	2	4.5	725.0	Ray White Canberra	15-coolgardie-street-dunlop-act-2615
73285	House	2023-01-12	Property Preview	2023-02-28	Undisclosed	3	2	2		563.0	LJ Hooker Ulladulla	27-oak-avenue-lake-tabourie-nsw-2539
73286	DuplexSemi-detached	2023-01-12	$1,185,000	2023-01-12	$1,185,000	3	1	1	2.5	522.1	Berkely Residential	47-chowne-street-campbell-act-2612
73287	House	2023-01-12	$1,449,000 - $1,499,000	2023-05-16	$1,500,000	5	3	3		833.0	Ian McNamee & Partners - Queanbeyan	156-waterfall-drive-jerrabomberra-nsw-2619
73288	House	2023-01-12	Auction 04/02/2023	2023-02-04	$682,000	3	1	2	3.0	556.0	Ray White Canberra	15-wiburd-street-banks-act-2906
73289	Apartment	2023-01-12	Offers $495,000+	2023-02-27	Undisclosed	2	2	1	6.0		Ray White Canberra	210-83-cooyong-street-reid-act-2612
73291	Apartment	2023-01-23	$1,695,000	2023-03-01	Undisclosed	3	2	2	6.0		PURNELL	19-11-kerridge-street-kingston-act-2604
73292	Townhouse	2023-01-12	$700,000+	2023-03-01	Undisclosed	3	1	2	6.0	380.0	My Morris	9-41-wiburd-street-banks-act-2906
73294	House	2023-01-12	$990,000	2023-05-04	$950,000	4	2	2		611.9	My Agent Team	5-sunfield-court-tomakin-nsw-2537
73295	Apartment	2023-01-12	Offers over $960,000	2023-03-18	$960,000	2	2	2	6.0		Crowthers	401-19-marcus-clarke-street-city-act-2601
73296	House	2023-01-12	$779,000	2023-03-07	$740,000	3	1	2	3.5	987.0	McIntyre Property	1-christmas-street-theodore-act-2905
73298	House	2023-01-12	$839,000	2023-03-03	Undisclosed	4	2	2		798.1	PRD Wagga Wagga	94-messenger-avenue-boorooma-nsw-2650
73301	Townhouse	2023-01-12	$1,000,000	2023-01-18	$1,000,000	3	2	2	5.0	240.0	home.by holly	5-bettie-mcnee-street-watson-act-2602
73302	Apartment	2023-01-12	$385,000+	2023-03-01	Undisclosed	1	1	1	6.0		VERV Property	30-37-braybrooke-street-bruce-act-2617
73304	AcreageSemi-rural	2023-01-12	908000	2023-04-06	$908,000	4	3	5		1.22	Smile Elite	4816-4818-wisemans-ferry-road-spencer-nsw-2775
73306	House	2023-01-12	Auction	2023-02-15	$885,000	3	1	4	1.0	758.0	LJ Hooker Kaleen	10-pambula-street-kaleen-act-2617
73307	House	2023-01-12	Auction	2023-01-28	$555,000	2	1	1	6.0	182.0	LJ Hooker Belconnen	25-85-macfarlane-burnet-avenue-macgregor-act-2615
73308	House	2023-01-12	By Negotiation	2023-03-16	Undisclosed	4	2	4	6.0	418.0	Impact Properties	9-quokka-street-throsby-act-2914
73309	House	2023-01-12	By Negotiation	2023-02-22	Undisclosed	3	2	2	3.5	392.0	LJ Hooker Kippax	15-bushby-place-holt-act-2615
73312	Apartment	2023-01-12	$399,000+	2023-02-03	Undisclosed	1	1	1	6.0		Badenoch Real Estate	34-15-braybrooke-street-bruce-act-2617
73313	House	2023-01-12	Auction 04/02/2023	2023-02-04	Undisclosed	4	2	2	1.0	1056.0	Ray White Canberra	7-clift-crescent-richardson-act-2905
73317	House	2023-01-12	contact agent	2023-01-21	Undisclosed	4	2	2	1.0	1010.0	home.by holly	16-joyner-place-flynn-act-2615
73318	House	2023-01-12	Auction 05/02/2023	2023-01-26	Undisclosed	4	2	2	2.0	886.0	Ray White Canberra	8-eucumbene-drive-duffy-act-2611
73319	Townhouse	2023-01-12	$695,000+	2023-03-03	Undisclosed	3	2	2	5.5		Ray White Canberra	9-3-fullston-way-holt-act-2615
73320	House	2023-01-12	Auction 01/02/2023	2023-02-01	Undisclosed	4	2	2	3.5	879.0	Ray White Canberra	4-greenup-close-florey-act-2615
73321	House	2023-01-12	AUCTION	2023-02-09	Undisclosed	3	1	3		619.0	Ray White Queanbeyan | Jerrabomberra	66-cooma-street-queanbeyan-nsw-2620
73322	House	2023-01-12	Auction 03/02/2023	2023-02-03	Undisclosed	4	3	3	5.0	648.0	Ray White Canberra	14-philip-hodgins-street-wright-act-2611
73323	Townhouse	2023-01-12	Auction 02/02/2023	2023-02-02	$910,000	3	3	2	4.5		Ray White Canberra	137-thynne-street-bruce-act-2617
73324	House	2023-01-12	Contact Agent	2023-03-03	Undisclosed	3	1	2	2.0	682.0	Ray White Canberra	39-pickworth-street-holt-act-2615
73325	Apartment	2023-01-12	Auction 04/02/2023	2023-02-04	Undisclosed	2	2	2	6.0		Ray White Canberra	30-2-manning-clark-street-franklin-act-2913
73326	House	2023-01-12	Auction 04/02/2023	2023-02-04	Undisclosed	3	1	1	6.0	529.0	Ray White Canberra	8-collicott-circuit-macquarie-act-2614
73327	House	2023-01-12	Auction 04/02/2023	2023-02-04	Undisclosed	3	2	1	3.5		Ray White Canberra	16-dugdale-street-cook-act-2614
73328	Lifestyle	2023-01-12	$750,000 - $795,000	2023-07-28	$790,000	3	1	0		69.0	Ray White Braidwood	6827-araluen-road-araluen-nsw-2622
73329	House	2023-01-12	Auction 04/02/2023	2023-02-04	Undisclosed	4	2	4	4.0	734.0	Ray White Canberra	9-grylls-crescent-cook-act-2614
73330	House	2023-01-12	Auction 03/02/2023	2023-02-04	Undisclosed	4	2	2	3.0		Ray White Canberra	4-schwarz-place-flynn-act-2615
73331	House	2023-01-12	Auction 04/02/2023	2023-02-04	$1,385,000	5	4	3	0.0	1181.0	Ray White Canberra	3-florina-place-hawker-act-2614
73332	Townhouse	2023-01-12	Auction 16/02/2023	2023-02-16	Undisclosed	3	2	0	1.0		Ray White Canberra	114-dexter-street-cook-act-2614
73333	House	2023-01-12	Auction 04/02/2023	2023-02-04	$760,000	3	1	1	1.5	670.0	Ray White Canberra	8-shand-place-latham-act-2615
73334	Apartment	2023-01-12	$355,000 +	2023-05-24	$370,000	1	1	1	6.0		LJ Hooker Gungahlin	50-162-flemington-road-harrison-act-2914
73337	House	2023-01-12	Auction 04/02/2023	2023-02-04	$735,000	3	1	0	1.0	826.0	Ray White Canberra	8-trott-place-holt-act-2615
73339	House	2023-01-12	Auction 04/02/2023	2023-02-04	Undisclosed	3	2	2	1.0	637.0	Ray White Canberra	5-burgan-place-rivett-act-2611
73341	House	2023-01-12	Auction 01/02/2023	2023-02-01	Undisclosed	4	2	2	2.5	920.0	Ray White Canberra	101-dumas-street-mckellar-act-2617
73343	House	2023-01-12	Auction 02/02/2023	2023-02-02	$2,155,000	5	3	6	1.0	3149.0	Ray White Canberra	45-mclachlan-crescent-weetangera-act-2614
73362	Apartment	2023-01-12	$670,000	2023-02-04	$670,000	2	2	2	6.0	4644.0	home.by holly	24-16-doonkuna-street-braddon-act-2612
73366	Apartment	2023-01-12	$499,000+	2023-06-20	$515,000	2	2	2	6.0		LJ Hooker Dickson	39-41-clare-burton-crescent-franklin-act-2913
73373	House	2023-01-12	$1,005,000	2023-02-04	$1,005,000	2	1	1	0.0	664.0	Luton Dickson	35-knox-street-watson-act-2602
73376	House	2023-01-12	$678,000+	2023-03-15	Undisclosed	2	2	1	6.0		Ray White Canberra	19-1-rouseabout-street-lawson-act-2617
73379	Apartment	2023-01-12	$900,000	2023-02-22	$900,000	3	2	2	6.5		home.by holly	208-71-constitution-avenue-campbell-act-2612
73381	MixedFarming	2023-01-12	UNDER OFFER	2023-01-11	$0	0	0	0		490.0	LAWD	8-cunningham-road-wilga-wa-6243
73382	Unit	2023-01-13	Auction	2023-02-09	Undisclosed	2	2	2	6.0		Luton Gungahlin	84-140-thynne-street-bruce-act-2617
73391	House	2023-01-13	$1,275,000	2023-09-15	$1,200,000	5	3	3		834.7	Ray White Batemans Bay	59-clarke-street-broulee-nsw-2537
73392	Unit	2023-01-13	$349,000	2023-02-08	$349,000	2	1	1	4.5		LJ Hooker Belconnen	8-26-springvale-drive-hawker-act-2614
73397	House	2023-01-13	$1,000,000-$1,100,000	2023-02-24	$1,000,000	3	2	1			My Agent Team	3-13a-orient-street-batemans-bay-nsw-2536
73401	Unit	2023-01-13	$900,000	2023-01-13	$900,000	3	2	2			Sails Real Estate	1-202-mirador-drive-merimbula-nsw-2548
73404	House	2023-01-13	$1,650,000	2023-02-11	$1,600,000	4	3	2		1105.0	Sails Real Estate	9-the-dress-circle-tura-beach-nsw-2548
73410	House	2023-01-13	Auction	2023-03-06	$1,050,000	4	2	2	5.0	529.0	Timothy Road	26-waterworth-street-dunlop-act-2615
73412	House	2023-01-13	Auction	2023-02-04	Undisclosed	3	1	4	1.0	863.0	My Morris	7-brawn-place-calwell-act-2905
73415	House	2023-01-13	Auction Sat, 4th of Feb at 1:00pm	2023-02-04	$852,000	3	1	2	5.0	582.0	LJ Hooker Gungahlin	7-warabin-crescent-ngunnawal-act-2913
73425	Lifestyle	2023-01-13	$1,375,000	2023-05-19	Undisclosed	0	0	0		86.0	LAWD	1367-marked-tree-road-gundaroo-nsw-2620
73428	Townhouse	2023-01-13	$479,000 - $509,000	2023-03-07	$470,000	2	1	1			Ian McNamee & Partners - Queanbeyan	11-15-charles-street-queanbeyan-nsw-2620
73430	House	2023-01-13	$745,000	2023-03-30	Undisclosed	3	1	3	2.5	771.0	Ray White Canberra	69-ohalloran-circuit-kambah-act-2902
73433	House	2023-01-13	AUCTION Saturday 18th February 2023 at 10am Onsite	2023-02-18	$1,000,000	3	1	0		1.6	LJ Hooker Moruya	9-eurobodalla-road-bodalla-nsw-2545
73434	Apartment	2023-01-13	$529,000 - $549,000	2023-02-22	Undisclosed	1	1	1	4.5		LJ Hooker Manuka	136-11-trevillian-quay-kingston-act-2604
73444	Land	2023-01-14	$325,000	2023-03-01	$320,000	0	0	0		838.0	One Agency Wagga Wagga	41-valencia-drive-gobbagombalin-nsw-2650
73445	House	2023-01-14	$510,000 - $549,000	2023-02-21	$540,000	3	1	4		700.0	One Agency Wagga Wagga	10-nardoo-street-glenfield-park-nsw-2650
73452	House	2023-01-15	Under Contract	2023-03-31	$2,860,000	5	4	5		1962.0	Clearwater Real Estate Narooma	20-gina-ct-narooma-nsw-2546
73459	House	2023-01-16	Contact Agent	2023-02-24	$1,475,000	4	2	2		1595.0	Raine & Horne Southern Highlands	7-wheen-close-bowral-nsw-2576
73463	House	2023-01-16	$840,000 - $880,000	2023-02-11	Undisclosed	3	2	2		562.0	Ward Estate Agents	6-tennyson-drive-queanbeyan-nsw-2620
73465	House	2023-01-16	$549,000	2023-02-08	$540,000	2	1	3		980.1	Ray White Goulburn	2-goulburn-street-marulan-nsw-2579
73466	House	2023-01-16	Auction - Guide from $950,000	2023-02-21	$950,000	4	2	2		667.0	Professionals Nowra	4-alata-crescent-south-nowra-nsw-2541
73475	House	2023-01-16	$750,000 - $800,000	2023-01-12	$741,000	3	2	2		728.0	My Agent Team	61-heron-road-catalina-nsw-2536
73478	House	2023-01-16	$1,250,000	2023-03-17	$1,125,000	5	2	2		1253.0	Dwyer Properties Sapphire Coast	63-headland-drive-tura-beach-nsw-2548
73482	House	2023-01-16	$1,580,000-$1,730,000	2023-05-04	Undisclosed	8	2	1	0.0	1834.0	McCann Properties	theconvent-wombat-street-gunning-nsw-2581
73497	House	2023-01-16	Auction 11/02/2023	2023-02-11	$1,020,000	4	2	2		558.0	Ray White Canberra	19-dolly-street-googong-nsw-2620
73500	House	2023-01-16	$365,000	2023-01-27	Undisclosed	3	1	2		664.0	Flemings Property Services	72-campbell-street-young-nsw-2594
73506	House	2023-01-16	$549,000	2023-03-29	Undisclosed	3	1	1		760.0	Macarthur Real Estate Agency	10-doman-street-estella-nsw-2650
73513	House	2023-01-16	$665,000	2023-03-28	Undisclosed	4	3	2		645.9	Macarthur Real Estate Agency	23-andrews-avenue-kooringal-nsw-2650
73522	House	2023-01-16	Expressions of Interest	2023-05-26	$1,530,000	4	3	4		706.0	Smile Elite	68-currajong-street-evans-head-nsw-2473
73529	Townhouse	2023-01-17	$800,000+	2023-02-27	$805,000	4	2	2	6.0		LJ Hooker Dickson	22-18-bowman-street-macquarie-act-2614
73532	House	2023-01-17	Auction Sat, 11th Feb at 1:00pm	2023-02-11	$1,455,000	5	3	2	3.5	883.0	LJ Hooker Gungahlin	12-sanford-place-kaleen-act-2617
73545	House	2023-01-17	Sold prior to auction	2023-01-31	Undisclosed	4	2	1	1.0	992.0	MARQ Property	36-arndell-street-macquarie-act-2614
73546	Land	2023-01-17	$280,000	2023-02-13	$275,000	0	0	0		900.0	My Agent Team	20-litchfield-crescent-long-beach-nsw-2536
73549	House	2023-01-17	$900,000+	2023-01-31	Undisclosed	4	2	2	6.0		Stone Gungahlin	30-mornington-street-amaroo-act-2914
73556	Townhouse	2023-01-17	By Negotiation	2023-02-22	Undisclosed	2	1	1	6.0		New Door Properties	32-2-hoffmann-street-moncrieff-act-2914
73557	House	2023-01-17	By Negotiation	2023-05-19	$1,730,000	4	2	2	4.5	930.0	Stone Gungahlin	23-gadali-crescent-ngunnawal-act-2913
73559	House	2023-01-17	$749,000+	2023-04-26	Undisclosed	3	1	3	1.5	848.0	Ray White Canberra	13-willyama-place-flynn-act-2615
73563	House	2023-01-17	$885,000	2023-04-14	Undisclosed	4	2	2		600.0	Ben Bate Real Estate	5-hyland-avenue-narooma-nsw-2546
73564	House	2023-01-17	$869,000	2023-03-24	$869,000	3	2	2		651.0	McGrath Batemans Bay & Moruya	95-vista-avenue-catalina-nsw-2536
73566	AcreageSemi-rural	2023-01-17	By Negotiation	2023-02-09	Undisclosed	4	2	2		7242.0	MARQ Property	12-clover-close-murrumbateman-nsw-2582
73570	AcreageSemi-rural	2023-01-17	$1,780,000- $1,880,000	2023-03-06	$1,900,000	5	3	9		8.0	Ray White Bungendore	88-poppet-road-wamboin-nsw-2620
73576	Other	2023-01-17	Auction	2023-02-24	Undisclosed	3	1	6		1080.38	Ray White Rural Tumbarumba	857-tom-groggin-road-rock-flat-nsw-2630
73577	House	2023-01-17	Price Guide $795,000 - $845,000	2023-03-03	$795,000	4	2	2		671.0	Raine & Horne Southern Highlands	14-telopea-road-hill-top-nsw-2575
73578	House	2023-01-17	Auction	2023-02-18	Undisclosed	3	2	2		1.98	Ray White Rural Canberra | Yass	3-wattle-glen-murrumbateman-nsw-2582
73579	Apartment	2023-01-17	Offers Above $590,000	2023-02-17	Undisclosed	2	1	1	6.0		Luton Dickson	turner-2612-act
73581	Land	2023-01-17	$509,900	2023-06-27	$509,900	0	0	0	0.0	443.0	Village	lot-907-88-alpine-ash-way-tralee-nsw-2620
73590	House	2023-01-18	$775,000	2023-03-09	$749,000	4	1	2	2.5	1186.0	McCann Properties	13-balfour-crescent-wanniassa-act-2903
73591	House	2023-01-18	$970,000	2023-03-06	$945,000	4	2	2	1.0	880.0	McCann Properties	13-forwood-street-monash-act-2904
73594	House	2023-01-18	$430,000 - $460,000	2023-03-14	Undisclosed	3	1	1		767.0	Macarthur Real Estate Agency	4-patey-close-ashmont-nsw-2650
73597	Other	2023-01-18	Expressions of Interest	2023-02-13	$1,350,000	4	1	2		5.0	Belle Property Braidwood	230-bombay-road-braidwood-nsw-2622
73598	House	2023-01-18	$399,000	2023-05-25	Undisclosed	3	1	2		784.1	Macarthur Real Estate Agency	15-macarthur-street-ashmont-nsw-2650
73600	Unit	2023-01-18	$558,000	2023-01-30	$550,000	2	1	1			Dwyer Properties Sapphire Coast	2-21-marine-parade-merimbula-nsw-2548
73602	House	2023-01-18	$695,000	2023-02-20	Undisclosed	3	2	1		556.0	LJ Hooker Batemans Bay	89-berrima-parade-surfside-nsw-2536
73603	House	2023-01-18	$695,000	2023-02-20	Undisclosed	3	2	1		556.0	LJ Hooker Malua Bay	89-berrima-parade-surfside-nsw-2536
73605	Apartment	2023-01-18	$600,000	2023-05-15	$600,000	3	2	2	5.0		home.by holly	27-31-thynne-street-bruce-act-2617
73606	House	2023-01-18	$840,000 - $880,000	2023-05-12	Undisclosed	4	2	2	1.5	960.0	McCann Properties	4-langridge-street-wanniassa-act-2903
73607	House	2023-01-18	$395,000 - $419,000	2023-04-06	Undisclosed	3	1	1		739.8	Macarthur Real Estate Agency	82-fernleigh-road-mount-austin-nsw-2650
73614	House	2023-01-18	$440,000	2023-04-26	$420,000	3	1	1		443.0	Henley Property - Cooma	57-wangie-street-cooma-nsw-2630
73615	House	2023-01-18	$660,000	2023-07-26	$640,000	2	1	4		7.96	Ray White Canberra	353-scotts-road-binjura-nsw-2630
73617	House	2023-01-18	$989,000	2023-02-27	$950,000	4	3	2		1239.0	Raine & Horne Goulburn	130-deccan-street-goulburn-nsw-2580
73618	Villa	2023-01-18	$217,000	2023-03-06	Undisclosed	2	1	1		118.0	Macarthur Real Estate Agency	1-13-edney-street-kooringal-nsw-2650
73619	Townhouse	2023-01-18	$685,000	2023-02-08	$685,000	2	2	2	6.0		MARQ Property	17-7-shewcroft-street-watson-act-2602
73620	House	2023-01-18	$850,000-$950,000	2023-02-24	$880,000	5	2	3	3.5	1073.0	Stone Gungahlin	87-shakespeare-crescent-fraser-act-2615
73624	Apartment	2023-01-18	$553,000	2023-03-03	$553,000	2	2	2	6.0		MARQ Property	119-49-nullarbor-avenue-franklin-act-2913
73625	House	2023-01-18	$1,190,000 - $1,290,000	2023-04-04	Undisclosed	4	2	4		2.03	Ray White Wagga Wagga	9-poplar-road-lake-albert-nsw-2650
73628	House	2023-01-18	$719,000 to $729,000	2023-04-04	$690,000	4	3	2		1034.0	PRD Wagga Wagga	34-balmoral-crescent-lake-albert-nsw-2650
73630	Apartment	2023-01-18	$400,000+	2023-05-25	$397,000	1	1	1	6.0		McIntyre Property	24-311-anketell-street-greenway-act-2900
73631	House	2023-01-18	$995,000	2023-02-04	$995,000	4	2	2	5.5	469.0	MARQ Property	3-lett-place-amaroo-act-2914
73636	House	2023-01-18	$765,000	2023-03-22	Undisclosed	4	2	2		709.6	Macarthur Real Estate Agency	79-strickland-drive-boorooma-nsw-2650
73637	House	2023-01-18	845000	2023-02-10	$845,000	3	1	1		584.0	Smile Elite	24-gordon-road-long-jetty-nsw-2261
73638	House	2023-01-18	Auction 11/02/2023	2023-02-11	$1,550,000	4	3	2	6.0	944.0	Ray White Canberra	2-ringrose-crescent-isaacs-act-2607
73641	Townhouse	2023-01-18	$599,000+	2023-02-21	$600,000	2	3	1	6.0		LJ Hooker Canberra City	45-16-cornelius-street-coombs-act-2611
73642	House	2023-01-18	$1,350,000	2023-03-23	Undisclosed	4	2	4		24600.0	PRD Wagga Wagga	519-shepherds-siding-road-harefield-nsw-2650
73643	Apartment	2023-01-18	$630,000	2023-03-29	$630,000	2	2	2	6.0		LJ Hooker Belconnen	107-39-benjamin-way-belconnen-act-2617
73647	House	2023-01-18	Auction	2023-02-11	$1,100,000	3	1	1	1.5	838.0	LJ Hooker Belconnen	20-gingana-street-aranda-act-2614
73651	House	2023-01-18	Sold Prior to Auction	2023-02-10	Undisclosed	3	1	7	1.0	984.0	Impact Properties	1-hooper-crescent-flynn-act-2615
73652	Townhouse	2023-01-18	Auction	2023-02-06	Undisclosed	2	2	2	6.0		Luton Gungahlin	48-15-jumbuck-crescent-lawson-act-2617
73654	House	2023-01-18	$749,000	2023-02-24	$720,000	3	1	4		1012.0	Henley Property - Berridale	66-myack-street-berridale-nsw-2628
73660	Apartment	2023-01-18	$550,000	2023-02-06	Undisclosed	2	2	1			Merimbula Realty	4-20-elizabeth-street-merimbula-nsw-2548
73664	House	2023-01-18	Contact Agent	2023-03-31	Undisclosed	4	2	2	4.5		New Door Properties	166-mabo-boulevard-bonner-act-2914
73672	Livestock	2023-01-18	EOI	2023-03-06	Undisclosed	3	0	0		758.0	LAWD	968-boambolo-road-yass-nsw-2582
73677	Apartment	2023-01-19	$970,000	2023-03-24	$968,000	3	2	2	4.5		MARQ Property	1204-8-gribble-street-gungahlin-act-2912
73678	DuplexSemi-detached	2023-01-19	$949,000	2023-04-05	Undisclosed	4	2	2	5.0	318.0	Luton Weston Creek & Molonglo Valley	34a-mulley-street-holder-act-2611
73679	House	2023-01-19	Expressions of Interest	2023-05-04	Undisclosed	3	2	2	1.0	707.0	Luton Weston Creek & Molonglo Valley	13-somerset-street-duffy-act-2611
73680	Apartment	2023-01-19	$375,000+	2023-02-03	$376,000	1	1	1	6.0		Impact Properties	11-90-gozzard-street-gungahlin-act-2912
73681	House	2023-01-19	$1,210,000	2023-02-11	$1,210,000	4	2	2	6.0	465.0	home.by holly	39-plimsoll-drive-casey-act-2913
73682	Apartment	2023-01-19	Offers Above $680,000	2023-02-08	$690,000	2	2	2	6.0		Cream Residential	28-15-coranderrk-street-canberra-act-2601
73683	House	2023-01-19	Auction	2023-02-11	$900,000	4	2	2	5.0	469.0	Luton Gungahlin	9-kangaroo-close-nicholls-act-2913
73686	Apartment	2023-01-19	$595,000+	2023-03-31	Undisclosed	2	1	1	6.0		Ray White Canberra	14-21-ijong-street-braddon-act-2612
73688	House	2023-01-19	Auction	2023-02-07	Undisclosed	3	1	1	4.5	383.0	Luton Gungahlin	20-phelp-court-amaroo-act-2914
73689	Apartment	2023-01-19	$420,000+	2023-02-20	$430,000	2	1	1	6.0		LJ Hooker Gungahlin	36-2-sapling-street-harrison-act-2914
73692	House	2023-01-19	$1,150,000	2023-02-14	$1,150,000	4	3	2	2.0	830.0	home.by holly	19-bean-crescent-mckellar-act-2617
73693	Other	2023-01-19	$2,100,000	2023-07-28	Undisclosed	4	2	0		14.6	McIntyre Property	535-kooringal-road-lake-albert-nsw-2650
73694	House	2023-01-19	$860,000 - $900,000	2023-02-03	$870,000	5	3	2		556.0	My Agent Team	4-boondi-street-malua-bay-nsw-2536
73695	House	2023-01-19	$639,000	2023-02-16	Undisclosed	5	3	3		739.0	PRD Wagga Wagga	17-panorama-street-kooringal-nsw-2650
73697	House	2023-01-19	$779,000+	2023-04-28	Undisclosed	3	2	2	1.5		Ray White Canberra	6-79-blackman-crescent-macquarie-act-2614
73704	House	2023-01-19	$995,000+	2023-03-14	Undisclosed	6	2	2	2.5	840.0	LJ Hooker Tuggeranong	45-hadleigh-circuit-isabella-plains-act-2905
73705	Apartment	2023-01-19	350,000+	2023-03-07	$360,000	1	1	1	6.0		LJ Hooker Canberra City	13-350-gundaroo-drive-gungahlin-act-2912
73709	House	2023-01-19	$1,195,000	2023-03-10	Undisclosed	6	3	2	4.0		My Morris	24-kirkwood-crescent-gordon-act-2906
73711	Unit	2023-01-19	$340,000 - $370,000	2023-03-03	$350,000	2	1	1			Ray White Queanbeyan | Jerrabomberra	14-12-federal-avenue-crestwood-nsw-2620
73712	House	2023-01-19	Auction 09/02/2023	2023-02-09	Undisclosed	3	1	2	2.0	799.0	Ray White Canberra	44-greenvale-street-fisher-act-2611
73713	House	2023-01-19	$699,000+	2023-03-02	Undisclosed	3	1	1	1.5		Ray White Canberra	98-wybalena-grove-cook-act-2614
73714	Unit	2023-01-19	$345,000+	2023-03-17	$345,000	1	1	1	3.5		McIntyre Property	11-byron-court-12-albermarle-place-phillip-act-2606
73715	Townhouse	2023-01-19	$675,000+	2023-02-15	$700,000	3	2	2	6.0		Badenoch Real Estate	24-128-flemington-road-harrison-act-2914
73716	House	2023-01-19	Auction 11/02/2023	2023-02-11	$947,000	4	2	6	6.0	350.0	Ray White Canberra	67-lorraway-street-holt-act-2615
73717	Apartment	2023-01-19	$799,000+	2023-02-10	Undisclosed	2	2	2	6.0		LJ Hooker Manuka	405-6-provan-street-campbell-act-2612
73718	Apartment	2023-01-19	Auction	2023-02-04	$631,000	3	2	2	5.5		LJ Hooker Belconnen	3-36-morell-close-belconnen-act-2617
73719	House	2023-01-19	$729,000	2023-04-04	$707,000	3	2	2		644.0	LJ Hooker Tuross Head	16-andrew-avenue-tuross-head-nsw-2537
73727	House	2023-01-19	Forthcoming Auction	2023-02-18	$575,000	3	1	1		556.0	First National Real Estate Batemans Bay	26-timbara-crescent-surfside-nsw-2536
73729	DuplexSemi-detached	2023-01-19	$590,000 - $625,000	2023-04-03	Undisclosed	4	2	1		336.0	LJ Hooker Sussex Inlet	28a-lancing-avenue-sussex-inlet-nsw-2540
73734	Villa	2023-01-19	$360,000 - $380,000	2023-03-03	Undisclosed	2	1	1		208.0	Macarthur Real Estate Agency	2-2-plumpton-road-kooringal-nsw-2650
73735	House	2023-01-19	$1,285,000	2023-06-08	Undisclosed	3	2	1		599.0	McGoldrick Estate Agents	10-north-street-berry-nsw-2535
73737	Apartment	2023-01-19	$435,000	2023-03-09	$435,000	1	1	1	6.0		home.by holly	12-43-ijong-street-braddon-act-2612
73744	House	2023-01-19	$750,000 - $820,000	2023-05-11	Undisclosed	3	1	1	2.0	668.0	McIntyre Property	36-benson-crescent-calwell-act-2905
73748	Unit	2023-01-19	$539,000	2023-04-11	$500,000	2	1	2			Tathra Beach Real Estate	4-4-reid-street-merimbula-nsw-2548
73751	Apartment	2023-01-19	$495,000+	2023-03-16	$500,000	2	2	2	6.0	1.58	LJ Hooker Gungahlin	296-1-anthony-rolfe-avenue-gungahlin-act-2912
73759	House	2023-01-19	Guide $850,000	2023-06-02	$800,000	4	2	2		743.0	Ray White Goulburn	32-roebuck-street-goulburn-nsw-2580
73760	House	2023-01-19	Auction	2023-02-09	$850,000	4	2	2	0.0	708.0	Luton Kippax	19-horsley-crescent-melba-act-2615
73762	House	2023-01-19	Auction	2023-02-11	$1,040,000	4	2	2	6.0		Luton Gungahlin	40-gruzman-view-taylor-act-2913
73766	House	2023-01-19	$830,000	2023-02-17	$840,000	3	1	2	1.0	353.0	LJ Hooker Belconnen	29-elkedra-close-hawker-act-2614
73767	House	2023-01-19	$815,000	2023-03-22	Undisclosed	4	2	2		683.9	Macarthur Real Estate Agency	76-coppabella-drive-gobbagombalin-nsw-2650
73772	Townhouse	2023-01-19	$525,000+	2023-01-30	Undisclosed	2	1	2	6.0		Luton Gungahlin	29-15-andersch-street-casey-act-2913
73778	Apartment	2023-01-20	$499,000	2023-02-08	Undisclosed	2	1	1	5.0		Luton Manuka	4-13-15-sturt-avenue-griffith-act-2603
73779	House	2023-01-20	Auction 11/02/2023	2023-02-11	$1,315,000	5	3	2	1.5	1274.0	Ray White Canberra	15-tanumbirini-street-hawker-act-2614
73780	House	2023-01-20	Auction Sat, 11th Feb at 2:30pm	2023-02-11	$727,000	3	1	1	5.5	298.0	LJ Hooker Gungahlin	5-ron-hoy-street-macgregor-act-2615
73781	House	2023-01-20	$830,000	2023-04-11	$810,000	4	1	3		1445.0	Dwyer Properties Sapphire Coast	5-bellbird-court-wolumla-nsw-2550
73784	Unit	2023-01-20	$649,000	2023-03-15	$625,000	3	2	2		496.0	PRD Wagga Wagga	2-claymore-road-estella-nsw-2650
73787	DuplexSemi-detached	2023-01-20	$718,000	2023-06-07	$700,000	3	2	1		285.0	Marshall and Tacheci Real Estate	60a-parbery-avenue-bermagui-nsw-2546
73788	House	2023-01-20	$749,000 - $765,000	2023-05-10	$740,000	3	1	1		652.0	Bella Coastal Property	16-hapgood-close-kioloa-nsw-2539
73798	DuplexSemi-detached	2023-01-20	Auction 11/02/2023	2023-02-11	Undisclosed	4	2	2	6.0		Bastion Property Group	1-2-morrell-place-rivett-act-2611
73799	House	2023-01-20	1250000	2023-02-17	$1,250,000	3	2	2		525.0	Smile Elite	37-horsley-road-oak-flats-nsw-2529
73802	House	2023-01-20	$595,000	2023-06-06	$575,000	3	1	1		664.0	McGrath Batemans Bay & Moruya	138-country-club-drive-catalina-nsw-2536
73806	House	2023-01-20	Contact Agent	2023-04-04	Undisclosed	4	2	2	1.5	1213.0	Luton Tuggeranong	458-bugden-avenue-fadden-act-2904
73807	House	2023-01-20	Auction	2023-03-04	$745,000	3	2	4	1.5	1018.0	Luton Tuggeranong	8-tuck-place-richardson-act-2905
73808	Villa	2023-01-20	$340,000 - $370,000	2023-02-22	$355,000	2	1	1			Merimbula Realty	57-3197-princes-highway-millingandi-nsw-2548
73815	House	2023-01-20	Auction 04/02/2023	2023-02-04	Undisclosed	4	2	2	5.0		Ray White Canberra	3-chuditch-street-throsby-act-2914
73817	House	2023-01-20	Contact Agent	2023-03-09	$1,375,000	5	3	2	4.5	917.0	Maria Selleck Properties	8-comet-street-amaroo-act-2914
73820	Land	2023-01-20	$45,000	2023-02-09	$45,000	0	0	0		1012.0	Kitson Property	lot-4-finlayson-lane-yerong-creek-nsw-2642
73823	House	2023-01-20	$1,165,000	2023-03-31	$1,120,000	4	2	2		1555.0	Belle Property Braidwood	5-hassall-circuit-braidwood-nsw-2622
73833	House	2023-01-20	$1,050,000	2023-05-26	Undisclosed	4	2	4		4844.0	Henley Property - Cooma	27-soho-street-cooma-nsw-2630
73837	Other	2023-01-20	Expressions of Interest	2023-02-06	Undisclosed	4	1	4		17.82	Belle Property Braidwood	225-brightside-road-braidwood-nsw-2622
73841	House	2023-01-20	550000	2023-05-12	$550,000	4	2	2		603.0	Smile Elite	30-peppermint-road-muswellbrook-nsw-2333
73847	House	2023-01-21	PREVIEW 	2023-02-23	$280,000	2	1	1		561.0	One Agency Wagga Wagga	13a-angel-street-lake-albert-nsw-2650
73848	House	2023-01-21	$1,395,000	2023-03-27	$1,375,000	4	3	2		5.0	John Mooney Real Estate	8-silverwood-road-lake-albert-nsw-2650
73854	House	2023-01-21	1522000	2023-03-04	$1,522,000	5	3	2		465.0	Smile Elite	21-stamford-bridge-avenue-north-kellyville-nsw-2155
73860	House	2023-01-23	$750,000 - $790,000	2023-02-15	$750,000	3	1	2		613.0	LJ Hooker Sussex Inlet	25-iverison-road-sussex-inlet-nsw-2540
73861	Townhouse	2023-01-23	$640,000+	2023-05-04	$650,000	3	2	1	6.0	91.0	LJ Hooker Gungahlin	7-57-bellhouse-crescent-moncrieff-act-2914
73862	House	2023-01-23	$810,000 to $850,000	2023-03-03	$815,000	3	2	2	4.5	548.0	LJ Hooker Gungahlin	7-naas-close-amaroo-act-2914
73873	House	2023-01-23	Auction Sunday 26th February at 10am	2023-02-26	$1,067,000	4	2	5	0.0	17.0	McCann Properties	128-collector-road-gunning-nsw-2581
73874	Apartment	2023-01-23	$520,000+	2023-02-23	$540,000	2	2	1	6.0		McIntyre Property	15-40-eileen-good-street-greenway-act-2900
73876	Apartment	2023-01-23	$569,950	2023-03-01	Undisclosed	2	2	2	6.0		McIntyre Property	5-108-athllon-drive-greenway-act-2900
73881	Cropping	2023-01-23	$280,000	2023-03-22	$270,000	0	0	0		55.0	Ray White Bungendore	227-caseys-road-bredbo-nsw-2626
73883	House	2023-01-23	$998,000	2023-03-15	$980,000	3	2	4		2.09	Clearwater Real Estate Narooma	39-pear-tree-pl-moruya-nsw-2537
73884	House	2023-01-23	$999,000-$1,025,000	2023-05-19	$985,000	4	2	2		1021.0	Ray White Bungendore	1-finch-street-bungendore-nsw-2621
73886	House	2023-01-23	$848,000	2023-08-01	$820,000	3	2	1		826.0	Marshall and Tacheci Real Estate	60-wallaga-lake-road-bermagui-nsw-2546
73887	Unit	2023-01-23	$450,000 to $480,000	2023-03-02	$442,000	2	1	1			Sails Real Estate	5-40-main-street-merimbula-nsw-2548
73888	House	2023-01-23	$960,000	2023-03-17	$960,000	4	3	2		917.0	My Agent Team	20-yarralumla-crescent-tomakin-nsw-2537
73892	Unit	2023-01-23	$425,000+	2023-03-17	Undisclosed	2	1	1	6.5		McIntyre Property	38-90-door-207-swain-street-gungahlin-act-2912
73895	House	2023-01-23	$1.100,000	2023-02-22	Undisclosed	4	3	2			Merimbula Realty	7-culgoa-cres-pambula-beach-nsw-2549
73896	Townhouse	2023-01-23	$1,885,000	2023-02-22	$1,885,000	4	3	2	5.0		home.by holly	2-50-savige-street-campbell-act-2612
73897	House	2023-01-23	$699,000+	2023-03-14	$725,000	3	2	1	6.0	300.0	LJ Hooker Kippax	28-eric-de-salis-street-macgregor-act-2615
73901	DuplexSemi-detached	2023-01-23	$1,895,000	2023-10-04	Undisclosed	5	5	1		432.0	Raine & Horne Mollymook Milton	17b-mitchell-parade-mollymook-beach-nsw-2539
73902	Lifestyle	2023-01-23	$1,650,000	2023-02-10	Undisclosed	3	1	0		50.0	LAWD	222-grogans-road-binalong-nsw-2584
73910	House	2023-01-23	$460,000	2023-02-14	Undisclosed	3	1	2		525.0	Flemings Property Services	11-main-street-young-nsw-2594
73912	House	2023-01-23	$900,000 - $990,000	2023-05-05	Undisclosed	4	2	3		651.0	LJ Hooker Ulladulla	26-lake-view-drive-burrill-lake-nsw-2539
73913	House	2023-01-23	$820,000 - $850,000	2023-04-03	$825,000	3	2	1		607.0	Merimbula Realty	25-beverley-street-merimbula-nsw-2548
73920	House	2023-01-23	$819,000	2023-03-01	$750,000	4	2	1		697.0	Raine & Horne Mollymook Milton	124-warden-street-ulladulla-nsw-2539
73921	House	2023-01-24	Auction 18/02/2023	2023-02-18	Undisclosed	4	2	1	5.0		Ray White Canberra	42-yarra-street-kaleen-act-2617
73924	House	2023-01-24	Auction	2023-02-18	$950,000	4	3	2	3.0	684.0	Luton Manuka	7-daplyn-close-weston-act-2611
73925	Apartment	2023-01-24	$480,000+	2023-03-17	$470,000	2	2	1	6.0		McIntyre Property	105-2-peter-cullen-way-wright-act-2611
73927	Apartment	2023-01-24	$676,500	2023-02-15	$676,500	2	2	1	6.0		MARQ Property	4-38-watson-street-turner-act-2612
73932	Townhouse	2023-01-24	$549,000+	2023-03-01	Undisclosed	2	1	1	3.0		LJ Hooker Woden/Weston	5-35-marshall-street-farrer-act-2607
73933	House	2023-01-24	Offers around $1,800,000	2023-03-14	Undisclosed	2	2	5		1939.0	Whale Coast Realty	1-3-jocelyn-street-dalmeny-nsw-2546
73934	Unit	2023-01-24	$365,000+	2023-03-31	$356,000	2	2	1	0.0	2416.0	Wright Dunn Real Estate	6-127-rivett-street-hackett-act-2602
73938	Townhouse	2023-01-24	$549,000+	2023-02-15	Undisclosed	2	1	1	4.5		Badenoch Real Estate	2-11-keene-place-page-act-2614
73940	House	2023-01-24	Auction 18/02/2023	2023-02-18	Undisclosed	3	1	2	2.5	447.0	Bastion Property Group	4-sully-place-chapman-act-2611
73941	House	2023-01-24	$649,000	2023-02-17	$630,000	5	2	1		964.0	My Agent Team	4-osprey-place-surfside-nsw-2536
73943	Land	2023-01-24	$260,000	2023-05-11	Undisclosed	0	0	0			Merimbula Realty	26-bega-st-candelo-nsw-2550
73944	House	2023-01-24	$595,000	2023-02-15	Undisclosed	4	2	2		819.9	LJ Hooker Wagga Wagga	12-nathan-place-kooringal-nsw-2650
73948	House	2023-01-24	Auction	2023-02-22	$1,810,000	4	2	2	6.0	581.0	LJ Hooker Kaleen	64-longstaff-street-lyneham-act-2602
73950	House	2023-01-24	Auction, 18/02/2023	2023-02-21	Undisclosed	2	1	3	5.5	613.0	Impact Properties	10-napper-place-charnwood-act-2615
73951	Townhouse	2023-01-24	$755,000	2023-02-17	$755,000	3	2	2			LJ Hooker Queanbeyan – Jerrabomberra – Googong	2-11-yass-road-queanbeyan-east-nsw-2620
73955	House	2023-01-24	Contact Agent	2023-03-08	Undisclosed	4	2	6	2.5	738.0	Ray White Canberra	46-macrossan-crescent-latham-act-2615
73959	House	2023-01-24	$389,000	2023-04-05	$370,000	3	1	1		575.4	Kitson Property	7-killara-avenue-mount-austin-nsw-2650
73963	House	2023-01-24	AUCTION 18/02/23	2023-01-31	Undisclosed	4	2	2		800.0	Ian McNamee & Partners - Queanbeyan	30-kinlyside-avenue-jerrabomberra-nsw-2619
73974	Townhouse	2023-01-25	Auction	2023-02-15	Undisclosed	3	2	2	3.5	437.0	Luton Weston Creek & Molonglo Valley	44b-arndell-street-macquarie-act-2614
73975	House	2023-01-25	Auction	2023-02-18	$940,000	5	3	3	1.0	1096.0	Luton Weston Creek & Molonglo Valley	7-samson-place-kambah-act-2902
73976	Townhouse	2023-01-25	$725,000	2023-05-22	$725,000	3	2	2	5.0		Hugo. Canberra	16-18-zamia-place-palmerston-act-2913
73977	House	2023-01-25	$749,000+	2023-03-21	Undisclosed	4	2	1	4.0		MARQ Property	64-pickworth-street-holt-act-2615
73980	Townhouse	2023-01-25	$640,000	2023-03-02	$640,000	2	2	2	6.0	147.0	home.by holly	106-stockman-avenue-lawson-act-2617
73983	House	2023-01-25	Auction	2023-02-11	$820,000	3	2	2	4.0	507.0	LJ Hooker Belconnen	70-hugh-mckay-crescent-dunlop-act-2615
73984	House	2023-01-25	$1,125,000	2023-03-16	$1,100,000	5	3	2	3.0	982.0	Luton Tuggeranong	11-armfield-place-chisholm-act-2905
73986	Apartment	2023-01-25	$465,000+	2023-02-17	$510,000	1	1	1	6.0		LJ Hooker Dickson	309-1-mouat-street-lyneham-act-2602
73988	Villa	2023-01-25	$436,000	2023-02-10	$436,000	2	1	1			LJ Hooker Queanbeyan – Jerrabomberra – Googong	3-30-donald-road-queanbeyan-nsw-2620
73989	House	2023-01-25	Auction	2023-02-17	Undisclosed	3	1	0	5.5	1234.0	Luton Weston Creek & Molonglo Valley	26-jim-bradley-crescent-uriarra-village-act-2611
73991	House	2023-01-25	$660,000	2023-02-18	$660,000	2	1	1	4.0	327.0	home.by holly	11-allott-place-belconnen-act-2617
73995	Unit	2023-01-25	$500,000 - $550,000	2023-03-14	$515,000	2	2	2			Ray White Queanbeyan | Jerrabomberra	27-161-uriarra-road-crestwood-nsw-2620
73996	House	2023-01-25	Auction 18/02/2023	2023-02-16	Undisclosed	3	1	5	6.0		Ray White Canberra	15-atherton-street-downer-act-2602
73997	House	2023-01-25	By Negotiation	2023-03-10	Undisclosed	2	2	2	6.0		Ray White Canberra	54-44-macquarie-street-barton-act-2600
74000	Unit	2023-01-25	$425,000	2023-02-23	$425,000	2	1	1		3817.0	Henley Property - Berridale	19-5-gungarlin-street-berridale-nsw-2628
74001	House	2023-01-25	$820,000+	2023-02-16	$835,000	3	1	2	3.0	1072.0	LJ Hooker Tuggeranong	2-enid-lorimer-circuit-chisholm-act-2905
74003	House	2023-01-25	$865,000+	2023-08-29	Undisclosed	3	2	0	0.5	719.0	Ray White Canberra	12-girdlestone-circuit-calwell-act-2905
74004	House	2023-01-25	$720,000	2023-03-16	Undisclosed	3	2	1	6.0	194.0	LJ Hooker Belconnen	96-tredwell-street-strathnairn-act-2615
74005	Other	2023-01-25	$980,000-$1,040,000	2023-05-31	$980,000	4	2	2		812.0	Raine & Horne Goulburn	70-quiberon-way-goulburn-nsw-2580
74006	Apartment	2023-01-25	Auction 16/02/2023	2023-02-17	Undisclosed	2	2	1	6.0		Ray White Canberra	255-12-limburg-way-greenway-act-2900
74012	House	2023-01-25	$950,000+	2023-03-08	Undisclosed	3	2	3	3.0	948.0	Bertram Ellis	32-rafferty-street-chapman-act-2611
74013	Townhouse	2023-01-25	Auction 16/02/2023	2023-02-16	Undisclosed	1	1	1	6.0		Ray White Canberra	3-13-coppin-place-weetangera-act-2614
74018	House	2023-01-25	$1,290,000	2023-03-28	Undisclosed	4	2	2	4.5	1055.0	Luton Tuggeranong	44-mt-vernon-drive-kambah-act-2902
74020	House	2023-01-18	Auction	2023-02-12	Undisclosed	4	2	2	5.5	449.0	Altair Property	5-rylstone-crescent-crace-act-2911
74021	Apartment	2023-01-25	Enquire Today!	2023-08-01	$550,000	1	1	1	6.0		Crowthers	1003-25-edinburgh-avenue-city-act-2601
74023	Apartment	2023-01-25	$420,000+	2023-02-20	Undisclosed	1	1	1	6.0		Ray White Canberra	43-41-chandler-street-belconnen-act-2617
74027	House	2023-01-25	$1,430,000	2023-02-18	$1,430,000	3	1	2	2.0	634.0	home.by holly	14-feakes-place-campbell-act-2612
74032	Apartment	2023-01-25	$420,000+	2023-02-14	$433,000	1	1	1	6.0		LJ Hooker Dickson	7-6-guthrie-street-dickson-act-2602
74035	House	2023-01-25	$615,000	2023-04-14	Undisclosed	2	1	1		562.8	Macarthur Real Estate Agency	55-brookong-avenue-wagga-wagga-nsw-2650
74040	House	2023-01-25	Auction	2023-02-18	$760,000	3	2	1	6.0	251.0	Luton Gungahlin	45-neil-currie-street-casey-act-2913
74043	House	2023-01-25	$439,000	2023-03-03	Undisclosed	3	1	6		2023.0	Ray White Wagga Wagga	44-wagga-wagga-street-oura-nsw-2650
74046	House	2023-01-25	Sold	2023-03-02	$320,000	2	1	1			The Property Collective	3-120-henderson-road-queanbeyan-nsw-2620
74047	House	2023-01-25	Sold	2023-02-02	$670,000	3	1	2		558.0	The Property Collective	6-mcintosh-street-queanbeyan-nsw-2620
74049	House	2023-01-25	Sold	2023-02-16	$410,000	1	1	1			The Property Collective	18-9-stornaway-road-queanbeyan-nsw-2620
74051	Townhouse	2023-01-25	$690,000 - $740,000	2023-03-29	Undisclosed	3	2	1	3.5	273.0	Luton Tuggeranong	1-15-weavell-place-kambah-act-2902
74053	House	2023-01-25	$760,000+	2023-03-15	$775,000	3	1	0	0.0	702.0	LJ Hooker Tuggeranong	21-mcmaster-street-scullin-act-2614
74055	House	2023-01-25	$690,000 - $740,000	2023-02-16	Undisclosed	3	2	3		803.0	My Agent Team	12-blue-gum-parade-maloneys-beach-nsw-2536
74057	Townhouse	2023-01-25	Contact Agent	2023-02-20	$1,195,000	3	2	2	3.5		Luton Dickson	23-11-joy-cummings-place-belconnen-act-2617
74059	Apartment	2023-01-24	$749,000+	2023-03-29	$740,000	2	2	2	6.0		PURNELL	47-5-burbury-close-barton-act-2600
74061	House	2023-01-25	Auction	2023-02-20	$1,010,000	3	1	1	0.0	716.0	Luton Dickson	10-swinden-street-downer-act-2602
74065	House	2023-01-25	$650,000 - $690,000	2023-08-23	$625,000	2	1	2		677.0	McGrath Batemans Bay & Moruya	17-timbara-crescent-surfside-nsw-2536
74066	House	2023-01-25	Auction 18/02/2023	2023-02-18	$877,500	3	2	2	5.0	437.0	Ray White Canberra	192-macfarlane-burnet-avenue-macgregor-act-2615
74067	House	2023-01-25	$1,220,000	2023-03-13	$1,220,000	3	1	1	2.5	905.0	home.by holly	27-tyson-street-ainslie-act-2602
74068	House	2023-01-25	$880,000	2023-02-17	$880,000	4	2	1	1.0		home.by holly	14-griffiths-street-holt-act-2615
74071	House	2023-01-25	$279,000	2023-02-03	Undisclosed	3	1	1		765.0	PRD Wagga Wagga	3-timor-place-ashmont-nsw-2650
74072	House	2023-01-25	$1,095,000	2023-02-18	$1,095,000	4	2	3	3.0		home.by holly	19-mcclure-street-evatt-act-2617
74073	House	2023-01-25	Auction	2023-02-08	$765,000	3	1	4	1.0	720.0	Luton Gungahlin	27-sellwood-street-holt-act-2615
74074	House	2023-01-25	$999,000+	2023-03-28	$1,010,100	4	2	2	5.5	465.0	Luton Gungahlin	14-hogg-street-casey-act-2913
74075	House	2023-01-26	$620,000 - $670,000	2023-02-22	$665,000	4	2	3		865.0	One Agency Wagga Wagga	12-magnolia-parade-lake-albert-nsw-2650
74077	House	2023-01-26	$1,295,000	2023-03-02	$1,230,000	5	2	2	2.0	1142.0	Michael Potter Real Estate	62-bindaga-street-aranda-act-2614
74078	House	2023-01-26	$815,000	2023-03-02	$815,000	3	1	2	1.5	889.0	Stone Gungahlin	35-nulsen-circuit-flynn-act-2615
74080	Terrace	2023-01-26	Offers above $679,000	2023-02-14	$700,000	3	1	2	0.0	501.0	Michael Potter Real Estate	31-cavanough-street-phillip-act-2606
74085	House	2023-01-27	$899,000+	2023-03-09	$895,000	4	2	2	6.0		PURNELL	23-cameleer-lane-strathnairn-act-2615
74086	House	2023-01-27	AUCTION	2023-02-17	$860,000	4	2	2	0.5	891.0	McIntyre Property	2-gibbs-place-kambah-act-2902
74088	House	2023-01-27	$475,000	2023-04-04	Undisclosed	3	1	2		713.1	Macarthur Real Estate Agency	88-dalman-parkway-glenfield-park-nsw-2650
74093	Apartment	2023-01-27	$438,500	2023-02-24	$438,500	2	1	1	6.0		home.by holly	11-35-tay-street-watson-act-2602
74094	House	2023-01-27	$809,000	2023-05-19	$805,000	4	2	6		1059.0	Ray White Goulburn	17-eliza-power-drive-marulan-nsw-2579
74095	House	2023-01-27	Auction	2023-03-18	$610,000	3	1	2	1.0	585.0	LJ Hooker Belconnen	20-garrad-court-charnwood-act-2615
74098	Townhouse	2023-01-27	$520,000+	2023-02-23	Undisclosed	2	1	1	6.0		Luton Gungahlin	18-quealy-street-casey-act-2913
74101	House	2023-01-27	Auction 18/02/2023	2023-02-18	$1,297,500	3	1	1	5.0	725.0	LJ Hooker Dickson	8-shortland-crescent-ainslie-act-2602
74102	House	2023-01-27	AUCTION - 3rd March 2023	2023-03-03	$690,000	3	1	1		512.2	Ray White Goulburn	9-beppo-street-goulburn-nsw-2580
74104	House	2023-01-27	$460,000 - $480,000	2023-04-04	Undisclosed	4	2	2		702.5	Macarthur Real Estate Agency	20-sackville-drive-forest-hill-nsw-2651
74105	House	2023-01-27	Auction 16/02/2023	2023-02-16	Undisclosed	4	2	2	2.0	1071.0	Ray White Canberra	6-davis-street-weetangera-act-2614
74107	House	2023-01-27	Auction 18/02/2023	2023-02-18	Undisclosed	4	2	2	4.0	880.0	Ray White Canberra	11-bathurst-place-macquarie-act-2614
74109	House	2023-01-27	Auction	2023-02-18	$1,000,000	4	2	2	5.0	449.0	Luton Gungahlin	64-essie-coffey-street-bonner-act-2914
74129	House	2023-01-27	$810,000	2023-09-15	$756,000	3	2	2		684.0	Marshall and Tacheci Real Estate	29-hart-street-bermagui-nsw-2546
74132	House	2023-01-27	Price Guide $790,000	2023-04-04	Undisclosed	3	2	2			Merimbula Realty	187-pacific-way-tura-beach-nsw-2548
74135	House	2023-01-27	Auction	2023-02-17	Undisclosed	4	3	2	6.0	615.0	Confidence Real Estate	15-berenice-street-taylor-act-2913
74136	Unit	2023-01-27	SOLD	2023-03-15	Undisclosed	2	1	1			Flemings Property Services	7-97-sutton-street-cootamundra-nsw-2590
74138	Apartment	2023-01-27	$509,000 +	2023-03-03	$510,000	1	1	1	4.0		LJ Hooker Woden/Weston	91-3-london-circuit-city-act-2601
74139	House	2023-01-27	Auction 16/02/2023	2023-02-16	Undisclosed	4	2	2	3.5		Ray White Canberra	7-cumpston-place-macgregor-act-2615
74141	House	2023-01-27	$1,750,000	2023-03-22	Undisclosed	3	3	2		1000.0	Ben Bate Real Estate	22-attunga-street-dalmeny-nsw-2546
74151	House	2023-01-27	$829,000	2023-03-08	$819,000	3	2	1		556.0	Hallmark Real Estate Advisors	23-coogee-street-tuross-head-nsw-2537
74154	House	2023-01-28	$840,000 - $890,000	2023-02-22	$880,000	4	2	2		706.0	One Agency Wagga Wagga	15-jimberoo-loop-gobbagombalin-nsw-2650
74159	House	2023-01-30	$1,495,000	2023-03-28	Undisclosed	4	3	2	5.5	777.0	My Morris	6-sidaway-street-chapman-act-2611
74168	House	2023-01-30	$950,000 - $1,000,000	2023-02-16	$950,000	4	2	2		664.0	My Agent Team	11-wattle-crescent-batehaven-nsw-2536
74169	House	2023-01-30	$419,000	2023-01-27	$420,381	3	1	2		647.7	Kitson Property	17-eaton-street-ashmont-nsw-2650
74174	House	2023-01-30	Sold	2023-03-03	$930,000	4	2	3		487.0	The Property Collective	2-11-urangarra-place-jerrabomberra-nsw-2619
74175	House	2023-01-30	$920,000-$940,000	2023-03-10	$905,000	4	2	2		450.0	The Property Collective	9-hopkins-street-googong-nsw-2620
74181	House	2023-01-30	Sold	2023-02-27	$750,000	3	1	2		578.0	The Property Collective	20a-river-drive-karabar-nsw-2620
74182	House	2023-01-30	$215,000-$245,000	2023-08-18	$222,000	1	1	1			The Property Collective	16-9-macquoid-street-queanbeyan-nsw-2620
74183	House	2023-01-30	$870,000-$910,000	2023-03-03	$840,000	3	2	2			The Property Collective	11-beard-street-queanbeyan-nsw-2620
74188	House	2023-01-30	$690,000 - $725,000	2023-07-13	$700,000	3	2	1		721.0	My Agent Team	16-long-beach-road-long-beach-nsw-2536
74194	House	2023-01-30	Sold $1,800,000	2023-02-18	$1,800,000	5	3	3	6.0	911.0	Blackshaw Gungahlin	56-bambridge-street-weetangera-act-2614
74198	House	2023-01-30	$520,000	2023-02-24	$500,000	4	2	2		720.0	Kitson Property	18-naretha-street-glenfield-park-nsw-2650
74203	House	2023-01-30	$999,000+	2023-03-02	Undisclosed	4	2	2	3.5	827.0	McIntyre Property	12-galmarra-street-ngunnawal-act-2913
74206	House	2023-01-30	Offers Over $790,000	2023-04-13	Undisclosed	4	1	1	2.0	1026.85	Ray White Canberra	8-millard-place-flynn-act-2615
74212	House	2023-01-30	$875,000	2023-02-24	$860,000	3	2	2		632.0	My Agent Team	7-reedy-place-malua-bay-nsw-2536
74215	Townhouse	2023-01-30	Auction	2023-02-04	$2,200,000	4	2	2	5.0		Badenoch Real Estate	22-somers-crescent-forrest-act-2603
74218	Apartment	2023-01-30	$590,000 Plus	2023-02-20	$590,000	2	1	1	5.0		Maloney's Property	33-11-howitt-street-kingston-act-2604
74227	Townhouse	2023-01-30	$1,210,000	2023-01-30	$1,210,000	3	2	2			Sails Real Estate	1-26-elizabeth-street-merimbula-nsw-2548
74228	House	2023-01-30	$640,000 - $660,000	2023-03-10	Undisclosed	3	2	2		418.8	Ray White Wagga Wagga	33-galing-place-wagga-wagga-nsw-2650
74239	House	2023-01-30	1465000	2023-02-17	$1,465,000	4	2	2		501.0	Smile Elite	23-stamford-bridge-avenue-north-kellyville-nsw-2155
74242	House	2023-01-31	$720,000 - $750,000	2023-03-16	$700,000	4	2	2		779.0	One Agency Wagga Wagga	113-strickland-drive-boorooma-nsw-2650
74243	Apartment	2023-01-31	$479,000	2023-05-16	Undisclosed	2	1	1	1.0		Luton Manuka	43-53-mcmillan-crescent-griffith-act-2603
74245	House	2023-01-31	$959,000	2023-03-03	$925,000	4	2	4		770.0	McGrath Batemans Bay & Moruya	20-clarence-street-long-beach-nsw-2536
74246	House	2023-01-31	Auction	2023-03-01	$708,000	3	1	1	2.5	362.0	LJ Hooker Canberra City	8-berkeley-street-dunlop-act-2615
74247	House	2023-01-31	Contact Agent	2023-03-03	$2,175,000	3	2	2		2511.0	Ray White Bowral	acrewood-3-belmore-falls-road-robertson-nsw-2577
74263	Apartment	2023-01-31	$550,000 +	2023-03-31	Undisclosed	3	2	2	6.0		Timothy Road	2102-120-eastern-valley-way-belconnen-act-2617
74271	House	2023-01-31	$140,000	2023-08-15	Undisclosed	2	1	1		1217.0	Flemings Property Services	232-neill-street-harden-nsw-2587
74272	House	2023-01-31	AUCTION on the 26/02/2023 at 12:45pm	2023-02-13	Undisclosed	4	2	2	5.0	337.0	Stone Gungahlin	49-henry-kendall-street-franklin-act-2913
74281	Unit	2023-01-31	$369,000	2023-03-07	$372,000	2	1	1		74.0	Ray White Queanbeyan | Jerrabomberra	12-1-mowatt-street-queanbeyan-nsw-2620
74288	House	2023-01-31	$849,000	2023-03-31	$810,000	3	2	1	1.0	831.0	McIntyre Property	3-trussell-place-kambah-act-2902
74289	House	2023-01-31	By Negotiation	2023-05-19	Undisclosed	4	2	2	6.0	612.0	New Door Properties	3-bronhill-street-moncrieff-act-2914
74290	House	2023-01-31	$820,000	2023-03-03	$820,000	3	2	2		510.0	LJ Hooker Queanbeyan – Jerrabomberra – Googong	20-pannamena-crescent-jerrabomberra-nsw-2619
74291	House	2023-01-31	AUCTION	2023-03-02	$890,000	4	2	2		663.0	The Property Collective	4-doeberl-place-queanbeyan-nsw-2620
74297	Apartment	2023-01-31	Auction	2023-02-18	$445,000	2	1	1	6.0		Luton Gungahlin	25-4-sapling-street-harrison-act-2914
74303	House	2023-01-31	$445,000	2023-02-28	Undisclosed	4	2	3		1012.0	Flemings Property Services	151-swift-street-harden-nsw-2587
74308	House	2023-01-31	$640,000	2023-03-22	Undisclosed	4	2	2		746.2	Macarthur Real Estate Agency	70-paperbark-drive-forest-hill-nsw-2651
74310	Townhouse	2023-01-31	$880,000	2023-02-27	$880,000	3	2	3	6.8	5748.0	POD Projects Group	10-4-hoolihan-street-denman-prospect-act-2611
74315	Townhouse	2023-01-31	$785,000 - $815,000	2023-04-14	$790,000	3	2	2	4.0	560.0	LJ Hooker Gungahlin	2-14-maria-smith-lane-gungahlin-act-2912
74321	Unit	2023-01-31	$975,000	2023-01-31	$975,000	2	2	0			Sails Real Estate	7-25-beach-street-merimbula-nsw-2548
74323	House	2023-01-31	Price Guide $3,500,000	2023-02-14	Undisclosed	4	3	3		809.0	Ben Bate Real Estate	12-warbler-crescent-north-narooma-nsw-2546
74326	House	2023-02-01	Auction Saturday 18 February 2023, 10am On Site	2023-02-18	Undisclosed	3	2	2	5.0	366.0	Morrissey Property	16-grimstone-place-franklin-act-2913
74327	Apartment	2023-02-01	Auction Current Bid $395,000	2023-02-15	Undisclosed	1	1	1	0.0		Henley Property - Jindabyne	106-10-kosciuszko-road-jindabyne-nsw-2627
74328	House	2023-02-01	$770,000	2023-05-18	$765,000	3	1	2	3.0	509.0	Luton Manuka	6-ella-close-palmerston-act-2913
74329	Townhouse	2023-02-01	Offers from $689,000	2023-03-03	$700,000	3	2	2	6.0		Luton Gungahlin	75-29-jimmy-little-street-moncrieff-act-2914
74331	House	2023-02-01	$2,500,000	2023-04-24	Undisclosed	4	2	2	2.5	2272.0	Luton Manuka	9-timbarra-crescent-omalley-act-2606
74335	Apartment	2023-02-01	$1,500,000 Plus	2023-07-31	$1,575,000	3	2	2	6.0		Maloney's Property	22-58-wentworth-avenue-kingston-act-2604
74338	House	2023-02-01	$640,000	2023-04-27	$640,000	3	1	1	2.0	348.0	home.by holly	4-barlow-street-scullin-act-2614
74339	House	2023-02-01	$1,030,000	2023-03-27	$1,030,000	3	1	1	0.5	705.0	home.by holly	3-mills-street-hackett-act-2602
74340	House	2023-02-01	AUCTION	2023-02-25	$1,200,000	4	2	2	1.0		McIntyre Property	10-stopford-crescent-fadden-act-2904
74343	House	2023-02-01	574000	2023-02-11	$574,000	3	1	2		500.0	Smile Elite	27-second-avenue-rutherford-nsw-2320
74344	House	2023-02-01	715000	2023-03-15	$715,000	2	2	1		797.0	Smile Elite	47-st-vincent-street-ulladulla-nsw-2539
74345	House	2023-02-01	Auction 23/02/2023	2023-02-23	$780,000	4	2	1	5.5	382.0	Ray White Canberra	3-finey-close-dunlop-act-2615
74347	House	2023-02-01	Auction 25/02/2023	2023-02-25	Undisclosed	3	2	2	6.0	394.0	Ray White Canberra	14a-buriga-street-giralang-act-2617
74348	House	2023-02-01	Auction	2023-02-25	$1,310,000	4	2	2	5.0	464.0	Luton Gungahlin	31-hyslop-crescent-casey-act-2913
74355	Unit	2023-02-01	$386,000	2023-02-28	$392,000	2	1	1	6.0		LJ Hooker Belconnen	10-9-keith-street-scullin-act-2614
74356	House	2023-02-01	Auction	2023-02-11	$760,000	3	2	3	2.5	713.0	LJ Hooker Belconnen	49-wrenfordsley-place-latham-act-2615
74359	House	2023-02-01	Auction 25/02/2023	2023-02-25	Undisclosed	4	2	3	5.0	271.0	Ray White Canberra	2-2-ashburton-circuit-kaleen-act-2617
74361	Apartment	2023-02-01	$500,000	2023-02-27	$505,000	2	1	2	1.5		LJ Hooker Belconnen	7-57-torrens-street-braddon-act-2612
74365	House	2023-02-01	NEW PRICE $920,000	2023-04-26	$890,000	6	3	2			Raine & Horne Goulburn	25-matchless-avenue-goulburn-nsw-2580
74368	House	2023-02-01	420000	2023-05-03	$420,000	3	1	2		575.0	Smile Elite	92-havannah-street-bathurst-nsw-2795
74377	House	2023-02-01	SOLD - $1,135,000	2023-02-10	$1,135,000	4	2	2	3.0	844.0	Stone Gungahlin	3-bingle-street-flynn-act-2615
74379	Townhouse	2023-02-01	Auction	2023-03-01	$725,000	3	2	2	3.0		LJ Hooker Canberra City	161-22-kings-canyon-street-harrison-act-2914
74381	House	2023-02-01	Contact Agent	2023-05-09	Undisclosed	4	3	2	6.0		New Door Properties	3-buhrich-street-taylor-act-2913
74383	House	2023-02-01	Sold $1,795,000	2023-02-18	$1,795,000	3	1	2	0.5	797.0	Blackshaw Gungahlin	6-cambage-street-yarralumla-act-2600
74387	Townhouse	2023-02-01	Auction 23/02/2023	2023-02-23	$665,000	3	2	2	6.0		Ray White Canberra	12-15-wanliss-street-latham-act-2615
74390	House	2023-02-01	Auction	2023-02-25	$740,000	3	1	1	2.0	664.0	Timothy Road	5-chambers-street-latham-act-2615
74393	House	2023-02-01	$759,000	2023-03-31	Undisclosed	3	2	2	1.5	798.0	Ray White Canberra	8-haugh-place-oxley-act-2903
74402	House	2023-02-01	$349,000	2023-02-22	$320,000	3	1	1		467.9	Kitson Property	4-essex-road-mount-austin-nsw-2650
74403	Apartment	2023-02-01	$975,000	2023-02-13	$975,000	2	2	2	6.0		home.by holly	30-18-austin-street-griffith-act-2603
74405	House	2023-02-01	$1,380,000	2023-05-13	$1,380,000	3	2	1	3.5	663.0	home.by holly	77-wattle-street-oconnor-act-2602
74407	House	2023-02-01	$1,330,000	2023-03-17	$1,300,000	4	2	1	0.0	784.0	LJ Hooker Kaleen	21-canning-street-ainslie-act-2602
74408	House	2023-02-01	$365,000	2023-02-28	Undisclosed	3	1	1		689.2	Ray White Wagga Wagga	146-fernleigh-road-mount-austin-nsw-2650
74410	House	2023-02-01	$449,000	2023-03-24	Undisclosed	3	1	1			Ray White Wagga Wagga	40-mimosa-drive-mount-austin-nsw-2650
74414	House	2023-02-01	$349,000	2023-04-03	$353,000	4	1	3		754.4	Kitson Property	44-cox-avenue-forest-hill-nsw-2651
74416	Retirement	2023-02-01	$495,000+	2023-05-11	$500,000	2	1	1	5.5		LJ Hooker Dickson	89-177-badimara-street-fisher-act-2611
74421	House	2023-02-02	Auction	2023-02-17	$725,000	3	1	1	4.5	332.0	Luton Manuka	2-bungaree-crescent-ngunnawal-act-2913
74422	Townhouse	2023-02-02	$1,199,000	2023-02-10	Undisclosed	3	3	2	4.5		Luton Manuka	9-70-henty-street-braddon-act-2612
74423	House	2023-02-02	$800,000+	2023-03-17	$815,000	3	1	3	1.5	827.0	My Morris	19-karney-street-kambah-act-2902
74425	Apartment	2023-02-02	$390,000+	2023-03-02	Undisclosed	1	1	1	6.0	0.0	Ray White Canberra	1509-120-eastern-valley-way-belconnen-act-2617
74427	House	2023-02-02	$775,000+	2023-03-29	$750,000	3	2	2	2.0	868.0	Solely Properties	6-lake-place-conder-act-2906
74432	House	2023-02-02	AUCTION	2023-02-25	Undisclosed	3	1	1		600.7	LJ Hooker Wagga Wagga	15-karen-street-tolland-nsw-2650
74434	Apartment	2023-02-02	$471,000	2023-03-07	$471,000	1	1	1	5.0		home.by holly	14-33-forbes-street-turner-act-2612
74436	House	2023-02-02	Contact Agent	2023-02-25	Undisclosed	4	2	2	4.0	898.0	My Morris	38-gallagher-street-kambah-act-2902
74437	Apartment	2023-02-02	$455,000+	2023-04-26	$466,000	2	1	1	6.0		Morrissey Property	74-1-braybrooke-street-bruce-act-2617
74438	House	2023-02-02	Auction Saturday 25 February 2023, 10am On Site	2023-02-27	Undisclosed	3	1	2	2.0	804.0	Morrissey Property	55-handcock-crescent-macgregor-act-2615
74441	Townhouse	2023-02-02	$540,000	2023-02-25	$540,000	2	1	1	2.5		home.by holly	30-dallachy-place-page-act-2614
74443	Townhouse	2023-02-02	$645,000+	2023-02-25	$655,000	3	2	2	5.5	12021.0	LJ Hooker Gungahlin	9-311-flemington-road-franklin-act-2913
74444	House	2023-02-02	$579,000	2023-03-21	Undisclosed	2	1	1	6.0	162.0	LJ Hooker Gungahlin	61-burrumarra-avenue-ngunnawal-act-2913
74446	Unit	2023-02-02	$335,900	2023-06-06	$335,900	2	1	1			LJ Hooker Queanbeyan – Jerrabomberra – Googong	6-30-trinculo-place-queanbeyan-east-nsw-2620
74450	House	2023-02-02	SOLD	2023-02-25	Undisclosed	3	1	1	5.5		MARQ Property	15-archel-place-palmerston-act-2913
74451	Townhouse	2023-02-02	contact agent	2023-03-22	Undisclosed	3	2	2	6.0		home.by holly	7-1-rouseabout-street-lawson-act-2617
74453	Townhouse	2023-02-02	Auction 02/03/2023	2023-03-02	$625,000	2	2	2	6.0		Ray White Canberra	147-1-rowland-rees-crescent-greenway-act-2900
74455	House	2023-02-02	Auction 25/02/2023	2023-02-25	Undisclosed	3	2	4	3.0	689.0	Ray White Canberra	32-burtt-crescent-calwell-act-2905
74458	Townhouse	2023-02-02	$699,000+	2023-02-22	Undisclosed	2	2	2	6.0		Badenoch Real Estate	74-44-marie-little-crescent-denman-prospect-act-2611
74462	House	2023-02-02	$839,000+	2023-03-07	Undisclosed	5	2	2	5.0	615.0	Ray White Canberra	10-mathews-place-banks-act-2906
74463	House	2023-02-02	Auction 25/02/2023	2023-02-25	Undisclosed	3	2	2	4.5	743.0	Ray White Canberra	43-bimberi-crescent-palmerston-act-2913
74464	House	2023-02-02	Auction 04/03/2023	2023-02-17	Undisclosed	4	3	10		2.31	VERV Property	6-kanangra-close-murrumbateman-nsw-2582
74466	House	2023-02-02	$2,300,000	2023-06-01	$2,300,000	3	2	1	4.0	867.0	home.by holly	27-musgrave-street-yarralumla-act-2600
74468	Apartment	2023-02-02	$830,000+	2023-02-17	$850,000	2	2	1	5.0		Maloney's Property	8-27-cunningham-street-kingston-act-2604
74470	House	2023-02-02	Auction 23/02/2023	2023-02-23	$1,370,000	5	2	2	2.0	1013.0	Ray White Canberra	18-mathieson-crescent-weetangera-act-2614
74471	House	2023-02-02	By Negotiation	2023-03-07	Undisclosed	6	2	3	6.0	876.0	VERV Property	1-kowari-close-throsby-act-2914
74472	House	2023-02-02	$875,000	2023-04-04	Undisclosed	4	2	2	4.5	525.0	Luton Kippax	5-fitton-close-dunlop-act-2615
74474	Townhouse	2023-02-02	$560,000	2023-05-08	Undisclosed	3	1	2	4.0		Luton Kippax	16-12-luke-street-holt-act-2615
74476	House	2023-02-02	Auction	2023-02-27	$760,000	3	1	2	5.0	421.0	Luton Gungahlin	8-naas-close-amaroo-act-2914
74478	Townhouse	2023-02-02	$470,000+	2023-02-23	$490,000	2	1	1	6.0	1231.0	Luton Kippax	1-52-jeff-snell-crescent-dunlop-act-2615
74480	Townhouse	2023-02-02	$990,000+	2023-03-10	Undisclosed	4	2	2	5.0	202.1	Ray White Canberra	2-gibbes-place-weetangera-act-2614
74481	House	2023-02-02	Auction 23/02/2023	2023-02-23	$900,000	4	3	2	2.0	1127.0	Ray White Canberra	39-osullivan-street-higgins-act-2615
74486	House	2023-02-02	Auction 25/02/2023	2023-02-25	$720,000	3	1	4	3.0	741.0	Ray White Canberra	17-bunton-place-holt-act-2615
74487	House	2023-02-02	Auction	2023-02-25	$1,310,000	3	2	2	0.5	758.0	Cream Residential	20-wisdom-street-hughes-act-2605
74488	DuplexSemi-detached	2023-02-02	Auction	2023-02-25	$1,020,000	3	2	2	6.0	392.0	Cream Residential	33-kitchener-street-hughes-act-2605
74489	Townhouse	2023-02-02	Auction	2023-02-25	$665,500	3	2	1	6.0		Luton Gungahlin	7-49-lorraway-street-holt-act-2615
74493	Townhouse	2023-02-02	$775,000	2023-03-30	$775,000	4	2	2	5.5		home.by holly	12-75-bellhouse-crescent-moncrieff-act-2914
74495	House	2023-02-02	Auction Guide $475,000	2023-03-03	$475,000	2	2	1		402.0	Ray White Goulburn	52-george-street-goulburn-nsw-2580
74497	Apartment	2023-02-02	1,100,000+	2023-07-21	Undisclosed	3	2	3	6.0		Ray White Canberra	9-39-mcintyre-street-narrabundah-act-2604
74499	House	2023-02-02	$1,100,000+	2023-05-04	Undisclosed	4	2	2	3.5	811.0	Ray White Canberra	7-ashbrook-street-amaroo-act-2914
74500	Townhouse	2023-02-02	$1,150,000	2023-03-14	$1,150,000	3	2	2	5.0		home.by holly	7-14-currie-crescent-kingston-act-2604
74503	Townhouse	2023-02-02	Auction	2023-02-16	$586,500	3	1	1	4.5	183.0	LJ Hooker Kaleen	42-158-starke-street-holt-act-2615
74504	House	2023-02-02	Auction Guide $990,000	2023-02-22	$900,000	3	1	1		1000.0	Ray White Bowral	44-thompson-street-bowral-nsw-2576
74505	House	2023-02-02	$595,000	2023-04-11	$595,000	3	1	2		917.0	Whale Coast Realty	26-isabel-street-narooma-nsw-2546
74506	House	2023-02-02	Contact Agent	2023-02-25	$1,235,000	5	3	6	1.5	922.0	VERV Property	14-chubb-place-latham-act-2615
74508	Apartment	2023-02-02	Contact Agent	2023-02-25	$421,000	1	1	1	6.0	11748.0	Wright Dunn Real Estate	44-23-aspinall-street-watson-act-2602
74509	Townhouse	2023-02-02	Auction	2023-02-25	$585,000	3	2	1	1.5		Luton Tuggeranong	3-31-moyes-crescent-holt-act-2615
74510	House	2023-02-02	$1,250,000+	2023-03-10	$1,250,000	4	3	3	2.0	801.0	LJ Hooker Tuggeranong	8-bernacchi-street-mawson-act-2607
74511	Villa	2023-02-02	$365,000	2023-04-11	Undisclosed	2	1	1		143.0	Macarthur Real Estate Agency	2-22-dove-street-mount-austin-nsw-2650
74513	House	2023-02-02	$1,080,000-$1,140,000	2023-03-01	Undisclosed	4	2	8		1614.0	Ray White Bungendore	32-hyland-drive-bungendore-nsw-2621
74520	House	2023-02-02	$830,000+	2023-03-02	$820,000	3	2	3	2.0	822.0	LJ Hooker Tuggeranong	5-allison-place-monash-act-2904
74529	Apartment	2023-02-02	$830,000	2023-04-28	$830,000	2	2	1	4.0		home.by holly	g2-2-currie-crescent-griffith-act-2603
74531	House	2023-02-02	$390,000	2023-03-20	Undisclosed	2	1	1			Flemings Property Services	11a-mayoh-place-young-nsw-2594
74534	Land	2023-02-02	Amazing Price $270,000	2023-08-22	$265,000	0	0	0		1515.0	Whale Coast Realty	7-eucalyptus-drive-dalmeny-nsw-2546
74535	Apartment	2023-02-02	$570,000 +	2023-02-27	$582,000	2	2	2	6.0		LJ Hooker Woden/Weston	34-1-drew-street-greenway-act-2900
74536	Townhouse	2023-02-02	$845,000+	2023-04-06	Undisclosed	3	2	2	6.0	248.0	LJ Hooker Woden/Weston	38-finemore-street-coombs-act-2611
74537	Other	2023-02-02	Auction 23/02/2023	2023-02-23	$560,000	2	2	2	6.0		Ray White Canberra	50-1-limburg-way-greenway-act-2900
74540	House	2023-02-02	$690,000	2023-03-09	$668,000	2	1	2		986.0	Ray White Bungendore	53-malbon-st-bungendore-nsw-2621
74543	Apartment	2023-02-02	Auction	2023-02-22	$595,000	3	2	2	4.0		LJ Hooker Woden/Weston	228-28-byron-court-phillip-act-2606
74544	Townhouse	2023-02-02	Auction	2023-03-01	$905,000	3	2	2	5.0	2958.0	LJ Hooker Kaleen	3-5-phippard-court-watson-act-2602
74549	House	2023-02-03	$499,000	2023-02-21	$499,000	3	1	4			One Agency Wagga Wagga	1-acacia-street-kooringal-nsw-2650
74550	House	2023-02-03	$729,000 - $769,000	2023-03-22	$755,000	4	2	2		870.0	One Agency Wagga Wagga	22-watson-boulevard-lloyd-nsw-2650
74552	House	2023-02-03	$600,000 - $649,000	2023-03-16	$600,000	3	2	2		677.0	One Agency Wagga Wagga	10-bourkelands-drive-bourkelands-nsw-2650
74553	House	2023-02-03	$1,450,000 - $1,550,000	2023-07-27	$None	4	2	4		2855.0	One Agency Wagga Wagga	4-belmore-place-tatton-nsw-2650
74555	Apartment	2023-02-03	Auction	2023-02-25	$775,000	2	2	2	6.0	4008.0	Luton Weston Creek & Molonglo Valley	120-5-burnie-street-lyons-act-2606
74556	House	2023-02-03	Auction	2023-02-25	Undisclosed	3	1	2	2.5	827.0	Luton Weston Creek & Molonglo Valley	47-cargelligo-street-duffy-act-2611
74557	House	2023-02-03	$799,000	2023-03-14	Undisclosed	3	2	1	1.5	820.0	Luton Weston Creek & Molonglo Valley	3-omeara-place-gowrie-act-2904
74558	House	2023-02-03	$940,000	2023-04-05	$940,000	2	1	1	2.5	464.0	home.by holly	7-gymea-street-narrabundah-act-2604
74559	House	2023-02-03	Contact Agent	2023-02-27	Undisclosed	4	2	2	2.5	842.0	Luton Dickson	8-claxton-crescent-lyneham-act-2602
74561	Unit	2023-02-03	Auction	2023-02-25	$566,000	3	2	2	6.0		LJ Hooker Belconnen	53-68-college-street-belconnen-act-2617
74564	House	2023-02-03	$990,000+	2023-03-23	Undisclosed	4	2	2	1.5	911.7	Ray White Canberra	38-pitcairn-street-evatt-act-2617
74565	House	2023-02-03	Auction 25/02/2023	2023-02-25	Undisclosed	4	2	1	0.0	927.0	Ray White Canberra	14-hobbs-street-oconnor-act-2602
74566	Townhouse	2023-02-03	Auction	2023-02-26	Undisclosed	3	2	4	4.5		Bastion Property Group	50b-jacka-crescent-campbell-act-2612
74572	House	2023-02-03	Auction	2023-02-22	$718,000	3	2	1	6.0	211.0	Luton Gungahlin	8-rockwood-street-casey-act-2913
74573	Apartment	2023-02-03	$655,000	2023-03-20	$655,000	2	2	2	6.0		home.by holly	8-15-oliver-street-lyneham-act-2602
74575	House	2023-02-03	$815,000	2023-03-16	$815,000	3	2	1	5.5		home.by holly	39-bunduluk-crescent-ngunnawal-act-2913
74576	House	2023-02-03	Auction 25/02/2023	2023-02-25	Undisclosed	6	4	3	2.5	1220.0	Ray White Canberra	21-salkauskas-crescent-lyneham-act-2602
74577	House	2023-02-03	$499,000	2023-02-24	Undisclosed	4	1	1		600.7	PRD Wagga Wagga	71-stanley-street-kooringal-nsw-2650
74584	Land	2023-02-03	475000	2023-04-27	$475,000	0	0	0		686.0	Smile Elite	220-sovereign-drive-thrumster-nsw-2444
74585	House	2023-02-03	1085000	2023-03-05	$1,085,000	3	2	2		484.0	Smile Elite	42-dongola-circuit-schofields-nsw-2762
74586	House	2023-02-03	SOLD At Auction $1,376,000	2023-02-27	$1,376,000	5	3	1		306.0	Smile Elite	32-corsair-street-schofields-nsw-2762
74589	House	2023-02-03	$1,199,000+	2023-02-24	Undisclosed	4	2	2	6.0		Badenoch Real Estate	46-florentine-circuit-kaleen-act-2617
74593	House	2023-02-03	Contact Agent	2023-03-20	$1,300,000	5	2	2		518.0	Smile Elite	51-oak-farm-road-calderwood-nsw-2527
74596	House	2023-02-03	$1,281,100	2023-03-01	$1,281,100	3	1	2	2.0		home.by holly	130-mackenzie-street-hackett-act-2602
74607	House	2023-02-03	$930,000 to $990,000	2023-03-15	Undisclosed	4	2	2		607.0	Merimbula Realty	25-culgoa-crescent-pambula-beach-nsw-2549
74616	House	2023-02-03	$549,000	2023-02-14	Undisclosed	3	1	1		854.7	Raine & Horne Young	110-blackett-avenue-young-nsw-2594
74617	House	2023-02-04	$1,100,000 - $1,170,000	2023-04-28	$1,150,000	4	2	2		665.0	One Agency Wagga Wagga	11-jumbuck-drive-gobbagombalin-nsw-2650
74618	House	2023-02-04	$485,000 - $520,000	2023-05-08	$485,000	3	1	4		774.0	One Agency Wagga Wagga	52-doman-street-estella-nsw-2650
74620	House	2023-02-04	Auction 19/02/2023	2023-02-19	Undisclosed	6	4	2	1.0	1320.0	Ray White Canberra	13-tanumbirini-street-hawker-act-2614
74629	Unit	2023-02-06	Auction 02/03/2023	2023-02-14	Undisclosed	2	2	2	6.0		Ray White Canberra	28-23-state-circle-forrest-act-2603
74634	House	2023-02-06	1200000	2023-02-24	$1,200,000	4	2	4		1200.0	Smile Elite	67-talleyrand-circuit-greta-nsw-2334
74647	House	2023-02-06	$949,000+	2023-04-11	$920,000	4	3	2	4.0		Confidence Real Estate	18-kettlewell-crescent-banks-act-2906
74650	Apartment	2023-02-06	$390,000+	2023-02-15	$395,000	1	1	1	5.0		Maloney's Property	30-25-aspinall-street-watson-act-2602
74653	Townhouse	2023-02-06	$895,000	2023-03-10	$860,000	2	2	1			Whale Coast Realty	3-7-wattle-street-bermagui-nsw-2546
74660	House	2023-02-06	$670,000	2023-03-10	$640,000	4	1	2		1016.0	LJ Hooker Moruya	28-haslingden-st-moruya-nsw-2537
74662	House	2023-02-06	765000	2023-03-08	$765,000	4	2	2		911.0	Smile Elite	56-emerald-drive-kelso-nsw-2795
74665	Apartment	2023-02-06	$510,000	2023-03-16	$500,000	2	2	1	5.0		McIntyre Property	155-8-limburg-way-greenway-act-2900
74670	House	2023-02-06	$1,290,000 - $1,320,000	2023-03-22	Undisclosed	5	3	2		6002.0	Ray White Wagga Wagga	28-mallee-road-springvale-nsw-2650
74673	Land	2023-02-06	$290,000	2023-03-27	$290,000	0	0	0		600.0	Smile Elite	4-yellow-box-place-gormans-hill-nsw-2795
74674	Land	2023-02-06	Contact Agent	2023-02-21	Undisclosed	0	0	0		554.8	Smile Elite	6-yellow-box-place-gormans-hill-nsw-2795
74676	House	2023-02-06	$365,000 - $375,000	2023-03-23	Undisclosed	3	1	3		752.0	Ray White Wagga Wagga	86-raye-street-tolland-nsw-2650
74677	House	2023-02-06	Contact Agent	2023-03-22	Undisclosed	3	1	2		697.6	Ray White Wagga Wagga	48-mallory-street-ashmont-nsw-2650
74678	Land	2023-02-06	Buyers guide $280,000 - $300,000	2023-05-30	$290,000	0	0	0		552.1	Smile Elite	8-yellow-box-place-gormans-hill-nsw-2795
74683	Apartment	2023-02-06	$630,000	2023-02-17	$655,000	3	1	2			Henley Property - Jindabyne	4-6-kirwan-close-jindabyne-nsw-2627
74685	House	2023-02-06	AUCTION	2023-03-17	Undisclosed	3	2	1			Ray White Goulburn	83-citizen-street-goulburn-nsw-2580
74687	Apartment	2023-02-07	$590,000+	2023-05-08	$581,000	2	2	2	6.0		LJ Hooker Woden/Weston	137-116-easty-street-phillip-act-2606
74688	Land	2023-02-07	$300,000-$320,000	2023-09-22	$305,000	0	0	0		8359.0	Ray White Canberra	41-mulach-street-cooma-nsw-2630
74689	House	2023-02-07	Contact Agent	2023-02-28	Undisclosed	4	2	2	4.0	573.0	Morrissey Property	7-cartledge-street-casey-act-2913
74695	AcreageSemi-rural	2023-02-07	Open Saturday 22nd July 12 Noon - $1.99m to $2.15m	2023-08-04	Undisclosed	4	2	10		1.0	Raine & Horne Southern Highlands	9-gum-tree-lane-kangaroo-valley-nsw-2577
74696	House	2023-02-07	$745,000 +	2023-03-24	Undisclosed	3	2	2	4.5	651.0	Timothy Road	52-maynard-street-ngunnawal-act-2913
74697	AcreageSemi-rural	2023-02-07	Offers Over $680,000	2023-09-21	Undisclosed	4	2	2		2.83	LAWD	26-mahony-road-katherine-nt-0850
74704	Land	2023-02-07	$455,000 - $475,000	2023-05-30	$460,000	0	0	0		1162.0	Ray White Batemans Bay	15-caswell-street-moruya-nsw-2537
74708	Apartment	2023-02-07	Auction	2023-02-21	$550,000	2	2	1	6.0		LJ Hooker Canberra City	408-4-grazier-lane-belconnen-act-2617
74709	Land	2023-02-07	Under Offer	2023-06-01	Undisclosed	0	0	0		2023.0	Raine & Horne Southern Highlands	10-peters-street-majors-creek-nsw-2622
74711	Unit	2023-02-07	$650,000	2023-05-30	Undisclosed	2	2	2			Dwyer Properties Sapphire Coast	9-1-3-ocean-drive-merimbula-nsw-2548
74713	House	2023-02-07	$640,000	2023-03-22	$640,000	3	1	1		771.0	Smile Elite	9-russell-street-gormans-hill-nsw-2795
74715	House	2023-02-07	SOLD	2023-02-25	$1,000,000	4	3	2	1.0	901.0	MARQ Property	48-jalanga-crescent-aranda-act-2614
74718	House	2023-02-07	$899,000	2023-03-28	$875,000	3	1	2	2.0	736.0	McIntyre Property	15-tantangara-street-duffy-act-2611
74729	Land	2023-02-07	$599,999	2023-05-03	Undisclosed	0	0	0			Ray White Canberra	25-borland-street-taylor-act-2913
74732	House	2023-02-07	$1,150,000 - $1,265,000	2023-05-15	$1,100,000	4	2	2		2.12	Professionals Nowra	139-browns-mountain-road-tapitallee-nsw-2540
74733	Townhouse	2023-02-07	$549,000+	2023-04-04	$561,000	2	1	1	6.0		LJ Hooker Kippax	6-139-macfarlane-burnet-avenue-macgregor-act-2615
74735	Townhouse	2023-02-07	$669,000+	2023-03-14	Undisclosed	3	2	2	4.5		New Door Properties	15-22-dulcie-holland-crescent-moncrieff-act-2914
74741	House	2023-02-07	$950,000	2023-06-29	Undisclosed	3	2	2		1111.0	Dwyer Properties Sapphire Coast	138-mirador-drive-mirador-nsw-2548
74749	House	2023-02-08	Sold at Auction	2023-03-14	$845,000	4	2	2		861.0	The Property Collective	24-kinsella-street-queanbeyan-nsw-2620
74751	House	2023-02-08	Auction	2023-02-25	$680,000	3	1	1	4.0	316.0	LJ Hooker Belconnen	2-bural-court-ngunnawal-act-2913
74758	House	2023-02-08	$765,000	2023-03-01	$747,500	3	1	1		701.0	Dwyer Properties Sapphire Coast	76-tura-beach-drive-tura-beach-nsw-2548
74765	Land	2023-02-08	$499,000	2023-10-17	$499,000	0	0	0		700.00	Merimbula Realty	23-the-peninsula-tura-beach-nsw-2548
74767	Townhouse	2023-02-08	Auction	2023-02-25	$585,000	2	2	1	6.0		LJ Hooker Belconnen	16-25-burnum-burnum-close-bonner-act-2914
74768	House	2023-02-08	AUCTION	2023-02-22	$950,000	4	2	1	1.5	1052.0	McIntyre Property	34-carr-crescent-wanniassa-act-2903
74771	House	2023-02-08	$495,000	2023-05-01	$500,000	2	2	1	6.0		LJ Hooker Belconnen	503-120-eastern-valley-way-belconnen-act-2617
74774	Land	2023-02-08	$379,000	2023-05-31	$350,000	0	0	0		812.0	Sails Real Estate	28-yarrawood-avenue-merimbula-nsw-2548
74776	Townhouse	2023-02-08	Auction	2023-03-04	$885,000	3	2	2	5.0		LJ Hooker Belconnen	15-1-bellette-street-weston-act-2611
74778	AcreageSemi-rural	2023-02-08	$1,150,000	2023-07-21	$1,050,000	4	2	2		17.89	Raine & Horne Goulburn	81-povey-place-breadalbane-nsw-2581
74780	Apartment	2023-02-08	$2,000,000	2023-02-08	$2,000,000	3	2	2			Sails Real Estate	2-25-beach-street-merimbula-nsw-2548
74782	House	2023-02-08	Price undisclosed	2023-02-15	Undisclosed	3	2	2	4.5		MARQ Property	3-elphick-place-bonner-act-2914
74788	House	2023-02-08	Auction	2023-03-04	Undisclosed	8	3	8	0.0	16.2	Luton Gungahlin	41-71-woodburn-lane-wallaroo-nsw-2618
74790	AcreageSemi-rural	2023-02-08	Contact Agent	2023-03-17	Undisclosed	5	4	7		49.37	Whale Coast Realty	67-priory-lane-bingie-nsw-2537
74792	Lifestyle	2023-02-08	$1,195,000	2023-08-11	Undisclosed	3	2	3		101.0	Belle Property Braidwood	183-brick-kiln-lane-braidwood-nsw-2622
74798	House	2023-02-08	$1,399,000+	2023-05-01	$1,370,000	4	3	2	6.0		Confidence Real Estate	30-kanooka-street-rivett-act-2611
74799	House	2023-02-08	$769,000	2023-02-23	$769,000	3	2	2		665.0	Dwyer Properties Sapphire Coast	36-idlewilde-crescent-pambula-nsw-2549
74800	Townhouse	2023-02-08	$705,000	2023-03-03	$705,000	2	2	2	6.0		home.by holly	14-beechworth-street-watson-act-2602
74801	Lifestyle	2023-02-08	$550,000	2023-05-02	$500,000	4	1	0		100.0	Ray White Goulburn	lots-175-176-kiowarrah-road-gunning-nsw-2581
74807	House	2023-02-08	$400,000+	2023-03-07	Undisclosed	2	1	1	5.5	1465.8	Ray White Canberra	6-140-port-jackson-circuit-phillip-act-2606
74809	Townhouse	2023-02-08	$695,000	2023-03-08	$695,000	3	2	2			LJ Hooker Queanbeyan – Jerrabomberra – Googong	11-11-doeberl-place-karabar-nsw-2620
74815	House	2023-02-08	$1,795,000	2023-07-14	$1,795,000	5	3	3		2.8	Professionals Wagga Wagga	21-currawang-drive-springvale-nsw-2650
74821	House	2023-02-08	$429,000	2023-03-16	$415,000	3	1	1			Professionals Wagga Wagga	21-eaton-street-ashmont-nsw-2650
74822	House	2023-02-08	$1,800,000 - $1,850,000	2023-04-03	$1,800,000	5	3	2		2.0	Professionals Wagga Wagga	31-matilda-crescent-wagga-wagga-nsw-2650
74824	House	2023-02-08	$290,000 - $310,000	2023-03-01	$295,000	2	1	0		658.0	Professionals Wagga Wagga	154-macleay-street-wagga-wagga-nsw-2650
74827	House	2023-02-08	$1,100,000 - $1,200,000	2023-03-13	$1,125,000	4	2	1		508.0	Professionals Wagga Wagga	173-gurwood-street-wagga-wagga-nsw-2650
74829	House	2023-02-08	$499,000	2023-04-28	$465,000	2	1	1		531.0	Professionals Wagga Wagga	54-crampton-street-wagga-wagga-nsw-2650
74833	Land	2023-02-08	$360,000 - $380,000	2023-03-24	$360,000	0	0	0		831.0	Professionals Wagga Wagga	47-stirling-boulevard-tatton-nsw-2650
74858	House	2023-02-08	$425,000	2023-05-01	$390,000	4	1	2		754.0	Professionals Wagga Wagga	52-cox-avenue-forest-hill-nsw-2651
74873	Apartment	2023-02-08	$1,000,000+	2023-03-10	Undisclosed	3	2	2	6.0	9680.4	Ray White Canberra	266-15-irving-street-phillip-act-2606
74874	House	2023-02-08	$1,350,000	2023-03-20	Undisclosed	5	3	3		4227.0	PRD Wagga Wagga	12-evangelist-avenue-lake-albert-nsw-2650
74876	House	2023-02-08	Sold - $157,000	2023-02-23	$157,000	2	1	0		423.0	Henley Property - Jindabyne	22-campbell-street-dalgety-nsw-2628
74877	House	2023-02-08	$790,000 - $830,000	2023-03-31	Undisclosed	5	2	2		714.0	Macarthur Real Estate Agency	63-kaloona-drive-bourkelands-nsw-2650
74882	Livestock	2023-02-08	$3,500,000	2023-03-21	Undisclosed	3	1	9		237.0	LAWD	4729-dalton-road-rye-park-nsw-2586
74883	House	2023-02-09	By Negotiation	2023-03-01	$985,000	4	2	2	3.0	665.0	Michael Potter Real Estate	4-sturrock-place-gordon-act-2906
74884	House	2023-02-09	By Negotiation	2023-04-04	Undisclosed	3	2	3	3.5	748.0	Luton Weston Creek & Molonglo Valley	27-burdekin-street-duffy-act-2611
74885	House	2023-02-09	Auction	2023-03-04	$1,190,000	3	3	0		796.0	Luton Manuka	12-john-bull-street-queanbeyan-west-nsw-2620
74887	Apartment	2023-02-09	$510,000	2023-05-12	$510,000	2	1	2	6.0		home.by holly	12-21-braybrooke-street-bruce-act-2617
74888	Apartment	2023-02-09	Auction	2023-03-04	$540,000	1	1	1	6.0		Luton Gungahlin	62-15-coranderrk-street-city-act-2601
74889	House	2023-02-09	contact agent	2023-03-04	$1,030,000	4	2	2	4.0	1033.0	home.by holly	14-blythe-close-kaleen-act-2617
74890	House	2023-02-09	$1,550,000+	2023-05-04	$1,575,000	4	2	2	5.0	709.0	LJ Hooker Dickson	3-briggs-street-downer-act-2602
74891	House	2023-02-09	$900,000	2023-02-21	Undisclosed	3	2	1		1331.0	LJ Hooker Narooma	12-possum-place-dalmeny-nsw-2546
74894	House	2023-02-09	$900,000+	2023-03-24	$870,000	2	1	1	0.5	705.0	LJ Hooker Dickson	4-colton-place-downer-act-2602
74896	DuplexSemi-detached	2023-02-09	$775,000+	2023-05-01	$780,000	3	2	1	5.0	344.0	Capital Hills Real Estate	2-5-crane-place-farrer-act-2607
74898	House	2023-02-09	$869,000	2023-03-29	Undisclosed	4	2	5		639.0	PRD Wagga Wagga	23-evans-street-wagga-wagga-nsw-2650
74899	Apartment	2023-02-09	$475,000 - $515,000	2023-05-15	$480,000	2	2	1			Ray White Queanbeyan | Jerrabomberra	27-39-43-crawford-street-queanbeyan-nsw-2620
74901	Apartment	2023-02-09	$530,000	2023-02-24	$530,000	1	1	1	6.0		home.by holly	29-16-doonkuna-street-braddon-act-2612
74902	House	2023-02-09	$749,900	2023-07-21	Undisclosed	4	2	2		710.4	Kitson Property	7-turramia-crescent-gobbagombalin-nsw-2650
74903	House	2023-02-09	Auction 04/03/2023	2023-03-04	Undisclosed	3	2	2	4.0	346.0	Ray White Canberra	1-strayleaf-crescent-gungahlin-act-2912
74905	Townhouse	2023-02-09	Auction 02/03/2023	2023-03-02	Undisclosed	3	2	2	6.0	407.0	Ray White Canberra	5-45-barr-smith-avenue-bonython-act-2905
74906	House	2023-02-09	$650,000	2023-04-11	Undisclosed	3	1	1	0.5		Ray White Canberra	83-pennefather-street-higgins-act-2615
74907	House	2023-02-09	Offers $799,000+	2023-03-10	$790,000	3	2	2	1.0	789.0	Ray White Canberra	33-lawrence-crescent-kambah-act-2902
74910	Townhouse	2023-02-09	$1,050,000	2023-02-25	$1,050,000	3	2	2	3.5		home.by holly	5-6-hall-street-lyneham-act-2602
74911	Apartment	2023-02-09	$749,000 - $799,000	2023-05-17	Undisclosed	3	2	1	3.5		LJ Hooker Manuka	102-13-15-sturt-avenue-griffith-act-2603
74913	House	2023-02-09	$895,000+	2023-03-24	Undisclosed	4	2	2	1.5	781.0	My Morris	9-moogerah-street-duffy-act-2611
74914	Townhouse	2023-02-09	$915,000	2023-02-17	Undisclosed	2	1	1	5.5		Luton Manuka	12-5-lane-poole-place-yarralumla-act-2600
74916	House	2023-02-09	$720,000	2023-02-21	$715,000	4	2	0		899.0	Raine & Horne Goulburn	20-emmerson-street-goulburn-nsw-2580
74919	House	2023-02-09	Auction	2023-03-04	$1,440,000	5	3	2	5.5	455.0	Luton Gungahlin	166-oodgeroo-avenue-franklin-act-2913
74920	Apartment	2023-02-09	$595,000 Plus	2023-03-06	$612,500	2	1	1	4.0		Maloney's Property	7-47-kennedy-street-kingston-act-2604
74923	House	2023-02-09	Auction 02/03/2023	2023-03-02	Undisclosed	4	2	2	4.5	515.0	Ray White Canberra	12-annan-close-amaroo-act-2914
74925	House	2023-02-09	Guide $565,000	2023-06-28	$560,000	3	2	1		343.0	Ray White Goulburn	16-74-cowper-street-goulburn-nsw-2580
74928	Apartment	2023-02-09	contact agent	2023-03-14	Undisclosed	2	2	2	6.0		home.by holly	120-253-northbourne-avenue-lyneham-act-2602
74929	Apartment	2023-02-09	$839,000	2023-06-09	$770,000	3	2	2			Whale Coast Realty	9-4-6-princes-highway-narooma-nsw-2546
74930	House	2023-02-09	$499,000	2023-07-21	$455,000	2	1	1		3829.53	Ray White Batemans Bay	12-14-high-view-avenue-surf-beach-nsw-2536
74932	Unit	2023-02-09	$400,000	2023-02-22	Undisclosed	1	1	0			Henley Property - Jindabyne	4-19-bobuck-lane-thredbo-nsw-2625
74933	Townhouse	2023-02-09	Sold Prior.	2023-02-21	$900,000	4	2	2	5.0		Cream Residential	14-29-bott-crescent-casey-act-2913
74936	House	2023-02-09	$835,000+	2023-05-03	$840,000	4	2	2	1.0	1056.0	McIntyre Property	24-drysdale-circuit-kambah-act-2902
74938	House	2023-02-09	$640,000+	2023-03-01	$741,000	3	1	2	0.5	814.0	LJ Hooker Kippax	13-landale-place-charnwood-act-2615
74942	Unit	2023-02-09	$329,500	2023-03-01	Undisclosed	1	1	1			Ben Bate Real Estate	42-147-princes-highway-narooma-nsw-2546
74943	House	2023-02-09	$590,000 - $620,000	2023-03-15	$580,000	2	1	1			My Agent Team	1-2-sheila-street-batehaven-nsw-2536
74946	House	2023-02-09	Auction	2023-03-03	Undisclosed	4	2	3	3.5	702.0	Luton Tuggeranong	75-forsythe-street-banks-act-2906
74948	Townhouse	2023-02-09	Auction 01/03/2023	2023-03-01	$750,000	3	2	2	3.0	426.0	LJ Hooker Dickson	9-3-derrington-crescent-bonython-act-2905
74949	Townhouse	2023-02-09	$559,000+	2023-03-01	$590,000	3	1	1	5.0		LJ Hooker Kippax	13-74-britten-jones-drive-holt-act-2615
74950	House	2023-02-09	Auction 02/03/2023	2023-03-02	$821,000	3	2	2	4.5	524.0	Ray White Canberra	27-waterworth-street-dunlop-act-2615
74951	House	2023-02-09	Auction 04/03/2023	2023-03-04	Undisclosed	3	2	3	1.5	896.0	Ray White Canberra	32-pambula-street-kaleen-act-2617
74952	Apartment	2023-02-09	$480,000+	2023-05-19	$495,000	2	2	2	6.0	2279.0	LJ Hooker Gungahlin	40-77-gozzard-street-gungahlin-act-2912
74956	Apartment	2023-02-09	$795,000	2023-03-24	$790,000	3	2	2			LJ Hooker Batemans Bay	6-94-96-beach-road-batemans-bay-nsw-2536
74957	Townhouse	2023-02-09	NEW PRICE - $699,000	2023-09-01	$680,000	3	2	1			Fraser-Gray Real Estate	unit-12-1a-myamba-parade-surfside-nsw-2536
74963	House	2023-02-09	New Price $599,000	2023-04-04	$605,000	3	1	1		510.0	Henley Property - Berridale	4b-katri-close-berridale-nsw-2628
74964	Land	2023-02-09	$690,000- $760,000	2023-04-27	$720,000	0	0	0			Ray White Bungendore	lot-253-388-mathews-lane-bungendore-nsw-2621
74967	House	2023-02-09	SOLD	2023-06-09	Undisclosed	5	3	11		26.0	Ian McNamee & Partners - Queanbeyan	1324-old-cooma-road-googong-nsw-2620
74968	House	2023-02-09	Auction	2023-02-20	$775,000	3	1	2	1.0	694.0	Luton Gungahlin	12-cawthorn-crescent-evatt-act-2617
74972	Unit	2023-02-10	$340,000 - $370,000	2023-04-06	$335,000	2	1	1		82.0	One Agency Wagga Wagga	6-239-kincaid-street-wagga-wagga-nsw-2650
74974	Villa	2023-02-10	$600,000 - $650,000	2023-03-23	$650,000	3	2	2		571.0	One Agency Wagga Wagga	73-paradise-drive-gobbagombalin-nsw-2650
74976	Townhouse	2023-02-10	$545,000+	2023-04-24	$551,000	2	1	1	6.0		LJ Hooker Gungahlin	8-2-clare-burton-crescent-franklin-act-2913
74984	House	2023-02-10	SOLD FOR NEW SUBURB RECORD $1,520,000.00	2023-03-19	$1,520,000	4	3	2		350.0	Smile Elite	27-marwan-avenue-schofields-nsw-2762
74985	House	2023-02-10	1200000	2023-02-27	$1,200,000	4	3	2		1103.0	Smile Elite	23-ryces-drive-clunes-nsw-2480
74986	House	2023-02-10	SOLD AT AUCTION $1,505,000	2023-02-26	$1,505,000	5	3	2		727.0	Smile Elite	11-station-street-schofields-nsw-2762
74987	House	2023-02-10	Price Guide: $1,725,000 - $1,825,000	2023-10-06	Undisclosed	3	2	2		1599.0	Raine & Horne Mollymook Milton	15-wolseley-street-milton-nsw-2538
74989	House	2023-02-10	$1,150,000	2023-10-16	$950,000	4	2	2		923.0	Professionals Nowra	31-catherine-street-myola-nsw-2540
74990	Apartment	2023-02-10	$395,000	2023-03-08	$395,000	1	1	1	6.0		home.by holly	25-1-3-mckay-street-turner-act-2612
74991	House	2023-02-10	By Negotiation	2023-03-03	$680,000	3	1	1		687.1	Ray White Canberra	29-stuart-street-crestwood-nsw-2620
74993	House	2023-02-10	$829,000	2023-03-24	$800,000	3	1	4		847.0	Bella Coastal Property	19-spinks-avenue-lake-conjola-nsw-2539
74994	House	2023-02-10	Auction Sat, 4th of March at 10:30 am	2023-03-04	$1,430,000	4	2	2	4.5	481.0	LJ Hooker Gungahlin	18-ivy-kent-street-forde-act-2914
74997	Unit	2023-02-10	$389,000 - $409,000	2023-03-21	$385,000	2	1	1			Ian McNamee & Partners - Queanbeyan	1-13-15-mowatt-street-queanbeyan-nsw-2620
74998	AcreageSemi-rural	2023-02-10	$1,200,000	2023-03-30	$1,175,000	3	1	4		6.2	Henley Property - Jindabyne	75-old-school-road-hill-top-nsw-2628
75009	House	2023-02-10	$340,000 - $360,000	2023-03-22	Undisclosed	3	1	1		720.8	Ray White Wagga Wagga	6-castlereagh-avenue-mount-austin-nsw-2650
75017	House	2023-02-10	Auction 02/03/2023	2023-03-02	Undisclosed	4	3	2	2.0	936.0	Ray White Canberra	8-hemmant-street-oconnor-act-2602
75020	DuplexSemi-detached	2023-02-10	$1,250,000	2023-04-27	$1,200,000	4	2	4		790.0	Fraser-Gray Real Estate	33-smith-street-broulee-nsw-2537
75029	House	2023-02-10	Auction	2023-03-01	$1,000,000	8	4	2	0.0	780.0	LJ Hooker Kaleen	295-maribyrnong-avenue-kaleen-act-2617
75044	House	2023-02-13	$1,085,000	2023-04-14	$1,085,000	4	2	2		561.0	LJ Hooker Malua Bay	3-gillan-grove-broulee-nsw-2537
75046	Apartment	2023-02-13	$460,000 Plus	2023-03-09	$475,000	3	1	1	1.0		Maloney's Property	7-5-hyndes-crescent-holder-act-2611
75065	House	2023-02-13	Auction Tuesday 7th March	2023-03-07	$1,106,000	3	1	2	1.0	596.0	Sadil Quinlan	109-captain-cook-crescent-narrabundah-act-2604
75075	House	2023-02-13	550000	2023-03-08	$550,000	4	1	3		1060.0	Smile Elite	58b-cousins-street-muswellbrook-nsw-2333
75076	House	2023-02-13	$690,000	2023-03-17	$650,000	3	2	1			LJ Hooker Batemans Bay	59b-karoola-crescent-surfside-nsw-2536
75080	Apartment	2023-02-13	Offers over $750,000	2023-09-12	$740,000	2	2	2	5.5		Luton Manuka	31-18-kennedy-street-kingston-act-2604
75082	House	2023-02-13	$579,000	2023-03-29	$560,000	3	1	1		571.0	Raine & Horne Goulburn	42-jacqua-avenue-goulburn-nsw-2580
75083	Apartment	2023-02-13	By Negotiation	2023-03-30	Undisclosed	1	1	1	6.0		Impact Properties	11-1-gungahlin-place-gungahlin-act-2912
75089	House	2023-02-13	$699,000 - $730,000	2023-04-06	Undisclosed	4	3	2		719.6	Ray White Wagga Wagga	23-vestey-street-wagga-wagga-nsw-2650
75091	House	2023-02-13	Auction Sat 7 Oct - Onsite at 11am	2023-10-16	Undisclosed	3	2	2		734.00	Ray White Batemans Bay	16-fairley-street-depot-beach-nsw-2536
75092	Land	2023-02-13	$69,000	2023-02-24	$69,000	0	0	0		879.0	Kitson Property	7-prichard-place-lockhart-nsw-2656
75095	House	2023-02-13	$1,150,000	2023-03-08	Undisclosed	4	3	2		941.0	Blackshaw Queanbeyan & Jerrabomberra	24-morella-avenue-jerrabomberra-nsw-2619
75096	House	2023-02-13	$650,000 - $685,000	2023-03-07	Undisclosed	3	1	1		569.0	Blackshaw Queanbeyan & Jerrabomberra	68-cameron-road-karabar-nsw-2620
75097	House	2023-02-13	Auction	2023-03-04	Undisclosed	4	2	2		400.0	Blackshaw Queanbeyan & Jerrabomberra	1-mason-street-googong-nsw-2620
75099	AcreageSemi-rural	2023-02-13	$1,100,000-$1,200,000	2023-09-11	$1,065,000	4	3	9		11.65	LJ Hooker Batemans Bay	2581-kings-highway-currowan-nsw-2536
75100	Land	2023-02-13	$315,000	2023-08-01	$290,000	0	0	0		923.0	Kitson Property	25-clifton-street-bourkelands-nsw-2650
75101	House	2023-02-13	$2,000,000	2023-07-28	Undisclosed	4	1	1		499.5	Elders Real Estate Tathra	2-wharf-road-tathra-nsw-2550
75105	House	2023-02-13	$690,000 - $720,000	2023-04-11	$740,000	3	2	2		654.0	My Agent Team	10-lincoln-crescent-north-batemans-bay-nsw-2536
75106	Unit	2023-02-13	$320,000+	2023-05-05	$326,000	1	1	1	0.0		Impact Properties	25-27-coxen-street-hughes-act-2605
75108	House	2023-02-13	$1,200,000-$1,300,000 Price Guide	2023-03-16	$1,210,000	3	2	2		685.0	Sails Real Estate	30-bournda-circuit-tura-beach-nsw-2548
75115	House	2023-02-14	$710,000 - $760,000	2023-04-03	$720,000	4	2	3		708.0	One Agency Wagga Wagga	54-wilks-avenue-kooringal-nsw-2650
75118	Other	2023-02-14	Expressions of Interest	2023-04-03	$1,000,000	3	1	1		2.35	Belle Property Braidwood	72-araluen-road-braidwood-nsw-2622
75126	House	2023-02-14	Sold	2023-03-17	$770,000	3	1	1		626.0	The Property Collective	137-ross-road-queanbeyan-nsw-2620
75127	Apartment	2023-02-14	$430,000 Plus	2023-03-09	$437,000	1	1	1	6.0		Maloney's Property	163-15-tench-street-kingston-act-2604
75129	House	2023-02-14	$749,000	2023-03-09	Undisclosed	3	2	1		711.0	My Agent Team	70-melaleuca-crescent-catalina-nsw-2536
75130	Apartment	2023-02-14	$389,999	2023-05-18	$389,999	2	1	1			Ray White Queanbeyan | Jerrabomberra	23-6-king-street-crestwood-nsw-2620
75131	House	2023-02-14	Auction 8/3/2023	2023-03-08	Undisclosed	3	1	6	5.0	465.0	Ray White Canberra	11-bungaree-crescent-ngunnawal-act-2913
75141	Apartment	2023-02-14	Auction	2023-02-28	$472,500	2	1	1	6.0	2128.0	LJ Hooker Gungahlin	207-48-gungahlin-place-gungahlin-act-2912
75151	Townhouse	2023-02-14	$699,999	2023-05-02	Undisclosed	3	2	2	2.0	41.0	LJ Hooker Dickson	12-8-zamia-place-palmerston-act-2913
75154	House	2023-02-14	Auction	2023-03-11	$885,000	3	2	2	2.5	788.0	Timothy Road	14-emerton-street-evatt-act-2617
75155	House	2023-02-14	$1,050,000	2023-05-23	Undisclosed	5	2	3		912.0	Smile Elite	13-heffernan-place-moruya-nsw-2537
75157	House	2023-02-01	$710,000 - $780,000	2023-03-13	Undisclosed	3	1	6		1372.0	dwell Realty	6-vickery-avenue-sanctuary-point-nsw-2540
75159	House	2023-02-14	$535,000	2023-06-16	$520,000	3	1	1		631.0	Macarthur Real Estate Agency	1-emu-place-kooringal-nsw-2650
75162	House	2023-02-14	UNDER OFFER	2023-03-24	Undisclosed	5	3	4		4.0	Raine & Horne Young	375-back-creek-road-young-nsw-2594
75167	House	2023-02-14	By Negotiation	2023-03-27	$850,000	3	2	1	2.0	852.0	LJ Hooker Kippax	11-harper-street-macgregor-act-2615
75170	House	2023-02-14	$520,000	2023-06-21	$530,000	3	1	0		1154.0	Henley Property - Cooma	276-sharp-street-cooma-nsw-2630
75175	House	2023-02-14	$600,000	2023-05-05	$610,000	3	2	2		927.0	Henley Property - Cooma	10-tumut-street-cooma-nsw-2630
75183	Unit	2023-02-14	By Negotiation	2023-04-14	$435,000	2	1	1	6.0		Impact Properties	6-54-chaseling-street-phillip-act-2606
75191	House	2023-02-15	$1,450,000	2023-03-24	Undisclosed	4	2	3		607.0	PRD Wagga Wagga	114-docker-street-wagga-wagga-nsw-2650
75192	Townhouse	2023-02-15	Auction	2023-03-04	$680,000	2	2	2	6.0	200.0	LJ Hooker Gungahlin	3-35-clare-burton-crescent-franklin-act-2913
75195	Terrace	2023-02-15	Sold $809,000	2023-04-06	Undisclosed	4	2	3		222.0	Blackshaw Queanbeyan & Jerrabomberra	37-wellsvale-drive-googong-nsw-2620
75197	House	2023-02-15	$1,600,000	2023-03-31	$1,600,000	2	1	1	3.5	933.0	home.by holly	56-paterson-street-ainslie-act-2602
75203	House	2023-02-15	$800,000	2023-03-27	$760,000	4	2	2		754.0	Henley Property - Cooma	3-stratos-place-cooma-nsw-2630
75205	House	2023-02-15	Guide $1,275,000	2023-05-05	$1,150,000	6	3	2		1193.0	Ray White Bowral	236-old-hume-highway-mittagong-nsw-2575
75209	Townhouse	2023-02-15	Open Home Cancelled	2023-06-07	Undisclosed	3	2	2	6.0	12603.0	New Door Properties	9-29-jimmy-little-street-moncrieff-act-2914
75210	House	2023-02-15	$840,000 - $860,000	2023-03-07	Undisclosed	3	2	5		787.0	PRD Wagga Wagga	17-turramia-crescent-gobbagombalin-nsw-2650
75211	House	2023-02-15	$670,000	2023-04-26	Undisclosed	3	1	2		824.0	Luton Tuggeranong	42-morton-street-crestwood-nsw-2620
75212	Apartment	2023-02-15	Auction	2023-03-11	Undisclosed	1	1	1	6.0		Luton Tuggeranong	1-71-giles-street-kingston-act-2604
75215	House	2023-02-15	$725,000	2023-03-17	$715,000	3	2	1	6.0	247.0	Luton Gungahlin	97-kavangal-circuit-ngunnawal-act-2913
75216	Apartment	2023-02-15	$359,000+	2023-03-09	Undisclosed	1	1	1	6.0		Badenoch Real Estate	46-20-bindubi-street-macquarie-act-2614
75217	Unit	2023-02-15	Auction	2023-02-27	$457,000	1	1	1	6.0		LJ Hooker Belconnen	220-41-chandler-street-belconnen-act-2617
75219	House	2023-02-15	$1,155,000	2023-03-04	$1,155,000	4	3	0	3.0		home.by holly	26-river-street-oaks-estate-act-2620
75220	House	2023-02-15	$880,000	2023-03-23	$850,000	4	2	2		554.0	My Agent Team	17-holstein-street-moruya-nsw-2537
75225	House	2023-02-15	By Negotiation	2023-03-09	$760,000	4	2	2		933.0	Bella Coastal Property	27-lyra-drive-lake-tabourie-nsw-2539
75243	House	2023-02-15	Auction 05/03/2023	2023-03-05	Undisclosed	4	3	2	6.0	557.0	Ray White Canberra	60-wanderlight-avenue-lawson-act-2617
75247	House	2023-02-15	$440,000 - $480,000	2023-05-01	Undisclosed	1	1	2			Blackshaw Queanbeyan & Jerrabomberra	135-uriarra-road-crestwood-nsw-2620
75248	House	2023-02-15	$890,000	2023-03-22	Undisclosed	6	4	1		786.0	McGrath Batemans Bay & Moruya	28-pyang-avenue-malua-bay-nsw-2536
75251	House	2023-02-15	$420,000	2023-08-03	$410,000	5	1	2		440.0	Flemings Property Services	25-east-street-harden-nsw-2587
75256	House	2023-02-15	$1,275,000	2023-03-07	$1,220,000	4	3	2		721.0	Whale Coast Realty	8-surf-beach-road-kianga-nsw-2546
75260	House	2023-02-15	Auction 11/03/2023	2023-03-07	Undisclosed	3	1	1	1.0		My Morris	7-tanner-place-kambah-act-2902
75263	House	2023-02-15	$899,000	2023-03-14	$899,000	4	2	2		780.0	Kitson Property	10-bennelong-crescent-lloyd-nsw-2650
75265	House	2023-02-15	$695,000	2023-04-26	Undisclosed	3	1	1		639.0	Whale Coast Realty	20-hillside-crescent-kianga-nsw-2546
75271	House	2023-02-15	Auction	2023-03-10	Undisclosed	3	2	2		620.0	Raine & Horne Mollymook Milton	233-mitchell-parade-mollymook-beach-nsw-2539
75282	House	2023-02-16	$1,049,000	2023-04-05	Undisclosed	3	2	2	0.0	1019.0	Luton Weston Creek & Molonglo Valley	201-badimara-street-fisher-act-2611
75283	House	2023-02-16	contact agent	2023-03-04	Undisclosed	3	1	1	1.0	441.0	home.by holly	6-lane-place-spence-act-2615
75286	House	2023-02-16	$1,175,000+	2023-05-04	$1,175,000	4	2	2	6.5	556.0	MARQ Property	41-mcglashan-street-taylor-act-2913
75288	House	2023-02-16	Auction 9/3/23	2023-02-27	Undisclosed	3	1	1	3.0	442.0	Ray White Canberra	51-chowne-street-campbell-act-2612
75290	House	2023-02-16	Auction Thursday 9 March 2023, 6pm On Site	2023-03-09	Undisclosed	4	2	2	3.0	711.0	Morrissey Property	3-bimberi-crescent-palmerston-act-2913
75291	House	2023-02-16	$1,170,000	2023-03-18	Undisclosed	4	2	2		855.9	Blackshaw Queanbeyan & Jerrabomberra	5-pine-place-karabar-nsw-2620
75294	House	2023-02-16	Auction, Sat 11th of Mar at 1pm	2023-03-11	$793,000	3	2	1	6.0	306.0	LJ Hooker Gungahlin	37-bunima-crescent-ngunnawal-act-2913
