id	type	ListingDate	PriceLabel	SoldDate	SoldPrice	Beds	Baths	Cars	EER	PlotSize	Agency.Name	Slug
63256	Land	2025-01-10	$255,000	2025-10-07	$255,000	0	0	0		1776.0	McCann Properties	40-green-avenue-gunning-nsw-2581
71095	Land	2025-01-10	$269,000	2025-03-14	$260,000	0	0	0		1036.0	McCann Properties	17-green-avenue-gunning-nsw-2581
109419	House	2025-01-10	$719,000	2025-07-17	$710,000	3	3	4	0.0	2000.0	McCann Properties	55-biala-street-gunning-nsw-2581
111964	House	2025-01-10	$839,000	2025-02-17	$800,000	4	2	12		2023.0	McCann Properties	11-copeland-street-gunning-nsw-2581
113393	Unit	2025-01-10	$459,000	2025-01-15	$459,000	2	1	2	3.0	11038.0	McCann Properties	18181-mcbryde-crescent-wanniassa-act-2903-113393
114653	Apartment	2025-01-02	$903,000	2025-03-06	$903,000	3	2	2	6.0		home.by holly	326-34-eyre-street-kingston-act-2604
114665	House	2025-01-02	Price Guide $630,000 - $650,000	2025-03-07	Undisclosed	4	2	1		203.0	Harcourts Greater Port Macquarie & The Rocks	19b-antigua-avenue-lake-cathie-nsw-2445-114665
114669	House	2025-01-02	$689,000	2025-02-04	Undisclosed	4	2	2		680.8	PRD Wagga Wagga	53-barrima-drive-glenfield-park-nsw-2650
114670	House	2025-01-02	$495,000	2025-02-05	$490,000	2	1	1			Professionals Nowra	322-mattes-way-bomaderry-nsw-2541
114688	House	2025-01-03	$775,000	2025-01-22	$760,000	3	1	2		612.0	LJ Hooker Batemans Bay	2-eugenia-place-maloneys-beach-nsw-2536
114722	Townhouse	2025-01-06	$560,000+	2025-02-12	$560,000	2	1	2	1.0	227.0	LJ Hooker Kaleen	1121-alsop-close-phillip-act-2606
114741	House	2025-01-06	$725,000	2025-05-14	$725,000	3	1	2		630.0	Elders Real Estate Batemans Bay	78-maloneys-drive-maloneys-beach-nsw-2536
114742	House	2025-01-06	$880,000 - $920,000	2025-02-28	$855,000	4	2	2		748.0	My Agent Team	43-courtenay-crescent-long-beach-nsw-2536
114747	House	2025-01-06	$865,000	2025-02-06	$880,000	4	2	3		972.5	Fitzpatricks	22-eastlake-drive-lake-albert-nsw-2650
114752	House	2025-01-06	$1,400,000 - $1,500,000	2025-02-05	$1,425,000	2	2	4		5372.0	Bella Coastal Property	55-murramarang-road-bawley-point-nsw-2539
114755	Unit	2025-01-06	$420,000	2025-03-19	$395,000	2	1	1			Ray White Batemans Bay	259-south-street-batemans-bay-nsw-2536
114773	House	2025-01-06	$850,000	2025-04-15	$815,000	3	2	1		575.0	Ray White Batemans Bay	43-bavarde-avenue-batemans-bay-nsw-2536
114776	House	2025-01-06	$1,299,000	2025-05-19	$1,275,000	4	2	7		2139.0	Ray White Goulburn	1-kingfisher-road-goulburn-nsw-2580
114790	House	2025-01-07	By Negotiation	2025-03-14	$670,000	3	1	1	4.0	270.0	LJ Hooker Gungahlin	39-karrugang-circuit-ngunnawal-act-2913
114806	House	2025-01-07	$590,000	2025-02-13	$577,500	3	1	1		601.0	Ray White Goulburn	57-lisgar-street-goulburn-nsw-2580
114819	Unit	2025-01-07	Auction 30/01/2025	2025-01-28	$660,000	2	2	2	6.0	2302.0	Ray White Canberra	137-coolac-place-braddon-act-2612
114823	House	2025-01-07	$1,145,000	2025-02-12	Undisclosed	4	2	2		1363.0	Bella Coastal Property	1-cornfield-parade-fishermans-paradise-nsw-2539
114825	House	2025-01-07	$510,000	2025-03-05	$505,000	3	1	1		689.0	Smile Elite	12-flanders-avenue-muswellbrook-nsw-2333
114828	House	2025-01-07	Offers considered $590,000 - $610,000	2025-03-18	$600,000	3	2	2		840.0	Professionals Wagga Wagga	48-balleroo-crescent-glenfield-park-nsw-2650
114843	House	2025-01-07	$389,000	2025-02-07	$396,000	3	1	1		581.0	Macarthur Real Estate Agency	4-margaret-avenue-mount-austin-nsw-2650
114845	Townhouse	2025-01-07	$745,000	2025-02-07	$745,000	3	2	2			Belle Property Batemans Bay	3304-beach-road-batehaven-nsw-2536
114847	House	2025-01-08	$849,000 - $879,000	2025-02-13	$855,000	4	2	2		781.0	One Agency Wagga Wagga	4-cootamundra-boulevard-gobbagombalin-nsw-2650
114852	House	2025-01-08	AUCTION 1/2/2025	2025-01-31	$860,000	3	2	2	4.0	441.0	Ray White Canberra	15-justice-place-gordon-act-2906
114853	House	2025-01-08	$1,350,000	2025-02-18	$1,340,000	4	3	2	6.0	480.0	LJ Hooker Belconnen	19-danaher-street-whitlam-act-2611
114856	House	2025-01-08	Auction	2025-01-24	$770,000	4	2	2	0.5	1118.0	LJ Hooker Belconnen	55-healy-street-spence-act-2615
114858	House	2025-01-08	$1,575,000	2025-03-20	$1,540,000	5	2	2	1.5	1533.0	LJ Hooker Belconnen	20-darmody-street-weetangera-act-2614
114862	House	2025-01-08	Guide $770,000 - $820,000	2025-02-04	Undisclosed	3	2	3		696.0	dwell Realty	18-tibbles-avenue-old-erowal-bay-nsw-2540
114863	Townhouse	2025-01-08	$610,000	2025-03-06	$602,500	2	2	1	6.0		LJ Hooker Belconnen	509-braybrooke-street-bruce-act-2617
114865	Unit	2025-01-08	$350,000	2025-03-24	$344,000	1	1	1	4.0		LJ Hooker Belconnen	1231-moulden-court-belconnen-act-2617
114866	House	2025-01-08	Auction	2025-02-01	$737,500	3	1	2	4.5	799.0	LJ Hooker Belconnen	56-clare-dennis-avenue-gordon-act-2906
114867	Unit	2025-01-08	$640,000+	2025-01-29	$640,000	3	1	2	3.5	230.0	Ray White Canberra	930-darcy-close-gordon-act-2906
114868	House	2025-01-08	$989,000+	2025-02-19	$1,075,000	4	2	4	3.0	1454.0	Ray White Canberra	17-woodburn-street-chisholm-act-2905
114869	House	2025-01-08	AUCTION - 2/2/2025	2025-02-02	$1,290,000	4	2	3		855.0	Ray White Canberra	60-pannamena-crescent-jerrabomberra-nsw-2619
114874	House	2025-01-08	Auction 02/02/2025	2025-02-02	$725,500	3	1	2	2.0	704.0	Ray White Canberra	6-grigg-place-richardson-act-2905
114878	House	2025-01-08	Auction 02/02/2025	2025-01-28	$800,000	3	2	2	3.0	826.0	Ray White Canberra	143-heagney-crescent-chisholm-act-2905
114879	Unit	2025-01-08	$770,000 - $790,000	2025-05-28	$730,000	3	2	1			LJ Hooker Malua Bay	1062-64-smith-street-broulee-nsw-2537
114880	House	2025-01-08	Auction 02/02/2025	2025-01-21	$720,000	3	1	1	4.0	542.0	Ray White Canberra	28-wilhelmi-crescent-banks-act-2906
114882	Apartment	2025-01-08	Offers Over $435,000	2025-03-07	$440,000	2	2	1	6.0		McIntyre Property	1748-limburg-way-greenway-act-2900
114885	House	2025-01-08	$709,000	2025-01-20	$689,000	4	2	2		830.4	PRD Wagga Wagga	14-brooklyn-drive-bourkelands-nsw-2650
114886	Land	2025-01-08	$695,000	2025-02-17	$645,000	0	0	0		20700.0	Whale Coast Realty	1067-congo-road-meringo-nsw-2537
114894	Unit	2025-01-08	$355,000+	2025-06-26	Undisclosed	1	1	1	6.0		LJ Hooker Gungahlin	24329-flemington-road-franklin-act-2913
114896	Townhouse	2025-01-08	$550,000+	2025-01-31	$555,000	2	1	1	2.0		McIntyre Property	2419-ashby-circuit-kambah-act-2902
114898	Apartment	2025-01-08	$545,000	2025-02-12	$521,000	2	2	2	6.0		LJ Hooker Woden/Weston	206-43-arthur-blakeley-way-coombs-act-2611
114899	House	2025-01-08	$440,000	2025-02-17	$441,750	3	1	2		651.0	PRD Wagga Wagga	76-raye-street-tolland-nsw-2650
114909	House	2025-01-08	Auction 02/02/25	2025-02-02	$785,000	3	1	3	1.5	822.0	Ray White Canberra	13-faucett-street-latham-act-2615
114924	Apartment	2025-01-08	$558,000	2025-02-18	$558,000	2	1	1	6.0		MARQ Property	1318-bradfield-street-downer-act-2602
114928	House	2025-01-08	$869,000+	2025-02-26	Undisclosed	4	1	4	1.5	697.0	Ray White Canberra	28-pearson-street-holder-act-2611
114929	Townhouse	2025-01-08	Auction 02/02/25	2025-02-02	Undisclosed	3	2	2	5.5	8170.0	Ray White Canberra	13135-easty-street-phillip-act-2606
114935	House	2025-01-08	By Negotiation	2025-02-18	$925,000	3	1	1	1.0	839.0	LJ Hooker Kippax	4-kriewaldt-circuit-higgins-act-2615
114936	House	2025-01-08	By Negotiation	2025-01-31	Undisclosed	3	1	2	6.0	404.0	Luton Gungahlin	1-wirria-circuit-ngunnawal-act-2913
114941	House	2025-01-09	Auction	2025-02-01	Undisclosed	4	2	2	0.5	875.0	Luton Weston Creek, Woden & Molonglo Valley	35-fincham-crescent-wanniassa-act-2903
114942	House	2025-01-09	Auction 01/02/2025	2025-02-01	$1,030,000	3	2	1	1.5	795.0	Ray White Canberra	122-bandjalong-crescent-aranda-act-2614
114944	Apartment	2025-01-09	$740,000+	2025-03-03	$761,500	3	2	2	5.5		Ray White Canberra	317-helemon-street-braddon-act-2612
114945	House	2025-01-09	$755,000+	2025-02-14	Undisclosed	5	2	2	3.5	700.0	Ray White Canberra	58-armstrong-crescent-holt-act-2615
114946	House	2025-01-09	$1,030,000+	2025-02-26	$1,083,500	3	1	1	5.0	660.0	Ray White Canberra	14-arabana-street-aranda-act-2614
114947	House	2025-01-09	Auction 02/02/2025	2025-02-02	$835,000	3	1	2	1.0	694.0	Ray White Canberra	36-hillebrand-street-page-act-2614
114948	Apartment	2025-01-09	$350,000+	2025-02-18	$380,000	1	1	1	6.0		Ray White Canberra	3797-eastern-valley-way-belconnen-act-2617
114949	Apartment	2025-01-09	By Negotiation	2025-06-23	$240,000	1	1	1	6.0		Ray White Canberra	4940-swain-street-gungahlin-act-2912
114950	House	2025-01-09	$880,000+	2025-03-11	Undisclosed	4	2	5	3.0	1209.0	Luton Tuggeranong	30-conlon-crescent-theodore-act-2905
114957	Townhouse	2025-01-09	Auction 01/02/2025	2025-02-01	$835,000	3	2	2	6.0		Ray White Canberra	132-2-mcmichael-terrace-denman-prospect-act-2611
114959	House	2025-01-09	Auction 02/02/2025	2025-02-02	$1,200,000	4	2	4	5.5	1230.0	Ray White Canberra	13-towers-place-gordon-act-2906
114960	House	2025-01-09	Auction	2025-01-31	Undisclosed	3	2	2	4.5		Luton Gungahlin	5-marika-street-ngunnawal-act-2913
114961	House	2025-01-09	$918,888	2025-02-01	$918,888	3	2	2	5.0		home.by holly	54-wanderer-court-amaroo-act-2914
114962	House	2025-01-09	$900,000+	2025-02-07	Undisclosed	4	2	2	3.0	826.0	My Morris	56-maxworthy-street-kambah-act-2902
114963	House	2025-01-09	$1,650,000+	2025-03-26	Undisclosed	4	3	2	5.0	459.0	Ray White Canberra	4-leontine-loop-denman-prospect-act-2611
114972	Apartment	2025-01-09	$499,000+	2025-02-19	$465,000	1	1	1	6.0	3686.0	Ray White Canberra	28-9-irving-street-phillip-act-2606
114976	House	2025-01-09	$815,000+	2025-02-20	$810,000	3	2	2	4.5	250.0	Impact Properties	11-trephina-street-harrison-act-2914
114978	House	2025-01-09	$1,750,000	2025-03-27	$1,730,000	4	3	2	6.0	729.0	Ray White Canberra	6-medley-street-chifley-act-2606
114979	House	2025-01-09	AUCTION 30/01/2025	2025-01-30	Undisclosed	4	1	2	2.0	758.0	Ray White Canberra	34-kinkead-street-evatt-act-2617
114980	House	2025-01-09	$1,169,000+	2025-03-10	$1,175,000	4	3	5	4.5	626.0	Impact Properties	12-pepper-street-bonner-act-2914
114982	Townhouse	2025-01-09	$850,000+	2025-03-01	$880,000	4	2	2	6.0	4798.0	Ray White Canberra	21-10-ellison-harvie-close-greenway-act-2900
114983	House	2025-01-09	$1,300,000	2025-06-16	$1,260,000	5	2	3		2001.0	Smile Elite	25-lochaven-drive-bangalee-nsw-2541
114988	House	2025-01-09	contact agent	2025-02-13	Undisclosed	5	2	1	4.0	666.0	home.by holly	6-boobialla-street-oconnor-act-2602
114992	House	2025-01-09	AUCTION 02/02/2025	2025-02-02	Undisclosed	3	1	3	0.5	855.0	Ray White Canberra	2-davison-place-holt-act-2615
114995	Land	2025-01-09	$350,000	2025-02-10	Undisclosed	0	0	0		40.0	Burchell Higgins Property Sales	1115-furners-road-mogilla-nsw-2550
114997	DuplexSemi-detached	2025-01-09	Price Guide $630,000 - $660,000	2025-01-30	$635,000	3	2	2		328.1	Harcourts Greater Port Macquarie & The Rocks	25-merrymen-way-port-macquarie-nsw-2444
115001	House	2025-01-09	$1,070,000	2025-02-26	$1,050,000	4	3	2			John Connell Real Estate	5-nelson-place-goulburn-nsw-2580
115002	Land	2025-01-09	Motivated Seller! Auction (Unless Sold Prior)	2025-03-14	$130,000	0	0	0		1619.0	Ray White Goulburn	196-cullerin-road-breadalbane-nsw-2581
115005	AcreageSemi-rural	2025-01-09	$920,000	2025-05-08	Undisclosed	4	3	2		350.0	Belle Property Snowy Mountains	1948-snowy-mountains-highway-cooma-nsw-2630-115005
115018	House	2025-01-10	$745,000	2025-03-06	$717,500	3	2	3		1040.0	Smile Elite	25-dell-parade-moruya-heads-nsw-2537
115019	House	2025-01-10	$995,000	2025-02-17	$955,000	5	2	2		878.0	Merimbula Realty	113-golf-circuit-tura-beach-nsw-2548
115022	House	2025-01-10	$790,000	2025-11-21	$775,000	3	2	2			Ray White Batemans Bay	10a-mirrabooka-avenue-moruya-nsw-2537
115024	House	2025-01-10	$1,950,000	2025-05-02	$1,800,000	4	2	2		596.0	Raine & Horne Berry	20-parker-crescent-berry-nsw-2535
115025	House	2025-01-10	Auction 02/02/2025	2025-02-02	$810,000	3	2	1	5.0	693.0	Ray White Canberra	21-alfred-hill-drive-melba-act-2615
115026	House	2025-01-10	AUCTION 01/02/2025	2025-01-22	Undisclosed	3	1	2	4.5	460.0	Ray White Canberra	50-hugh-mckay-crescent-dunlop-act-2615
115030	House	2025-01-10	$745,000+	2025-02-21	$760,000	3	2	1	1.5	743.0	Ray White Canberra	3-quambone-place-isabella-plains-act-2905
115031	House	2025-01-10	$850,000+	2025-01-17	$870,000	4	2	2	4.5	255.0	Stone Gungahlin	5-domain-street-palmerston-act-2913
115033	House	2025-01-10	$770,000+	2025-02-16	$745,000	4	1	4	1.0	893.2	Ray White Canberra	45-healy-street-spence-act-2615
115037	House	2025-01-10	Auction 02/02/2025	2025-02-02	Undisclosed	3	1	2	1.5	846.0	Ray White Canberra	4-lelta-place-giralang-act-2617
115040	House	2025-01-10	By Negotiation	2025-01-21	Undisclosed	3	2	2	6.0	286.0	Impact Properties	7-roy-marika-street-bonner-act-2914
115059	House	2025-01-10	Price Guide: $650,000	2025-09-01	$650,000	3	2	1		639.0	Raine & Horne Mollymook Milton	38-alma-avenue-fishermans-paradise-nsw-2539
115063	Townhouse	2025-01-10	$450,000 to $485,000	2025-04-02	$455,000	3	1	1			Smile Elite	1729-carolina-street-lismore-heights-nsw-2480
115065	House	2025-01-10	Price Guide $930,000 - $960,000	2025-03-21	Undisclosed	3	3	2		623.0	Harcourts Greater Port Macquarie & The Rocks	53-obriens-road-port-macquarie-nsw-2444
115073	House	2025-01-10	$675,000+	2025-01-31	$680,000	3	1	1	3.0	356.0	LJ Hooker Gungahlin	9-kudyera-place-ngunnawal-act-2913
115075	Villa	2025-01-10	$650,000	2025-02-28	Undisclosed	4	2	2			Harcourts Greater Port Macquarie & The Rocks	3b-electra-avenue-south-west-rocks-nsw-2431-115075
115077	House	2025-01-10	$599,900	2025-04-28	$599,000	6	2	3		1012.0	Kitson Property	5-inglis-street-lake-albert-nsw-2650
115085	House	2025-01-11	$412,000	2025-03-21	$412,000	3	1	1		722.0	Flemings Property Services	39-hay-street-cootamundra-nsw-2590
115086	House	2025-01-11	$2,685,000	2025-03-14	Undisclosed	4	2	4		9252.0	Ray White Bowral	299-greenhills-road-werai-nsw-2577
115095	Townhouse	2025-01-13	$360,000	2025-02-18	$380,000	2	1	1		106.0	Fitzpatricks	1-241-243-edward-street-wagga-wagga-nsw-2650-115095
115103	House	2025-01-13	AUCTION GUIDE $500,000	2025-02-28	$555,000	3	1	4		854.0	Ray White Goulburn	26-carrington-street-crookwell-nsw-2583
115105	House	2025-01-13	$775,000	2025-02-06	$775,000	2	1	1	4.5		MARQ Property	16-miljanovic-street-forde-act-2914
115106	Apartment	2025-01-13	$501,000	2025-02-06	$501,000	1	1	1	6.0		MARQ Property	74260-city-walk-city-act-2601
115111	Lifestyle	2025-01-13	$769,000	2025-02-14	$769,000	3	1	6		4.5	Smile Elite	101-post-office-lane-lewis-ponds-nsw-2800
115116	House	2025-01-13	$890,000 - $930,000	2025-03-26	$890,000	5	3	2		722.0	My Agent Team	9-iandra-road-surfside-nsw-2536
115120	House	2025-01-13	$460,000	2025-06-25	Undisclosed	2	1	3		487.0	Harcourts Greater Port Macquarie & The Rocks	42-marsh-street-west-kempsey-nsw-2440
115127	Land	2025-01-13	$230,000	2025-09-24	$225,000	0	0	0		660.0	Macarthur Real Estate Agency	14-lacebark-drive-forest-hill-nsw-2651
115130	House	2025-01-13	$965,000+	2025-03-18	$970,000	4	2	2	1.5	799.0	Ray White Canberra	18-forwood-street-monash-act-2904
115135	Land	2025-01-13	Buyers Guide $320,000 - $340,000	2025-02-10	$340,000	0	0	0		808.0	Smile Elite	264-piper-street-bathurst-nsw-2795-1
115139	Land	2025-01-13	$430,000	2025-03-04	$430,000	0	0	0		1569.0	PRD Wagga Wagga	11-coachwood-drive-lake-albert-nsw-2650-115139
115160	House	2025-01-14	$790,000	2025-05-23	$760,000	3	1	3		590.0	Ray White Batemans Bay	20-crest-crescent-moruya-heads-nsw-2537
115161	House	2025-01-14	$339,500	2025-02-14	$360,000	2	1	2		389.0	PRD Wagga Wagga	11-derna-place-ashmont-nsw-2650
115162	Land	2025-01-14	$529,000	2025-05-23	$510,000	0	0	0		602.0	McGoldrick Estate Agents	1-eumundi-avenue-badagarang-nsw-2540
115169	Townhouse	2025-01-14	$525,000+	2025-02-13	$535,000	2	1	1	6.0		Ray White Canberra	5442-lhotsky-street-charnwood-act-2615
115172	House	2025-01-14	$675,000	2025-02-11	Undisclosed	5	2	4		948.5	Ray White Wagga Wagga	53-mitchelmore-street-turvey-park-nsw-2650
115178	Unit	2025-01-14	$499,000+	2025-02-27	Undisclosed	2	1	1	6.0		Luton Tuggeranong	4198-corinna-street-phillip-act-2606
115189	Townhouse	2025-01-14	AUCTION 2/2/2025	2025-02-02	$965,000	3	2	2	5.5	312.0	Ray White Canberra	559-hodgson-crescent-pearce-act-2607
115216	House	2025-01-14	$640,000	2025-01-12	$640,000	4	2	1		710.0	Ray White Goulburn	2-11-aston-martin-drive-goulburn-nsw-2580-115216
115217	House	2025-01-14	$1,750,000 - $1,800,000	2025-03-04	$1,900,000	4	2	7		35.62	Ray White Canberra	267-back-creek-road-gundaroo-nsw-2620
115218	House	2025-01-14	$599,000	2025-05-09	$599,000	3	1	1		864.0	Belle Property Snowy Mountains	21-kiparra-drive-berridale-nsw-2628
115221	Lifestyle	2025-01-14	$1,350,000	2025-03-19	Undisclosed	4	1	4		25.0	Ray White Goulburn	4-granger-road-wollogorang-nsw-2581-115221
115230	Apartment	2025-01-15	$529,000	2025-03-17	Undisclosed	1	1	1	6.0		Luton Weston Creek, Woden & Molonglo Valley	50815-provan-street-campbell-act-2612
115233	House	2025-01-15	Auction	2025-02-01	$655,000	3	1	1	2.5	473.0	LJ Hooker Belconnen	53-maynard-street-ngunnawal-act-2913
115236	House	2025-01-15	contact agent	2025-02-14	Undisclosed	5	2	3	6.0		home.by holly	4-gilbert-street-hackett-act-2602
115240	House	2025-01-15	$829,000	2025-02-13	$813,500	4	2	2		721.0	Smile Elite	33-olympic-drive-orange-nsw-2800
115241	House	2025-01-15	$550,000	2025-05-15	Undisclosed	3	1	1			Ben Bate Real Estate	6169-princes-highway-narooma-nsw-2546
115242	House	2025-01-15	$550,000+	2025-02-07	$602,000	3	1	0	5.0	451.92	McIntyre Property	36-rohan-street-richardson-act-2905
115251	Townhouse	2025-01-15	$1,050,000	2025-03-24	$1,050,000	4	2	2	6.0		home.by holly	1023-kinloch-circuit-bruce-act-2617
115258	House	2025-01-15	$685,000	2025-02-25	$680,000	3	2	1		626.0	My Agent Team	7-wallarah-street-surfside-nsw-2536
115259	Townhouse	2025-01-15	$530,000+	2025-04-28	$545,000	3	1	2	4.5		McIntyre Property	93-peron-place-banks-act-2906
115266	Apartment	2025-01-15	$380,000+	2025-04-29	Undisclosed	2	1	1	2.5		LJ Hooker Canberra City	6058-wattle-street-lyneham-act-2602
115269	House	2025-01-15	$715,000	2025-02-21	$715,000	3	1	1	4.5		home.by holly	22-barlow-street-scullin-act-2614
115271	Townhouse	2025-01-15	Price Guide $665,000+	2025-03-18	Undisclosed	2	2	1	6.0		LJ Hooker Canberra City	25b-negus-crescent-watson-act-2602
115273	House	2025-01-15	By Negotiation	2025-02-28	Undisclosed	4	2	4		1201.0	LJ Hooker Woden/Weston	36-middle-street-murrumbateman-nsw-2582
115275	House	2025-01-15	$940,000+	2025-02-26	$950,000	4	2	1	2.5	1422.0	LJ Hooker Tuggeranong	6-porteous-crescent-theodore-act-2905
115277	Apartment	2025-01-15	$603,000	2025-02-14	$603,000	2	1	1	4.5		home.by holly	221-ijong-street-braddon-act-2612
115278	House	2025-01-15	Auction	2025-02-17	Undisclosed	3	2	2	4.0	402.0	Luton Manuka	151-clive-steele-avenue-monash-act-2904
115288	Townhouse	2025-01-15	$450,000	2025-02-05	Undisclosed	2	1	1			Ben Bate Real Estate	214-forsters-bay-road-narooma-nsw-2546
115294	Lifestyle	2025-01-15	$360,000	2025-04-29	$320,000	2	0	0		16.1	Ray White Goulburn	lot-36-mares-forest-road-taralga-nsw-2580-115294
115295	Townhouse	2025-01-15	$475,000	2025-10-28	$450,000	2	1	1			Fraser-Gray Real Estate	315-native-way-moruya-heads-nsw-2537
115297	DuplexSemi-detached	2025-01-15	$585,000	2025-03-07	$585,000	3	1	1		843.0	Dwyer Properties Sapphire Coast	122-berrambool-drive-berrambool-nsw-2548
115298	House	2025-01-15	$1,367,000	2025-02-06	$1,367,000	5	3	2	4.0		home.by holly	45-oodgeroo-avenue-franklin-act-2913
115299	Apartment	2025-01-15	$598,000	2025-08-26	$598,000	2	2	2	5.0		home.by holly	135395-antill-street-watson-act-2602
115302	House	2025-01-15	Auction	2025-02-08	Undisclosed	5	3	2	4.0		LJ Hooker Canberra City	22-payne-place-fadden-act-2904
115303	House	2025-01-15	Guide: $1,660,000 -  $1,760,000	2025-02-25	Undisclosed	4	3	4		661.5	Raine & Horne Mollymook Milton	15-porter-circuit-milton-nsw-2538
115306	House	2025-01-16	Auction	2025-02-08	Undisclosed	3	2	2	1.0	925.0	Luton Weston Creek, Woden & Molonglo Valley	2-lochee-place-stirling-act-2611
115307	Townhouse	2025-01-16	$620,000	2025-02-25	$620,000	2	2	1	6.0		MARQ Property	78-52-mcmichael-terrace-denman-prospect-act-2611
115308	Unit	2025-01-16	By Negotiataion	2025-02-10	Undisclosed	2	2	2	4.5		Luton Weston Creek, Woden & Molonglo Valley	18545-west-row-city-act-2601
115309	House	2025-01-16	By Negotiation	2025-03-25	Undisclosed	3	1	2	0.0	426.0	Luton Weston Creek, Woden & Molonglo Valley	97-nemarang-crescent-waramanga-act-2611
115310	House	2025-01-16	$795,000 - $815,000	2025-04-07	$795,000	3	2	2	6.0		MARQ Property	16-bettong-avenue-throsby-act-2914
115311	House	2025-01-16	$990,000	2025-02-05	$990,000	4	2	2	4.0	405.0	MARQ Property	4-burbie-street-harrison-act-2914
115312	Other	2025-01-16	$2,950,000	2025-05-01	Undisclosed	6	3	11		33.49	Harcourts Greater Port Macquarie & The Rocks	44-quarry-road-rosewood-nsw-2446
115316	House	2025-01-16	Auction 08/02/2025	2025-02-08	Undisclosed	4	3	3	1.5	1086.0	Ray White Canberra	6-mathieson-crescent-weetangera-act-2614
115317	Townhouse	2025-01-16	$699,000+	2025-03-19	$710,000	2	2	1	6.0		Ray White Canberra	3545-frencham-street-downer-act-2602
115318	Unit	2025-01-16	$419,000	2025-02-25	$405,000	2	1	1		144.0	One Agency Wagga Wagga	1189-crampton-street-wagga-wagga-nsw-2650
115319	Townhouse	2025-01-16	$749,000+	2025-03-04	$755,000	3	2	2	5.5		Morrissey Property	19-98-henry-kendall-street-franklin-act-2913-1
115320	House	2025-01-16	$1,275,000 to $1,350,000	2025-02-04	$1,320,000	6	3	2		780.0	Blackshaw Real Estate Coastal	67-elizabeth-drive-broulee-nsw-2537
115323	House	2025-01-16	$900,000+	2025-03-18	Undisclosed	4	2	3	5.0	709.0	My Morris	26-illingworth-street-wanniassa-act-2903
115325	Villa	2025-01-16	$599,000	2025-03-03	$605,000	3	2	2		316.4	Macarthur Real Estate Agency	35-carinya-street-glenfield-park-nsw-2650
115327	Townhouse	2025-01-16	$749,000+	2025-02-12	$735,000	3	2	2	5.5		Ray White Canberra	125-nott-street-fraser-act-2615
115328	House	2025-01-16	$285,000	2025-10-07	$285,000	1	1	1			Professionals Nowra	929-browns-road-south-nowra-nsw-2541
115330	House	2025-01-16	contact agent	2025-02-08	Undisclosed	4	2	2	6.0	767.0	home.by holly	30-earle-street-lyneham-act-2602
115333	House	2025-01-16	Auction 08/02/2025	2025-02-08	$1,510,000	4	2	2	6.0	425.0	Ray White Canberra	20-penketh-street-denman-prospect-act-2611
115335	House	2025-01-16	Auction	2025-02-10	Undisclosed	3	1	4	1.5	648.0	LJ Hooker Kaleen	82-wilshire-street-dickson-act-2602
115337	Townhouse	2025-01-16	$470,000+	2025-02-05	$513,000	2	1	1	2.0		LJ Hooker Tuggeranong	188b-beasley-street-farrer-act-2607
115340	House	2025-01-16	By Negotiation	2025-02-25	Undisclosed	3	1	1	4.0	450.0	Luton Kippax	10-hobday-place-dunlop-act-2615
115341	House	2025-01-16	$1,700,000	2025-02-11	$1,700,000	4	2	1	1.0	704.0	home.by holly	10-johnston-street-narrabundah-act-2604
115343	House	2025-01-16	Auction 08/02/2025	2025-02-08	$795,000	3	1	2	1.5	966.0	Ray White Canberra	4-halford-crescent-page-act-2614
115347	Townhouse	2025-01-16	$1,110,000	2025-02-27	$1,110,000	4	2	2	4.0	495.0	home.by holly	25-dugdale-street-cook-act-2614
115348	House	2025-01-16	Another Home SOLD by Irving Gunawan	2025-02-11	Undisclosed	3	2	1		364.8	Smile Elite	24-brackley-street-stanhope-gardens-nsw-2768
115351	Townhouse	2025-01-16	$650,000 - $675,000	2025-05-21	$656,000	3	1	2	3.5		McIntyre Property	326-william-hudson-crescent-monash-act-2904
115353	Townhouse	2025-01-16	$575,000	2025-04-11	$575,000	3	1	1			Ray White Queanbeyan | Jerrabomberra	1737-43-derrima-road-queanbeyan-nsw-2620
115356	House	2025-01-16	$845,000	2025-03-24	$845,000	3	2	2	1.5	738.0	home.by holly	46-herschell-circuit-flynn-act-2615
115359	House	2025-01-16	Auction on Saturday 15th February 2025 at 12:45pm	2025-02-15	Undisclosed	4	3	2	4.5	693.0	Stone Gungahlin	10-augustus-close-palmerston-act-2913
115361	House	2025-01-16	Auction	2025-02-12	$852,000	3	1	1	0.5	731.0	LJ Hooker Kippax	32-gollan-street-evatt-act-2617
115364	Townhouse	2025-01-16	$1,020,000	2025-02-27	$1,020,000	3	2	2	6.0		home.by holly	536-blacket-street-downer-act-2602
115367	Unit	2025-01-16	$430,000	2025-06-05	$420,000	2	2	1	6.0		Ray White Canberra	1207-3-grazier-lane-belconnen-act-2617
115370	House	2025-01-16	Contact Agent	2025-01-31	Undisclosed	3	1	1			Smile Elite	5-dora-street-hill-top-nsw-2575
115372	Townhouse	2025-01-16	$699,000+	2025-02-19	Undisclosed	3	2	2	5.5		MARQ Property	6149-kelleway-avenue-nicholls-act-2913
115375	House	2025-01-16	$828,000	2025-03-20	$828,000	4	1	1	2.0	673.0	home.by holly	4-sproule-circuit-evatt-act-2617
115376	House	2025-01-16	$819,000+	2025-02-01	$875,000	4	1	2	1.0	736.0	LJ Hooker Kippax	66-macrossan-crescent-latham-act-2615
115378	House	2025-01-16	$689,000	2025-02-05	$660,000	3	1	2			John Connell Real Estate	8-kinghorne-street-goulburn-nsw-2580
115381	House	2025-01-16	Auction	2025-02-12	$827,000	3	1	2	5.5	832.0	LJ Hooker Kippax	50-davidson-street-higgins-act-2615
115382	House	2025-01-16	By Negotiation 	2025-02-10	Undisclosed	3	1	1	2.0	531.0	LJ Hooker Gungahlin	4-inglis-place-latham-act-2615
115386	Villa	2025-01-16	Price Guide $525,000 to $548,000	2025-03-10	Undisclosed	3	2	2			Harcourts Greater Port Macquarie & The Rocks	443-pead-street-wauchope-nsw-2446
115387	House	2025-01-16	$805,000	2025-02-08	$805,000	3	2	2	2.0	951.0	home.by holly	45-rosman-circuit-gilmore-act-2905
115392	Townhouse	2025-01-16	$642,500	2025-01-31	$642,500	2	1	2	3.0		home.by holly	13-crick-place-belconnen-act-2617
115393	House	2025-01-16	$860,000	2025-08-18	$825,000	3	2	2		5135.0	Fitzpatricks	62-plumpton-road-springvale-nsw-2650
115394	Apartment	2025-01-16	$749,000 +	2025-04-14	Undisclosed	3	2	1	6.0		Cream Residential	1218-jardine-street-kingston-act-2604
115396	House	2025-01-16	$899,000	2025-07-16	Undisclosed	3	2	2			Ben Bate Real Estate	18-tilba-street-narooma-nsw-2546-1
115397	House	2025-01-16	Auction	2025-01-23	Undisclosed	4	2	2	4.0	502.0	Luton Gungahlin	88-overall-avenue-casey-act-2913
115399	House	2025-01-16	Auction	2025-02-08	Undisclosed	4	2	2	6.0	288.0	LJ Hooker Kippax	127-lionel-rose-street-strathnairn-act-2615
115400	Apartment	2025-01-16	$655,000+	2025-07-28	$650,000	2	2	2	7.5		LJ Hooker Tuggeranong	911-1-corinna-street-phillip-act-2606-115400
115401	House	2025-01-16	$995,000	2025-01-30	$995,000	5	3	2		1067.0	PRD Wagga Wagga	10-kincora-place-bourkelands-nsw-2650
115408	House	2025-01-16	Auction	2025-02-12	Undisclosed	4	2	2		540.0	LJ Hooker Kippax	11-goiser-loop-googong-nsw-2620
115409	House	2025-01-16	Auction 08/02/2025	2025-02-08	Undisclosed	3	2	2	6.0	298.0	Ray White Canberra	16-ayrton-street-gungahlin-act-2912
115425	Unit	2025-01-17	$410,000+	2025-04-15	$422,550	1	1	1	6.0	5076.0	Ray White Canberra	2815-fox-place-lyneham-act-2602
115427	Townhouse	2025-01-17	$432,500	2025-02-14	$432,500	1	1	1	6.0		Stone Gungahlin	5-lubke-street-gungahlin-act-2912
115428	Apartment	2025-01-17	$539,000	2025-02-28	$532,500	2	2	1	6.0		Luton Manuka	1618-limburg-way-greenway-act-2900
115444	Townhouse	2025-01-17	$705,000	2025-03-07	$705,000	2	2	1	3.0		home.by holly	242-sexton-street-cook-act-2614
115465	Townhouse	2025-01-17	$720,000+	2025-03-26	Undisclosed	3	1	2	3.5		My Morris	109-tristania-street-rivett-act-2611
115466	Apartment	2025-01-17	$560,000+	2025-02-06	Undisclosed	1	1	1	6.0		LJ Hooker Canberra City	41827-lonsdale-street-braddon-act-2612
115485	Townhouse	2025-01-17	By Negotiation	2025-01-17	Undisclosed	3	2	2	6.0		Stone Gungahlin	860-boldrewood-street-turner-act-2612-115485
115488	Townhouse	2025-01-17	Auction	2025-02-12	$845,000	2	1	1	1.0		LJ Hooker Kaleen	106-8-fawkner-street-braddon-act-2612
115491	House	2025-01-17	$699,000	2025-02-28	Undisclosed	3	3	2	0.0	593.2	One Agency Gatty Coastal	26-gould-street-tuross-head-nsw-2537
115492	House	2025-01-17	$879,000	2025-03-05	Undisclosed	4	2	1	2.0	961.0	Luton Tuggeranong	7-armfield-place-chisholm-act-2905
115494	House	2025-01-17	$1,800,000	2025-05-02	$1,675,000	4	3	3		10010.0	Ray White Batemans Bay	1a-cutharich-place-moruya-nsw-2537
115495	House	2025-01-17	Price Guide $1,590,000 - $1,650,000	2025-05-16	Undisclosed	5	2	3		9465.0	Harcourts Greater Port Macquarie & The Rocks	138-old-king-creek-road-king-creek-nsw-2446-115495
115496	House	2025-01-17	$810,000 - $850,000	2025-02-12	Undisclosed	4	2	2			Smile Elite	21-hydrangea-avenue-parkes-nsw-2870
115501	House	2025-01-18	$595,000	2025-03-25	$580,000	3	1	2		709.6	Fitzpatricks	75-grevillea-crescent-lake-albert-nsw-2650
115502	House	2025-01-18	Price By Negotiation	2025-02-18	$1,350,000	4	2	3		665.0	Raine & Horne Mollymook Milton	27-molloy-street-mollymook-nsw-2539
115506	House	2025-01-20	Guide $1,200,000 - $1,250,000	2025-08-06	Undisclosed	4	2	6		894.0	dwell Realty	17-yallara-crescent-sanctuary-point-nsw-2540
115507	House	2025-01-20	$520,000	2025-03-13	Undisclosed	3	2	3		1163.0	Flemings Property Services	35-caple-street-young-nsw-2594
115511	House	2025-01-20	$995,000 - $1,050,000	2025-03-21	$975,000	2	1	3		2023.0	Ray White Canberra	28-lind-street-gundaroo-nsw-2620
115513	House	2025-01-20	$949,000	2025-02-11	$945,000	4	2	1		630.0	My Agent Team	41-maloneys-drive-maloneys-beach-nsw-2536
115514	Apartment	2025-01-20	$465,000	2025-05-16	$465,000	1	1	1	4.5		MARQ Property	268-macleay-street-turner-act-2612
115516	Apartment	2025-01-20	$700,000+	2025-06-05	Undisclosed	2	2	2	6.0	97.0	Luton Gungahlin	602-352-northbourne-avenue-dickson-act-2602
115522	Other	2025-01-20	Expressions Of Interest Closing 20/02/2025	2025-03-06	Undisclosed	0	0	0		5.72	Ray White Goulburn	26-brayton-road-marulan-nsw-2579-115522
115526	House	2025-01-20	Buyers Guide - $625,000 - $650,000	2025-03-13	$630,000	3	2	2		718.0	Smile Elite	13-isaacs-street-west-bathurst-nsw-2795
115533	Unit	2025-01-20	Offers above $700,000	2025-02-14	$705,000	3	2	2	5.0	2692.0	Ray White Canberra	730-coane-street-holder-act-2611
115535	House	2025-01-20	$875,000	2025-03-07	$825,000	3	1	1		720.0	Smile Elite	16-lackersteen-street-callala-bay-nsw-2540
115537	Apartment	2025-01-20	$579,000	2025-10-31	$579,000	2	1	1	6.0		Maloney's Property	513107-canberra-avenue-griffith-act-2603
115538	Land	2025-01-20	$390,000 - $430,000	2025-03-07	$395,000	0	0	0		770.0	My Agent Team	114-hume-road-sunshine-bay-nsw-2536
115541	House	2025-01-20	$1,100,000	2025-05-20	$1,075,000	6	3	2		835.0	My Agent Team	47-ocean-avenue-surf-beach-nsw-2536
115544	House	2025-01-20	Auction	2025-02-12	Undisclosed	3	2	2	6.0		LJ Hooker Kaleen	1-4-ashburton-circuit-kaleen-act-2617
115546	House	2025-01-20	$1,550,000	2025-02-27	$1,480,000	3	2	3		26.0	My Agent Team	552-larrys-mountain-road-mogendoura-nsw-2537
115547	Lifestyle	2025-01-20	Price Guide $1,150,000 - $1,250,000	2025-06-18	Undisclosed	6	2	2		30.0	John Connell Real Estate	91-painters-lane-goulburn-nsw-2580-115547
115549	House	2025-01-20	$449,000	2025-10-03	$420,000	4	1	1		5.86	PRD Wagga Wagga	60-milbrulong-tip-road-milbrulong-nsw-2656
115557	Apartment	2025-01-20	$895,000	2025-02-28	Undisclosed	2	2	2			Harcourts Greater Port Macquarie & The Rocks	312-paragon-avenue-south-west-rocks-nsw-2431
115559	House	2025-01-21	$759,000	2025-06-25	$740,000	2	1	1		240.0	Raine & Horne Mollymook Milton	1130-balmoral-road-burrill-lake-nsw-2539
115564	House	2025-01-21	Auction	2025-02-01	Undisclosed	3	1	2	3.5	842.0	Luton Weston Creek, Woden & Molonglo Valley	30-dalabon-crescent-waramanga-act-2611
115567	House	2025-01-21	$770,000	2025-05-20	$766,000	4	2	2		686.2	Macarthur Real Estate Agency	24-darcy-drive-boorooma-nsw-2650
115569	House	2025-01-20	$475,000	2025-02-14	$455,000	3	1	1			LJ Hooker Malua Bay	353-golf-links-drive-batemans-bay-nsw-2536
115573	Townhouse	2025-01-20	$649,000+	2025-02-28	$660,000	3	2	1	6.0	80.0	Ray White Canberra	102-161-mortimer-lewis-drive-greenway-act-2900
115576	Unit	2025-01-21	$700,000+	2025-02-20	$710,000	3	2	2	6.0		Ray White Canberra	1835-clare-burton-crescent-franklin-act-2913
115577	House	2025-01-21	$1,675,000	2025-02-28	$1,630,000	5	3	4		2.5	Ray White Goulburn	21-park-close-goulburn-nsw-2580-115577
115582	Apartment	2025-01-21	$739,000	2025-02-24	$730,000	3	2	2	4.5		Maloney's Property	152-eldridge-crescent-garran-act-2605
115593	House	2025-01-20	$569,000	2025-03-19	Undisclosed	3	1	2		882.0	Macarthur Real Estate Agency	1-naretha-street-glenfield-park-nsw-2650
115594	House	2025-01-20	$1,575,000 - $1,625,000	2025-04-24	$1,460,000	4	2	4		997.0	Raine & Horne Berry	44-clarence-street-berry-nsw-2535
115595	Unit	2025-01-21	$259,000	2025-02-11	$250,000	1	1	1		52.0	Ray White Queanbeyan | Jerrabomberra	438-isabella-street-queanbeyan-nsw-2620
115597	House	2025-01-21	$615,000	2025-06-11	Undisclosed	4	2	4		1050.0	Flemings Property Services	97-long-street-boorowa-nsw-2586
115598	Townhouse	2025-01-21	$480,000 - $500,000	2025-04-02	Undisclosed	2	1	1	0.0	200.0	LJ Hooker Country Canberra	628-bungendore-road-queanbeyan-east-nsw-2620
115600	House	2025-01-20	$1,050,000 to $1,150,000	2025-04-22	Undisclosed	2	2	9		1.0	Harcourts Greater Port Macquarie & The Rocks	13-palm-grove-arakoon-nsw-2431
115602	Unit	2025-01-20	Offers Over $550,000	2025-02-19	$600,000	2	1	1	1.0		McIntyre Property	1246-catchpole-street-macquarie-act-2614
115603	House	2025-01-22	$1,280,000	2025-05-07	Undisclosed	1	1	1		1315.0	McGoldrick Estate Agents	28-loralyn-avenue-st-georges-basin-nsw-2540
115606	House	2025-01-21	$899,000+	2025-02-25	$910,000	4	2	2	5.0	457.0	LJ Hooker Gungahlin	126-jabanungga-avenue-ngunnawal-act-2913
115608	Townhouse	2025-01-22	$619,000+	2025-03-07	$620,000	3	1	1	5.5		LJ Hooker Gungahlin	7942-paul-coe-crescent-ngunnawal-act-2913
115610	Lifestyle	2025-01-22	$360,000	2025-03-26	Undisclosed	3	1	0		6.26	Ray White Rural Tumbarumba	105-coppabella-road-rosewood-nsw-2652
115612	Townhouse	2025-01-22	$750,000	2025-04-03	$740,000	3	2	2	6.0		LJ Hooker Belconnen	114-bindel-place-aranda-act-2614
115613	Apartment	2025-01-22	$395,000	2025-02-17	$390,000	1	1	1	6.0		LJ Hooker Belconnen	725-15-bowes-street-phillip-act-2606
115615	Townhouse	2025-01-22	$530,000+	2025-02-13	$530,000	3	1	1	2.0	250.0	Ray White Canberra	1730-cartwright-street-charnwood-act-2615
115616	Unit	2025-01-22	$69,000	2025-06-27	$60,000	2	1	1			LJ Hooker Malua Bay	site-99-11195-princes-highway-north-batemans-bay-nsw-2536-115616
115625	Townhouse	2025-01-22	$678,000+	2025-02-21	$678,500	3	2	2	5.5		Stone Gungahlin	2112-dulcie-holland-crescent-moncrieff-act-2914
115630	House	2025-01-22	$900,000-$950,000	2025-01-31	$955,000	3	2	2			My Agent Team	50-kingston-place-tomakin-nsw-2537
115633	House	2025-01-22	$229,000	2025-01-20	$220,000	2	1	1			Ben Bate Real Estate	g1-easts-narooma-village-narooma-nsw-2546-115633
115637	House	2025-01-21	$440,000	2025-03-12	$415,000	3	1	1		818.0	Ray White Canberra	2-woolalla-street-cooma-nsw-2630
115638	House	2025-01-21	$845,000- $880,000	2025-02-13	Undisclosed	3	2	2		696.0	Ray White Queanbeyan | Jerrabomberra	13-agnes-avenue-crestwood-nsw-2620
115643	House	2025-01-21	$685,000	2025-04-10	$660,000	3	3	1		1165.0	LJ Hooker Malua Bay	126-edward-road-batehaven-nsw-2536
115658	Apartment	2025-01-22	$760,000	2025-03-13	$760,000	3	2	2	4.5		home.by holly	207-coolac-place-braddon-act-2612
115660	Unit	2025-01-22	$975,000	2025-02-21	Undisclosed	3	2	2			Ben Bate Real Estate	1-4-marine-drive-narooma-nsw-2546
115665	Unit	2025-01-22	Offers Above $470,000	2025-05-02	$460,000	2	1	1	4.5		Cream Residential	5325-pinkerton-circuit-kambah-act-2902
115666	House	2025-01-22	$1,070,000+	2025-02-05	Undisclosed	4	2	2	5.0	489.0	LJ Hooker Woden/Weston	5-coomera-street-harrison-act-2914
115667	Cropping	2025-01-22	$1,060,000	2025-05-13	$1,050,000	4	2	4		25.0	John Connell Real Estate	465-forest-siding-road-goulburn-nsw-2580-115667
115670	House	2025-01-22	$945,000	2025-03-24	$920,000	3	1	2		719.0	Smile Elite	334-lords-place-orange-nsw-2800
115673	Unit	2025-01-22	$379,000	2025-03-18	$379,000	1	1	1	6.0		LJ Hooker Belconnen	344-thadoona-street-crace-act-2911
115679	House	2025-01-22	$680,000	2025-01-30	$680,000	3	1	1		697.0	Smile Elite	16-queen-street-moruya-nsw-2537
115685	Lifestyle	2025-01-22	$660,000 - $680,000	2025-03-10	Undisclosed	4	2	9		2.25	Flemings Property Services	240-conimbla-road-cowra-nsw-2794
115687	House	2025-01-22	Auction 12.30pm Wednesday 19th February 2025	2025-02-19	$1,430,000	3	1	0	0.0		Bertram Ellis	48-foveaux-street-ainslie-act-2602
115689	House	2025-01-22	$445,000	2025-05-01	Undisclosed	3	1	2		620.0	Harcourts Greater Port Macquarie & The Rocks	20-north-street-west-kempsey-nsw-2440
115690	Lifestyle	2025-01-22	$698,000	2025-04-16	Undisclosed	2	1	9		44.0	Burchell Higgins Property Sales	kingfisher-road-wyndham-nsw-2550-115690
115698	House	2025-01-22	$950,000 - $1,020,000	2025-02-20	$950,000	3	2	2			My Agent Team	221a-bavarde-avenue-batemans-bay-nsw-2536
115709	House	2025-01-23	$639,000+	2025-04-22	$625,000	3	1	2	3.5	433.0	Ray White Canberra	1-carter-place-banks-act-2906
115710	Apartment	2025-01-23	Offers Over $299,000	2025-03-10	Undisclosed	1	1	1	2.0		Luton Manuka	947-mcmillan-crescent-griffith-act-2603
115711	House	2025-01-23	$1,180,000+	2025-02-21	$1,181,000	4	2	4	3.5	773.0	MARQ Property	53-badenoch-crescent-evatt-act-2617
115712	House	2025-01-23	AUCTION 13/02/2025	2025-02-13	$935,000	4	2	2	5.5	434.0	Ray White Canberra	212-macfarlane-burnet-avenue-macgregor-act-2615
115713	House	2025-01-23	By Negotiation	2025-03-07	$1,290,000	4	2	2	1.5	1066.0	Ray White Canberra	31-mathieson-crescent-weetangera-act-2614
115717	House	2025-01-23	$945,000	2025-10-15	$945,000	4	1	2		594.0	Belle Property Batemans Bay	16-barbara-crescent-denhams-beach-nsw-2536
115721	House	2025-01-23	$715,000	2025-03-11	$690,000	4	1	3		809.0	Professionals Nowra	77-illaroo-road-north-nowra-nsw-2541
115722	Townhouse	2025-01-23	$735,000	2025-02-15	$735,000	2	1	1	4.5		home.by holly	1570-bourne-street-cook-act-2614
115723	House	2025-01-23	$1,095,000	2025-02-24	$1,080,000	3	1	2	2.5	565.0	Ray White Canberra	12-lalor-street-ainslie-act-2602
115724	House	2025-01-23	AUCTION 15/02/2025	2025-02-15	Undisclosed	4	2	2	1.5	862.0	Ray White Canberra	17-newbery-crescent-page-act-2614
115726	Apartment	2025-01-23	$660,000	2025-02-27	$660,000	2	2	2	6.0		home.by holly	9029-dawes-street-kingston-act-2604
115727	House	2025-01-23	Auction	2025-02-15	$755,000	3	1	2	3.5	903.0	Luton Tuggeranong	6-foord-place-kambah-act-2902
115736	Townhouse	2025-01-23	contact agent	2025-02-17	Undisclosed	2	1	1	1.0		home.by holly	2219-ashby-circuit-kambah-act-2902
115737	House	2025-01-23	Price on Application	2025-01-22	Undisclosed	3	1	1			LJ Hooker Narooma	38-tilba-street-narooma-nsw-2546
115738	House	2025-01-23	Auction	2025-02-15	$910,000	4	2	2	5.0	1009.0	LJ Hooker Belconnen	5-wedgwood-close-chisholm-act-2905
115739	Apartment	2025-01-23	$415,000	2025-02-11	$415,000	2	1	1	0.0		home.by holly	9c-111-knox-street-watson-act-2602-115739
115741	House	2025-01-23	$1,240,000	2025-01-31	$1,240,000	4	2	2		711.0	Belle Property Batemans Bay	37-john-penn-drive-tomakin-nsw-2537
115744	Townhouse	2025-01-23	$749,000+	2025-03-12	$780,000	3	2	2	6.0	255.0	Ray White Canberra	412-marou-place-ngunnawal-act-2913
115745	House	2025-01-23	$769,000	2025-02-11	$725,000	3	2	2		745.0	Whale Coast Realty	5-sunset-boulevard-kianga-nsw-2546
115747	House	2025-01-23	$1,275,000	2025-02-28	Undisclosed	4	2	3		720.0	PRD Wagga Wagga	5-billabong-crescent-gobbagombalin-nsw-2650
115749	House	2025-01-23	Offers Over $1,050,000	2025-02-28	Undisclosed	3	1	1	0.5	731.0	Home By Holly & Canberry	9-phillip-avenue-watson-act-2602
115750	House	2025-01-23	By Negotiation	2025-02-12	Undisclosed	4	2	2	3.5	418.0	Impact Properties	159-hoskins-street-franklin-act-2913
115752	Apartment	2025-01-23	Offers Above $449,000	2025-02-19	$455,000	2	1	2	4.0		Cream Residential	6617-medley-street-chifley-act-2606
115756	House	2025-01-23	$806,000	2025-02-01	$806,000	3	1	3	3.0	760.0	Stone Gungahlin	7-louat-place-evatt-act-2617
115758	Townhouse	2025-01-23	$665,000	2025-02-17	$665,000	3	2	1	4.5		home.by holly	3646-paul-coe-crescent-ngunnawal-act-2913
115763	Land	2025-01-23	$650,000	2025-10-09	$650,000	0	0	0		581.5	Raine & Horne Mollymook Milton	33-bara-parade-dolphin-point-nsw-2539
115764	Land	2025-01-23	$650,000	2025-03-21	$630,000	0	0	0		1774.0	LJ Hooker Moruya	6-8-charles-street-mogo-nsw-2536-115764
115765	Apartment	2025-01-23	$439,000 +	2025-07-30	$417,000	2	1	1	6.0		LJ Hooker Woden/Weston	59116-easty-street-phillip-act-2606
115766	House	2025-01-23	Auction	2025-02-15	$1,210,000	3	1	1	4.0	1089.0	Luton Dickson	5-peacock-place-curtin-act-2605
115768	House	2025-01-23	Auction	2025-02-13	Undisclosed	3	1	1	0.5	841.0	Luton Dickson	6-munro-street-curtin-act-2605
115773	House	2025-01-23	$799,000	2025-05-23	$790,000	4	2	2		790.8	PRD Wagga Wagga	10-nellywanna-street-gobbagombalin-nsw-2650
115774	House	2025-01-23	$680,000 - $720,000	2025-03-19	$695,000	3	2	2		652.4	Fitzpatricks	14-goonawarra-street-gobbagombalin-nsw-2650
115775	Unit	2025-01-23	$340,000	2025-03-17	$335,000	2	1	1			Professionals Nowra	6-morton-parade-nowra-nsw-2541
115776	Land	2025-01-23	$850,000 - $895,000	2025-05-20	$890,000	0	0	0	0.0	11500.0	McIntyre Property	3-elrington-close-murrumbateman-nsw-2582
115777	Villa	2025-01-23	$725,000	2025-02-07	Undisclosed	2	1	2			Raine & Horne Southern Highlands	102-4-carrington-street-bowral-nsw-2576
115779	House	2025-01-23	$1,600,000	2025-02-04	$1,600,000	4	2	2		699.0	Blackshaw Real Estate Coastal	50-tranquil-bay-place-rosedale-nsw-2536
115780	House	2025-01-23	Price by Negotiation	2025-02-14	$1,370,000	3	1	1		757.0	Raine & Horne Mollymook Milton	40-jones-avenue-mollymook-beach-nsw-2539-115780
115782	House	2025-01-23	Auction	2025-02-17	$850,500	3	2	2	4.0	554.0	LJ Hooker Kippax	24-wyselaskie-circuit-kambah-act-2902
115791	House	2025-01-23	$539,000 +	2025-02-19	$546,000	2	2	2	6.0		LJ Hooker Woden/Weston	913-15-bowes-street-phillip-act-2606-115791
115794	Apartment	2025-01-23	$498,000+	2025-03-21	$500,000	2	2	2	6.0		Impact Properties	2377-gozzard-street-gungahlin-act-2912
115800	House	2025-01-23	$1,849,000	2025-04-24	$1,800,000	5	2	4		1001.0	Smile Elite	20-eastwood-avenue-culburra-beach-nsw-2540
115801	House	2025-01-23	$610,000 - $630,000	2025-01-22	$640,000	3	1	2		1715.0	Smile Elite	4-almeria-glen-muswellbrook-nsw-2333
115805	Townhouse	2025-01-24	$590,000+	2025-02-26	$582,000	3	1	1	1.5		McIntyre Property	4081-box-hill-avenue-conder-act-2906
115806	House	2025-01-24	AUCTION	2025-01-31	Undisclosed	4	2	2	4.0	732.0	McIntyre Property	37-russell-drysdale-crescent-conder-act-2906
115810	House	2025-01-24	PRICE SLASHED $770,000	2025-08-08	$770,000	4	2	6		23670.0	Dwyer Properties Sapphire Coast	252-mine-road-lochiel-nsw-2549
115811	Lifestyle	2025-01-24	$1,249,000	2025-03-05	$1,200,000	4	2	8		7.24	Ray White Goulburn	81-povey-place-breadalbane-nsw-2581
115814	House	2025-01-24	Price Guide $1,250,000- $1,350,000	2025-05-05	Undisclosed	5	2	4		5637.0	Raine & Horne Southern Highlands	5-7-links-avenue-yerrinbool-nsw-2575-115814
115815	House	2025-01-24	$589,000	2025-02-04	$616,520	3	1	1		556.0	My Agent Team	14-wallarah-street-surfside-nsw-2536
115819	House	2025-01-24	$899,000	2025-02-13	$870,000	4	2	2		910.0	Raine & Horne Goulburn	1-kidd-circuit-goulburn-nsw-2580
115826	Villa	2025-01-24	Price Guide $1,850,000	2025-05-28	$1,770,000	3	2	3		758.0	Dwyer Properties Sapphire Coast	326-ocean-drive-merimbula-nsw-2548
115829	House	2025-01-24	$699,000	2025-02-10	$670,000	3	1	1		693.0	Ray White Goulburn	1-paradise-place-goulburn-nsw-2580
115836	House	2025-01-24	$750,000+	2025-05-09	$742,500	3	1	1	2.5		Ray White Canberra	25-fernyhough-crescent-lyneham-act-2602
115838	House	2025-01-24	$1,250,000 to $1,285,000	2025-04-16	Undisclosed	3	2	4		1024.0	Smile Elite	403-elizabeth-drive-vincentia-nsw-2540
115840	House	2025-01-24	$360,000	2025-06-06	$360,000	3	1	4		985.0	Flemings Property Services	17-richards-street-cootamundra-nsw-2590
115843	DuplexSemi-detached	2025-01-24	$935,000	2025-03-17	$925,000	3	2	2	5.0	1171.0	Whale Coast Realty	45b-warbler-crescent-north-narooma-nsw-2546-115843
115848	House	2025-01-24	$900,000 - $950,000	2025-02-14	$965,000	3	1	2		582.0	Smile Elite	18-ocean-beach-drive-shellharbour-nsw-2529
115852	House	2025-01-24	New Price $855,000	2025-09-05	$845,000	4	2	2		852.0	Dwyer Properties Sapphire Coast	19-hakea-place-tura-beach-nsw-2548
115859	House	2025-01-24	New to Market	2025-02-28	$791,000	4	2	2		651.0	Raine & Horne Berry	10-christiana-close-west-nowra-nsw-2541
115862	House	2025-01-24	$880,000	2025-09-16	$880,000	4	2	2		805.1	Ray White Wagga Wagga	12-quill-avenue-boorooma-nsw-2650
115866	House	2025-01-24	Auction	2025-02-15	$1,115,000	4	2	2	1.5	711.0	LJ Hooker Woden/Weston	6-prior-place-farrer-act-2607
115873	House	2025-01-24	$949,000	2025-02-12	Undisclosed	3	2	2		723.0	Harcourts Greater Port Macquarie & The Rocks	15-marlin-drive-south-west-rocks-nsw-2431
115874	House	2025-01-24	$885,000	2025-02-20	$885,000	3	2	2			My Agent Team	1239-beach-road-denhams-beach-nsw-2536
115885	Unit	2025-01-25	$420,000	2025-05-09	$420,000	2	1	1			Blackshaw Real Estate Coastal	221-golf-links-drive-batemans-bay-nsw-2536
115887	House	2025-01-26	$748,500	2025-05-29	$748,500	3	2	3		803.0	Belle Property Batemans Bay	12-blue-gum-parade-maloneys-beach-nsw-2536
115894	House	2025-01-28	Auction	2025-02-22	$775,000	3	1	1	0.5	777.0	LJ Hooker Belconnen	5-clyde-place-kaleen-act-2617
115902	House	2025-01-28	Auction if not sold prior	2025-02-28	$585,000	3	1	4		816.0	Ray White Goulburn	57-victoria-street-goulburn-nsw-2580
115907	Townhouse	2025-01-28	$720,000	2025-03-25	Undisclosed	2	2	2	6.0		Luton Gungahlin	17-20-greenwood-street-denman-prospect-act-2611
115912	Unit	2025-01-28	$310,000	2025-02-27	$305,000	2	1	1		132.0	Macarthur Real Estate Agency	533-wren-street-mount-austin-nsw-2650
115914	Apartment	2025-01-28	$595,000	2025-04-08	$595,000	2	1	1	5.0		Maloney's Property	3894-giles-street-kingston-act-2604
115920	Apartment	2025-01-28	$375,000+	2025-02-13	$395,000	1	1	1	6.0		McIntyre Property	63311-anketell-street-greenway-act-2900
115923	Land	2025-01-28	$249,000	2025-10-21	$235,000	0	0	0		817.0	Ray White Batemans Bay	118-blairs-road-long-beach-nsw-2536-1
115925	House	2025-01-28	$845,000	2025-03-11	$780,000	3	2	0		727.0	My Agent Team	120-northcove-road-long-beach-nsw-2536
115926	Unit	2025-01-28	$575,000	2025-04-23	$550,000	2	1	1			Merimbula Realty	25-randolph-street-merimbula-nsw-2548
115927	Land	2025-01-28	$1,250,000	2025-10-16	$1,150,000	0	0	0			Sadil Quinlan	4-highlands-avenue-surf-beach-nsw-2536
115932	House	2025-01-28	$379,000	2025-04-10	$368,000	3	1	1		569.1	PRD Wagga Wagga	14-doyle-avenue-mount-austin-nsw-2650
115950	House	2025-01-28	Sold at Auction	2025-06-05	$970,000	4	1	1	2.5	464.0	Ward Estate Agents	38-nimbin-street-narrabundah-act-2604
115951	Land	2025-01-28	$940,000	2025-10-08	$900,000	0	0	0		4046.0	Raine & Horne Berry	23-west-cambewarra-road-north-nowra-nsw-2541
115954	House	2025-01-28	$825,000	2025-04-03	Undisclosed	2	1	4		746.0	Ben Bate Real Estate	33-mort-avenue-dalmeny-nsw-2546
115956	House	2025-01-28	$948,000	2025-02-07	$975,000	3	1	4		561.0	Smile Elite	33-camelot-drive-cranebrook-nsw-2749
115957	House	2025-01-28	Onsite Auction	2025-02-18	$830,000	3	1	4	2.5	705.0	Ray White Queanbeyan | Jerrabomberra	7-gonzaga-place-richardson-act-2905
115971	House	2025-01-29	$595,000	2025-06-30	$595,000	4	1	2		676.4	Macarthur Real Estate Agency	64-vincent-road-lake-albert-nsw-2650
115973	House	2025-01-29	Auction	2025-02-15	$945,000	4	2	2	1.0	928.0	LJ Hooker Belconnen	2-wilkinson-street-flynn-act-2615
115975	House	2025-01-29	Auction Saturday 22 February 2025, 10am On site	2025-02-20	$1,300,000	4	2	2	3.0	601.0	Morrissey Property	27-benaroon-circuit-amaroo-act-2914
115979	House	2025-01-29	$1,275,000	2025-05-23	Undisclosed	5	1	2		1547.0	Ray White Bowral	88-southey-street-mittagong-nsw-2575
115983	House	2025-01-29	Offers Over $1,100,000	2025-03-06	$1,100,000	3	1	1	1.0	742.0	LJ Hooker Dickson	54-officer-crescent-ainslie-act-2602
115985	Townhouse	2025-01-29	$599,000+	2025-02-20	$600,000	3	1	1	2.0	320.0	LJ Hooker Tuggeranong	67-sommers-street-conder-act-2906
115987	House	2025-01-29	Guide $489,000	2025-04-03	$482,000	2	1	1		210.0	Ray White Goulburn	1419-faithfull-street-goulburn-nsw-2580
115994	Unit	2025-01-29	$519,000	2025-03-11	$505,000	2	1	1			Dwyer Properties Sapphire Coast	115-ives-street-pambula-nsw-2549
115999	House	2025-01-29	Contact agent	2025-06-12	Undisclosed	4	3	6		2023.0	Ray White Canberra	3-morning-street-gundaroo-nsw-2620
116001	House	2025-01-29	contact agent	2025-05-02	Undisclosed	4	2	2	5.5	250.0	home.by holly	6-banggu-street-throsby-act-2914
116004	House	2025-01-29	$400,000	2025-05-05	Undisclosed	3	1	2		512.0	Harcourts Greater Port Macquarie & The Rocks	311-river-street-greenhill-nsw-2440
116005	House	2025-01-29	New to Market	2025-02-04	Undisclosed	2	1	2		695.0	Raine & Horne Berry	166-pur-pur-avenue-lake-illawarra-nsw-2528-1
116010	Townhouse	2025-01-29	$779,000 - $829,000	2025-10-10	$750,000	3	2	2			Ian McNamee & Partners - Queanbeyan	2136-halloran-drive-jerrabomberra-nsw-2619
116012	Unit	2025-01-29	$499,000	2025-02-12	$480,000	2	1	2		915.0	Dwyer Properties Sapphire Coast	257-tura-beach-drive-tura-beach-nsw-2548
116014	House	2025-01-29	$775,000	2025-05-12	Undisclosed	3	1	2		782.0	Whale Coast Realty	50-mummaga-lake-drive-dalmeny-nsw-2546
116015	House	2025-01-29	Auction	2025-02-22	Undisclosed	3	2	2	1.0	729.0	Luton Tuggeranong	22-costello-circuit-calwell-act-2905
116017	House	2025-01-29	$1,750,000	2025-02-21	$1,750,000	10	2	0		1682.0	Blackshaw Real Estate Coastal	3-sproxtons-lane-nelligen-nsw-2536
116019	House	2025-01-29	AUCTION 22/02/2025	2025-02-15	Undisclosed	4	2	2	4.0	976.0	Ray White Canberra	24-walu-street-aranda-act-2614
116024	House	2025-01-29	$955,000	2025-05-12	$955,000	3	2	2	5.0		home.by holly	14-gwen-meredith-loop-franklin-act-2913
116025	DuplexSemi-detached	2025-01-29	$960,000	2025-03-05	$960,000	3	2	0	3.5	536.0	home.by holly	127-majura-avenue-dickson-act-2602
116026	House	2025-01-29	$1,200,000	2025-04-15	$1,200,000	4	2	0	1.0	664.0	home.by holly	5-kerferd-street-watson-act-2602
116028	House	2025-01-29	$890,000	2025-02-25	$850,000	4	2	2		815.4	Elders Real Estate Batemans Bay	6-timber-way-surf-beach-nsw-2536
116034	House	2025-01-29	$830,000 to $850,000	2025-02-19	Undisclosed	4	2	2		759.0	Harcourts Greater Port Macquarie & The Rocks	1-peter-mark-circuit-south-west-rocks-nsw-2431
116035	Townhouse	2025-01-29	Sold By Sam $625,000	2025-02-25	$625,000	3	3	2	6.0		MARQ Property	21b-narrambla-terrace-lawson-act-2617
116037	Terrace	2025-01-29	Sold by Sam $625,000	2025-03-13	$625,000	2	1	1	6.0	134.0	MARQ Property	19-quain-street-crace-act-2911
116038	House	2025-01-29	Sold By Sam $762,000	2025-02-18	$762,000	2	1	1	2.0	809.0	MARQ Property	118-pennefather-street-higgins-act-2615
116043	House	2025-01-30	$839,000	2025-08-05	$815,000	4	2	2		758.0	One Agency Wagga Wagga	70-best-street-wagga-wagga-nsw-2650
116045	House	2025-01-30	$1,250,000	2025-03-10	$1,235,000	4	2	2		872.0	One Agency Wagga Wagga	13-lansdowne-avenue-lake-albert-nsw-2650
116048	House	2025-01-30	Sold at Auction - $1,700,000	2025-02-22	$1,700,000	5	2	6	5.5	893.0	MARQ Property	2-bimberi-crescent-palmerston-act-2913
116049	Apartment	2025-01-30	$810,000+	2025-08-26	$810,000	2	2	2	6.0		MARQ Property	40359-constitution-avenue-campbell-act-2612
116050	House	2025-01-30	$1,110,000	2025-02-19	$1,110,000	4	2	2	4.0	612.0	MARQ Property	19-wallaman-street-harrison-act-2914
116051	House	2025-01-30	$880,000	2025-02-20	$880,000	3	2	2	3.5	390.0	MARQ Property	8-coomera-street-harrison-act-2914
116053	House	2025-01-30	Auction 20/02/2025	2025-02-15	Undisclosed	2	2	1	6.0	357.0	Ray White Canberra	21-john-holt-street-macgregor-act-2615
116055	House	2025-01-30	contact agent	2025-02-20	Undisclosed	4	2	2	0.5	865.0	home.by holly	31-kidston-crescent-curtin-act-2605
116056	House	2025-01-30	$900,000	2025-02-20	$900,000	2	1	1	0.0	865.0	home.by holly	78-higinbotham-street-watson-act-2602
116057	Townhouse	2025-01-30	$825,000	2025-02-26	$825,000	3	2	2	2.5		home.by holly	14-the-verge-phillip-act-2606
116058	Apartment	2025-01-30	$450,000	2025-03-11	$450,000	2	1	1	5.5		home.by holly	62-ranken-place-belconnen-act-2617
116059	House	2025-01-30	By Negotiation	2025-02-21	Undisclosed	3	2	2	6.0		LJ Hooker Gungahlin	5-6a-chadwick-street-taylor-act-2913
116060	House	2025-01-30	By Negotiation	2025-02-07	Undisclosed	3	1	2	1.5	872.0	LJ Hooker Gungahlin	238-southern-cross-drive-latham-act-2615
116061	Land	2025-01-30	$395,000	2025-08-26	$375,000	0	0	0		779.5	John Connell Real Estate	2-duffy-st-goulburn-nsw-2580-116061
116062	Apartment	2025-01-30	$428,000	2025-03-14	$428,000	1	1	1	6.0		home.by holly	54260-city-walk-city-act-2601
116063	Townhouse	2025-01-30	$540,000+	2025-02-13	$600,000	2	1	2	2.0		Morrissey Property	92-covington-crescent-charnwood-act-2615
116064	House	2025-01-30	AUCTION	2025-02-24	Undisclosed	4	2	2	4.0	652.0	McIntyre Property	3-humphrey-street-conder-act-2906
116065	Unit	2025-01-30	$560,000+	2025-03-20	$572,000	2	2	2	6.0	8104.0	Ray White Canberra	2520-beissel-street-belconnen-act-2617
116066	House	2025-01-30	Auction	2025-02-17	Undisclosed	4	2	2	4.5	405.0	LJ Hooker Woden/Weston	3-james-mcauley-crescent-wright-act-2611
116067	House	2025-01-30	$1,200,000	2025-03-17	$1,200,000	4	2	3	3.0	885.0	home.by holly	8-adams-place-watson-act-2602
116069	House	2025-01-30	$920,000+	2025-03-06	Undisclosed	4	2	1	3.5		My Morris	4-cooke-street-kambah-act-2902
116072	Apartment	2025-01-30	Auction	2025-02-11	Undisclosed	2	2	2	6.0		Luton Gungahlin	1650-lampard-circuit-bruce-act-2617
116074	Apartment	2025-01-30	$380,000+	2025-04-04	Undisclosed	2	1	0	6.0		McIntyre Property	413-waddell-place-curtin-act-2605
116078	House	2025-01-30	$835,000	2025-04-11	$835,000	3	1	2	0.5	823.0	home.by holly	31-dalgleish-close-spence-act-2615
116080	House	2025-01-30	AUCTION - 01/03/2025	2025-02-21	$1,300,000	4	2	2		7922.0	Ian McNamee & Partners - Queanbeyan	31-severne-street-greenleigh-nsw-2620
116083	House	2025-01-30	Auction	2025-02-19	$1,300,000	6	3	1	1.0	808.0	LJ Hooker Woden/Weston	13-potts-place-farrer-act-2607
116084	Unit	2025-01-30	$805,000	2025-02-27	$805,000	2	2	2	6.0		home.by holly	132-archibald-street-lyneham-act-2602
116086	House	2025-01-30	By Negotiation	2025-02-26	$970,000	4	2	2	1.0	978.0	LJ Hooker Gungahlin	61-kriewaldt-circuit-higgins-act-2615
116087	House	2025-01-30	$1,240,000	2025-05-16	$1,240,000	3	2	2	1.5	702.0	home.by holly	3-araba-street-aranda-act-2614
116089	House	2025-01-30	Sold prior to auction-$1,125,000	2025-02-13	$1,125,000	4	2	2	5.5	495.0	Stone Gungahlin	5-pender-street-casey-act-2913
116093	House	2025-01-30	Offers Above $630,000	2025-02-28	$650,000	3	1	2	0.0	688.0	Cream Residential	8-gannon-place-charnwood-act-2615
116094	Townhouse	2025-01-30	$610,000+	2025-02-19	Undisclosed	2	2	2	6.0		Luton Weston Creek, Woden & Molonglo Valley	7760-john-gorton-drive-coombs-act-2611
116098	House	2025-01-30	AUCTION 22/02/2025	2025-02-22	$830,000	3	1	2	2.5	818.0	Ray White Canberra	26-cantor-crescent-higgins-act-2615
116099	House	2025-01-30	$825,000	2025-03-24	Undisclosed	3	1	1		695.0	Ben Bate Real Estate	12-viewhill-road-kianga-nsw-2546
116100	House	2025-01-30	$1,220,000	2025-10-10	Undisclosed	4	2	23		8.37	Flemings Property Services	177-golden-grove-road-young-nsw-2594
116101	House	2025-01-30	Auction	2025-03-01	$1,175,000	3	2	2	0.0		Bertram Ellis	39-pelham-close-chapman-act-2611
116102	House	2025-01-30	$890,000 +	2025-03-19	$930,000	4	2	2	1.0	1038.0	Ray White Canberra	18-blackwell-circuit-flynn-act-2615
116103	House	2025-01-30	NEW PRICE $660,000	2025-04-29	$650,000	3	2	1		355.0	My Agent Team	12-wentworth-avenue-sunshine-bay-nsw-2536
116104	House	2025-01-30	$1,980,000 +	2025-03-06	Undisclosed	5	3	2	3.5	847.0	Ray White Canberra	11-gingana-street-aranda-act-2614
116107	Apartment	2025-01-30	$379,000 +	2025-03-20	$392,000	1	1	2	5.5		LJ Hooker Woden/Weston	7117-medley-street-chifley-act-2606
116112	Townhouse	2025-01-30	Auction	2025-02-05	Undisclosed	3	2	2	1.5	324.0	Luton Weston Creek, Woden & Molonglo Valley	73-florence-taylor-street-greenway-act-2900
116113	House	2025-01-30	Auction 19/02/2024	2025-02-07	$920,000	4	2	2	5.0	796.0	Ray White Canberra	22-merriman-crescent-macarthur-act-2904
116116	Unit	2025-01-30	New Price $649,000	2025-05-09	Undisclosed	2	2	2			Belle Property Snowy Mountains	98-clyde-street-jindabyne-nsw-2627
116118	Land	2025-01-30	$350,000	2025-03-11	$305,000	0	0	0		984.0	Dwyer Properties Sapphire Coast	13-bega-street-pambula-nsw-2549-116118
116122	Apartment	2025-01-30	$841,000	2025-02-05	$851,000	3	2	2	5.0		home.by holly	3643-ijong-street-braddon-act-2612
116124	Apartment	2025-01-30	Offers Over $585,000	2025-04-16	Undisclosed	1	1	1	5.0		NBHD Agency	1-100-northbourne-avenue-braddon-act-2612
116126	House	2025-01-30	$699,000 - $729,000	2025-03-06	$700,000	3	1	1		683.6	Ray White Batemans Bay	11-luks-way-batehaven-nsw-2536
116127	House	2025-01-30	AUCTION 20/02/2025	2025-02-20	Undisclosed	3	2	2	4.0	914.0	Ray White Canberra	21a-hibiscus-crescent-rivett-act-2611
116131	House	2025-01-30	$720,000	2025-02-20	$720,000	2	1	2	6.0	204.0	Stone Gungahlin	21-ultimo-street-crace-act-2911
116133	House	2025-01-30	$1,090,000 - $1,150,000	2025-10-13	$1,075,000	5	2	3		811.0	LJ Hooker Malua Bay	61-grantham-road-batehaven-nsw-2536
116136	Townhouse	2025-01-30	$729,000 +	2025-03-14	Undisclosed	3	2	2	5.0		Luton Tuggeranong	915-oxenham-circuit-gordon-act-2906
116137	House	2025-01-30	AUCTION	2025-02-22	$742,000	3	2	1	6.0	247.0	LJ Hooker Dickson	12-whitmore-crescent-watson-act-2602
116139	House	2025-01-30	$299,000	2025-02-13	$295,000	4	1	1		613.4	Kitson Property	39-chifley-crescent-kooringal-nsw-2650
116142	House	2025-01-30	$895,000	2025-10-14	$870,000	3	1	2		1189.0	Whale Coast Realty	10-john-reilly-street-dalmeny-nsw-2546
116146	House	2025-01-30	contact agent	2025-03-14	Undisclosed	4	2	3	4.0		home.by holly	43-liz-oneill-street-casey-act-2913
116154	House	2025-01-30	Auction	2025-02-22	Undisclosed	4	2	3	3.0	932.0	LJ Hooker Belconnen	10-erldunda-circuit-hawker-act-2614
116157	House	2025-01-30	$1,320,000	2025-06-11	Undisclosed	4	3	2	3.5	909.0	Luton Kippax	1-hedger-street-dunlop-act-2615
116160	House	2025-01-30	Price Guide $700,000 - $750,000	2025-02-20	Undisclosed	3	2	3		627.0	Harcourts Greater Port Macquarie & The Rocks	7-mayworth-avenue-port-macquarie-nsw-2444
116161	House	2025-01-30	$829,000	2025-02-24	Undisclosed	2	2	1		1018.0	PRD Wagga Wagga	19-beauty-point-avenue-turvey-park-nsw-2650
116170	Townhouse	2025-01-31	Auction	2025-02-22	Undisclosed	3	2	2	1.0	611.0	Luton Weston Creek, Woden & Molonglo Valley	5221-biddlecombe-street-pearce-act-2607
116171	Apartment	2025-01-31	$339,000+	2025-06-27	$337,500	1	1	1	6.0		Morrissey Property	941-braybrooke-street-bruce-act-2617
116176	Apartment	2025-01-31	$560,000	2025-02-19	Undisclosed	2	1	1	6.0		Luton Gungahlin	609-49-furzer-street-phillip-act-2606
116177	House	2025-01-31	$820,000+	2025-03-06	$840,000	3	2	2	4.5	620.0	Ray White Canberra	43-tarrant-crescent-dunlop-act-2615
116178	House	2025-01-31	$800,000+	2025-03-21	Undisclosed	3	2	2	2.0	933.0	LJ Hooker Kippax	76-jackie-howe-crescent-macarthur-act-2904
116185	House	2025-01-31	$1,695,000	2025-10-27	Undisclosed	4	3	5		1973.0	Ben Bate Real Estate	68-williamson-drive-north-narooma-nsw-2546
116189	House	2025-01-31	Auction	2025-02-12	Undisclosed	3	2	2	5.5	551.0	Luton Gungahlin	3-clarendon-street-amaroo-act-2914
116197	House	2025-01-31	$735,000	2025-05-20	$720,000	3	1	1		650.0	Raine & Horne Mollymook Milton	21-curtis-street-ulladulla-nsw-2539
116199	House	2025-01-31	$1,095,000-$1,140,000	2025-09-08	Undisclosed	4	2	3		1746.0	Ray White Bungendore	56-modbury-street-bungendore-nsw-2621
116203	House	2025-01-31	Contact Agent	2025-06-23	Undisclosed	8	5	2	3.5	1108.0	LJ Hooker Dickson	16b-mollee-crescent-isabella-plains-act-2905
116204	Townhouse	2025-01-31	$900,000 - $950,000	2025-05-28	$900,000	3	1	1			Raine & Horne Berry	236-campbell-street-gerringong-nsw-2534
116205	Townhouse	2025-01-31	$950,000	2025-10-31	$905,000	3	2	2			Raine & Horne Berry	136-campbell-street-gerringong-nsw-2534
116206	Townhouse	2025-01-31	$1,380,000	2025-05-06	$1,380,000	3	2	2	6.0		home.by holly	22-holder-street-turner-act-2612
116207	House	2025-01-31	$1,560,000	2025-05-06	$1,560,000	4	2	2	2.0		home.by holly	5-duffy-street-ainslie-act-2602
116210	Townhouse	2025-01-31	Offers: $610,000+	2025-02-20	$580,000	3	1	1	1.0	426.0	Ray White Canberra	2-1-cantor-crescent-higgins-act-2615
116212	House	2025-01-31	$635,000	2025-05-27	$635,000	2	1	1	6.0		home.by holly	50-tay-street-watson-act-2602
116215	House	2025-01-31	$940,000	2025-05-29	$940,000	4	1	6	2.5	1054.0	Luton Dickson	66-shakespeare-crescent-fraser-act-2615
116220	House	2025-01-31	$1,100,000 - $1,200,000	2025-05-09	$1,150,000	4	2	2		644.0	My Agent Team	23-buguri-crescent-malua-bay-nsw-2536
116222	House	2025-01-31	$399,000	2025-08-05	$355,000	3	1	2		2023.0	Macarthur Real Estate Agency	25-cave-street-ganmain-nsw-2702
116223	Land	2025-01-31	$99,000	2025-04-30	$95,000	0	0	0		1700.0	Macarthur Real Estate Agency	37-cave-street-ganmain-nsw-2702
116224	DuplexSemi-detached	2025-01-31	$1,050,000	2025-05-28	Undisclosed	3	2	1		360.0	Elders Real Estate Batemans Bay	190a-long-beach-road-long-beach-nsw-2536
116226	House	2025-01-31	Auction 22/02/25	2025-02-22	$1,415,000	5	3	2	1.0	1555.0	Ray White Canberra	44-ambalindum-street-hawker-act-2614
116227	House	2025-01-31	AUCTION 14/02/25	2025-02-14	$560,000	2	1	1	0.5	195.0	Ray White Canberra	1721-jinka-street-hawker-act-2614
116229	House	2025-01-31	Price Guide - $1,380,000	2025-04-02	$1,370,000	5	2	2		816.0	Raine & Horne Berry	4-broughton-avenue-tullimbar-nsw-2527
116232	House	2025-01-31	AUCTION 22/02/2025	2025-02-22	$1,087,500	3	2	2	4.5	564.0	Ray White Canberra	46-langtree-crescent-crace-act-2911
116234	House	2025-01-31	$1,395,000	2025-05-09	Undisclosed	4	2	2		1431.0	Smile Elite	39b-brighton-parade-culburra-beach-nsw-2540-116234
116237	House	2025-01-31	$549,900	2025-03-13	$549,900	3	1	1		648.0	Kitson Property	5-falcon-place-kooringal-nsw-2650
116244	House	2025-01-31	By Negotiation	2025-05-12	Undisclosed	4	3	4	4.0	469.0	Impact Properties	31-hibberd-crescent-forde-act-2914
116247	Villa	2025-01-31	$775,000	2025-02-20	$765,000	2	1	1			Raine & Horne Mollymook Milton	6-42-nurrawallee-street-ulladulla-nsw-2539
116250	House	2025-01-31	$539,000	2025-02-18	Undisclosed	3	2	2		1127.0	PRD Wagga Wagga	8-rockliff-court-lockhart-nsw-2656
116251	Townhouse	2025-01-31	$595,000 to $645,000	2025-03-05	$595,000	2	1	1			Ray White Bowral	58-arthur-street-moss-vale-nsw-2577
116254	House	2025-01-31	Price range $495,000 - $525,000	2025-05-19	$487,670	3	2	1			Smile Elite	32-lorking-parkes-nsw-2870-116254
116256	Lifestyle	2025-01-31	$2,100,000	2025-06-02	Undisclosed	4	2	12		25.0	Ray White Goulburn	272-chinamans-lane-goulburn-nsw-2580-116256
116259	House	2025-01-31	AUCTION	2025-02-26	$612,000	4	3	1		1014.0	Smile Elite	47-park-road-nowra-nsw-2541
116267	House	2025-02-02	$929,000	2025-05-06	$920,000	4	2	2		778.0	One Agency Wagga Wagga	25-nolan-street-lloyd-nsw-2650
116268	House	2025-02-02	$990,000	2025-04-07	$990,000	3	2	1		689.2	One Agency Gatty Coastal	55-allenby-road-tuross-head-nsw-2537
116283	House	2025-02-03	$990,000 - $1,050,000	2025-04-03	$995,000	4	2	2		457.0	My Agent Team	16b-buguri-crescent-malua-bay-nsw-2536-116283
116289	House	2025-02-03	$329,000	2025-06-26	Undisclosed	3	1	1		1353.0	Ray White Wagga Wagga	83-waterview-street-ganmain-nsw-2702
116290	House	2025-02-03	$1,300,000-$1,350,000	2025-02-28	$1,260,000	5	4	2		661.0	My Agent Team	2-dawarra-street-tomakin-nsw-2537-116290
116292	House	2025-02-03	$700,000 - $730,000	2025-02-18	$750,000	3	2	2		656.0	My Agent Team	2-courtenay-crescent-long-beach-nsw-2536
116293	House	2025-02-03	$870,000	2025-02-25	$870,000	4	2	1	3.5	877.0	Ray White Canberra	4-mighell-place-theodore-act-2905
116302	House	2025-02-03	$749,000	2025-05-14	$730,000	3	2	1		443.0	Merimbula Realty	7d-surf-circle-tura-beach-nsw-2548
116308	House	2025-02-03	AUCTION	2025-03-04	Undisclosed	2	2	2		1849.0	Belle Property Snowy Mountains	10-lakeview-terrace-east-jindabyne-nsw-2627
116309	House	2025-02-03	Price Guide $570,000 - $610,000	2025-02-19	Undisclosed	3	1	1		320.2	Harcourts Greater Port Macquarie & The Rocks	36a-boronia-street-port-macquarie-nsw-2444
116317	House	2025-02-03	Auction	2025-03-01	$1,100,000	4	2	2		930.0	Fitzpatricks	24-lakeside-drive-lake-albert-nsw-2650
116318	House	2025-02-03	AUCTION GUIDE $500,000	2025-02-28	$530,000	3	1	2		626.0	Ray White Goulburn	4-princes-avenue-goulburn-nsw-2580
116321	House	2025-02-03	$1,000,000	2025-04-30	Undisclosed	4	2	2		500.0	Raine & Horne Berry	8-catalina-place-badagarang-nsw-2540
116327	House	2025-02-04	$900,000+	2025-03-11	$921,000	4	2	2	4.48	450.0	Southern Property Canberra	56-charles-perkins-circuit-bonner-act-2914
116338	House	2025-02-04	$1,420,000	2025-08-01	Undisclosed	4	2	8		2500.0	Ray White Goulburn	100-ducks-lane-run-o-waters-nsw-2580-116338
116339	House	2025-02-04	$648,000 - $675,000	2025-05-16	$636,000	5	2	2		600.0	Smile Elite	16-hakea-drive-muswellbrook-nsw-2333-1
116346	Townhouse	2025-02-04	$575,000 to $595,000	2025-02-24	Undisclosed	2	1	1			Ray White Bowral	68-arthur-street-moss-vale-nsw-2577
116354	Retirement	2025-02-04	$240,000	2025-02-25	Undisclosed	1	1	1		657.0	Harcourts Greater Port Macquarie & The Rocks	54-collin-tait-avenue-west-kempsey-nsw-2440
116356	House	2025-02-04	$575,000 - $600,000	2025-04-04	$580,000	4	1	2		781.0	Smile Elite	6-almeria-glen-muswellbrook-nsw-2333
116357	Apartment	2025-02-04	Offers Over $299,000	2025-03-14	$300,000	1	1	1	6.0		Luton Manuka	9027-coxen-street-hughes-act-2605
116364	House	2025-02-04	Price Guide $700,000 to $720,000	2025-04-10	Undisclosed	4	3	1		856.0	Harcourts Greater Port Macquarie & The Rocks	11a-campbell-street-wauchope-nsw-2446
116366	House	2025-02-04	$880 000 - $920 000	2025-05-28	$870,000	4	2	2		911.0	My Agent Team	20-canning-crescent-sunshine-bay-nsw-2536
116370	House	2025-02-04	$630,000 - $660,000	2025-03-14	Undisclosed	3	1	3		600.7	Ray White Wagga Wagga	17-croaker-street-turvey-park-nsw-2650
116371	House	2025-02-04	$1,350,000 - $1,400,000	2025-04-28	$1,310,000	3	1	1		2.34	LJ Hooker Country Canberra	89-old-gold-mines-road-sutton-nsw-2620
116373	House	2025-02-04	Offers invited - guide $2.5m	2025-06-06	$2,450,000	4	2	3		1.14	Ray White Bowral	522-ellsmore-road-exeter-nsw-2579
116377	Land	2025-02-04	$599,000+	2025-07-15	$620,000	0	0	0		384.0	LJ Hooker Kaleen	12-skyring-street-whitlam-act-2611
116381	House	2025-02-04	By Negotiation	2025-03-20	$848,000	4	2	2	3.0	1307.0	Luton Tuggeranong	37-twamley-crescent-richardson-act-2905
116388	Land	2025-02-04	$175,000	2025-03-13	Undisclosed	0	0	0		2606.0	Ray White Wagga Wagga	18-24-menangle-street-ganmain-nsw-2702
116389	Unit	2025-02-04	$549,000	2025-07-16	$520,000	2	1	2			LJ Hooker Malua Bay	109-11-bent-street-batemans-bay-nsw-2536
116392	Townhouse	2025-02-04	$650,000+	2025-06-16	$650,000	4	2	2	6.0		LJ Hooker Gungahlin	2484-kings-canyon-street-harrison-act-2914
116398	House	2025-02-04	$780,000	2025-05-22	$746,000	3	1	4		3218.0	Smile Elite	78-spencer-street-moruya-nsw-2537
116401	House	2025-02-05	$699,000 - $709,000	2025-02-26	$705,000	3	2	2		439.0	One Agency Wagga Wagga	144-muttama-parade-gobbagombalin-nsw-2650-116401
116405	House	2025-02-05	$1,100,000+	2025-03-07	$1,062,000	5	3	2	1.0	1062.08	McIntyre Property	30-mehaffey-crescent-theodore-act-2905
116410	Unit	2025-02-05	$225,000	2025-06-11	$213,000	1	1	1			Flemings Property Services	4322-parker-street-cootamundra-nsw-2590
116414	House	2025-02-05	$580,000-$620,000	2025-03-26	$591,000	3	1	3		653.0	Ray White Queanbeyan | Jerrabomberra	21-margaret-street-karabar-nsw-2620
116417	House	2025-02-05	Auction	2025-02-22	$862,500	4	2	2	0.0	919.0	LJ Hooker Belconnen	103-copland-drive-melba-act-2615
116418	Unit	2025-02-05	Auction	2025-03-01	$318,000	2	1	1	5.0		LJ Hooker Belconnen	23-bonrook-street-hawker-act-2614
116421	House	2025-02-05	Auction	2025-03-01	Undisclosed	3	2	2	3.0		Luton Gungahlin	9-shepherdson-place-isaacs-act-2607
116426	Unit	2025-02-05	$550,000	2025-06-12	Undisclosed	1	1	2			Belle Property Snowy Mountains	235-cobbon-crescent-jindabyne-nsw-2627-116426
116428	House	2025-02-05	Auction	2025-02-22	$705,000	3	1	1	1.0	469.0	LJ Hooker Belconnen	3-byram-place-florey-act-2615
116431	Townhouse	2025-02-05	$1,395,000 +	2025-06-12	Undisclosed	4	2	2	4.5		VERV Property	2-16-leighton-street-pearce-act-2607
116433	Apartment	2025-02-05	$625,000	2025-12-01	$620,000	2	2	1	6.00		Maloney's Property	103107-canberra-avenue-griffith-act-2603
116434	House	2025-02-05	Sold prior to auction-$1,130,000	2025-02-14	$1,130,000	4	2	2	6.0	378.0	Stone Gungahlin	32-cocoparra-crescent-crace-act-2911
116439	House	2025-02-05	AUCTION - 01/03/2025	2025-03-01	$957,000	4	2	2		961.1	Ian McNamee & Partners - Queanbeyan	10-terrara-close-jerrabomberra-nsw-2619
116440	Unit	2025-02-05	$390,000+	2025-03-04	Undisclosed	3	2	1	4.0		Luton Kippax	1728-springvale-drive-hawker-act-2614
116441	Townhouse	2025-02-05	$625,000 - $675,000	2025-02-25	$650,000	2	1	2			McIntyre Property	114-ford-street-queanbeyan-east-nsw-2620
116447	House	2025-02-05	By Negotiation	2025-02-26	$760,000	3	2	2	4.0	380.0	LJ Hooker Gungahlin	12-marika-street-ngunnawal-act-2913
116448	House	2025-02-05	$850,000 - $895,000	2025-09-08	$830,000	3	2	0		1362.0	My Agent Team	19-braidwood-street-nelligen-nsw-2536
116450	House	2025-02-05	$619,000	2025-03-03	Undisclosed	3	2	4		1231.0	Flemings Property Services	17-pineview-circuit-young-nsw-2594
116451	House	2025-02-05	By Negotiation	2025-03-03	$670,000	3	1	1	5.5	378.0	LJ Hooker Gungahlin	4-maynard-street-ngunnawal-act-2913
116453	Unit	2025-02-05	Price Guide $580,000 to $620,000	2025-03-20	Undisclosed	2	1	1			Harcourts Greater Port Macquarie & The Rocks	15-58-64-pacific-drive-port-macquarie-nsw-2444-116453
116457	House	2025-02-05	$820,000+	2025-03-19	$842,500	3	2	6	3.5	677.0	McIntyre Property	12-glencross-street-chisholm-act-2905
116462	House	2025-02-05	Auction	2025-03-03	Undisclosed	4	2	2	2.0	1377.0	Luton Manuka	108-vasey-crescent-campbell-act-2612
116464	Apartment	2025-02-05	$340,000	2025-03-13	$340,000	1	1	1	6.0		LJ Hooker Belconnen	1113120-eastern-valley-way-belconnen-act-2617
116465	Apartment	2025-02-05	$495,000+	2025-05-15	$490,000	2	1	1	4.5		Luton Manuka	5221-aspinall-street-watson-act-2602
116467	Apartment	2025-02-05	$370,000+	2025-05-01	$365,000	1	1	1	6.0		McIntyre Property	35311-anketell-street-greenway-act-2900
116474	House	2025-02-05	$595,000	2025-04-02	$510,000	4	1	2		575.0	Whale Coast Realty	16-thomson-parade-dalmeny-nsw-2546
116475	House	2025-02-05	Guide $1,495,000	2025-05-22	Undisclosed	6	3	6		1357.0	Belle Property Snowy Mountains	1-acacia-place-east-jindabyne-nsw-2627
116477	House	2025-02-05	$840,000	2025-02-05	$840,000	3	2	2	6.0		Stone Gungahlin	11-sarre-street-gungahlin-act-2912
116483	House	2025-02-05	$1,025,000	2025-04-10	$985,000	3	2	2		5.0	Ray White Goulburn	181-mutmutbilly-road-breadalbane-nsw-2581
116485	House	2025-02-06	$1,249,000	2025-04-04	Undisclosed	3	2	2	2.0	745.0	Luton Weston Creek, Woden & Molonglo Valley	7-wrest-street-lyons-act-2606
116486	Apartment	2025-02-06	$500,000+	2025-03-17	$500,000	2	1	1	6.0		MARQ Property	13439-benjamin-way-belconnen-act-2617
116487	Land	2025-02-06	$169,000	2025-03-12	$160,000	0	0	0		2024.0	Kitson Property	80-82-loch-street-ganmain-nsw-2702
116489	House	2025-02-06	$849,000+	2025-03-13	Undisclosed	3	1	1	3.0	732.0	Ray White Canberra	3-moy-place-macquarie-act-2614
116493	Apartment	2025-02-06	$365,000	2025-06-06	Undisclosed	1	1	1	6.0		Luton Weston Creek, Woden & Molonglo Valley	7132-thynne-street-bruce-act-2617
116494	Apartment	2025-02-06	$529,000	2025-03-17	Undisclosed	1	1	1	6.0		Luton Manuka	2420-eyre-street-kingston-act-2604
116496	DuplexSemi-detached	2025-02-06	$1,675,000	2025-03-01	$1,675,000	2	1	1	1.5	712.0	home.by holly	63-leichhardt-street-kingston-act-2604
116498	House	2025-02-06	$1,520,000	2025-03-01	$1,520,000	4	2	1	4.5	752.0	Ray White Canberra	88-mackellar-crescent-cook-act-2614
116500	House	2025-02-06	Contact Agent	2025-07-30	Undisclosed	4	2	2	3.5	785.0	Solely Properties	13-fitzhardinge-crescent-evatt-act-2617
116501	House	2025-02-06	$685,000+	2025-04-14	$682,000	3	1	2	2.5	544.0	McIntyre Property	60-wiburd-street-banks-act-2906
116506	House	2025-02-06	$920,000	2025-02-20	$920,000	3	2	2	3.5	814.0	home.by holly	31-pickles-street-scullin-act-2614
116508	House	2025-02-06	$890,000	2025-03-21	$890,000	2	1	1		785.0	MUM Real Estate	31-forest-way-mollymook-beach-nsw-2539
116510	House	2025-02-06	Auction 01/03/2025	2025-03-01	$1,015,000	4	2	3	2.0	780.0	Ray White Canberra	22-osullivan-street-higgins-act-2615
116512	House	2025-02-06	Auction	2025-02-20	Undisclosed	4	2	2	1.0	965.0	Agent Team	35-partridge-street-fadden-act-2904
116514	House	2025-02-06	$1,150,000+	2025-02-20	Undisclosed	5	2	2	5.5	564.0	LJ Hooker Kippax	101-henry-williams-street-bonner-act-2914
116515	Unit	2025-02-06	$675,000	2025-02-25	Undisclosed	4	1	1	4.0	9995.0	Ray White Canberra	145-hyndes-crescent-holder-act-2611
116516	House	2025-02-06	Auction 26/02/2025	2025-02-26	$905,000	3	2	1	4.5	854.0	Ray White Canberra	6-mackerras-crescent-theodore-act-2905
116518	House	2025-02-06	AUCTION 27/02/2025	2025-02-12	$1,010,000	4	2	2	0.0	728.0	Ray White Canberra	8-strehlow-place-flynn-act-2615
116522	House	2025-02-06	$729,000+	2025-02-19	Undisclosed	3	2	2	5.0	358.0	LJ Hooker Gungahlin	19-tipiloura-street-ngunnawal-act-2913
116523	House	2025-02-06	$445,000	2025-03-17	$435,000	3	1	1		680.0	Flemings Property Services	155-albury-street-harden-nsw-2587
116524	House	2025-02-06	$425,000	2025-05-16	$420,000	3	1	1		613.0	Belle Property Snowy Mountains	1-kurang-place-cooma-nsw-2630
116526	Townhouse	2025-02-06	$679,000+	2025-07-29	$670,000	2	1	1	3.5		Stone Gungahlin	197-watling-place-weston-act-2611
116528	House	2025-02-06	$1,901,000	2025-03-01	$1,901,000	4	2	1	5.5	594.0	home.by holly	42-stephen-street-ainslie-act-2602
116531	House	2025-02-06	Sold Prior to Auction	2025-02-25	$1,325,000	4	2	1	0.0	972.0	Cream Residential	10-ogilvie-place-garran-act-2605
116532	House	2025-02-06	$1,230,000 +	2025-06-13	Undisclosed	4	2	2	1.0	787.0	Cream Residential	11-dry-street-curtin-act-2605
116533	House	2025-02-06	Auction 1/3/25	2025-03-01	$1,714,000	4	2	1	3.5	728.0	Ray White Canberra	7-greenhood-place-oconnor-act-2602
116534	House	2025-02-06	Another SOLD in 1 Week by Irving - 0468 956 677	2025-02-21	Undisclosed	3	2	2		350.2	Smile Elite	1-hamish-circuit-stanhope-gardens-nsw-2768
116535	House	2025-02-06	$1,395,000	2025-06-03	Undisclosed	4	2	2		441.0	PRD Wagga Wagga	119-morgan-street-wagga-wagga-nsw-2650
116536	Townhouse	2025-02-06	Contact Agent	2025-02-25	Undisclosed	3	2	3	1.0		Luton Kippax	6a-trickett-street-holt-act-2615
116537	Townhouse	2025-02-06	$700,000	2025-03-18	Undisclosed	3	2	2	4.0		Luton Gungahlin	317-conner-close-palmerston-act-2913
116538	Townhouse	2025-02-06	Auction	2025-04-14	Undisclosed	2	2	2	5.0		Luton Tuggeranong	39135-easty-street-phillip-act-2606
116541	House	2025-02-06	$850,000+	2025-04-02	Undisclosed	4	2	2	2.5	694.0	LJ Hooker Kippax	8-broadbent-street-scullin-act-2614
116543	House	2025-02-06	$1,099,000	2025-03-01	$1,099,000	3	2	1	1.5	831.0	Ray White Canberra	37-skinner-street-cook-act-2614
116544	House	2025-02-06	$1,999,000 - $2,199,000	2025-06-11	$1,875,000	5	3	6		6942.0	Ian McNamee & Partners - Queanbeyan	33-severne-street-greenleigh-nsw-2620
116545	House	2025-02-06	Auction	2025-03-01	Undisclosed	3	2	2	3.0		Luton Kippax	76-clarey-crescent-spence-act-2615
116548	House	2025-02-06	$650,000+	2025-02-28	$670,000	3	1	2	3.0	565.0	LJ Hooker Tuggeranong	6-tumbleton-place-isabella-plains-act-2905
116549	Lifestyle	2025-02-06	$1,690,000	2025-05-02	Undisclosed	4	2	5		66.47	Flemings Property Services	753-conimbla-road-cowra-nsw-2794
116550	House	2025-02-06	Auction 01/03/2025	2025-03-01	$861,000	3	2	1	6.0	328.0	Ray White Canberra	27-fullston-way-holt-act-2615
116552	Townhouse	2025-02-06	Auction	2025-03-01	$1,230,000	3	2	2	5.0	145.0	Luton Dickson	62-moorhouse-street-oconnor-act-2602
116554	House	2025-02-06	$1,210,000	2025-03-01	$1,210,000	3	1	1	1.0		home.by holly	9-sherbrooke-street-ainslie-act-2602
116560	House	2025-02-06	Contact agent	2025-05-21	Undisclosed	3	1	1		556.0	Blackshaw Real Estate Coastal	21-sunset-street-surfside-nsw-2536-1
116562	House	2025-02-06	$980,000 - $1,050,000	2025-05-06	$920,000	3	2	5		3.05	LJ Hooker Moruya	40-lilydale-place-bergalia-nsw-2537
116563	House	2025-02-06	$960,000	2025-03-13	$950,000	3	1	4		1821.0	LJ Hooker Moruya	359-south-head-road-moruya-heads-nsw-2537
116566	House	2025-02-06	contact agent	2025-04-29	Undisclosed	4	1	2	1.5	897.0	home.by holly	5-dunn-place-hackett-act-2602
116568	House	2025-02-06	$720,000	2025-02-27	$720,000	3	2	1		478.0	Blackshaw Real Estate Coastal	11-vince-place-malua-bay-nsw-2536
116569	Apartment	2025-02-06	$420,000	2025-03-04	$420,000	1	1	1	6.0		home.by holly	11517-dooring-street-braddon-act-2612
116570	Townhouse	2025-02-06	$937,500	2025-05-01	$937,500	3	2	2	2.5		home.by holly	19215-aspinall-street-watson-act-2602
116571	Apartment	2025-02-06	$520,000	2025-04-03	$520,000	2	1	1	6.0		home.by holly	3419-condamine-street-turner-act-2612
116574	Apartment	2025-02-06	$429,000+	2025-02-25	Undisclosed	2	1	1	6.0		Luton Weston Creek, Woden & Molonglo Valley	5039-woodberry-avenue-coombs-act-2611
116575	House	2025-02-06	$1,149,000+	2025-03-26	Undisclosed	5	3	3	5.0	406.0	Stone Gungahlin	360-anthony-rolfe-avenue-harrison-act-2914
116582	House	2025-02-06	Price By Negotiation	2025-10-02	$1,410,000	3	2	1		795.0	Raine & Horne Mollymook Milton	32-alaska-street-cunjurong-point-nsw-2539
116583	House	2025-02-06	Auction	2025-03-07	$1,275,000	5	3	2	4.5	895.0	LJ Hooker Kippax	6-mag-place-dunlop-act-2615
116584	House	2025-02-06	SOLD - $1,900,000	2025-05-16	$1,900,000	5	3	2	5.5	540.0	Stone Gungahlin	6-quenda-close-throsby-act-2914
116585	Townhouse	2025-02-06	$650,000	2025-06-27	Undisclosed	3	2	1	6.0		Luton Gungahlin	16-68-mcmichael-terrace-denman-prospect-act-2611
116586	House	2025-02-06	Auction	2025-03-01	$1,225,000	3	2	2	2.5	695.0	LJ Hooker Woden/Weston	40-kitchener-street-hughes-act-2605
116587	Apartment	2025-02-06	$650,000	2025-08-25	Undisclosed	3	2	2	6.0	3035.0	LJ Hooker Canberra City	85-11-camilleri-way-gungahlin-act-2912
116589	House	2025-02-06	Auction 1st March	2025-02-17	$825,000	3	1	1	3.5	835.0	LJ Hooker Dickson	6-humphris-place-gowrie-act-2904
116591	House	2025-02-06	OPEN HOUSE CANCELLED - UNDER OFFER	2025-02-28	$1,335,000	5	2	2		964.0	Ray White Bowral	11-blackett-place-bowral-nsw-2576
116596	House	2025-02-07	$1,250,000	2025-02-24	$1,250,000	3	2	2	3.5	779.0	home.by holly	46-abeckett-street-watson-act-2602
116597	House	2025-02-07	AUCTION	2025-02-21	$935,000	4	2	2	3.0	1126.0	McIntyre Property	3-crommelin-place-chisholm-act-2905
116600	House	2025-02-07	$1,290,000 - $1,390,000	2025-02-20	$1,390,000	4	2	1		1125.0	Fitzpatricks	51-balmoral-crescent-lake-albert-nsw-2650
116607	Apartment	2025-02-07	$765,000	2025-02-18	Undisclosed	2	2	1	0.0		Luton Manuka	628-gosse-street-kingston-act-2604
116612	Townhouse	2025-02-07	Auction 12/03/2025	2025-02-24	$510,000	2	1	2	5.0		LJ Hooker Dickson	90-newbold-lane-gungahlin-act-2912
116615	Cropping	2025-02-07	$630,000	2025-03-13	$656,000	3	1	0		20.35	Kitson Property	1-walker-street-humula-nsw-2652
116616	House	2025-02-07	$720,000	2025-06-06	$720,000	3	1	1	3.0	451.0	home.by holly	3-coningham-street-gowrie-act-2904
116641	House	2025-02-07	$750,000	2025-03-04	$750,000	3	1	0	2.5	677.0	home.by holly	12-shand-place-latham-act-2615
116655	House	2025-02-07	$875,000	2025-03-26	Undisclosed	4	2	2		700.0	Ray White Goulburn	19-quiberon-way-goulburn-nsw-2580
116668	House	2025-02-07	By Negotiation	2025-02-07	Undisclosed	4	2	2		547.0	One Agency Gatty Coastal	82-coogee-street-tuross-head-nsw-2537
116671	House	2025-02-07	Price Guide: $1,490,000 - $1,500,000	2025-03-19	$1,440,000	4	3	2		661.0	Raine & Horne Mollymook Milton	51-tallwood-avenue-mollymook-beach-nsw-2539
116673	House	2025-02-07	$1,200,000	2025-02-20	$1,220,000	4	2	2		471.0	Smile Elite	14-st-ives-road-flinders-nsw-2529
116680	House	2025-02-07	Contact Agent	2025-06-04	Undisclosed	4	2	4	0.0	3019.0	Raine & Horne Southern Highlands	34-narellan-road-moss-vale-nsw-2577
116690	House	2025-02-10	Guide $1,625,000	2025-04-03	Undisclosed	5	2	2		800.0	Ray White Bowral	31-kingsbury-circuit-bowral-nsw-2576
116698	Apartment	2025-02-10	$520,000	2025-04-14	$512,000	2	2	1	6.0		Ray White Canberra	1111-4-grazier-lane-belconnen-act-2617
116704	House	2025-02-10	$1,285,000	2025-05-30	$1,285,000	5	4	2		40.0	Elders Real Estate Batemans Bay	20-western-distributor-road-currowan-nsw-2536
116718	House	2025-02-10	$799,000	2025-04-04	Undisclosed	5	1	2		524.8	Ray White Wagga Wagga	61-wollundry-avenue-wagga-wagga-nsw-2650
116725	House	2025-02-10	Contact Agent	2025-03-06	Undisclosed	4	2	2		912.8	Ray White Wagga Wagga	19-kimba-drive-glenfield-park-nsw-2650
116727	AcreageSemi-rural	2025-02-10	$2,290,000	2025-09-19	Undisclosed	5	2	6		15.0	Ray White Bungendore	1191-norton-road-wamboin-nsw-2620
116728	House	2025-02-10	$795,000	2025-10-24	$740,000	3	2	2		556.0	Fraser-Gray Real Estate	46-kingston-place-tomakin-nsw-2537
116735	Townhouse	2025-02-10	$635,000	2025-02-25	$617,720	2	2	1		158.0	Raine & Horne Mollymook Milton	314-buchan-street-mollymook-nsw-2539
116739	House	2025-02-10	$749,000	2025-03-08	$749,000	4	2	2		432.0	Raine & Horne Goulburn	11-kavanagh-street-goulburn-nsw-2580
116740	House	2025-02-10	$875,000	2025-04-11	$850,000	5	3	2		749.0	Raine & Horne Goulburn	3-3a-evangelista-st-goulburn-nsw-2580-116740
116742	House	2025-02-10	$490,000	2025-06-18	$467,500	2	1	1		200.0	Raine & Horne Goulburn	619-faithfull-street-goulburn-nsw-2580
116746	House	2025-02-11	AUCTION GUIDE $500,000	2025-02-28	$575,000	3	1	1		727.0	Ray White Goulburn	16-coromandel-street-goulburn-nsw-2580
116748	House	2025-02-11	$390,000	2025-04-02	Undisclosed	3	1	2		575.4	PRD Wagga Wagga	44-gilmore-avenue-mount-austin-nsw-2650
116756	House	2025-02-11	Auction 05/03/2025	2025-03-05	Undisclosed	5	2	4	2.0	2190.0	Ray White Canberra	8-goodparla-street-hawker-act-2614
116759	House	2025-02-11	$740,000 - $760,000	2025-03-07	$740,000	3	1	1		553.0	My Agent Team	42-yugura-street-malua-bay-nsw-2536
116761	House	2025-02-11	$799,000	2025-04-14	$790,000	3	2	2		749.0	LJ Hooker Malua Bay	13-youralla-avenue-malua-bay-nsw-2536
116762	Villa	2025-02-11	Price Guide $475,000 - $485,000	2025-02-24	Undisclosed	2	1	1			Harcourts Greater Port Macquarie & The Rocks	199-cameron-street-wauchope-nsw-2446
116766	House	2025-02-11	$670,000	2025-08-07	$660,000	4	2	2		973.0	Belle Property Snowy Mountains	72-orana-avenue-cooma-nsw-2630
116778	House	2025-02-11	$995,000+	2025-03-17	$1,010,000	4	2	6	1.0	957.0	Ray White Canberra	45-glencross-street-chisholm-act-2905
116779	Land	2025-02-11	$390,000	2025-04-28	$390,000	0	0	0		2.45	Ray White Goulburn	13-gibson-street-goulburn-nsw-2580
116782	House	2025-02-11	$505,000 - $525,000	2025-09-03	$510,000	3	2	1		1402.0	Smile Elite	10-racecourse-road-muswellbrook-nsw-2333
116790	House	2025-02-11	$555,000	2025-03-14	Undisclosed	3	1	1		524.0	Harcourts Greater Port Macquarie & The Rocks	32-flobern-avenue-wauchope-nsw-2446
116791	House	2025-02-11	$400,000	2025-05-02	$390,000	4	1	0		595.0	PRD Wagga Wagga	163-raye-street-tolland-nsw-2650
116792	Unit	2025-02-11	$530,000	2025-09-22	$520,000	2	1	1			Elders Real Estate Batemans Bay	9388-beach-road-batehaven-nsw-2536
116797	AcreageSemi-rural	2025-02-11	$1,940,000-$1,990,000	2025-03-26	$1,932,000	6	3	10		10.0	Ray White Bungendore	345-weeroona-drive-wamboin-nsw-2620
116798	House	2025-02-11	$639,000	2025-04-28	$620,000	4	2	2		749.2	Macarthur Real Estate Agency	8-beech-street-forest-hill-nsw-2651
116803	House	2025-02-11	$895,000	2025-03-17	$917,500	4	2	2		1607.0	PRD Wagga Wagga	28-lakehaven-drive-lake-albert-nsw-2650
116809	House	2025-02-11	Sale by Negotiation	2025-04-02	$1,038,000	4	2	2	5.5	441.0	LJ Hooker Kippax	15-bob-whan-street-strathnairn-act-2615
116814	House	2025-02-11	Auction (Unless Sold Prior)	2025-10-03	$1,500,000	4	2	8		3479.0	Ray White Goulburn	17-bonnett-drive-run-o-waters-nsw-2580
116818	Villa	2025-02-12	$475,000	2025-03-03	$475,000	2	1	1		210.0	One Agency Wagga Wagga	144-fay-avenue-kooringal-nsw-2650
116819	House	2025-02-12	Auction 05/03/2025	2025-03-05	Undisclosed	5	3	4	4.5	769.0	Ray White Canberra	58-paperbark-street-banks-act-2906
116824	Townhouse	2025-02-12	$749,000 +	2025-08-01	Undisclosed	3	2	2	6.0		Premier Capital Properties	145-sutherland-crescent-taylor-act-2913
116825	AcreageSemi-rural	2025-02-12	$880,000 - $925,000	2025-05-15	$860,000	4	1	6		10600.0	Macarthur Real Estate Agency	21-25-orr-street-coolamon-nsw-2701-116825
116826	Unit	2025-02-12	Offers Over $395,000	2025-03-14	$390,000	2	1	1	6.0		LJ Hooker Dickson	1139-49-brigalow-street-oconnor-act-2602
116827	House	2025-02-12	$59,000	2025-04-02	$65,500	1	1	0			LJ Hooker Malua Bay	130-6-lyttle-street-broulee-nsw-2537-116827
116831	House	2025-02-12	$929,000	2025-03-12	$980,126	2	2	1			LJ Hooker Malua Bay	116-kuppa-avenue-malua-bay-nsw-2536
116835	Apartment	2025-02-12	$1,650,000+	2025-03-19	Undisclosed	3	2	2	6.0		MRKT Property	606-82-wentworth-avenue-kingston-act-2604
116848	Unit	2025-02-12	$440,000	2025-05-07	$442,000	1	1	1	6.0		LJ Hooker Belconnen	63-towns-crescent-turner-act-2612
116850	House	2025-02-12	Auction	2025-03-17	Undisclosed	5	4	2	4.5	420.0	Altair Property	19-patkin-street-whitlam-act-2611
116853	Unit	2025-02-12	$550,000	2025-03-12	$550,000	1	1	1	6.0		LJ Hooker Belconnen	113-burbury-close-barton-act-2600
116855	House	2025-02-12	$850,000 to $875,000	2025-04-04	$850,000	4	2	4		758.79	Smile Elite	32-tallyan-point-road-basin-view-nsw-2540
116857	Apartment	2025-02-12	$397,400	2025-03-21	$397,400	1	1	1	6.0		home.by holly	317-wimmera-street-harrison-act-2914
116858	House	2025-02-12	Price By Negotiation	2025-05-08	$865,000	3	1	2		582.0	Raine & Horne Mollymook Milton	9-hollywood-avenue-ulladulla-nsw-2539
116862	House	2025-02-12	Offers Over $799,000	2025-03-14	$815,000	3	1	2	3.0	733.0	McIntyre Property	9-duggan-street-calwell-act-2905
116863	House	2025-02-12	$599,000	2025-04-24	$599,000	4	2	2		581.7	Fitzpatricks	45-kilpatrick-street-kooringal-nsw-2650
116868	Apartment	2025-02-12	$850,000	2025-04-03	$840,000	2	2	2	6.0		Maloney's Property	4181-kalma-way-campbell-act-2612
116874	House	2025-02-12	$1,550,000	2025-04-22	$1,530,000	5	4	2	4.0	917.0	Ray White Canberra	4-buckmaster-crescent-dunlop-act-2615
116875	House	2025-02-12	$1,275,000 - $1,325,000	2025-03-07	$1,275,000	4	2	2		722.0	Ian McNamee & Partners - Queanbeyan	8-silky-oak-circle-jerrabomberra-nsw-2619
116879	House	2025-02-12	Sold By Sam $1,095,000	2025-03-08	$1,095,000	4	2	2	6.0	457.0	MARQ Property	176-langtree-crescent-crace-act-2911
116880	House	2025-02-12	Sold By Sam $872,000	2025-03-08	$872,000	3	1	1	6.0	735.0	MARQ Property	15-jacobs-street-evatt-act-2617
116882	Terrace	2025-02-12	Sold By Sam $885,000	2025-03-25	$885,000	3	2	3	5.0	307.0	MARQ Property	5-fairfield-street-crace-act-2911
116883	House	2025-02-12	$750,000+	2025-03-12	$770,000	4	1	0	0.5	1116.0	McIntyre Property	28-crozier-circuit-kambah-act-2902
116884	House	2025-02-12	Price by Negotiation	2025-05-12	$1,650,000	4	2	1		575.4	Raine & Horne Mollymook Milton	14-normandy-street-narrawallee-nsw-2539
116885	House	2025-02-12	$865,000	2025-04-28	$850,000	3	2	2		862.0	Whale Coast Realty	18-mummaga-lake-drive-dalmeny-nsw-2546
116893	House	2025-02-12	AUCTION 06/03/25	2025-03-06	Undisclosed	4	2	2	3.5	1560.0	Ray White Canberra	18-packer-street-weetangera-act-2614
116895	House	2025-02-12	$890,000	2025-02-27	$890,000	4	2	1		800.0	Belle Property Batemans Bay	37-warragai-place-malua-bay-nsw-2536
116896	House	2025-02-12	Guide $2,100,000 - $2,300,000	2025-05-27	Undisclosed	5	2	1		663.9	Raine & Horne Mollymook Milton	19-matron-porter-drive-narrawallee-nsw-2539
116897	House	2025-02-12	$635,000	2025-04-15	$626,000	3	2	2		722.0	Professionals Nowra	104-isa-road-worrigee-nsw-2540
116901	Apartment	2025-02-12	$375,000	2025-03-18	$365,000	1	1	1	6.0		Impact Properties	412-34-oakden-street-greenway-act-2900
116904	House	2025-02-13	$1,159,000	2025-03-18	Undisclosed	3	3	4	3.5	860.0	Luton Manuka	7-mullins-place-gowrie-act-2904
116905	House	2025-02-13	Auction	2025-03-06	$3,100,000	5	3	3	4.0	1369.0	Luton Manuka	8-titheradge-place-chapman-act-2611
116906	House	2025-02-13	Auction	2025-03-05	Undisclosed	4	2	2	2.0	1041.0	Luton Manuka	3-wyola-place-kaleen-act-2617
116908	House	2025-02-13	Auction	2025-03-05	$1,430,000	3	2	1	3.5	909.0	Luton Manuka	25-lynch-street-hughes-act-2605
116909	Townhouse	2025-02-13	Auction	2025-02-25	$675,000	2	2	2			Luton Manuka	1-4-powell-street-queanbeyan-east-nsw-2620
116910	House	2025-02-13	$935,000	2025-03-21	Undisclosed	4	2	2		453.0	Hawk Real Estate	4-pemberton-place-jerrabomberra-nsw-2619
116911	House	2025-02-13	Auction	2025-03-08	$1,720,000	4	2	2	0.5	862.0	Luton Manuka	27-glasgow-street-hughes-act-2605
116912	Townhouse	2025-02-13	contact agent	2025-03-06	Undisclosed	2	1	1	3.5	227.5	home.by holly	4632-bunbury-street-stirling-act-2611
116913	House	2025-02-13	$760,000+	2025-02-17	$693,000	3	2	2	4.0	506.7	Ray White Canberra	61-hugh-mckay-crescent-dunlop-act-2615
116914	House	2025-02-13	Auction 08/03/2025	2025-03-08	$1,235,000	4	2	2	2.5	896.0	Ray White Canberra	15-buggy-crescent-mckellar-act-2617
116916	DuplexSemi-detached	2025-02-13	$485,000	2025-03-26	Undisclosed	2	1	1		429.0	Flemings Property Services	118-white-street-young-nsw-2594
116921	House	2025-02-13	$869500	2025-03-13	$869,500	3	2	2	0.5		home.by holly	15-ashburner-street-higgins-act-2615
116922	House	2025-02-13	$710,000+	2025-03-14	Undisclosed	3	1	1	6.0	357.0	Luton Kippax	22-refshauge-crescent-macgregor-act-2615
116924	Townhouse	2025-02-13	Auction - Price Guide $695,000+	2025-03-07	Undisclosed	3	2	2	5.5		Luton Gungahlin	501-bon-scott-crescent-moncrieff-act-2914
116926	Apartment	2025-02-13	$510,000	2025-06-20	$510,000	1	1	1	6.0		home.by holly	31612-provan-street-campbell-act-2612
116927	DuplexSemi-detached	2025-02-13	Auction 08/03/2025	2025-03-08	$1,202,500	3	1	2	1.5	454.0	LJ Hooker Dickson	32-lowanna-street-braddon-act-2612
116929	Apartment	2025-02-13	$595,000	2025-03-14	$595,000	2	2	2	6.0		home.by holly	1505-1-corinna-street-phillip-act-2606
116930	House	2025-02-13	$1,200,000	2025-02-25	Undisclosed	4	3	2	5.0	450.0	Stone Gungahlin	149-bettong-avenue-throsby-act-2914
116931	House	2025-02-13	$535,000	2025-03-07	$535,000	3	2	2		706.0	Belle Property Snowy Mountains	2-awa-place-cooma-nsw-2630
116933	House	2025-02-13	$655,000	2025-08-18	$655,000	4	2	3		1012.0	Flemings Property Services	46-hurley-street-cootamundra-nsw-2590
116934	House	2025-02-13	Auction	2025-03-03	Undisclosed	4	2	3	2.0	765.0	Luton Weston Creek, Woden & Molonglo Valley	31-gamor-street-waramanga-act-2611
116935	House	2025-02-13	Auction 04/03/2025	2025-03-04	Undisclosed	4	2	2	6.0	768.0	Ray White Canberra	40-stieglitz-circuit-kambah-act-2902
116937	House	2025-02-13	Auction	2025-03-10	Undisclosed	4	2	1	3.0	665.0	LJ Hooker Woden/Weston	10-meldrum-street-weston-act-2611
116943	House	2025-02-13	$809,000	2025-04-03	$799,000	4	2	2		870.0	Macarthur Real Estate Agency	3-exford-loop-bourkelands-nsw-2650
116945	House	2025-02-13	$1,350,000	2025-03-19	$1,335,000	4	2	2		527.0	Smile Elite	51-eleanor-drive-glenfield-nsw-2167
116946	House	2025-02-13	$1,380,000	2025-04-02	$1,380,000	4	2	2	4.5	772.0	home.by holly	58-araba-street-aranda-act-2614
116949	House	2025-02-13	$950,000+	2025-03-07	$940,000	5	3	1	2.5	922.0	Ray White Canberra	5-tozer-place-kambah-act-2902
116950	House	2025-02-13	Auction	2025-03-15	Undisclosed	4	2	2	2.0		Luton Gungahlin	29-fellows-street-latham-act-2615
116951	Apartment	2025-02-13	$490,000+	2025-03-24	$500,000	2	2	2	6.0		McIntyre Property	122-serventy-street-wright-act-2611
116953	Townhouse	2025-02-13	$649,000+	2025-03-14	Undisclosed	3	2	1	5.5		LJ Hooker Gungahlin	76224-flemington-road-harrison-act-2914
116954	Land	2025-02-13	$738,000	2025-03-14	$720,000	0	0	0		693.9	Raine & Horne Mollymook Milton	36-vista-drive-dolphin-point-nsw-2539
116955	Townhouse	2025-02-13	Auction	2025-03-06	$575,000	2	2	1			Luton Tuggeranong	1-5-waterloo-street-queanbeyan-east-nsw-2620
116959	House	2025-02-13	$943,000	2025-05-19	Undisclosed	4	2	4		595.0	Harcourts Greater Port Macquarie & The Rocks	32-glenview-drive-wauchope-nsw-2446-116959
116961	Apartment	2025-02-13	Offers Above $469,000	2025-04-22	$450,000	1	1	1	6.0		Cream Residential	6l-17-the-causeway-kingston-act-2604-116961
116963	House	2025-02-13	$829,000+	2025-05-02	Undisclosed	3	2	2	4.5	455.0	Luton Kippax	67-carman-loop-macgregor-act-2615
116966	Townhouse	2025-02-13	Offers Over $995,000	2025-04-14	$985,000	3	2	2	6.0		LJ Hooker Dickson	2-8-mokoan-place-duffy-act-2611
116967	Unit	2025-02-13	$350,000 - $370,000	2025-03-20	$365,000	2	1	1			Ray White Queanbeyan | Jerrabomberra	825-macquoid-street-queanbeyan-east-nsw-2620
116974	House	2025-02-13	AUCTION 05/03/2025	2025-03-05	$1,160,000	4	2	3	3.0	941.0	Ray White Canberra	2-wray-place-gowrie-act-2904
116977	House	2025-02-13	$775,000 +	2025-04-24	Undisclosed	3	1	2	4.0	1125.0	LJ Hooker Woden/Weston	15-forrest-place-kambah-act-2902
116979	Unit	2025-02-13	$655,000	2025-03-18	$655,000	2	2	1	5.0		home.by holly	2417-david-street-oconnor-act-2602
116983	House	2025-02-13	$865,000 - $885,000	2025-03-13	$885,000	4	3	4		692.0	Ray White Bungendore	74-butmaroo-street-bungendore-nsw-2621
116985	House	2025-02-13	$609,000	2025-02-27	$600,000	4	2	2		700.6	Macarthur Real Estate Agency	5-melaleuca-drive-forest-hill-nsw-2651
116986	Apartment	2025-02-13	$837,500	2025-03-14	$837,500	3	2	1	4.5		home.by holly	451-allambee-street-reid-act-2612
116988	House	2025-02-13	Auction	2025-03-03	Undisclosed	3	2	2	6.0	249.0	Luton Tuggeranong	76-peter-cullen-way-wright-act-2611
116989	Land	2025-02-13	$265,000	2025-06-26	$265,000	0	0	0		684.0	Kitson Property	6-burt-street-gobbagombalin-nsw-2650
116993	House	2025-02-13	Auction	2025-03-15	Undisclosed	4	3	2	3.5	1204.0	LJ Hooker Kaleen	25-eleanora-street-fisher-act-2611
116994	Townhouse	2025-02-13	Auction	2025-03-12	$600,000	2	2	2	6.0		LJ Hooker Kaleen	22-narrambla-terrace-lawson-act-2617
116995	House	2025-02-13	$590,000+	2025-03-20	$600,000	3	1	1	2.0	271.0	LJ Hooker Tuggeranong	121-cleeve-place-gordon-act-2906
116997	House	2025-02-13	$674,000	2025-06-18	$660,000	3	1	3		1211.0	Marshall and Tacheci Real Estate	17-tarlinton-street-cobargo-nsw-2550
116998	House	2025-02-13	$1,579,000 +	2025-05-01	Undisclosed	5	2	4	3.0	874.0	LJ Hooker Woden/Weston	37-tullaroop-street-duffy-act-2611
117000	Townhouse	2025-02-13	$739,000+	2025-04-02	$730,000	4	1	1	1.5		Ray White Canberra	3158-maribyrnong-avenue-kaleen-act-2617
117001	House	2025-02-13	AUCTION 04/03/2025	2025-03-04	$1,307,000	4	2	2	4.0	803.0	Ray White Canberra	59-mcclelland-avenue-nicholls-act-2913
117004	House	2025-02-13	$989,000+	2025-03-19	$1,000,000	4	2	3	5.0	800.0	LJ Hooker Tuggeranong	33-bottrill-street-bonython-act-2905
117008	Unit	2025-02-13	Forthcoming Auction	2025-02-27	Undisclosed	1	1	1	6.0		Luton Gungahlin	2623-state-circle-forrest-act-2603
117014	House	2025-02-14	Auction	2025-03-05	Undisclosed	3	2	2	2.0	585.0	Luton Weston Creek, Woden & Molonglo Valley	54b-hyndes-crescent-holder-act-2611
117015	House	2025-02-14	Auction	2025-03-04	Undisclosed	3	2	1	2.0	721.0	Luton Weston Creek, Woden & Molonglo Valley	24-percival-street-holder-act-2611
117017	Lifestyle	2025-02-14	$1,690,000	2025-10-03	$1,600,000	3	2	8		40.69	Kate Murphy Property	201-pine-bank-drive-lower-boro-nsw-2580
117018	Lifestyle	2025-02-14	$1,195,000	2025-04-10	Undisclosed	3	1	5		40.39	Kate Murphy Property	866-willow-glen-rd-lower-boro-nsw-2580-117018
117023	Unit	2025-02-14	Offers Over $439,000	2025-06-16	Undisclosed	2	1	1	6.0		Carter and Co Agents	11082-gribble-street-gungahlin-act-2912
117031	House	2025-02-14	$790,000 - $830,000	2025-03-06	$815,000	3	2	2			My Agent Team	219-bavarde-avenue-batemans-bay-nsw-2536
117033	House	2025-02-14	$350,000	2025-03-21	$345,000	3	1	1		815.7	Kitson Property	5-smithies-place-ashmont-nsw-2650
117034	Townhouse	2025-02-14	SOLD	2025-06-04	Undisclosed	1	1	1	5.0		Cream Residential	42-otway-street-harrison-act-2914
117038	House	2025-02-14	$599,000	2025-05-09	$580,000	3	2	3		1012.0	Ray White Wagga Wagga	118-methul-street-coolamon-nsw-2701
117044	House	2025-02-14	$525,000	2025-03-07	$500,000	3	1	4		866.3	Kitson Property	2-elizabeth-avenue-forest-hill-nsw-2651
117055	House	2025-02-14	AUCTION 08/03/2025	2025-03-08	Undisclosed	5	2	3	4.0	969.0	Ray White Canberra	9-coppin-place-weetangera-act-2614
117056	House	2025-02-14	$775,000	2025-05-06	$765,000	3	2	1			Raine & Horne Berry	2-nattai-crescent-albion-park-nsw-2527
117060	House	2025-02-14	$900,000 - $950,000	2025-05-28	Undisclosed	4	2	2		616.0	LJ Hooker Woden/Weston	7-james-place-yass-nsw-2582
117069	House	2025-02-14	$750,000	2025-05-14	$750,000	2	1	1	1.0	269.0	LJ Hooker Kaleen	20b-quandong-street-oconnor-act-2602
117070	Apartment	2025-02-14	$379,500	2025-04-02	$375,000	1	1	1	6.0		LJ Hooker Kaleen	56-566-cotter-road-wright-act-2611
117075	House	2025-02-14	Forthcoming Auction	2025-02-14	$1,840,000	6	3	4	3.5	549.0	Confidence Real Estate	1-janine-haines-terrace-coombs-act-2611
117079	House	2025-02-14	$1,350,000	2025-09-09	$1,300,000	4	2	4		10490.0	Kitson Property	10-bell-gum-place-lake-albert-nsw-2650
117081	House	2025-02-14	$825,000 - $880,000	2025-04-04	$825,000	4	2	2		2303.0	Smile Elite	7-ivon-court-uralla-nsw-2358
117082	House	2025-02-14	Contact agent	2025-02-14	$670,000	3	2	1			Ray White Goulburn	9-74-cowper-street-goulburn-nsw-2580
117083	House	2025-02-14	contact agent	2025-02-14	$670,000	3	2	1			Ray White Goulburn	11-74-cowper-street-goulburn-nsw-2580
117091	House	2025-02-16	$969,000	2025-03-25	$942,000	4	2	5		770.0	One Agency Wagga Wagga	47-barmedman-avenue-gobbagombalin-nsw-2650-117091
117094	House	2025-02-17	$889,000	2025-08-07	$875,000	4	2	3		1168.0	My Agent Team	1-south-head-road-moruya-nsw-2537
117096	House	2025-02-17	$1,095,000	2025-05-07	$1,080,000	4	2	4		3.36	My Agent Team	14-sanctuary-forest-place-long-beach-nsw-2536
117097	House	2025-02-17	$625,000	2025-06-18	$595,000	4	2	2		721.5	Macarthur Real Estate Agency	23-huron-crescent-lake-albert-nsw-2650
117105	House	2025-02-17	$ 909,000	2025-06-18	$895,000	4	2	2			John Connell Real Estate	7-evangelista-street-goulburn-nsw-2580
117120	House	2025-02-17	Auction	2025-03-19	Undisclosed	4	1	0		2410.0	Flemings Property Services	26-marsden-street-boorowa-nsw-2586
117128	House	2025-02-17	$495,000	2025-03-21	$497,000	3	1	2		815.0	Fitzpatricks	50-alexander-street-ashmont-nsw-2650
117142	House	2025-02-17	SOLD OFF MARKET	2025-02-17	$675,000	4	2	2		775.9	Macarthur Real Estate Agency	72-mima-street-glenfield-park-nsw-2650
117144	House	2025-01-24	By Negotiation	2025-07-17	$2,000,000	4	2	3		110.8	Ray White Canberra	4922-gundaroo-road-bellmount-forest-nsw-2581
117145	House	2025-02-17	Price Guide $850,000 - $880,000	2025-03-04	Undisclosed	4	2	2		306.0	Raine & Horne Berry	122a-crest-road-albion-park-nsw-2527
117146	House	2025-02-17	$655,000	2025-02-27	$655,000	3	1	2		887.0	John Connell Real Estate	11-yarrowlow-st-goulburn-nsw-2580-117146
117149	House	2025-02-17	$739,000	2025-04-10	$730,000	4	2	2		756.0	Smile Elite	16-james-sheahan-drive-orange-nsw-2800
117152	House	2025-02-17	New Price $750,000-$780,000	2025-05-23	$760,000	4	3	2			Smile Elite	52-northcott-drive-goonellabah-nsw-2480
117156	House	2025-02-17	Buyers Guide $1,000,000 - $1,100,000	2025-04-14	$990,000	4	2	3		3390.0	Smile Elite	345-yetholme-drive-yetholme-nsw-2795
117158	House	2025-02-18	Auction	2025-02-24	Undisclosed	4	3	4	5.0	1031.0	Luton Weston Creek, Woden & Molonglo Valley	7-peake-place-curtin-act-2605
117161	House	2025-02-18	Auction Unless Sold Prior!	2025-03-14	$700,000	3	1	0		690.0	Ray White Goulburn	13-victoria-parade-goulburn-nsw-2580
117169	Other	2025-02-18	$499,000	2025-10-30	$465,000	2	1	1		41.87	Belle Property Snowy Mountains	2100-shannons-flat-road-cooma-nsw-2630-117169
117170	House	2025-02-18	$930,000+	2025-05-14	$910,000	4	2	2	2.5	729.0	Southern Property Canberra	35-crawford-crescent-flynn-act-2615
117177	House	2025-02-18	$799,000	2025-04-04	$750,000	4	2	3		701.8	Kitson Property	3-beetson-street-boorooma-nsw-2650
