id	type	ListingDate	PriceLabel	SoldDate	SoldPrice	Beds	Baths	Cars	EER	PlotSize	Agency.Name	Slug
124068	House	2025-07-01	$295,000	2025-08-04	Undisclosed	2	1	1		106.0	Ray White Wagga Wagga	315-edney-street-kooringal-nsw-2650
124072	Land	2025-07-01	$600,000 - $620,000	2025-09-19	$605,000	0	0	0		612.0	Smile Elite	24-bristlebird-drive-calderwood-nsw-2527
124076	House	2025-07-01	SOLD OFF MARKET	2025-07-01	$690,000	3	2	1		947.0	My Agent Team	66-fauna-avenue-long-beach-nsw-2536
124093	Land	2025-07-01	$558,870	2025-10-24	$558,870	0	0	0	0.0	504.0	Ginninderry	42-bornemissza-crescent-macnamara-act-2615-124093
124095	Land	2025-07-01	$560,000	2025-09-05	$560,000	0	0	0	0.0	529.0	Ginninderry	47-bornemissza-crescent-macnamara-act-2615-124095
124096	House	2025-07-01	$1,500,000	2025-08-21	Undisclosed	3	2	2		563.0	Venture Property Specialists	30-haddrill-parade-dalmeny-nsw-2546
124097	House	2025-07-01	Offers Over $800,000	2025-08-22	$840,000	3	2	0	3.0	755.0	Sadil Quinlan	4b-badimara-street-waramanga-act-2611
124114	Apartment	2025-07-01	$330,000 - $360,000	2025-10-28	Undisclosed	1	1	1	6.00		McIntyre Property	1031-braybrooke-street-bruce-act-2617
124116	Unit	2025-07-01	AUCTION GUIDE $350,000	2025-08-08	$365,000	2	1	1			Ray White Goulburn	1233-ottiwell-street-goulburn-nsw-2580
124120	House	2025-07-01	Auction 19/07/2025	2025-07-19	$1,110,000	4	2	3	2.5	1035.0	Ray White Canberra	12-pickles-street-scullin-act-2614
124130	Unit	2025-07-02	Auction	2025-07-17	$565,000	3	2	2	4.5		LJ Hooker Belconnen	60b-9-chandler-street-belconnen-act-2617-124130
124138	Apartment	2025-07-02	$449,000+	2025-09-24	$450,000	1	1	1	5.5		LJ Hooker Woden/Weston	3316-doonkuna-street-braddon-act-2612
124140	House	2025-07-02	Price By Negotiation	2025-08-12	Undisclosed	3	2	1		662.0	Raine & Horne Mollymook Milton	43-camden-street-ulladulla-nsw-2539
124149	House	2025-07-02	$859,000	2025-07-29	Undisclosed	3	2	2	5.5	420.0	LJ Hooker Gungahlin	11-dyindan-street-ngunnawal-act-2913
124159	House	2025-07-02	$1,850,000	2025-07-15	Undisclosed	5	2	10		14.99	Agent Team	133-macdiarmid-road-burra-nsw-2620
124161	Apartment	2025-07-02	$650,000	2025-08-28	$650,000	2	2	2	4.0		home.by holly	311-wise-street-braddon-act-2612
124165	Unit	2025-07-02	By Negotiation	2025-08-04	Undisclosed	3	2	2	5.5	3749.0	LJ Hooker Gungahlin	215-bill-ferguson-circuit-bonner-act-2914
124167	House	2025-07-02	By Negotiation	2025-07-31	Undisclosed	3	2	1	3.0	353.0	LJ Hooker Gungahlin	9-honyong-crescent-ngunnawal-act-2913
124172	Land	2025-07-02	$499,000	2025-09-13	Undisclosed	2	1	9		3320.0	Flemings Property Services	101-103-farm-street-boorowa-nsw-2586-124172
124177	Unit	2025-07-02	$430,000	2025-08-14	$420,000	2	1	1		127.0	Smile Elite	1145-147-rocket-street-bathurst-nsw-2795
124204	House	2025-07-02	$749,000	2025-10-03	$715,000	3	1	1			LJ Hooker Malua Bay	8-belbowrie-parade-maloneys-beach-nsw-2536
124206	House	2025-07-02	$475,000 - $515,000	2025-08-25	$525,100	3	1	1		803.0	Fitzpatricks	30-higgins-avenue-wagga-wagga-nsw-2650
124213	Apartment	2025-07-03	$575,000+	2025-08-22	Undisclosed	2	2	1	6.0		Luton Weston Creek, Woden & Molonglo Valley	51016-moore-street-city-act-2601
124214	Townhouse	2025-07-03	$729,000	2025-09-09	Undisclosed	3	2	2	4.0	277.0	Luton Weston Creek, Woden & Molonglo Valley	616-fairlight-street-dunlop-act-2615
124216	House	2025-07-03	Auction	2025-08-02	Undisclosed	2	1	1	2.5	214.0	Luton Manuka	21-cosgrove-street-curtin-act-2605
124219	House	2025-07-03	$1,120,000+	2025-09-17	Undisclosed	4	2	2	4.5	450.0	Ray White Canberra	73-oodgeroo-avenue-franklin-act-2913
124221	House	2025-07-03	$1,150,000	2025-08-29	$1,150,000	4	2	2	4.5	774.0	home.by holly	61-dobbin-circuit-nicholls-act-2913
124222	Townhouse	2025-07-03	$755,000	2025-08-11	$755,000	3	1	1	4.5	313.0	home.by holly	434-antill-street-watson-act-2602
124232	House	2025-07-03	Guide $550,000	2025-07-17	$550,000	2	1	1		680.0	Ray White Goulburn	54-sloane-street-goulburn-nsw-2580
124235	House	2025-07-03	Sale by Negotiation	2025-08-03	$630,000	2	1	1	2.0	399.0	LJ Hooker Kippax	1-crockett-place-holt-act-2615
124236	Apartment	2025-07-03	$399,000+	2025-09-05	$393,000	2	1	1	6.0		Stone Gungahlin	34-70-efkarpidis-street-gungahlin-act-2912
124242	Apartment	2025-07-03	$599,000+	2025-08-01	$597,500	3	2	2	5.5		LJ Hooker Dickson	81-eardley-street-bruce-act-2617-124242
124247	House	2025-07-03	$610,000+	2025-08-04	Undisclosed	2	1	1	1.5	430.0	Luton Kippax	11-moorehead-place-latham-act-2615
124253	House	2025-07-03	$745,000 +	2025-08-04	$760,000	3	1	1	1.5	490.0	Cream Residential	15-morrison-street-kambah-act-2902
124256	House	2025-07-03	$1,400,000	2025-07-28	$1,400,000	4	2	3	3.0		home.by holly	6-peden-place-watson-act-2602
124258	House	2025-07-03	UNDER CONTRACT	2025-10-02	$1,050,000	4	2	4		788.0	Smile Elite	1-native-way-moruya-heads-nsw-2537-124258
124259	Unit	2025-07-03	$610,000	2025-08-06	$610,000	3	2	2	6.0		home.by holly	2831-thynne-street-bruce-act-2617
124265	Unit	2025-07-03	NEW PRICE RANGE $680,000 - $699,000	2025-10-29	$680,000	2	2	1		1522.0	Dwyer Properties Sapphire Coast	420-surf-circle-tura-beach-nsw-2548
124275	House	2025-07-03	Auction	2025-07-30	Undisclosed	4	2	2	1.0	904.0	LJ Hooker Kippax	278-southern-cross-drive-macgregor-act-2615
124278	Apartment	2025-07-03	$580,000	2025-08-06	$580,000	2	2	1	4.5		home.by holly	1660-henty-street-braddon-act-2612
124283	House	2025-07-03	Auction 26/07/2025	2025-07-18	$740,000	3	1	2	1.0	631.0	Ray White Canberra	37-trumper-street-holt-act-2615
124294	House	2025-07-03	$949,000+	2025-10-24	Undisclosed	4	2	2	6.0	452.0	LJ Hooker Canberra City	24-roy-marika-street-bonner-act-2914
124295	Townhouse	2025-07-03	$565,000+	2025-08-22	$601,000	2	2	2	6.0		LJ Hooker Canberra City	62-whitrod-avenue-casey-act-2913
124309	Unit	2025-07-04	Auction 30/07/2025	2025-07-30	$448,000	2	1	1	6.0	28020.0	Ray White Canberra	2125-pinkerton-circuit-kambah-act-2902
124315	House	2025-07-04	$395,000-$415,000	2025-08-07	Undisclosed	2	1	1		582.0	Belle Property Snowy Mountains	12-buchan-parade-cooma-nsw-2630
124321	Land	2025-07-04	Under Offer	2025-09-10	Undisclosed	0	0	0		706.5	Marble & Oak Property	lot-6-6-horseshoe-lane-moss-vale-nsw-2577-124321
124333	Apartment	2025-07-04	$649,000 - $699,000	2025-09-04	$665,000	3	2	2	5.0		McIntyre Property	1458-eileen-good-street-greenway-act-2900
124334	House	2025-07-04	Price Guide $675,000 to $725,000	2025-10-10	Undisclosed	3	1	1		3.98	Harcourts Greater Port Macquarie & The Rocks	115-jericho-road-moorland-nsw-2443
124335	House	2025-07-04	$660,000+	2025-08-11	$645,000	2	2	1	2.0	306.0	Ray White Canberra	152-murranji-street-hawker-act-2614
124336	House	2025-07-04	Price by Negotiation	2025-10-24	$1,335,000	5	2	1		779.0	Raine & Horne Mollymook Milton	49-linden-way-mollymook-beach-nsw-2539
124342	Unit	2025-07-04	$510,000+	2025-07-31	$523,000	3	2	2	4.0	1.05	Ray White Canberra	29112-baldwin-drive-kaleen-act-2617
124356	Unit	2025-07-04	$419,000	2025-07-28	$419,000	2	1	1		164.0	Fitzpatricks	49-docker-street-wagga-wagga-nsw-2650
124379	House	2025-07-07	$599,500	2025-08-03	$575,000	3	1	2		1012.0	Fitzpatricks	351-lake-albert-road-kooringal-nsw-2650
124380	House	2025-07-07	$650,000	2025-10-30	$652,000	3	2	1		461.5	Fitzpatricks	9-osprey-place-estella-nsw-2650
124381	House	2025-07-07	$775,000	2025-08-20	$775,000	2	2	2		648.0	Bella Coastal Property	3-torquay-drive-lake-tabourie-nsw-2539
124392	House	2025-07-07	$599,000	2025-07-30	$600,500	3	1	2		764.4	PRD Wagga Wagga	24-grevillea-crescent-lake-albert-nsw-2650
124396	House	2025-07-07	$419,000	2025-08-28	$419,000	3	1	1		643.0	Belle Property Snowy Mountains	1-namala-street-cooma-nsw-2630
124397	Apartment	2025-07-07	By Negotiation	2025-09-09	Undisclosed	2	1	1	6.0		Impact Properties	217-90-swain-street-gungahlin-act-2912
124406	House	2025-07-07	Auction - Unless Sold Prior	2025-08-06	$887,500	4	2	2		638.0	Ray White Goulburn	22-huxtable-place-goulburn-nsw-2580-124406
124409	House	2025-07-07	$815,000	2025-09-08	$815,000	4	2	1		556.0	Blackshaw Real Estate Coastal	5-palm-place-surfside-nsw-2536
124412	House	2025-07-07	$749,000	2025-09-01	$735,000	4	3	4		800.4	Kitson Property	10-mccoullough-drive-tolland-nsw-2650
124424	House	2025-07-08	Expressions Of Interest	2025-08-01	$810,000	3	1	4		696.0	Ray White Bowral	13-melbourne-street-new-berrima-nsw-2577
124426	Townhouse	2025-07-08	$2,250,000	2025-10-03	Undisclosed	2	2	2			Belle Property Snowy Mountains	7d-diggings-terrace-thredbo-nsw-2625
124432	House	2025-07-08	$650,000 - $695,000	2025-09-02	$656,000	4	1	1		778.0	LJ Hooker Malua Bay	12-runnyford-road-nelligen-nsw-2536
124433	Apartment	2025-07-08	Offers: $310,000+	2025-09-15	$315,000	1	1	1	2.0	8531.0	Ray White Canberra	376-wilkins-street-mawson-act-2607
124436	House	2025-07-08	$55,000	2025-10-24	$45,000	1	1	1			LJ Hooker Malua Bay	17-51-beach-road-batehaven-nsw-2536-124436
124447	Townhouse	2025-07-08	Auction	2025-08-13	$742,000	2	1	2	2.0	4379.0	LJ Hooker Kaleen	25-9-11-mcclintock-street-lyneham-act-2602-124447
124450	House	2025-07-08	$1,275,000	2025-09-10	Undisclosed	3	2	3		13900.0	McGrath Merimbula	17-buckett-lane-millingandi-nsw-2549
124452	AcreageSemi-rural	2025-07-08	$1,225,000	2025-07-18	$1,225,000	3	2	2		97124.6	McGrath Merimbula	294-old-mill-road-wolumla-nsw-2550
124453	Unit	2025-07-08	$599,000	2025-10-24	Undisclosed	2	1	1			McGrath Merimbula	144-munn-street-merimbula-nsw-2548
124456	Apartment	2025-07-08	$465,000	2025-07-18	$455,000	2	1	1			McGrath Merimbula	1057-59-ocean-drive-merimbula-nsw-2548-124456
124458	Unit	2025-07-08	$420,000	2025-09-11	$400,000	2	1	1			McGrath Merimbula	165-67-merimbula-drive-merimbula-nsw-2548
124460	House	2025-07-08	Contact Agent	2025-08-06	Undisclosed	4	2	2			McGrath Merimbula	106-old-tathra-road-merimbula-nsw-2548-124460
124474	Townhouse	2025-07-08	$1,140,000	2025-10-20	Undisclosed	3	2	2		268.0	PRD Wagga Wagga	6-114-trail-street-wagga-wagga-nsw-2650
124483	Land	2025-07-08	$569,000	2025-08-25	$550,000	0	0	4		47.0	Flemings Property Services	101-kabardin-lane-young-nsw-2594
124484	House	2025-07-08	$850,000	2025-08-14	$840,000	3	2	2			McGrath Merimbula	7a-surf-circle-tura-beach-nsw-2548
124485	House	2025-07-08	$515,000	2025-08-06	$530,000	3	1	1		639.0	Kitson Property	70-elizabeth-avenue-forest-hill-nsw-2651
124495	Unit	2025-07-09	$425,000	2025-09-12	$421,500	2	1	1	2.5		LJ Hooker Belconnen	1910-wilkins-street-mawson-act-2607
124496	Lifestyle	2025-07-09	AUCTION GUIDE $750,000	2025-08-08	$850,000	3	2	10		32.0	Ray White Goulburn	1113-cuddyong-road-limerick-nsw-2583-124496
124500	DuplexSemi-detached	2025-07-09	$612,500	2025-07-28	$610,000	4	2	1			Raine & Horne Goulburn	1-31-matchless-avenue-goulburn-nsw-2580
124501	House	2025-07-09	Auction	2025-07-16	Undisclosed	3	2	2	0.5	767.0	LJ Hooker Belconnen	36-gundara-street-aranda-act-2614
124514	Apartment	2025-07-09	$615,000	2025-09-03	Undisclosed	2	1	1	6.0		Berkely Residential	227-50-eastlake-parade-kingston-act-2604
124515	House	2025-07-09	Auction - Sold $1,700,000	2025-08-04	$1,700,000	4	4	2	4.5	562.0	Altair Property	18-laurel-martyn-view-whitlam-act-2611
124517	Apartment	2025-07-09	$470,000+	2025-08-20	Undisclosed	1	1	1	3.5	491.0	LJ Hooker Gungahlin	10-putt-lane-harrison-act-2914
124518	House	2025-07-09	$1,915,000	2025-07-29	$1,915,000	5	2	2	2.0	824.0	home.by holly	81-morgan-crescent-curtin-act-2605
124521	House	2025-07-09	Sold prior to auction-$1,425,000	2025-07-29	$1,425,000	5	3	2	3.0	718.0	Stone Gungahlin	10-lexcen-avenue-nicholls-act-2913
124523	House	2025-07-09	Another SOLD by Irving Gunawan	2025-08-08	$1,400,000	3	2	2		363.0	Smile Elite	14-latan-way-stanhope-gardens-nsw-2768
124527	Townhouse	2025-07-09	$655,000	2025-08-02	$655,000	2	1	1	2.5		home.by holly	37-connelly-place-belconnen-act-2617
124528	DuplexSemi-detached	2025-07-09	$725,000 - $735,000	2025-08-26	$715,000	4	2	1		294.0	Ray White Batemans Bay	2-33-freycinet-drive-sunshine-bay-nsw-2536
124529	House	2025-07-09	$920,000+	2025-07-29	$925,000	4	2	4	2.0	788.0	LJ Hooker Tuggeranong	43-collyburl-crescent-isabella-plains-act-2905
124530	House	2025-07-09	$520,000 - $550,000	2025-08-29	$530,000	3	1	4		670.0	Smile Elite	2-skellatar-street-muswellbrook-nsw-2333
124532	House	2025-07-09	$829,000 -$849,000	2025-09-19	Undisclosed	4	2	2		786.7	Yass First National	84-church-street-yass-nsw-2582
124539	House	2025-07-09	$850,000+	2025-08-14	$882,000	3	2	2	2.5	858.0	McIntyre Property	22-loureiro-street-conder-act-2906
124552	Apartment	2025-07-09	$405,000+	2025-08-04	$420,000	2	1	1	5.0		LJ Hooker Gungahlin	42-playfair-place-belconnen-act-2617
124564	House	2025-07-09	$849,000	2025-08-29	$820,000	3	1	3		864.8	Ray White Batemans Bay	23-hawdon-street-moruya-nsw-2537
124566	House	2025-07-10	Auction	2025-08-02	Undisclosed	4	2	2	3.0		Luton Weston Creek, Woden & Molonglo Valley	66-david-street-turner-act-2612
124568	House	2025-07-10	$740,000	2025-08-19	$730,000	3	2	1		718.0	McGoldrick Estate Agents	21-ferntree-drive-bomaderry-nsw-2541
124569	House	2025-07-10	By Negotiation	2025-08-14	$780,000	3	2	2	4.0	397.0	LJ Hooker Gungahlin	4-yirawala-street-ngunnawal-act-2913
124571	House	2025-07-10	Auction 02/08/2025	2025-08-02	Undisclosed	3	2	1	6.0	405.0	Ray White Canberra	4-herring-place-macgregor-act-2615
124574	Unit	2025-07-10	$390,000+	2025-09-24	$392,000	1	1	1	4.5		LJ Hooker Gungahlin	447-abena-avenue-crace-act-2911
124575	Townhouse	2025-07-10	$660,000+	2025-08-15	$660,000	3	2	1	6.0		McIntyre Property	101-161-mortimer-lewis-drive-greenway-act-2900
124579	Apartment	2025-07-10	Offers Over $440,000	2025-08-14	$447,000	1	1	1	3.0		LJ Hooker Dickson	112-challis-street-dickson-act-2602
124580	Townhouse	2025-07-10	$805,000	2025-08-18	$805,000	3	1	2	0.0		home.by holly	78-watling-place-weston-act-2611
124586	Apartment	2025-07-10	$399,000+	2025-10-07	$410,000	1	1	1	6.0	9728.0	LJ Hooker Tuggeranong	125311-anketell-street-greenway-act-2900
124588	House	2025-07-10	Auction	2025-08-02	Undisclosed	4	2	3	0.5	983.0	Luton Kippax	64-ashburner-street-higgins-act-2615
124589	House	2025-07-10	Another SOLD at AUCTION by Irving Gunawan	2025-08-03	$3,620,000	3	2	2		461.6	Smile Elite	255-sailors-bay-road-northbridge-nsw-2063
124591	House	2025-07-10	$1,499,000+	2025-08-22	Undisclosed	5	2	2	2.0	959.0	Ray White Canberra	22-maddison-close-bruce-act-2617
124592	House	2025-07-10	$1,095,000	2025-08-21	$1,095,000	4	2	2	6.0	486.0	MARQ Property	12-scholtens-street-casey-act-2913
124594	House	2025-07-10	Auction	2025-07-17	Undisclosed	3	1	1	6.0		Luton Gungahlin	31-carmody-street-casey-act-2913
124596	House	2025-07-10	$499,000	2025-08-04	$506,000	3	1	2		746.1	PRD Wagga Wagga	34-temerloh-avenue-tolland-nsw-2650
124601	House	2025-07-10	Auction 02/08/2025	2025-08-02	Undisclosed	4	1	2	1.5	911.0	Ray White Canberra	185-starke-street-holt-act-2615
124604	House	2025-07-10	Auction 07/08/2025	2025-08-07	$790,000	3	1	1	0.5	711.0	Ray White Canberra	42-holyman-street-scullin-act-2614
124606	Apartment	2025-07-10	$419,000+	2025-09-11	Undisclosed	2	1	1	6.0		LJ Hooker Gungahlin	9351-catalano-street-wright-act-2611
124608	Other	2025-07-10	$749,000	2025-09-03	Undisclosed	0	0	0		27.92	McGrath Batemans Bay & Moruya	lot-13-runnyford-road-runnyford-nsw-2536-124608
124613	House	2025-07-10	Auction 02/08/2025	2025-08-02	$1,348,000	4	3	2	6.0	533.0	Ray White Canberra	14-chilton-street-casey-act-2913
124615	Unit	2025-07-10	$599,000+	2025-09-05	Undisclosed	3	1	1	3.0		Luton Tuggeranong	3875-box-hill-avenue-conder-act-2906
124616	House	2025-07-10	Auction	2025-08-02	Undisclosed	3	2	2	3.0	1160.0	Luton Tuggeranong	13-gosman-close-oxley-act-2903
124617	House	2025-07-10	Auction	2025-07-30	Undisclosed	3	1	2	1.0	577.0	Luton Kippax	30-geeves-court-charnwood-act-2615
124622	House	2025-07-10	$990,000	2025-08-01	$990,000	4	2	1	2.0		home.by holly	17-strehlow-place-flynn-act-2615
124625	House	2025-07-10	$975,000+	2025-08-29	Undisclosed	4	2	2	1.0		LJ Hooker Canberra City	10-dickinson-street-watson-act-2602
124628	House	2025-07-10	$605,000	2025-07-31	$605,000	3	1	1		601.0	Ray White Batemans Bay	54-riverview-crescent-catalina-nsw-2536
124633	House	2025-07-10	$951,120	2025-08-15	$951,120	3	1	1	3.5		home.by holly	5-madigan-street-hackett-act-2602
124640	House	2025-07-10	$579,000	2025-08-15	$600,000	3	1	2		729.1	Macarthur Real Estate Agency	3-magnolia-parade-lake-albert-nsw-2650
124645	House	2025-07-10	Auction	2025-07-16	Undisclosed	3	1	1	1.5	1139.0	LJ Hooker Kippax	12-holland-street-macgregor-act-2615
124646	House	2025-07-10	Auction	2025-08-02	$1,150,000	4	2	2	1.5	780.0	LJ Hooker Woden/Weston	43-leist-street-weston-act-2611
124648	House	2025-07-10	Contact Agent	2025-08-14	Undisclosed	3	2	2		462.0	Smile Elite	25-tucana-place-forster-nsw-2428
124650	DuplexSemi-detached	2025-07-10	By Negotiation	2025-09-12	Undisclosed	4	4	2	6.0	351.0	Impact Properties	55-grenfell-avenue-taylor-act-2913
124652	House	2025-07-10	$669,000.00	2025-08-27	Undisclosed	2	1	6		1086.0	Yass First National	5-mount-street-yass-nsw-2582
124658	Apartment	2025-07-11	$579,000+	2025-07-28	$585,000	2	2	2	6.0		LJ Hooker Canberra City	205-76-steve-irwin-avenue-wright-act-2611-124658
124664	Apartment	2025-07-11	$335,000+	2025-10-30	$340,000	1	1	1	6.0		Ray White Canberra	6126-thynne-street-bruce-act-2617
124672	Apartment	2025-07-11	$519,000	2025-10-30	$519,000	2	2	2	6.00		Luton Manuka	302-335-anketell-street-greenway-act-2900
124673	House	2025-07-11	$780,000+	2025-08-06	$835,000	3	2	1	0.5	848.0	LJ Hooker Tuggeranong	18-aronson-crescent-gilmore-act-2905
124674	House	2025-07-11	$1,550,000 - $1,650,000	2025-09-25	$1,620,000	4	3	8		9036.0	My Agent Team	33-clyde-road-north-batemans-bay-nsw-2536
124679	House	2025-07-11	$779,000	2025-09-12	Undisclosed	3	1	4		603.0	Harcourts Greater Port Macquarie & The Rocks	7-everglades-place-south-west-rocks-nsw-2431
124685	House	2025-07-11	$645,000	2025-09-12	$658,000	3	2	1		881.0	Macarthur Real Estate Agency	12-cooba-place-estella-nsw-2650
124688	Apartment	2025-07-11	$299,000 - $319,000	2025-08-11	$310,000	2	1	1		89.0	Ray White Wagga Wagga	410-bulolo-street-ashmont-nsw-2650
124689	Land	2025-07-11	$525,000	2025-09-03	$525,000	0	0	0	0.0	442.0	Ginninderry	2-sherrard-crescent-macnamara-act-2615-124689
124693	House	2025-07-11	Contact agent	2025-09-17	Undisclosed	3	2	4		998.0	Marble & Oak Property	19-mccleery-avenue-moss-vale-nsw-2577
124708	Unit	2025-07-11	$449,000+	2025-10-13	$440,000	2	1	1	6.0		LJ Hooker Kippax	112-buik-place-belconnen-act-2617
124718	Lifestyle	2025-07-14	Auction	2025-08-15	$1,257,000	5	3	3		16.99	John Connell Real Estate	31-anderson-rd-crookwell-nsw-2583-124718
124736	House	2025-07-14	$940,000	2025-09-10	$940,000	6	3	2		700.0	Ray White Goulburn	18-bonneville-boulevard-goulburn-nsw-2580
124742	House	2025-07-14	$770,000 to $810,000	2025-07-14	$795,000	3	1	1		730.0	Marble & Oak Property	32-cherry-tree-close-moss-vale-nsw-2577
124745	House	2025-07-14	$750,000	2025-09-17	$750,000	5	2	2		856.5	Macarthur Real Estate Agency	55-horsley-street-kooringal-nsw-2650
124753	House	2025-07-14	AUCTION GUIDE $580,000	2025-08-08	$659,000	3	1	1		1328.0	Ray White Goulburn	33-prince-street-goulburn-nsw-2580
124764	Unit	2025-07-15	$349,000+	2025-09-24	Undisclosed	2	1	1	3.5		LJ Hooker Canberra City	9131-rivett-street-hackett-act-2602
124773	House	2025-07-15	Auction 06/08/2025	2025-08-06	Undisclosed	5	2	2	4.0	971.0	Ray White Canberra	11-st-clair-place-lyons-act-2606
124784	House	2025-07-15	$840,000 - $880,000	2025-08-11	$860,000	4	3	2		711.0	My Agent Team	17a-burrawang-crescent-sunshine-bay-nsw-2536
124786	House	2025-07-15	Auction	2025-08-13	$1,427,000	3	1	2	0.0		LJ Hooker Canberra City	81-sherbrooke-street-ainslie-act-2602
124794	House	2025-07-15	$750,000	2025-08-29	$775,000	2	1	1		862.6	Raine & Horne Mollymook Milton	111-st-vincent-street-ulladulla-nsw-2539
124795	House	2025-07-15	$460,000	2025-09-22	$435,000	3	1	1		794.0	One Agency Craig Schofield	4-miloo-street-cooma-nsw-2630
124799	House	2025-07-15	$649,000	2025-10-07	Undisclosed	4	2	2		1220.0	Flemings Property Services	15-normoyle-crescent-young-nsw-2594
124800	House	2025-07-15	Auction	2025-08-19	$750,000	4	3	2		569.0	Ray White Batemans Bay	10b-bavarde-avenue-batemans-bay-nsw-2536
124805	Apartment	2025-07-15	SOLD OFF MARKET	2025-07-15	$421,500	1	1	1	6.0		Ray White Canberra	14-9-irving-street-phillip-act-2606
124815	House	2025-07-16	Auction 09/08/2025	2025-08-09	Undisclosed	5	3	2	4.0	460.0	Ray White Canberra	17-hazelgrove-street-harrison-act-2914
124818	Apartment	2025-07-16	$419,000	2025-10-23	$417,500	1	1	1	6.0		home.by holly	14-3-buninyong-street-watson-act-2602-124818
124826	House	2025-07-16	Auction	2025-08-02	$730,000	3	1	1	5.5	451.0	LJ Hooker Belconnen	72-hollows-circuit-macgregor-act-2615
124832	House	2025-07-16	$965,000	2025-10-14	$965,000	4	2	2		1001.0	Belle Property Batemans Bay	10-currell-close-malua-bay-nsw-2536
124836	House	2025-07-16	$549,000	2025-10-31	$540,000	3	1	2		525.0	PRD Wagga Wagga	24-spring-street-wagga-wagga-nsw-2650
124838	House	2025-07-16	Auction	2025-08-05	Undisclosed	3	1	1	3.0		Luton Gungahlin	32-bimbiang-crescent-ngunnawal-act-2913
124841	House	2025-07-16	$539,000	2025-09-02	Undisclosed	1	1	0		1138.0	Ben Bate Real Estate	2-ross-street-narooma-nsw-2546
124843	House	2025-07-16	$555,000	2025-08-12	$555,000	3	1	1		374.0	Belle Property Batemans Bay	18-bent-lane-batemans-bay-nsw-2536
124845	Apartment	2025-07-16	$680,000+	2025-09-26	Undisclosed	2	2	2	3.5		LJ Hooker Canberra City	512-condamine-street-turner-act-2612
124855	House	2025-07-16	$1,100,000-$1,125,000	2025-08-12	$1,125,000	4	2	2	0.0	400.0	Blackshaw Queanbeyan & Jerrabomberra	7-hopkins-street-googong-nsw-2620-124855
124856	House	2025-07-16	Price By Negotiation	2025-08-25	$1,080,000	4	2	2		812.0	Raine & Horne Mollymook Milton	85-garside-road-mollymook-beach-nsw-2539-124856
124859	Townhouse	2025-07-16	$525,000+	2025-09-05	Undisclosed	2	1	1	3.0	452.0	LJ Hooker Gungahlin	21-cammack-lane-forde-act-2914
124863	Land	2025-07-16	BIDDING GUIDE: $800,000	2025-08-11	$801,000	0	0	0		777.0	My Agent Team	17-burrawang-crescent-sunshine-bay-nsw-2536
124864	House	2025-07-16	Auction onsite Saturday 16th August at 10.30am	2025-08-16	$870,000	3	2	2		607.0	PRD Wagga Wagga	8-bolton-street-wagga-wagga-nsw-2650
124865	DuplexSemi-detached	2025-07-16	$1,150,000 - $1,200,000	2025-10-09	$1,070,000	6	3	3		517.0	dwell Realty	8-aspromonte-drive-south-nowra-nsw-2541
124866	House	2025-07-16	New to Market	2025-08-05	$910,000	4	2	1		990.0	Raine & Horne Berry	30-cocos-palm-drive-bomaderry-nsw-2541
124881	DuplexSemi-detached	2025-07-16	$995,000	2025-10-13	Undisclosed	5	2	2		605.0	Harcourts Greater Port Macquarie & The Rocks	4-nursery-lane-wauchope-nsw-2446
124886	House	2025-07-16	Auction	2025-08-11	$980,000	3	1	4	2.5	705.0	LJ Hooker Woden/Weston	92-spowers-circuit-holder-act-2611
124888	House	2025-07-16	$1,050,000 - $1,150,000	2025-09-25	$1,020,000	4	2	2		1242.0	LJ Hooker Woden/Weston	38-middle-street-murrumbateman-nsw-2582
124890	House	2025-07-16	Price on request	2025-08-11	$750,000	3	1	1		2020.0	Smile Elite	229-richmond-hill-road-richmond-hill-nsw-2480
124891	House	2025-07-16	$1,400,000	2025-08-01	$1,400,000	3	3	2			Blackshaw Real Estate Coastal	6a-karana-close-long-beach-nsw-2536
124894	House	2025-07-16	$679,000	2025-08-05	Undisclosed	3	1	2		489.0	Harcourts Greater Port Macquarie & The Rocks	25-main-street-jerseyville-nsw-2431
124901	House	2025-07-17	Auction	2025-08-09	Undisclosed	3	2	1	0.0	1237.0	Luton Weston Creek, Woden & Molonglo Valley	9-brookman-street-torrens-act-2607
124902	House	2025-07-17	Auction	2025-08-09	Undisclosed	3	1	4	3.0	993.0	Luton Weston Creek, Woden & Molonglo Valley	52-arndell-street-macquarie-act-2614
124903	Townhouse	2025-07-17	$845,000+	2025-08-04	$860,000	3	2	2	5.5	271.0	Luton Weston Creek, Woden & Molonglo Valley	430-jemalong-street-duffy-act-2611
124907	Townhouse	2025-07-17	$720,000	2025-08-08	$720,000	3	2	1	4.5		home.by holly	2319-aspinall-street-watson-act-2602
124909	House	2025-07-17	$729,000	2025-08-19	$729,000	3	1	3			Professionals Nowra	48-judith-drive-north-nowra-nsw-2541
124912	House	2025-07-17	$920,000	2025-08-11	$920,000	3	1	2	2.0		home.by holly	185-mouat-street-lyneham-act-2602
124913	Unit	2025-07-17	$573,000	2025-08-29	$573,000	2	1	1	1.0		home.by holly	4712-oliver-street-lyneham-act-2602
124914	DuplexSemi-detached	2025-07-17	$739,950+	2025-08-29	Undisclosed	3	2	2	5.0	436.0	Ray White Canberra	18-dyring-place-chisholm-act-2905
124915	Townhouse	2025-07-17	$880,000	2025-07-16	$880,000	4	2	2		544.0	Blackshaw Real Estate Coastal	8a-ocean-road-batehaven-nsw-2536
124916	House	2025-07-17	$799,000+	2025-09-02	Undisclosed	3	1	2	2.0	801.0	Luton Weston Creek, Woden & Molonglo Valley	11-croton-street-rivett-act-2611
124917	House	2025-07-17	Auction	2025-08-01	Undisclosed	3	2	2	6.0		Luton Gungahlin	27-woodward-loop-taylor-act-2913
124918	House	2025-07-17	AUCTION	2025-08-12	Undisclosed	3	1	2	1.0	854.0	McIntyre Property	3-kadina-crescent-isabella-plains-act-2905
124923	House	2025-07-17	$1,000,000+	2025-08-07	$1,020,000	3	2	2	3.0	820.0	Morrissey Property	30-deumonga-court-ngunnawal-act-2913
124928	Lifestyle	2025-07-17	Inviting Offers	2025-08-01	$1,450,000	3	2	7		2.02	Smile Elite	37-evelyn-road-tomerong-nsw-2540
124931	Apartment	2025-07-17	$410,000.00	2025-10-29	$410,000	2	1	1	6.0		Impact Properties	54235-flemington-road-franklin-act-2913
124934	Townhouse	2025-07-17	$760,000	2025-09-24	$715,000	3	2	2		2054.0	Dwyer Properties Sapphire Coast	110-12-reid-street-merimbula-nsw-2548
124935	Apartment	2025-07-17	$505,000	2025-09-04	$505,000	2	2	2	6.0		MARQ Property	8117-redfern-street-macquarie-act-2614
124939	House	2025-07-17	Auction	2025-08-09	Undisclosed	4	3	2	3.0	844.0	LJ Hooker Tuggeranong	2-manifold-place-kambah-act-2902
124944	House	2025-07-17	Auction 10:30am Saturday 9 August	2025-08-02	Undisclosed	3	1	1	2.5		home.by holly	15-ligertwood-street-evatt-act-2617
124945	House	2025-07-17	$1,780,000	2025-08-07	Undisclosed	4	2	2	3.5		home.by holly	88-scrivener-street-oconnor-act-2602
124950	House	2025-07-17	$740,000+	2025-08-06	$765,000	3	2	1	3.0	375.0	LJ Hooker Tuggeranong	10-whitford-place-conder-act-2906
124951	Unit	2025-07-17	$325,000+	2025-08-18	$330,000	2	1	1	2.0		LJ Hooker Kaleen	21153-murranji-street-hawker-act-2614
124954	Apartment	2025-07-17	$706,000+	2025-09-15	$700,000	3	2	1	1.5		LJ Hooker Dickson	52a-forbes-street-turner-act-2612
124958	Apartment	2025-07-17	$639,000+	2025-09-04	$646,000	3	2	2	5.5		LJ Hooker Woden/Weston	149121-easty-street-phillip-act-2606
124960	House	2025-07-17	Auction	2025-08-09	$1,205,000	3	1	2	5.5	855.0	Luton Dickson	34-legge-street-downer-act-2602
124961	House	2025-07-17	$849,000 - $869,000	2025-08-12	$852,000	3	1	3	3.5	766.0	McIntyre Property	5-clement-place-macgregor-act-2615
124966	Apartment	2025-07-17	$630,000+	2025-09-16	$636,000	2	1	1	6.0		LJ Hooker Woden/Weston	333-34-eyre-street-kingston-act-2604
124969	House	2025-07-17	$449,000	2025-08-12	$445,000	2	1	1		253.0	PRD Wagga Wagga	27-travers-street-wagga-wagga-nsw-2650
124985	Apartment	2025-07-18	$590,000	2025-09-03	$590,000	2	2	2	6.0		Seminara & Co Properties	119-69-john-gorton-drive-wright-act-2611
124987	House	2025-07-18	$1,250,000	2025-10-24	Undisclosed	4	2	3		961.0	Ben Bate Real Estate	14-harper-crescent-narooma-nsw-2546
125007	House	2025-07-18	$900,000	2025-07-31	$900,000	3	2	2		757.0	Blackshaw Real Estate Coastal	14-poole-place-sunshine-bay-nsw-2536
125010	House	2025-07-18	Auction 02/08/2025	2025-08-02	$890,000	4	2	1	3.5	867.0	Ray White Canberra	46-spofforth-street-holt-act-2615
125018	House	2025-07-18	$895,000+	2025-10-13	$885,000	5	2	3	2.0	571.0	Impact Properties	7-biala-place-ngunnawal-act-2913
125021	House	2025-07-18	$780,000 - $830,000	2025-09-15	$820,000	5	2	1		747.0	Smile Elite	123-barleyfields-road-uralla-nsw-2358
125028	House	2025-07-17	$790,000+	2025-09-09	$870,000	3	2	2	3.0	807.0	Ward Estate Agents	101-jim-pike-avenue-gordon-act-2906
125029	House	2025-07-18	$750,000 - $770,000	2025-08-20	$750,000	4	2	2		869.0	Smile Elite	22-tierney-street-muswellbrook-nsw-2333
125030	House	2025-07-18	$835,000+	2025-08-26	Undisclosed	3	2	2	5.0	493.0	Luton Gungahlin	20-anakie-court-ngunnawal-act-2913
125031	Lifestyle	2025-07-18	350000	2025-09-26	Undisclosed	0	0	0		40.0	Belle Property Braidwood	7-the-glen-road-bungendore-nsw-2621-125031
125033	BlockOfUnits	2025-07-18	$1,300,000 - $1,400,000	2025-09-26	$1,200,000	5	3	5		796.0	Dwyer Properties Sapphire Coast	27-jinjera-parade-pambula-beach-nsw-2549
125035	House	2025-07-18	$830,000 - $860,000	2025-08-14	$830,000	4	2	4		781.0	My Agent Team	88-litchfield-crescent-long-beach-nsw-2536
125037	Townhouse	2025-07-18	By Negotiation	2025-08-13	Undisclosed	2	2	1	6.0		LJ Hooker Gungahlin	4557-bellhouse-crescent-moncrieff-act-2914
125038	House	2025-07-18	Auction	2025-08-16	Undisclosed	4	2	7	1.5	912.0	Luton Kippax	22-cannan-crescent-macgregor-act-2615
125039	House	2025-07-18	New to Market	2025-08-04	$940,000	3	2	2		480.0	Raine & Horne Berry	12-broughton-avenue-tullimbar-nsw-2527
125047	Townhouse	2025-07-18	$1,150,000 - $1,250,000	2025-08-15	$1,210,000	3	2	2		255.0	Smile Elite	17-the-island-court-shell-cove-nsw-2529-125047
125052	House	2025-07-18	$710,000	2025-08-05	$705,000	3	2	1		353.0	Smile Elite	28b-tahnee-street-sanctuary-point-nsw-2540
125054	Townhouse	2025-07-19	$725,000	2025-08-21	$720,000	3	2	2	6.0		The Real Estate Shop	42-narrambla-terrace-lawson-act-2617
125062	House	2025-07-21	Guide $699,000	2025-08-06	$710,000	3	2	1		382.0	Ray White Goulburn	10b-bigwood-place-goulburn-nsw-2580
125064	House	2025-07-21	$1,437,500	2025-08-28	$1,437,500	4	2	2		701.0	Blackshaw Real Estate Coastal	6-bada-lane-tomakin-nsw-2537
125069	Retirement	2025-07-21	$420,000 - $450,000	2025-07-31	$435,000	3	1	1			Smile Elite	49221-red-head-road-red-head-nsw-2430
125073	House	2025-07-21	Buyers Guide $680,000 - $710,000	2025-08-22	$680,000	3	1	2		949.0	Smile Elite	33-opperman-way-windradyne-nsw-2795-125073
125082	House	2025-07-21	$720,000+	2025-08-13	Undisclosed	3	1	1	0.5	715.0	McIntyre Property	81-castleton-crescent-gowrie-act-2904
125083	Unit	2025-07-21	$335,000	2025-09-09	Undisclosed	2	1	1	4.0		MARQ Property	116-walsh-place-curtin-act-2605
125089	House	2025-07-21	Buyers Guide $925,000 - $950,000	2025-08-29	$920,000	6	2	2		1000.0	Smile Elite	16-oreilly-place-llanarth-nsw-2795
125095	House	2025-07-21	$569,000	2025-08-13	$593,270	3	1	2		583.3	Kitson Property	20-lonergan-place-wagga-wagga-nsw-2650-125095
125112	Land	2025-07-21	$110,000	2025-10-16	$110,000	0	0	0		1795.0	Kitson Property	25-prichard-place-lockhart-nsw-2656
125115	House	2025-07-21	$669,900	2025-09-16	Undisclosed	3	2	4		666.0	PRD Wagga Wagga	8-eyre-street-lake-albert-nsw-2650
125120	Land	2025-07-21	$169 000	2025-08-04	Undisclosed	0	0	0		9089.0	Smile Elite	70-dawes-lane-bendick-murrell-nsw-2803
125131	House	2025-07-22	$649,000	2025-09-02	$615,000	4	2	1		645.0	Kitson Property	2-marloo-crescent-kooringal-nsw-2650
125135	Apartment	2025-07-22	$420,000+	2025-09-03	$415,000	1	1	1	4.0		LJ Hooker Gungahlin	1123-lowanna-street-braddon-act-2612
125159	House	2025-07-22	$1,850,000	2025-08-12	$1,830,000	4	3	4		3.7	My Agent Team	17-pinnacles-close-bingie-nsw-2537
125162	House	2025-07-22	$649,000	2025-08-15	$649,000	3	1	2		679.0	Raine & Horne Goulburn	77-kinghorne-street-goulburn-nsw-2580
125166	Land	2025-07-22	$369,000	2025-08-22	$369,000	0	0	0		560.0	Ben Bate Real Estate	3-elanora-street-dalmeny-nsw-2546
125167	Villa	2025-07-22	$895,000	2025-08-19	Undisclosed	3	2	2		440.0	Harcourts Greater Port Macquarie & The Rocks	24-grenadines-way-bonny-hills-nsw-2445
125172	House	2025-07-22	$1,250,000	2025-09-05	$1,225,000	4	2	0		779.0	Raine & Horne Mollymook Milton	24-gordon-street-milton-nsw-2538
125174	House	2025-07-22	$779,000	2025-08-21	$777,500	4	2	2		969.2	Kitson Property	36-franklin-drive-estella-nsw-2650
125175	DuplexSemi-detached	2025-07-22	$745,000	2025-08-21	$745,000	4	2	1		364.0	Belle Property Batemans Bay	35a-wagtail-crescent-batehaven-nsw-2536
125176	Apartment	2025-07-22	$650,000	2025-10-03	$642,500	1	1	1	6.0		Maloney's Property	1325-eastlake-parade-kingston-act-2604
125177	Apartment	2025-07-22	$720,000 Plus	2025-08-29	$710,000	2	2	1	6.0		Maloney's Property	5411-kerridge-street-kingston-act-2604
125182	Apartment	2025-07-22	$300,000+	2025-08-19	$305,000	1	1	1	6.0		McIntyre Property	338325-anketell-street-greenway-act-2900
125183	House	2025-07-22	$565,000	2025-10-07	$545,000	3	1	1		784.8	Fitzpatricks	24-fairbairn-crescent-kooringal-nsw-2650
125184	House	2025-07-22	$430,000	2025-09-02	$415,000	3	1	2		1012.0	Flemings Property Services	161-neill-street-harden-nsw-2587
125189	House	2025-07-23	$575,000	2025-08-22	Undisclosed	2	1	2		2020.0	Flemings Property Services	28-brial-street-boorowa-nsw-2586
125193	House	2025-07-23	$398,000	2025-08-18	Undisclosed	2	1	2		532.0	Flemings Property Services	20a-macassar-street-cowra-nsw-2794
125194	House	2025-07-23	Auction	2025-08-05	Undisclosed	3	2	1	6.0		Luton Gungahlin	15-nordeck-street-casey-act-2913
125198	House	2025-07-23	$1,199,000	2025-09-16	Undisclosed	4	2	2	4.0	650.0	Luton Gungahlin	22-burbidge-crescent-palmerston-act-2913
125200	Lifestyle	2025-07-23	Expressions of Interest	2025-08-28	$1,050,000	3	1	6		6.64	Belle Property Braidwood	535-northangera-road-braidwood-nsw-2622-125200
125204	House	2025-07-23	$759,000	2025-08-12	$759,000	3	1	1		880.0	McGrath Batemans Bay & Moruya	21-explorers-way-surf-beach-nsw-2536
125206	House	2025-07-23	$733,000	2025-08-14	$733,000	3	1	1		2032.0	Belle Property Snowy Mountains	72-myack-street-berridale-nsw-2628
125210	House	2025-07-23	$1,125,000-$1,175,000	2025-10-02	$1,150,000	6	3	2	5.0	255.0	LJ Hooker Gungahlin	7b-braggett-street-gungahlin-act-2912
125211	House	2025-07-23	$749,000	2025-09-10	Undisclosed	3	2	2		730.0	Professionals Nowra	107-park-road-nowra-nsw-2541
125212	House	2025-07-23	Forthcoming Auction	2025-08-22	$690,000	3	1	1		538.0	Ray White Goulburn	26-victoria-street-goulburn-nsw-2580
125213	House	2025-07-23	$1,450,000	2025-10-29	$1,450,000	5	2	3		505.9	PRD Wagga Wagga	64-peter-street-wagga-wagga-nsw-2650
125221	Apartment	2025-07-23	$605,000+	2025-08-28	Undisclosed	2	2	1	1.0		LJ Hooker Canberra City	928-32-torrens-street-braddon-act-2612
125223	House	2025-07-23	$730,000+	2025-08-11	$753,000	3	1	1	2.5	747.0	LJ Hooker Tuggeranong	4-fern-place-banks-act-2906
125224	House	2025-07-23	$799,000	2025-08-21	Undisclosed	3	2	2		689.0	One Agency Gatty Coastal	27-allenby-road-tuross-head-nsw-2537
125229	House	2025-07-23	Auction 16/08/2025	2025-08-16	Undisclosed	3	2	2	3.5	748.0	Ray White Canberra	22-earle-street-lyneham-act-2602
125230	House	2025-07-23	Auction 16/08/2025	2025-07-28	$910,000	3	1	2	6.0	1045.0	Ray White Canberra	5-habgood-place-kambah-act-2902
125231	House	2025-07-23	$930,000	2025-09-04	Undisclosed	3	1	1	4.5	787.0	Luton Gungahlin	32-callabonna-street-kaleen-act-2617
125236	AcreageSemi-rural	2025-07-23	$1,195,000	2025-08-21	Undisclosed	4	2	10		5.06	Whale Coast Realty	52-corunna-road-narooma-nsw-2546
125243	House	2025-07-23	$1,295,000	2025-08-29	$1,295,000	5	2	2	5.5	871.0	Luton Tuggeranong	37-partridge-street-fadden-act-2904
125244	Apartment	2025-07-23	Sold By Sam $510,000	2025-10-20	$510,000	2	2	1	6.0		MARQ Property	1712-3-grazier-lane-belconnen-act-2617
125248	House	2025-07-24	Auction	2025-08-16	Undisclosed	3	1	3	1.0	718.0	Luton Weston Creek, Woden & Molonglo Valley	29-hibiscus-crescent-rivett-act-2611
125249	Apartment	2025-07-23	$780,000+	2025-08-14	Undisclosed	2	2	1	6.0		Seminara & Co Properties	11-18-parbery-street-kingston-act-2604-1-1
125252	House	2025-07-24	Auction 16/08/2025	2025-08-16	$1,065,000	3	2	1	1.5	789.0	Ray White Canberra	3-hetherington-circuit-mckellar-act-2617
125255	Townhouse	2025-07-24	Contact Agent	2025-08-16	Undisclosed	3	2	1	6.0		Solely Properties	617-fernyhough-crescent-lyneham-act-2602
125257	Townhouse	2025-07-24	$698,000	2025-08-20	$698,000	3	2	2	5.0		home.by holly	850-marungul-avenue-ngunnawal-act-2913
125258	House	2025-07-24	$729,000	2025-08-25	$720,000	4	2	2		781.3	Ray White Wagga Wagga	74-yentoo-drive-glenfield-park-nsw-2650
125259	Townhouse	2025-07-24	$885,000 +	2025-09-04	Undisclosed	2	2	2	6.0		VERV Property	33-banjine-street-oconnor-act-2602
125261	Unit	2025-07-24	$425,000	2025-10-14	$425,000	1	1	1	6.0		Suburbia Real Estate	443-london-circuit-city-act-2601
125264	House	2025-07-24	$520,000-$550,000	2025-08-08	$525,000	2	1	1			My Agent Team	1061-69-sunpatch-parade-tomakin-nsw-2537
125270	Land	2025-07-24	Guide $330,000	2025-08-29	Undisclosed	0	0	0		715.1	Marble & Oak Property	lot-214-4-fawcett-street-marulan-nsw-2579-125270
125271	Townhouse	2025-07-24	$620,000+	2025-08-29	Undisclosed	2	1	1	5.5	135.0	LJ Hooker Gungahlin	20-redruth-street-crace-act-2911
125276	House	2025-07-24	Auction 06/09/2025	2025-09-06	Undisclosed	2	1	2	6.0	231.0	Impact Properties	113-burrumarra-avenue-ngunnawal-act-2913
125277	House	2025-07-24	$1,650,000	2025-10-28	Undisclosed	4	3	6		1.01	Elders Real Estate Batemans Bay	135-larrys-mountain-road-moruya-nsw-2537
125280	House	2025-07-24	$850,000 - $900,000	2025-08-21	$876,000	4	3	0		625.0	My Agent Team	237-beach-road-denhams-beach-nsw-2536
125282	House	2025-07-24	Auction 16/08/2025	2025-08-16	$2,025,000	4	4	2	3.0	1116.0	Ray White Canberra	9-gidabal-street-aranda-act-2614
125284	DuplexSemi-detached	2025-07-24	Another SOLD by Irving	2025-09-19	Undisclosed	3	2	2		333.7	Smile Elite	17-hilcot-street-stanhope-gardens-nsw-2768
125287	House	2025-07-24	$1,435,000+	2025-09-05	$1,435,000	4	3	2	5.5	578.0	LJ Hooker Gungahlin	66-marie-pitt-street-franklin-act-2913
125288	Townhouse	2025-07-24	$685,000+	2025-09-18	Undisclosed	3	3	2	5.5		LJ Hooker Woden/Weston	3958-max-jacobs-avenue-wright-act-2611
125294	House	2025-07-24	$525,000	2025-08-20	$527,000	3	1	2		627.0	Flemings Property Services	5-parkview-crescent-harden-nsw-2587
125299	House	2025-07-24	Auction 09/08/2025	2025-08-09	Undisclosed	4	2	2	5.0	615.0	Ray White Canberra	16-baudinette-circuit-bruce-act-2617
125300	House	2025-07-24	$1,135,000 +	2025-08-01	Undisclosed	5	2	2	5.0	926.0	Cream Residential	96-jackie-howe-crescent-macarthur-act-2904
125309	House	2025-07-24	$650,000 - $680,000	2025-09-18	$670,000	3	2	0		830.0	My Agent Team	21-pleasurelea-drive-sunshine-bay-nsw-2536
125310	House	2025-07-24	$699,000	2025-08-19	$707,400	4	2	2		746.8	Kitson Property	18-walla-place-glenfield-park-nsw-2650
125311	House	2025-07-24	$495,000	2025-09-25	$515,000	4	2	2		708.0	Macarthur Real Estate Agency	9-malta-crescent-ashmont-nsw-2650
125312	Apartment	2025-07-24	$590,000 - $650,000	2025-10-08	$607,000	3	2	2	6.0		LJ Hooker Gungahlin	5092-gribble-street-gungahlin-act-2912
125324	House	2025-07-24	Price Guide $690,000 - $720,000	2025-08-08	Undisclosed	3	1	1		354.0	Harcourts Greater Port Macquarie & The Rocks	17-sherana-place-port-macquarie-nsw-2444
125331	DuplexSemi-detached	2025-07-24	$699,000	2025-10-23	Undisclosed	3	2	2			McGrath Merimbula	191-monaro-street-merimbula-nsw-2548
125333	House	2025-07-24	Auction	2025-08-16	$1,320,000	3	1	1	2.5	702.0	Luton Dickson	213-atherton-street-downer-act-2602
125338	Apartment	2025-07-24	$500,000+	2025-08-26	$520,000	2	1	1	6.0	11240.0	LJ Hooker Kaleen	781-mouat-street-lyneham-act-2602
125343	House	2025-07-25	Auction	2025-08-16	Undisclosed	3	1	3	1.5	730.0	Luton Weston Creek, Woden & Molonglo Valley	3-tobin-place-holder-act-2611
125345	House	2025-07-25	Auction	2025-08-26	$2,000,000	4	3	2		1989.0	Smile Elite	114-windang-road-primbee-nsw-2502
125348	Apartment	2025-07-25	$442,500	2025-10-14	$442,500	1	1	1	6.0		Suburbia Real Estate	2720-bradfield-street-downer-act-2602
125349	Apartment	2025-07-25	Preview	2025-08-25	$488,500	2	1	1		300.9	Ray White Wagga Wagga	17-bentley-place-wagga-wagga-nsw-2650-1
125351	House	2025-07-25	$730,000	2025-08-18	$722,500	4	2	2		998.5	PRD Wagga Wagga	13-myall-crescent-lake-albert-nsw-2650
125352	House	2025-07-25	UNDER OFFER 	2025-08-29	$1,020,000	4	2	2		1391.0	Ray White Bowral	43-orient-street-willow-vale-nsw-2575
125354	Townhouse	2025-07-25	$790,000	2025-09-05	$790,000	4	2	2	6.0		home.by holly	202-eureka-way-denman-prospect-act-2611
125359	Unit	2025-07-25	Buyers Guide $350,000 - $365,000	2025-08-25	$370,000	2	1	1		104.0	Smile Elite	2214-keppel-street-bathurst-nsw-2795
125361	House	2025-07-25	Auction Unless sold Prior	2025-09-03	$1,250,000	4	2	3		1.55	Raine & Horne Goulburn	3-merino-road-marulan-nsw-2579
125363	Apartment	2025-07-23	$375,000 - $395,000	2025-08-01	Undisclosed	2	1	1			Luton Weston Creek, Woden & Molonglo Valley	3186-derrima-road-crestwood-nsw-2620
125376	House	2025-07-25	$1,475,000	2025-10-13	$1,475,000	3	2	2	4.0		home.by holly	84-paterson-street-ainslie-act-2602
125380	House	2025-07-25	$590,000 - $620,000	2025-10-30	$570,000	3	1	1		472.0	My Agent Team	2-palm-place-surfside-nsw-2536
125381	Apartment	2025-07-25	Auction 24/08/2025	2025-08-19	Undisclosed	1	1	1	6.0		Ray White Canberra	146-39-mcintyre-street-narrabundah-act-2604
125407	Apartment	2025-07-23	$329,000	2025-08-20	$334,000	1	1	1	6.0		LJ Hooker Belconnen	1314120-eastern-valley-way-belconnen-act-2617
125408	Unit	2025-07-23	$380,000+	2025-09-03	$397,500	2	1	1	2.5		LJ Hooker Belconnen	103-keith-street-scullin-act-2614
125412	Apartment	2025-07-28	$429,000+	2025-09-08	Undisclosed	1	1	1	6.0	3037.0	LJ Hooker Canberra City	2728-watson-street-turner-act-2612
125414	Land	2025-07-28	$444,000	2025-08-14	$444,000	0	0	0		2032.0	Belle Property Snowy Mountains	72-myack-street-berridale-nsw-2628-125414
125415	House	2025-07-28	Buyers Guide $550,000 - $580,000	2025-08-25	$567,000	4	2	2		679.0	Smile Elite	30-suttor-street-west-bathurst-nsw-2795
125417	House	2025-07-28	$620,000	2025-09-01	Undisclosed	3	1	1		619.0	Harcourts Greater Port Macquarie & The Rocks	1a-colonial-circuit-wauchope-nsw-2446
125423	Apartment	2025-07-28	$570,000 to $585,000	2025-10-16	$570,000	2	2	2	6.0		Impact Properties	19112-mcmichael-terrace-denman-prospect-act-2611
125425	House	2025-07-28	$759,000	2025-08-25	Undisclosed	3	2	2		768.3	Ray White Wagga Wagga	7-henwood-avenue-kooringal-nsw-2650
125437	House	2025-07-28	$689,000	2025-08-11	$694,000	3	2	1		467.0	My Agent Team	5a-excelsa-court-maloneys-beach-nsw-2536
125441	House	2025-07-28	$349,000	2025-10-17	Undisclosed	2	1	1		634.0	Flemings Property Services	16-macassar-street-cowra-nsw-2794
125443	Unit	2025-07-23	$420,000	2025-08-11	$415,000	2	1	1	5.0		LJ Hooker Belconnen	2014-playfair-place-belconnen-act-2617
125449	Lifestyle	2025-07-28	Auction (Unless Sold Prior)	2025-08-19	$1,400,000	5	2	8		25.27	Ray White Goulburn	127-long-swamp-road-greenwich-park-nsw-2580-125449
125453	House	2025-07-28	$525,000	2025-07-28	Undisclosed	3	1	2			Macarthur Real Estate Agency	11-doman-street-estella-nsw-2650
125454	House	2025-07-28	$1,100,000-$1,150,000	2025-09-18	$1,060,000	4	2	3		1277.0	Ray White Bungendore	4-mcfadzen-place-bungendore-nsw-2621
125455	Land	2025-07-28	$995,000	2025-08-27	Undisclosed	0	0	0		607.0	Ben Bate Real Estate	45-mcmillan-crescent-dalmeny-nsw-2546
125462	House	2025-07-28	$799,500	2025-08-21	$812,500	4	2	2		1398.0	PRD Wagga Wagga	14-kincora-place-bourkelands-nsw-2650
125465	House	2025-07-28	$1,800,000 - $1,900,000	2025-10-13	Undisclosed	5	5	2		600.0	My Agent Team	88-sandy-place-long-beach-nsw-2536
125473	House	2025-07-29	$1,395,000	2025-08-27	Undisclosed	3	2	1		607.0	Ben Bate Real Estate	47-mcmillan-crescent-dalmeny-nsw-2546
125474	House	2025-07-29	Sold $955,000	2025-08-26	$955,000	4	2	2	5.5	388.0	MARQ Property	17-selleck-street-casey-act-2913
125477	Unit	2025-07-29	Auction	2025-08-07	Undisclosed	3	2	2	5.5		Luton Weston Creek, Woden & Molonglo Valley	299-eastlake-parade-kingston-act-2604
125483	House	2025-07-29	Price Guide $1,180,000 - $1,220,000	2025-10-31	Undisclosed	4	2	3		735.0	Harcourts Greater Port Macquarie & The Rocks	14-kingston-town-loop-port-macquarie-nsw-2444
125491	House	2025-07-29	$669,000	2025-07-29	$660,000	3	2	2		648.0	Macarthur Real Estate Agency	6-moonah-street-forest-hill-nsw-2651-125491
125497	House	2025-07-29	Sold prior to auction	2025-08-14	Undisclosed	4	2	2	5.5	475.0	Seminara & Co Properties	20-toppano-street-moncrieff-act-2914
125498	House	2025-07-29	$1,250,000	2025-10-24	$1,260,000	3	2	3		649.0	Fraser-Gray Real Estate	14-broulee-road-broulee-nsw-2537
125501	House	2025-07-29	Price Guide $1,350,000 - $1,400,000	2025-08-29	Undisclosed	4	2	4		8320.0	Harcourts Greater Port Macquarie & The Rocks	33-forest-oak-road-king-creek-nsw-2446
125507	House	2025-07-29	AUCTION GUIDE $700,000	2025-09-17	$750,000	4	2	2		617.0	Ray White Goulburn	25-warne-street-crookwell-nsw-2583
125525	AcreageSemi-rural	2025-07-29	$790,000 - $830,000	2025-10-13	$775,000	4	1	1		2.0	Smile Elite	1305-caniaba-road-clovass-nsw-2480
125528	Apartment	2025-07-30	$369,000+	2025-09-12	$362,500	2	1	1	0.5	8531.0	Ray White Canberra	76-wilkins-street-mawson-act-2607
125532	Unit	2025-07-30	$699,000	2025-08-19	$699,000	2	2	2			Sails Real Estate	121-the-fairway-tura-beach-nsw-2548
125537	House	2025-07-30	Auction	2025-08-12	Undisclosed	3	1	2	1.0		Luton Gungahlin	34-narryer-close-palmerston-act-2913
125539	House	2025-07-30	Auction 24/08/2025	2025-08-22	$952,000	4	2	2	2.5	766.0	Ray White Canberra	353-bugden-avenue-fadden-act-2904
125540	House	2025-07-30	$570,000 - $585,000	2025-10-10	$585,000	4	1	1		716.0	Smile Elite	65-shiraz-street-muswellbrook-nsw-2333
125543	House	2025-07-30	Auction 24/08/2025	2025-08-24	Undisclosed	5	3	6	1.5	1043.0	Ray White Canberra	83-oconnor-circuit-calwell-act-2905
125553	House	2025-07-30	$1,500,000 - $1,580,000	2025-09-09	$1,565,000	4	3	2		300.2	Smile Elite	31-rubicon-street-tallawong-nsw-2762
125558	Apartment	2025-07-30	$585,000	2025-10-09	$560,000	2	1	2			McGrath Merimbula	23-banksia-court-tura-beach-nsw-2548
125559	House	2025-07-30	$800,000	2025-10-17	$800,000	3	2	1		670.0	Blackshaw Real Estate Coastal	20-grantham-road-batehaven-nsw-2536
125560	House	2025-07-30	$930,000	2025-10-17	$930,000	4	2	2		643.0	Blackshaw Real Estate Coastal	12-throsby-crescent-sunshine-bay-nsw-2536
125563	House	2025-07-30	Auction Guide $500,000	2025-09-05	$540,000	3	1	1		633.0	Ray White Goulburn	19-hovell-street-goulburn-nsw-2580
125564	House	2025-07-30	$825,000+	2025-10-15	$830,000	3	2	2	4.0	469.0	LJ Hooker Gungahlin	15-ferguson-circuit-ngunnawal-act-2913
125565	Townhouse	2025-07-30	$610,000+	2025-09-09	Undisclosed	2	1	1	2.0		LJ Hooker Gungahlin	1557-newman-morris-circuit-oxley-act-2903
125566	House	2025-07-30	$699,000+	2025-09-09	$730,000	3	2	1	5.0		LJ Hooker Gungahlin	10-crossman-street-amaroo-act-2914
125593	Apartment	2025-07-30	$399,000 - $419,000	2025-08-13	$410,000	3	1	1		880.0	Ray White Wagga Wagga	154-allonby-avenue-forest-hill-nsw-2651
125598	Townhouse	2025-07-30	Contact Agent	2025-08-21	$780,000	3	2	1			Smile Elite	332-canberra-street-oxley-park-nsw-2760
125605	Apartment	2025-07-31	$559,000+	2025-09-09	$560,000	1	1	1	6.0		PURNELL	1947-blackall-street-barton-act-2600
125606	Apartment	2025-07-31	$615,000+	2025-09-10	$610,000	1	1	1	6.0		PURNELL	6-9-light-street-griffith-act-2603
125607	Apartment	2025-07-31	$509,000+	2025-10-17	$509,000	1	1	1	6.0		PURNELL	20350-eastlake-parade-kingston-act-2604
125608	House	2025-07-31	$979,000+	2025-08-28	$965,000	3	1	1	4.0		PURNELL	12-wyangala-street-duffy-act-2611
125612	Apartment	2025-07-31	$719,000+	2025-08-29	$710,000	2	2	1	6.0		PURNELL	309-82-wentworth-avenue-kingston-act-2604
125613	Unit	2025-07-31	$689,000+	2025-10-29	$689,000	2	2	2	6.0		PURNELL	3951-dawes-street-kingston-act-2604
125614	Apartment	2025-07-31	$439,000+	2025-10-07	Undisclosed	1	1	1	6.0		PURNELL	839-eastlake-parade-kingston-act-2604
125617	Apartment	2025-07-31	$429,000+	2025-08-21	$410,000	1	1	1	4.5		PURNELL	6612-challis-street-dickson-act-2602
125618	Apartment	2025-07-31	$499,000+	2025-09-04	$500,000	1	1	1	6.0		PURNELL	2676-leichhardt-street-griffith-act-2603
125621	Apartment	2025-07-31	$1,599,000+	2025-09-18	Undisclosed	3	2	4	6.0		PURNELL	20317-state-circle-forrest-act-2603
125624	House	2025-07-31	Auction	2025-08-23	$1,925,000	4	2	2	4.0	483.0	Luton Manuka	37-moorhouse-street-oconnor-act-2602
125625	Apartment	2025-07-31	$629,000+	2025-08-13	$670,000	2	1	1	1.5		PURNELL	433-dawes-street-kingston-act-2604
125628	House	2025-07-31	contact agent	2025-08-18	$1,025,500	4	2	2	4.0	779.0	home.by holly	1-reveley-crescent-stirling-act-2611
125629	House	2025-07-31	$1,295,000	2025-10-28	$1,275,000	4	2	2		1170.0	Macarthur Real Estate Agency	36-lakehaven-drive-lake-albert-nsw-2650
125631	Townhouse	2025-07-31	Auction 24/08/2025	2025-08-24	$641,000	3	1	2	4.0		Ray White Canberra	793-namadgi-circuit-palmerston-act-2913
125632	Townhouse	2025-07-31	$750,000	2025-09-19	$745,000	3	2	2	5.0	204.0	Ray White Canberra	17-lansdown-crescent-casey-act-2913-1
125635	House	2025-07-31	Auction 24/08/2025	2025-08-24	$1,020,000	3	2	2	0.0	390.0	Ray White Canberra	65-dexter-street-cook-act-2614
125637	Unit	2025-07-31	$369,000	2025-10-17	$364,000	1	1	1	6.0	2.1	Ray White Canberra	9g-21-beissel-street-belconnen-act-2617
125638	Townhouse	2025-07-31	Auction 24/08/2025	2025-08-24	$716,000	3	2	1	4.0		Ray White Canberra	2-2-belconnen-way-page-act-2614
125639	House	2025-07-31	$650,000	2025-09-05	$650,000	3	1	2		1613.0	Professionals Nowra	375-princes-highway-bomaderry-nsw-2541
125640	Apartment	2025-07-31	AUCTION 18/09/2025	2025-09-18	Undisclosed	2	2	1	6.0		Ray White Canberra	39109-canberra-avenue-griffith-act-2603
125644	House	2025-07-31	By negotiation	2025-10-31	Undisclosed	5	4	2	6.00	1060.0	Bastion Property Group	1-greenhood-place-oconnor-act-2602
125645	House	2025-07-31	$530,000	2025-09-12	$530,000	3	1	1		594.0	Macarthur Real Estate Agency	48-ceduna-street-mount-austin-nsw-2650
125646	Townhouse	2025-07-31	Auction 24/08/2025	2025-08-24	$635,500	2	1	1	3.0	18885.0	Ray White Canberra	1219-ashby-circuit-kambah-act-2902
125649	House	2025-07-31	Auction 24/08/2025	2025-08-24	$865,000	3	2	2	5.5	738.0	Ray White Canberra	4-conley-drive-melba-act-2615
125652	House	2025-07-31	$1,325,000	2025-09-12	Undisclosed	4	2	2	6.0	487.0	VERV Property	7-alan-watt-crescent-casey-act-2913
125653	House	2025-07-31	$750,000	2025-09-04	$730,000	3	2	2			McGrath Merimbula	70-berrambool-drive-berrambool-nsw-2548
125656	House	2025-07-31	$1,270,000	2025-08-25	$1,270,000	4	3	2	1.5		home.by holly	3-mathieson-crescent-weetangera-act-2614
125659	House	2025-07-31	Auction	2025-08-30	$1,550,000	4	2	1	1.5	716.0	LJ Hooker Woden/Weston	26-nelson-place-curtin-act-2605
125660	Townhouse	2025-07-31	Auction 24/08/2025	2025-08-24	$676,000	3	1	1	0.5	273.0	Ray White Canberra	3918-cromwell-circuit-isabella-plains-act-2905
125662	Apartment	2025-07-31	$560,000 +	2025-08-20	Undisclosed	2	2	2	2.0		Cream Residential	67-byron-court-phillip-act-2606
125667	House	2025-07-31	contact agent	2025-08-26	Undisclosed	3	1	2	3.5		home.by holly	21-haddon-street-hackett-act-2602
125668	Apartment	2025-07-31	$470,000+	2025-10-15	Undisclosed	2	1	1	6.0		Ray White Canberra	g7-39-braybrooke-street-bruce-act-2617-125668
125669	House	2025-07-31	$1,495,000+	2025-10-20	Undisclosed	5	3	2	3.0		Ray White Canberra	6-soutar-place-kambah-act-2902
125670	House	2025-07-31	Auction 23/08/2025	2025-08-23	Undisclosed	5	2	5	2.5	923.0	Ray White Canberra	23-percival-street-holder-act-2611
125675	House	2025-07-31	Auction 24/08/2025	2025-08-24	Undisclosed	4	3	2	4.0	806.0	Ray White Canberra	51-goldstein-crescent-chisholm-act-2905
125676	House	2025-07-31	$740,000	2025-07-31	$740,000	3	2	4		989.0	Belle Property Batemans Bay	28-karoola-crescent-surfside-nsw-2536
125677	House	2025-07-31	By Negotiation	2025-09-24	$695,000	3	1	1	4.0	148.0	Luton Dickson	36-irinyili-street-bonner-act-2914
125682	House	2025-07-31	Auction 16/08/2025	2025-08-16	Undisclosed	3	2	2	6.0	430.0	LJ Hooker Dickson	7-bronhill-street-moncrieff-act-2914
125683	House	2025-07-31	contact agent	2025-08-25	Undisclosed	4	2	2	4.5		home.by holly	17-mcclemans-street-watson-act-2602
125685	House	2025-07-31	contact agent	2025-08-18	$1,762,000	4	1	2	2.5		home.by holly	10a-ebden-street-ainslie-act-2602
125686	House	2025-07-31	$438,000	2025-09-15	$425,000	1	1	1			Ray White Batemans Bay	6388-beach-road-batehaven-nsw-2536
125688	House	2025-07-31	Auction 24/08/2025	2025-08-24	$828,000	3	2	3	0.5	877.0	Ray White Canberra	2-ohea-street-wanniassa-act-2903
125693	Apartment	2025-07-31	$385,000	2025-09-04	$385,000	2	1	1			home.by holly	730-trinculo-place-queanbeyan-east-nsw-2620
125698	Townhouse	2025-07-31	$720,000+	2025-09-05	Undisclosed	3	2	1	3.5		My Morris	9118-barr-smith-avenue-bonython-act-2905
125700	House	2025-07-31	Auction 24/08/2025	2025-08-15	Undisclosed	3	2	1	0.5		Ray White Canberra	25-kulgera-street-hawker-act-2614
125703	House	2025-07-31	$715,000	2025-07-31	$715,000	3	1	2	6.0	250.0	Impact Properties	27-vahland-street-taylor-act-2913
125705	Apartment	2025-07-31	$510,000+	2025-08-18	$560,000	2	2	1	6.0		LJ Hooker Gungahlin	24412-limburg-way-greenway-act-2900
125707	House	2025-07-31	Another SOLD by Irving Gunawan	2025-08-18	$1,072,000	3	2	2		231.5	Smile Elite	196-stanhope-parkway-stanhope-gardens-nsw-2768
125709	AcreageSemi-rural	2025-07-31	New to Market	2025-09-17	$1,925,000	3	2	1		4.89	Raine & Horne Berry	1386a-kangaroo-valley-road-kangaroo-valley-nsw-2577
125710	House	2025-07-31	Auction	2025-08-27	$792,000	3	1	2	0.5	394.0	LJ Hooker Kaleen	25-rubicon-street-kaleen-act-2617
125712	Townhouse	2025-07-31	$925,000+	2025-10-02	$950,000	3	2	2	6.0		LJ Hooker Canberra City	37-calaby-street-coombs-act-2611-125712
125715	House	2025-07-31	Contact Agent	2025-07-31	Undisclosed	4	2	2			Blackshaw Real Estate Coastal	2-25-mary-place-long-beach-nsw-2536-125715
125722	House	2025-07-31	$1,330,000	2025-09-08	Undisclosed	4	2	2	4.0		Luton Gungahlin	2-howmans-street-harrison-act-2914
125723	House	2025-07-31	Auction	2025-08-30	Undisclosed	3	2	2	2.5		Luton Tuggeranong	20110-julia-flynn-avenue-isaacs-act-2607
125727	House	2025-07-31	$419,000 +	2025-09-22	$415,000	1	1	1	6.0		LJ Hooker Woden/Weston	176142-anketell-street-greenway-act-2900
125743	House	2025-08-01	$1,269,000+	2025-09-12	$1,260,000	4	3	5	5.5	570.0	Impact Properties	17-alistair-knox-terrace-taylor-act-2913
125744	House	2025-08-01	Auction	2025-09-05	Undisclosed	3	2	2	4.0		PURNELL	80-stuart-street-narrabundah-act-2604
125746	House	2025-08-01	$825,000+	2025-08-27	$855,000	6	1	4	1.5	882.0	LJ Hooker Kaleen	9-cawthorn-crescent-evatt-act-2617
125748	Townhouse	2025-08-01	$665,000+	2025-10-27	Undisclosed	3	2	2	6.0		My Morris	40-99-woodberry-avenue-coombs-act-2611-125748
125758	Apartment	2025-08-01	$440,000	2025-09-01	$422,000	2	1	1	6.0		Ray White Canberra	8210-hinder-street-gungahlin-act-2912
125760	House	2025-08-01	contact agent	2025-08-11	Undisclosed	3	1	1	2.0		home.by holly	95-majura-avenue-dickson-act-2602
125762	House	2025-08-01	$525,000	2025-09-22	$520,000	2	1	1		615.0	Raine & Horne Goulburn	52-queen-street-goulburn-nsw-2580
125763	DuplexSemi-detached	2025-08-01	$799,000	2025-09-05	Undisclosed	3	2	1			Sails Real Estate	2-159-pacific-way-tura-beach-nsw-2548-125763
125764	House	2025-08-01	Auction 16/08/2025	2025-08-16	$1,043,000	4	2	2	1.5	1144.0	Ray White Canberra	12-rogers-street-fraser-act-2615
125765	House	2025-08-01	contact agent	2025-10-17	Undisclosed	5	3	2	5.0	1274.0	home.by holly	52-sidaway-street-chapman-act-2611
125768	House	2025-08-01	Auction 23/08/2025	2025-08-23	Undisclosed	4	2	2	5.0	928.0	Ray White Canberra	4-miller-street-oconnor-act-2602
125769	House	2025-08-01	$1,425,000	2025-08-22	Undisclosed	4	3	2		985.0	Belle Property Batemans Bay	54-sandy-place-long-beach-nsw-2536
125773	Land	2025-08-01	$543,250	2025-08-28	$543,250	0	0	0	0.0	476.0	Ginninderry	59-sherrard-crescent-macnamara-act-2615-125773
125787	House	2025-08-01	$765,000	2025-09-16	$720,000	3	2	2		1607.0	Belle Property Braidwood	10-coghill-street-braidwood-nsw-2622
125795	House	2025-08-01	Price on Application	2025-08-20	Undisclosed	2	1	1		1005.7	Raine & Horne Young	43-demondrille-street-young-nsw-2594
125796	House	2025-08-01	Auction Guide $500,000	2025-09-05	$535,000	3	1	1		1013.0	Ray White Goulburn	20-allison-street-goulburn-nsw-2580
125817	House	2025-08-04	$949,000+	2025-09-15	$1,000,000	4	2	2	4.0	792.0	McIntyre Property	6-connell-place-conder-act-2906
125833	House	2025-08-04	$1,395,000	2025-09-18	$1,335,000	3	3	4		917.0	Whale Coast Realty	105-cresswick-parade-dalmeny-nsw-2546
125838	House	2025-08-04	Guide $980,000	2025-08-14	$980,000	4	2	2		800.0	Ray White Bowral	12-baker-street-moss-vale-nsw-2577
125853	House	2025-08-04	$930,000 - $980,000	2025-10-10	$925,000	4	2	2		731.0	Raine & Horne Berry	6-hillside-drive-albion-park-nsw-2527
125854	Unit	2025-08-04	$775,000	2025-09-05	$755,000	3	2	2			Whale Coast Realty	114-6-princes-highway-narooma-nsw-2546
125863	House	2025-08-05	AUCTION 30/08/2025	2025-08-08	$960,000	3	1	2	2.0	894.2	Ray White Canberra	20-terewah-circuit-kaleen-act-2617
125871	House	2025-08-05	Sold By Sam $955,000	2025-10-07	$955,000	4	2	2	6.0	482.0	MARQ Property	casey-2913-act-125871
125875	Unit	2025-08-05	Sale by Negotiation	2025-09-12	$420,000	2	2	2	6.0		LJ Hooker Kippax	3768-hardwick-crescent-holt-act-2615
125881	House	2025-08-05	$625,000 - $650,000	2025-10-20	$610,000	2	2	2		451.5	Macarthur Real Estate Agency	110-watson-boulevard-lloyd-nsw-2650-125881
125883	Retirement	2025-08-05	Price Guide $460,000 - $475,000	2025-09-01	Undisclosed	3	1	1			Harcourts Greater Port Macquarie & The Rocks	893-lincoln-road-port-macquarie-nsw-2444
125885	House	2025-08-05	By Negotiation	2025-08-05	$1,080,000	4	2	2	6.0	1352.0	Ray White Canberra	5-nish-place-fraser-act-2615
125898	Land	2025-08-05	ONLINE AUCTION - Guide $350,000	2025-09-08	$360,000	0	0	0		706.0	Raine & Horne Goulburn	1-quadrant-place-goulburn-nsw-2580
125909	Apartment	2025-08-05	UNDER OFFER	2025-10-08	Undisclosed	2	2	2	6.0		LJ Hooker Canberra City	403-76-steve-irwin-avenue-wright-act-2611
125915	House	2025-08-05	$1,450,000 to $1,550,000	2025-10-14	$1,440,000	5	3	6	0.0	5888.0	Ray White Canberra	55-merryville-drive-murrumbateman-nsw-2582
125916	House	2025-08-05	$964,000	2025-10-14	Undisclosed	2	1	4		1005.0	Marshall and Tacheci Real Estate	57-oconnells-point-road-wallaga-lake-nsw-2546
125917	House	2025-08-06	$1,089,000+	2025-08-19	$1,100,000	4	2	2	4.0	537.0	Stone Gungahlin	18-wellesley-street-amaroo-act-2914
125918	Apartment	2025-08-06	$409,000-$459,000	2025-09-05	$429,500	1	1	1	6.0		Stone Gungahlin	15215-irving-street-phillip-act-2606
125919	House	2025-08-06	Offers Over $1,695,000	2025-08-20	Undisclosed	4	2	2	3.0	1059.0	Independent Property Group South	11-coleman-street-pearce-act-2607
125920	Townhouse	2025-08-06	$670,000	2025-08-28	$670,000	3	1	1	3.5		Independent Property Group South	1341-ern-florence-crescent-theodore-act-2905
125923	Unit	2025-08-06	$360,000	2025-08-12	$360,000	1	1	1	6.0		Independent Property Group South	9-dover-court-phillip-act-2606
125924	Townhouse	2025-08-06	$749,000	2025-10-20	Undisclosed	2	2	1	2.5		Independent Property Group South	19-61-mcnamara-street-pearce-act-2607-125924
125927	Townhouse	2025-08-06	635000	2025-09-19	$635,000	1	1	1	4.0		Independent Property Group South	1010-robson-street-garran-act-2605
125928	Apartment	2025-08-06	$509,000	2025-08-26	$509,000	1	1	1	6.0		Independent Property Group South	38-9-irving-street-phillip-act-2606
125929	House	2025-08-06	$1,110,000	2025-08-11	$1,110,000	4	3	2		396.0	Independent Property Group South	39-mccauley-avenue-googong-nsw-2620
125930	House	2025-08-06	$852,000	2025-08-29	$852,000	3	1	1	2.0	857.0	Independent Property Group South	26-verbrugghen-street-melba-act-2615
125932	Unit	2025-08-06	Offers Over $399,000	2025-08-08	Undisclosed	2	1	1	3.0		Independent Property Group South	77-medley-street-chifley-act-2606
125933	House	2025-08-06	$1,850,000	2025-10-24	Undisclosed	4	2	2	1.5	1286.0	Independent Property Group South	46-olympus-way-lyons-act-2606
125935	House	2025-08-06	$947,500	2025-09-10	$947,500	3	1	1	1.5	618.0	home.by holly	47-burn-street-downer-act-2602
125936	Apartment	2025-08-06	Offers Over $460,000	2025-10-09	$448,000	1	1	1	6.0		LJ Hooker Dickson	7112-david-street-turner-act-2612
125941	Townhouse	2025-08-06	$572,500	2025-09-05	$572,500	2	2	1	6.0		Suburbia Real Estate	1511-wanderlight-avenue-lawson-act-2617
125942	Unit	2025-08-06	$675,000	2025-08-01	$675,000	2	2	2	6.0		Suburbia Real Estate	12911-trevillian-quay-kingston-act-2604
125943	Apartment	2025-08-06	$489,000	2025-08-13	$489,000	2	1	1	6.0		Suburbia Real Estate	2511-mouat-street-lyneham-act-2602
125944	Townhouse	2025-08-06	$813,000	2025-09-23	$813,000	3	2	2	6.0		Suburbia Real Estate	82114-thynne-street-bruce-act-2617
125947	House	2025-08-06	$975,000	2025-09-10	$975,000	4	3	2	6.0		Suburbia Real Estate	82-pro-hart-avenue-strathnairn-act-2615
125948	Apartment	2025-08-06	$418,000	2025-08-14	$418,000	1	1	1	6.0		Suburbia Real Estate	309-55-dooring-street-dickson-act-2602
125949	Townhouse	2025-08-06	$1,187,000	2025-08-08	$1,187,000	3	2	3	6.0		Suburbia Real Estate	196-dooring-street-dickson-act-2602
125950	Unit	2025-08-06	$512,000	2025-08-12	$512,000	2	1	2	4.5		Suburbia Real Estate	2151-totterdell-street-belconnen-act-2617
125955	Townhouse	2025-08-06	Auction	2025-08-18	$581,000	3	1	2	5.5		Archer	5960-john-gorton-drive-coombs-act-2611
125956	Townhouse	2025-08-06	$729,000+	2025-10-07	$725,000	3	2	2	4.5		Archer	95-colmer-street-bruce-act-2617
125962	Townhouse	2025-08-06	Auction	2025-08-13	$720,000	3	3	2	5.0	85.0	Archer	8-henry-kendall-street-franklin-act-2913
125966	House	2025-08-06	Auction	2025-08-23	$1,266,000	4	2	2	4.0	605.0	Archer	32-morris-west-street-franklin-act-2913
125969	Apartment	2025-08-06	$500,000+	2025-09-29	Undisclosed	2	2	2	6.0		Archer	219-335-anketell-street-greenway-act-2900
125971	Apartment	2025-08-06	$449,000+	2025-10-14	Undisclosed	1	1	1	6.0		Archer	102-2-edinburgh-avenue-city-act-2601
125973	Apartment	2025-08-06	$400,000+	2025-08-12	Undisclosed	1	1	1	6.0		Archer	1908-2-furzer-street-phillip-act-2606
125981	Apartment	2025-08-06	$300,000	2025-09-19	Undisclosed	1	1	1	5.5		Archer	g14-26-cynthea-teague-crescent-greenway-act-2900-125981
125983	Apartment	2025-08-06	$390,000	2025-08-22	Undisclosed	2	1	1	6.0		Archer	1101-90-swain-street-gungahlin-act-2912
125984	Townhouse	2025-08-06	$625,000+	2025-10-16	$625,000	3	2	2	6.0	111.0	Archer	57-bellhouse-crescent-moncrieff-act-2914
125993	Apartment	2025-08-06	$499,000+	2025-09-15	$512,000	2	2	2	6.0		Archer	1704-1-grazier-lane-belconnen-act-2617
125994	Townhouse	2025-08-06	$880,000	2025-09-10	$865,000	4	2	2	6.0		Archer	26-10-ellison-harvie-close-greenway-act-2900
125996	House	2025-08-06	$825,000+	2025-08-27	$825,000	3	2	2	5.0	231.0	Archer	206-anthony-rolfe-avenue-gungahlin-act-2912
125997	Apartment	2025-08-06	$399,000+	2025-09-19	$397,000	1	1	1	6.0		Archer	11541-chandler-street-belconnen-act-2617
126005	Apartment	2025-08-06	$379,000+	2025-10-29	Undisclosed	1	1	1	6.00		Archer	1662-lowanna-street-braddon-act-2612
126012	Apartment	2025-08-06	$399,000+	2025-08-14	$415,000	1	1	1	5.5		Stone Gungahlin	36235-flemington-road-franklin-act-2913
126013	Apartment	2025-08-06	$430,000	2025-09-03	$430,000	2	1	1	6.0		Stone Gungahlin	8910-hinder-street-gungahlin-act-2912
126015	House	2025-08-06	Auction	2025-08-16	Undisclosed	4	3	2	4.5	608.0	Altair Property	27-richard-clough-view-taylor-act-2913
126016	Townhouse	2025-08-06	By Negotiation	2025-08-25	Undisclosed	4	3	2	6.0		Altair Property	5-91-ainsworth-street-mawson-act-2607
126018	Townhouse	2025-08-06	$799,950	2025-09-25	Undisclosed	3	1	1	6.0		Independent Property Group South	2-178-clive-steele-avenue-monash-act-2904
126024	House	2025-08-06	Auction	2025-08-23	$1,000,000	4	2	2	4.0	423.0	LJ Hooker Belconnen	66-hilda-kincaid-crescent-macgregor-act-2615
126027	Unit	2025-08-06	$350,000+	2025-09-08	$380,000	2	1	1	5.5		McIntyre Property	196-wilkins-street-mawson-act-2607
126035	Apartment	2025-08-06	$450,000+	2025-09-18	Undisclosed	1	1	1	6.0		LJ Hooker Canberra City	20-28-beechworth-street-watson-act-2602
126036	House	2025-08-06	Auction 30/08/2025	2025-08-30	Undisclosed	4	2	2	4.5	803.0	Ray White Canberra	64-somerset-street-duffy-act-2611
126039	House	2025-08-06	Auction	2025-08-23	$837,000	3	2	2	2.0	436.0	LJ Hooker Belconnen	111-magrath-crescent-spence-act-2615
126040	Townhouse	2025-08-06	By Negotiation	2025-08-27	Undisclosed	4	3	2	7.0		Altair Property	1-melia-place-rivett-act-2611
126041	Apartment	2025-08-06	Offers over $425,000	2025-08-07	Undisclosed	1	1	1	6.0		Altair Property	302-torrens-street-braddon-act-2612
126042	House	2025-08-06	$979,000+	2025-09-22	$987,500	4	2	2	1.0	951.0	Ray White Canberra	19-kater-close-macarthur-act-2904
126043	House	2025-08-06	$820,000 to $870,000	2025-10-17	$850,000	3	1	1		317.0	Ray White Bowral	2-north-street-moss-vale-nsw-2577
126044	House	2025-08-06	$800,000+	2025-08-13	$875,000	3	2	2	3.5	804.0	Ray White Canberra	2-kanooka-street-rivett-act-2611
126047	Apartment	2025-08-06	$680,000+	2025-09-24	$660,000	2	1	1	5.0		Maloney's Property	20-4-tench-kingston-act-2604-126047
126048	Land	2025-08-06	$450,000	2025-08-19	$465,000	0	0	0		40.01	Belle Property Snowy Mountains	475-ironmungie-road-cooma-nsw-2630-126048
126053	House	2025-08-06	$1,100,000 - $1,150,000	2025-10-10	$990,000	4	1	2		626.0	Bella Coastal Property	117-malibu-drive-bawley-point-nsw-2539
126063	House	2025-08-06	$1,189,000+	2025-10-30	Undisclosed	4	3	2	6.0	247.0	Bastion Property Group	26-phippard-court-watson-act-2602
126074	Townhouse	2025-08-06	$600,000	2025-10-24	Undisclosed	2	2	2			Bastion Property Group	227-yass-road-queanbeyan-east-nsw-2620
126081	House	2025-08-06	Auction	2025-08-15	$1,315,000	3	1	2	3.0	633.0	Bastion Property Group	3-vaughan-gardens-narrabundah-act-2604
126084	House	2025-08-06	By Negotiation	2025-11-03	Undisclosed	3	2	3	5.00		Bastion Property Group	69-hurley-street-mawson-act-2607
126098	House	2025-08-06	$480,000 - $510,000	2025-10-08	$475,000	2	1	1		575.0	My Agent Team	12-berrima-parade-surfside-nsw-2536
126099	House	2025-08-06	Auction	2025-08-27	Undisclosed	3	2	2	5.0	237.0	Luton Gungahlin	41-farran-street-gungahlin-act-2912
126106	Townhouse	2025-08-06	$879,000	2025-09-05	Undisclosed	3	2	2			Belle Property Snowy Mountains	317-kirwan-close-jindabyne-nsw-2627
126114	House	2025-08-06	$989,000	2025-10-29	$950,000	5	3	2		706.0	Raine & Horne Goulburn	12a-colvin-place-goulburn-nsw-2580
126117	Townhouse	2025-08-06	$530,000+	2025-09-10	$535,000	2	1	1	5.0	225.0	McIntyre Property	223-maddock-place-gordon-act-2906
126118	Townhouse	2025-08-07	Auction	2025-08-22	Undisclosed	3	2	2	1.0	507.0	Luton Weston Creek, Woden & Molonglo Valley	43-pearson-street-holder-act-2611
126120	House	2025-08-07	Auction	2025-08-30	Undisclosed	3	1	2	1.0	708.0	Luton Weston Creek, Woden & Molonglo Valley	5-fizelle-place-weston-act-2611
126124	House	2025-08-07	Auction	2025-08-28	Undisclosed	3	1	2	1.5	750.0	Luton Manuka	17-alawa-street-waramanga-act-2611
126125	Apartment	2025-08-07	$519,000	2025-08-22	Undisclosed	1	1	1	6.0		Luton Manuka	87-lowrie-street-dickson-act-2602
126127	Unit	2025-08-07	$475,000 +	2025-09-11	$470,000	2	1	1	4.5		LJ Hooker Woden/Weston	184-antis-street-phillip-act-2606
126128	House	2025-08-07	$600,000	2025-08-29	$580,000	3	1	1			John Connell Real Estate	4-woodward-street-goulburn-nsw-2580
126132	Apartment	2025-08-07	$460,000+	2025-09-17	$465,000	2	2	2	6.0		LJ Hooker Woden/Weston	7566-cotter-road-wright-act-2611
126133	Apartment	2025-08-07	$535,000+	2025-09-05	Undisclosed	2	2	2	6.0		LJ Hooker Gungahlin	9142-gribble-street-gungahlin-act-2912
126136	House	2025-08-07	$1,250,000	2025-10-23	Undisclosed	3	1	2		1208.0	Ray White Bowral	19-elizabeth-street-moss-vale-nsw-2577
126144	House	2025-08-07	Auction	2025-08-30	Undisclosed	3	1	1	1.5	718.0	Luton Gungahlin	26-wrixon-street-latham-act-2615
126145	House	2025-08-07	Auction	2025-08-22	Undisclosed	5	2	3	4.0	1275.0	Agent Team	38-eaglemont-retreat-conder-act-2906
126146	House	2025-08-07	Auction	2025-08-21	Undisclosed	3	2	2	5.5		Luton Gungahlin	27-hyslop-crescent-casey-act-2913
126151	Townhouse	2025-08-07	$640,000+	2025-09-04	$661,000	3	1	1	6.0		McIntyre Property	615-chipperfield-circuit-gordon-act-2906
126152	House	2025-08-07	$1,217,000	2025-08-30	$1,217,000	3	1	1	0.5		home.by holly	19-bragg-street-hackett-act-2602
126156	House	2025-08-07	Auction 30/08/2025	2025-08-30	Undisclosed	4	2	2	1.0	1228.0	Ray White Canberra	15-bathurst-place-macquarie-act-2614
126157	Apartment	2025-08-07	$355,000 +	2025-10-23	$355,000	1	1	1	6.0		LJ Hooker Gungahlin	46126-thynne-street-bruce-act-2617
126159	House	2025-08-07	Auction	2025-08-14	Undisclosed	3	2	2		492.0	LJ Hooker Kippax	20-unwin-avenue-jerrabomberra-nsw-2619
126161	Townhouse	2025-08-07	$1,050,000 +	2025-10-30	Undisclosed	4	2	2	2.50		Cream Residential	18146-shackleton-circuit-mawson-act-2607
126163	House	2025-08-07	725,0o00	2025-09-10	$725,000	3	2	1			McGrath Merimbula	11-illawong-heights-merimbula-nsw-2548
126181	House	2025-08-07	SOLD AT AUCTION	2025-08-30	Undisclosed	3	1	1	1.5	732.0	Cream Residential	315-antill-street-watson-act-2602
126188	House	2025-08-07	$1,310,000	2025-08-30	$1,310,000	4	2	2	4.0	813.0	home.by holly	3-manu-place-waramanga-act-2611
126192	House	2025-08-07	$1,095,000 - 1,120,000	2025-10-30	$1,090,000	4	2	2		1010.0	LJ Hooker Woden/Weston	5-helen-street-murrumbateman-nsw-2582
126193	House	2025-08-07	Auction Sat 30 Aug at 2:30pm	2025-08-30	$1,175,000	3	1	1	0.0	774.0	LJ Hooker Gungahlin	34-abeckett-street-watson-act-2602
126201	House	2025-08-07	$795,000	2025-09-09	$785,000	3	2	2	6.0	234.0	LJ Hooker Belconnen	24-salisbury-street-casey-act-2913
126225	Apartment	2025-08-07	Offers over $699,000	2025-09-12	$710,000	2	2	1	6.0		Luton Manuka	263-giles-street-kingston-act-2604
126230	House	2025-08-08	Sold $4,200,000	2025-10-17	$4,200,000	4	3	3	4.0	915.0	Luton Manuka	7-normanby-crescent-deakin-act-2600
126232	Apartment	2025-08-08	$639,000+	2025-08-27	$642,000	2	1	1	4.0		PURNELL	912-howitt-street-kingston-act-2604
126233	House	2025-08-08	$1,430,000	2025-10-17	$1,430,000	6	5	4	3.5		home.by holly	25-manning-clark-crescent-franklin-act-2913
126234	Unit	2025-08-08	$1,100,000	2025-08-25	$1,100,000	3	2	2	6.0		home.by holly	312-hartley-street-turner-act-2612
126242	Townhouse	2025-08-08	$599,000+	2025-09-01	$620,000	2	2	2	6.0		McIntyre Property	3-10-ellison-harvie-close-greenway-act-2900
126245	DuplexSemi-detached	2025-08-08	$799,000	2025-08-26	$790,000	3	2	2		1235.0	Dwyer Properties Sapphire Coast	228a-elizabeth-parade-tura-beach-nsw-2548
126247	Townhouse	2025-08-08	$670,777	2025-08-25	$670,777	3	1	1	4.0		MARQ Property	24-gamban-square-ngunnawal-act-2913
126253	Townhouse	2025-08-08	$449,000	2025-10-07	$445,000	2	2	1		140.0	Macarthur Real Estate Agency	638-kenneally-street-kooringal-nsw-2650
126257	House	2025-08-08	$699,000	2025-09-18	$665,000	3	2	1		1687.0	Ray White Batemans Bay	19-sandpiper-place-catalina-nsw-2536
126266	House	2025-08-08	$1,950,000	2025-08-08	$1,800,000	12	6	6		1135.0	Ray White Batemans Bay	660-beach-road-surf-beach-nsw-2536
126268	House	2025-08-08	$520,000	2025-09-26	$517,000	3	1	2		854.0	Ray White Canberra	10-smith-street-cooma-nsw-2630
126272	House	2025-08-08	$800,000 to $850,000	2025-10-09	Undisclosed	3	1	2		670.3	Ray White Bowral	1-spring-lane-moss-vale-nsw-2577
126273	House	2025-08-08	$869,000	2025-09-15	$840,000	3	2	1		651.0	LJ Hooker Tuross Head	3-anderson-avenue-tuross-head-nsw-2537
126288	House	2025-08-08	Auction	2025-08-27	$1,160,000	4	3	2	0.0	1345.0	LJ Hooker Kaleen	20-pasmore-close-kaleen-act-2617
126289	DuplexSemi-detached	2025-08-08	$599,000	2025-10-13	$590,000	3	2	1		266.0	Ray White Goulburn	3-176-taralga-road-goulburn-nsw-2580
126293	House	2025-08-08	$599,000	2025-09-04	Undisclosed	4	2	3		1005.0	Flemings Property Services	114-william-street-young-nsw-2594
126312	House	2025-08-11	$699,000	2025-09-05	$699,000	5	2	2		763.0	Kitson Property	10-hazelwood-drive-forest-hill-nsw-2651
126317	Unit	2025-08-11	$775,000	2025-10-31	$750,000	3	2	7		843.0	Dwyer Properties Sapphire Coast	222-berrambool-drive-berrambool-nsw-2548
126335	Unit	2025-08-11	$605,000	2025-09-29	$605,000	3	2	3			Blackshaw Real Estate Coastal	6-216-218-beach-road-batehaven-nsw-2536-126335
126336	House	2025-08-11	$650,000 - $680,000	2025-09-03	$655,000	3	2	1		358.7	My Agent Team	41-timber-way-surf-beach-nsw-2536
126345	House	2025-08-11	$621,000	2025-08-22	$600,000	3	1	1		683.0	Smile Elite	43-kalandar-street-nowra-nsw-2541
126347	House	2025-08-11	$730,000	2025-10-15	Undisclosed	4	2	2		872.0	Smile Elite	45-mount-street-yass-nsw-2582
126349	House	2025-08-08	Buyer Guide $180,000 - $190,000	2025-10-09	Undisclosed	2	1	0			One Agency Craig Schofield	177-maybe-street-bombala-nsw-2632
126352	AcreageSemi-rural	2025-08-11	$540,000	2025-08-07	$540,000	0	0	0		20000.0	Belle Property Braidwood	8-aubrey-close-braidwood-nsw-2622
126355	House	2025-08-11	$780,000	2025-10-09	$780,000	4	2	1		556.4	Belle Property Batemans Bay	56-surf-beach-avenue-surf-beach-nsw-2536
126358	House	2025-08-11	Price Guide $850,000 - $865,000	2025-10-17	Undisclosed	4	2	2		525.9	Harcourts Greater Port Macquarie & The Rocks	13-freesia-place-port-macquarie-nsw-2444
126373	House	2025-08-12	$710,000	2025-10-17	Undisclosed	3	1	1		754.0	Sails Real Estate	8-tura-beach-drive-tura-beach-nsw-2548
126374	House	2025-08-12	$1,260,000	2025-09-08	$1,260,000	3	1	2	2.5	728.0	home.by holly	96-officer-place-ainslie-act-2602
126375	House	2025-08-12	Auction 04/09/2025	2025-08-22	$1,050,000	3	1	3	0.0	622.0	Ian McNamee & Partners - Queanbeyan	12-lowe-street-queanbeyan-nsw-2620
126380	House	2025-08-12	$525,000 - $550,000	2025-09-23	$530,000	4	2	0		721.0	Smile Elite	108-wollombi-road-muswellbrook-nsw-2333
126381	House	2025-08-12	$925,000	2025-10-17	Undisclosed	3	1	2		3.16	Ben Bate Real Estate	16-bodalla-park-drive-bodalla-nsw-2545
126384	House	2025-08-12	$810,000	2025-09-02	$799,000	4	2	2		580.0	PRD Wagga Wagga	14-marylands-way-bourkelands-nsw-2650
126391	Apartment	2025-08-12	$500,000+	2025-09-25	Undisclosed	1	1	1	6.0		My Morris	2241-hampton-circuit-yarralumla-act-2600
126395	House	2025-08-12	$590,000	2025-09-04	$611,000	4	1	1		666.0	Kitson Property	11-bass-street-lake-albert-nsw-2650
126410	House	2025-08-12	$530,000	2025-09-02	$520,000	4	2	2		631.0	Smile Elite	40-tindale-street-muswellbrook-nsw-2333
126413	Villa	2025-08-12	New to Market	2025-09-05	$640,000	2	1	1		934.0	Raine & Horne Berry	219-murchison-street-albion-park-nsw-2527
126414	House	2025-08-12	Preview	2025-09-04	$630,000	3	2	2		368.6	Ray White Wagga Wagga	1-68-grinton-avenue-flowerdale-nsw-2650-126414
126415	Apartment	2025-08-12	Preview	2025-09-04	$630,000	3	2	2		336.6	Ray White Wagga Wagga	2-68-grinton-avenue-flowerdale-nsw-2650-126415
126428	House	2025-08-12	AUCTION - ON SITE: 13th September 2025 at 11am	2025-09-13	Undisclosed	4	2	2		497.0	Harcourts Greater Port Macquarie & The Rocks	32-waugh-street-wauchope-nsw-2446
126430	House	2025-08-12	$529,000	2025-09-10	$530,000	3	1	1		637.0	PRD Wagga Wagga	6-clowes-place-ashmont-nsw-2650
126431	House	2025-08-12	$799,000	2025-08-29	$775,000	3	2	4		1839.0	Sails Real Estate	9-clarke-street-wolumla-nsw-2550
126433	House	2025-08-13	Auction	2025-09-06	Undisclosed	3	2	1	3.0	822.0	Luton Weston Creek, Woden & Molonglo Valley	3-perkins-place-torrens-act-2607
126434	House	2025-08-13	Auction	2025-09-06	Undisclosed	4	2	1	1.5	788.0	Luton Weston Creek, Woden & Molonglo Valley	49-holman-street-curtin-act-2605
126435	House	2025-08-13	$641,000	2025-09-10	$641,000	2	2	1	6.0		home.by holly	112-burrumarra-avenue-ngunnawal-act-2913
126440	Unit	2025-08-13	$575,000 +	2025-08-26	Undisclosed	3	2	2	6.0		LJ Hooker Belconnen	2188-hawker-place-hawker-act-2614
126441	House	2025-08-13	$865,000	2025-08-22	$855,000	3	1	1		668.0	LJ Hooker Narooma	25-yabbarra-drive-dalmeny-nsw-2546
126442	House	2025-08-13	Auction	2025-08-30	$970,000	4	2	2	5.0	879.0	LJ Hooker Belconnen	7-hayden-close-florey-act-2615
126443	Townhouse	2025-08-13	Auction 06/09/2025	2025-09-06	$960,000	3	2	2	0.5		Ray White Canberra	32-teague-street-cook-act-2614
126456	House	2025-08-13	$1,890,000	2025-09-06	$1,890,000	4	2	2	3.5		Blackshaw Manuka	82-finniss-crescent-narrabundah-act-2604
126460	House	2025-08-13	Auction	2025-08-23	Undisclosed	6	2	1	0.5	1582.0	Blackshaw Manuka	20-stockdale-street-dickson-act-2602
126462	House	2025-08-13	$2,350,000	2025-09-06	$2,350,000	5	3	4	2.0		Blackshaw Manuka	27-gormanston-crescent-deakin-act-2600
126467	House	2025-08-13	$1,140,000	2025-09-25	$1,140,000	3	2	2	2.0		Blackshaw Manuka	42-appel-crescent-fadden-act-2904
126469	House	2025-08-13	Auction 30/08/2025	2025-08-30	$1,275,000	3	1	2	1.0	699.0	LJ Hooker Manuka	26-bundeela-street-narrabundah-act-2604
126471	Unit	2025-08-13	$649,000+	2025-09-22	$650,000	2	2	2	5.0		LJ Hooker Manuka	2841-hampton-circuit-yarralumla-act-2600
126477	Apartment	2025-08-13	Auction 11/10/2025	2025-10-11	Undisclosed	2	2	2	6.0		LJ Hooker Manuka	65115-canberra-avenue-griffith-act-2603
126479	Apartment	2025-08-13	$1,400,000	2025-10-29	$1,325,500	3	2	2	4.00		LJ Hooker Manuka	1002-edinburgh-avenue-city-act-2601
126482	House	2025-08-13	Auction 24/09/2025	2025-09-17	Undisclosed	3	2	2	3.5	983.0	LJ Hooker Manuka	79-national-circuit-deakin-act-2600
126483	House	2025-08-13	Auction 27/09/2025	2025-09-27	Undisclosed	3	1	2	1.5	772.0	LJ Hooker Manuka	3-brent-place-garran-act-2605
126486	Apartment	2025-08-13	$679,000+	2025-09-08	Undisclosed	2	2	2	6.0		LJ Hooker Manuka	127-39-mcintyre-street-narrabundah-act-2604
126487	House	2025-08-13	$785,000 - $835,000	2025-08-19	$795,000	3	1	2	1.5	724.0	LJ Hooker Manuka	71-osullivan-street-higgins-act-2615
126490	Apartment	2025-08-13	By Negotiation	2025-10-07	Undisclosed	2	2	2	6.0		LJ Hooker Manuka	76-39-mcintyre-street-narrabundah-act-2604
126491	Terrace	2025-08-13	Auction 15/10/2025	2025-10-15	$772,000	4	2	3	6.0		LJ Hooker Manuka	164-toorale-terrace-lawson-act-2617
126493	House	2025-08-13	$1,100,000 - $1,150,000	2025-10-02	$1,110,000	4	2	5		2.93	Ray White Batemans Bay	142-kettle-road-long-beach-nsw-2536
126495	Townhouse	2025-08-13	$680,000+	2025-09-26	Undisclosed	2	1	2	3.5		My Morris	330-darcy-close-gordon-act-2906
126497	House	2025-08-13	$1,300,000	2025-08-26	$1,300,000	4	2	0	2.5	861.0	home.by holly	31-kennerley-street-curtin-act-2605
126504	Apartment	2025-09-23	$359,000	2025-09-25	Undisclosed	2	1	1	0.5	12921.0	Luton Weston Creek, Woden & Molonglo Valley	28179-melrose-drive-lyons-act-2606
126507	House	2025-08-13	$1,150,000	2025-09-08	$1,150,000	3	1	2	1.5		home.by holly	1-randell-street-dickson-act-2602
126518	Apartment	2025-08-13	$609,000+	2025-08-27	Undisclosed	2	2	1	6.0		Ray White Canberra	711-49-furzer-street-phillip-act-2606
126519	Apartment	2025-08-13	Auction 24/08/2025	2025-08-13	$1,300,000	3	2	2	6.0		Ray White Canberra	8522-eyre-street-kingston-act-2604
126520	Land	2025-08-13	$885,000 - $915,000	2025-10-16	Undisclosed	0	0	0		629.89	Ray White Canberra	33-stella-young-way-denman-prospect-act-2611
126521	Lifestyle	2025-08-13	Auction Sat 13 Sept at 2:30pm	2025-09-13	Undisclosed	4	2	1		60.9	LJ Hooker Country Canberra	321-the-forest-road-bywong-nsw-2621-126521
126522	Apartment	2025-08-13	$670,000+	2025-09-04	$673,000	2	2	2	6.0		Ray White Canberra	716-19-challis-street-dickson-act-2602
126523	DuplexSemi-detached	2025-08-13	By Negotiation	2025-09-19	$1,700,000	3	2	2	5.5	503.0	Ray White Canberra	222a-la-perouse-street-red-hill-act-2603
126524	Townhouse	2025-08-13	Sold prior to Auction	2025-08-21	$710,000	3	2	2	6.0		Ray White Canberra	75-44-marie-little-crescent-denman-prospect-act-2611
126525	Apartment	2025-08-13	$555,000	2025-10-03	$550,000	3	2	2	6.0		Ray White Canberra	7413-chandler-street-belconnen-act-2617
126527	Apartment	2025-08-13	$880,000+	2025-09-12	Undisclosed	2	2	2	6.0		Ray White Canberra	8-44-constitution-avenue-parkes-act-2600
126528	House	2025-08-13	Auction 30/08/2025	2025-08-30	Undisclosed	4	2	2	6.0	450.0	Ray White Canberra	48-bandicoot-street-throsby-act-2914
126533	House	2025-08-13	$649,000	2025-09-11	$675,000	3	2	2		456.0	Fitzpatricks	54-barrima-drive-glenfield-park-nsw-2650
126538	House	2025-08-13	$950,000+	2025-10-10	$965,000	4	2	2	4.0	449.0	LJ Hooker Tuggeranong	24-betty-maloney-crescent-banks-act-2906
126539	House	2025-08-13	$739,000+	2025-08-11	$735,000	3	1	1	6.0	250.0	Confidence Real Estate	33-vahland-street-taylor-act-2913
126543	House	2025-08-13	$1,330,000	2025-09-22	Undisclosed	4	2	3	2.5	694.0	Luton Manuka	42-phillip-avenue-downer-act-2602
126547	Apartment	2025-08-13	$339,000	2025-10-09	$327,500	1	1	1	6.0		Luton Manuka	15235-oakden-street-greenway-act-2900
126548	Apartment	2025-08-13	$665,000	2025-10-24	$650,000	2	2	1	6.0		Maloney's Property	308107-canberra-avenue-griffith-act-2603
126552	Unit	2025-08-13	$665,000	2025-09-06	$665,000	3	2	1			Belle Property Batemans Bay	170-cook-avenue-surf-beach-nsw-2536
126553	House	2025-08-13	$795,000	2025-10-10	$780,000	3	2	2		600.0	My Agent Team	19-luks-way-batehaven-nsw-2536
126558	House	2025-08-13	Auction 06/09/2025	2025-09-06	Undisclosed	3	1	2	4.0	680.0	Ray White Canberra	20-chambers-street-latham-act-2615
126561	Land	2025-08-13	$705,000	2025-09-05	$705,000	0	0	4		1002.0	Smile Elite	54-orama-crescent-orient-point-nsw-2540
126562	House	2025-08-13	$1,028,000	2025-08-25	$1,080,000	3	2	1		677.0	Smile Elite	12-chopin-crescent-claremont-meadows-nsw-2747
126564	Townhouse	2025-09-24	$799,000+	2025-09-25	Undisclosed	4	2	4	6.0		Luton Weston Creek, Woden & Molonglo Valley	2633-arthur-blakeley-way-coombs-act-2611
126566	House	2025-08-14	Auction 06/09/2025	2025-08-29	$1,161,000	3	1	1	1.0	733.0	Ray White Canberra	5-noala-street-aranda-act-2614
126567	House	2025-08-14	$1,220,000	2025-10-14	$1,220,000	4	3	2	4.0	418.0	MARQ Property	96-moonlight-avenue-harrison-act-2914
126568	Unit	2025-08-14	Offers above $419,000	2025-09-19	$415,000	1	1	1	6.0		Michael Potter Real Estate	84121-easty-street-phillip-act-2606
126569	Townhouse	2025-08-14	Offers over $749,000	2025-10-13	$770,000	3	1	1	1.5		My Morris	1211-steffanoni-circuit-monash-act-2904
126570	House	2025-08-14	$970,000	2025-08-19	$970,000	4	2	3	4.0	878.0	My Morris	14-ragless-circuit-kambah-act-2902
126571	Unit	2025-08-14	$758,000	2025-08-15	$753,000	3	2	2	6.0		My Morris	132-eldridge-crescent-garran-act-2605
126572	House	2025-08-14	$869,000+	2025-08-08	$890,000	3	1	4	5.0		My Morris	4-eales-place-kambah-act-2902
126573	Apartment	2025-08-14	$585,000+	2025-10-30	$576,000	1	1	1	6.00		PURNELL	3347-wentworth-avenue-kingston-act-2604
126574	Apartment	2025-08-14	$549,000+	2025-09-03	$552,000	1	1	1	6.0		PURNELL	2220-eyre-street-kingston-act-2604
126575	Apartment	2025-08-14	$549,000+	2025-09-19	$555,000	1	1	1	6.0		PURNELL	420-new-south-wales-crescent-forrest-act-2603
126577	House	2025-08-14	$1,690,000 - $1,740,000	2025-08-29	$1,740,000	5	3	3		671.0	Smile Elite	15-magnetic-ridge-shell-cove-nsw-2529
126579	Townhouse	2025-08-14	$779,900	2025-09-11	Undisclosed	2	2	2	6.0		VERV Property	15-50-maymuru-way-whitlam-act-2611
126582	Townhouse	2025-08-14	By Negotiation	2025-08-25	Undisclosed	3	2	2	3.0	856.0	Independent Property Group South	1058-shackleton-circuit-mawson-act-2607
126583	House	2025-08-14	$1,045,000	2025-09-08	$1,045,000	3	1	1	1.0		home.by holly	22-kerferd-street-watson-act-2602
126584	House	2025-08-14	$312,500	2025-10-02	$312,500	3	1	2		731.0	Flemings Property Services	106-thompson-street-cootamundra-nsw-2590
126586	Townhouse	2025-08-14	$595,000 +	2025-09-01	Undisclosed	2	2	2	6.0		VERV Property	2011-starcevich-crescent-jacka-act-2914
126589	House	2025-08-14	$910,000 - $930,000	2025-09-01	Undisclosed	4	2	2		270.0	VERV Property	134-oxalis-crescent-tralee-nsw-2620
126591	House	2025-08-14	$1,045,000 +	2025-09-10	Undisclosed	4	2	4	2.0	959.0	VERV Property	15-rolland-place-flynn-act-2615
126593	Apartment	2025-08-14	$425,000+	2025-09-09	Undisclosed	1	1	1	6.0		VERV Property	928-mort-street-braddon-act-2612
126597	Apartment	2025-08-14	Auction 03/09/2025	2025-09-03	Undisclosed	2	1	1			Ray White Canberra	3106-henderson-road-crestwood-nsw-2620
126598	Apartment	2025-08-14	$445,000 +	2025-08-25	Undisclosed	1	1	1	6.0		VERV Property	20924-girrahween-street-braddon-act-2612
126599	House	2025-08-14	Auction	2025-09-06	Undisclosed	4	2	2	0.0	889.0	Luton Kippax	7-poole-place-latham-act-2615
126600	House	2025-08-14	$785,000	2025-09-19	$787,000	3	2	2	4.0	334.0	VERV Property	3292-casey-crescent-calwell-act-2905
126601	House	2025-08-14	$753,850	2025-08-28	$753,850	3	1	1	6.0	507.0	Suburbia Real Estate	19-marungul-avenue-ngunnawal-act-2913
126604	Apartment	2025-08-14	$425,000	2025-09-15	Undisclosed	2	1	1	0.0		VERV Property	247-medley-street-chifley-act-2606
126605	Apartment	2025-08-14	$900,000	2025-09-12	$900,000	3	2	2	6.0		Suburbia Real Estate	37-2-torrens-street-braddon-act-2612
126606	Unit	2025-08-14	Offers over $790,000	2025-09-12	$880,000	3	2	2	6.0		Suburbia Real Estate	1411-fawkner-street-braddon-act-2612
126608	House	2025-08-14	$785,000	2025-09-15	$775,000	4	2	2		801.0	Professionals Nowra	3-marana-close-nowra-nsw-2541
126609	House	2025-08-14	Auction 06/09/2025	2025-09-03	Undisclosed	3	1	2	1.0	739.0	LJ Hooker Dickson	36-ebden-street-ainslie-act-2602
126610	House	2025-08-14	Auction	2025-08-26	Undisclosed	3	2	2	1.5	795.0	Luton Weston Creek, Woden & Molonglo Valley	46-nelumbo-street-rivett-act-2611
126613	House	2025-08-14	$1,177,000	2025-08-29	$1,177,000	3	1	1	1.5		home.by holly	80-irvine-street-watson-act-2602
126614	House	2025-08-14	Auction	2025-09-06	$873,000	3	2	2	1.5	375.0	LJ Hooker Woden/Weston	14-evergood-close-weston-act-2611
126618	Apartment	2025-08-14	$495,000+	2025-09-22	$505,000	2	2	2	6.0		LJ Hooker Tuggeranong	12120-athllon-drive-greenway-act-2900
126620	House	2025-08-14	$529,000	2025-09-05	$542,000	3	1	1		643.3	Kitson Property	9-eldershaw-drive-forest-hill-nsw-2651
126621	Townhouse	2025-08-14	$650,000	2025-09-15	$650,000	3	1	1	5.5		home.by holly	10636-paul-coe-crescent-ngunnawal-act-2913
126622	Townhouse	2025-08-14	$799,000+	2025-09-24	$795,000	3	1	2	2.0		PURNELL	12-8-teague-street-cook-act-2614-126622
126625	Townhouse	2025-08-14	$720,000+	2025-09-23	$725,000	3	2	2	5.0	488.5	Ray White Queanbeyan | Jerrabomberra	553-derrington-crescent-bonython-act-2905
126627	House	2025-08-14	Sold at Auction - $895,000	2025-09-02	$895,000	3	2	1	0.5	1012.0	Ward Estate Agents	9-river-street-oaks-estate-act-2620
126634	House	2025-08-14	AUCTION 19th September	2025-09-19	Undisclosed	8	4	4		753.5	Ray White Goulburn	25-kavanagh-street-goulburn-nsw-2580
126635	House	2025-08-14	$1,175,000+	2025-08-29	$1,190,000	4	3	2	1.5	841.0	LJ Hooker Tuggeranong	23-sid-barnes-crescent-gordon-act-2906
126640	House	2025-08-14	Offers $730,000+	2025-09-05	Undisclosed	3	2	1	4.5	454.0	McIntyre Property	48-loureiro-street-conder-act-2906
126642	Apartment	2025-08-14	$589,000 +	2025-10-15	$585,000	3	2	2	4.5		LJ Hooker Woden/Weston	9-dover-court-phillip-act-2606
126643	Townhouse	2025-08-14	Auction	2025-09-13	$900,000	3	2	2	3.0	567.0	LJ Hooker Kippax	7-meyrick-place-florey-act-2615
126644	Townhouse	2025-08-14	$610,000+	2025-10-15	$630,000	2	2	2	6.0		LJ Hooker Gungahlin	825-burnum-burnum-close-bonner-act-2914
126647	House	2025-08-14	Auction	2025-09-10	$880,000	4	2	1	1.0	697.0	LJ Hooker Kippax	36-lutwyche-street-higgins-act-2615
126649	House	2025-08-14	$1,750,000	2025-10-29	Undisclosed	6	2	2		2839.0	McGrath Merimbula	133a-merimbula-drive-merimbula-nsw-2548
126650	Apartment	2025-08-14	Price Guide: $530,000+	2025-09-10	$555,000	2	2	1	6.0		LJ Hooker Dickson	364-lowanna-street-braddon-act-2612
126653	Apartment	2025-08-14	$650,000	2025-10-03	Undisclosed	2	1	1	1.0		Luton Manuka	1133-dawes-street-kingston-act-2604
126654	House	2025-08-14	Auction 06/09/2025	2025-09-06	$1,073,000	3	2	1	1.5	818.0	Ray White Canberra	5-willis-street-evatt-act-2617
126658	House	2025-08-14	$817,000	2025-09-09	$817,000	4	3	2		979.9	Kitson Property	5-coocook-place-gobbagombalin-nsw-2650
126664	House	2025-08-14	$1,265,000	2025-09-22	$1,265,000	3	1	1	0.0		home.by holly	13-shortland-crescent-ainslie-act-2602
126666	Townhouse	2025-08-14	$850,000+	2025-10-03	$855,000	3	2	2	5.0	244.0	Ray White Queanbeyan | Jerrabomberra	634-luffman-crescent-gilmore-act-2905
126673	Townhouse	2025-08-14	Auction	2025-09-04	$620,000	3	1	2	2.0		LJ Hooker Kippax	526-chave-street-holt-act-2615
126677	House	2025-08-14	$895,000	2025-11-03	$870,000	3	2	2		991.0	Whale Coast Realty	33-warbler-crescent-north-narooma-nsw-2546-1
126678	Land	2025-08-14	$45,000 - $49,000	2025-08-27	$40,000	0	0	0		1012.0	Smile Elite	60-bogan-street-bogan-gate-nsw-2876
126686	House	2025-08-15	$790,000 - $820,000	2025-10-20	$800,000	4	2	5		741.0	My Agent Team	31-the-ridge-road-malua-bay-nsw-2536-126686
126693	Land	2025-08-15	$340,000	2025-08-29	Undisclosed	0	0	0		2000.0	Burchell Higgins Property Sales	30-32-william-street-candelo-nsw-2550
126694	House	2025-08-15	$349,000	2025-09-15	$340,000	4	1	3		2529.0	Ray White Goulburn	3-bigga-street-bigga-nsw-2583
126697	House	2025-08-15	$3,400,000	2025-08-29	$3,400,000	6	3	2	5.5		Blackshaw Manuka	17-hodgkinson-street-griffith-act-2603
126702	Apartment	2025-08-15	Auction (if not sold prior)	2025-08-22	$762,570	2	1	1	4.0		PURNELL	86-howitt-street-kingston-act-2604
126704	House	2025-08-15	$350,000 - $380,000	2025-08-29	$365,000	2	1	1			PURNELL	66-8-stornaway-road-queanbeyan-nsw-2620
126706	House	2025-08-15	$919,000	2025-09-11	$900,000	4	2	4		40.0	McCann Properties	tyagarah-38-rock-lodge-road-lade-vale-gunning-nsw-2581-126706
126726	Land	2025-08-15	$423,900	2025-08-15	$423,900	0	0	0		1500.0	Macarthur Real Estate Agency	lot-233-coachwood-drive-lake-albert-nsw-2650-126726
126729	Townhouse	2025-08-15	$695,000-$745,000	2025-10-13	Undisclosed	2	2	2			Ray White Canberra	111-doeberl-place-karabar-nsw-2620
126734	AcreageSemi-rural	2025-08-15	$725,000	2025-10-24	$700,000	3	1	3		7513.0	Smile Elite	13-rodgers-road-east-megan-nsw-2453-126734
126747	House	2025-08-16	By Negotiation	2025-08-15	$980,000	4	2	4	7.0	337.0	Impact Properties	2-cobden-street-taylor-act-2913
126750	House	2025-08-18	$359,000	2025-09-10	$350,000	3	1	0		1011.0	McCann Properties	18-gunning-street-dalton-gunning-nsw-2581-126750
126751	House	2025-08-18	Sold By Sam $1,265,000	2025-10-30	$1,265,000	4	2	6	4.00	726.0	MARQ Property	125-knox-street-watson-act-2602
126752	House	2025-08-18	$440,000 - $460,000	2025-09-10	$444,900	3	1	0		619.7	Fitzpatricks	15-tarakan-avenue-ashmont-nsw-2650
126769	House	2025-08-18	$890,000 - $940,000	2025-09-19	$860,000	2	1	2		696.0	My Agent Team	19-sandy-place-long-beach-nsw-2536
126778	House	2025-08-18	$859,000	2025-09-19	$840,000	3	2	2		833.0	My Agent Team	3-banks-place-sunshine-bay-nsw-2536
126788	House	2025-08-18	New to Market	2025-09-02	$945,000	3	2	2		822.3	Raine & Horne Berry	17-arborea-place-bowral-nsw-2576-1
126789	House	2025-08-18	By Negotiation	2025-10-09	$1,000,000	6	3	2		1123.0	LJ Hooker Woden/Weston	10b-demestre-street-yass-nsw-2582
126796	Villa	2025-08-18	Price Guide $660,000-$690,000	2025-10-29	Undisclosed	3	2	2			Harcourts Greater Port Macquarie & The Rocks	6a-chicory-place-yippin-creek-nsw-2446-126796
126798	House	2025-08-18	$335,000	2025-09-16	$335,000	2	1	2		689.0	Flemings Property Services	295-temora-street-cootamundra-nsw-2590
126801	Other	2025-08-18	$580,000	2025-08-13	$642,500	3	1	0		386.0	Ray White Goulburn	123-faithfull-street-goulburn-nsw-2580
126805	House	2025-08-18	CONTACT AGENT	2025-08-18	Undisclosed	2	1	1		990.0	Smile Elite	122-the-lake-circuit-culburra-beach-nsw-2540-126805
126808	House	2025-08-18	$700,000 - $750,000	2025-10-31	$710,000	2	1	1			Ray White Bowral	526-merrigang-street-bowral-nsw-2576
126818	Unit	2025-08-19	$439,000	2025-09-18	$425,000	2	1	1			LJ Hooker Malua Bay	2-10-catlin-avenue-batemans-bay-nsw-2536-126818
126821	House	2025-08-19	$1,550,000	2025-09-26	Undisclosed	4	3	2		1053.0	Dwyer Properties Sapphire Coast	12-the-dress-circle-tura-beach-nsw-2548-126821
126822	House	2025-08-19	$669,000	2025-09-04	$655,000	3	2	6		601.0	Ray White Goulburn	24-robinson-street-goulburn-nsw-2580
126835	House	2025-08-19	$925,000+	2025-10-08	$970,000	3	2	2	4.5	350.0	Ray White Canberra	6-pumpurs-crescent-taylor-act-2913
126836	Unit	2025-08-19	$340,000+	2025-10-07	Undisclosed	1	1	1	6.0		LJ Hooker Kippax	913120-eastern-valley-way-belconnen-act-2617
126837	House	2025-08-19	Contact Agent	2025-08-19	$2,100,000	4	2	2	2.0		Cream Residential	85-strickland-crescent-deakin-act-2600
126841	House	2025-08-19	$480,000	2025-09-10	$475,000	3	1	1		588.1	Kitson Property	114-ashmont-avenue-ashmont-nsw-2650
126845	House	2025-08-19	$917,000	2025-10-30	$885,000	3	2	2		698.0	Smile Elite	58-silvermere-street-culburra-beach-nsw-2540
126847	Other	2025-08-19	$1,150,000	2025-10-08	Undisclosed	3	1	4		3.15	Harcourts Greater Port Macquarie & The Rocks	6-coolamon-road-lake-innes-nsw-2446
126850	Unit	2025-08-19	Contact Agent	2025-08-19	$350,000	2	1	1			Ray White Goulburn	39-allison-street-goulburn-nsw-2580
126853	House	2025-08-19	$880,000	2025-09-17	$880,000	4	2	2		1037.0	Blackshaw Real Estate Coastal	21-kennedy-crescent-denhams-beach-nsw-2536
126861	House	2025-08-19	$1,649,000 - $1,729,000	2025-09-16	$1,610,000	5	3	4		1460.0	Ian McNamee & Partners - Queanbeyan	3-blackwood-place-jerrabomberra-nsw-2619
126864	House	2025-08-19	$849,000	2025-10-24	Undisclosed	3	2	1		911.0	Ben Bate Real Estate	8-canty-street-narooma-nsw-2546
126874	House	2025-08-19	Auction - 6/9/25	2025-09-06	$1,005,000	3	2	1	2.0		Independent  Property Group North	16-dugdale-street-cook-act-2614
126876	House	2025-08-20	Auction	2025-09-13	$945,000	3	1	1	1.0	880.0	Luton Weston Creek, Woden & Molonglo Valley	44-yanda-street-waramanga-act-2611
126881	Townhouse	2025-08-20	Auction	2025-09-13	$750,000	3	3	2	6.0		LJ Hooker Belconnen	815-jumbuck-crescent-lawson-act-2617
126882	House	2025-08-20	$799,000+	2025-09-23	$810,000	3	1	2	1.5	806.0	McIntyre Property	8-annand-place-wanniassa-act-2903
126885	House	2025-08-20	$685,000	2025-10-20	$675,000	3	1	0		664.0	LJ Hooker Malua Bay	20-marina-avenue-surfside-nsw-2536
126890	House	2025-08-20	Auction	2025-08-19	$1,150,000	4	2	2	4.0		Luton Tuggeranong	9-gaylard-place-gordon-act-2906
126900	House	2025-08-20	$660,000	2025-08-29	$660,000	3	2	2		368.0	Blackshaw Real Estate Coastal	33b-thomas-mitchell-crescent-sunshine-bay-nsw-2536
126902	Townhouse	2025-08-20	$629,000+	2025-09-29	Undisclosed	3	1	1	3.0		LJ Hooker Gungahlin	3-everard-street-palmerston-act-2913
126905	BlockOfUnits	2025-08-20	$645,000	2025-09-12	Undisclosed	8	4	4		1012.0	Flemings Property Services	2-cooyal-street-cowra-nsw-2794-4
126906	House	2025-08-20	Price By Negotiation	2025-09-12	$1,300,000	4	3	1		765.0	Raine & Horne Mollymook Milton	62-garside-road-mollymook-beach-nsw-2539
126908	House	2025-08-20	Auction	2025-09-04	$1,133,000	4	2	2	5.0	1171.0	Altair Property	84-ballarat-street-fisher-act-2611
126912	House	2025-08-20	Buyers Guide $595,000 - $640,000	2025-09-05	$620,000	4	1	2		1011.0	Smile Elite	52-nelson-street-raglan-nsw-2795
126914	House	2025-08-20	$1,200,000	2025-10-15	$1,186,000	5	2	2		1000.0	Dwyer Properties Sapphire Coast	98-tura-beach-drive-tura-beach-nsw-2548
126917	House	2025-08-20	$475,000	2025-09-23	Undisclosed	2	1	0		193.0	LJ Hooker Sussex Inlet	30-33-berrara-rd-berrara-nsw-2540-126917
126918	House	2025-08-20	New to Market	2025-09-15	$482,000	3	1	1		658.0	Raine & Horne Berry	9-depot-road-west-nowra-nsw-2541
126922	House	2025-08-20	$1,190,000	2025-09-18	$1,190,000	4	2	2	5.0		home.by holly	35-digby-circuit-crace-act-2911
126924	House	2025-08-20	contact agent	2025-09-15	Undisclosed	5	1	0	2.5		home.by holly	13-sherbrooke-street-ainslie-act-2602
126941	House	2025-08-20	Auction 13/09/2025	2025-09-13	$815,000	3	1	2	1.0	729.0	Ray White Canberra	25-pennefather-street-higgins-act-2615
126942	Townhouse	2025-08-20	Auction 13/09/2025	2025-09-13	$650,000	3	2	1	5.5		Ray White Canberra	514-bargang-crescent-ngunnawal-act-2913
126944	House	2025-08-20	Auction 13/09/2025	2025-09-03	$1,370,000	5	1	2	1.0		Ray White Canberra	105-mackellar-crescent-cook-act-2614
126945	House	2025-08-20	By Negotiation	2025-08-20	$715,000	3	1	5	0.5	730.0	Impact Properties	22-pennefather-street-higgins-act-2615
126946	House	2025-08-20	Auction Onsite	2025-09-13	$965,000	4	2	2	4.0	465.0	MARQ Property	35-stump-jump-crescent-dunlop-act-2615
126947	House	2025-08-20	$2,395,000	2025-09-08	$2,350,000	4	2	2		1777.0	Sails Real Estate	22-hill-street-merimbula-nsw-2548-126947
126948	Townhouse	2025-08-21	Auction	2025-09-12	Undisclosed	3	2	2	2.5	875.0	Luton Weston Creek, Woden & Molonglo Valley	644-shackleton-circuit-mawson-act-2607
126949	House	2025-08-21	Auction	2025-09-13	$1,038,000	3	1	0	1.5	647.0	Luton Manuka	15-wilson-street-curtin-act-2605
126951	House	2025-08-21	AUCTION GUIDE $710,000	2025-09-19	$766,000	4	3	1		560.0	Ray White Goulburn	68-ada-street-goulburn-nsw-2580
126954	House	2025-08-21	Auction 13/09/2025	2025-09-15	Undisclosed	4	2	2	6.0	769.0	LJ Hooker Manuka	125-miller-street-oconnor-act-2602
126958	Apartment	2025-08-21	$449,000+	2025-09-19	Undisclosed	1	1	1	6.0		PURNELL	6072-wentworth-avenue-kingston-act-2604
126959	Apartment	2025-08-21	$440,000+	2025-09-11	$445,000	2	2	1	6.0		McIntyre Property	16435-oakden-street-greenway-act-2900
126960	House	2025-08-21	Auction	2025-09-13	$722,000	3	1	1	6.0	297.0	Luton Kippax	19-rowland-street-macgregor-act-2615
126966	Townhouse	2025-08-21	$645,000	2025-09-19	$645,000	3	1	2	4.5		home.by holly	529-popplewell-place-gordon-act-2906
126971	Apartment	2025-08-21	$525,000	2025-09-17	$525,000	2	2	1	6.0		Suburbia Real Estate	162-manning-clark-crescent-franklin-act-2913
126976	Townhouse	2025-08-21	Auction	2025-09-13	$637,000	3	1	1	2.5		Luton Gungahlin	3193-chewings-street-scullin-act-2614
126979	Townhouse	2025-08-21	$960,000	2025-09-15	$960,000	3	1	2	1.5		home.by holly	76-wybalena-grove-cook-act-2614
126980	Apartment	2025-08-21	$410,000	2025-10-02	$410,000	1	1	1	6.0		Suburbia Real Estate	1828-mort-street-braddon-act-2612
126985	House	2025-08-21	Auction	2025-09-13	$1,760,000	4	3	2	5.0		Luton Gungahlin	4-cooee-rise-lawson-act-2617
126987	House	2025-08-21	Auction	2025-09-12	$788,000	3	1	1	2.5	504.0	LJ Hooker Woden/Weston	11-freda-gibson-circuit-theodore-act-2905
126988	House	2025-08-21	$999,000+	2025-09-23	Undisclosed	4	2	2	0.5	1407.0	Stone Gungahlin	7-brahe-place-melba-act-2615
126992	Townhouse	2025-08-21	$875,000	2025-09-19	Undisclosed	3	2	2	3.5		Luton Manuka	23-grounds-crescent-greenway-act-2900
126996	Apartment	2025-08-21	Sold Prior to Auction	2025-09-08	$628,000	2	1	1	5.5		PURNELL	6847-kennedy-street-kingston-act-2604
126998	Townhouse	2025-08-21	$425,000 +	2025-09-09	$430,000	1	1	1	3.5		Cream Residential	40-otway-street-harrison-act-2914
127014	House	2025-08-21	Auction	2025-09-13	$1,000,000	3	2	1	5.5		Luton Gungahlin	44-bunima-crescent-ngunnawal-act-2913
127018	House	2025-08-21	Another SOLD by Irving Gunawan in 2 Weeks!	2025-09-11	Undisclosed	4	2	2			Smile Elite	19-braunton-street-kellyville-ridge-nsw-2155
127021	Apartment	2025-08-21	Offers over $475,000	2025-10-10	Undisclosed	2	2	2	6.0		LJ Hooker Kippax	116311-flemington-road-franklin-act-2913
127022	House	2025-08-21	By Negotiation	2025-09-05	Undisclosed	3	1	2	3.0		Luton Tuggeranong	1-bews-place-bonython-act-2905
127025	House	2025-08-21	Auction	2025-08-29	$850,000	3	1	2	1.5		Bertram Ellis	4-kallara-close-duffy-act-2611
127030	House	2025-08-21	Auction	2025-09-11	$906,000	4	2	3	1.0	853.0	LJ Hooker Woden/Weston	65-carbeen-street-rivett-act-2611
127036	House	2025-08-21	Auction	2025-09-10	$970,000	5	2	4	2.0	689.0	LJ Hooker Kippax	5-kinalung-place-giralang-act-2617
127039	House	2025-08-21	Auction 10/09/2025	2025-09-10	$926,000	3	2	2	2.0	423.0	Ray White Canberra	61-florence-taylor-street-greenway-act-2900
127046	Apartment	2025-08-22	$475,000	2025-10-31	$475,000	2	2	2	6.00		MARQ Property	57241-flemington-road-franklin-act-2913
127060	Land	2025-08-22	$299,000	2025-10-28	Undisclosed	0	0	0		890.0	McIntyre Property	61-broomfield-crescent-long-beach-nsw-2536
127065	Apartment	2025-08-22	$550,000+	2025-10-02	$596,000	3	2	2	6.0	6354.0	Ray White Canberra	6113-chandler-street-belconnen-act-2617
127067	Unit	2025-08-22	Offers Over $800,000	2025-09-02	Undisclosed	3	3	2	6.0		LJ Hooker Gungahlin	45217-northbourne-avenue-turner-act-2612
127076	House	2025-08-22	Auction	2025-09-10	$1,050,000	3	2	1	0.0	783.0	LJ Hooker Kippax	14-pohlman-street-latham-act-2615
